author,chapter,line,text
Onbekend,[Inhoudstafel],1,HIer beghinnet die
Onbekend,[Inhoudstafel],2,tafel in duutsch uan
Onbekend,[Inhoudstafel],3,cantica canticorum
Onbekend,[Inhoudstafel],4,inden eersten
Onbekend,[Inhoudstafel],5,I Hoe dat god alle
Onbekend,[Inhoudstafel],6,dinc maecte ende lucifer viel
Onbekend,[Inhoudstafel],7,ij Hoe die mensche viel
Onbekend,[Inhoudstafel],8,iij Hoe gods minne anden mensche
Onbekend,[Inhoudstafel],9,bleef ende makede vrede tot marien
Onbekend,[Inhoudstafel],10,iiij Wair om die mensche is verlost
Onbekend,[Inhoudstafel],11,ende niet die duuel
Onbekend,[Inhoudstafel],12,v Hoe die soene toe quam
Onbekend,[Inhoudstafel],13,vi Wair om dit boec is ghescreuen
Onbekend,[Inhoudstafel],14,vij Een ander sprake uan minnen
Onbekend,[Inhoudstafel],15,viij Hoe salemoen dit boec makede
Onbekend,[Inhoudstafel],16,ix Vanden drien vianden der doget
Onbekend,[Inhoudstafel],17,x Hoe dit boec gheheten is
Onbekend,[Inhoudstafel],18,xi Der bruut woirde uander ontfanghenisse
Onbekend,[Inhoudstafel],19,gods
Onbekend,[Inhoudstafel],20,xij Een gheliken inder glosen
Onbekend,[Inhoudstafel],21,xiij Hoe god ander menscheit quam
Onbekend,[Inhoudstafel],22,xiiij Van drierhande personen die hier te
Onbekend,[Inhoudstafel],23,gader spreken uander brulocht
Onbekend,[Inhoudstafel],24,xv Van drien pointen der minnen
Onbekend,[Inhoudstafel],25,xvi Van drien vreden die adam brac
Onbekend,[Inhoudstafel],26,xvij Wie wairdich is gode te cussen
Onbekend,[Inhoudstafel],27,xviij Van drien cussen
Onbekend,[Inhoudstafel],28,xix Een vraghen inder glosen
Onbekend,[Inhoudstafel],29,xx Hoe die bruut ontsculdighet
Onbekend,[Inhoudstafel],30,hare boutheit
Onbekend,[Inhoudstafel],31,xxi Vandes brudegoms borsten
Onbekend,[Inhoudstafel],32,xxij Vanden leden der heiligher
Onbekend,[Inhoudstafel],33,kerstenhede
Onbekend,[Inhoudstafel],34,xxiij Vanden saluen der salicheit
Onbekend,[Inhoudstafel],35,xxiiij Hoe die name ihesus is oly
Onbekend,[Inhoudstafel],36,xxv Wair om die maghede den brudegom
Onbekend,[Inhoudstafel],37,minnen
Onbekend,[Inhoudstafel],38,xxvi Sinte barnaerds woorde
Onbekend,[Inhoudstafel],39,xxvij Hoe die bruut na gode begheert
Onbekend,[Inhoudstafel],40,te climmen
Onbekend,[Inhoudstafel],41,xxviij Van sinte augustiin
Onbekend,[Inhoudstafel],42,xxix Een uraghen ende een antwoorde
Onbekend,[Inhoudstafel],43,xxx Echter uan vier saluen
Onbekend,[Inhoudstafel],44,xxxi Ene clairnisse der glosen
Onbekend,[Inhoudstafel],45,xxxij Hoe die bruut gheleit wart inden
Onbekend,[Inhoudstafel],46,kelren gods
Onbekend,[Inhoudstafel],47,xxxiij Vanden kelren wat si siin
Onbekend,[Inhoudstafel],48,xxxiiii Noch uan drien kelren
Onbekend,[Inhoudstafel],49,xxxv Van drien ghesinden gods
Onbekend,[Inhoudstafel],50,xxxvi Hoe die ouerste alden
Onbekend,[Inhoudstafel],51,last draghen
Onbekend,[Inhoudstafel],52,xxxvij Wair bi die prelaten verduldich
Onbekend,[Inhoudstafel],53,sullen siin
Onbekend,[Inhoudstafel],54,xxxviij Vanden quaden die die kerke
Onbekend,[Inhoudstafel],55,verdrucken
Onbekend,[Inhoudstafel],56,xxxix Hoe goods gracie is moeder
Onbekend,[Inhoudstafel],57,alre creaturen
Onbekend,[Inhoudstafel],58,xl Een ander glose
Onbekend,[Inhoudstafel],59,xli Vanden prelaten
Onbekend,[Inhoudstafel],60,xlij Van enen vraghen
Onbekend,[Inhoudstafel],61,xliij Van gods wiingaerde
Onbekend,[Inhoudstafel],62,xliiij Vanden goeden wijngaerdes hoeder
Onbekend,[Inhoudstafel],63,xlv Hier is ondersceit vandes wijngaerts
Onbekend,[Inhoudstafel],64,hoedere
Onbekend,[Inhoudstafel],65,xlvi Vijf pointen uan ghewairre
Onbekend,[Inhoudstafel],66,minnen
Onbekend,[Inhoudstafel],67,xlvij Hoe die bruut wil weten wair
Onbekend,[Inhoudstafel],68,god rust
Onbekend,[Inhoudstafel],69,xlviij Een ander glose vanden seluen
Onbekend,[Inhoudstafel],70,xlix Hoe die brudegom der bruut
Onbekend,[Inhoudstafel],71,antwoort
Onbekend,[Inhoudstafel],72,L Wat wi behoeuen tot der salicheit
Onbekend,[Inhoudstafel],73,li Hoe die brudegom der bruut troost
Onbekend,[Inhoudstafel],74,lij Vanden gauen des brudegoms
Onbekend,[Inhoudstafel],75,liij Van des duuels waghene
Onbekend,[Inhoudstafel],76,liij Wair bi men die bruut kent
Onbekend,[Inhoudstafel],77,lv Van goeden werken ende bequame
Onbekend,[Inhoudstafel],78,lvi Van der bruut hals ende hair
Onbekend,[Inhoudstafel],79,zierheit
Onbekend,[Inhoudstafel],80,lvij Vanden rechten gheloue
Onbekend,[Inhoudstafel],81,lviii Ene iammerlike claghe
Onbekend,[Inhoudstafel],82,lix Vander bruut verduldichede
Onbekend,[Inhoudstafel],83,lx Drie duechden der bruut
Onbekend,[Inhoudstafel],84,lxi Van tween manieren der
Onbekend,[Inhoudstafel],85,ootmoedicheit
Onbekend,[Inhoudstafel],86,lxij Van rechter ootmoedicheit
Onbekend,[Inhoudstafel],87,lxiij Van verduldicheit
Onbekend,[Inhoudstafel],88,lxiiij Vanden risen des dogen gods
Onbekend,[Inhoudstafel],89,lxv Noch uander passien risekiin ende
Onbekend,[Inhoudstafel],90,vanden seuen tiden
Onbekend,[Inhoudstafel],91,lxvi Hier wart die bruut ghetroest om
Onbekend,[Inhoudstafel],92,dat hair lief bi hair is mit minnen
Onbekend,[Inhoudstafel],93,lxvij Vander duuen dat cristus is
Onbekend,[Inhoudstafel],94,lxviij Een ander gloze
Onbekend,[Inhoudstafel],95,lxix Een ander glose
Onbekend,[Inhoudstafel],96,lxx Hoe die brudegom die bruut prijst
Onbekend,[Inhoudstafel],97,dit lof is der eerster bruut die van
Onbekend,[Inhoudstafel],98,adame is eerst comen ende heet
Onbekend,[Inhoudstafel],99,die eerste kerke
Onbekend,[Inhoudstafel],100,lxxi Vander duuen nature
Onbekend,[Inhoudstafel],101,lxxij Noch twee ogen der bruut
Onbekend,[Inhoudstafel],102,lxxiij Hoe men god hier siet
Onbekend,[Inhoudstafel],103,lxxiiij Echt een vraghen
Onbekend,[Inhoudstafel],104,lxxv Hoe men hier op antwoort
Onbekend,[Inhoudstafel],105,lxxvi Hoe die bruut te vreden is
Onbekend,[Inhoudstafel],106,lxxvij Echt uander bruut bedde
Onbekend,[Inhoudstafel],107,lxxviij Vander minnen huse
Onbekend,[Inhoudstafel],108,lxxix Vanden rechten gods huse
Onbekend,[Inhoudstafel],109,lxxx Een ander glose
Onbekend,[Inhoudstafel],110,lxxxi Van seuen bloemen
Onbekend,[Inhoudstafel],111,lxxxij Hoe die brudegom leert die bruut
Onbekend,[Inhoudstafel],112,ootmoedich te sine
Onbekend,[Inhoudstafel],113,lxxxiij Een ander suete lere van drien
Onbekend,[Inhoudstafel],114,bloemen
Onbekend,[Inhoudstafel],115,lxxxiiij Vander lelien nature
Onbekend,[Inhoudstafel],116,lxxxv Hoe die brudegom die bruut prijst
Onbekend,[Inhoudstafel],117,lxxxvi Lof der bruut des brudegoms
Onbekend,[Inhoudstafel],118,lxxvij Hoe die bruut hair belouet uan
Onbekend,[Inhoudstafel],119,den brudegom
Onbekend,[Inhoudstafel],120,lxxxviij Die glose
Onbekend,[Inhoudstafel],121,lxxxix Een ander glose
Onbekend,[Inhoudstafel],122,xc Van caritaten
Onbekend,[Inhoudstafel],123,xci Watmen minnen sal
Onbekend,[Inhoudstafel],124,xcij Hoe die bruut doget begheert
Onbekend,[Inhoudstafel],125,xciij Hoe gheloue sonder werke niet en is
Onbekend,[Inhoudstafel],126,xciiij Van tween handen gods
Onbekend,[Inhoudstafel],127,xcv Vander bruut rusten
Onbekend,[Inhoudstafel],128,xcvi Van tween campen
Onbekend,[Inhoudstafel],129,xcvij Des rees nature
Onbekend,[Inhoudstafel],130,xcviij Des harten nature
Onbekend,[Inhoudstafel],131,xcix Hoe die bruut den maghen
Onbekend,[Inhoudstafel],132,antwoort
Onbekend,[Inhoudstafel],133,C Van drien berghen
Onbekend,[Inhoudstafel],134,Ci Een merkelic woort uan
Onbekend,[Inhoudstafel],135,gods springhen
Onbekend,[Inhoudstafel],136,Van tween pointen in cristo
Onbekend,[Inhoudstafel],137,Ciij Hoe na ons cristus is in naturen
Onbekend,[Inhoudstafel],138,Ciiii Van vier vianden
Onbekend,[Inhoudstafel],139,Cv Echt uan vier vianden
Onbekend,[Inhoudstafel],140,Cvi Van gods werken
Onbekend,[Inhoudstafel],141,Cvij Van hinder der ghelouen
Onbekend,[Inhoudstafel],142,Cviij Vanden winter
Onbekend,[Inhoudstafel],143,Cix Vanden reghen
Onbekend,[Inhoudstafel],144,Cx Vander bequameliker tijt
Onbekend,[Inhoudstafel],145,Cxi Van vijf pointen der salicheit
Onbekend,[Inhoudstafel],146,Cxij Teerste point
Onbekend,[Inhoudstafel],147,Cxiij Tander point
Onbekend,[Inhoudstafel],148,Cxiiij Terde point
Onbekend,[Inhoudstafel],149,Cxv Hoe cristus onse broeder is
Onbekend,[Inhoudstafel],150,Cxvi Vander blijscap tijt
Onbekend,[Inhoudstafel],151,Cxvij Vander tortelduuen manieren
Onbekend,[Inhoudstafel],152,Cxviij Dat vierde point
Onbekend,[Inhoudstafel],153,Cxix Dat vijfte point der salicheit
Onbekend,[Inhoudstafel],154,Cxx Vier pointen in penitencien
Onbekend,[Inhoudstafel],155,Cxxi Wair salicheit in leghet enter
Onbekend,[Inhoudstafel],156,bruut drie namen
Onbekend,[Inhoudstafel],157,Cxxij Wat die predicair sal siin
Onbekend,[Inhoudstafel],158,Cxxiij Wair die sal wonen
Onbekend,[Inhoudstafel],159,Cxxiiij Vandes wijngaerts hoeder
Onbekend,[Inhoudstafel],160,Cxxv Twee pointen
Onbekend,[Inhoudstafel],161,Cxxvi Hoe die goede predicaers
Onbekend,[Inhoudstafel],162,gode behaghen
Onbekend,[Inhoudstafel],163,Cxxvij Van drien wijngaerden
Onbekend,[Inhoudstafel],164,Cxviij Van gheveinsde kerstene
Onbekend,[Inhoudstafel],165,Cxxix Van ualschen begheuen luden
Onbekend,[Inhoudstafel],166,Cxxx Vanden vossen
Onbekend,[Inhoudstafel],167,Cxxxi Van drien scalken sonden
Onbekend,[Inhoudstafel],168,Cxxxij Van rechter minnen sede
Onbekend,[Inhoudstafel],169,Cxxxiij Drie pointen die die
Onbekend,[Inhoudstafel],170,woorde benemen
Onbekend,[Inhoudstafel],171,Cxxxiiij Drie pointen van rechter minnen
Onbekend,[Inhoudstafel],172,Cxxxv Noch uander lelien
Onbekend,[Inhoudstafel],173,Cxxxvi Welc rechte lelien voir gode sijn
Onbekend,[Inhoudstafel],174,Cxxxvij Hoe die bruut hair lief weder roept
Onbekend,[Inhoudstafel],175,Cxxxviii Hier beghint dat ander boec
Onbekend,[Inhoudstafel],176,Cxxxix Een voirsproke des anders boecs
Onbekend,[Inhoudstafel],177,Cxl Hoe die kerstenheit is ghedeelt
Onbekend,[Inhoudstafel],178,Cxli Vander bruut bedde
Onbekend,[Inhoudstafel],179,Cxlij Hoe wi ter kerstenheit siin comen
Onbekend,[Inhoudstafel],180,Cxliij Hoe men soeken sal ende vinden
Onbekend,[Inhoudstafel],181,Cxliiij Een ghelike
Onbekend,[Inhoudstafel],182,Cxlv Hoe besweert die brudegom
Onbekend,[Inhoudstafel],183,die dochtren
Onbekend,[Inhoudstafel],184,Cxlvi Hoe twee brude in gode
Onbekend,[Inhoudstafel],185,vergadert siin
Onbekend,[Inhoudstafel],186,Cxlvij Wat der eerster bruut uerwondert
Onbekend,[Inhoudstafel],187,Cxlviii Hoe die heidenscap an gode quam
Onbekend,[Inhoudstafel],188,Cxlix Hoe die eerste bruut vraghet
Onbekend,[Inhoudstafel],189,vander ander
Onbekend,[Inhoudstafel],190,CL Van ses pointen der salicheit
Onbekend,[Inhoudstafel],191,Cli Een ander glose
Onbekend,[Inhoudstafel],192,Clij Hoe die bruut mitten brudegom
Onbekend,[Inhoudstafel],193,werscapt
Onbekend,[Inhoudstafel],194,Cliij Noch uanden seluen van salemoens
Onbekend,[Inhoudstafel],195,huse die sierheit
Onbekend,[Inhoudstafel],196,Cliiij Hoe die bruut den brudegom wijst
Onbekend,[Inhoudstafel],197,den dochtren
Onbekend,[Inhoudstafel],198,Clv Noch vanden seluen
Onbekend,[Inhoudstafel],199,Clvi Hoe die brudegom die bruut prijst
Onbekend,[Inhoudstafel],200,Clvij Noch ene glose
Onbekend,[Inhoudstafel],201,Clviii Hoe die brudegom soeket sine
Onbekend,[Inhoudstafel],202,vriende
Onbekend,[Inhoudstafel],203,Clix Hoe hi die bruut prijst in haren
Onbekend,[Inhoudstafel],204,leden
Onbekend,[Inhoudstafel],205,Clx Hoe die brudegom der kerken
Onbekend,[Inhoudstafel],206,voirseit hare viande
Onbekend,[Inhoudstafel],207,Clxi Wat beduut drieweruen comen
Onbekend,[Inhoudstafel],208,Clxij Hoe die brudegom troest die
Onbekend,[Inhoudstafel],209,bruut ten stride
Onbekend,[Inhoudstafel],210,Clxiij Vander bruut leden
Onbekend,[Inhoudstafel],211,Clxiiij Hoe starc die bruut
Onbekend,[Inhoudstafel],212,is te uechten
Onbekend,[Inhoudstafel],213,Clxv Hoe die bruut weder staet der quader
Onbekend,[Inhoudstafel],214,scaren ende uerwint
Onbekend,[Inhoudstafel],215,Clxvi Wat bloemen inder kerken
Onbekend,[Inhoudstafel],216,houe wassen
Onbekend,[Inhoudstafel],217,Clxvij Vander kerstenheit fonteine
Onbekend,[Inhoudstafel],218,Clxviij Vanden blomen des houes
Onbekend,[Inhoudstafel],219,Clxix Vanden bloemen die inder kerken
Onbekend,[Inhoudstafel],220,paradyse wassen
Onbekend,[Inhoudstafel],221,Clxx Van tween bomen sonderlinghe
Onbekend,[Inhoudstafel],222,Clxxi Vander bruut houe ende wat hair let
Onbekend,[Inhoudstafel],223,Clxxij Hoe die bruut nv noet
Onbekend,[Inhoudstafel],224,den brudegom
Onbekend,[Inhoudstafel],225,Clxxiij Hoe die brudegom lieflike der
Onbekend,[Inhoudstafel],226,bruut antwoort
Onbekend,[Inhoudstafel],227,Clxxiiij Hoe die brudegom vint in der
Onbekend,[Inhoudstafel],228,bruut hof al sinen wille
Onbekend,[Inhoudstafel],229,Clxxv Vanden tiden des vreden inder
Onbekend,[Inhoudstafel],230,kerken
Onbekend,[Inhoudstafel],231,Clxxvi Hoe men nv van gode slaept
Onbekend,[Inhoudstafel],232,Clxxvij Hoe die bruut ghairne bleue mit
Onbekend,[Inhoudstafel],233,rusten in gode
Onbekend,[Inhoudstafel],234,Clxxviij Hoe node die bruut hair beslet
Onbekend,[Inhoudstafel],235,mitter werelt
Onbekend,[Inhoudstafel],236,Clxxix Hoe die brudegom die bruut wel
Onbekend,[Inhoudstafel],237,minnentlike dwinghet te prediken
Onbekend,[Inhoudstafel],238,Clxxx Hoe die lerair werden ghetroest
Onbekend,[Inhoudstafel],239,in weder stoot
Onbekend,[Inhoudstafel],240,Clxxxj Hoe die bruut ghehoirsaem is //
Onbekend,[Inhoudstafel],241,[haren lieue
Onbekend,[Inhoudstafel],242,Clxxxij Hoe die bruut hair lief soect
Onbekend,[Inhoudstafel],243,Clxxxiij Hoe die bruut die
Onbekend,[Inhoudstafel],244,dochtren besweert
Onbekend,[Inhoudstafel],245,Clxxiiij Hoe die dochtren uraghen
Onbekend,[Inhoudstafel],246,Clxxxv Hair lief wijst den dochtren
Onbekend,[Inhoudstafel],247,Clxxxvi ?...
Onbekend,[Inhoudstafel],248,Clxxxvij Dit is der bruut antwoorde
Onbekend,[Inhoudstafel],249,den dochtren
Onbekend,[Inhoudstafel],250,Clxxxviij Hoe die minne dicken
Onbekend,[Inhoudstafel],251,die woorde breket
Onbekend,[Inhoudstafel],252,Clxxxix Hoe vier brude vergadert
Onbekend,[Inhoudstafel],253,siin in ene minne gods in
Onbekend,[Inhoudstafel],254,rechter ghelouen
Onbekend,[Inhoudstafel],255,Cxc ?...
Onbekend,[Inhoudstafel],256,Cxci ?...
Onbekend,[Inhoudstafel],257,Cxcij ?...
Onbekend,[Inhoudstafel],258,Cxciij ?...
Onbekend,[Inhoudstafel],259,Cxciiij ?...
Onbekend,[Inhoudstafel],260,Cxcv ?...
Onbekend,[Inhoudstafel],261,Cxcvi ?...
Onbekend,[Inhoudstafel],262,Cxcvij ?...
Onbekend,[Inhoudstafel],263,Cxcviij Die derde graet
Onbekend,[Inhoudstafel],264,Cxcix Der bruut lof
Onbekend,[Inhoudstafel],265,Cc Hoe die dochtren nv die
Onbekend,[Inhoudstafel],266,bruut prisen
Onbekend,[Inhoudstafel],267,Cci ?...
Onbekend,[Inhoudstafel],268,Ccij ?...
Onbekend,[Inhoudstafel],269,Cciij Hier beghint die derde boec
Onbekend,[Inhoudstafel],270,Cciiij Die text uander lettren
Onbekend,[Inhoudstafel],271,Ccv Hoe sinlicheit bedrieghet
Onbekend,[Inhoudstafel],272,Ccvi ?...
Onbekend,[Inhoudstafel],273,CCvij ?...
Onbekend,[Inhoudstafel],274,Ccviij ?...
Onbekend,[Inhoudstafel],275,Ccix ?...
Onbekend,[Inhoudstafel],276,Ccx ?...
Onbekend,[Inhoudstafel],277,Ccxi ?...
Onbekend,[Inhoudstafel],278,Ccxij ?...
Onbekend,[Inhoudstafel],279,Ccxiij ?...
Onbekend,[Inhoudstafel],280,Ccxiiij Hier beghint dat vierde boec
Onbekend,[Inhoudstafel],281,Ccxv Hoe die bruut uut gaet ende
Onbekend,[Inhoudstafel],282,wint die heiden te gode
Onbekend,[Inhoudstafel],283,Ccxvi Hoe die sunamite brenghet
Onbekend,[Inhoudstafel],284,voor den brudegom mandragora
Onbekend,[Inhoudstafel],285,uander heidenscap
Onbekend,[Inhoudstafel],286,Ccxvij ?...
Onbekend,[Inhoudstafel],287,Ccxviij ?...
Onbekend,[Inhoudstafel],288,Ccxix Hoe die bruut den brudegom
Onbekend,[Inhoudstafel],289,hout ende mit hair leet
Onbekend,[Inhoudstafel],290,Ccxx Hoe men te gode climmet
Onbekend,[Inhoudstafel],291,mit minnen
Onbekend,[Inhoudstafel],292,Ccxxi Hoe die bruut rust nader vergaderinghe
Onbekend,[Inhoudstafel],293,hairs lieuen
Onbekend,[Inhoudstafel],294,Ccxxij Hoe der synagogen uerwondert
Onbekend,[Inhoudstafel],295,vander groter hoocheit der
Onbekend,[Inhoudstafel],296,bruut mandragora
Onbekend,[Inhoudstafel],297,Ccxxiij Die brudegom die bruut
Onbekend,[Inhoudstafel],298,wairnt uan ualle
Onbekend,[Inhoudstafel],299,Ccxxiiij Vander minnen starcheit
Onbekend,[Inhoudstafel],300,Ccxxv Den lof der ware minnen
Onbekend,[Inhoudstafel],301,Ccxxvi ?...
Onbekend,[Inhoudstafel],302,Ccxxvij ?...
Onbekend,[Inhoudstafel],303,Ccxxviij ?...
Onbekend,[Inhoudstafel],304,Ccxxix Wat die bruut sal doen
Onbekend,[Inhoudstafel],305,Ccxxx Hoe die bruut antwoort
Onbekend,[Inhoudstafel],306,? ?...]
Onbekend,HIER BEGHINNEN DIE BOEKEN DIE  GHEHETEN  SIIN CANTICA CANTICORUM,307,GOd here almachtich wijs ende goet
Onbekend,HIER BEGHINNEN DIE BOEKEN DIE  GHEHETEN  SIIN CANTICA CANTICORUM,308,Alles goedes vtevloeiende uloet
Onbekend,HIER BEGHINNEN DIE BOEKEN DIE  GHEHETEN  SIIN CANTICA CANTICORUM,309,Want alre dinc bistu beghin
Onbekend,HIER BEGHINNEN DIE BOEKEN DIE  GHEHETEN  SIIN CANTICA CANTICORUM,310,Mer beghin ginc di nye in
Onbekend,HIER BEGHINNEN DIE BOEKEN DIE  GHEHETEN  SIIN CANTICA CANTICORUM,5,Du waers ye dattu nv bist
Onbekend,HIER BEGHINNEN DIE BOEKEN DIE  GHEHETEN  SIIN CANTICA CANTICORUM,312,Al ende heuet di ooc ghemist
Onbekend,HIER BEGHINNEN DIE BOEKEN DIE  GHEHETEN  SIIN CANTICA CANTICORUM,313,Nochtan bistu sonder miswende
Onbekend,HIER BEGHINNEN DIE BOEKEN DIE  GHEHETEN  SIIN CANTICA CANTICORUM,314,Alre dinc beghin ende ende
Onbekend,HIER BEGHINNEN DIE BOEKEN DIE  GHEHETEN  SIIN CANTICA CANTICORUM,315,Want in diinre godliker cracht
Onbekend,HIER BEGHINNEN DIE BOEKEN DIE  GHEHETEN  SIIN CANTICA CANTICORUM,10,Heuestu alle dinc ghewracht
Onbekend,HIER BEGHINNEN DIE BOEKEN DIE  GHEHETEN  SIIN CANTICA CANTICORUM,317,In wijsheit voeghestu alle dinc
Onbekend,HIER BEGHINNEN DIE BOEKEN DIE  GHEHETEN  SIIN CANTICA CANTICORUM,318,Wat ye wesen ane vinc
Onbekend,HIER BEGHINNEN DIE BOEKEN DIE  GHEHETEN  SIIN CANTICA CANTICORUM,319,B[i] waire dueghet behoutstuut al
Onbekend,HIER BEGHINNEN DIE BOEKEN DIE  GHEHETEN  SIIN CANTICA CANTICORUM,320,Dat durende is groot ende smal
Onbekend,HIER BEGHINNEN DIE BOEKEN DIE  GHEHETEN  SIIN CANTICA CANTICORUM,15,Wattu in di seluen bist
Onbekend,HIER BEGHINNEN DIE BOEKEN DIE  GHEHETEN  SIIN CANTICA CANTICORUM,322,Can gheenre creaturen list
Onbekend,HIER BEGHINNEN DIE BOEKEN DIE  GHEHETEN  SIIN CANTICA CANTICORUM,323,E ... wanttu onbegripelike
Onbekend,HIER BEGHINNEN DIE BOEKEN DIE  GHEHETEN  SIIN CANTICA CANTICORUM,324,Bist in alre grootheit rike
Onbekend,HIER BEGHINNEN DIE BOEKEN DIE  GHEHETEN  SIIN CANTICA CANTICORUM,325,In di moghen wi allene kinnen
Onbekend,HIER BEGHINNEN DIE BOEKEN DIE  GHEHETEN  SIIN CANTICA CANTICORUM,20,Wattu bist tot ons in minnen
Onbekend,HIER BEGHINNEN DIE BOEKEN DIE  GHEHETEN  SIIN CANTICA CANTICORUM,327,Mer rechte gheloue can ons leren
Onbekend,HIER BEGHINNEN DIE BOEKEN DIE  GHEHETEN  SIIN CANTICA CANTICORUM,328,Hoe wi sullen onse sinne keren
Onbekend,HIER BEGHINNEN DIE BOEKEN DIE  GHEHETEN  SIIN CANTICA CANTICORUM,329,Te di. dat wi moghen verstaen
Onbekend,HIER BEGHINNEN DIE BOEKEN DIE  GHEHETEN  SIIN CANTICA CANTICORUM,330,Dat wi in dine kennisse gaen
Onbekend,HIER BEGHINNEN DIE BOEKEN DIE  GHEHETEN  SIIN CANTICA CANTICORUM,25,So veer alst moghelijc mach wesen
Onbekend,HIER BEGHINNEN DIE BOEKEN DIE  GHEHETEN  SIIN CANTICA CANTICORUM,332,Dair wi ter sielen bi ghenesen
Onbekend,HIER BEGHINNEN DIE BOEKEN DIE  GHEHETEN  SIIN CANTICA CANTICORUM,333,Enen god ghelouen wi
Onbekend,HIER BEGHINNEN DIE BOEKEN DIE  GHEHETEN  SIIN CANTICA CANTICORUM,334,Van beghinne clairlijc vri
Onbekend,HIER BEGHINNEN DIE BOEKEN DIE  GHEHETEN  SIIN CANTICA CANTICORUM,335,Die emmer sonder einde sal duren
Onbekend,HIER BEGHINNEN DIE BOEKEN DIE  GHEHETEN  SIIN CANTICA CANTICORUM,30,Scepper alre creaturen
Onbekend,HIER BEGHINNEN DIE BOEKEN DIE  GHEHETEN  SIIN CANTICA CANTICORUM,337,Een god ... s sonder verdriet
Onbekend,HIER BEGHINNEN DIE BOEKEN DIE  GHEHETEN  SIIN CANTICA CANTICORUM,338,Dair an ghebrec mach comen niet
Onbekend,HIER BEGHINNEN DIE BOEKEN DIE  GHEHETEN  SIIN CANTICA CANTICORUM,339,Want ... bair
Onbekend,HIER BEGHINNEN DIE BOEKEN DIE  GHEHETEN  SIIN CANTICA CANTICORUM,340,Ende onuerg[an]ghelijc ouer wair
Onbekend,HIER BEGHINNEN DIE BOEKEN DIE  GHEHETEN  SIIN CANTICA CANTICORUM,35,God is bi namen ondersceden
Onbekend,HIER BEGHINNEN DIE BOEKEN DIE  GHEHETEN  SIIN CANTICA CANTICORUM,342,In drien personen mit groter reden
Onbekend,HIER BEGHINNEN DIE BOEKEN DIE  GHEHETEN  SIIN CANTICA CANTICORUM,343,Vader soen ende heilighe gheest
Onbekend,HIER BEGHINNEN DIE BOEKEN DIE  GHEHETEN  SIIN CANTICA CANTICORUM,344,Gheloue leert ons alre meest
Onbekend,HIER BEGHINNEN DIE BOEKEN DIE  GHEHETEN  SIIN CANTICA CANTICORUM,345,Dat dese heilighe namen drie
Onbekend,HIER BEGHINNEN DIE BOEKEN DIE  GHEHETEN  SIIN CANTICA CANTICORUM,40,God wairlijc siin ende waren ye
Onbekend,HIER BEGHINNEN DIE BOEKEN DIE  GHEHETEN  SIIN CANTICA CANTICORUM,347,Hier bi ghelouen wi dat god is
Onbekend,HIER BEGHINNEN DIE BOEKEN DIE  GHEHETEN  SIIN CANTICA CANTICORUM,348,Ende kennent seker ende ghewis
Onbekend,HIER BEGHINNEN DIE BOEKEN DIE  GHEHETEN  SIIN CANTICA CANTICORUM,349,Mer dat hi in hem seluen siet
Onbekend,HIER BEGHINNEN DIE BOEKEN DIE  GHEHETEN  SIIN CANTICA CANTICORUM,350,Mach creature gheweten niet
Onbekend,HIER BEGHINNEN DIE BOEKEN DIE  GHEHETEN  SIIN CANTICA CANTICORUM,45,Sonder die godlike menscheit
Onbekend,HIER BEGHINNEN DIE BOEKEN DIE  GHEHETEN  SIIN CANTICA CANTICORUM,352,Die kerst allene is bereit
Onbekend,HIER BEGHINNEN DIE BOEKEN DIE  GHEHETEN  SIIN CANTICA CANTICORUM,353,Mer wi sullen biden raden
Onbekend,HIER BEGHINNEN DIE BOEKEN DIE  GHEHETEN  SIIN CANTICA CANTICORUM,354,Sinte pouwels gaen mit staden
Onbekend,HIER BEGHINNEN DIE BOEKEN DIE  GHEHETEN  SIIN CANTICA CANTICORUM,355,In dien dinghen die wi sien
Onbekend,HIER BEGHINNEN DIE BOEKEN DIE  GHEHETEN  SIIN CANTICA CANTICORUM,50,Ende dair vte sine kennisse tien
Onbekend,HIER BEGHINNEN DIE BOEKEN DIE  GHEHETEN  SIIN CANTICA CANTICORUM,357,Bi sterchede. bi grootheit. bi figuren
Onbekend,HIER BEGHINNEN DIE BOEKEN DIE  GHEHETEN  SIIN CANTICA CANTICORUM,358,Die wi sien in creaturen
Onbekend,HIER BEGHINNEN DIE BOEKEN DIE  GHEHETEN  SIIN CANTICA CANTICORUM,359,So merken wi ende proeuen wale
Onbekend,HIER BEGHINNEN DIE BOEKEN DIE  GHEHETEN  SIIN CANTICA CANTICORUM,360,Dat een scepper altemale
Onbekend,HIER BEGHINNEN DIE BOEKEN DIE  GHEHETEN  SIIN CANTICA CANTICORUM,55,Bouen al in eren staet
Onbekend,HIER BEGHINNEN DIE BOEKEN DIE  GHEHETEN  SIIN CANTICA CANTICORUM,362,Want alle werc in prise gaet
Onbekend,HIER BEGHINNEN DIE BOEKEN DIE  GHEHETEN  SIIN CANTICA CANTICORUM,363,Siins werkers. ende uoir alle makinghe
Onbekend,HIER BEGHINNEN DIE BOEKEN DIE  GHEHETEN  SIIN CANTICA CANTICORUM,364,Looft men den maker sonderlinghe
Onbekend,HIER BEGHINNEN DIE BOEKEN DIE  GHEHETEN  SIIN CANTICA CANTICORUM,365,Die mensche die bi des appels vorme
Onbekend,HIER BEGHINNEN DIE BOEKEN DIE  GHEHETEN  SIIN CANTICA CANTICORUM,60,Ende uerradenisse des worme
Onbekend,HIER BEGHINNEN DIE BOEKEN DIE  GHEHETEN  SIIN CANTICA CANTICORUM,367,Van siins sceppers kennisse ginc
Onbekend,HIER BEGHINNEN DIE BOEKEN DIE  GHEHETEN  SIIN CANTICA CANTICORUM,368,Die most bi redenliker dinc
Onbekend,HIER BEGHINNEN DIE BOEKEN DIE  GHEHETEN  SIIN CANTICA CANTICORUM,369,Weder nemen sinen keer
Onbekend,HIER BEGHINNEN DIE BOEKEN DIE  GHEHETEN  SIIN CANTICA CANTICORUM,370,Ende weder gaen tot onsen heer
Onbekend,HIER BEGHINNEN DIE BOEKEN DIE  GHEHETEN  SIIN CANTICA CANTICORUM,65,In bekennisse siinre werke
Onbekend,HIER BEGHINNEN DIE BOEKEN DIE  GHEHETEN  SIIN CANTICA CANTICORUM,372,Ende pinen hem mit alre merke
Onbekend,HIER BEGHINNEN DIE BOEKEN DIE  GHEHETEN  SIIN CANTICA CANTICORUM,373,Wederstaen den fellen worm
Onbekend,HIER BEGHINNEN DIE BOEKEN DIE  GHEHETEN  SIIN CANTICA CANTICORUM,374,Die hem bedroech in slanghen vorm
Onbekend,HIER BEGHINNEN DIE BOEKEN DIE  GHEHETEN  SIIN CANTICA CANTICORUM,375,Ende climmen dus in gode weder
Onbekend,HIER BEGHINNEN DIE BOEKEN DIE  GHEHETEN  SIIN CANTICA CANTICORUM,70,Die langhe hadde ghelegen neder
Onbekend,HIER BEGHINNEN DIE BOEKEN DIE  GHEHETEN  SIIN CANTICA CANTICORUM,377,Dus comen wi inder kennissen gods
Onbekend,HIER BEGHINNEN DIE BOEKEN DIE  GHEHETEN  SIIN CANTICA CANTICORUM,378,Ende inder minnen siins ghebods
Onbekend,HIER BEGHINNEN DIE BOEKEN DIE  GHEHETEN  SIIN CANTICA CANTICORUM,379,¶ In drien pointen die men vint
Onbekend,HIER BEGHINNEN DIE BOEKEN DIE  GHEHETEN  SIIN CANTICA CANTICORUM,380,In creaturen doen ons bekint
Onbekend,HIER BEGHINNEN DIE BOEKEN DIE  GHEHETEN  SIIN CANTICA CANTICORUM,75,Dat in hem seluen god moet siin
Onbekend,HIER BEGHINNEN DIE BOEKEN DIE  GHEHETEN  SIIN CANTICA CANTICORUM,382,Macht. wijsheit. ende goetheit fijn
Onbekend,HIER BEGHINNEN DIE BOEKEN DIE  GHEHETEN  SIIN CANTICA CANTICORUM,383,¶ Ten eersten dat hi wesen heuet
Onbekend,HIER BEGHINNEN DIE BOEKEN DIE  GHEHETEN  SIIN CANTICA CANTICORUM,384,Ghegheuen alle dinghe die leuet
Onbekend,HIER BEGHINNEN DIE BOEKEN DIE  GHEHETEN  SIIN CANTICA CANTICORUM,385,Ende niet en leuet ende nochtan is
Onbekend,HIER BEGHINNEN DIE BOEKEN DIE  GHEHETEN  SIIN CANTICA CANTICORUM,80,Dit wiset sine moghentheit gewis
Onbekend,HIER BEGHINNEN DIE BOEKEN DIE  GHEHETEN  SIIN CANTICA CANTICORUM,387,¶ Dat ander is der creaturen
Onbekend,HIER BEGHINNEN DIE BOEKEN DIE  GHEHETEN  SIIN CANTICA CANTICORUM,388,Ordinancie ende figuren
Onbekend,HIER BEGHINNEN DIE BOEKEN DIE  GHEHETEN  SIIN CANTICA CANTICORUM,389,Dair bi bekennen wi sine wijsheit
Onbekend,HIER BEGHINNEN DIE BOEKEN DIE  GHEHETEN  SIIN CANTICA CANTICORUM,390,Die an allen dinghen leit
Onbekend,HIER BEGHINNEN DIE BOEKEN DIE  GHEHETEN  SIIN CANTICA CANTICORUM,85,Sine goetheit wi verstaen
Onbekend,HIER BEGHINNEN DIE BOEKEN DIE  GHEHETEN  SIIN CANTICA CANTICORUM,392,Want wi alle dinc sien gaen
Onbekend,HIER BEGHINNEN DIE BOEKEN DIE  GHEHETEN  SIIN CANTICA CANTICORUM,393,Ende duren als hijt heuet gestelt
Onbekend,HIER BEGHINNEN DIE BOEKEN DIE  GHEHETEN  SIIN CANTICA CANTICORUM,394,Want sonder hem wart al gheuelt
