author,chapter,line,text
Onbekend,Onbekend Hoofdstuk,1,Dat ter werelt goet dochte
Onbekend,Onbekend Hoofdstuk,2,Mach lichte het sal haer comen ten oren
Onbekend,Onbekend Hoofdstuk,3,Haddi vromich gheweest te voren
Onbekend,Onbekend Hoofdstuk,4,Nu hantteerde hi dor haer ere
Onbekend,Onbekend Hoofdstuk,5,Vromichede veel te mere
Onbekend,Onbekend Hoofdstuk,6,Hi wart milde hovesch ende wijs
Onbekend,Onbekend Hoofdstuk,7,Ende verdiende so groten prijs
Onbekend,Onbekend Hoofdstuk,8,Jeghen alle dies werdich waren
Onbekend,Onbekend Hoofdstuk,9,Sodat men sijns in groter maren
Onbekend,Onbekend Hoofdstuk,10,Dicken te menigher steden gewoech
Onbekend,Onbekend Hoofdstuk,11,Mer altoes doghede hi onghevoech
Onbekend,Onbekend Hoofdstuk,12,Stille int herte ende zware verdrach
Onbekend,Onbekend Hoofdstuk,13,Dat hi die scone so selden sach
Onbekend,Onbekend Hoofdstuk,14,Tehant vant hi in sinen sinne
Onbekend,Onbekend Hoofdstuk,15,Bi venus rade der godinne
Onbekend,Onbekend Hoofdstuk,16,Wanti wient zwaerlike van minnen staet
Onbekend,Onbekend Hoofdstuk,17,Hi vint bi wilen nauweren raet
Onbekend,Onbekend Hoofdstuk,18,Dan hi emmer meer ghevonde
Onbekend,Onbekend Hoofdstuk,19,En dade bedwanc der minnen wonde
Onbekend,Onbekend Hoofdstuk,20,Hi nam enen sire zuster zoen
Onbekend,Onbekend Hoofdstuk,21,Een arm ridder was diegoen
Onbekend,Onbekend Hoofdstuk,22,Ende seide neve ic wil u goeden
Onbekend,Onbekend Hoofdstuk,23,Ic heb een borch seldi behoeden
Onbekend,Onbekend Hoofdstuk,24,Int lant van faeljuwele staende
Onbekend,Onbekend Hoofdstuk,25,Ende hi sprac oem doen hijs vermaende
Onbekend,Onbekend Hoofdstuk,26,God moet u lonen derre eren
Onbekend,Onbekend Hoofdstuk,27,Want ic mi altoes gherne sal keren
Onbekend,Onbekend Hoofdstuk,28,Tot uwen dienst sowaer ic mach
Onbekend,Onbekend Hoofdstuk,29,Ende ic heb oec menigen dach
Onbekend,Onbekend Hoofdstuk,30,Ghehoept dat ghi mi soudt versien
Onbekend,Onbekend Hoofdstuk,31,God danc dat nu sal ghescien
Onbekend,Onbekend Hoofdstuk,32,Die here sprac doen openbaer
Onbekend,Onbekend Hoofdstuk,33,Neve ic wil dat ghi vaert daer
Onbekend,Onbekend Hoofdstuk,34,Ende sijt vromich ende faeljant
Onbekend,Onbekend Hoofdstuk,35,Ic verleen u hier al tlant
Onbekend,Onbekend Hoofdstuk,36,Stede borch bosch ende pleyn
Onbekend,Onbekend Hoofdstuk,37,Ende sijt voert maer mijn casteleyn
Onbekend,Onbekend Hoofdstuk,38,Doen riepen si alle diere stonden bi
Onbekend,Onbekend Hoofdstuk,39,Oy ha baetchelaer van coetchi
Onbekend,Onbekend Hoofdstuk,40,Borchgrave van coetchi here
Onbekend,Onbekend Hoofdstuk,41,God ghestarke u vorwart mere
Onbekend,Onbekend Hoofdstuk,42,Dit ghecri ginc den jongen man
Onbekend,Onbekend Hoofdstuk,43,Vrolijc int herte ende began
Onbekend,Onbekend Hoofdstuk,44,Volghen der eren na dien dach
Onbekend,Onbekend Hoofdstuk,45,Dat hi verrees daer men toe sach
Onbekend,Onbekend Hoofdstuk,46,Hi voer int lant van faeljuwele
Onbekend,Onbekend Hoofdstuk,47,Ende vercierde so dien castele
Onbekend,Onbekend Hoofdstuk,48,Met al datter toebehoerde
Onbekend,Onbekend Hoofdstuk,49,Dat hi sijns vader viande stoerde
Onbekend,Onbekend Hoofdstuk,50,Die hem dicke dar te voren
Onbekend,Onbekend Hoofdstuk,51,Scade hadden ghedaen ende toren
Onbekend,Onbekend Hoofdstuk,52,Dit behaechde harde wel den oem
Onbekend,Onbekend Hoofdstuk,53,Dat hi dus nam der eren goem
Onbekend,Onbekend Hoofdstuk,54,Ende peynsde du moghes met eren
Onbekend,Onbekend Hoofdstuk,55,In dat lant varen ende keren
Onbekend,Onbekend Hoofdstuk,56,Ende sijn die scone dagheraet
Onbekend,Onbekend Hoofdstuk,57,Daer al dijn welvart aen staet
Onbekend,Onbekend Hoofdstuk,58,Hi tijdde derwert ende vant
Onbekend,Onbekend Hoofdstuk,59,Den neve machtich ende faeljant
Onbekend,Onbekend Hoofdstuk,60,Van live van herten ende van goede
Onbekend,Onbekend Hoofdstuk,61,Noch vint men se als ic bevroede
Onbekend,Onbekend Hoofdstuk,62,Dat hem selc moet laten genoegen
Onbekend,Onbekend Hoofdstuk,63,Die hem sere wel souden connen voegen
Onbekend,Onbekend Hoofdstuk,64,In eren groet met coste fier
Onbekend,Onbekend Hoofdstuk,65,Ja wilde iement blasen tfier
Onbekend,Onbekend Hoofdstuk,66,Daer waer speels vele aen belanc
Onbekend,Onbekend Hoofdstuk,67,Nochtan wiste hem dese here danc
Onbekend,Onbekend Hoofdstuk,68,Dat hi hem so gelaten dorste
Onbekend,Onbekend Hoofdstuk,69,Hi seide neve hier woent een vorste
Onbekend,Onbekend Hoofdstuk,70,Die ons wel gan in minen besten
Onbekend,Onbekend Hoofdstuk,71,Willen wi varen tot sire vesten
Onbekend,Onbekend Hoofdstuk,72,Hi sal ons hopic gherne sien
Onbekend,Onbekend Hoofdstuk,73,Ja wi here ende mettien
Onbekend,Onbekend Hoofdstuk,74,Sijn si vrolijc opgheseten
Onbekend,Onbekend Hoofdstuk,75,Ende quamen daer recht vor den eten
Onbekend,Onbekend Hoofdstuk,76,Ten here die se ontfinc vrolike
Onbekend,Onbekend Hoofdstuk,77,Ende die vrouwe in vrouden [ghelike]
Onbekend,Onbekend Hoofdstuk,78,Dat se die here [thuis] dus sochte
Onbekend,Onbekend Hoofdstuk,79,Die lultel peinsde om sijn ghedochte
Onbekend,Onbekend Hoofdstuk,80,Ende ginghen dwaen ende darnae eten
Onbekend,Onbekend Hoofdstuk,81,Ende die vrouwe dede vergeten
Onbekend,Onbekend Hoofdstuk,82,Hem alle droefheit die daer waren
Onbekend,Onbekend Hoofdstuk,83,So vrolijc conste si haer gebaren
Onbekend,Onbekend Hoofdstuk,84,Si boet haren dienst den here
Onbekend,Onbekend Hoofdstuk,85,Van coetchi dies begheerde zere
Onbekend,Onbekend Hoofdstuk,86,Anders dan hijt int herte meende
Onbekend,Onbekend Hoofdstuk,87,Ende den borchgreve dien hi verleende
Onbekend,Onbekend Hoofdstuk,88,Dor haer dat goet al en wistijs niet
Onbekend,Onbekend Hoofdstuk,89,Hi h[ee]ft oec harde nauwe [bespiet]
Onbekend,Onbekend Hoofdstuk,90,Der scoenre vrowen figure
Onbekend,Onbekend Hoofdstuk,91,Ende peinsde dese creature
Onbekend,Onbekend Hoofdstuk,92,[En] heeft seker gheen gelike
Onbekend,Onbekend Hoofdstuk,93,Van scoenheiden in al ertrike
Onbekend,Onbekend Hoofdstuk,94,Wat mochtijs dan dat hi so dochte
Onbekend,Onbekend Hoofdstuk,95,Want en was nieman die se mochte
Onbekend,Onbekend Hoofdstuk,96,Wel te punte aen scouwen
Onbekend,Onbekend Hoofdstuk,97,Hi ne vergater bi sijne rouwen
Onbekend,Onbekend Hoofdstuk,98,Wat holpt dat ic vele dichte
Onbekend,Onbekend Hoofdstuk,99,Van hare doghet die ic niet lichte
Onbekend,Onbekend Hoofdstuk,100,Ter waerheit en can bescriven
Onbekend,Onbekend Hoofdstuk,101,Scoene bloem van aertschen wiven
Onbekend,Onbekend Hoofdstuk,102,In suverheiden van aensci[ne]
Onbekend,Onbekend Hoofdstuk,103,In dogheden ende in milde [te sine]
Onbekend,Onbekend Hoofdstuk,104,In rechter trouwen in oe[tmoet]
Onbekend,Onbekend Hoofdstuk,105,Ende in gelaet sowel behoet
Onbekend,Onbekend Hoofdstuk,106,Dat ghene dinc haer mi[ss]at
Onbekend,Onbekend Hoofdstuk,107,Die nature en mocht se niet bat
Onbekend,Onbekend Hoofdstuk,108,Volmaect hebben in minen waen
Onbekend,Onbekend Hoofdstuk,109,So gratiose was haer gedaen
Onbekend,Onbekend Hoofdstuk,110,Doe waest also gevoege ten eten
Onbekend,Onbekend Hoofdstuk,111,Dat si so na waren geseten
Onbekend,Onbekend Hoofdstuk,112,Die here van coetchi entie vrouwe
Onbekend,Onbekend Hoofdstuk,113,Dat hi haer bat op rechte trouwen
Onbekend,Onbekend Hoofdstuk,114,Dat si hem goetlijc onderspraken
Onbekend,Onbekend Hoofdstuk,115,D[li]ef in hemeliken saken
Onbekend,Onbekend Hoofdstuk,116,Ende alse die vrouwe dat verhoerde
Onbekend,Onbekend Hoofdstuk,117,Gaf si ghetogheliken antwoerde
Onbekend,Onbekend Hoofdstuk,118,Uwen willen here sprect ende ghebiet
Onbekend,Onbekend Hoofdstuk,119,Te mi wert ende let u yet
Onbekend,Onbekend Hoofdstuk,120,Aen minen here ocht aen die mine
Onbekend,Onbekend Hoofdstuk,121,Ic betert mag ic sprac die fine
Onbekend,Onbekend Hoofdstuk,122,Die here sprac vrowe weert also
Onbekend,Onbekend Hoofdstuk,123,Laet here maect u anders vro
Onbekend,Onbekend Hoofdstuk,124,Dus spraken voert ende weder
Onbekend,Onbekend Hoofdstuk,125,Hi began ende leide dan neder
Onbekend,Onbekend Hoofdstuk,126,Doer noet die hi int herte droech
Onbekend,Onbekend Hoofdstuk,127,Int leste hi solanghe gewoech
Onbekend,Onbekend Hoofdstuk,128,Bedectelike so hi beste mochte
Onbekend,Onbekend Hoofdstuk,129,Dattie vrouwe sijn gedochte
Onbekend,Onbekend Hoofdstuk,130,Ter waerheit wel onderwant
Onbekend,Onbekend Hoofdstuk,131,Datten die bant van minnen bant
Onbekend,Onbekend Hoofdstuk,132,Ende tiersten dat sijs die waerheit wiste
Onbekend,Onbekend Hoofdstuk,133,Antwerde si met soeten liste
Onbekend,Onbekend Hoofdstuk,134,Here dats bliscap ende jolijt
Onbekend,Onbekend Hoofdstuk,135,So vromen ridder alse ghi sijt
Onbekend,Onbekend Hoofdstuk,136,So riken ende so hoghen gheboren
Onbekend,Onbekend Hoofdstuk,137,Dat ghi duesen hebt vercoren
Onbekend,Onbekend Hoofdstuk,138,Daer noyt ridder in en bedarf
Onbekend,Onbekend Hoofdstuk,139,Oec heb ic harde menichwarf
Onbekend,Onbekend Hoofdstuk,140,Ghehoert in walsche ende in latijn
Onbekend,Onbekend Hoofdstuk,141,Dat sijs alle verbetert sijn
Onbekend,Onbekend Hoofdstuk,142,Die gherechte minne draghen
Onbekend,Onbekend Hoofdstuk,143,Hierbi so ne sal u niet mishaghen
Onbekend,Onbekend Hoofdstuk,144,Ende hopen altoes te ghewinnen
Onbekend,Onbekend Hoofdstuk,145,Hulpe ende troest van uwer minnen
Onbekend,Onbekend Hoofdstuk,146,Hiermede liet hi hem ghepayt
Onbekend,Onbekend Hoofdstuk,147,Ende dese werde worden gesayt
Onbekend,Onbekend Hoofdstuk,148,Onder hare met sulken liste
Onbekend,Onbekend Hoofdstuk,149,Datter nieman meer af en wiste
Onbekend,Onbekend Hoofdstuk,150,Na desen wert daer opghedaen
Onbekend,Onbekend Hoofdstuk,151,Ende ghedwoghen darna saen
Onbekend,Onbekend Hoofdstuk,152,Ende ghinghen hare meyhen lancs der zale
Onbekend,Onbekend Hoofdstuk,153,Ende hadden menigherhande tale
Onbekend,Onbekend Hoofdstuk,154,So van desen so van dien
Onbekend,Onbekend Hoofdstuk,155,Ende alse hi hem heeft versien
Onbekend,Onbekend Hoofdstuk,156,Nam hi orlof an den here
Onbekend,Onbekend Hoofdstuk,157,Van faeljuwele ende dancte hem sere
Onbekend,Onbekend Hoofdstuk,158,Der groter eren die hi hem dede
Onbekend,Onbekend Hoofdstuk,159,Ende boet hem aldaer ter stede
Onbekend,Onbekend Hoofdstuk,160,Sinen dienst so werwaert dat hi mochte
Onbekend,Onbekend Hoofdstuk,161,Waert dat hine aen hem zochte
Onbekend,Onbekend Hoofdstuk,162,Die here dancte hem ende seide
Onbekend,Onbekend Hoofdstuk,163,Dat hi voer in gods gheleyde
Onbekend,Onbekend Hoofdstuk,164,Ende emmer derwert ghebode
Onbekend,Onbekend Hoofdstuk,165,Doen beval hi die vrouwe te gode
Onbekend,Onbekend Hoofdstuk,166,Die scone was ende bi hem stont
Onbekend,Onbekend Hoofdstuk,167,Ende si hieten riden ghesont
Onbekend,Onbekend Hoofdstuk,168,In desen sat hi op ter vaert
Onbekend,Onbekend Hoofdstuk,169,Ende reet vaste te lande waert
Onbekend,Onbekend Hoofdstuk,170,Met sinen neve die luttel wiste
Onbekend,Onbekend Hoofdstuk,171,Dat sijn herte bleef in twiste
Onbekend,Onbekend Hoofdstuk,172,Van der scoener vrowen goet
Onbekend,Onbekend Hoofdstuk,173,Mer die altoes sinen moet
Onbekend,Onbekend Hoofdstuk,174,Hadde in goeden gedachte vri
Onbekend,Onbekend Hoofdstuk,175,Dat was die here van coetchi
Onbekend,Onbekend Hoofdstuk,176,Die gherne hem sette te selken dingen
Onbekend,Onbekend Hoofdstuk,177,Dat hi troest van lieve ontfinge
Onbekend,Onbekend Hoofdstuk,178,Te sinen neve sprac hi ter tijt
Onbekend,Onbekend Hoofdstuk,179,Borchgreve mi dunct goet dat ghi rijt
Onbekend,Onbekend Hoofdstuk,180,Tuwen lande ic heb te doene
Onbekend,Onbekend Hoofdstuk,181,In ardenne tenen saysoene
Onbekend,Onbekend Hoofdstuk,182,Daer ic haesteliken vare
Onbekend,Onbekend Hoofdstuk,183,Of ghi moget so volget mi nare
Onbekend,Onbekend Hoofdstuk,184,Gherne oem sprac hi mettien
Onbekend,Onbekend Hoofdstuk,185,Nu rijt ghesont ghi selt mi sien
Onbekend,Onbekend Hoofdstuk,186,Tuwen dienst altoes bereet
Onbekend,Onbekend Hoofdstuk,187,Mi ne lette dinc die ic niene weet
Onbekend,Onbekend Hoofdstuk,188,Dus sciet die borchgreve van sinen here
Onbekend,Onbekend Hoofdstuk,189,Die peynsde mochti emmermeer
Onbekend,Onbekend Hoofdstuk,190,Ter werelt sulc geluc gescien
Onbekend,Onbekend Hoofdstuk,191,Dattic dese vrowe noch mochte sien
Onbekend,Onbekend Hoofdstuk,192,Die ons dus blidelijc ontfinc
Onbekend,Onbekend Hoofdstuk,193,Dat waer di ene salige dinc
Onbekend,Onbekend Hoofdstuk,194,Sijs so scone ende so volmaect
Onbekend,Onbekend Hoofdstuk,195,Ende in alre doghet sowel geraect
Onbekend,Onbekend Hoofdstuk,196,Hoe mach mi enich dinc verdrieten
Onbekend,Onbekend Hoofdstuk,197,Ic salt noch in dat vat geghieten
Onbekend,Onbekend Hoofdstuk,198,Daer ic bi sal scouwen ane
Onbekend,Onbekend Hoofdstuk,199,Haer scone gratiose ghedane
Onbekend,Onbekend Hoofdstuk,200,In dit gedachte wert hi began
Onbekend,Onbekend Hoofdstuk,201,Ende bleef altoes dese jonge man
Onbekend,Onbekend Hoofdstuk,202,Nu hadde die here van faeljuwele
Onbekend,Onbekend Hoofdstuk,203,Een orloghe op ende die castele
Onbekend,Onbekend Hoofdstuk,204,Die die borchgreve hadde in die hant
Onbekend,Onbekend Hoofdstuk,205,Lach tusschen deser heren lant
Onbekend,Onbekend Hoofdstuk,206,Ende het ghinc buten der vorwerde
Onbekend,Onbekend Hoofdstuk,207,Sodat deen den anderen daerde
Onbekend,Onbekend Hoofdstuk,208,Aen live an goede sowaer hi mochte
Onbekend,Onbekend Hoofdstuk,209,Dat dede den borchgreven harde sochte
Onbekend,Onbekend Hoofdstuk,210,Want hi ne beghert el gheen goet
Onbekend,Onbekend Hoofdstuk,211,Dan hi den enen helpen moet
Onbekend,Onbekend Hoofdstuk,212,Maer an welken hi hem wil [gade]
Onbekend,Onbekend Hoofdstuk,213,Dies vermaet ic mi wel te rade
Onbekend,Onbekend Hoofdstuk,214,Hi was dapper ende snel
Onbekend,Onbekend Hoofdstuk,215,Ende sijn leven stont hem wel
Onbekend,Onbekend Hoofdstuk,216,Hi was jonc ende welgewrocht
Onbekend,Onbekend Hoofdstuk,217,Suverlijc ende sijn ghedocht
Onbekend,Onbekend Hoofdstuk,218,Was so groet ter vrouwen waert
Onbekend,Onbekend Hoofdstuk,219,Dat hi hem niemans en vervaert
Onbekend,Onbekend Hoofdstuk,220,Hi peinsde waerwaert mag ic tiden
Onbekend,Onbekend Hoofdstuk,221,Ic wil och god wilt leren striden
Onbekend,Onbekend Hoofdstuk,222,Alhier nu met desen heren
Onbekend,Onbekend Hoofdstuk,223,Dat ic mi echt mach bekeren
Onbekend,Onbekend Hoofdstuk,224,Te bat in stride comicker toe
Onbekend,Onbekend Hoofdstuk,225,Nu sach hi waer eens merghens vroe
Onbekend,Onbekend Hoofdstuk,226,Vele volcs versament was
Onbekend,Onbekend Hoofdstuk,227,Een stic van daer op enen pas
Onbekend,Onbekend Hoofdstuk,228,Ende ghereiden hem te stride
Onbekend,Onbekend Hoofdstuk,229,Nu ist tijt sprac hi dat ic ride
Onbekend,Onbekend Hoofdstuk,230,Ende lere metten zweerde houwen
Onbekend,Onbekend Hoofdstuk,231,Opten troest dat ic sal scouwen
Onbekend,Onbekend Hoofdstuk,232,Die scone die mi so wel behaget
Onbekend,Onbekend Hoofdstuk,233,Hi reet derwaert al onversaget
Onbekend,Onbekend Hoofdstuk,234,Ende vant se met stride ghemene
Onbekend,Onbekend Hoofdstuk,235,Hi sloech met sporen in allene
Onbekend,Onbekend Hoofdstuk,236,Als ene die heeft met groten nide
Onbekend,Onbekend Hoofdstuk,237,Thant vercoren die ene side
Onbekend,Onbekend Hoofdstuk,238,Dat was der scoenre vrouwen man
Onbekend,Onbekend Hoofdstuk,239,Dien hi aldaer helpen began
Onbekend,Onbekend Hoofdstuk,240,Ter noet daer hi ne sach verladen
Onbekend,Onbekend Hoofdstuk,241,Stont hi den groten here in staden
Onbekend,Onbekend Hoofdstuk,242,Vromelijc als een ridder vri
Onbekend,Onbekend Hoofdstuk,243,Doen waert daer geroepen coetchi
Onbekend,Onbekend Hoofdstuk,244,Danc hebt here der groter wardicheden
Onbekend,Onbekend Hoofdstuk,245,Dat ghi dus quaemt al ongebeden
Onbekend,Onbekend Hoofdstuk,246,Hi liet crayeren so wie so wilde
Onbekend,Onbekend Hoofdstuk,247,Maer selve wart hi daer so milde
Onbekend,Onbekend Hoofdstuk,248,Met vromer hant met groten slagen
Onbekend,Onbekend Hoofdstuk,249,Datter menich man began vraghen
Onbekend,Onbekend Hoofdstuk,250,Wie hi was of wanne hi quam
Onbekend,Onbekend Hoofdstuk,251,Die des strijds sovele op hem nam
Onbekend,Onbekend Hoofdstuk,252,Die aventure die veel can werken
Onbekend,Onbekend Hoofdstuk,253,Heeft den ridder daer doen merken
Onbekend,Onbekend Hoofdstuk,254,In groter eren tot diere tijt
Onbekend,Onbekend Hoofdstuk,255,Want hi verwan aldaer den strijt
Onbekend,Onbekend Hoofdstuk,256,Dies dancte hem die here groet
Onbekend,Onbekend Hoofdstuk,257,Van faeljuwele die hem boet
Onbekend,Onbekend Hoofdstuk,258,Sinen dienst waer hijt vermochte
Onbekend,Onbekend Hoofdstuk,259,Want hi sijns daer ter noet gedochte
Onbekend,Onbekend Hoofdstuk,260,Hi sprac here ghi sult verstaen
Onbekend,Onbekend Hoofdstuk,261,Dat ic dit gherne heb gedaen
Onbekend,Onbekend Hoofdstuk,262,Dor u ende sal altoes na desen dach
Onbekend,Onbekend Hoofdstuk,263,Altoes u dienen waer dat ic mach
Onbekend,Onbekend Hoofdstuk,264,Dese mare liep achter lande
Onbekend,Onbekend Hoofdstuk,265,Van messelgieren menigherande
Onbekend,Onbekend Hoofdstuk,266,Datten borchgreve van coetchi
Onbekend,Onbekend Hoofdstuk,267,Dese ere gevallen was ende hi
Onbekend,Onbekend Hoofdstuk,268,Die here daer hijt om bestont
Onbekend,Onbekend Hoofdstuk,269,Es thuus comen ende maket cont
Onbekend,Onbekend Hoofdstuk,270,Der scoenre vrouwen alst ghevel
Onbekend,Onbekend Hoofdstuk,271,Ende seide vrouwe een ridder snel
Onbekend,Onbekend Hoofdstuk,272,Die edel borchgreve van coetchi
Onbekend,Onbekend Hoofdstuk,273,Stont ons so trouweliken bi
Onbekend,Onbekend Hoofdstuk,274,In der alremeester noet
Onbekend,Onbekend Hoofdstuk,275,Dat wi daer alle weren bleven doet
Onbekend,Onbekend Hoofdstuk,276,Sekerlijc in mijn verstaen
Onbekend,Onbekend Hoofdstuk,277,En hadde sijn manlijcheit gedaen
Onbekend,Onbekend Hoofdstuk,278,Die wise vrouwe antwerde here
Onbekend,Onbekend Hoofdstuk,279,Dies ghedenct dats wel u ere
Onbekend,Onbekend Hoofdstuk,280,Want daer mocht men an hem sien
Onbekend,Onbekend Hoofdstuk,281,Dat hem leet was u misscien
Onbekend,Onbekend Hoofdstuk,282,Bi waerheiden vrouwe ghi segt waer
Onbekend,Onbekend Hoofdstuk,283,Moetic leven ic dencker naer
Onbekend,Onbekend Hoofdstuk,284,Also dats hem sal sijn te bat
Onbekend,Onbekend Hoofdstuk,285,Mer hiermede hijs niene vergat
Onbekend,Onbekend Hoofdstuk,286,Die borchgreve die daer was sijn vrient
Onbekend,Onbekend Hoofdstuk,287,Hi seide also dat hi dient
Onbekend,Onbekend Hoofdstuk,288,Sowaer hi mach spade ende vroe
Onbekend,Onbekend Hoofdstuk,289,Alle die den here horen toe
Onbekend,Onbekend Hoofdstuk,290,Oude jonge armen ende riken
Onbekend,Onbekend Hoofdstuk,291,Ende doet also willichliken
Onbekend,Onbekend Hoofdstuk,292,Dat sijs hem alle spreken lof
Onbekend,Onbekend Hoofdstuk,293,Die ghenaken des heren hof
Onbekend,Onbekend Hoofdstuk,294,Van faeljuwele ende der vrouwen
Onbekend,Onbekend Hoofdstuk,295,Die hem alle doghet betrouwen
Onbekend,Onbekend Hoofdstuk,296,Want si vindene altoes bereet
Onbekend,Onbekend Hoofdstuk,297,[...............]
Onbekend,Onbekend Hoofdstuk,298,Dat ghi sijt alleen hier comen
Onbekend,Onbekend Hoofdstuk,299,Vrouwe sprac hi neenic ende zuchte
Onbekend,Onbekend Hoofdstuk,300,Van den anxte dien hi huden duchte
Onbekend,Onbekend Hoofdstuk,301,Beefde hi zere ende was in vare
Onbekend,Onbekend Hoofdstuk,5,Dus stoet hi ende sach op hare
Onbekend,Onbekend Hoofdstuk,303,Als ene die sprake heeft verloren
Onbekend,Onbekend Hoofdstuk,304,Cume mochte hi sien of horen
Onbekend,Onbekend Hoofdstuk,305,Dus was hi langhe sonder spreken
Onbekend,Onbekend Hoofdstuk,306,Die vrouwe sach hem dicke ghebreken
Onbekend,Onbekend Hoofdstuk,10,Van varwen die hem overstreec
Onbekend,Onbekend Hoofdstuk,308,Biwilen roet biwilen bleec
Onbekend,Onbekend Hoofdstuk,309,Biwilen heet ende daerna cout
Onbekend,Onbekend Hoofdstuk,310,Doen sprac die vrouwe ridder hout
Onbekend,Onbekend Hoofdstuk,311,U herte segt mi in welker zake
Onbekend,Onbekend Hoofdstuk,15,Dat ghi sijt dus tonghemake
Onbekend,Onbekend Hoofdstuk,313,Ghi staet ende dunct mi al versteeft
Onbekend,Onbekend Hoofdstuk,314,Ende tiersten dat hi die vrouwe heeft
Onbekend,Onbekend Hoofdstuk,315,In deser tale dus vernomen
Onbekend,Onbekend Hoofdstuk,316,Is hi tot hemselven comen
Onbekend,Onbekend Hoofdstuk,20,Ende sprac aldus te halver tale
Onbekend,Onbekend Hoofdstuk,318,Bi uwen orlove ic dwale
Onbekend,Onbekend Hoofdstuk,319,Wel lieve vrouwe ende hoe
Onbekend,Onbekend Hoofdstuk,320,Eest u dus galinghe comen toe
Onbekend,Onbekend Hoofdstuk,321,Het is al seker van den bloede
Onbekend,Onbekend Hoofdstuk,25,Neen vrouwe mi is anders te moede
Onbekend,Onbekend Hoofdstuk,323,Waeraf segt mi hoet u steet
Onbekend,Onbekend Hoofdstuk,324,Bi gode vrouwe inne weet
Onbekend,Onbekend Hoofdstuk,325,Doch let u siecheit of anders yet
Onbekend,Onbekend Hoofdstuk,326,Dat doet vrouwe swaer verdriet
Onbekend,Onbekend Hoofdstuk,30,Soe segt mi dan in wat manieren
Onbekend,Onbekend Hoofdstuk,328,Mijn here is wijs hi sal visieren
Onbekend,Onbekend Hoofdstuk,329,Tot uwer ziecten goeden raet
Onbekend,Onbekend Hoofdstuk,330,Neen vrouwe die meesterie staet
Onbekend,Onbekend Hoofdstuk,331,Aen anderen meesters dan an hem
Onbekend,Onbekend Hoofdstuk,35,Die mi dus neemt hert ende sen
Onbekend,Onbekend Hoofdstuk,333,Hoe sijn meesters dan niet vroet
Onbekend,Onbekend Hoofdstuk,334,Ja si scone vrouwe goet
Onbekend,Onbekend Hoofdstuk,335,Van dingen daer si hem op verstaen
Onbekend,Onbekend Hoofdstuk,336,Hoe waerwaert sal dese redene gaen
Onbekend,Onbekend Hoofdstuk,40,Daer ghi af sijt in deser noet
Onbekend,Onbekend Hoofdstuk,338,Nerghen vrouwe dan ter doet
Onbekend,Onbekend Hoofdstuk,339,En trouwen ridder dat is pine
Onbekend,Onbekend Hoofdstuk,340,Wattan vrouwe die medicine
Onbekend,Onbekend Hoofdstuk,341,Is mi tonghereet te verwerven
Onbekend,Onbekend Hoofdstuk,45,Daerbi moet ict besterven
Onbekend,Onbekend Hoofdstuk,343,Hoe is si dan so diere te cope
Onbekend,Onbekend Hoofdstuk,344,Noem se mi bi gode ic hope
Onbekend,Onbekend Hoofdstuk,345,Op enen die se u bewerft
Onbekend,Onbekend Hoofdstuk,346,Eer ghi ons aldus onsterft
Onbekend,Onbekend Hoofdstuk,50,Vrouwe nieman en mach se weten
Onbekend,Onbekend Hoofdstuk,348,Die doet en heb mi eer verbeten
Onbekend,Onbekend Hoofdstuk,349,Daerna sal si dan comen uet
Onbekend,Onbekend Hoofdstuk,350,Hoe comet dat ghi die waerheit huet
Onbekend,Onbekend Hoofdstuk,351,Ende mi int segghen sijt dus [......]
Onbekend,Onbekend Hoofdstuk,55,Ic sie die dinc sowel [......]
Onbekend,Onbekend Hoofdstuk,353,Daer ic bin dus af te rade
Onbekend,Onbekend Hoofdstuk,354,Dat ic hope ghere ghenade
Onbekend,Onbekend Hoofdstuk,355,Hierbi moet ict besterven saen
Onbekend,Onbekend Hoofdstuk,356,Waer willen dese werde gaen
Onbekend,Onbekend Hoofdstuk,60,Segt mi dat vrouwe inne weet
Onbekend,Onbekend Hoofdstuk,358,Hoe bin ic jeghen u gheveet
Onbekend,Onbekend Hoofdstuk,359,Dat ghi der spraken hebt begonnen
Onbekend,Onbekend Hoofdstuk,360,Ende mi der redene niene wilt gonnen
Onbekend,Onbekend Hoofdstuk,361,Bi gode so ne sidi mi niet hout
Onbekend,Onbekend Hoofdstuk,65,Ay vrouwe en is niet mijn scout
Onbekend,Onbekend Hoofdstuk,363,Want ic en bin niet wel al hiere
Onbekend,Onbekend Hoofdstuk,364,Doen gaf die vrouwe antwerde sciere
Onbekend,Onbekend Hoofdstuk,365,Die scone was ende stont hem bi
Onbekend,Onbekend Hoofdstuk,366,So sidi dan een ander ghi
Onbekend,Onbekend Hoofdstuk,70,Dat hoer ic wel an uwe tale
Onbekend,Onbekend Hoofdstuk,368,Ja vercoerne scone smale
Onbekend,Onbekend Hoofdstuk,369,Ghi spreect dat mi int herte d[ro]eft
Onbekend,Onbekend Hoofdstuk,370,Noch wanic her ridder dat ghi [do]eft
Onbekend,Onbekend Hoofdstuk,371,Of dat ghi sijt in madox drome
Onbekend,Onbekend Hoofdstuk,75,Daer come af vrouwe datter af come
Onbekend,Onbekend Hoofdstuk,373,Mire herten keiserinne
Onbekend,Onbekend Hoofdstuk,374,Dat bedaghen van uwer minne
Onbekend,Onbekend Hoofdstuk,375,Heeft mi ghebonden in dit seer
Onbekend,Onbekend Hoofdstuk,376,Ende inne ghecrighe nemmermeer
Onbekend,Onbekend Hoofdstuk,80,In der herten mijn ghesonde
Onbekend,Onbekend Hoofdstuk,378,Ghi ne troest mi met uwen soeten monde
Onbekend,Onbekend Hoofdstuk,379,Siet dit is al tvolghen ende al tvlien
Onbekend,Onbekend Hoofdstuk,380,Nu wert die scone vrouwe mettien
Onbekend,Onbekend Hoofdstuk,381,Ontferuet int aenscijn ende dochte
Onbekend,Onbekend Hoofdstuk,85,Hoe si dese antwerden mochte
Onbekend,Onbekend Hoofdstuk,383,Ghetamelijc alst haer wel sat
Onbekend,Onbekend Hoofdstuk,384,Ende si sprac ten ridder na dat
Onbekend,Onbekend Hoofdstuk,385,Ay goede here ic biddu dies
Onbekend,Onbekend Hoofdstuk,386,Verdraghes mi hets mijn verlies
Onbekend,Onbekend Hoofdstuk,90,Dat ghi mi hieraf gewaghet
Onbekend,Onbekend Hoofdstuk,388,Die man ter werelt niene daghet
Onbekend,Onbekend Hoofdstuk,389,[...] wi al sijn dat god us gewrochte
Onbekend,Onbekend Hoofdstuk,390,[D]aer ic mi toe gevoeghen mochte
Onbekend,Onbekend Hoofdstuk,391,Boven minen lieven here
Onbekend,Onbekend Hoofdstuk,95,Her ridder hierbi doeldi sere
Onbekend,Onbekend Hoofdstuk,393,Verlaet[s] ons dies hets wel gedaen
Onbekend,Onbekend Hoofdstuk,394,Neen vrouwe ghi selt verstaen
Onbekend,Onbekend Hoofdstuk,395,Dat mine minne is so reyne
Onbekend,Onbekend Hoofdstuk,396,Dat ic int herten tuwaert meine
Onbekend,Onbekend Hoofdstuk,100,Al wist mijn here hi soude ons laten
Onbekend,Onbekend Hoofdstuk,398,Der minne velschen ende niet haten
Onbekend,Onbekend Hoofdstuk,399,Hoe mochti mi des maken vroet
Onbekend,Onbekend Hoofdstuk,400,Maer scone vrouwe werde goet
Onbekend,Onbekend Hoofdstuk,401,Saen wisti wie noyale minne
Onbekend,Onbekend Hoofdstuk,105,Draghet natuerlijc in den sinne
Onbekend,Onbekend Hoofdstuk,403,Dat hire recht bi wert geovergeert
Onbekend,Onbekend Hoofdstuk,404,Ende van alre archeit weert
Onbekend,Onbekend Hoofdstuk,405,Die vrouwe peinsde het mach sijn waer
Onbekend,Onbekend Hoofdstuk,406,Ende antwerde hem aldus daernaer
Onbekend,Onbekend Hoofdstuk,110,Soe mocht si doen die waer alleen
Onbekend,Onbekend Hoofdstuk,408,Mer ic her ridder die bin gemeen
Onbekend,Onbekend Hoofdstuk,409,Ende heb al ghegeven herte ende sin
Onbekend,Onbekend Hoofdstuk,410,Met minen here meer ende min
Onbekend,Onbekend Hoofdstuk,411,En wert ghesceiden groet no clene
Onbekend,Onbekend Hoofdstuk,115,Hoe mocht ichs yet met u ghemene
