author,chapter,line,text
Onbekend,Onbekend Hoofdstuk,832,"Tote in die borst, wet vorwaer;"
Onbekend,Onbekend Hoofdstuk,833,"Ende, alst vergadert es aldaer,"
Onbekend,Onbekend Hoofdstuk,834,"Dan verwarmet daer, dat wet,"
Onbekend,Onbekend Hoofdstuk,835,Ende wert verwandelt in melke vet
Onbekend,Onbekend Hoofdstuk,836,"Bi der vulster siedingen, sonder letten,"
Onbekend,Onbekend Hoofdstuk,837,Alse van der naturliker hetten
Onbekend,Onbekend Hoofdstuk,838,Ende van den getermerden tide mede
Onbekend,Onbekend Hoofdstuk,839,Dies kints alset heeft gerede.
Onbekend,Onbekend Hoofdstuk,840,"Daeraf saelt nemen sine voedinge,"
Onbekend,Onbekend Hoofdstuk,841,Ende hieraf eist sonderlinge
Onbekend,Onbekend Hoofdstuk,842,Dat den vrouwen dan gebreken
Onbekend,Onbekend Hoofdstuk,843,"Haer stonden, daer wi dus af spreken,"
Onbekend,Onbekend Hoofdstuk,844,Des niet te doene hebben die man;
Onbekend,Onbekend Hoofdstuk,845,Maer alle die andre adren dan
Onbekend,Onbekend Hoofdstuk,846,"Dienen gelike vort hen beiden,"
Onbekend,Onbekend Hoofdstuk,847,Alsic vort sal besceiden;
Onbekend,Onbekend Hoofdstuk,848,Ende waer men elke bekinnen sal
Onbekend,Onbekend Hoofdstuk,849,"An den mensche, groet ende smal."
Onbekend,Onbekend Hoofdstuk,850,"Int vorhoeft vore, doe ic verstaen,"
Onbekend,Onbekend Hoofdstuk,851,"Daer es ene adre, sonder waen,"
Onbekend,Onbekend Hoofdstuk,852,"Die soude men laten, sijts gewes,"
Onbekend,Onbekend Hoofdstuk,853,Den genen die uut sinen sinne es.
Onbekend,Onbekend Hoofdstuk,854,"In elken slaep staet oec ene,"
Onbekend,Onbekend Hoofdstuk,855,In orconscape Galiene;
Onbekend,Onbekend Hoofdstuk,856,"Waer enege van dien tebreken,"
Onbekend,Onbekend Hoofdstuk,857,Hem en soude nemmeer stoken
Onbekend,Onbekend Hoofdstuk,858,"Ghene luxurie, sijt seker des,"
Onbekend,Onbekend Hoofdstuk,859,Ende dese heten zuveniles.
Onbekend,Onbekend Hoofdstuk,860,"Onder den kinne staet I daer na,"
Onbekend,Onbekend Hoofdstuk,861,Ende die heet ubula;
Onbekend,Onbekend Hoofdstuk,862,"Ende op die scoudre oec daerbi,"
Onbekend,Onbekend Hoofdstuk,863,Ende die heet men gwindeghi;
Onbekend,Onbekend Hoofdstuk,864,"Oec staet I an den hals,"
Onbekend,Onbekend Hoofdstuk,865,Ende die maect groet gemals
Onbekend,Onbekend Hoofdstuk,866,"Als een der doot es na,"
Onbekend,Onbekend Hoofdstuk,867,Ende die heet gorgonica.
Onbekend,Onbekend Hoofdstuk,868,Oec steet daerna transitoria
Onbekend,Onbekend Hoofdstuk,869,Ende ysmon oec daerna.
Onbekend,Onbekend Hoofdstuk,870,"Nu hort an den arm sciere,"
Onbekend,Onbekend Hoofdstuk,871,Daer esser in gerekent viere;
Onbekend,Onbekend Hoofdstuk,872,"Buten den arm esser ene,"
Onbekend,Onbekend Hoofdstuk,873,"Die heet silvestres, int gemene."
Onbekend,Onbekend Hoofdstuk,874,"Daerna steet sepalica,"
Onbekend,Onbekend Hoofdstuk,875,"Daerna mediana of cardiaca,"
Onbekend,Onbekend Hoofdstuk,876,"Daerna epatica of basilica,"
Onbekend,Onbekend Hoofdstuk,877,"Ende titilares comt daerna,"
Onbekend,Onbekend Hoofdstuk,878,"Dats de vijfste, dat verstaet,"
Onbekend,Onbekend Hoofdstuk,879,Ende die recht onder die scoudren gaet
Onbekend,Onbekend Hoofdstuk,880,Die onder docsele comt mede.
Onbekend,Onbekend Hoofdstuk,881,Die dese adren ontwee snede
Onbekend,Onbekend Hoofdstuk,882,"Of daeruut bloet laten woude,"
Onbekend,Onbekend Hoofdstuk,883,"Ic seggu dat hi sterven soude,"
Onbekend,Onbekend Hoofdstuk,884,Al lachende sonder enich wee
Onbekend,Onbekend Hoofdstuk,885,"Men seit dat Seneca wilen ee,"
Onbekend,Onbekend Hoofdstuk,886,"Doen hem Nero doden soude,"
Onbekend,Onbekend Hoofdstuk,887,Dat hi also sterven woude.
Onbekend,Onbekend Hoofdstuk,888,Boven de borst oec daerna
Onbekend,Onbekend Hoofdstuk,889,So comt die adre baselica
Onbekend,Onbekend Hoofdstuk,890,Van den enen arm vort
Onbekend,Onbekend Hoofdstuk,891,"Toten andren, hebbic gehort;"
Onbekend,Onbekend Hoofdstuk,892,Ende dese leiden dbloet mede
Onbekend,Onbekend Hoofdstuk,893,Dor den lichame te meneger stede;
Onbekend,Onbekend Hoofdstuk,894,Ende van desen oec overluut
Onbekend,Onbekend Hoofdstuk,895,"So spruten andre adren uut,"
Onbekend,Onbekend Hoofdstuk,896,Recht boven der magen mede
Onbekend,Onbekend Hoofdstuk,897,So es I adre ter stede
Onbekend,Onbekend Hoofdstuk,898,"Die profundum heet in latijn,"
Onbekend,Onbekend Hoofdstuk,899,Dat wilt in dietsch diep sijn;
Onbekend,Onbekend Hoofdstuk,900,"Daeromme heet si diep, sonder waen,"
Onbekend,Onbekend Hoofdstuk,901,Omdat si vele mach ontfaen.
Onbekend,Onbekend Hoofdstuk,902,Tusschen der adren enter levere na
Onbekend,Onbekend Hoofdstuk,903,"So comt die adre melayca,"
Onbekend,Onbekend Hoofdstuk,904,Ende achter die levere oec mede
Onbekend,Onbekend Hoofdstuk,905,So gaet capillares ter stede;
Onbekend,Onbekend Hoofdstuk,906,Ende alle dese adren met
Onbekend,Onbekend Hoofdstuk,907,"Hebben bloet in, dat wet."
Onbekend,Onbekend Hoofdstuk,908,Varices sijn adren mede
Onbekend,Onbekend Hoofdstuk,909,An die dien staende gerede;
Onbekend,Onbekend Hoofdstuk,910,Worden die gesneden ontwee
Onbekend,Onbekend Hoofdstuk,911,Die mensche ne mochte nemmermee
Onbekend,Onbekend Hoofdstuk,912,"Rechte gaen, dat verstaet."
Onbekend,Onbekend Hoofdstuk,913,Noch es I adre die gaet
Onbekend,Onbekend Hoofdstuk,914,"Onder die knoesele, als ict versta,"
Onbekend,Onbekend Hoofdstuk,915,Ende es geheten sophena;
Onbekend,Onbekend Hoofdstuk,916,Ende dese plegen te latene mede
Onbekend,Onbekend Hoofdstuk,917,"Die vrouwen in menige stede,"
Onbekend,Onbekend Hoofdstuk,918,Om der matricen ongemake
Onbekend,Onbekend Hoofdstuk,919,Ende oec om der blasen sake.
Onbekend,Onbekend Hoofdstuk,920,Noch es een andre adre met
Onbekend,Onbekend Hoofdstuk,921,"Onder die knoesele geset,"
Onbekend,Onbekend Hoofdstuk,922,Die es geheten sciatica;
Onbekend,Onbekend Hoofdstuk,923,"Die laet men oec, alsic versta,"
Onbekend,Onbekend Hoofdstuk,924,Jegen dongemake ter noet
Onbekend,Onbekend Hoofdstuk,925,Die van den lindinen comen groet.
Onbekend,Onbekend Hoofdstuk,926,"Dit sijn die adren, hoe soet gaet,"
Onbekend,Onbekend Hoofdstuk,927,Die elc mensche te hebbene staet;
Onbekend,Onbekend Hoofdstuk,928,"Maer andre adren hieruut gaen,"
Onbekend,Onbekend Hoofdstuk,929,"Die ic niet en doe verstaen,"
Onbekend,Onbekend Hoofdstuk,930,Want daer leget niet vele an;
Onbekend,Onbekend Hoofdstuk,931,Om dit so latict achter dan.
Onbekend,Onbekend Hoofdstuk,932,Nu hebbic u die gedane al
Onbekend,Onbekend Hoofdstuk,933,"Van den mensche, groet ende smal,"
Onbekend,Onbekend Hoofdstuk,934,In menegen teken doen bekinnen.
Onbekend,Onbekend Hoofdstuk,935,Nu willic u vort beginnen
Onbekend,Onbekend Hoofdstuk,936,"Van den mannen ende van den vrouwen,"
Onbekend,Onbekend Hoofdstuk,937,Waerbi dat men best mach scouwen
Onbekend,Onbekend Hoofdstuk,938,Dat si gheen kint mogen winnen.
Onbekend,Onbekend Hoofdstuk,939,Avicenna doet ons bekinnen
Onbekend,Onbekend Hoofdstuk,940,"Ende Ypocras mede, entrouwen;"
Onbekend,Onbekend Hoofdstuk,941,Si seggen beide dat selke vrouwen
Onbekend,Onbekend Hoofdstuk,942,Onorborleke te selken dingen
Onbekend,Onbekend Hoofdstuk,943,Of si sijn te dinne sonderlingen
Onbekend,Onbekend Hoofdstuk,944,"Of al te mager, hoe soet gaet,"
Onbekend,Onbekend Hoofdstuk,945,"Of al te vet, dat verstaet,"
Onbekend,Onbekend Hoofdstuk,946,"Want die vetheit, wetet dat,"
Onbekend,Onbekend Hoofdstuk,947,Beslut de matrice ter stat
Onbekend,Onbekend Hoofdstuk,948,Dat dat saet int beghin
Onbekend,Onbekend Hoofdstuk,949,Niet en mach comen daerin;
Onbekend,Onbekend Hoofdstuk,950,Ende selke hebben oec so licht
Onbekend,Onbekend Hoofdstuk,951,Die materie daerom bericht
Onbekend,Onbekend Hoofdstuk,952,"Dat saet oec mach sijn daerin,"
Onbekend,Onbekend Hoofdstuk,953,Want en mach meer no min
Onbekend,Onbekend Hoofdstuk,954,"Daerin en genen tijt geduren,"
Onbekend,Onbekend Hoofdstuk,955,Hen moet weder saen uutscuren.
Onbekend,Onbekend Hoofdstuk,956,Ende oec gebreket ane den man
Onbekend,Onbekend Hoofdstuk,957,"In deser manieren, verstaet mi dan,"
Onbekend,Onbekend Hoofdstuk,958,Want dat oec der manne saet
Onbekend,Onbekend Hoofdstuk,959,"Te cout sijn, dat verstaet,"
Onbekend,Onbekend Hoofdstuk,960,"Ende oec al te dinne mede,"
Onbekend,Onbekend Hoofdstuk,961,Ende hieromme caent gene stede
Onbekend,Onbekend Hoofdstuk,962,Gecrigen in die matrice daer
Onbekend,Onbekend Hoofdstuk,963,Ende comt uut mede daernaer.
Onbekend,Onbekend Hoofdstuk,964,Ende selke manne met gewout
Onbekend,Onbekend Hoofdstuk,965,"Hebben dat saet droge ende cout,"
Onbekend,Onbekend Hoofdstuk,966,Sodat de coutheit van des
Onbekend,Onbekend Hoofdstuk,967,"Ende de droecheit, des sijt gewes,"
Onbekend,Onbekend Hoofdstuk,968,Hem gene kindre laten winnen.
Onbekend,Onbekend Hoofdstuk,969,Kinder dit soudic wel doen kinnen
Onbekend,Onbekend Hoofdstuk,970,"Ende daerna mede, als ict wiste,"
Onbekend,Onbekend Hoofdstuk,971,"Wies scout het es, soudic met liste"
Onbekend,Onbekend Hoofdstuk,972,Hem geraden in allen sinnen
Onbekend,Onbekend Hoofdstuk,973,"Dat si kindre souden winnen,"
Onbekend,Onbekend Hoofdstuk,974,"Ende ic had hier oec gedicht,"
Onbekend,Onbekend Hoofdstuk,975,Maer hen ware niet goet bericht
Onbekend,Onbekend Hoofdstuk,976,"Altemale den ruden leeken,"
Onbekend,Onbekend Hoofdstuk,977,Ende oec ontsie ic der papen treken
Onbekend,Onbekend Hoofdstuk,978,Dat sijs mi mochten spreken lachter;
Onbekend,Onbekend Hoofdstuk,979,Hieromme so lietict achter.
Onbekend,Onbekend Hoofdstuk,980,"God, die makere es alre dinge,"
Onbekend,Onbekend Hoofdstuk,981,Hi besciet ons sonderlinge
Onbekend,Onbekend Hoofdstuk,982,Int beginsel der werelt mede
Onbekend,Onbekend Hoofdstuk,983,Elke nature na menschelijchede;
Onbekend,Onbekend Hoofdstuk,984,Hi gaf den mensch oec gereit
Onbekend,Onbekend Hoofdstuk,985,Boven alle diere werdicheit
Onbekend,Onbekend Hoofdstuk,986,Want hi gaf hem groten sin
Onbekend,Onbekend Hoofdstuk,987,"Ende verstannisse mede daerin,"
Onbekend,Onbekend Hoofdstuk,988,"Ende hi woude oec mede, dat verstaet,"
Onbekend,Onbekend Hoofdstuk,989,Dat ewelike vorweert gaet
Onbekend,Onbekend Hoofdstuk,990,Des menschen gebornisse ter stat
Onbekend,Onbekend Hoofdstuk,991,Ende staende bleve oec nadat
Onbekend,Onbekend Hoofdstuk,992,"In ongeliken personen mede,"
Onbekend,Onbekend Hoofdstuk,993,"Alse manne ende wive mede,"
Onbekend,Onbekend Hoofdstuk,994,"Ende omdat van hem, hebbic vernomen,"
Onbekend,Onbekend Hoofdstuk,995,"Te samen kindre souden comen,"
Onbekend,Onbekend Hoofdstuk,996,Om dit maectise beide daer:
Onbekend,Onbekend Hoofdstuk,997,"Heet ende droge, wet vorwaer,"
Onbekend,Onbekend Hoofdstuk,998,"Maecte hi den man, ende omdat"
Onbekend,Onbekend Hoofdstuk,999,Dat selke qualike in elke stat
Onbekend,Onbekend Hoofdstuk,1000,Alse hitte ende droechede
Onbekend,Onbekend Hoofdstuk,1001,Niet te sere en souden mede
Onbekend,Onbekend Hoofdstuk,1002,"Int vergaderen habunderen,"
Onbekend,Onbekend Hoofdstuk,1003,"Maer dat naturlijcheit soude verweren,"
Onbekend,Onbekend Hoofdstuk,1004,Om dat so maecti met gewout
Onbekend,Onbekend Hoofdstuk,1005,Dat wijf beide versch ende cout
Onbekend,Onbekend Hoofdstuk,1006,Ende cranxt oec met anscijn;
Onbekend,Onbekend Hoofdstuk,1007,Ende dat de man starxt soude sijn
Onbekend,Onbekend Hoofdstuk,1008,"Van complexien, sonder blijf,"
Onbekend,Onbekend Hoofdstuk,1009,"Sijn werc soude doen dat wijf,"
Onbekend,Onbekend Hoofdstuk,1010,Gelijc dat saet dat men mede
Onbekend,Onbekend Hoofdstuk,1011,In derde werpt te meneger stede
Onbekend,Onbekend Hoofdstuk,1012,Ende dat beclijft ende brinct vrucht
Onbekend,Onbekend Hoofdstuk,1013,"Omdat si getempert es, heet ende vucht,"
Onbekend,Onbekend Hoofdstuk,1014,"No te mager no te vet,"
Onbekend,Onbekend Hoofdstuk,1015,Om dat draget si te bet;
Onbekend,Onbekend Hoofdstuk,1016,Aldus soude die wijf dan
Onbekend,Onbekend Hoofdstuk,1017,Van den gewerke van den man
Onbekend,Onbekend Hoofdstuk,1018,Ontfaen dat saet ter selver uuren
Onbekend,Onbekend Hoofdstuk,1019,In den scoet der naturen.
Onbekend,Onbekend Hoofdstuk,1020,Want die vrouwen cranker sijn
Onbekend,Onbekend Hoofdstuk,1021,"Van naturen, alst anscijn,"
Onbekend,Onbekend Hoofdstuk,1022,"Dan de manne in vele dingen,"
Onbekend,Onbekend Hoofdstuk,1023,Ende gepijnt werden sonderlinge
Onbekend,Onbekend Hoofdstuk,1024,"In dragene ende in arbeide,"
Onbekend,Onbekend Hoofdstuk,1025,"Hieraf comt hen siecheide,"
Onbekend,Onbekend Hoofdstuk,1026,Ende meest oec an die lede
Onbekend,Onbekend Hoofdstuk,1027,"Van hare naturlijchede,"
Onbekend,Onbekend Hoofdstuk,1028,Ende dorren harre naturen crancheit
Onbekend,Onbekend Hoofdstuk,1029,Ende oec mede haer siecheit
Onbekend,Onbekend Hoofdstuk,1030,"Met scaemden die si hebben, twaren,"
Onbekend,Onbekend Hoofdstuk,1031,"Den medecinen niet oppenbaren,"
Onbekend,Onbekend Hoofdstuk,1032,Noch oec mede niet gewagen
Onbekend,Onbekend Hoofdstuk,1033,Van der siecheit daer si se dragen.
Onbekend,Onbekend Hoofdstuk,1034,Daeromme so dwinghet mi
Onbekend,Onbekend Hoofdstuk,1035,"Haer grote weecheit oec daerbi,"
Onbekend,Onbekend Hoofdstuk,1036,"Die tontfarmene es wel sere,"
Onbekend,Onbekend Hoofdstuk,1037,Ende die gracie dwinget mi mere
Onbekend,Onbekend Hoofdstuk,1038,"Van selken vrouwen dat ic, twaren,"
Onbekend,Onbekend Hoofdstuk,1039,Die curen hier wille oppenbaren
Onbekend,Onbekend Hoofdstuk,1040,"Jegen die siecheit, sijt seker das,"
Onbekend,Onbekend Hoofdstuk,1041,Uuten boeke van Ypocras
Onbekend,Onbekend Hoofdstuk,1042,"Ende uute Galienus bede,"
Onbekend,Onbekend Hoofdstuk,1043,Ende met der Gods hulpe mede
Onbekend,Onbekend Hoofdstuk,1044,Sal ic scriven die saken nu
Onbekend,Onbekend Hoofdstuk,1045,"Ende die tekene, dat seggic u,"
Onbekend,Onbekend Hoofdstuk,1046,"Waerbi dat men se sal bekinnen,"
Onbekend,Onbekend Hoofdstuk,1047,Want in de wive niet es binnen
Onbekend,Onbekend Hoofdstuk,1048,So grote hitte dat die humoren
Onbekend,Onbekend Hoofdstuk,1049,Die hitte iet can doen scoren
Onbekend,Onbekend Hoofdstuk,1050,"Die in hen overtullech es,"
Onbekend,Onbekend Hoofdstuk,1051,"Want die humoren, sijt seker des,"
Onbekend,Onbekend Hoofdstuk,1052,"Die overmids haer coutheit sijn vermogen,"
Onbekend,Onbekend Hoofdstuk,1053,"En can haer hitte niet verdrogen,"
Onbekend,Onbekend Hoofdstuk,1054,No der wive cranker in scine
Onbekend,Onbekend Hoofdstuk,1055,En mach niet dogen so grote pine
Onbekend,Onbekend Hoofdstuk,1056,Dat si overtullech humoren
Onbekend,Onbekend Hoofdstuk,1057,Met swete mach uut doen scoren
Onbekend,Onbekend Hoofdstuk,1058,Teniger stede of verdriven.
Onbekend,Onbekend Hoofdstuk,1059,Daerbi om de nature van wiven
Onbekend,Onbekend Hoofdstuk,1060,Om te behagen haer hitte met
Onbekend,Onbekend Hoofdstuk,1061,"So heeft I purgatie geset,"
Onbekend,Onbekend Hoofdstuk,1062,Die men menstrua doet noemen
Onbekend,Onbekend Hoofdstuk,1063,"Ende die men gemeinlike heet bloemen,"
Onbekend,Onbekend Hoofdstuk,1064,Want gelijc alse men siet
Onbekend,Onbekend Hoofdstuk,1065,Dat de bloeme en draget niet
Onbekend,Onbekend Hoofdstuk,1066,"Sonder bloyen, dat verstaet,"
Onbekend,Onbekend Hoofdstuk,1067,Diegelike so ne ontfaet
Onbekend,Onbekend Hoofdstuk,1068,"Dat wijf sonder bloeme geen kint,"
Onbekend,Onbekend Hoofdstuk,1069,Als ons nature wel ontbint.
Onbekend,Onbekend Hoofdstuk,1070,Dese purgacie den wiven gevalt
Onbekend,Onbekend Hoofdstuk,1071,"Gelijc den man, daer men af calt"
Onbekend,Onbekend Hoofdstuk,1072,Ende hem snachts te meneger stede
Onbekend,Onbekend Hoofdstuk,1073,Pollucie gevalt al slapende mede;
Onbekend,Onbekend Hoofdstuk,1074,"Want altoes die nature,"
Onbekend,Onbekend Hoofdstuk,1075,Alsi te swert es telker uure
Onbekend,Onbekend Hoofdstuk,1076,"Van den quaden humoren dan,"
Onbekend,Onbekend Hoofdstuk,1077,"Eist I wijf, eist een man,"
Onbekend,Onbekend Hoofdstuk,1078,So pijnt si harre te verjagene dat
Onbekend,Onbekend Hoofdstuk,1079,Ende har pine te minderne ter stat.
Onbekend,Onbekend Hoofdstuk,1080,Dit doet van den humoren dovertullichede
Onbekend,Onbekend Hoofdstuk,1081,Dier te vele es in elke stede.
Onbekend,Onbekend Hoofdstuk,1082,Van der purgacien van wiven
Onbekend,Onbekend Hoofdstuk,1083,"Willic u vort bescriven,"
Onbekend,Onbekend Hoofdstuk,1084,"Die hen somen, alse ment kint,"
Onbekend,Onbekend Hoofdstuk,1085,"Te XIIIJ jaren begint,"
Onbekend,Onbekend Hoofdstuk,1086,"Ende oec hen somen te XIJ jaren,"
Onbekend,Onbekend Hoofdstuk,1087,Na dien dat in hen gewaren
Onbekend,Onbekend Hoofdstuk,1088,Van naturen heet ende cout.
Onbekend,Onbekend Hoofdstuk,1089,Dese stonden duren met gewout
Onbekend,Onbekend Hoofdstuk,1090,"Tote XL jaren, sijt seker des,"
Onbekend,Onbekend Hoofdstuk,1091,"Ja, opdat si mager es;"
Onbekend,Onbekend Hoofdstuk,1092,"Ende es dat wijf versch ende vet,"
Onbekend,Onbekend Hoofdstuk,1093,So maget hare geduren met
Onbekend,Onbekend Hoofdstuk,1094,Tote XL jaren wel gerede
Onbekend,Onbekend Hoofdstuk,1095,Of tote vive ende viertich mede.
Onbekend,Onbekend Hoofdstuk,1096,Es de purgacie geordineert
Onbekend,Onbekend Hoofdstuk,1097,"Te rechte ende getermineert,"
Onbekend,Onbekend Hoofdstuk,1098,So wert ontcommert die nature
Onbekend,Onbekend Hoofdstuk,1099,Van der overtulleger humore;
Onbekend,Onbekend Hoofdstuk,1100,"Maer, es die purgacie meer in scine"
Onbekend,Onbekend Hoofdstuk,1101,Dan si sculdech es te sine
Onbekend,Onbekend Hoofdstuk,1102,"Of mindert, so comt oec van beiden"
Onbekend,Onbekend Hoofdstuk,1103,"Menegerhande siecheiden,"
Onbekend,Onbekend Hoofdstuk,1104,Want dappetijt wert hen gemate
Onbekend,Onbekend Hoofdstuk,1105,"Beide van dranke ende van ate,"
Onbekend,Onbekend Hoofdstuk,1106,Ende werd in hen gemindert sere
Onbekend,Onbekend Hoofdstuk,1107,"Noch comt hen daeraf mere,"
Onbekend,Onbekend Hoofdstuk,1108,Want walginge ende keringe
Onbekend,Onbekend Hoofdstuk,1109,"Comt oec van desen dinge,"
Onbekend,Onbekend Hoofdstuk,1110,Ende ondertiden comter af mee
Onbekend,Onbekend Hoofdstuk,1111,Grote sweringe ende wee
Onbekend,Onbekend Hoofdstuk,1112,In den rugge ende int hoeft mede
Onbekend,Onbekend Hoofdstuk,1113,"Oec comter af de bernende rede,"
Onbekend,Onbekend Hoofdstuk,1114,Ende in dogen siet men oec de dinge;
Onbekend,Onbekend Hoofdstuk,1115,"Daer comt af van herten cnaginge,"
Onbekend,Onbekend Hoofdstuk,1116,Ende daeraf laedt men dwater mede
Onbekend,Onbekend Hoofdstuk,1117,Ende die bloetsocht oec gerede.
Onbekend,Onbekend Hoofdstuk,1118,"Oec selke vrouwen, alsijt weten,"
Onbekend,Onbekend Hoofdstuk,1119,Hebben begerte om erde teten
Onbekend,Onbekend Hoofdstuk,1120,Of crijt of colen sonderlinge
Onbekend,Onbekend Hoofdstuk,1121,Of jegen nature enegerande dinge.
Onbekend,Onbekend Hoofdstuk,1122,Ende dese siecheden comen
Onbekend,Onbekend Hoofdstuk,1123,Omdat behorlike titde der bloemen
Onbekend,Onbekend Hoofdstuk,1124,"Den vrouwen gebreken, wet dat wale,"
Onbekend,Onbekend Hoofdstuk,1125,"Of dat si hem gebreken altemale,"
Onbekend,Onbekend Hoofdstuk,1126,Want allene comter af niet
Onbekend,Onbekend Hoofdstuk,1127,"Twater, bloetsocht, als men siet,"
Onbekend,Onbekend Hoofdstuk,1128,Of bitinge van herten mede.
Onbekend,Onbekend Hoofdstuk,1129,"Daer comt af ander siechede,"
Onbekend,Onbekend Hoofdstuk,1130,"Die quader sijn, als ict versta;"
Onbekend,Onbekend Hoofdstuk,1131,"Daer comt af dyarra,"
Onbekend,Onbekend Hoofdstuk,1132,"Omdat die couteit, wetet dat,"
Onbekend,Onbekend Hoofdstuk,1133,"Alse van der naturliker stat,"
Onbekend,Onbekend Hoofdstuk,1134,"Die matrix heet in latijn,"
Onbekend,Onbekend Hoofdstuk,1135,Of omdat die cleine sijn
Onbekend,Onbekend Hoofdstuk,1136,Die adren entie graselijc
Onbekend,Onbekend Hoofdstuk,1137,"Gelijc den wive sekerlijc,"
Onbekend,Onbekend Hoofdstuk,1138,"Die dobbel sijn van naturen,"
Onbekend,Onbekend Hoofdstuk,1139,Want in hen hebben te gere uuren
Onbekend,Onbekend Hoofdstuk,1140,Die overtullech humoren stranc
Onbekend,Onbekend Hoofdstuk,1141,In hen negenen lichten uutganc
Onbekend,Onbekend Hoofdstuk,1142,Omdat die humoren sijn te dicke
Onbekend,Onbekend Hoofdstuk,1143,Ende viscoes ende ongemicke;
Onbekend,Onbekend Hoofdstuk,1144,"Ende oec mede sonderlinge,"
Onbekend,Onbekend Hoofdstuk,1145,Om die grote vergaderinge
Onbekend,Onbekend Hoofdstuk,1146,"Van den humoren, so wert hen met"
Onbekend,Onbekend Hoofdstuk,1147,"Die wech benomen oec, dat wet,"
Onbekend,Onbekend Hoofdstuk,1148,Of omdat si cleinlijc eten
Onbekend,Onbekend Hoofdstuk,1149,"Of van pinen te sere sweten,"
Onbekend,Onbekend Hoofdstuk,1150,"Sodat de quade humore en mogen,"
Onbekend,Onbekend Hoofdstuk,1151,"Die in hen wassen, niet verdrogen."
Onbekend,Onbekend Hoofdstuk,1152,Ende dit gecrijcht dat roede wijf
Onbekend,Onbekend Hoofdstuk,1153,"Die niet vele pijnt haer lijf,"
Onbekend,Onbekend Hoofdstuk,1154,Want het es behorlec dat si
Onbekend,Onbekend Hoofdstuk,1155,Vele bloemen hebber daerbi.
Onbekend,Onbekend Hoofdstuk,1156,Sal si gesont daermede bliven
Onbekend,Onbekend Hoofdstuk,1157,So moeten emmer dan becliven
Onbekend,Onbekend Hoofdstuk,1158,"Haer bloemen, omdat haer bloet"
Onbekend,Onbekend Hoofdstuk,1159,"In haren lichame, als ict verstoet,"
Onbekend,Onbekend Hoofdstuk,1160,Vergadert ende geronnen es.
Onbekend,Onbekend Hoofdstuk,1161,"Somwile valt oec, des sijt gewes,"
Onbekend,Onbekend Hoofdstuk,1162,Dat bloet uuteloept ten stonden
Onbekend,Onbekend Hoofdstuk,1163,Beide ter nese of ten monde
Onbekend,Onbekend Hoofdstuk,1164,Ende met spekelen die hen afgaet;
Onbekend,Onbekend Hoofdstuk,1165,"Somwile gebreken, dat verstaet,"
Onbekend,Onbekend Hoofdstuk,1166,"Die bloemen, overmids errede"
Onbekend,Onbekend Hoofdstuk,1167,"Ende oec overmids serechede,"
Onbekend,Onbekend Hoofdstuk,1168,Ende oec van groten wee
Onbekend,Onbekend Hoofdstuk,1169,Ende van groten anxenen mee.
Onbekend,Onbekend Hoofdstuk,1170,Ende werden de bloemen oec daernaer
Onbekend,Onbekend Hoofdstuk,1171,"Lange onthouden, wet vorwaer,"
Onbekend,Onbekend Hoofdstuk,1172,So eist te mestruwene mede
Onbekend,Onbekend Hoofdstuk,1173,"Van al te groter siechede,"
Onbekend,Onbekend Hoofdstuk,1174,Want somwile der wive orine
Onbekend,Onbekend Hoofdstuk,1175,Werden verkeert aldus in scine
Onbekend,Onbekend Hoofdstuk,1176,"Groenachtich, gelachtich ende bleec,"
Onbekend,Onbekend Hoofdstuk,1177,Ofte bruunlijc sekerlec.
Onbekend,Onbekend Hoofdstuk,1178,Es dat sake dat men mach scouwen
Onbekend,Onbekend Hoofdstuk,1179,"Te lettel bloemen an die vrouwen,"
Onbekend,Onbekend Hoofdstuk,1180,"Ende si hen gebreken ter stede,"
Onbekend,Onbekend Hoofdstuk,1181,Ende moru ende cranc sijn mede
Onbekend,Onbekend Hoofdstuk,1182,"Van complexien uutermaten,"
Onbekend,Onbekend Hoofdstuk,1183,So sal si hare dan doen laten
Onbekend,Onbekend Hoofdstuk,1184,"Die adre die onder dien cnoesel es,"
Onbekend,Onbekend Hoofdstuk,1185,"Des iersts dages, sijt gewes,"
Onbekend,Onbekend Hoofdstuk,1186,"In den iersten voet ter stede,"
Onbekend,Onbekend Hoofdstuk,1187,Sanderdages an den andren mede.
Onbekend,Onbekend Hoofdstuk,1188,Also vele als sijs vermach
Onbekend,Onbekend Hoofdstuk,1189,"Sal mens laten op elken dach,"
Onbekend,Onbekend Hoofdstuk,1190,Want in alle siecheden sal men dinken
Onbekend,Onbekend Hoofdstuk,1191,Dat men den sieken te sere niet crinken
Onbekend,Onbekend Hoofdstuk,1192,En sal van eneger medicine
Onbekend,Onbekend Hoofdstuk,1193,Dies hi hadde te groter pine.
Onbekend,Onbekend Hoofdstuk,1194,Galienus segt in sire spraken
Onbekend,Onbekend Hoofdstuk,1195,Van enen wive diere gebraken
Onbekend,Onbekend Hoofdstuk,1196,"IX maent die bloemen na das,"
Onbekend,Onbekend Hoofdstuk,1197,"Die al haer lijf verstopt oec was,"
Onbekend,Onbekend Hoofdstuk,1198,"Vercranct ende verdroeget mede,"
Onbekend,Onbekend Hoofdstuk,1199,Ende haer gebrac oec ter stede
Onbekend,Onbekend Hoofdstuk,1200,Die lust sere ende ongemate
Onbekend,Onbekend Hoofdstuk,1201,Beide van dranke ende van ate;
Onbekend,Onbekend Hoofdstuk,1202,Ende Galienus dede oppenbare
Onbekend,Onbekend Hoofdstuk,1203,Dieselve adren laten hare
Onbekend,Onbekend Hoofdstuk,1204,"Negen daghe, des sijt vroet,"
Onbekend,Onbekend Hoofdstuk,1205,"Des eens dages an enen voet,"
Onbekend,Onbekend Hoofdstuk,1206,"Des anderdages an den andren met,"
Onbekend,Onbekend Hoofdstuk,1207,Aldus deen na dander geset;
Onbekend,Onbekend Hoofdstuk,1208,In corten tiden daer ter stede
Onbekend,Onbekend Hoofdstuk,1209,Quam hare lust ende verwe mede.
Onbekend,Onbekend Hoofdstuk,1210,"Oec plegen si, dats hen ene pine,"
Onbekend,Onbekend Hoofdstuk,1211,Dicwile bestopt te sine
Onbekend,Onbekend Hoofdstuk,1212,"In den lichame, dat verstaet;"
Onbekend,Onbekend Hoofdstuk,1213,"Dan sal men hen geven, dats mijn raet,"
Onbekend,Onbekend Hoofdstuk,1214,"Vijf pillen, so scarp dat si"
Onbekend,Onbekend Hoofdstuk,1215,Mogen redelike ingaen daerbi;
Onbekend,Onbekend Hoofdstuk,1216,"Dan sal si verlaten, dat versta,"
Onbekend,Onbekend Hoofdstuk,1217,Ende baden sal si oec daerna;
Onbekend,Onbekend Hoofdstuk,1218,Dan sal si drinken na dat bat
Onbekend,Onbekend Hoofdstuk,1219,"Calemenium, wetet dat,"
Onbekend,Onbekend Hoofdstuk,1220,Of nepitam of mirra
Onbekend,Onbekend Hoofdstuk,1221,"Gesoden in honege wel daerna,"
Onbekend,Onbekend Hoofdstuk,1222,Sodat I deel borns si
Onbekend,Onbekend Hoofdstuk,1223,Ende dachtendeel honechs daerbi;
Onbekend,Onbekend Hoofdstuk,1224,"Dicwile alsi baeds gedinken,"
Onbekend,Onbekend Hoofdstuk,1225,Ende na dbat sal si drinken
Onbekend,Onbekend Hoofdstuk,1226,Dyatesseron IJ d. gewichte
Onbekend,Onbekend Hoofdstuk,1227,"Honech ende water, seget tgedichte"
Onbekend,Onbekend Hoofdstuk,1228,Daermet sal sijt dus ontfaen.
Onbekend,Onbekend Hoofdstuk,1229,"Dyatesseron es, sonder waen,"
Onbekend,Onbekend Hoofdstuk,1230,Gemaect van desen IIIJ dingen
Onbekend,Onbekend Hoofdstuk,1231,"Die ic u noemen sal sonderlinge,"
Onbekend,Onbekend Hoofdstuk,1232,Alse aristologia longa ende bactis lauri
Onbekend,Onbekend Hoofdstuk,1233,"Ende menta ende gentiana daerbi,"
Onbekend,Onbekend Hoofdstuk,1234,Ende elc evenvele geset
Onbekend,Onbekend Hoofdstuk,1235,Ende in honich gesoden daermet;
Onbekend,Onbekend Hoofdstuk,1236,"Ende dan sal hi nemen alse ierapiga,"
Onbekend,Onbekend Hoofdstuk,1237,Ende haer selen helpen oec daerna
Onbekend,Onbekend Hoofdstuk,1238,"Alle riekende crude, cinium,"
Onbekend,Onbekend Hoofdstuk,1239,"Venkel, spica ende aprum,"
Onbekend,Onbekend Hoofdstuk,1240,"Ameos, petercelle ende carvi,"
