author,chapter,line,text
Onbekend,Onbekend Hoofdstuk,1646,Ende daeromme seggen selke dan
Onbekend,Onbekend Hoofdstuk,1647,Dat men in den rechtren wint den man
Onbekend,Onbekend Hoofdstuk,1648,"Ende in de slinke wint dat wijf,"
Onbekend,Onbekend Hoofdstuk,1649,Dat men in midden wint heeft lijf.
Onbekend,Onbekend Hoofdstuk,1650,Andre seggen overmids nature
Onbekend,Onbekend Hoofdstuk,1651,"In jegewelc hol mach winnen ter uure,"
Onbekend,Onbekend Hoofdstuk,1652,Ende dat men in die slinke side wint
Onbekend,Onbekend Hoofdstuk,1653,"Dats I mannachtich wijf dat kint,"
Onbekend,Onbekend Hoofdstuk,1654,Ende wint men in die rechter side
Onbekend,Onbekend Hoofdstuk,1655,Dats I wijfachtich man tien tide.
Onbekend,Onbekend Hoofdstuk,1656,Ghi selt weten dat selcs mans roede
Onbekend,Onbekend Hoofdstuk,1657,"So crom es, dat tsaet te goede"
Onbekend,Onbekend Hoofdstuk,1658,Dat bi haer niet mach ontfaen
Onbekend,Onbekend Hoofdstuk,1659,"In die matrice, hebbic verstaen,"
Onbekend,Onbekend Hoofdstuk,1660,Ende in I ander deel ontfaet tsaet;
Onbekend,Onbekend Hoofdstuk,1661,"Daeromme sijnt, dat wel verstaet,"
Onbekend,Onbekend Hoofdstuk,1662,"Ondertiden knechte, ende oec mede"
Onbekend,Onbekend Hoofdstuk,1663,"Ondertiden meiskijn, ende oec bede."
Onbekend,Onbekend Hoofdstuk,1664,Het gevalt somwile den vrouwen
Onbekend,Onbekend Hoofdstuk,1665,"Dat haer matrix opheft, entrouwen;"
Onbekend,Onbekend Hoofdstuk,1666,Daerbi comt dat si verkeert si
Onbekend,Onbekend Hoofdstuk,1667,Ende cranken appetijt hebben daerbi
Onbekend,Onbekend Hoofdstuk,1668,Van vercoutheden der herten mede
Onbekend,Onbekend Hoofdstuk,1669,Dat hen overcomt te meneger stede.
Onbekend,Onbekend Hoofdstuk,1670,"Ondertiden dogen si sincopin,"
Onbekend,Onbekend Hoofdstuk,1671,Ende dat de puls slaet te min
Onbekend,Onbekend Hoofdstuk,1672,Dat men se niet geborsen can
Onbekend,Onbekend Hoofdstuk,1673,Alse men tasten wilt daeran.
Onbekend,Onbekend Hoofdstuk,1674,"Ende van der saken, sonder blijf,"
Onbekend,Onbekend Hoofdstuk,1675,"Word ondertiden crom dat wijf,"
Onbekend,Onbekend Hoofdstuk,1676,Sodat ondertiden dat hoeft
Onbekend,Onbekend Hoofdstuk,1677,"Ende die kinnen vergadren, geloeft,"
Onbekend,Onbekend Hoofdstuk,1678,"Ende dat si haer stemme verliesen met,"
Onbekend,Onbekend Hoofdstuk,1679,"Ende lippe ende tande oec, dat wet,"
Onbekend,Onbekend Hoofdstuk,1680,Bedwingen ende de borst aldaer
Onbekend,Onbekend Hoofdstuk,1681,"Boven mate opheffen, wet vorwaer."
Onbekend,Onbekend Hoofdstuk,1682,Galienus segt van enen wive
Onbekend,Onbekend Hoofdstuk,1683,Die soe doegede in haren live
Onbekend,Onbekend Hoofdstuk,1684,Dat si verloes haer stemme ter stede
Onbekend,Onbekend Hoofdstuk,1685,"Ende haren puls verloes si mede,"
Onbekend,Onbekend Hoofdstuk,1686,Ende si was so gebreclijc in hare
Onbekend,Onbekend Hoofdstuk,1687,"Gelijc of si doot ware,"
Onbekend,Onbekend Hoofdstuk,1688,Ende negeen teken van den live
Onbekend,Onbekend Hoofdstuk,1689,Vant men daer in genen wive;
Onbekend,Onbekend Hoofdstuk,1690,Maer haer nature hadde meer no min
Onbekend,Onbekend Hoofdstuk,1691,Te luttel hitten ant herte in;
Onbekend,Onbekend Hoofdstuk,1692,Ende selke mesters seiden daer
Onbekend,Onbekend Hoofdstuk,1693,"Dat si doot ware, vorwaer."
Onbekend,Onbekend Hoofdstuk,1694,Galienus nam wolle ende deed se doe
Onbekend,Onbekend Hoofdstuk,1695,"Vor haren nese, ende provese soe,"
Onbekend,Onbekend Hoofdstuk,1696,"Ende vant lijf noch an hare,"
Onbekend,Onbekend Hoofdstuk,1697,Ende seide dat dese siecheit aldare
Onbekend,Onbekend Hoofdstuk,1698,"Haere anquam, bedi dat si"
Onbekend,Onbekend Hoofdstuk,1699,"Te vele naturen hadde, daerbi"
Onbekend,Onbekend Hoofdstuk,1700,"Dat si mans en plach niet,"
Onbekend,Onbekend Hoofdstuk,1701,"Ende haer nature, alse men siet,"
Onbekend,Onbekend Hoofdstuk,1702,Gecorrumppeert was ter stat.
Onbekend,Onbekend Hoofdstuk,1703,Ende wedewen gevalt vele dat
Onbekend,Onbekend Hoofdstuk,1704,Die vor mans hebben geplogen;
Onbekend,Onbekend Hoofdstuk,1705,Ende jonge liede oec wel mogen
Onbekend,Onbekend Hoofdstuk,1706,"Dese dinge oec gescien met,"
Onbekend,Onbekend Hoofdstuk,1707,"Alsi tharen tide comen, dat wet,"
Onbekend,Onbekend Hoofdstuk,1708,Dat si huwelijc souden plien
Onbekend,Onbekend Hoofdstuk,1709,"Ende mans niet hebben in dien,"
Onbekend,Onbekend Hoofdstuk,1710,Bedi in hen dat saet
Onbekend,Onbekend Hoofdstuk,1711,"Meer overvloyt, dat verstaet,"
Onbekend,Onbekend Hoofdstuk,1712,"Dat sonder man niet mach wesen,"
Onbekend,Onbekend Hoofdstuk,1713,Die nature in hen verderven van desen.
Onbekend,Onbekend Hoofdstuk,1714,"Ende van desen sade, dat es"
Onbekend,Onbekend Hoofdstuk,1715,"In hen overvloyende, des sijt gewes,"
Onbekend,Onbekend Hoofdstuk,1716,Ende dese verrotte matrice mede
Onbekend,Onbekend Hoofdstuk,1717,Comt ene wintachtichede
Onbekend,Onbekend Hoofdstuk,1718,Opwert tselker stede slaende
Onbekend,Onbekend Hoofdstuk,1719,Tote bi der herten ommegaende
Onbekend,Onbekend Hoofdstuk,1720,Die sijn gebure der herten omtrent
Onbekend,Onbekend Hoofdstuk,1721,Ende der magen instrument.
Onbekend,Onbekend Hoofdstuk,1722,"Ende hieraf hen gebrect der sprake,"
Onbekend,Onbekend Hoofdstuk,1723,Ende dit ongemac van desen ongemake
Onbekend,Onbekend Hoofdstuk,1724,Nemt beginsel van dat hen
Onbekend,Onbekend Hoofdstuk,1725,"Haer siecheit gebreken meer no men,"
Onbekend,Onbekend Hoofdstuk,1726,Ende gebreken hare stonden;
Onbekend,Onbekend Hoofdstuk,1727,Ende es in hen overtullech vonden
Onbekend,Onbekend Hoofdstuk,1728,Dat saet es in hen tongemac
Onbekend,Onbekend Hoofdstuk,1729,"Vele te meer, daer ic af sprac."
Onbekend,Onbekend Hoofdstuk,1730,Die overste medicine die es
Onbekend,Onbekend Hoofdstuk,1731,"Jegen dit ongemac, des sijt gewes,"
Onbekend,Onbekend Hoofdstuk,1732,Dat men in die hande ende in die voete
Onbekend,Onbekend Hoofdstuk,1733,I lettel crauwe met goeder moete
Onbekend,Onbekend Hoofdstuk,1734,"Met olie lauine, dat wet,"
Onbekend,Onbekend Hoofdstuk,1735,Ende vor den nese houde met
Onbekend,Onbekend Hoofdstuk,1736,"Dinge die sijn van gore sware,"
Onbekend,Onbekend Hoofdstuk,1737,"Alse galbanum, ende daernare"
Onbekend,Onbekend Hoofdstuk,1738,"Beverscul, pec, gebert velt,"
Onbekend,Onbekend Hoofdstuk,1739,Ende I linijn cleet gebernt gi selt
Onbekend,Onbekend Hoofdstuk,1740,"Of apponax daervore houden nu,"
Onbekend,Onbekend Hoofdstuk,1741,"Ende derregelike, dat seggic u,"
Onbekend,Onbekend Hoofdstuk,1742,Ende warme unguente daer sal men met
Onbekend,Onbekend Hoofdstuk,1743,"Vulvam ungeren binnen, dat wet,"
Onbekend,Onbekend Hoofdstuk,1744,"Ende buten, alse hierna steet,"
Onbekend,Onbekend Hoofdstuk,1745,Dats yroleon musseloen gereet
Onbekend,Onbekend Hoofdstuk,1746,Ende camillion ende ardilion;
Onbekend,Onbekend Hoofdstuk,1747,Dese bringen weder in haer doen
Onbekend,Onbekend Hoofdstuk,1748,Menstrua ende ander siechede.
Onbekend,Onbekend Hoofdstuk,1749,Men sal I ventoyse setten mede
Onbekend,Onbekend Hoofdstuk,1750,"Op die borst, ende smorgens alsoe"
Onbekend,Onbekend Hoofdstuk,1751,"Sal si diacimum nemen, ende daertoe"
Onbekend,Onbekend Hoofdstuk,1752,Metten sape van eppen daer
Onbekend,Onbekend Hoofdstuk,1753,"Of met den sope van calamente, vorwaer,"
Onbekend,Onbekend Hoofdstuk,1754,"Of van nepita gemaect, verstaet;"
Onbekend,Onbekend Hoofdstuk,1755,"Of ghi selt nemen belsemsaet,"
Onbekend,Onbekend Hoofdstuk,1756,"Wit peper ende costi,"
Onbekend,Onbekend Hoofdstuk,1757,"Mente, eppe, ende castori"
Onbekend,Onbekend Hoofdstuk,1758,Evenvele I dragma
Onbekend,Onbekend Hoofdstuk,1759,"Ofte meer, dit stoet daerna"
Onbekend,Onbekend Hoofdstuk,1760,Ende temperet met witten wine
Onbekend,Onbekend Hoofdstuk,1761,Ende drinkes I dragma in scine.
Onbekend,Onbekend Hoofdstuk,1762,Justinus heet dat men neme nu
Onbekend,Onbekend Hoofdstuk,1763,"Comijn, ende drogene, seggic u;"
Onbekend,Onbekend Hoofdstuk,1764,Ende I lepelken vol ofte mee
Onbekend,Onbekend Hoofdstuk,1765,"Geve in dranke, het stelpt wee."
Onbekend,Onbekend Hoofdstuk,1766,"Hi heet oec nemen, Godweet,"
Onbekend,Onbekend Hoofdstuk,1767,"Tinc van den vos of van der geet,"
Onbekend,Onbekend Hoofdstuk,1768,Ende maecter pulver af ter stede
Onbekend,Onbekend Hoofdstuk,1769,Ende doet in hare scamelhede.
Onbekend,Onbekend Hoofdstuk,1770,Maer Tribacius heet sieden mee
Onbekend,Onbekend Hoofdstuk,1771,Den wortel van gemandere
Onbekend,Onbekend Hoofdstuk,1772,"Of camadreos of venkel, verstaet,"
Onbekend,Onbekend Hoofdstuk,1773,"Ende van lijnsade dat saet,"
Onbekend,Onbekend Hoofdstuk,1774,Ende doet oec daerna in des.
Onbekend,Onbekend Hoofdstuk,1775,Oec seit hi dat daertoe goet es
Onbekend,Onbekend Hoofdstuk,1776,"Wortele ende logenstoc, dat wet,"
Onbekend,Onbekend Hoofdstuk,1777,Gesoden ende gescoten met
Onbekend,Onbekend Hoofdstuk,1778,Swinensmoute ende geleget
Onbekend,Onbekend Hoofdstuk,1779,"Op den navel, alse men seget"
Onbekend,Onbekend Hoofdstuk,1780,Es dat sake dat na der dracht
Onbekend,Onbekend Hoofdstuk,1781,Matrix es buten hare macht
Onbekend,Onbekend Hoofdstuk,1782,"Ende te sere gaet nederwaert,"
Onbekend,Onbekend Hoofdstuk,1783,Men sal wermen evene ter vaert
Onbekend,Onbekend Hoofdstuk,1784,Die ierstwerf gesuvert es
Onbekend,Onbekend Hoofdstuk,1785,"Ende gevet wale om des,"
Onbekend,Onbekend Hoofdstuk,1786,Matrix gaet uut haerre stede
Onbekend,Onbekend Hoofdstuk,1787,"Sonder waen, ende sciet uut mede"
Onbekend,Onbekend Hoofdstuk,1788,"Te naturliker, alse men weet;"
Onbekend,Onbekend Hoofdstuk,1789,Ende dat valt bi den adren gereet
Onbekend,Onbekend Hoofdstuk,1790,Die omtrent matrix staen;
Onbekend,Onbekend Hoofdstuk,1791,"Alsi met coude wort bevaen,"
Onbekend,Onbekend Hoofdstuk,1792,Ende morwet die wachede
Onbekend,Onbekend Hoofdstuk,1793,Die overvloyende es inwert mede.
Onbekend,Onbekend Hoofdstuk,1794,Dese vercoutheit ende dese moruheit
Onbekend,Onbekend Hoofdstuk,1795,Comt der matricen anegereit
Onbekend,Onbekend Hoofdstuk,1796,"Van couder locht, die ingaet"
Onbekend,Onbekend Hoofdstuk,1797,"Matrix hole; ende, verstaet,"
Onbekend,Onbekend Hoofdstuk,1798,"Het comt oec vele, wetet dat"
Onbekend,Onbekend Hoofdstuk,1799,Omdat si op enen couden steen sat;
Onbekend,Onbekend Hoofdstuk,1800,Oec comet ondertiden menichfout
Onbekend,Onbekend Hoofdstuk,1801,Dat si baden in water cout;
Onbekend,Onbekend Hoofdstuk,1802,Ende word licht ende moru daerbi
Onbekend,Onbekend Hoofdstuk,1803,Ende uut haren gaet dan si.
Onbekend,Onbekend Hoofdstuk,1804,Eist dat matrix nederwert sleet
Onbekend,Onbekend Hoofdstuk,1805,"Ende niet altemale uut en geet,"
Onbekend,Onbekend Hoofdstuk,1806,So sal men vor den nese houden dus
Onbekend,Onbekend Hoofdstuk,1807,"Balsamus of muscus,"
Onbekend,Onbekend Hoofdstuk,1808,"Spica, nardi, scorope ende ambra"
Onbekend,Onbekend Hoofdstuk,1809,Ende derregelike oec daerna;
Onbekend,Onbekend Hoofdstuk,1810,Ende beneden sal men se roeken mede
Onbekend,Onbekend Hoofdstuk,1811,"Met gebernenden cledren dier gelijchede,"
Onbekend,Onbekend Hoofdstuk,1812,Ende op den navel leggen met
Onbekend,Onbekend Hoofdstuk,1813,"Wolle, die in wine ende in olie es gevet."
Onbekend,Onbekend Hoofdstuk,1814,"Ende eist dat matrix uutegeet,"
Onbekend,Onbekend Hoofdstuk,1815,Nemt armoriacum gereet
Onbekend,Onbekend Hoofdstuk,1816,Ende tempert met sap van alsenen dat
Onbekend,Onbekend Hoofdstuk,1817,Ende salven haren lichame ter stat;
Onbekend,Onbekend Hoofdstuk,1818,Daerna nemt cassiafustula ende ruta
Onbekend,Onbekend Hoofdstuk,1819,Ende bivoet evenvele daerna
Onbekend,Onbekend Hoofdstuk,1820,.......................
Onbekend,Onbekend Hoofdstuk,1821,Ende siedet in wine daerna;
Onbekend,Onbekend Hoofdstuk,1822,Met gesodender tarwen al bloet
Onbekend,Onbekend Hoofdstuk,1823,Sal ment daerop binden ter noet.
Onbekend,Onbekend Hoofdstuk,1824,"Ende ierstwerf boven allen dingen,"
Onbekend,Onbekend Hoofdstuk,1825,"Es matrix uutcomen sonderlinge,"
Onbekend,Onbekend Hoofdstuk,1826,So seldi se met wen handen saen
Onbekend,Onbekend Hoofdstuk,1827,"In haer proper stat doen staen,"
Onbekend,Onbekend Hoofdstuk,1828,Ende dan sal si na dat
Onbekend,Onbekend Hoofdstuk,1829,"Gaen sitten in een warm bat,"
Onbekend,Onbekend Hoofdstuk,1830,"Daerin gesoden sal sijn, als ict versta,"
Onbekend,Onbekend Hoofdstuk,1831,"Balanstria, cortex malignata,"
Onbekend,Onbekend Hoofdstuk,1832,"Rosa galla, contusa menta,"
Onbekend,Onbekend Hoofdstuk,1833,"Sumac, glandes, lenticula,"
Onbekend,Onbekend Hoofdstuk,1834,"Daeraf sal men I stove maken,"
Onbekend,Onbekend Hoofdstuk,1835,Die sere helpt te desen saken.
Onbekend,Onbekend Hoofdstuk,1836,Dyascorides stoven heet
Onbekend,Onbekend Hoofdstuk,1837,"Ofte suffumigeren gereet,"
Onbekend,Onbekend Hoofdstuk,1838,Haer dieten selen cout wesen.
Onbekend,Onbekend Hoofdstuk,1839,Een experiment goet te desen
Onbekend,Onbekend Hoofdstuk,1840,Dat geproeft es in ware dinc
Onbekend,Onbekend Hoofdstuk,1841,Daer die matrix uuteginc:
Onbekend,Onbekend Hoofdstuk,1842,Pulver van den herte des herts met
Onbekend,Onbekend Hoofdstuk,1843,"Ende blader van lauwerbome, dat wet,"
Onbekend,Onbekend Hoofdstuk,1844,Evenvele ene onse mede
Onbekend,Onbekend Hoofdstuk,1845,Ende I dragma mirren gerede;
Onbekend,Onbekend Hoofdstuk,1846,Wrivet ende temperet met wine
Onbekend,Onbekend Hoofdstuk,1847,"Ende gevet in dranke, dits medicine,"
Onbekend,Onbekend Hoofdstuk,1848,Ende aldus sal matrix mede
Onbekend,Onbekend Hoofdstuk,1849,Wedergaen in haren stede.
Onbekend,Onbekend Hoofdstuk,1850,Ondertiden worden daernaer
Onbekend,Onbekend Hoofdstuk,1851,Opblasinge in matrix daer
Onbekend,Onbekend Hoofdstuk,1852,Ende apostemen van diverser manieren.
Onbekend,Onbekend Hoofdstuk,1853,Eist dat colera uutgaet sciere
Onbekend,Onbekend Hoofdstuk,1854,Van der leveren es de sake met
Onbekend,Onbekend Hoofdstuk,1855,"Van ere aposteme, oec dat wet,"
Onbekend,Onbekend Hoofdstuk,1856,So maket enen rede daer
Onbekend,Onbekend Hoofdstuk,1857,"Ende enen canker, dat es waer."
Onbekend,Onbekend Hoofdstuk,1858,Ende eist van couden humoren mede
Onbekend,Onbekend Hoofdstuk,1859,Ende roe ende hart ter stede
Onbekend,Onbekend Hoofdstuk,1860,Ende swaerheiden met groten wee;
Onbekend,Onbekend Hoofdstuk,1861,Ende eist in ene side oec mee
Onbekend,Onbekend Hoofdstuk,1862,"Van der matricen bi den monde,"
Onbekend,Onbekend Hoofdstuk,1863,So gevoelt si rouwe tien stonden
Onbekend,Onbekend Hoofdstuk,1864,"An haer scoenhede, ende oec mede"
Onbekend,Onbekend Hoofdstuk,1865,"An den navel, te meneger stede"
Onbekend,Onbekend Hoofdstuk,1866,"An de lindinen, daer af comt"
Onbekend,Onbekend Hoofdstuk,1867,Dat men die bloetsocht nomt;
Onbekend,Onbekend Hoofdstuk,1868,"Ende es daposteme banderside,"
Onbekend,Onbekend Hoofdstuk,1869,So es si in den rugge tien tide
Onbekend,Onbekend Hoofdstuk,1870,Ende in die side groet seer
Onbekend,Onbekend Hoofdstuk,1871,Ende den lichame verstopt meer.
Onbekend,Onbekend Hoofdstuk,1872,Ierstwerf sal men vernemen
Onbekend,Onbekend Hoofdstuk,1873,Welc de saken sijn der apostemen
Onbekend,Onbekend Hoofdstuk,1874,"Eist dat si van heter saken si,"
Onbekend,Onbekend Hoofdstuk,1875,So seldi laten I adre daerbi
Onbekend,Onbekend Hoofdstuk,1876,"Die in den voet es gestaen,"
Onbekend,Onbekend Hoofdstuk,1877,Dit seit Galienus sonder waen.
Onbekend,Onbekend Hoofdstuk,1878,"Nadat men kint die siechede,"
Onbekend,Onbekend Hoofdstuk,1879,Want liet men an de hant mede
Onbekend,Onbekend Hoofdstuk,1880,In der siecheit van matrix daer
Onbekend,Onbekend Hoofdstuk,1881,"Die lange trect, vorwaer,"
Onbekend,Onbekend Hoofdstuk,1882,"Dat bloet opwert, ende alsoe"
Onbekend,Onbekend Hoofdstuk,1883,Trect die matrice daerwert toe;
Onbekend,Onbekend Hoofdstuk,1884,Ende om dit so es men sculdech ter stede
Onbekend,Onbekend Hoofdstuk,1885,Dbloet beneden te latene mede.
Onbekend,Onbekend Hoofdstuk,1886,"Ende es twijf starc ende vermogen,"
Onbekend,Onbekend Hoofdstuk,1887,Dat sijt IJ werf mach gedogen
Onbekend,Onbekend Hoofdstuk,1888,"Op enen dach te latene daer,"
Onbekend,Onbekend Hoofdstuk,1889,"Dat waer haer goet, ende daernaer"
Onbekend,Onbekend Hoofdstuk,1890,Sal men haer geven in dranke mede
Onbekend,Onbekend Hoofdstuk,1891,"Sap van morellen ende wegebrede,"
Onbekend,Onbekend Hoofdstuk,1892,Donderbaer ende castiofistele
Onbekend,Onbekend Hoofdstuk,1893,Ende mandragora ende desgelike mee.
Onbekend,Onbekend Hoofdstuk,1894,"Men sal oec nemen I plaester met,"
Onbekend,Onbekend Hoofdstuk,1895,"Die de hitte verdrijft, dat wet,"
Onbekend,Onbekend Hoofdstuk,1896,"Ende de cracht conforteert mee,"
Onbekend,Onbekend Hoofdstuk,1897,Van den sape van portulace
Onbekend,Onbekend Hoofdstuk,1898,"Ende silij ende wegebrede,"
Onbekend,Onbekend Hoofdstuk,1899,"Van scarleye ende donderbaer mede,"
Onbekend,Onbekend Hoofdstuk,1900,Ende daertoe olie rosaciarum;
Onbekend,Onbekend Hoofdstuk,1901,"Ende daerna, alst rijp es som,"
Onbekend,Onbekend Hoofdstuk,1902,Sal mer opleggen lijnsaet
Onbekend,Onbekend Hoofdstuk,1903,"In botren gesoden, dat verstaet,"
Onbekend,Onbekend Hoofdstuk,1904,Ende malue ende fenigriec met
Onbekend,Onbekend Hoofdstuk,1905,"Ende ganssmout of hinnen, dat wet,"
Onbekend,Onbekend Hoofdstuk,1906,"Ende dwitte van den eye daermede,"
Onbekend,Onbekend Hoofdstuk,1907,Dit es goet te sulker stede.
Onbekend,Onbekend Hoofdstuk,1908,"Dyascoridis seget dit,"
Onbekend,Onbekend Hoofdstuk,1909,Dat sere hulpet die sit
Onbekend,Onbekend Hoofdstuk,1910,In water daer spica in gesoden es.
Onbekend,Onbekend Hoofdstuk,1911,"Paulus leert oec, sijt seker des,"
Onbekend,Onbekend Hoofdstuk,1912,Enen te makene daermede
Onbekend,Onbekend Hoofdstuk,1913,Jegen der matricen herthede
Onbekend,Onbekend Hoofdstuk,1914,Ende jegen hare verkeertheit
Onbekend,Onbekend Hoofdstuk,1915,"Of geswollen of windachticheit,"
Onbekend,Onbekend Hoofdstuk,1916,Dit verdrijft men ende geneest met.
Onbekend,Onbekend Hoofdstuk,1917,Nemt van den calve dat vet
Onbekend,Onbekend Hoofdstuk,1918,Ende van den buc oec
Onbekend,Onbekend Hoofdstuk,1919,"Thewichte van XLVIIJ d. groet,"
Onbekend,Onbekend Hoofdstuk,1920,Ende van den vetten des hertshoren
Onbekend,Onbekend Hoofdstuk,1921,Drie dragmen ende daertoe horen
Onbekend,Onbekend Hoofdstuk,1922,Tfette van der gans ende van der hinnen met
Onbekend,Onbekend Hoofdstuk,1923,"Evenvele IIJ dragmen, dat wet,"
Onbekend,Onbekend Hoofdstuk,1924,"Ende honich IJ dragmen daerbi,"
Onbekend,Onbekend Hoofdstuk,1925,"Ende VJ d. gewichte van ysopi,"
Onbekend,Onbekend Hoofdstuk,1926,"Dese sal men stoten gerede,"
Onbekend,Onbekend Hoofdstuk,1927,Ende wijfs melc mingen mede
Onbekend,Onbekend Hoofdstuk,1928,Ende met olien van rosen roet
Onbekend,Onbekend Hoofdstuk,1929,"Ende met I pessere indoen ter noet,"
Onbekend,Onbekend Hoofdstuk,1930,Ende daeraf sal men I plaester maken.
Onbekend,Onbekend Hoofdstuk,1931,"Es de posteme van couder saken,"
Onbekend,Onbekend Hoofdstuk,1932,Haer dieten selen sijn clene
Onbekend,Onbekend Hoofdstuk,1933,Om die humoren te minderne allene.
Onbekend,Onbekend Hoofdstuk,1934,"Ende wiltuse ter gesonde wert keren,"
Onbekend,Onbekend Hoofdstuk,1935,"Die aposteme, ic saelt di leren,"
Onbekend,Onbekend Hoofdstuk,1936,So nem fenigere ende lijnsaet
Onbekend,Onbekend Hoofdstuk,1937,"Ende gerstenmele, dat verstaet,"
Onbekend,Onbekend Hoofdstuk,1938,"Te gadre gesoden, sijt seker des,"
Onbekend,Onbekend Hoofdstuk,1939,Ende boven gesoden in duvenmes.
Onbekend,Onbekend Hoofdstuk,1940,Es dat de posteme inwert ga
Onbekend,Onbekend Hoofdstuk,1941,"Ter blasen wert, so nem daerna"
Onbekend,Onbekend Hoofdstuk,1942,"Geitenmelc ende esels mede,"
Onbekend,Onbekend Hoofdstuk,1943,"Ende drinke dat, ende make ter stede"
Onbekend,Onbekend Hoofdstuk,1944,Van tysanen ende honich aldaer
Onbekend,Onbekend Hoofdstuk,1945,"Enen possere, ende doet in daernaer"
Onbekend,Onbekend Hoofdstuk,1946,"Met enen in die matricee,"
Onbekend,Onbekend Hoofdstuk,1947,Het helpt ter baten vele mee.
Onbekend,Onbekend Hoofdstuk,1948,Dits jegen die hebben niet
Onbekend,Onbekend Hoofdstuk,1949,"Haer stonden, of gebreken iet:"
Onbekend,Onbekend Hoofdstuk,1950,Om weder te hebbene seldi
Onbekend,Onbekend Hoofdstuk,1951,"Van der wortelen nemen, seit men mi,"
Onbekend,Onbekend Hoofdstuk,1952,Van der wilgen de scorse daer
Onbekend,Onbekend Hoofdstuk,1953,"Die naest der overster es, vorwaer,"
Onbekend,Onbekend Hoofdstuk,1954,Ende seltse met wine sieden mede
Onbekend,Onbekend Hoofdstuk,1955,"Ende tempernse ende warmense ter stede,"
Onbekend,Onbekend Hoofdstuk,1956,Des morgens in dranke geven.
Onbekend,Onbekend Hoofdstuk,1957,Oec es goet daer beneven
Onbekend,Onbekend Hoofdstuk,1958,Malua persicaria ende blader van lauri
Onbekend,Onbekend Hoofdstuk,1959,"Ende I rokinge gemaect daerbi,"
Onbekend,Onbekend Hoofdstuk,1960,Ende de wortle van rosen mede
Onbekend,Onbekend Hoofdstuk,1961,Gebonden ende gedaen ter stede.
Onbekend,Onbekend Hoofdstuk,1962,Om die haer stonden te sere
Onbekend,Onbekend Hoofdstuk,1963,"Flueren ende daeraf hebben dere,"
Onbekend,Onbekend Hoofdstuk,1964,Ghi selt nemen I hertshoren
Onbekend,Onbekend Hoofdstuk,1965,Ende die ontwee sniden te voren
Onbekend,Onbekend Hoofdstuk,1966,Ende pulveren se met den sade
Onbekend,Onbekend Hoofdstuk,1967,Van der netelen met goeder stade
Onbekend,Onbekend Hoofdstuk,1968,"Ende temperet met regenwatre daer,"
Onbekend,Onbekend Hoofdstuk,1969,Ende gevet haer drinken daernaer.
Onbekend,Onbekend Hoofdstuk,1970,Medicine jegen dieghene
Onbekend,Onbekend Hoofdstuk,1971,"Die hem beseiken op dbedde altenen,"
Onbekend,Onbekend Hoofdstuk,1972,"Willense of en willense, dat wet,"
Onbekend,Onbekend Hoofdstuk,1973,"Si ne connens niet onthouden met,"
Onbekend,Onbekend Hoofdstuk,1974,Dese sal men met warmen crude daer
Onbekend,Onbekend Hoofdstuk,1975,Beroken ende stoven daernaer.
Onbekend,Onbekend Hoofdstuk,1976,Jegen de luse tusschen de been
Onbekend,Onbekend Hoofdstuk,1977,"Ende onder docsele, van desen tween,"
Onbekend,Onbekend Hoofdstuk,1978,"Heten platluse, dat verstaet,"
Onbekend,Onbekend Hoofdstuk,1979,"Du sout nemen, na minen raet"
Onbekend,Onbekend Hoofdstuk,1980,"Alsene, ende met olien mingen,"
Onbekend,Onbekend Hoofdstuk,1981,Ende daeraf maken temperingen
Onbekend,Onbekend Hoofdstuk,1982,Ende bestriken daer die worme sijn.
Onbekend,Onbekend Hoofdstuk,1983,Ende oec es goet ende fijn
Onbekend,Onbekend Hoofdstuk,1984,"Ten roden ogen, die se daermet"
Onbekend,Onbekend Hoofdstuk,1985,"An den steert bestrijct, dat wet."
Onbekend,Onbekend Hoofdstuk,1986,"Waer dat in den mont stinct,"
Onbekend,Onbekend Hoofdstuk,1987,"Dat de quade mage toebrinct,"
Onbekend,Onbekend Hoofdstuk,1988,Ghi sult nemen doverste mede
Onbekend,Onbekend Hoofdstuk,1989,"Van der menten, ende dat gerede"
Onbekend,Onbekend Hoofdstuk,1990,"Sieden in wine, tote dat es"
Onbekend,Onbekend Hoofdstuk,1991,"Ter helft gesoden, ende na des"
Onbekend,Onbekend Hoofdstuk,1992,"Dat gedronken, alse die mage"
Onbekend,Onbekend Hoofdstuk,1993,"Wel gesuvert es alle dage,"
Onbekend,Onbekend Hoofdstuk,1994,Soutu dinen mont wasschen daer;
Onbekend,Onbekend Hoofdstuk,1995,Dit es goet wel oppenbaer.
Onbekend,Onbekend Hoofdstuk,1996,Alse vrouwen sijn gequetst van desen
Onbekend,Onbekend Hoofdstuk,1997,"Dat manne met hen hebben gewesen,"
Onbekend,Onbekend Hoofdstuk,1998,"Dat si swillen an hare nature,"
Onbekend,Onbekend Hoofdstuk,1999,Si sullen sieden daertoe ter cure
Onbekend,Onbekend Hoofdstuk,2000,Malue ende poleye mede
Onbekend,Onbekend Hoofdstuk,2001,"In regenwatre daer ter stede,"
Onbekend,Onbekend Hoofdstuk,2002,Sitten ende baden daerin;
Onbekend,Onbekend Hoofdstuk,2003,"Dits hen goet, seit mijn sin."
Onbekend,Onbekend Hoofdstuk,2004,"Het sijn wijf die sere stinken,"
Onbekend,Onbekend Hoofdstuk,2005,Den stanc sal men hier met minken;
Onbekend,Onbekend Hoofdstuk,2006,Ghi sult in wine sieden nu
Onbekend,Onbekend Hoofdstuk,2007,"Bladre van menten, radic u,"
Onbekend,Onbekend Hoofdstuk,2008,"Ende daerin enen doec netten,"
Onbekend,Onbekend Hoofdstuk,2009,Daerin wasschen sonder letten.
Onbekend,Onbekend Hoofdstuk,2010,Die oec geswollen es
Onbekend,Onbekend Hoofdstuk,2011,"Om sijn scoenhede, sijt seker des,"
Onbekend,Onbekend Hoofdstuk,2012,Hi neme poleye ende pollicarie
Onbekend,Onbekend Hoofdstuk,2013,"Ende bladre van lauwerbome nie,"
Onbekend,Onbekend Hoofdstuk,2014,"Ende doet wallen int water ter stat,"
Onbekend,Onbekend Hoofdstuk,2015,"Ende ga daerin sitten na dat,"
Onbekend,Onbekend Hoofdstuk,2016,Ende daerin sal hi beroken daer
Onbekend,Onbekend Hoofdstuk,2017,"Met olivano, wet vorwaer."
Onbekend,Onbekend Hoofdstuk,2018,Wiltu dat I wijf die soeget
Onbekend,Onbekend Hoofdstuk,2019,"Melc gnouch geve ter doget,"
Onbekend,Onbekend Hoofdstuk,2020,Tes morges tonderen gerede
Onbekend,Onbekend Hoofdstuk,2021,"Ende des avonts oec mede,"
Onbekend,Onbekend Hoofdstuk,2022,"Gef hare drinken venkelsaet,"
Onbekend,Onbekend Hoofdstuk,2023,"Lau gemaect, vore dat si et."
Onbekend,Onbekend Hoofdstuk,2024,"Dit cruut, gesoden ende daerop gelegt"
Onbekend,Onbekend Hoofdstuk,2025,"Tere plaestren, het helpt, so men segt."
Onbekend,Onbekend Hoofdstuk,2026,"Jegen die borst, die geswollen wesen,"
Onbekend,Onbekend Hoofdstuk,2027,Tebroken boenen nem van desen
Onbekend,Onbekend Hoofdstuk,2028,In I mortier met groter cracht
Onbekend,Onbekend Hoofdstuk,2029,Ende doet se int water enen nacht
Onbekend,Onbekend Hoofdstuk,2030,"Ende I nacht, ende een pont"
Onbekend,Onbekend Hoofdstuk,2031,Van boli armenti terstont
Onbekend,Onbekend Hoofdstuk,2032,"Ene vijse, ende edic mede,"
Onbekend,Onbekend Hoofdstuk,2033,Ende mac ene plaestre ter stede;
Onbekend,Onbekend Hoofdstuk,2034,"Daerop leg se, dat es goet,"
Onbekend,Onbekend Hoofdstuk,2035,Ende dat geswel oec sinken moet.
Onbekend,Onbekend Hoofdstuk,2036,Noch ter borst serichede
Onbekend,Onbekend Hoofdstuk,2037,"Nemt armoniaco, ende mede"
Onbekend,Onbekend Hoofdstuk,2038,"Met melke in watre gewreven,"
Onbekend,Onbekend Hoofdstuk,2039,Ende doet der borst alomme beneven;
Onbekend,Onbekend Hoofdstuk,2040,"Legget daerop, ende daernaer"
Onbekend,Onbekend Hoofdstuk,2041,"Bladre van latuwen, ende aldaer"
Onbekend,Onbekend Hoofdstuk,2042,"Bladre van roden coelen met,"
Onbekend,Onbekend Hoofdstuk,2043,"Dits goet daerjegen, dat wet."
Onbekend,Onbekend Hoofdstuk,2044,Diegene die hebben verdriet
Onbekend,Onbekend Hoofdstuk,2045,"Ende haer stonden en hebben niet,"
