author,chapter,line,text
Onbekend,Onbekend Hoofdstuk,1,"God, enich Vader ende Here,"
Onbekend,Onbekend Hoofdstuk,2,Sonder beghin ende emmermere
Onbekend,Onbekend Hoofdstuk,3,"Sonder ende wesen sal,"
Onbekend,Onbekend Hoofdstuk,4,Hem bevelic groet ende smal
Onbekend,Onbekend Hoofdstuk,5,"Mijn ziele, mijn lijf van quaden dingen;"
Onbekend,Onbekend Hoofdstuk,6,"Ne laet mi, Here, niet ghehingen"
Onbekend,Onbekend Hoofdstuk,7,Te doene dat onnuttelec si.
Onbekend,Onbekend Hoofdstuk,8,"Oec biddic, Here, dat ghi mi"
Onbekend,Onbekend Hoofdstuk,9,Helpt nu te desen stonden
Onbekend,Onbekend Hoofdstuk,10,So dat moet werden vonden
Onbekend,Onbekend Hoofdstuk,11,"Dit boec, dat ic hier dichten sal:"
Onbekend,Onbekend Hoofdstuk,12,U hulpe begeric boven al.
Onbekend,Onbekend Hoofdstuk,13,"Want wildi mi in staden staen,"
Onbekend,Onbekend Hoofdstuk,14,So willic nu hier anegaen
Onbekend,Onbekend Hoofdstuk,15,"Van naturen die meeste wort,"
Onbekend,Onbekend Hoofdstuk,16,Die noch nie worden gehoert
Onbekend,Onbekend Hoofdstuk,17,Van enegen man teneger tijt.
Onbekend,Onbekend Hoofdstuk,18,"Maria, moeder Gods, ghi sijt"
Onbekend,Onbekend Hoofdstuk,19,Dieghene daer ic troest an soeke
Onbekend,Onbekend Hoofdstuk,20,Om mi te helpene tesen boeke;
Onbekend,Onbekend Hoofdstuk,21,"Want wildi mi staen te staden,"
Onbekend,Onbekend Hoofdstuk,22,"Daertoe troesten ende geraden,"
Onbekend,Onbekend Hoofdstuk,23,So sal ic te bat in allen saken
Onbekend,Onbekend Hoofdstuk,24,Dit mogen dichten ende maken.
Onbekend,Onbekend Hoofdstuk,25,Vort biddic allen desen
Onbekend,Onbekend Hoofdstuk,26,"Die dit boec selen lesen,"
Onbekend,Onbekend Hoofdstuk,27,Dat si die grote Heimlijchede
Onbekend,Onbekend Hoofdstuk,28,Van mannen ende van vrouwen mede
Onbekend,Onbekend Hoofdstuk,29,Niet ne lesen oppenbare
Onbekend,Onbekend Hoofdstuk,30,Vor diegene die hare enthare
Onbekend,Onbekend Hoofdstuk,31,Scone wort ende const beniden
Onbekend,Onbekend Hoofdstuk,32,Ende die oec lachteren tallen tiden;
Onbekend,Onbekend Hoofdstuk,33,"Maer dat doet haer scalke sin,"
Onbekend,Onbekend Hoofdstuk,34,Dar die doegt niene macht in.
Onbekend,Onbekend Hoofdstuk,35,Op dit so segt Aristotiles:
Onbekend,Onbekend Hoofdstuk,36,So wie dat besmet es
Onbekend,Onbekend Hoofdstuk,37,"Met alrande quaethede,"
Onbekend,Onbekend Hoofdstuk,38,Waer hi comt telker stede
Onbekend,Onbekend Hoofdstuk,39,"Dar hi wijsheit ende leringe hort,"
Onbekend,Onbekend Hoofdstuk,40,Hi verkeret in quade vort;
Onbekend,Onbekend Hoofdstuk,41,"Maer, daer dogt ende wijsheit es in,"
Onbekend,Onbekend Hoofdstuk,42,"Al hort hi iet, sijn hovesch sin,"
Onbekend,Onbekend Hoofdstuk,43,"Keret ter dogt, groet ende clene,"
Onbekend,Onbekend Hoofdstuk,44,Want naturlike leringe gemene
Onbekend,Onbekend Hoofdstuk,45,Geeft hem dat hi alle saken
Onbekend,Onbekend Hoofdstuk,46,Ten besten keert met sire spraken.
Onbekend,Onbekend Hoofdstuk,47,"Ende hoe men dit bekinnen sal,"
Onbekend,Onbekend Hoofdstuk,48,"Sal ic u nu leeren al,"
Onbekend,Onbekend Hoofdstuk,49,Ende in dietsche wel bescriven
Onbekend,Onbekend Hoofdstuk,50,Beide van mannen ende van wiven.
Onbekend,Onbekend Hoofdstuk,51,God maecte den man na sire werde
Onbekend,Onbekend Hoofdstuk,52,Van den lime van der erde
Onbekend,Onbekend Hoofdstuk,53,Ende gaf hem der werelt mogenthede
Onbekend,Onbekend Hoofdstuk,54,"Van al te besittene mede,"
Onbekend,Onbekend Hoofdstuk,55,Ende Adam was dierste man
Onbekend,Onbekend Hoofdstuk,56,Dar God an te makene began.
Onbekend,Onbekend Hoofdstuk,57,Nu seegt Aristotiles
Onbekend,Onbekend Hoofdstuk,58,Dat Adam gemaect es
Onbekend,Onbekend Hoofdstuk,59,"Van VIIJ stucken, dat verstaet,"
Onbekend,Onbekend Hoofdstuk,60,"Dat deen na den andren gaet,"
Onbekend,Onbekend Hoofdstuk,61,"Ende leert hier in sijn beghinnen,"
Onbekend,Onbekend Hoofdstuk,62,Waer men elc gedeel sal kinnen
Onbekend,Onbekend Hoofdstuk,63,Dat an den man gemaect es;
Onbekend,Onbekend Hoofdstuk,64,Ende wat in elc te merkene es
Onbekend,Onbekend Hoofdstuk,65,Dat suldi nu alhier verstaen.
Onbekend,Onbekend Hoofdstuk,66,"Dat ierste deel es, sonder waen,"
Onbekend,Onbekend Hoofdstuk,67,"Van den lime van der erden,"
Onbekend,Onbekend Hoofdstuk,68,Ende daeraf liet God gewerden
Onbekend,Onbekend Hoofdstuk,69,"Tfleesch dat die mensche heeft,"
Onbekend,Onbekend Hoofdstuk,70,Dat weder de doot der erden geeft.
Onbekend,Onbekend Hoofdstuk,71,"Dat ander deel, verstaet hier mee,"
Onbekend,Onbekend Hoofdstuk,72,"Es gemaect van der zee,"
Onbekend,Onbekend Hoofdstuk,73,Ende daeraf comt mede dat bloet
Onbekend,Onbekend Hoofdstuk,74,Dat in den mensche wesen moet.
Onbekend,Onbekend Hoofdstuk,75,"Dat derde deel, dats oppenbaer,"
Onbekend,Onbekend Hoofdstuk,76,"Dat comt u van der sonnen claer,"
Onbekend,Onbekend Hoofdstuk,77,"Ende daeraf sijn, als wijt togen,"
Onbekend,Onbekend Hoofdstuk,78,"Gemaect scone des menschen ogen,"
Onbekend,Onbekend Hoofdstuk,79,Die al den lichame leiden mede
Onbekend,Onbekend Hoofdstuk,80,Met harre claerheit telker stede.
Onbekend,Onbekend Hoofdstuk,81,Dat vierde deel gemaect es
Onbekend,Onbekend Hoofdstuk,82,"Van den wolken, des sijt gewes,"
Onbekend,Onbekend Hoofdstuk,83,Ende daeraf sijn gemaect nu
Onbekend,Onbekend Hoofdstuk,84,"Des menschen gepeise, seggic u,"
Onbekend,Onbekend Hoofdstuk,85,Beide goet ende quaet.
Onbekend,Onbekend Hoofdstuk,86,"Dat vifte deel, dat verstaet,"
Onbekend,Onbekend Hoofdstuk,87,"Also als ict hebbe vernomen,"
Onbekend,Onbekend Hoofdstuk,88,Es hem van den winde comen;
Onbekend,Onbekend Hoofdstuk,89,"Daeraf heeft hi uut nese, uut monde."
Onbekend,Onbekend Hoofdstuk,90,Den ademtucht tallen stonde.
Onbekend,Onbekend Hoofdstuk,91,"Dat seste deel, wat helpt ontsaect,"
Onbekend,Onbekend Hoofdstuk,92,"Dat es van den stene gemaect,"
Onbekend,Onbekend Hoofdstuk,93,Ende daeraf sijn alle die beene
Onbekend,Onbekend Hoofdstuk,94,"Van den mensche, groet ende cleene."
Onbekend,Onbekend Hoofdstuk,95,"Dat sevende deel, hebbic vereest,"
Onbekend,Onbekend Hoofdstuk,96,"Dat es van den heilegen geest,"
Onbekend,Onbekend Hoofdstuk,97,Daer die mensche af redelic mede
Onbekend,Onbekend Hoofdstuk,98,Es besceden in elke stede.
Onbekend,Onbekend Hoofdstuk,99,"Dat achste deel, seegt tghedichte,"
Onbekend,Onbekend Hoofdstuk,100,"Dat es van der werelt lichte,"
Onbekend,Onbekend Hoofdstuk,101,Dat licht dat Christus es genant;
Onbekend,Onbekend Hoofdstuk,102,Ende daeraf es die mensche becant
Onbekend,Onbekend Hoofdstuk,103,"Dat hi godevruchtech es,"
Onbekend,Onbekend Hoofdstuk,104,"Op alle dinc, sijt seker des."
Onbekend,Onbekend Hoofdstuk,105,Dus es die mensche gemaect al
Onbekend,Onbekend Hoofdstuk,106,"Van desen achten, groot ende smal."
Onbekend,Onbekend Hoofdstuk,107,Nu hort van desen meer:
Onbekend,Onbekend Hoofdstuk,108,Ghi horet nu wel seggen eer
Onbekend,Onbekend Hoofdstuk,109,"Dat die mensche, na minen rime,"
Onbekend,Onbekend Hoofdstuk,110,Gemaect es van der erden lime;
Onbekend,Onbekend Hoofdstuk,111,"Ende, trect hi der erden meest an hem,"
Onbekend,Onbekend Hoofdstuk,112,......................
Onbekend,Onbekend Hoofdstuk,113,"Ende swaer, ende werdet gerne vet,"
Onbekend,Onbekend Hoofdstuk,114,Opdat hem anders niet ne let.
Onbekend,Onbekend Hoofdstuk,115,"Ende es hi van der zee meest,"
Onbekend,Onbekend Hoofdstuk,116,"Daer ic dat bloet in hebbe vereest,"
Onbekend,Onbekend Hoofdstuk,117,"So es hi vroet, met ere vlucht"
Onbekend,Onbekend Hoofdstuk,118,Die hem nochtan geeft I ducht
Onbekend,Onbekend Hoofdstuk,119,"Ter vroetscap, dar hi hem toe keert,"
Onbekend,Onbekend Hoofdstuk,120,Dat hire niet I wort volleert.
Onbekend,Onbekend Hoofdstuk,121,"Ende es hi van der sonnen dan,"
Onbekend,Onbekend Hoofdstuk,122,"Dar hem sijn licht af comt an,"
Onbekend,Onbekend Hoofdstuk,123,So es hi scone van allen leden
Onbekend,Onbekend Hoofdstuk,124,"Ende graselijc oec van seden,"
Onbekend,Onbekend Hoofdstuk,125,"Ende int scouwen te siene goet,"
Onbekend,Onbekend Hoofdstuk,126,Maer quaet es te kennene haer moet.
Onbekend,Onbekend Hoofdstuk,127,"Ende es hi van den wolken met,"
Onbekend,Onbekend Hoofdstuk,128,"Dar sine gepeise af sijn geset,"
Onbekend,Onbekend Hoofdstuk,129,"So es hi lijcht ende snel,"
Onbekend,Onbekend Hoofdstuk,130,"Want de gepeise, wetti wel,"
Onbekend,Onbekend Hoofdstuk,131,Die sijn vollec harentare;
Onbekend,Onbekend Hoofdstuk,132,Dus moet hi trecken oppenbare.
Onbekend,Onbekend Hoofdstuk,133,"Es hi meest van den winde,"
Onbekend,Onbekend Hoofdstuk,134,"Daraf die adem comt gehinde,"
Onbekend,Onbekend Hoofdstuk,135,"So es hi haestich ende wreet,"
Onbekend,Onbekend Hoofdstuk,136,Ende ter erscap oec gereet;
Onbekend,Onbekend Hoofdstuk,137,"Want, daer vele adems binnen es,"
Onbekend,Onbekend Hoofdstuk,138,"Es vollec verwermt, sijt seker des."
Onbekend,Onbekend Hoofdstuk,139,"Ende es hi meest van den steene,"
Onbekend,Onbekend Hoofdstuk,140,"Daer af gemaect sijn die bene,"
Onbekend,Onbekend Hoofdstuk,141,So es hi wreet van sinne
Onbekend,Onbekend Hoofdstuk,142,"Ende wreet mede, als ict kinne,"
Onbekend,Onbekend Hoofdstuk,143,Gelijc die stene hart sijn
Onbekend,Onbekend Hoofdstuk,144,"Ende quaet te werkene sijn ascijn,"
Onbekend,Onbekend Hoofdstuk,145,"Also sijn dese die ic mene,"
Onbekend,Onbekend Hoofdstuk,146,Die meest in hebben die bene.
Onbekend,Onbekend Hoofdstuk,147,Ende es hi oec alre meest
Onbekend,Onbekend Hoofdstuk,148,"Gemaect van den Heilegen Geest,"
Onbekend,Onbekend Hoofdstuk,149,"Dar hem bescedenheit af comt,"
Onbekend,Onbekend Hoofdstuk,150,"Als hiervoren es genoemt,"
Onbekend,Onbekend Hoofdstuk,151,"So es hi goet ende suver mede,"
Onbekend,Onbekend Hoofdstuk,152,Ende set sinen sin wel gerede
Onbekend,Onbekend Hoofdstuk,153,"Ter heileger Scrifturen wert,"
Onbekend,Onbekend Hoofdstuk,154,"Die hem wort wel geoppenbaert,"
Onbekend,Onbekend Hoofdstuk,155,Want die Heilege Geest in hem leeft
Onbekend,Onbekend Hoofdstuk,156,Daer hi sijn wesen meest af heeft.
Onbekend,Onbekend Hoofdstuk,157,Ende es hi meest gemaect mede
Onbekend,Onbekend Hoofdstuk,158,"Van den lichte der claerhede,"
Onbekend,Onbekend Hoofdstuk,159,"Dat God selve es gheheten,"
Onbekend,Onbekend Hoofdstuk,160,"So es hi goet, alse wijt weten,"
Onbekend,Onbekend Hoofdstuk,161,"Ende herde claer op alle dinge,"
Onbekend,Onbekend Hoofdstuk,162,Want hi es so sonderlinge
Onbekend,Onbekend Hoofdstuk,163,Van levene in gerechticheden
Onbekend,Onbekend Hoofdstuk,164,Dat hijt al gedoogt mede
Onbekend,Onbekend Hoofdstuk,165,"Dat hi hort ende siet,"
Onbekend,Onbekend Hoofdstuk,166,Want hen gereint sire herten niet.
Onbekend,Onbekend Hoofdstuk,167,Dit sijn de poente daer men mede
Onbekend,Onbekend Hoofdstuk,168,"Kinnen sal des menschen sede,"
Onbekend,Onbekend Hoofdstuk,169,Ende waertoe hi es gesaect.
Onbekend,Onbekend Hoofdstuk,170,Ende waer hi meest af es gemaect.
Onbekend,Onbekend Hoofdstuk,171,Noch sijn oec IIIJ ander dinge
Onbekend,Onbekend Hoofdstuk,172,Daer die mensche sonderlinge
Onbekend,Onbekend Hoofdstuk,173,"Af es gemaect, als ict versta."
Onbekend,Onbekend Hoofdstuk,174,Dit sijn die IIIJ elementa;
Onbekend,Onbekend Hoofdstuk,175,"Dats vier, lucht, dese beede"
Onbekend,Onbekend Hoofdstuk,176,Ende water ende die erde mede:
Onbekend,Onbekend Hoofdstuk,177,Dese IIIJ sijn an elken man
Onbekend,Onbekend Hoofdstuk,178,"Ende doen boven den andren nochtan,"
Onbekend,Onbekend Hoofdstuk,179,Ende welc si meest hevet ane
Onbekend,Onbekend Hoofdstuk,180,Daerna trect sine gedane.
Onbekend,Onbekend Hoofdstuk,181,Heeft hi des viers alre meest
Onbekend,Onbekend Hoofdstuk,182,"Ende de lucht mede, hebbic vereest,"
Onbekend,Onbekend Hoofdstuk,183,So es hi heet van naturen;
Onbekend,Onbekend Hoofdstuk,184,Ende es dat in hem geduren
Onbekend,Onbekend Hoofdstuk,185,Twater ende die erde met
Onbekend,Onbekend Hoofdstuk,186,"Ende meer sijn in hem geset,"
Onbekend,Onbekend Hoofdstuk,187,So es hi versch ende cout
Onbekend,Onbekend Hoofdstuk,188,Ende daerna trect oec sijn gewout.
Onbekend,Onbekend Hoofdstuk,189,Dus heeft elc mensche dese viere
Onbekend,Onbekend Hoofdstuk,190,In hem geset na sine maniere.
Onbekend,Onbekend Hoofdstuk,191,Nu seldi noch vorwart weten
Onbekend,Onbekend Hoofdstuk,192,Dat oec van den VIJ planeten
Onbekend,Onbekend Hoofdstuk,193,Elc mensche heeft sine nature.
Onbekend,Onbekend Hoofdstuk,194,Die willic noemen nu ter uure
Onbekend,Onbekend Hoofdstuk,195,"Saturnus, Jupiter, ende daeran"
Onbekend,Onbekend Hoofdstuk,196,"Volgt Mars, ende de Sonne dan;"
Onbekend,Onbekend Hoofdstuk,197,Darna Venus ende Mercurius
Onbekend,Onbekend Hoofdstuk,198,"Ende de Mane, wi lesent dus."
Onbekend,Onbekend Hoofdstuk,199,"Nu doen die mesters verstaen,"
Onbekend,Onbekend Hoofdstuk,200,"Als een kint wert ontfaen,"
Onbekend,Onbekend Hoofdstuk,201,Die planete die rengneert dan
Onbekend,Onbekend Hoofdstuk,202,"Dat dat kint trect daran,"
Onbekend,Onbekend Hoofdstuk,203,Weder si es quaet of goet.
Onbekend,Onbekend Hoofdstuk,204,"Pytagoras ons verstaen doet,"
Onbekend,Onbekend Hoofdstuk,205,"Als dat kint wert geboren,"
Onbekend,Onbekend Hoofdstuk,206,Die planete die dan comt voren
Onbekend,Onbekend Hoofdstuk,207,"Dat dan darna trecken moet,"
Onbekend,Onbekend Hoofdstuk,208,Weder si es quaet of goet;
Onbekend,Onbekend Hoofdstuk,209,"Ende sijn si beide goet dan,"
Onbekend,Onbekend Hoofdstuk,210,So wert sere goet die man
Onbekend,Onbekend Hoofdstuk,211,"Ende sijn si quaet, als ict versta,"
Onbekend,Onbekend Hoofdstuk,212,So trect hi oec gerne darna;
Onbekend,Onbekend Hoofdstuk,213,"Ende es deen quaet ende dander goet,"
Onbekend,Onbekend Hoofdstuk,214,"So es hi tusschen beide gemoet,"
Onbekend,Onbekend Hoofdstuk,215,"En ware alse, als ghi mogt horen,"
Onbekend,Onbekend Hoofdstuk,216,Als ic gesproken hebbe hiervoren
Onbekend,Onbekend Hoofdstuk,217,"Van den VIIJ delen, Godweet,"
Onbekend,Onbekend Hoofdstuk,218,Si mogent breken wel gereet;
Onbekend,Onbekend Hoofdstuk,219,"Want, mocht an die planeten gaen,"
Onbekend,Onbekend Hoofdstuk,220,So ne mocht niemen wederstaen
Onbekend,Onbekend Hoofdstuk,221,"Sinen wille doen no den haren,"
Onbekend,Onbekend Hoofdstuk,222,Hi ne soude altoes darna varen.
Onbekend,Onbekend Hoofdstuk,223,Nu sijn noch IIIJ ander dingen
Onbekend,Onbekend Hoofdstuk,224,Daer de menschen sonderlinge
Onbekend,Onbekend Hoofdstuk,225,Haer nature af hebben ontfaen:
Onbekend,Onbekend Hoofdstuk,226,Nu horter na ende vanc verstaen.
Onbekend,Onbekend Hoofdstuk,227,"Dat sijn IIIJ complexien, geset"
Onbekend,Onbekend Hoofdstuk,228,"Met al den andren, dat wel wet,"
Onbekend,Onbekend Hoofdstuk,229,Dar alle menschen af moeten wesen:
Onbekend,Onbekend Hoofdstuk,230,Ende die ierste oec van desen
Onbekend,Onbekend Hoofdstuk,231,"Heet sanguinea int latijn,"
Onbekend,Onbekend Hoofdstuk,232,Ende wille de beste van allen sijn;
Onbekend,Onbekend Hoofdstuk,233,"Die andre heet colerica,"
Onbekend,Onbekend Hoofdstuk,234,Si es oec de beste darna;
Onbekend,Onbekend Hoofdstuk,235,"Die derde heet fleumatica,"
Onbekend,Onbekend Hoofdstuk,236,"Die vierde melancolia,"
Onbekend,Onbekend Hoofdstuk,237,Dese IJ sijn niet so goet
Onbekend,Onbekend Hoofdstuk,238,"Als dander IJ, als ict verstoet."
Onbekend,Onbekend Hoofdstuk,239,Dese vier complexien geven mede
Onbekend,Onbekend Hoofdstuk,240,"Elken sine naturlijchede,"
Onbekend,Onbekend Hoofdstuk,241,Want sanguinea maect blide den man
Onbekend,Onbekend Hoofdstuk,242,"Ende doeten oec sere minnen dan,"
Onbekend,Onbekend Hoofdstuk,243,"Ende die andre maecten coene,"
Onbekend,Onbekend Hoofdstuk,244,Licht tornich in elken doene.
Onbekend,Onbekend Hoofdstuk,245,"Die derde complexie, als ict kinne,"
Onbekend,Onbekend Hoofdstuk,246,"Maken bloede ende plomp de sinne,"
Onbekend,Onbekend Hoofdstuk,247,Ende vele spraken es in desen
Onbekend,Onbekend Hoofdstuk,248,Die vierde gevet oec met desen
Onbekend,Onbekend Hoofdstuk,249,Den genen daer si wonet mede
Onbekend,Onbekend Hoofdstuk,250,Dat hi traech es in al de lede
Onbekend,Onbekend Hoofdstuk,251,"Ende gerne droeven ende allene,"
Onbekend,Onbekend Hoofdstuk,252,Hi ducht alle dinc gemeene.
Onbekend,Onbekend Hoofdstuk,253,Nu hebbic u nu doen verstaen
Onbekend,Onbekend Hoofdstuk,254,Waerof dat hebben ontfaen
Onbekend,Onbekend Hoofdstuk,255,Har nature ende har wesen
Onbekend,Onbekend Hoofdstuk,256,"Alle menschen, nu hort na desen"
Onbekend,Onbekend Hoofdstuk,257,Noch een luttel van hen meer.
Onbekend,Onbekend Hoofdstuk,258,Ic wille u hier doen kennen meer
Onbekend,Onbekend Hoofdstuk,259,"In die ogen wat een es,"
Onbekend,Onbekend Hoofdstuk,260,Also ons segt Aristotiles;
Onbekend,Onbekend Hoofdstuk,261,"Hi segt, als wijt horen mogen:"
Onbekend,Onbekend Hoofdstuk,262,"Diegene die heeft grote ogen,"
Onbekend,Onbekend Hoofdstuk,263,Hi es droge van naturen
Onbekend,Onbekend Hoofdstuk,264,In hem selven telker uuren.
Onbekend,Onbekend Hoofdstuk,265,"Dengenen die oec, sonder waen,"
Onbekend,Onbekend Hoofdstuk,266,"Sijn ogen diep in thoeft staen,"
Onbekend,Onbekend Hoofdstuk,267,Hi es van quader listechede
Onbekend,Onbekend Hoofdstuk,268,Ende oec I bedriegere mede.
Onbekend,Onbekend Hoofdstuk,269,"Den genen die dogen opwert pulen,"
Onbekend,Onbekend Hoofdstuk,270,An dengenen sal men gevulen
Onbekend,Onbekend Hoofdstuk,271,Onscamelheit ende clappen met
Onbekend,Onbekend Hoofdstuk,272,"Ende van herden sinne, dat wet."
Onbekend,Onbekend Hoofdstuk,273,Die vele bruuns hevet nu
Onbekend,Onbekend Hoofdstuk,274,"Int ogeappel, dat seggic u,"
Onbekend,Onbekend Hoofdstuk,275,Hi es van groter bloethede
Onbekend,Onbekend Hoofdstuk,276,Ende vervaert hem gerne mede.
Onbekend,Onbekend Hoofdstuk,277,Den genen die de ogen scieten
Onbekend,Onbekend Hoofdstuk,278,"Herwert, derwert, ende vlieten"
Onbekend,Onbekend Hoofdstuk,279,"Eenpaerlike, ende die alle dinge"
Onbekend,Onbekend Hoofdstuk,280,"Nauwe besiet sonderlinge,"
Onbekend,Onbekend Hoofdstuk,281,"Hijs quaet ende scalc, dat seggic u;"
Onbekend,Onbekend Hoofdstuk,282,"Huet u van hem, dat radic u."
Onbekend,Onbekend Hoofdstuk,283,"Diegene die oec siet als I wijf,"
Onbekend,Onbekend Hoofdstuk,284,Hi es oncuusch in al sijn lijf;
Onbekend,Onbekend Hoofdstuk,285,Ende van lichame onsuver mede
Onbekend,Onbekend Hoofdstuk,286,Ende onscamel in elke stede.
Onbekend,Onbekend Hoofdstuk,287,Diegene die siet als I kint
Onbekend,Onbekend Hoofdstuk,288,"Ende kintsche gedachte heeft omtrent,"
Onbekend,Onbekend Hoofdstuk,289,"Ende blide ansichten togen,"
Onbekend,Onbekend Hoofdstuk,290,"Ende gerne lachen metten ogen,"
Onbekend,Onbekend Hoofdstuk,291,Die mach leven lange tijt
Onbekend,Onbekend Hoofdstuk,292,So blidelike ende met jolijt.
Onbekend,Onbekend Hoofdstuk,293,Diegene die dogen groet heeft
Onbekend,Onbekend Hoofdstuk,294,"Ende bernende rayen uutgeeft,"
Onbekend,Onbekend Hoofdstuk,295,Dats I drogen mensche mede
Onbekend,Onbekend Hoofdstuk,296,"Ende al vol van idelheden,"
Onbekend,Onbekend Hoofdstuk,297,"Ende mint gerne, sonder blijf,"
Onbekend,Onbekend Hoofdstuk,298,Weder dat si man of wijf.
Onbekend,Onbekend Hoofdstuk,299,Diegene die hevet cleine ogen
Onbekend,Onbekend Hoofdstuk,300,"Ende bevende, als wijt togen,"
Onbekend,Onbekend Hoofdstuk,301,Die es tornich ende wreet
Onbekend,Onbekend Hoofdstuk,302,Ende mint oec die wijf gereet.
Onbekend,Onbekend Hoofdstuk,303,"Diegene oec, nu merket hier,"
Onbekend,Onbekend Hoofdstuk,304,"Die dogen vlammen als I vier,"
Onbekend,Onbekend Hoofdstuk,305,"Die es quaet, seit mine leere,"
Onbekend,Onbekend Hoofdstuk,306,Ende een quaet mensche sere.
Onbekend,Onbekend Hoofdstuk,307,Diegene die oec heeft ter stede
Onbekend,Onbekend Hoofdstuk,308,Vele verwen in dogen mede
Onbekend,Onbekend Hoofdstuk,309,Geminget met geluer gedane
Onbekend,Onbekend Hoofdstuk,310,"Gelijc oft ware sufferane,"
Onbekend,Onbekend Hoofdstuk,311,Dat betekent in waerheden
Onbekend,Onbekend Hoofdstuk,312,Dat hi es van quaden seden.
Onbekend,Onbekend Hoofdstuk,313,Die vele vlecken hevet met
Onbekend,Onbekend Hoofdstuk,314,Omtrent dogeappel geset
Onbekend,Onbekend Hoofdstuk,315,"Also als ment hier verstaet,"
Onbekend,Onbekend Hoofdstuk,316,Betekent dat hi es quaet.
Onbekend,Onbekend Hoofdstuk,317,"Diegene oec, als wijt kinnen,"
Onbekend,Onbekend Hoofdstuk,318,Die dogen hebben bruun binnen
Onbekend,Onbekend Hoofdstuk,319,"Ende met gelu rayen, sonder waen,"
Onbekend,Onbekend Hoofdstuk,320,Diegene hevet manslacht gedaen.
Onbekend,Onbekend Hoofdstuk,321,Nu hort vorwert ende verstaet
Onbekend,Onbekend Hoofdstuk,322,Waer dese redene henen gaet;
Onbekend,Onbekend Hoofdstuk,323,Een luttel seggen hort na mi;
Onbekend,Onbekend Hoofdstuk,324,"De nese, die an den mensche si,"
Onbekend,Onbekend Hoofdstuk,325,Sijn daraf inge die gate
Onbekend,Onbekend Hoofdstuk,326,"Ende suptijl oec mede ter mate,"
Onbekend,Onbekend Hoofdstuk,327,"Dengenen dien si also staen,"
Onbekend,Onbekend Hoofdstuk,328,"Hi veght gerne, sonder waen."
Onbekend,Onbekend Hoofdstuk,329,Diegene die de nesegaten
Onbekend,Onbekend Hoofdstuk,330,"Wijt hebben uutermaten,"
Onbekend,Onbekend Hoofdstuk,331,"Ende groet oec die nese mede,"
Onbekend,Onbekend Hoofdstuk,332,Hi es van luttel wijsheden;
Onbekend,Onbekend Hoofdstuk,333,"Maer, die heeft tusschen beden,"
Onbekend,Onbekend Hoofdstuk,334,"No groet no cleine, in waerheden,"
Onbekend,Onbekend Hoofdstuk,335,"No te wijt no te inge,"
Onbekend,Onbekend Hoofdstuk,336,Dat sijn die beste sonderlinge.
Onbekend,Onbekend Hoofdstuk,337,"Dit sijn der naturen heimlijchede,"
Onbekend,Onbekend Hoofdstuk,338,Dar men se mach bekinnen mede.
Onbekend,Onbekend Hoofdstuk,339,Omdat ic hier hebbe geseit
Onbekend,Onbekend Hoofdstuk,340,"Van der naturen heimlijcheit,"
Onbekend,Onbekend Hoofdstuk,341,Waer men die mach bekinnen
Onbekend,Onbekend Hoofdstuk,342,"An den mensche in allen sinnen,"
Onbekend,Onbekend Hoofdstuk,343,Ierst van VIIJ poenten gerede
Onbekend,Onbekend Hoofdstuk,344,"Ende van IIIJ elementen mede,"
Onbekend,Onbekend Hoofdstuk,345,"Ende van VIJ planeten daernaer,"
Onbekend,Onbekend Hoofdstuk,346,"Ende van IIIJ complexien oppenbaer,"
Onbekend,Onbekend Hoofdstuk,347,Gelijc dat dese regneren alle
Onbekend,Onbekend Hoofdstuk,348,"In den mensche, dar elc gevalle,"
Onbekend,Onbekend Hoofdstuk,349,Al deser gelike elc mensche es
Onbekend,Onbekend Hoofdstuk,350,"Van IIIJ humoren, sijt seker des;"
Onbekend,Onbekend Hoofdstuk,351,Ende dies willic u maken vroet.
Onbekend,Onbekend Hoofdstuk,352,"Dat ierste humor, dat es bloet,"
Onbekend,Onbekend Hoofdstuk,353,"Weder het si versch of heet,"
Onbekend,Onbekend Hoofdstuk,354,Ende dat regneert oec wel gereet
Onbekend,Onbekend Hoofdstuk,355,Den mensche in die rechter side;
Onbekend,Onbekend Hoofdstuk,356,Ende dat regneert tallen tiden
Onbekend,Onbekend Hoofdstuk,357,Daer uut ende in comen moet.
Onbekend,Onbekend Hoofdstuk,358,"Dat ander humor, als ict verstoet,"
Onbekend,Onbekend Hoofdstuk,359,"Es I rode colore, Godweet,"
Onbekend,Onbekend Hoofdstuk,360,"Ende die es droge ende heet,"
Onbekend,Onbekend Hoofdstuk,361,Ende regneert oec tallen tiden
Onbekend,Onbekend Hoofdstuk,362,Den mensche in die slinker side.
Onbekend,Onbekend Hoofdstuk,363,"Nu hort van den derden humore,"
Onbekend,Onbekend Hoofdstuk,364,Dat es erande swarte colore:
Onbekend,Onbekend Hoofdstuk,365,"Dese es droge ende cout,"
Onbekend,Onbekend Hoofdstuk,366,Ende heeft in alle die lede gewout.
Onbekend,Onbekend Hoofdstuk,367,"Die vierde colore, als ict versta,"
Onbekend,Onbekend Hoofdstuk,368,Es erande fleuma;
Onbekend,Onbekend Hoofdstuk,369,Ende dese es in elke stede
Onbekend,Onbekend Hoofdstuk,370,"Met der swarter gemingt mede,"
Onbekend,Onbekend Hoofdstuk,371,Ende sijn oec beide int hoeft
Onbekend,Onbekend Hoofdstuk,372,"In I deel, dies geloeft,"
Onbekend,Onbekend Hoofdstuk,373,Ende in I deel oec mede
Onbekend,Onbekend Hoofdstuk,374,"In de blase wel gerede,"
Onbekend,Onbekend Hoofdstuk,375,Ende in I derdendeel oec met
Onbekend,Onbekend Hoofdstuk,376,In de mage mede geset.
Onbekend,Onbekend Hoofdstuk,377,Nu sijn dese humoren in schijn
Onbekend,Onbekend Hoofdstuk,378,Waer si in den mensche sijn;
Onbekend,Onbekend Hoofdstuk,379,Nu willic u vort seggen al
Onbekend,Onbekend Hoofdstuk,380,Weltijt elc regneren sal:
Onbekend,Onbekend Hoofdstuk,381,"Dat bloet, segt Aristotiles,"
Onbekend,Onbekend Hoofdstuk,382,"Dat meest in den lentijn es,"
Onbekend,Onbekend Hoofdstuk,383,"In den mensche, ende wast al stille"
Onbekend,Onbekend Hoofdstuk,384,Van viften dages in sporkille
Onbekend,Onbekend Hoofdstuk,385,"Toten meye also vort,"
Onbekend,Onbekend Hoofdstuk,386,"VIIJ dage, hebbic gehort."
Onbekend,Onbekend Hoofdstuk,387,"Die rode colore, dat verstaet,"
Onbekend,Onbekend Hoofdstuk,388,"In den somer anegaet,"
Onbekend,Onbekend Hoofdstuk,389,Daer dat bloet nemet ende
Onbekend,Onbekend Hoofdstuk,390,Ende duert vort met genende
Onbekend,Onbekend Hoofdstuk,391,"VI dage binnen oegstmaent,"
Onbekend,Onbekend Hoofdstuk,392,"Daer gaet si uute, na mijn verstaen."
Onbekend,Onbekend Hoofdstuk,393,"Daerna die swarte colore begint,"
Onbekend,Onbekend Hoofdstuk,394,"Ende duert, als men bescreven vint,"
Onbekend,Onbekend Hoofdstuk,395,Vort tote alreheilegen misse
Onbekend,Onbekend Hoofdstuk,396,Tote in die maent dage sesse.
Onbekend,Onbekend Hoofdstuk,397,"Darna begint fleuma saen,"
Onbekend,Onbekend Hoofdstuk,398,"Ende duert vort, al sonder waen,"
Onbekend,Onbekend Hoofdstuk,399,Al den winter met gewelt
Onbekend,Onbekend Hoofdstuk,400,Tote dat men sporkille telt
Onbekend,Onbekend Hoofdstuk,401,"V dage, hebbic vernomen,"
Onbekend,Onbekend Hoofdstuk,402,Dar sijn si ten ende comen.
Onbekend,Onbekend Hoofdstuk,403,Noch seldi meer verstaen
Onbekend,Onbekend Hoofdstuk,404,Van desen humoren nu saen:
Onbekend,Onbekend Hoofdstuk,405,Ic segge u mede dat dat bloet
Onbekend,Onbekend Hoofdstuk,406,In den mensche regneren moet
Onbekend,Onbekend Hoofdstuk,407,Van der negender uuren met
Onbekend,Onbekend Hoofdstuk,408,"Die in den nacht es geset,"
Onbekend,Onbekend Hoofdstuk,409,Recht toter derder uuren
Onbekend,Onbekend Hoofdstuk,410,die in den nacht sal geduren.
Onbekend,Onbekend Hoofdstuk,411,Ende gi selt weten hier ter stede
Onbekend,Onbekend Hoofdstuk,412,Dat viere en twintech uuren mede
Onbekend,Onbekend Hoofdstuk,413,"Altoes sijn, des sijt bedacht,"
Onbekend,Onbekend Hoofdstuk,414,Binnen den dage enter nacht.
Onbekend,Onbekend Hoofdstuk,415,"Ende in de rode colore, dats waer,"
