author,chapter,line,text
Onbekend,Onbekend Hoofdstuk,4085,Sijn vlien conste hem niet besluten
Onbekend,Onbekend Hoofdstuk,4086,Doe versagene die van buten
Onbekend,Onbekend Hoofdstuk,4087,Meer dan .vc. tenen iane
Onbekend,Onbekend Hoofdstuk,4088,ltEnde scieden hem vter banegt
Onbekend,Onbekend Hoofdstuk,4089,ltDaer si in vochten doegt
Onbekend,Onbekend Hoofdstuk,4090,ltEnde reden fergute toegt
Onbekend,Onbekend Hoofdstuk,4091,ltSelc met speren selc met swerdegt
Onbekend,Onbekend Hoofdstuk,4092,ltEn halp niet dat hi hem werdegt
Onbekend,Onbekend Hoofdstuk,4093,ltDaer gauen si in dat ghelachgt
Onbekend,Onbekend Hoofdstuk,4094,ltDen riddere meneghen slachgt
Onbekend,Onbekend Hoofdstuk,4095,Ende veldene op die erde
Onbekend,Onbekend Hoofdstuk,4096,Elc met piken of met swerde
Onbekend,Onbekend Hoofdstuk,4097,Gingen houwen ende steken
Onbekend,Onbekend Hoofdstuk,4098,Si souden hem wel gerne wreken
Onbekend,Onbekend Hoofdstuk,4099,Hi hadde hem scaden vele gedaen
Onbekend,Onbekend Hoofdstuk,4100,Mochtsi souden gerne slaen
Onbekend,Onbekend Hoofdstuk,4101,Si ontsagene altemale
Onbekend,Onbekend Hoofdstuk,4102,Mochtsine doden si wisten wale
Onbekend,Onbekend Hoofdstuk,4103,Die andere souden lettel duren
Onbekend,Onbekend Hoofdstuk,4104,Si soudense houden binnen muren
Onbekend,Onbekend Hoofdstuk,4105,Sine mochten hem niet verweren
Onbekend,Onbekend Hoofdstuk,4106,Waest wonder dat si hem gheren
Onbekend,Onbekend Hoofdstuk,4107,Si welfden alle op hem ter vaert
Onbekend,Onbekend Hoofdstuk,4108,Elc noepte met sporen sijn paert
Onbekend,Onbekend Hoofdstuk,4109,Hi was in vresen vander doet
Onbekend,Onbekend Hoofdstuk,4110,Bedi hi hadde die porsse groet
Onbekend,Onbekend Hoofdstuk,4111,Hi moeste vallen op die knien
Onbekend,Onbekend Hoofdstuk,4112,Hine conste die swerde niet dorsien
Onbekend,Onbekend Hoofdstuk,4113,Die hem quamen op dat hoeft
Onbekend,Onbekend Hoofdstuk,4114,Sijn vaste helm was hem gecloeft
Onbekend,Onbekend Hoofdstuk,4115,Dat hi hinc ane weder zide
Onbekend,Onbekend Hoofdstuk,4116,Ferguut wart op ende was onblide
Onbekend,Onbekend Hoofdstuk,4117,Ende hi enbrachierde sinen scilt
Onbekend,Onbekend Hoofdstuk,4118,Dat swert hi vaste in sijn hant hilt
Onbekend,Onbekend Hoofdstuk,4119,Al omtrent hem ginc hi houwen
Onbekend,Onbekend Hoofdstuk,4120,Die noit eer ridder mochte scouwen
Onbekend,Onbekend Hoofdstuk,4121,Mochte daer enen hebben vonden
Onbekend,Onbekend Hoofdstuk,4122,Hem bloeden sere sine wonden
Onbekend,Onbekend Hoofdstuk,4123,Hi hadde verloren die ventalgie
Onbekend,Onbekend Hoofdstuk,4124,Nochtan secgic v sonder falgie
Onbekend,Onbekend Hoofdstuk,4125,Wie dat hem quam binnen slage
Onbekend,Onbekend Hoofdstuk,4126,Hi moester bliuen ouer sine gelage
Onbekend,Onbekend Hoofdstuk,4127,Bedi sloechsine alle van verren
Onbekend,Onbekend Hoofdstuk,4128,Die vander stat mogen merren
Onbekend,Onbekend Hoofdstuk,4129,Te lange eer si hem te helpen comen
Onbekend,Onbekend Hoofdstuk,4130,Blijft hire het sal hem lettel vromen
Onbekend,Onbekend Hoofdstuk,4131,Si daden luden enen horen
Onbekend,Onbekend Hoofdstuk,4132,Om den ridder hebben si toren
Onbekend,Onbekend Hoofdstuk,4133,Datsine niewerinc en saghen
Onbekend,Onbekend Hoofdstuk,4134,Doe sagen si van verren iagen
Onbekend,Onbekend Hoofdstuk,4135,Penneuaren sijn rosside
Onbekend,Onbekend Hoofdstuk,4136,Doe reden si daer wart met nide
Onbekend,Onbekend Hoofdstuk,4137,.ij. seriante haddent geuaen
Onbekend,Onbekend Hoofdstuk,4138,Die van der stat lieten naer slaen
Onbekend,Onbekend Hoofdstuk,4139,Ende bescudden penneuaren
Onbekend,Onbekend Hoofdstuk,4140,Here god hoe serech datsi waren
Onbekend,Onbekend Hoofdstuk,4141,Om den ridder het was wel recht
Onbekend,Onbekend Hoofdstuk,4142,Mettien quam gelopen .i. knecht
Onbekend,Onbekend Hoofdstuk,4143,Ende riep gi heren ghi doet wonder
Onbekend,Onbekend Hoofdstuk,4144,Die witte ridder hi gaet tonder
Onbekend,Onbekend Hoofdstuk,4145,Ic sachne lanc eer te voet
Onbekend,Onbekend Hoofdstuk,4146,Sere te meskieue gi quaet doet
Onbekend,Onbekend Hoofdstuk,4147,Dat ghi hier hout met al vre crachte
Onbekend,Onbekend Hoofdstuk,4148,Indie porsse daer gi gene scachte
Onbekend,Onbekend Hoofdstuk,4149,Ende die glauien siet gherecht
Onbekend,Onbekend Hoofdstuk,4150,Daer es die ridder sere hi vecht
Onbekend,Onbekend Hoofdstuk,4151,Alse dat horden die van binnen
Onbekend,Onbekend Hoofdstuk,4152,Some spraken si nv salmen kinnen
Onbekend,Onbekend Hoofdstuk,4153,Die ghenendech sal sijn ende stout
Onbekend,Onbekend Hoofdstuk,4154,Nv toe en sparen wi ionc no out
Onbekend,Onbekend Hoofdstuk,4155,Varen wi bescudden den goeden man
Onbekend,Onbekend Hoofdstuk,4156,Doe reden si alle gader an
Onbekend,Onbekend Hoofdstuk,4157,Ende scorden die porsse met crachte
Onbekend,Onbekend Hoofdstuk,4158,Daer waren glauien ende scachte
Onbekend,Onbekend Hoofdstuk,4159,Scilde ende helme ghefrotsiert
Onbekend,Onbekend Hoofdstuk,4160,So verre hebben ghepongiert
Onbekend,Onbekend Hoofdstuk,4161,Die van binnen dat sine sagen
Onbekend,Onbekend Hoofdstuk,4162,Den witten ridder al omme hem iagen
Onbekend,Onbekend Hoofdstuk,4163,Ridders knapen vut menegen lande
Onbekend,Onbekend Hoofdstuk,4164,Al dore cloeft tote in die tande
Onbekend,Onbekend Hoofdstuk,4165,Alse ferguut die van binnen vernam
Onbekend,Onbekend Hoofdstuk,4166,Ende dat heme die helpe quam
Onbekend,Onbekend Hoofdstuk,4167,Ende si heme brochten sijn rosside
Onbekend,Onbekend Hoofdstuk,4168,Soe wart hi vtermaten blide
Onbekend,Onbekend Hoofdstuk,4169,Want hi wanet wel hebben verloren
Onbekend,Onbekend Hoofdstuk,4170,Hi sat op ende sloech met sporen
Onbekend,Onbekend Hoofdstuk,4171,Die starke porsse dedi dunnen
Onbekend,Onbekend Hoofdstuk,4172,Waer so hi quam . jn soude ltcunnengt
Onbekend,Onbekend Hoofdstuk,4173,Sine doget vertellen niewer naer
Onbekend,Onbekend Hoofdstuk,4174,Al pijndix mi ic hadt te swaer
Onbekend,Onbekend Hoofdstuk,4175,Die van binnen waren harde blide
Onbekend,Onbekend Hoofdstuk,4176,Datsi dien ridder hadden vten stride
Onbekend,Onbekend Hoofdstuk,4177,Si hadden wel hare ere gedaen
Onbekend,Onbekend Hoofdstuk,4178,Ten riken stene keerden si saen
Onbekend,Onbekend Hoofdstuk,4179,Ne waer lthi keerdegt houde
Onbekend,Onbekend Hoofdstuk,4180,Tsinen castele inden woude
Onbekend,Onbekend Hoofdstuk,4181,Daer hi die ioncfrouwe vant
Onbekend,Onbekend Hoofdstuk,4182,Si ontwapindene alte hant
Onbekend,Onbekend Hoofdstuk,4183,Si weenden vtermaten sere
Onbekend,Onbekend Hoofdstuk,4184,Alsi vonden den ionchere
Onbekend,Onbekend Hoofdstuk,4185,Dore slegen in so meneger stat
Onbekend,Onbekend Hoofdstuk,4186,Si salfdene ende maecten hem .i. bat
Onbekend,Onbekend Hoofdstuk,4187,Si waren vroet van eersatrien
Onbekend,Onbekend Hoofdstuk,4188,Worper in rosen ende acoleien
Onbekend,Onbekend Hoofdstuk,4189,Ende ander cruut datsi daer vonden
Onbekend,Onbekend Hoofdstuk,4190,Omme te sachtene sine wonden
Onbekend,Onbekend Hoofdstuk,4191,In corter stont hadsine genesen
Onbekend,Onbekend Hoofdstuk,4192,Nv latic vanden ridder wesen
Onbekend,Onbekend Hoofdstuk,4193,Int here die coninc galarltentgt
Onbekend,Onbekend Hoofdstuk,4194,Dede houden sijn parlemltentgt
Onbekend,Onbekend Hoofdstuk,4195,Ende sprac gi heren wat te rade
Onbekend,Onbekend Hoofdstuk,4196,Wi hebben gehadt grote scade
Onbekend,Onbekend Hoofdstuk,4197,Ic doge int herte groten toren
Onbekend,Onbekend Hoofdstuk,4198,Mijn volx hebbic vele verloren
Onbekend,Onbekend Hoofdstuk,4199,Gherne wrake ic mi wistic hoe
Onbekend,Onbekend Hoofdstuk,4200,Die grote heren spraken daer toe
Onbekend,Onbekend Hoofdstuk,4201,Here waent v here battalgieren
Onbekend,Onbekend Hoofdstuk,4202,Ende laet ons die stat alselieren
Onbekend,Onbekend Hoofdstuk,4203,Tallen ziden met alre crachte
Onbekend,Onbekend Hoofdstuk,4204,Wi selen v leueren met ltmachtegt
Onbekend,Onbekend Hoofdstuk,4205,Galienen der coninginnen
Onbekend,Onbekend Hoofdstuk,4206,Ende verslaen die van binnen
Onbekend,Onbekend Hoofdstuk,4207,So wat so wi gereken mogen
Onbekend,Onbekend Hoofdstuk,4208,Galarant hi waert in hogen
Onbekend,Onbekend Hoofdstuk,4209,Dat heme sijn volc so wel geliet
Onbekend,Onbekend Hoofdstuk,4210,Staphants dat parlement sciet
Onbekend,Onbekend Hoofdstuk,4211,Men dede roepen dat assaut
Onbekend,Onbekend Hoofdstuk,4212,Daer en bleef knecht no ribaut
Onbekend,Onbekend Hoofdstuk,4213,Sine trocken vore rikenstene
Onbekend,Onbekend Hoofdstuk,4214,Saen verhoret galiene
Onbekend,Onbekend Hoofdstuk,4215,Dattie van buten op haer quamen
Onbekend,Onbekend Hoofdstuk,4216,Hi dede wapinen al te samen
Onbekend,Onbekend Hoofdstuk,4217,Alle die in die stat waren
Onbekend,Onbekend Hoofdstuk,4218,Ende hietse vore die porte varen
Onbekend,Onbekend Hoofdstuk,4219,Bat hem datsi behilden haer ere
Onbekend,Onbekend Hoofdstuk,4220,Want si duchte den coninc sere
Onbekend,Onbekend Hoofdstuk,4221,Die van der stat in corter wilen
Onbekend,Onbekend Hoofdstuk,4222,Some met gysarmen some met bilen
Onbekend,Onbekend Hoofdstuk,4223,Some met piken some met pestelen
Onbekend,Onbekend Hoofdstuk,4224,Si traken alle ten cartelen
Onbekend,Onbekend Hoofdstuk,4225,Des coninx here met groten scaren
Onbekend,Onbekend Hoofdstuk,4226,Quamen vore die stat geuaren
Onbekend,Onbekend Hoofdstuk,4227,Die van binnen scoten gedichte
Onbekend,Onbekend Hoofdstuk,4228,Vutwert pile ende scichte
Onbekend,Onbekend Hoofdstuk,4229,Dat assaut wart daer stuer
Onbekend,Onbekend Hoofdstuk,4230,Die van buten tote ane den muer
Onbekend,Onbekend Hoofdstuk,4231,Sijn gedrongen al met crachte
Onbekend,Onbekend Hoofdstuk,4232,Dat was dien vander stat onsachte
Onbekend,Onbekend Hoofdstuk,4233,Si sagen houwen ende steken
Onbekend,Onbekend Hoofdstuk,4234,Ende hare porte met crachte breken
Onbekend,Onbekend Hoofdstuk,4235,Ende ledren rechten an haer muren
Onbekend,Onbekend Hoofdstuk,4236,Si worden alte na geburen
Onbekend,Onbekend Hoofdstuk,4237,Der ere partien mochts wel messchien
Onbekend,Onbekend Hoofdstuk,4238,Die van der stat worden in dien
Onbekend,Onbekend Hoofdstuk,4239,Datsi die stat op souden geuen
Onbekend,Onbekend Hoofdstuk,4240,Behouden goet ende leuen
Onbekend,Onbekend Hoofdstuk,4241,Des wart galiene geware
Onbekend,Onbekend Hoofdstuk,4242,Si was in herde groten vare
Onbekend,Onbekend Hoofdstuk,4243,Si riep int here enen seriant
Onbekend,Onbekend Hoofdstuk,4244,Ende vragede waer es galarant
Onbekend,Onbekend Hoofdstuk,4245,V here doeten tote mi comen
Onbekend,Onbekend Hoofdstuk,4246,Die coninc hadse saen genomen
Onbekend,Onbekend Hoofdstuk,4247,In enen torre daer si lach
Onbekend,Onbekend Hoofdstuk,4248,Soe was claer alse die dach
Onbekend,Onbekend Hoofdstuk,4249,Hi groetese ende vragede houde
Onbekend,Onbekend Hoofdstuk,4250,Of soene te manne nemen soude
Onbekend,Onbekend Hoofdstuk,4251,Of dat hise winnen moeste met crachte
Onbekend,Onbekend Hoofdstuk,4252,Des en hebt gheene gedachte
Onbekend,Onbekend Hoofdstuk,4253,Sprac galiene nv ten stonden
Onbekend,Onbekend Hoofdstuk,4254,Enen andren raet hebbic vonden
Onbekend,Onbekend Hoofdstuk,4255,Her coninc dorsti v gheninden
Onbekend,Onbekend Hoofdstuk,4256,Met []enegen ridder die gi cont vinden
Onbekend,Onbekend Hoofdstuk,4257,Vanden meesten prise in v lant
Onbekend,Onbekend Hoofdstuk,4258,Her coninc so sekeric v te hant
Onbekend,Onbekend Hoofdstuk,4259,Te bringhene enen campioen
Onbekend,Onbekend Hoofdstuk,4260,Die v beiden sal onder doen
Onbekend,Onbekend Hoofdstuk,4261,Waert so dat hi v mochte verwinnen
Onbekend,Onbekend Hoofdstuk,4262,Her coninc ic wille v wel doen kinnen
Onbekend,Onbekend Hoofdstuk,4263,Soe moesti varen vre straten
Onbekend,Onbekend Hoofdstuk,4264,Altoe so moesti mi doen baten
Onbekend,Onbekend Hoofdstuk,4265,Van alder scade die gi mi doet
Onbekend,Onbekend Hoofdstuk,4266,Maer coninc geuallet v soe goet
Onbekend,Onbekend Hoofdstuk,4267,Dat ghi minen riddere verwont
Onbekend,Onbekend Hoofdstuk,4268,Ic wilde v ter seluer stont
Onbekend,Onbekend Hoofdstuk,4269,Mi vp gheuen ende mine stat
Onbekend,Onbekend Hoofdstuk,4270,Her coninc merct wel dat
Onbekend,Onbekend Hoofdstuk,4271,Ghi moest v here achter doen trecken
Onbekend,Onbekend Hoofdstuk,4272,Ende wi souden ons berecken
Onbekend,Onbekend Hoofdstuk,4273,Minen kempe soudic beiagen
Onbekend,Onbekend Hoofdstuk,4274,So dat ic binnen .xl. dagen
Onbekend,Onbekend Hoofdstuk,4275,V te rechte moeste staen
Onbekend,Onbekend Hoofdstuk,4276,Galarant sprac ic loeft saen
Onbekend,Onbekend Hoofdstuk,4277,Doe ict niet so moetic riesen
Onbekend,Onbekend Hoofdstuk,4278,Alte hant so willic kiesen
Onbekend,Onbekend Hoofdstuk,4279,Minen neuen macedone
Onbekend,Onbekend Hoofdstuk,4280,Hi es mire suster sone
Onbekend,Onbekend Hoofdstuk,4281,Met hem willic steruen ende leuen
Onbekend,Onbekend Hoofdstuk,4282,Ic hope hine sal mi niet begeuen
Onbekend,Onbekend Hoofdstuk,4283,Dese wijch sal sijn vor rikenstene
Onbekend,Onbekend Hoofdstuk,4284,Also sekerict sprac galiene
Onbekend,Onbekend Hoofdstuk,4285,So doe ic oec sprac die coninc
Onbekend,Onbekend Hoofdstuk,4286,Daer en was geen ander dinc
Onbekend,Onbekend Hoofdstuk,4287,Hi dede sijn volc achter varen
Onbekend,Onbekend Hoofdstuk,4288,Alle die gene die met hem waren
Onbekend,Onbekend Hoofdstuk,4289,Waren blide ende te gemake
Onbekend,Onbekend Hoofdstuk,4290,Ende macedone van der sake
Onbekend,Onbekend Hoofdstuk,4291,Dat hi met sinen oem soude vechten
Onbekend,Onbekend Hoofdstuk,4292,Want hi waende hem wel verrechten
Onbekend,Onbekend Hoofdstuk,4293,Ieghen elken man waer dat ware
Onbekend,Onbekend Hoofdstuk,4294,Hi was een riddere openbare
Onbekend,Onbekend Hoofdstuk,4295,Ouer dadich ende stout
Onbekend,Onbekend Hoofdstuk,4296,Van iaren en was hi niet out
Onbekend,Onbekend Hoofdstuk,4297,Hine hadde niet .xxxij. iaer
Onbekend,Onbekend Hoofdstuk,4298,Galiene heuet nv wel swaer
Onbekend,Onbekend Hoofdstuk,4299,Si dede soeken ouer al int lant
Onbekend,Onbekend Hoofdstuk,4300,Daer en was ridder no seriant
Onbekend,Onbekend Hoofdstuk,4301,Die vechten dorste vor die coninglthinnegt
Onbekend,Onbekend Hoofdstuk,4302,Dies was si droeue in haren sinne
Onbekend,Onbekend Hoofdstuk,4303,Sine mochten drinken no eten
Onbekend,Onbekend Hoofdstuk,4304,Here god sprac si dit moetti weten
Onbekend,Onbekend Hoofdstuk,4305,Eer ic werde sconinx wijf
Onbekend,Onbekend Hoofdstuk,4306,Ic sal mi seluen eer nemen tlijf
Onbekend,Onbekend Hoofdstuk,4307,Galiene hadde ene ioncfrouwe
Onbekend,Onbekend Hoofdstuk,4308,Die omme hare hadde groten rouwe
Onbekend,Onbekend Hoofdstuk,4309,Om datsi dreef so groet mesbaer
Onbekend,Onbekend Hoofdstuk,4310,Si sprac vrouwe het gaet mi naer
Onbekend,Onbekend Hoofdstuk,4311,Dat gi dus verslaet v lijf
Onbekend,Onbekend Hoofdstuk,4312,Ic wille v raden sonder blijf
Onbekend,Onbekend Hoofdstuk,4313,Daer v goet af sal ghescien
Onbekend,Onbekend Hoofdstuk,4314,Ic hebbe v dicwile gesien
Onbekend,Onbekend Hoofdstuk,4315,Artuer dieltngt coninc ende sine maisniede
Onbekend,Onbekend Hoofdstuk,4316,Hi hout altoes vrome liede
Onbekend,Onbekend Hoofdstuk,4317,Daer es mijn her gawein
Onbekend,Onbekend Hoofdstuk,4318,Ende metten witten handen ywein
Onbekend,Onbekend Hoofdstuk,4319,Pertseuale ende sagremort
Onbekend,Onbekend Hoofdstuk,4320,Lanceloet ende sijn neue bohort
Onbekend,Onbekend Hoofdstuk,4321,Agrauein ende gariet
Onbekend,Onbekend Hoofdstuk,4322,Mereagis ende erec
Onbekend,Onbekend Hoofdstuk,4323,Mijn her keye ende leyuale
Onbekend,Onbekend Hoofdstuk,4324,Ende laquis van portegale
Onbekend,Onbekend Hoofdstuk,4325,Ende walewein .i. ridder van prise
Onbekend,Onbekend Hoofdstuk,4326,Ende menech ander ridder wise
Onbekend,Onbekend Hoofdstuk,4327,Die te nomene waren te lanc
Onbekend,Onbekend Hoofdstuk,4328,Daer soudic varen wistijs mi danc
Onbekend,Onbekend Hoofdstuk,4329,Bidden aerture den coninc rike
Onbekend,Onbekend Hoofdstuk,4330,Ende genoeueren oetmoedelike
Onbekend,Onbekend Hoofdstuk,4331,Der coninginnen datsi bade
Onbekend,Onbekend Hoofdstuk,4332,Riddere die ons soccoers dade
Onbekend,Onbekend Hoofdstuk,4333,Ende die v holpe vter noet
Onbekend,Onbekend Hoofdstuk,4334,Want v dogen es te groet
Onbekend,Onbekend Hoofdstuk,4335,Dat es mi van herten leet
Onbekend,Onbekend Hoofdstuk,4336,Dat v so campelike steet
Onbekend,Onbekend Hoofdstuk,4337,Doe sprac galiene ter ioncfrouwen
Onbekend,Onbekend Hoofdstuk,4338,Lunette du hebs mi met trouwen
Onbekend,Onbekend Hoofdstuk,4339,In allen stonden oit gedient
Onbekend,Onbekend Hoofdstuk,4340,Ter noet prijst elc sinen vrient
Onbekend,Onbekend Hoofdstuk,4341,Op enen muel werpt .i. ghereide
Onbekend,Onbekend Hoofdstuk,4342,Ende vaert te houe sonder beide
Onbekend,Onbekend Hoofdstuk,4343,Bidt arture dat hem mijns ontfarme
Onbekend,Onbekend Hoofdstuk,4344,Si dwanc lunetten in haer arme
Onbekend,Onbekend Hoofdstuk,4345,Ende bat hare datsi hulpe sochte
Onbekend,Onbekend Hoofdstuk,4346,Ende si haer haeste datsi mochte
Onbekend,Onbekend Hoofdstuk,4347,Die .xl. dage begonnen naken
Onbekend,Onbekend Hoofdstuk,4348,Lunette ghinc hare wech maken
Onbekend,Onbekend Hoofdstuk,4349,Tote ghincestre es si comen
Onbekend,Onbekend Hoofdstuk,4350,Daer si den coninc heft vernomen
Onbekend,Onbekend Hoofdstuk,4351,Si beette ende ginc vp in die zale
Onbekend,Onbekend Hoofdstuk,4352,Daer mense ontfinc herde wale
Onbekend,Onbekend Hoofdstuk,4353,Die coninc selue festerese sere
Onbekend,Onbekend Hoofdstuk,4354,Lunette sprac lieue here
Onbekend,Onbekend Hoofdstuk,4355,Dat v god lone waeltngtt mi verhogen
Onbekend,Onbekend Hoofdstuk,4356,Es hier ridder die soude moghen
Onbekend,Onbekend Hoofdstuk,4357,Varen met mi tote rikenstene
Onbekend,Onbekend Hoofdstuk,4358,Daer es mijn ioncfrouwe galiene
Onbekend,Onbekend Hoofdstuk,4359,Beset lten vangt enen coninc
Onbekend,Onbekend Hoofdstuk,4360,Here omme gheen ander dinc
Onbekend,Onbekend Hoofdstuk,4361,Dan hise gerne name te wiue
Onbekend,Onbekend Hoofdstuk,4362,Galiene swert bi haren liue
Onbekend,Onbekend Hoofdstuk,4363,Watsi doet sone nemes niet
Onbekend,Onbekend Hoofdstuk,4364,Here so eser met ghesciet
Onbekend,Onbekend Hoofdstuk,4365,Si moet soeken campioen
Onbekend,Onbekend Hoofdstuk,4366,Die den coninc moet onder doen
Onbekend,Onbekend Hoofdstuk,4367,Ende enen sire suster sone
Onbekend,Onbekend Hoofdstuk,4368,Diemen hetet macedone
Onbekend,Onbekend Hoofdstuk,4369,Die goet ridder es van sire hant
Onbekend,Onbekend Hoofdstuk,4370,Die coninc artur sprac thant
Onbekend,Onbekend Hoofdstuk,4371,Ioncfrouwe gi dunct mi tongemake
Onbekend,Onbekend Hoofdstuk,4372,Dats mi leet van derre sake
Onbekend,Onbekend Hoofdstuk,4373,En salic v connen berechten
Onbekend,Onbekend Hoofdstuk,4374,Hiers niemen die voer v dar vechten
Onbekend,Onbekend Hoofdstuk,4375,No die dauonture bestonden
Onbekend,Onbekend Hoofdstuk,4376,Die ridders van der tafelronden
Onbekend,Onbekend Hoofdstuk,4377,Alle die beste die met mi waren
Onbekend,Onbekend Hoofdstuk,4378,Sijn enen ridder soeken geuaren
Onbekend,Onbekend Hoofdstuk,4379,Die si gerne te houe brochten
Onbekend,Onbekend Hoofdstuk,4380,Quame iemen weder dieltngt wi mochten
Onbekend,Onbekend Hoofdstuk,4381,Her bidden ic wilt gerne doen
Onbekend,Onbekend Hoofdstuk,4382,Dat lthi hier wordegt v kempioen
Onbekend,Onbekend Hoofdstuk,4383,Dus bleef lunette metten coninc
Onbekend,Onbekend Hoofdstuk,4384,So lange dattie tijt wech ginc
Onbekend,Onbekend Hoofdstuk,4385,Die .xl. dage begonsten naken
Onbekend,Onbekend Hoofdstuk,4386,Here sprac lunette ic moet mi maken
Onbekend,Onbekend Hoofdstuk,4387,Te mire ioncfrouwen sonder beide
Onbekend,Onbekend Hoofdstuk,4388,Wat holpt dat ic vele seide
Onbekend,Onbekend Hoofdstuk,4389,Met mi geen ridder weder keert
Onbekend,Onbekend Hoofdstuk,4390,Mire vrouwen hebbic onteert
Onbekend,Onbekend Hoofdstuk,4391,Hare lant wert hare al genomen
Onbekend,Onbekend Hoofdstuk,4392,Ic behiet hare ic soude comen
Onbekend,Onbekend Hoofdstuk,4393,Ende ridder bringen wel te tide
Onbekend,Onbekend Hoofdstuk,4394,Die hare soude helpen vten stride
Onbekend,Onbekend Hoofdstuk,4395,Nv sie ic wel waer wert het gheet
Onbekend,Onbekend Hoofdstuk,4396,Die coninc sprac dat es mi leet
Onbekend,Onbekend Hoofdstuk,4397,Also motic sijn met ihesu christe
Onbekend,Onbekend Hoofdstuk,4398,In goeden sticken ic ne wiste
Onbekend,Onbekend Hoofdstuk,4399,Dat mijn hof dus was versceden
Onbekend,Onbekend Hoofdstuk,4400,Die rike god moet v geleden
Onbekend,Onbekend Hoofdstuk,4401,Ende betren vwen aerbeit
Onbekend,Onbekend Hoofdstuk,4402,Lunette wenet ende screit
Onbekend,Onbekend Hoofdstuk,4403,Ende si dreef alte groet mesbaer
Onbekend,Onbekend Hoofdstuk,4404,Si sloech haer hande si trac haer haer
Onbekend,Onbekend Hoofdstuk,4405,Om die doet si menech werf riep
Onbekend,Onbekend Hoofdstuk,4406,Tote haren mule dat si liep
Onbekend,Onbekend Hoofdstuk,4407,Met ere scorgien ghinc soese driuen
Onbekend,Onbekend Hoofdstuk,4408,Sine wilde te houe niet langer bliuen
Onbekend,Onbekend Hoofdstuk,4409,Si maecte haer wech met groter iacht
Onbekend,Onbekend Hoofdstuk,4410,Ende heft gereden dach ende nacht
Onbekend,Onbekend Hoofdstuk,4411,Om hare ioncfrouwen si sere vreest
Onbekend,Onbekend Hoofdstuk,4412,Dus es si comen int foreest
Onbekend,Onbekend Hoofdstuk,4413,Daer die witte ridder was
Onbekend,Onbekend Hoofdstuk,4414,Hi ginc hem meyen in dat gras
Onbekend,Onbekend Hoofdstuk,4415,Alse dauenture soude gescien
Onbekend,Onbekend Hoofdstuk,4416,Lunetten heft hi saen versien
Onbekend,Onbekend Hoofdstuk,4417,Die vter maten serich quam
Onbekend,Onbekend Hoofdstuk,4418,In sinen aerme hise nam
Onbekend,Onbekend Hoofdstuk,4419,Ende dwancse ane heme vriendelikeltngt
Onbekend,Onbekend Hoofdstuk,4420,Hi seide ioncfrouwe omme gode den riken
Onbekend,Onbekend Hoofdstuk,4421,Waer omme hebdi dit mesbaer
Onbekend,Onbekend Hoofdstuk,4422,Betet af ende comet naer
Onbekend,Onbekend Hoofdstuk,4423,Men sal v te gemake doen
Onbekend,Onbekend Hoofdstuk,4424,Ghine hebt knape no garsoen
Onbekend,Onbekend Hoofdstuk,4425,Hets nacht waer wildi tameer
Onbekend,Onbekend Hoofdstuk,4426,Ridder seitsoe ghi doet mi seer
Onbekend,Onbekend Hoofdstuk,4427,Al lustes v ic en hebbe geen spel
Onbekend,Onbekend Hoofdstuk,4428,Laet mi varen so doedi wel
Onbekend,Onbekend Hoofdstuk,4429,Want ic ben sere tongemakeltngt
Onbekend,Onbekend Hoofdstuk,4430,Ferguut sprac omme wat saken
Onbekend,Onbekend Hoofdstuk,4431,Sidi van iemen te blouwen
Onbekend,Onbekend Hoofdstuk,4432,Dat ware mi leet bi mire trouwen
Onbekend,Onbekend Hoofdstuk,4433,Of heft v ieman messeit
Onbekend,Onbekend Hoofdstuk,4434,Waer omme ghi so sere screit
Onbekend,Onbekend Hoofdstuk,4435,Ay lieue vrient wats mi gesciet
Onbekend,Onbekend Hoofdstuk,4436,Al seidict v en holpe mi niet
Onbekend,Onbekend Hoofdstuk,4437,Ic mochter mijn zeer met vernuwen
Onbekend,Onbekend Hoofdstuk,4438,Haren muel so ghincsi bluwen
Onbekend,Onbekend Hoofdstuk,4439,Dat heme mach rouwen dat hi ltleeftgt
Onbekend,Onbekend Hoofdstuk,4440,Ferguut begrepen heeft
Onbekend,Onbekend Hoofdstuk,4441,Haren breidel in sijn hande
Onbekend,Onbekend Hoofdstuk,4442,Hi sprac ioncfrowe god geue mi scande
Onbekend,Onbekend Hoofdstuk,4443,In sal weten wat v mescomt
Onbekend,Onbekend Hoofdstuk,4444,Eer ghi heden van mi comt
Onbekend,Onbekend Hoofdstuk,4445,Ofte glthi selt hiergt houden stille
Onbekend,Onbekend Hoofdstuk,4446,Tote morgen vroe eist v wille
Onbekend,Onbekend Hoofdstuk,4447,Soe oltntdectgt mi v mesquame
Onbekend,Onbekend Hoofdstuk,4448,Lunette sprac here vwen name
Onbekend,Onbekend Hoofdstuk,4449,En wetic niet no wie gi sijt
Onbekend,Onbekend Hoofdstuk,4450,Laet mi varen hets meer dan tijt
Onbekend,Onbekend Hoofdstuk,4451,Inden hemel sie ic die sterren
Onbekend,Onbekend Hoofdstuk,4452,Ghi doet mi hier te lange merren
Onbekend,Onbekend Hoofdstuk,4453,Die sonne es gegaen onder
Onbekend,Onbekend Hoofdstuk,4454,Ferguut sprac gi segt wonder
Onbekend,Onbekend Hoofdstuk,4455,Ghine comt van mi heden mere
Onbekend,Onbekend Hoofdstuk,4456,Ghine ondect mi van vwen sere
Onbekend,Onbekend Hoofdstuk,4457,Waer omme ghi v dus verslaet
Onbekend,Onbekend Hoofdstuk,4458,Lunette sprac ridder dat verstaet
Onbekend,Onbekend Hoofdstuk,4459,Dat emmer sijn moet dat moet sijn
Onbekend,Onbekend Hoofdstuk,4460,Here ic ben met ere ioncfrouwe ltfijngt
Onbekend,Onbekend Hoofdstuk,4461,Die in hare herte heft groten rouwe
Onbekend,Onbekend Hoofdstuk,4462,ltDat iammer es bi miere trouwegt
Onbekend,Onbekend Hoofdstuk,4463,Also ic v mach tellen
Onbekend,Onbekend Hoofdstuk,4464,Een coninc heftse doen quellen
Onbekend,Onbekend Hoofdstuk,4465,Sine wille niet volgen sinen rade
Onbekend,Onbekend Hoofdstuk,4466,Hi heft hare gedaen grote scade
Onbekend,Onbekend Hoofdstuk,4467,Wilde sine ontfaen ouer here
Onbekend,Onbekend Hoofdstuk,4468,Ende nemen te manne hi dade haer ere
Onbekend,Onbekend Hoofdstuk,4469,Dat heft hi hare dicke doen bieden
Onbekend,Onbekend Hoofdstuk,4470,Met hem ende met andren lieden
Onbekend,Onbekend Hoofdstuk,4471,Maer mijn ioncfrouwe en wils niet horen
Onbekend,Onbekend Hoofdstuk,4472,Bedie heft soe scade ende toren
Onbekend,Onbekend Hoofdstuk,4473,Ende heft hare mengen man genomen
Onbekend,Onbekend Hoofdstuk,4474,Al toe eist nv op hare comen
Onbekend,Onbekend Hoofdstuk,4475,Hi heefse beseten in .i. haer ltstadegt
Onbekend,Onbekend Hoofdstuk,4476,In tende wart mijn ioncfrouwe te rade
Onbekend,Onbekend Hoofdstuk,4477,Bi hars selfs moet core
Onbekend,Onbekend Hoofdstuk,4478,Si dede den coninc haer comen vore
Onbekend,Onbekend Hoofdstuk,4479,Ende seide si soude ridder bringen
Onbekend,Onbekend Hoofdstuk,4480,Die daer toe soude den coninc dwingen
Onbekend,Onbekend Hoofdstuk,4481,Name wat ridder so hi mochte
Onbekend,Onbekend Hoofdstuk,4482,Vinden in sijn lant ende brochte
Onbekend,Onbekend Hoofdstuk,4483,Hare riddere soudse bede onder doen
Onbekend,Onbekend Hoofdstuk,4484,Dien coninc ende sinen campioen
Onbekend,Onbekend Hoofdstuk,4485,Gheuielt oec dat hijs niet en dade
Onbekend,Onbekend Hoofdstuk,4486,Den coninc soudsoe hare stade
Onbekend,Onbekend Hoofdstuk,4487,Ende al haer lant op moeten geuen
Onbekend,Onbekend Hoofdstuk,4488,Haer seluen mach hi nemen tleuen
Onbekend,Onbekend Hoofdstuk,4489,Waert sijn wille ende gedroeget sijn raet
Onbekend,Onbekend Hoofdstuk,4490,Geuielt oec den coninc quaet
Onbekend,Onbekend Hoofdstuk,4491,Soe dat hi verwonnen ware
