author,chapter,line,text
Onbekend,Onbekend Hoofdstuk,1,Die coninc aertuer hadde hof
Onbekend,Onbekend Hoofdstuk,2,Gehouden daer hi groten lof
Onbekend,Onbekend Hoofdstuk,3,Eens sinxendages hadde ontfaen
Onbekend,Onbekend Hoofdstuk,4,Ter borch die hiet caradigaen
Onbekend,Onbekend Hoofdstuk,5,Daer waren ridders houesch ende goet
Onbekend,Onbekend Hoofdstuk,6,Ende van ridderscepe vroet
Onbekend,Onbekend Hoofdstuk,7,Die ic wel soude connen nomen
Onbekend,Onbekend Hoofdstuk,8,Waendic dat mi soude vromen
Onbekend,Onbekend Hoofdstuk,9,Bedi alsic hebbe horen saghen
Onbekend,Onbekend Hoofdstuk,10,Ende dauonturen onder vragen
Onbekend,Onbekend Hoofdstuk,11,Daer was mijn here gawein
Onbekend,Onbekend Hoofdstuk,12,Ende sijn geselle mijn her ywein
Onbekend,Onbekend Hoofdstuk,13,Pertseuale ende lanceloet
Onbekend,Onbekend Hoofdstuk,14,Her keye ende sagremort
Onbekend,Onbekend Hoofdstuk,15,Ende menech ander hoge man
Onbekend,Onbekend Hoofdstuk,16,Die ic genomen niet en can
Onbekend,Onbekend Hoofdstuk,17,Maer na etene worpsi ten spele
Onbekend,Onbekend Hoofdstuk,18,Scaec ende worptafle in die zele
Onbekend,Onbekend Hoofdstuk,19,Selc telde andren sine auonture
Onbekend,Onbekend Hoofdstuk,20,Die heme worden was te sure
Onbekend,Onbekend Hoofdstuk,21,Mijn her gawein nam bider hant
Onbekend,Onbekend Hoofdstuk,22,Sinen geselle die hi noit vant
Onbekend,Onbekend Hoofdstuk,23,Mijn her yweine bloede no loes
Onbekend,Onbekend Hoofdstuk,24,Sint dat hine eerstwerf coes
Onbekend,Onbekend Hoofdstuk,25,Twee gesellen noit eer
Onbekend,Onbekend Hoofdstuk,26,Ne minden mallijc andren meer
Onbekend,Onbekend Hoofdstuk,27,Elc coes andren van hen beden
Onbekend,Onbekend Hoofdstuk,28,Hem .ij. conste niemen versceden
Onbekend,Onbekend Hoofdstuk,29,Si saten neder ende spraken
Onbekend,Onbekend Hoofdstuk,30,Beide gader van menegen saken
Onbekend,Onbekend Hoofdstuk,31,Die hen beiden ltsach.gt gescien
Onbekend,Onbekend Hoofdstuk,32,Die coninc es comen binnen dien
Onbekend,Onbekend Hoofdstuk,33,Ende viel neder tusschen hem lttweengt
Onbekend,Onbekend Hoofdstuk,34,Mallic spranc op sine been
Onbekend,Onbekend Hoofdstuk,35,Ende seiden wel moetti comen sijn
Onbekend,Onbekend Hoofdstuk,36,Here wildi sitten .i. lettelkijn
Onbekend,Onbekend Hoofdstuk,37,Hier bi ons so sit hier neder
Onbekend,Onbekend Hoofdstuk,38,Neen ic seit hi ic sie tweder
Onbekend,Onbekend Hoofdstuk,39,Scone ende claer. in wille niet dagen
Onbekend,Onbekend Hoofdstuk,40,Bedi ic wille varen jaghen
Onbekend,Onbekend Hoofdstuk,41,Int foreest van goriende
Onbekend,Onbekend Hoofdstuk,42,Den witten hert die noit en kende
Onbekend,Onbekend Hoofdstuk,43,Dat grote geloep van minen honden
Onbekend,Onbekend Hoofdstuk,44,Hi saelt weten ane dien stonden
Onbekend,Onbekend Hoofdstuk,45,Canicken te velde belopen
Onbekend,Onbekend Hoofdstuk,46,Ic wane wel hi saelt becopen
Onbekend,Onbekend Hoofdstuk,47,Ic wille ghi minen wille doet
Onbekend,Onbekend Hoofdstuk,48,Sprac der gawein het dunct mi goet
Onbekend,Onbekend Hoofdstuk,49,Here dat gi hebt geseit
Onbekend,Onbekend Hoofdstuk,50,Alse ghi wilt wi sijn bereit
Onbekend,Onbekend Hoofdstuk,51,Die knapen sprongen op ter vaert
Onbekend,Onbekend Hoofdstuk,52,Elc sadelde sijns heren paert
Onbekend,Onbekend Hoofdstuk,53,Ende torsten hare somers sciere
Onbekend,Onbekend Hoofdstuk,54,Ende worper op hare fortsiere
Onbekend,Onbekend Hoofdstuk,55,Dat harnasch was ltghereet snellijcgt
Onbekend,Onbekend Hoofdstuk,56,Die coninc spranc op hastelltijcgt
Onbekend,Onbekend Hoofdstuk,57,Hi was .i. scone man ende groet
Onbekend,Onbekend Hoofdstuk,58,Noit was coninc sijn genoet
Onbekend,Onbekend Hoofdstuk,59,Noch die bet scheen .i. edel man
Onbekend,Onbekend Hoofdstuk,60,Selue hi enen horen nam
Onbekend,Onbekend Hoofdstuk,61,Ende maecte heme vter stat wel houde
Onbekend,Onbekend Hoofdstuk,62,Want hi wilde sijn te woude
Onbekend,Onbekend Hoofdstuk,63,Heme volchden alle die baroene
Onbekend,Onbekend Hoofdstuk,64,Dier daer menech was ende coene
Onbekend,Onbekend Hoofdstuk,65,Mijn her gawein die wel geraect
Onbekend,Onbekend Hoofdstuk,66,Was ende van hoefscheden volmaect
Onbekend,Onbekend Hoofdstuk,67,Hi voer neuen der coninginne ltfinegt
Onbekend,Onbekend Hoofdstuk,68,Die enen mantel van hermine
Onbekend,Onbekend Hoofdstuk,69,Hadde omme hare dor dat sonneschijn
Onbekend,Onbekend Hoofdstuk,70,Die lijste die was sabelijn
Onbekend,Onbekend Hoofdstuk,71,Die al omme den mantel hinc
Onbekend,Onbekend Hoofdstuk,72,Noit man sach so rikelijc dinc
Onbekend,Onbekend Hoofdstuk,73,Hens niemen diet volprisen mochte
Onbekend,Onbekend Hoofdstuk,74,Iegen die scepsterigge diet wrochte
Onbekend,Onbekend Hoofdstuk,75,Dus quamse ridende ant foreest
Onbekend,Onbekend Hoofdstuk,76,Die coninc was die alre meest
Onbekend,Onbekend Hoofdstuk,77,Meinde den hert ende sach op ende tale
Onbekend,Onbekend Hoofdstuk,78,Doe riep hi mijn her pertseuale
Onbekend,Onbekend Hoofdstuk,79,Ende sine iagers datsi quamen
Onbekend,Onbekend Hoofdstuk,80,Mettien si den hert vernamen
Onbekend,Onbekend Hoofdstuk,81,Buten bossche op .i. fonteine
Onbekend,Onbekend Hoofdstuk,82,Die coninc riep mijn her yweine
Onbekend,Onbekend Hoofdstuk,83,Ende men ontcoppelde die honde
Onbekend,Onbekend Hoofdstuk,84,Elc sette horen ten monde
Onbekend,Onbekend Hoofdstuk,85,Si voeren sere daer waert
Onbekend,Onbekend Hoofdstuk,86,Die hert spranc op ende wart veruart
Onbekend,Onbekend Hoofdstuk,87,Ende vloe neuen ere riuieren
Onbekend,Onbekend Hoofdstuk,88,Doe liet die coninc verlaisieren
Onbekend,Onbekend Hoofdstuk,89,Die honde maecten groet geluut
Onbekend,Onbekend Hoofdstuk,90,Doe hadden die iagers haer deduut
Onbekend,Onbekend Hoofdstuk,91,Si iageden wel .iij. grote milen
Onbekend,Onbekend Hoofdstuk,92,Ende scoter naer met haren pylen
Onbekend,Onbekend Hoofdstuk,93,Doe spranc hi in .i. water diep
Onbekend,Onbekend Hoofdstuk,94,Dat daer neuen den woude liep
Onbekend,Onbekend Hoofdstuk,95,Ende barch hem in .i. lanc cruut
Onbekend,Onbekend Hoofdstuk,96,Die honde maecten groet geluut
Onbekend,Onbekend Hoofdstuk,97,Die ridders bliesen diere na quamen
Onbekend,Onbekend Hoofdstuk,98,Alsi den hert int cruut vernamen
Onbekend,Onbekend Hoofdstuk,99,Redensire na metter vaert
Onbekend,Onbekend Hoofdstuk,100,Die hert spranc op ende wart veruaert
Onbekend,Onbekend Hoofdstuk,101,Ten bossche waert hi hem onstal
Onbekend,Onbekend Hoofdstuk,102,Ende liep in een groet dal
Onbekend,Onbekend Hoofdstuk,103,Die jagers wordens alle gram
Onbekend,Onbekend Hoofdstuk,104,Elc doe enen hont nam
Onbekend,Onbekend Hoofdstuk,105,Ende sijn na den hert glthedokengt
Onbekend,Onbekend Hoofdstuk,106,Die bracken hebben[- .] ltegtcht verroken
Onbekend,Onbekend Hoofdstuk,107,Ende maecten een groet gedalsch
Onbekend,Onbekend Hoofdstuk,108,Die iagers waren herde gemalsch
Onbekend,Onbekend Hoofdstuk,109,Mallijc blies met sinen horne
Onbekend,Onbekend Hoofdstuk,110,Het was herde goet te horne
Onbekend,Onbekend Hoofdstuk,111,Vandien honden dat geloep
Onbekend,Onbekend Hoofdstuk,112,Maer die hert hem allen ontsltloepgt
Onbekend,Onbekend Hoofdstuk,113,Ende verre die honde hi leet
Onbekend,Onbekend Hoofdstuk,114,Doe swoer die coninc enen eet
Onbekend,Onbekend Hoofdstuk,115,Dat hine sal laten die jacht
Onbekend,Onbekend Hoofdstuk,116,Dore bosch dor hage dach no nacht
Onbekend,Onbekend Hoofdstuk,117,Tes hi geuaen sal hebben den hert
Onbekend,Onbekend Hoofdstuk,118,Wien soet te pinen wert
Onbekend,Onbekend Hoofdstuk,119,Doe waren die ridders alle blide
Onbekend,Onbekend Hoofdstuk,120,Ende hi riep ane ene zide
Onbekend,Onbekend Hoofdstuk,121,Alte gader sine man
Onbekend,Onbekend Hoofdstuk,122,Enen groten cop hi nam
Onbekend,Onbekend Hoofdstuk,123,In sine hant van roden goude
Onbekend,Onbekend Hoofdstuk,124,Ende seide dat hine hebben soude
Onbekend,Onbekend Hoofdstuk,125,Die den witten hert mochte vaen
Onbekend,Onbekend Hoofdstuk,126,Doe ginc elc met sporen slaen
Onbekend,Onbekend Hoofdstuk,127,Naden hert soe hi best mochte
Onbekend,Onbekend Hoofdstuk,128,Die hert vloe sere want hi dltogtchte
Onbekend,Onbekend Hoofdstuk,129,Die vrese sere van der doet
Onbekend,Onbekend Hoofdstuk,130,Deen blies dander scoet
Onbekend,Onbekend Hoofdstuk,131,Hi liep al gapende in dat wout
Onbekend,Onbekend Hoofdstuk,132,Heme volchde menech ridder stout
Onbekend,Onbekend Hoofdstuk,133,Die honde daden hem groten pant
Onbekend,Onbekend Hoofdstuk,134,Hi liep neder doe al te hant
Onbekend,Onbekend Hoofdstuk,135,In enen broec hem ginc daer dorsten
Onbekend,Onbekend Hoofdstuk,136,Van hitten was hi bi na te borsten
Onbekend,Onbekend Hoofdstuk,137,Doe quam pertseuale ter vaert
Onbekend,Onbekend Hoofdstuk,138,Ridende op .i. hoge paert
Onbekend,Onbekend Hoofdstuk,139,Dat hi den roden Ridder nam
Onbekend,Onbekend Hoofdstuk,140,Den hert iagende hi vernam
Onbekend,Onbekend Hoofdstuk,141,Sinen spiet heft hi verdregen
Onbekend,Onbekend Hoofdstuk,142,Ende waenden wel hebben geslegen
Onbekend,Onbekend Hoofdstuk,143,Maer hine wilde noch steruen niet
Onbekend,Onbekend Hoofdstuk,144,In een dal hi zeere ltvlietgt
Onbekend,Onbekend Hoofdstuk,145,Ne waer mijn her pertseual
Onbekend,Onbekend Hoofdstuk,146,Volchde heme al ouer al
Onbekend,Onbekend Hoofdstuk,147,Die hert voren .i. deel hem lust
Onbekend,Onbekend Hoofdstuk,148,Te lopene. hi was gherust
Onbekend,Onbekend Hoofdstuk,149,Des was die coninc lterre dangt
Onbekend,Onbekend Hoofdstuk,150,Hi was moede ende sine man
Onbekend,Onbekend Hoofdstuk,151,Wilden weder te samen gaen
Onbekend,Onbekend Hoofdstuk,152,Den hert en constense niet geuaen
Onbekend,Onbekend Hoofdstuk,153,Die coninc hefse wel gehort
Onbekend,Onbekend Hoofdstuk,154,Een lettelkijn reet hi bet vort
Onbekend,Onbekend Hoofdstuk,155,Ende seit dat hi nemmermeer ltbi karitatengt
Onbekend,Onbekend Hoofdstuk,156,Goet doelttgt die den hert ltsal latengt
Onbekend,Onbekend Hoofdstuk,157,Doe reden si mee dan haren telt
Onbekend,Onbekend Hoofdstuk,158,Naden hert die vor hem helt
Onbekend,Onbekend Hoofdstuk,159,Ende sere liep dan si consten gehogen
Onbekend,Onbekend Hoofdstuk,160,Si hilden heme ouer bedrogen
Onbekend,Onbekend Hoofdstuk,161,Alle die gene diere waren
Onbekend,Onbekend Hoofdstuk,162,Die hert was hem allen ontfaren
Onbekend,Onbekend Hoofdstuk,163,Wel na groter milen twee
Onbekend,Onbekend Hoofdstuk,164,Ic wane sine hadden nemmermee
Onbekend,Onbekend Hoofdstuk,165,Gheuaen. si hadden verloren
Onbekend,Onbekend Hoofdstuk,166,Die coninc hadde geweest versworen
Onbekend,Onbekend Hoofdstuk,167,Maer dore mijn her pertseuale
Onbekend,Onbekend Hoofdstuk,168,Die hem volget berch ende dale
Onbekend,Onbekend Hoofdstuk,169,Die hert ontliep hem vten woude
Onbekend,Onbekend Hoofdstuk,170,Wilde pertseuale of en woude
Onbekend,Onbekend Hoofdstuk,171,Int wout van gladone hi hem dede
Onbekend,Onbekend Hoofdstuk,172,Ende pertseuale algader mede
Onbekend,Onbekend Hoofdstuk,173,Hi liep op den foreeste sciere
Onbekend,Onbekend Hoofdstuk,174,Drie grote milen so dede hi viere
Onbekend,Onbekend Hoofdstuk,175,Ende maecte hem in .i. vremt lant
Onbekend,Onbekend Hoofdstuk,176,Daermen gode niet en kant
Onbekend,Onbekend Hoofdstuk,177,Dat lant heet indegale
Onbekend,Onbekend Hoofdstuk,178,Een bracke liep met pertseuale
Onbekend,Onbekend Hoofdstuk,179,Diet spoer vanden hert hilt
Onbekend,Onbekend Hoofdstuk,180,Doe sach percheuael waer hi hilt
Onbekend,Onbekend Hoofdstuk,181,Int ende van ere holre straten
Onbekend,Onbekend Hoofdstuk,182,Doe riep percheuale vtermaten
Onbekend,Onbekend Hoofdstuk,183,Lude ende vertroeste sinen hont
Onbekend,Onbekend Hoofdstuk,184,Die tonge hinc hem vter mont
Onbekend,Onbekend Hoofdstuk,185,Hi was herde moede ende slanc
Onbekend,Onbekend Hoofdstuk,186,Nochtan verlichte hi hem ende spranc
Onbekend,Onbekend Hoofdstuk,187,Ende tande den hert in sijn vleesch
Onbekend,Onbekend Hoofdstuk,188,Pertseuale lthads sinen eeschgt
Onbekend,Onbekend Hoofdstuk,189,Ende riep en laetten di niet ontgaen
Onbekend,Onbekend Hoofdstuk,190,Ic comdi bescudden saen
Onbekend,Onbekend Hoofdstuk,191,Doe spranc in .i. marasch te handen
Onbekend,Onbekend Hoofdstuk,192,Die hert ende die hont metten tanden
Onbekend,Onbekend Hoofdstuk,193,Dwanckene ende maecten moede
Onbekend,Onbekend Hoofdstuk,194,Thoeft was hem al roet van bloede
Onbekend,Onbekend Hoofdstuk,195,Het ginc den hert al vten spele
Onbekend,Onbekend Hoofdstuk,196,Hi doec ende ontede sijn kele
Onbekend,Onbekend Hoofdstuk,197,Nv mach hi drinken dorst hem sere
Onbekend,Onbekend Hoofdstuk,198,Maer hem liep des waters mere
Onbekend,Onbekend Hoofdstuk,199,Dan heme lief was in sine kele
Onbekend,Onbekend Hoofdstuk,200,Hi spranc vte hi hads te vele
Onbekend,Onbekend Hoofdstuk,201,Ende waende wel sinen wech gaen
Onbekend,Onbekend Hoofdstuk,202,Maer die bracke greepen saen
Onbekend,Onbekend Hoofdstuk,203,Doe spranc hi weder wel sciere
Onbekend,Onbekend Hoofdstuk,204,Herde diep indie riuiere
Onbekend,Onbekend Hoofdstuk,205,Ende voer in gront ende verdranc
Onbekend,Onbekend Hoofdstuk,206,Doe quam hi bouen eer iet lanc
Onbekend,Onbekend Hoofdstuk,207,Die bracke dede hem groten pant
Onbekend,Onbekend Hoofdstuk,208,Hi swam na ende tracken ant lant
Onbekend,Onbekend Hoofdstuk,209,Doe quam pertcheuale toe geslegen
Onbekend,Onbekend Hoofdstuk,210,Ende vint den hert ant lant gedreuen
Onbekend,Onbekend Hoofdstuk,211,Hem wonderde dat hi was doet
Onbekend,Onbekend Hoofdstuk,212,Van sinen orsse dat hi scoet
Onbekend,Onbekend Hoofdstuk,213,Ende blies .iij. werf ende dede verstaen
Onbekend,Onbekend Hoofdstuk,214,Dat hi den hert hadde geuaen
Onbekend,Onbekend Hoofdstuk,215,Hi wiste meer ane dat geblas
Onbekend,Onbekend Hoofdstuk,216,Dat enech ridder diere was
Onbekend,Onbekend Hoofdstuk,217,Die coninc kende sinen horen
Onbekend,Onbekend Hoofdstuk,218,Hi riep ende noepede dors met sporen
Onbekend,Onbekend Hoofdstuk,219,Die hert es geuaen ic hort wale
Onbekend,Onbekend Hoofdstuk,220,Nv toe ende helpe wi pertseuale
Onbekend,Onbekend Hoofdstuk,221,Hi heft den witten hert verslegen
Onbekend,Onbekend Hoofdstuk,222,Percheuale alse een coene degen
Onbekend,Onbekend Hoofdstuk,223,Doe reden si vort ende sagen staen
Onbekend,Onbekend Hoofdstuk,224,Te voet ende hadde den hert ondaen
Onbekend,Onbekend Hoofdstuk,225,Met sire sleppen drogedi sinen hont
Onbekend,Onbekend Hoofdstuk,226,Doe quam die coninc daer hi stont
Onbekend,Onbekend Hoofdstuk,227,Ende groetene alse sinen vrient
Onbekend,Onbekend Hoofdstuk,228,Hi seide gi hebt mi wel gedient
Onbekend,Onbekend Hoofdstuk,229,Percheuale groetene weder
Onbekend,Onbekend Hoofdstuk,230,Ende seide here beet neder
Onbekend,Onbekend Hoofdstuk,231,Ende rust v wi moeten hier bliuen
Onbekend,Onbekend Hoofdstuk,232,Wi soude ons nv henen driuen
Onbekend,Onbekend Hoofdstuk,233,Mi duncke dat wel bider nacht si
Onbekend,Onbekend Hoofdstuk,234,Ghi segt waer dat duncke mi
Onbekend,Onbekend Hoofdstuk,235,Sprac die coninc hi beette saen
Onbekend,Onbekend Hoofdstuk,236,Doe gincmen pawelioene slaen
Onbekend,Onbekend Hoofdstuk,237,Die mane scheen scone ende claer
Onbekend,Onbekend Hoofdstuk,238,Alden nacht bleuen si daer
Onbekend,Onbekend Hoofdstuk,239,Ende aten daer. daer was spisen gnoech
Onbekend,Onbekend Hoofdstuk,240,Ende alles dies si hadden ltgheuoechgt
Onbekend,Onbekend Hoofdstuk,241,Achter etene si slapen gingen
Onbekend,Onbekend Hoofdstuk,242,Doe dede die coninc den cop bringen
Onbekend,Onbekend Hoofdstuk,243,Ende gaffene mijn her percheuale
Onbekend,Onbekend Hoofdstuk,244,Ende seide vrient ic ans v wale
Onbekend,Onbekend Hoofdstuk,245,Ghi hebt den witten hert geuaen
Onbekend,Onbekend Hoofdstuk,246,Van allen hebdi den prijs ontfaen
Onbekend,Onbekend Hoofdstuk,247,Mijn her percheuale wart op
Onbekend,Onbekend Hoofdstuk,248,Ende gaf mijn her gaweine den cop
Onbekend,Onbekend Hoofdstuk,249,Dat was hem allen wel bequame
Onbekend,Onbekend Hoofdstuk,250,Dat hi ontfinc den groten name
Onbekend,Onbekend Hoofdstuk,251,Dien nacht rusten si met gemake
Onbekend,Onbekend Hoofdstuk,252,Tierst dat die dach grake
Onbekend,Onbekend Hoofdstuk,253,Was. wart op die goede man
Onbekend,Onbekend Hoofdstuk,254,Ende dede sine cleder an
Onbekend,Onbekend Hoofdstuk,255,Alse hi gereet was wildi dwaen
Onbekend,Onbekend Hoofdstuk,256,Men brochte hem dat water saen
Onbekend,Onbekend Hoofdstuk,257,In .ij. guldine beckine
Onbekend,Onbekend Hoofdstuk,258,Ende ene dwale purperine
Onbekend,Onbekend Hoofdstuk,259,Hi dwoech ende hiet al op doen
Onbekend,Onbekend Hoofdstuk,260,Sine tenten ende sine pawelioen
Onbekend,Onbekend Hoofdstuk,261,Doe warpmen omme die somers sciere
Onbekend,Onbekend Hoofdstuk,262,Ende loet pauwelione ende fortsiere
Onbekend,Onbekend Hoofdstuk,263,Den hert en heeftmen niet vergeten
Onbekend,Onbekend Hoofdstuk,264,Die coninc hi hadt wel geweten
Onbekend,Onbekend Hoofdstuk,265,Een knape op enen zomere hine leide
Onbekend,Onbekend Hoofdstuk,266,Daer en was nemmer geen beide
Onbekend,Onbekend Hoofdstuk,267,Si saten op alle ter vaert
Onbekend,Onbekend Hoofdstuk,268,Ende reden alle te cardoel wart
Onbekend,Onbekend Hoofdstuk,269,In een dal si gereden quamen
Onbekend,Onbekend Hoofdstuk,270,Enen casteel si vernamen
Onbekend,Onbekend Hoofdstuk,271,Daer woende een dorpere van pelande
Onbekend,Onbekend Hoofdstuk,272,Die op die zee van jngelande
Onbekend,Onbekend Hoofdstuk,273,Op ene roetsche hadde gemaect
Onbekend,Onbekend Hoofdstuk,274,Sine husinge ende al omme gestaect
Onbekend,Onbekend Hoofdstuk,275,Met groten ende met langen bomen
Onbekend,Onbekend Hoofdstuk,276,Hine wilde daer hebben niemens comen
Onbekend,Onbekend Hoofdstuk,277,Ene hoge torre stont ane deen ende
Onbekend,Onbekend Hoofdstuk,278,Hine ontsiet assaut no meswende
Onbekend,Onbekend Hoofdstuk,279,Wel was die dorpere gheaisiert
Onbekend,Onbekend Hoofdstuk,280,Die den torre gebatalgiert
Onbekend,Onbekend Hoofdstuk,281,So wel hadde op die hoge zee
Onbekend,Onbekend Hoofdstuk,282,.xxx. milen ende mee
Onbekend,Onbekend Hoofdstuk,283,Soe mach hi omtrent hem sien
Onbekend,Onbekend Hoofdstuk,284,Dier in es darf nieman ontsien
Onbekend,Onbekend Hoofdstuk,285,Van hem en willic niet vertrecken
Onbekend,Onbekend Hoofdstuk,286,Al tlant was sijn hi moest berecken
Onbekend,Onbekend Hoofdstuk,287,Men mochte tlant niemen els geuen
Onbekend,Onbekend Hoofdstuk,288,Het was hem van sinen oer bleuen
Onbekend,Onbekend Hoofdstuk,289,Die dorpere hiet somilet
Onbekend,Onbekend Hoofdstuk,290,Een wijf haddi die vele bet
Onbekend,Onbekend Hoofdstuk,291,Was geboren dan hare man
Onbekend,Onbekend Hoofdstuk,292,Dor sgoets wille sine ltghewangt
Onbekend,Onbekend Hoofdstuk,293,Drie sonen haddi bi sinen wiue
Onbekend,Onbekend Hoofdstuk,294,Die scone waren van haren liue
Onbekend,Onbekend Hoofdstuk,295,Ende van leden wel geraect
Onbekend,Onbekend Hoofdstuk,296,Nature hadse volmaect
Onbekend,Onbekend Hoofdstuk,297,Die dorpere hietse pinen gaen
Onbekend,Onbekend Hoofdstuk,298,Alden dach ende vroech op staen
Onbekend,Onbekend Hoofdstuk,299,Die .ij. dedi driuen vee
Onbekend,Onbekend Hoofdstuk,300,Verre van husen op die zee
Onbekend,Onbekend Hoofdstuk,301,Die derde ginc in die ploech
Onbekend,Onbekend Hoofdstuk,302,Van calf vellen hi ane droech
Onbekend,Onbekend Hoofdstuk,303,Enen roc cort toten knie
Onbekend,Onbekend Hoofdstuk,304,Ende .ij. hoselen gebonden ant die
Onbekend,Onbekend Hoofdstuk,305,Ter pinen was hi wel gewone
Onbekend,Onbekend Hoofdstuk,306,Hi scheen qualic eens rijcs mans sone
Onbekend,Onbekend Hoofdstuk,307,Die coninc leet biden castele
Onbekend,Onbekend Hoofdstuk,308,Sere besach hi die tornele
Onbekend,Onbekend Hoofdstuk,309,Dat hordijs die hoge zale
Onbekend,Onbekend Hoofdstuk,310,Die bequam hem herde wale
Onbekend,Onbekend Hoofdstuk,311,Hine voer niet sere waer den telt
Onbekend,Onbekend Hoofdstuk,312,Quam hi gereden ane .i. velt
Onbekend,Onbekend Hoofdstuk,313,Daer des dorpers sone dreef di ploech
Onbekend,Onbekend Hoofdstuk,314,Die knape versachse niet sere hi loech
Onbekend,Onbekend Hoofdstuk,315,Herde sere was hi veruaert
Onbekend,Onbekend Hoofdstuk,316,Vlien en wiste hi waer waert
Onbekend,Onbekend Hoofdstuk,317,Hi waende sine wech wilden voeren
Onbekend,Onbekend Hoofdstuk,318,Een let endorsti niet verroeren
Onbekend,Onbekend Hoofdstuk,319,Hi stont ende sweette alse een das
Onbekend,Onbekend Hoofdstuk,320,Tes die rote leden was
Onbekend,Onbekend Hoofdstuk,321,ltAchtergt die ploech die knape lach
Onbekend,Onbekend Hoofdstuk,322,Van verren dat hi comen sach
Onbekend,Onbekend Hoofdstuk,323,Enen zomere met gemake
Onbekend,Onbekend Hoofdstuk,324,Die was gehort ane enen stake
Onbekend,Onbekend Hoofdstuk,325,Een knape dreefne met ere roeden
Onbekend,Onbekend Hoofdstuk,326,Dat heme die lanken gingen bloeden
Onbekend,Onbekend Hoofdstuk,327,Hine consten niet vort gedriuen
Onbekend,Onbekend Hoofdstuk,328,Bedi moesti achter bliuen
Onbekend,Onbekend Hoofdstuk,329,Alse dit des dorpers sone vernam
Onbekend,Onbekend Hoofdstuk,330,Sine ploech liet hi ende ltquamgt
Onbekend,Onbekend Hoofdstuk,331,Ten knape wert so hi seerst mochte
Onbekend,Onbekend Hoofdstuk,332,Sine grote colue dat hi brochte
Onbekend,Onbekend Hoofdstuk,333,Sijn hant in sknapen togel hi sleet
Onbekend,Onbekend Hoofdstuk,334,Vrient seit hi dat di god al leet
Onbekend,Onbekend Hoofdstuk,335,Moete verden segt mi wie si sijn
Onbekend,Onbekend Hoofdstuk,336,Die heren die hier leden sijn
Onbekend,Onbekend Hoofdstuk,337,Hets die coninc ende sine vrient
Onbekend,Onbekend Hoofdstuk,338,Die hem dicke hebben gedient
Onbekend,Onbekend Hoofdstuk,339,Si hebben heme verwonnen tlant
Onbekend,Onbekend Hoofdstuk,340,Soe dat hi keyser es te hant
Onbekend,Onbekend Hoofdstuk,341,Nv sech mi noch lieue caren
Onbekend,Onbekend Hoofdstuk,342,Die daer naest den coninc varen
Onbekend,Onbekend Hoofdstuk,343,Wie sijn si bestaen si hem iet
Onbekend,Onbekend Hoofdstuk,344,Iasi vrient en twifels niet
Onbekend,Onbekend Hoofdstuk,345,Het sijn die vander tafelronden
Onbekend,Onbekend Hoofdstuk,346,Menige auonture hebsi vonden
Onbekend,Onbekend Hoofdstuk,347,Het sijn die gene van sconinx rade
Onbekend,Onbekend Hoofdstuk,348,Lude stille vroe ende spade
Onbekend,Onbekend Hoofdstuk,349,Het mach wel sijn bi mire trouwen
Onbekend,Onbekend Hoofdstuk,350,Ic wane den coninc dan noch scouwen
Onbekend,Onbekend Hoofdstuk,351,Ic hebbe horen tellen soe vele
Onbekend,Onbekend Hoofdstuk,352,Van heme dogeden in menegen spele
Onbekend,Onbekend Hoofdstuk,353,Ende vanden ridders die hi heeft
Onbekend,Onbekend Hoofdstuk,354,Hets wel bestaet dat hi leeft
Onbekend,Onbekend Hoofdstuk,355,Te houe waert willic mi maken
Onbekend,Onbekend Hoofdstuk,356,Ic hope ic salre wel geraken
Onbekend,Onbekend Hoofdstuk,357,Soudicken soeken op den rijn
Onbekend,Onbekend Hoofdstuk,358,Ic sal van siere meysnieden sijn
Onbekend,Onbekend Hoofdstuk,359,Ende van sinen nausten rade
Onbekend,Onbekend Hoofdstuk,360,Ic sal van hem iagen die quade
Onbekend,Onbekend Hoofdstuk,361,Ghi hebt recht sprac die seriant
Onbekend,Onbekend Hoofdstuk,362,Te houe werdi saen bekant
Onbekend,Onbekend Hoofdstuk,363,Hi nam orlof ende keerde saen
Onbekend,Onbekend Hoofdstuk,364,Te sire ploech quam hi gegaen
Onbekend,Onbekend Hoofdstuk,365,Sine perde hi ontspien
Onbekend,Onbekend Hoofdstuk,366,Ten castele liep hi mettien
Onbekend,Onbekend Hoofdstuk,367,Soe vele liep hi dat hem tsweet
Onbekend,Onbekend Hoofdstuk,368,Pisselinge ouer die ogen leet
Onbekend,Onbekend Hoofdstuk,369,Hi liep so sere indat gras
Onbekend,Onbekend Hoofdstuk,370,Welna hi te borsten was
Onbekend,Onbekend Hoofdstuk,371,Vtermaten sere hi ran
Onbekend,Onbekend Hoofdstuk,372,Mettien hi ten castele quam ltangt
Onbekend,Onbekend Hoofdstuk,373,Sinen vader hi daer vint
Onbekend,Onbekend Hoofdstuk,374,Hine groeten niet .i. twint
Onbekend,Onbekend Hoofdstuk,375,Sijn ploech yser hi brochte
Onbekend,Onbekend Hoofdstuk,376,Ter erden waerp hijt. hine rochte
Onbekend,Onbekend Hoofdstuk,377,Nemmer te gane metter ploech
Onbekend,Onbekend Hoofdstuk,378,Sijn vader sagene sere hi loech
Onbekend,Onbekend Hoofdstuk,379,Hi seide wat hefstu vernomen
Onbekend,Onbekend Hoofdstuk,380,Waer bi bestu so tilec comen
Onbekend,Onbekend Hoofdstuk,381,Du hebst tilec werc gelaten
Onbekend,Onbekend Hoofdstuk,382,Qualec hebstu verdient dijn haten
Onbekend,Onbekend Hoofdstuk,383,Here sprac die cnape bi god
Onbekend,Onbekend Hoofdstuk,384,Mi dunct gi hout met mi v spod
Onbekend,Onbekend Hoofdstuk,385,Geeft mi wapene laet mi varen
Onbekend,Onbekend Hoofdstuk,386,Te houe in wils niet ontbaren
Onbekend,Onbekend Hoofdstuk,387,Die dorpre horet ende wart lterre daer afgt
Onbekend,Onbekend Hoofdstuk,388,Hi begreep enen groten lt.i. groten stafgt
Onbekend,Onbekend Hoofdstuk,389,Ic wane hi hadde hem ltte broken thoeftgt
Onbekend,Onbekend Hoofdstuk,390,Maer sijn moeder quam ltdes gheloeftgt
Onbekend,Onbekend Hoofdstuk,391,Ende greep den dorpere in haer arme
Onbekend,Onbekend Hoofdstuk,392,Si seide lieue here wacharme
Onbekend,Onbekend Hoofdstuk,393,Gi doet quaet te minen trouwen
Onbekend,Onbekend Hoofdstuk,394,Dat gi vwen sone wilt blouwen
Onbekend,Onbekend Hoofdstuk,395,Die dorpre versprac sinen sone
Onbekend,Onbekend Hoofdstuk,396,Ia seit hi quaet hoeren sone
Onbekend,Onbekend Hoofdstuk,397,Wildi wesen ridders genoet
Onbekend,Onbekend Hoofdstuk,398,Gaet ende hoet v queckenoet
Onbekend,Onbekend Hoofdstuk,399,Oft gi metter ploech niet wilt gaen
Onbekend,Onbekend Hoofdstuk,400,So draget mes met berien saen
Onbekend,Onbekend Hoofdstuk,401,Here sprac die vrouwe gi hebt onrecht
Onbekend,Onbekend Hoofdstuk,402,Ghine saget noit bi mi liggen knecht
Onbekend,Onbekend Hoofdstuk,403,Ghi scelt mi hoere ende quade schite
Onbekend,Onbekend Hoofdstuk,404,Van hoerdome willic wesen quite
Onbekend,Onbekend Hoofdstuk,405,Hens man geen diet mi op tien
Onbekend,Onbekend Hoofdstuk,406,Wilde ic ensout hem doen lien
Onbekend,Onbekend Hoofdstuk,407,Dat logene ware ende sceren
Onbekend,Onbekend Hoofdstuk,408,Sappans stede wildix mi weren
Onbekend,Onbekend Hoofdstuk,409,Oec secgic v van vwen zone
Onbekend,Onbekend Hoofdstuk,410,Al hebdine ter pinen gewone
Onbekend,Onbekend Hoofdstuk,411,Ne wondere v niet dat hi gedachte
Onbekend,Onbekend Hoofdstuk,412,Ten wapinen heft in mijn geslachte
Onbekend,Onbekend Hoofdstuk,413,Es noch menech riddere goet
Onbekend,Onbekend Hoofdstuk,414,Here mi dunct dat gi wel doet
