author,chapter,line,text
Onbekend,Onbekend Hoofdstuk,2452,Die ridder sprac op mine trouwe
Onbekend,Onbekend Hoofdstuk,2453,Tierst het daget ic v geloue
Onbekend,Onbekend Hoofdstuk,2454,Dat ic varen sal te houe
Onbekend,Onbekend Hoofdstuk,2455,Ende mijn lief ende mijn garsoen
Onbekend,Onbekend Hoofdstuk,2456,Ic wille v boetscap doen
Onbekend,Onbekend Hoofdstuk,2457,Ferguut sprac en lates niet
Onbekend,Onbekend Hoofdstuk,2458,Doe reet hi danen die wijch sciet
Onbekend,Onbekend Hoofdstuk,2459,Ende die ridder hilt al stille
Onbekend,Onbekend Hoofdstuk,2460,Sere tongemake te sinen onwille
Onbekend,Onbekend Hoofdstuk,2461,Die dach quam die nacht leet
Onbekend,Onbekend Hoofdstuk,2462,Ferguut vollike danen reet
Onbekend,Onbekend Hoofdstuk,2463,In gepense heften venus brltachtgt
Onbekend,Onbekend Hoofdstuk,2464,Hine vergat niet sinen scacht
Onbekend,Onbekend Hoofdstuk,2465,Daer hi met stac den ridder coene
Onbekend,Onbekend Hoofdstuk,2466,Hi reet den dach dore toter noene
Onbekend,Onbekend Hoofdstuk,2467,Int foreest dwers ende lanx
Onbekend,Onbekend Hoofdstuk,2468,Dat hi en onbeet aet no dranx
Onbekend,Onbekend Hoofdstuk,2469,Hem en lustes oec groet no clene
Onbekend,Onbekend Hoofdstuk,2470,So sere dwinctene galiene
Onbekend,Onbekend Hoofdstuk,2471,Hine weet oec waer hi vaert
Onbekend,Onbekend Hoofdstuk,2472,Waer dat wille gaet sijn paert
Onbekend,Onbekend Hoofdstuk,2473,Ten togle hi nie ware en nam
Onbekend,Onbekend Hoofdstuk,2474,Ende es comen op enen dam
Onbekend,Onbekend Hoofdstuk,2475,Neuen .i. water sterc ende groet
Onbekend,Onbekend Hoofdstuk,2476,Daer menich man es bleuen doet
Onbekend,Onbekend Hoofdstuk,2477,Op dien dam so hadde gesticht
Onbekend,Onbekend Hoofdstuk,2478,Een scakere enen torre slicht
Onbekend,Onbekend Hoofdstuk,2479,Neuen den watre an die wostine
Onbekend,Onbekend Hoofdstuk,2480,Warent seriante of pelgrime
Onbekend,Onbekend Hoofdstuk,2481,Ridders die auonture sochten
Onbekend,Onbekend Hoofdstuk,2482,Hi nam hem al datsi brochten
Onbekend,Onbekend Hoofdstuk,2483,Wie daer leet of wie hem werde
Onbekend,Onbekend Hoofdstuk,2484,Sloech hi thoeft af metten swerde
Onbekend,Onbekend Hoofdstuk,2485,Vele quaets haddi gedaen int lant
Onbekend,Onbekend Hoofdstuk,2486,Ouer al was hi becant
Onbekend,Onbekend Hoofdstuk,2487,Daer en dorste niemen gaen no riden
Onbekend,Onbekend Hoofdstuk,2488,Maer ferguut moeter nv liden
Onbekend,Onbekend Hoofdstuk,2489,Ende vanden dieue hi niet en weet
Onbekend,Onbekend Hoofdstuk,2490,Die strate hi so lange reet
Onbekend,Onbekend Hoofdstuk,2491,Enen casteel hi vore hem sach
Onbekend,Onbekend Hoofdstuk,2492,Daer ouer ene brucge lach
Onbekend,Onbekend Hoofdstuk,2493,Die ginc tote ouer die riuiere
Onbekend,Onbekend Hoofdstuk,2494,Ferguut die quam daer sciere
Onbekend,Onbekend Hoofdstuk,2495,Die altoes peinst om .i. sake
Onbekend,Onbekend Hoofdstuk,2496,Hi waent wel liden met gemake
Onbekend,Onbekend Hoofdstuk,2497,Also hi waent en saelt gaen niet
Onbekend,Onbekend Hoofdstuk,2498,Want die dief heften bespiet
Onbekend,Onbekend Hoofdstuk,2499,Die altoes hadde in sijn gedochte
Onbekend,Onbekend Hoofdstuk,2500,Hoe hi die liede rouen mochte
Onbekend,Onbekend Hoofdstuk,2501,Vten castele hi verlaisiert
Onbekend,Onbekend Hoofdstuk,2502,Met luder stemmen hi craihiert
Onbekend,Onbekend Hoofdstuk,2503,Her ridder ghi dunct mi al dol
Onbekend,Onbekend Hoofdstuk,2504,Want hier geltmen den tol
Onbekend,Onbekend Hoofdstuk,2505,Alsemen inden lande wille varen
Onbekend,Onbekend Hoofdstuk,2506,Ghi wilten ontfoeren twaren
Onbekend,Onbekend Hoofdstuk,2507,Maer en sal alsoe niet sijn
Onbekend,Onbekend Hoofdstuk,2508,Soe helpe mi sente martijn
Onbekend,Onbekend Hoofdstuk,2509,Ghi sulten mi ontfoeren cume
Onbekend,Onbekend Hoofdstuk,2510,Ic sal v leren die costume
Onbekend,Onbekend Hoofdstuk,2511,Eer gi heden van mi scheet
Onbekend,Onbekend Hoofdstuk,2512,Ic wille dat gi neder beet
Onbekend,Onbekend Hoofdstuk,2513,Ende v ors ouer den tol mi geft
Onbekend,Onbekend Hoofdstuk,2514,Als ferguut dit gehort heft
Onbekend,Onbekend Hoofdstuk,2515,Sprac hi vrient wildi minen wreen
Onbekend,Onbekend Hoofdstuk,2516,Ouer vwen tol eest v leen
Onbekend,Onbekend Hoofdstuk,2517,Van vwen rechte ic niet en weet
Onbekend,Onbekend Hoofdstuk,2518,Nemdi mijn ors hets mi leet
Onbekend,Onbekend Hoofdstuk,2519,En magic mi niet berechten
Onbekend,Onbekend Hoofdstuk,2520,Eer ict verliese ic sal eer vechten
Onbekend,Onbekend Hoofdstuk,2521,Verlorict en ware mi niet goet
Onbekend,Onbekend Hoofdstuk,2522,Want ic mach qualic te voet
Onbekend,Onbekend Hoofdstuk,2523,Elc den andren sere naect
Onbekend,Onbekend Hoofdstuk,2524,Maer ferguut heften tierst geraect
Onbekend,Onbekend Hoofdstuk,2525,Met so groter cracht hine stac
Onbekend,Onbekend Hoofdstuk,2526,Dat hi heme sinen aerm brac
Onbekend,Onbekend Hoofdstuk,2527,Daer hi den scilt mede droech
Onbekend,Onbekend Hoofdstuk,2528,Die dief versaecht niet sere hi loech
Onbekend,Onbekend Hoofdstuk,2529,Alse hi sinen aerm sach verkert
Onbekend,Onbekend Hoofdstuk,2530,Hine hadde niet sulke steke geleert
Onbekend,Onbekend Hoofdstuk,2531,Die dief sach wel sonder waen
Onbekend,Onbekend Hoofdstuk,2532,Moesti noch sulken slach ontfaen
Onbekend,Onbekend Hoofdstuk,2533,Alse hi nv sloech . ic bleue doet
Onbekend,Onbekend Hoofdstuk,2534,Of geuaen of in groter noet
Onbekend,Onbekend Hoofdstuk,2535,Dier slage en begeert hi mere
Onbekend,Onbekend Hoofdstuk,2536,Ten castele wert vloe hi ltseregt
Onbekend,Onbekend Hoofdstuk,2537,Ferguut reet naer den dief
Onbekend,Onbekend Hoofdstuk,2538,Heme en sal niet wesen lief
Onbekend,Onbekend Hoofdstuk,2539,Ontgaet hi hem binnen den stene
Onbekend,Onbekend Hoofdstuk,2540,Hi riep ridder minen wrene
Onbekend,Onbekend Hoofdstuk,2541,Bringic v beit .i. lettelkijn
Onbekend,Onbekend Hoofdstuk,2542,Mijns tols willic quite sijn
Onbekend,Onbekend Hoofdstuk,2543,V recht en willic v niet ontdragen
Onbekend,Onbekend Hoofdstuk,2544,Want gi sout ouer mi clagen
Onbekend,Onbekend Hoofdstuk,2545,Dief ende valsch soudi mi scelden
Onbekend,Onbekend Hoofdstuk,2546,Wildic v niet vwen tol gelden
Onbekend,Onbekend Hoofdstuk,2547,Ic geuene v gerne beit doch
Onbekend,Onbekend Hoofdstuk,2548,Een lettel ic ware gerne woch
Onbekend,Onbekend Hoofdstuk,2549,Want ic hebbe noch vele te gane
Onbekend,Onbekend Hoofdstuk,2550,Die dief was niet gereet tontfane
Onbekend,Onbekend Hoofdstuk,2551,Van dien tolle dat payment
Onbekend,Onbekend Hoofdstuk,2552,Hi wilde wel sijn te ghent
Onbekend,Onbekend Hoofdstuk,2553,Ende hi daer niet comen en ware
Onbekend,Onbekend Hoofdstuk,2554,Hi was sijns lijfs in groten vare
Onbekend,Onbekend Hoofdstuk,2555,Den casteel hi voer hem siet
Onbekend,Onbekend Hoofdstuk,2556,Maer hine comter binnen niet
Onbekend,Onbekend Hoofdstuk,2557,Hem sal berouwen eer hire in vert
Onbekend,Onbekend Hoofdstuk,2558,Dat hi wilde hebben ferguuts pert
Onbekend,Onbekend Hoofdstuk,2559,Ferguut so sere na hem rijdt
Onbekend,Onbekend Hoofdstuk,2560,Dat hem achter ontwee snijt
Onbekend,Onbekend Hoofdstuk,2561,Aertsoen ende ors met sinen swerde
Onbekend,Onbekend Hoofdstuk,2562,Die dief viel neder op die erde
Onbekend,Onbekend Hoofdstuk,2563,Ferguut hastelike versach
Onbekend,Onbekend Hoofdstuk,2564,Dat hi neder ter erden lach
Onbekend,Onbekend Hoofdstuk,2565,Auerecht op sinen scilt
Onbekend,Onbekend Hoofdstuk,2566,Mettien hi sijn scheren hilt
Onbekend,Onbekend Hoofdstuk,2567,Ende riep lude te sinen scoppe
Onbekend,Onbekend Hoofdstuk,2568,Ridder willic v helpen oppe
Onbekend,Onbekend Hoofdstuk,2569,Ic sie v thoeft ter erden helden
Onbekend,Onbekend Hoofdstuk,2570,Suldi minen tol quite scelden
Onbekend,Onbekend Hoofdstuk,2571,Die dief riep ontfarmeliken
Onbekend,Onbekend Hoofdstuk,2572,Hebt mijns genade om gode den riken
Onbekend,Onbekend Hoofdstuk,2573,Alse minen here ic v sal
Onbekend,Onbekend Hoofdstuk,2574,Gerne dienen mijn leuen al
Onbekend,Onbekend Hoofdstuk,2575,Ferguut sprac ic sla v af thoeft
Onbekend,Onbekend Hoofdstuk,2576,En si dat gi mi geloeft
Onbekend,Onbekend Hoofdstuk,2577,Ende sekert in mine hant
Onbekend,Onbekend Hoofdstuk,2578,Dat gi nemmermee in dit lant
Onbekend,Onbekend Hoofdstuk,2579,Roeuen en sult manne no wiue
Onbekend,Onbekend Hoofdstuk,2580,Aldus mogedi bliuen te liue
Onbekend,Onbekend Hoofdstuk,2581,Ende gi v geuangen gheeft
Onbekend,Onbekend Hoofdstuk,2582,Den coninc aertuer die mi heft
Onbekend,Onbekend Hoofdstuk,2583,Van naesten wapine gegeuen
Onbekend,Onbekend Hoofdstuk,2584,Wildi dit doen so mogedi leuen
Onbekend,Onbekend Hoofdstuk,2585,Die dief sprac dat hi sijn gelof
Onbekend,Onbekend Hoofdstuk,2586,Soude doen ende varen int hof
Onbekend,Onbekend Hoofdstuk,2587,Ferguut sprac in bidde nemmeer
Onbekend,Onbekend Hoofdstuk,2588,Daer en leet man noit eer
Onbekend,Onbekend Hoofdstuk,2589,Hine was geroeuet vanden goede
Onbekend,Onbekend Hoofdstuk,2590,Of vanden liue nv en hebs hoede
Onbekend,Onbekend Hoofdstuk,2591,Si mogen varen sekerlike
Onbekend,Onbekend Hoofdstuk,2592,Alle die willen in dat rike
Onbekend,Onbekend Hoofdstuk,2593,Ferguut vollec danen voer
Onbekend,Onbekend Hoofdstuk,2594,Want sine herte hem sere swoer
Onbekend,Onbekend Hoofdstuk,2595,Dat hi sijn lief hadde verloren
Onbekend,Onbekend Hoofdstuk,2596,Hi hads pine ende ende groten toren
Onbekend,Onbekend Hoofdstuk,2597,In een foreest es hi geslegen
Onbekend,Onbekend Hoofdstuk,2598,Daer lettel liede te varen plegen
Onbekend,Onbekend Hoofdstuk,2599,Si ontsagent alle ghemene
Onbekend,Onbekend Hoofdstuk,2600,Die vanden lande groet ende clene
Onbekend,Onbekend Hoofdstuk,2601,Men plach daer vele quaets te doene
Onbekend,Onbekend Hoofdstuk,2602,Ferguut voer toter neder noene
Onbekend,Onbekend Hoofdstuk,2603,In dat foreest dwers ende lanx
Onbekend,Onbekend Hoofdstuk,2604,Want sijn ors ginc sijns danx
Onbekend,Onbekend Hoofdstuk,2605,Waer dat wilde in allen steden
Onbekend,Onbekend Hoofdstuk,2606,Dus heft ferguut den dach gereden
Onbekend,Onbekend Hoofdstuk,2607,Ende den nacht toter dagrake
Onbekend,Onbekend Hoofdstuk,2608,Met pinen ende met ongemake
Onbekend,Onbekend Hoofdstuk,2609,Hine vant auonture en gene
Onbekend,Onbekend Hoofdstuk,2610,Dicke riep galiene
Onbekend,Onbekend Hoofdstuk,2611,In can v vinden dats mi swaer
Onbekend,Onbekend Hoofdstuk,2612,Die honger ginc hem herde naer
Onbekend,Onbekend Hoofdstuk,2613,Hine hadde geten in .iij. dagen
Onbekend,Onbekend Hoofdstuk,2614,Die scaerpe dorne ende hagen
Onbekend,Onbekend Hoofdstuk,2615,Daden heme sijn ansichte bloeden
Onbekend,Onbekend Hoofdstuk,2616,Sijn ors begonste sere moeden
Onbekend,Onbekend Hoofdstuk,2617,Het ne was niet wel te sinen wille
Onbekend,Onbekend Hoofdstuk,2618,In een plein bleeft staende stille
Onbekend,Onbekend Hoofdstuk,2619,Aldus hilt doen ferguut
Onbekend,Onbekend Hoofdstuk,2620,Soe dat hi hoerde een groet geluut
Onbekend,Onbekend Hoofdstuk,2621,Ende sach roec ende claerheit van viere
Onbekend,Onbekend Hoofdstuk,2622,Ferguut maecte hem daer wart sciere
Onbekend,Onbekend Hoofdstuk,2623,Alse hi daer ghereden quam
Onbekend,Onbekend Hoofdstuk,2624,Hastelike hi vernam
Onbekend,Onbekend Hoofdstuk,2625,Ene tafle wel bereit
Onbekend,Onbekend Hoofdstuk,2626,Daer op wijn ende claerheit
Onbekend,Onbekend Hoofdstuk,2627,Ende spise van meniger manieren
Onbekend,Onbekend Hoofdstuk,2628,Alsoement wel conste visieren
Onbekend,Onbekend Hoofdstuk,2629,Ter taflen .xv. ridders saten
Onbekend,Onbekend Hoofdstuk,2630,Haer eerste gerechte datsi aten
Onbekend,Onbekend Hoofdstuk,2631,Ende ferguut hi beette saen
Onbekend,Onbekend Hoofdstuk,2632,Hine sprac word no en hiesch dwaen
Onbekend,Onbekend Hoofdstuk,2633,Maer ginc sitten daert hem scoenst dochte
Onbekend,Onbekend Hoofdstuk,2634,Van al datmen ter taflen brochte
Onbekend,Onbekend Hoofdstuk,2635,Daer af nam hi sijn geuoech
Onbekend,Onbekend Hoofdstuk,2636,Ende settet vor hem deen ridder loech
Onbekend,Onbekend Hoofdstuk,2637,Toten andren vele sere
Onbekend,Onbekend Hoofdstuk,2638,Ende si spraken wies dese here
Onbekend,Onbekend Hoofdstuk,2639,Ens niet die hoefste vanden lande
Onbekend,Onbekend Hoofdstuk,2640,Het ware recht dat hijs hadde scande
Onbekend,Onbekend Hoofdstuk,2641,Ende dat hi sijn gelach betale
Onbekend,Onbekend Hoofdstuk,2642,Want hi heeft geten altemale
Onbekend,Onbekend Hoofdstuk,2643,Van onser spisen dbeste deel
Onbekend,Onbekend Hoofdstuk,2644,Doe wi hem gelden elc morseel
Onbekend,Onbekend Hoofdstuk,2645,Ende hangewine bider kele
Onbekend,Onbekend Hoofdstuk,2646,Hets meer dan tijt hi et te vele
Onbekend,Onbekend Hoofdstuk,2647,Ende ferguut horde wel dat gedreech
Onbekend,Onbekend Hoofdstuk,2648,Hi at al stille ende dranc ende sweech
Onbekend,Onbekend Hoofdstuk,2649,Ende liet hen secgen datsi wouden
Onbekend,Onbekend Hoofdstuk,2650,Tote hi sat was doe hiet hi vouden
Onbekend,Onbekend Hoofdstuk,2651,Dat amelaken ende doen woch
Onbekend,Onbekend Hoofdstuk,2652,Neen sprac die meester het nes noch
Onbekend,Onbekend Hoofdstuk,2653,Gheen tijt wech te verne
Onbekend,Onbekend Hoofdstuk,2654,Mi dunct gi waent tuwen scerne
Onbekend,Onbekend Hoofdstuk,2655,Geten hebben onse spise
Onbekend,Onbekend Hoofdstuk,2656,Also helpe mi god van paradise
Onbekend,Onbekend Hoofdstuk,2657,Het sal v costen vwen crage
Onbekend,Onbekend Hoofdstuk,2658,Betaelt vollec v gelage
Onbekend,Onbekend Hoofdstuk,2659,Hier moet bliuen v ors v gereide
Onbekend,Onbekend Hoofdstuk,2660,Ontwapent v alsonder beide
Onbekend,Onbekend Hoofdstuk,2661,Ende geeft ons al toter huut
Onbekend,Onbekend Hoofdstuk,2662,Haestelike sprac ferguut
Onbekend,Onbekend Hoofdstuk,2663,Ghi heren houdi met mi v scheren
Onbekend,Onbekend Hoofdstuk,2664,Dus gedaenre tale waent ontberen
Onbekend,Onbekend Hoofdstuk,2665,Want in hebbe seluer no gout
Onbekend,Onbekend Hoofdstuk,2666,Wat holpe dat gi vele scout
Onbekend,Onbekend Hoofdstuk,2667,Mine wapine geuic v niet
Onbekend,Onbekend Hoofdstuk,2668,Alse dit die meester here siet
Onbekend,Onbekend Hoofdstuk,2669,Trac hi enen brant vten viere
Onbekend,Onbekend Hoofdstuk,2670,Ende sloech fergute schiere
Onbekend,Onbekend Hoofdstuk,2671,In dansichte met dien brande
Onbekend,Onbekend Hoofdstuk,2672,Ferguut sprac god geue v scande
Onbekend,Onbekend Hoofdstuk,2673,Dat gi mi dus hebt gesmeten
Onbekend,Onbekend Hoofdstuk,2674,Ende ic met v hebbe gheten
Onbekend,Onbekend Hoofdstuk,2675,Ferguut begrepen biden hare
Onbekend,Onbekend Hoofdstuk,2676,Ende scoeten int vier ende seide vare
Onbekend,Onbekend Hoofdstuk,2677,Die duuel hi moet di geleiden
Onbekend,Onbekend Hoofdstuk,2678,Waer omme wilstu mi ontcleiden
Onbekend,Onbekend Hoofdstuk,2679,Doe scoten dandere .xiiij. oppe
Onbekend,Onbekend Hoofdstuk,2680,Ende gauen heme slage ende cloppe
Onbekend,Onbekend Hoofdstuk,2681,Met groten slttockengt van faseelen
Onbekend,Onbekend Hoofdstuk,2682,Ferguut trac tswert ende ginc hem deelen
Onbekend,Onbekend Hoofdstuk,2683,Ende sloeger .v. te .vij. slagen
Onbekend,Onbekend Hoofdstuk,2684,Den andren gincs qualic behagen
Onbekend,Onbekend Hoofdstuk,2685,Ende wapenden hem so si ierst mochten
Onbekend,Onbekend Hoofdstuk,2686,Wantsi ferguuts slage dochten
Onbekend,Onbekend Hoofdstuk,2687,Si waren te gereke saen
Onbekend,Onbekend Hoofdstuk,2688,Ende gingen op fergute slaen
Onbekend,Onbekend Hoofdstuk,2689,Ende steken ende houwen
Onbekend,Onbekend Hoofdstuk,2690,Noit man en sach bi mire trouwen
Onbekend,Onbekend Hoofdstuk,2691,Enen ridder so vele gedogen
Onbekend,Onbekend Hoofdstuk,2692,Vanden slagen moeste hi bogen
Onbekend,Onbekend Hoofdstuk,2693,Ende vallen ouer die knien
Onbekend,Onbekend Hoofdstuk,2694,Ferguut wart op mettien
Onbekend,Onbekend Hoofdstuk,2695,Ende dwanc ane hem sinen scilt
Onbekend,Onbekend Hoofdstuk,2696,Dat swert hi vaste in die hant hilt
Onbekend,Onbekend Hoofdstuk,2697,Hi verhieft met groter cracht
Onbekend,Onbekend Hoofdstuk,2698,Ende sloech den enen daer hi iegen vacht
Onbekend,Onbekend Hoofdstuk,2699,Bouen op den helm van stale
Onbekend,Onbekend Hoofdstuk,2700,Ende dore sloech heme altemale
Onbekend,Onbekend Hoofdstuk,2701,Coifie halsberch ende beckineel
Onbekend,Onbekend Hoofdstuk,2702,Ende vanden houede tbeeste deel
Onbekend,Onbekend Hoofdstuk,2703,Ende cloefden toten tanden toe
Onbekend,Onbekend Hoofdstuk,2704,Herde lude riep ferguut doe
Onbekend,Onbekend Hoofdstuk,2705,Dieue gi blijft hier altemale
Onbekend,Onbekend Hoofdstuk,2706,Waric op tors dat wetic wale
Onbekend,Onbekend Hoofdstuk,2707,Also suldi bi minen trouwen
Onbekend,Onbekend Hoofdstuk,2708,Ghi wanet mi hebben te blouwen
Onbekend,Onbekend Hoofdstuk,2709,Ende genomen mine gewade
Onbekend,Onbekend Hoofdstuk,2710,Dat sal v vergaen te quade
Onbekend,Onbekend Hoofdstuk,2711,Ghi sult alte gader bliuen
Onbekend,Onbekend Hoofdstuk,2712,Doe ginc hise weder driuen
Onbekend,Onbekend Hoofdstuk,2713,Deen hi sloech dander hi stac
Onbekend,Onbekend Hoofdstuk,2714,Die derde scoet die vierde trac
Onbekend,Onbekend Hoofdstuk,2715,Si sloegen hem sinen scilt in stltuckengt
Onbekend,Onbekend Hoofdstuk,2716,Ende sine wapine hi moeste ucken
Onbekend,Onbekend Hoofdstuk,2717,Want hi was gewont seere
Onbekend,Onbekend Hoofdstuk,2718,Soe dat hine waende nemmermere
Onbekend,Onbekend Hoofdstuk,2719,Vanden dage sijn ontgaen
Onbekend,Onbekend Hoofdstuk,2720,Doe ginc hi houwen ende slaen
Onbekend,Onbekend Hoofdstuk,2721,Met beiden handen inden tas
Onbekend,Onbekend Hoofdstuk,2722,So dat ginder niemen en was
Onbekend,Onbekend Hoofdstuk,2723,Hine ontsach ferguuts slage
Onbekend,Onbekend Hoofdstuk,2724,Si worden verbloet ende trage
Onbekend,Onbekend Hoofdstuk,2725,Ende sere te meskieue
Onbekend,Onbekend Hoofdstuk,2726,Ferguut verltmeigtsterde die dieue
Onbekend,Onbekend Hoofdstuk,2727,Ende sloech heme af voete ende hande
Onbekend,Onbekend Hoofdstuk,2728,Some lietsire haer hoeft te pande
Onbekend,Onbekend Hoofdstuk,2729,Fergute en dorsten si niet genaken
Onbekend,Onbekend Hoofdstuk,2730,Die dieue waenden hem wech maken
Onbekend,Onbekend Hoofdstuk,2731,Maer ferguut was daer te snel
Onbekend,Onbekend Hoofdstuk,2732,Ende liep na die ridders fel
Onbekend,Onbekend Hoofdstuk,2733,Ende achter gincse ane .i. berch
Onbekend,Onbekend Hoofdstuk,2734,Ende sloech hem scilt ende halsberch
Onbekend,Onbekend Hoofdstuk,2735,Tote .xiij. nam hire haer leuen
Onbekend,Onbekend Hoofdstuk,2736,Dander .ij. hebben hem op gegeuen
Onbekend,Onbekend Hoofdstuk,2737,Ende roepen op fergute genade
Onbekend,Onbekend Hoofdstuk,2738,Neen sprac hi hets te spade
Onbekend,Onbekend Hoofdstuk,2739,Ic sal v thoeft af slaen
Onbekend,Onbekend Hoofdstuk,2740,En si dat gi v geeft geuaen
Onbekend,Onbekend Hoofdstuk,2741,Den coninc van bertaengen arture
Onbekend,Onbekend Hoofdstuk,2742,Ende hem vertelt v auonture
Onbekend,Onbekend Hoofdstuk,2743,Segt dat v daer sent ferguut
Onbekend,Onbekend Hoofdstuk,2744,Groetse mi al ouer luut
Onbekend,Onbekend Hoofdstuk,2745,Die ridders die te houe behoren
Onbekend,Onbekend Hoofdstuk,2746,Sonder keyen als te voren
Onbekend,Onbekend Hoofdstuk,2747,Magic leuen het sal hem deren
Onbekend,Onbekend Hoofdstuk,2748,Dat hi met mi hilt sijn scheren
Onbekend,Onbekend Hoofdstuk,2749,Sine quade tale sal hem comen
Onbekend,Onbekend Hoofdstuk,2750,Meer te scaden dan te vromen
Onbekend,Onbekend Hoofdstuk,2751,Die ridders antworden fergute saen
Onbekend,Onbekend Hoofdstuk,2752,Here wi willen dit anegaen
Onbekend,Onbekend Hoofdstuk,2753,ltEndegt gheuen ons geuangen
Onbekend,Onbekend Hoofdstuk,2754,Arture den coninc hi mach ons hangen
Onbekend,Onbekend Hoofdstuk,2755,Ofte braden of verdrinken
Onbekend,Onbekend Hoofdstuk,2756,Ferguut sprac dan waent niet dinken
Onbekend,Onbekend Hoofdstuk,2757,Hine doet v nemmer el dan ere
Onbekend,Onbekend Hoofdstuk,2758,Doe sciedsi van den ionchere
Onbekend,Onbekend Hoofdstuk,2759,Ende makeden dapperlijc och
Onbekend,Onbekend Hoofdstuk,2760,Ferguut keerde weder sinen woch
Onbekend,Onbekend Hoofdstuk,2761,Tes hi weder te sinen orse quam
Onbekend,Onbekend Hoofdstuk,2762,Haestelijc hijt biden breidel nam
Onbekend,Onbekend Hoofdstuk,2763,Ende waerp hem int gereide
Onbekend,Onbekend Hoofdstuk,2764,Hi reet vollec wech sonder beide
Onbekend,Onbekend Hoofdstuk,2765,Peinsende omme galienen minne
Onbekend,Onbekend Hoofdstuk,2766,Ende wart staphants vten sinne
Onbekend,Onbekend Hoofdstuk,2767,Dat was grote iammerhede
Onbekend,Onbekend Hoofdstuk,2768,Ic waenre speelt die duuel mede
Onbekend,Onbekend Hoofdstuk,2769,Dattie minne es van so groter crachte
Onbekend,Onbekend Hoofdstuk,2770,Datsi eens mans gedachte
Onbekend,Onbekend Hoofdstuk,2771,In soe corter stont onder doet
Onbekend,Onbekend Hoofdstuk,2772,Wel gokelt si onder den hoet
Onbekend,Onbekend Hoofdstuk,2773,Bedi en cans niemen gehoeden
Onbekend,Onbekend Hoofdstuk,2774,Die gene die meest wanen vroeden
Onbekend,Onbekend Hoofdstuk,2775,Doetsi dolen alre meest
Onbekend,Onbekend Hoofdstuk,2776,Si sent in hem haren geest
Onbekend,Onbekend Hoofdstuk,2777,Ende doetse anebeden haren god
Onbekend,Onbekend Hoofdstuk,2778,Vanden vroeden maecse sot
Onbekend,Onbekend Hoofdstuk,2779,Ende vanden sotten vroet
Onbekend,Onbekend Hoofdstuk,2780,Enen doetse quaet .i. andren goet
Onbekend,Onbekend Hoofdstuk,2781,Ouer al es hare gewelt
Onbekend,Onbekend Hoofdstuk,2782,Si loept sere dan dien telt
Onbekend,Onbekend Hoofdstuk,2783,Hare en mach nieman ontriden
Onbekend,Onbekend Hoofdstuk,2784,Wien si wille doet si gliden
Onbekend,Onbekend Hoofdstuk,2785,Dus voer ferguut al omtrent
Onbekend,Onbekend Hoofdstuk,2786,Die minne doet hem groet torment
Onbekend,Onbekend Hoofdstuk,2787,Hine weet welc et es dach of nacht
Onbekend,Onbekend Hoofdstuk,2788,Ende heft verloren alsine cracht
Onbekend,Onbekend Hoofdstuk,2789,Sine vroetscap ende sine virtuut
Onbekend,Onbekend Hoofdstuk,2790,Aldus dolende reet ferguut
Onbekend,Onbekend Hoofdstuk,2791,Al moeder ene in dat wout
Onbekend,Onbekend Hoofdstuk,2792,Die minne pijnten menechfout
Onbekend,Onbekend Hoofdstuk,2793,Nv swiget ende waent mi horen
Onbekend,Onbekend Hoofdstuk,2794,Dauonture van hier te voren
Onbekend,Onbekend Hoofdstuk,2795,Hoe dane wijs die ridder swart
Onbekend,Onbekend Hoofdstuk,2796,Also saen alse hi genesen wart
Onbekend,Onbekend Hoofdstuk,2797,Van sinen wonden ende hem dochte
Onbekend,Onbekend Hoofdstuk,2798,Dat hi te houe varen mochte
Onbekend,Onbekend Hoofdstuk,2799,Sine wapine hiesch hi altemale
Onbekend,Onbekend Hoofdstuk,2800,Men brochse vore hem in die zale
Onbekend,Onbekend Hoofdstuk,2801,Gewapint was hi gereet
Onbekend,Onbekend Hoofdstuk,2802,Sijn ors brochtmen hem geleet
Onbekend,Onbekend Hoofdstuk,2803,Hi waerp hem in die artsoene
Onbekend,Onbekend Hoofdstuk,2804,Sonder knapen ende garsoene
Onbekend,Onbekend Hoofdstuk,2805,Makedi hem te houe wert
Onbekend,Onbekend Hoofdstuk,2806,Dapperlike ende onveruert
Onbekend,Onbekend Hoofdstuk,2807,Alle sine dachuarde willic helen
Onbekend,Onbekend Hoofdstuk,2808,Want ic en weetse binnen velen
Onbekend,Onbekend Hoofdstuk,2809,Ne waer te cardoel es hi comen
Onbekend,Onbekend Hoofdstuk,2810,Daer hi den coninc heft vernomen
Onbekend,Onbekend Hoofdstuk,2811,Die sijn hof hilt met groten loue
Onbekend,Onbekend Hoofdstuk,2812,Hi maect hem vollec te houe
Onbekend,Onbekend Hoofdstuk,2813,Daer haddemen dat eten leden
Onbekend,Onbekend Hoofdstuk,2814,Voer den coninc es hi gereden
Onbekend,Onbekend Hoofdstuk,2815,Helm op thoeft . scilt anden hals
Onbekend,Onbekend Hoofdstuk,2816,Hine maecte geen groet gedalsch
Onbekend,Onbekend Hoofdstuk,2817,Maer hi viel op sconinx voet
Onbekend,Onbekend Hoofdstuk,2818,Hi sprac artur coninc goet
Onbekend,Onbekend Hoofdstuk,2819,Doet mi horen ouer luut
Onbekend,Onbekend Hoofdstuk,2820,Een ridder die heet ferguut
Onbekend,Onbekend Hoofdstuk,2821,Heft mi met wapinen verwonnen
Onbekend,Onbekend Hoofdstuk,2822,Onder die scijnte van der sonnen
Onbekend,Onbekend Hoofdstuk,2823,So wanic wel dat niemans leuen
Onbekend,Onbekend Hoofdstuk,2824,Sijn gelijc es no diemen geuen
Onbekend,Onbekend Hoofdstuk,2825,Met rechte mach lof ende prijs
Onbekend,Onbekend Hoofdstuk,2826,Vore heme god van paradijs
Onbekend,Onbekend Hoofdstuk,2827,Moeten bescermen van ongeualle
Onbekend,Onbekend Hoofdstuk,2828,Here hi groet v ridders alle
Onbekend,Onbekend Hoofdstuk,2829,Sonder den drossate keye
Onbekend,Onbekend Hoofdstuk,2830,Dien radic wel bi sente meye
Onbekend,Onbekend Hoofdstuk,2831,Bede bi dage ende bi nachte
Onbekend,Onbekend Hoofdstuk,2832,Dat hi hem van fergute wachte
Onbekend,Onbekend Hoofdstuk,2833,Dien dreecht hi vtermaten sere
Onbekend,Onbekend Hoofdstuk,2834,Want hi seide hem groet onnere
Onbekend,Onbekend Hoofdstuk,2835,Vore alle die ridders vanden lande
Onbekend,Onbekend Hoofdstuk,2836,Eer hi fergute wel kande
Onbekend,Onbekend Hoofdstuk,2837,Here her coninc siet hier den horen
Onbekend,Onbekend Hoofdstuk,2838,Die menegen man gedaen heft toren
Onbekend,Onbekend Hoofdstuk,2839,Ende dat hoet cleet van ziden
Onbekend,Onbekend Hoofdstuk,2840,Sent hi v noit tenegen tiden
Onbekend,Onbekend Hoofdstuk,2841,Sone conste noit man vp mi gewinnen
Onbekend,Onbekend Hoofdstuk,2842,Ic wille dat alle v ridders kinnen
Onbekend,Onbekend Hoofdstuk,2843,Menich man heuet becocht
Onbekend,Onbekend Hoofdstuk,2844,Die dauonture hebben ane socht
Onbekend,Onbekend Hoofdstuk,2845,Dien hebbic alle tlijf genomen
Onbekend,Onbekend Hoofdstuk,2846,Here nv ben ic tote v comen
Onbekend,Onbekend Hoofdstuk,2847,Ende leuere mi in v prisoen
Onbekend,Onbekend Hoofdstuk,2848,Met mi mogedi vwen wille doen
Onbekend,Onbekend Hoofdstuk,2849,Ghi moget mi hangen of radebraken
Onbekend,Onbekend Hoofdstuk,2850,Ende bitterlike doet doen smaken
Onbekend,Onbekend Hoofdstuk,2851,Doe antworde hem die coninc saen
Onbekend,Onbekend Hoofdstuk,2852,Ridder waent vollic op staen
Onbekend,Onbekend Hoofdstuk,2853,Ende doet v wapine vut
Onbekend,Onbekend Hoofdstuk,2854,Omdat v hier sende ferguut
Onbekend,Onbekend Hoofdstuk,2855,Vergeuic v minen euelen moet
Onbekend,Onbekend Hoofdstuk,2856,Die vangenesse suldi hebben goet
Onbekend,Onbekend Hoofdstuk,2857,Ic leuere v der coninginnen
Onbekend,Onbekend Hoofdstuk,2858,Mire vrouwen si wille v kinnen
Onbekend,Onbekend Hoofdstuk,2859,Ic hope si sal v doen groet ere
Onbekend,Onbekend Hoofdstuk,2860,Dies dankesi alle den coninc sere
Onbekend,Onbekend Hoofdstuk,2861,Ouer ene corte wile saen
Onbekend,Onbekend Hoofdstuk,2862,Soe quam die ridder ende die naen
