author,chapter,line,text
Onbekend,Onbekend Hoofdstuk,1234,Ende scoet der ioncfrouwen dore doge
Onbekend,Onbekend Hoofdstuk,1235,In therte so diep hen conste verdriuen
Onbekend,Onbekend Hoofdstuk,1236,Noit meester het moeste met haer bliuen
Onbekend,Onbekend Hoofdstuk,1237,In wil niet dats mi yemen veronste
Onbekend,Onbekend Hoofdstuk,1238,Dat ic seide dat minne conste
Onbekend,Onbekend Hoofdstuk,1239,Scichte schieten of quarele
Onbekend,Onbekend Hoofdstuk,1240,Al ware een man in .iij. castele
Onbekend,Onbekend Hoofdstuk,1241,Dore wapent met ysere ofte met stale
Onbekend,Onbekend Hoofdstuk,1242,Si dore scoten met haren strale
Onbekend,Onbekend Hoofdstuk,1243,Die minne es soe ghetrahijnt
Onbekend,Onbekend Hoofdstuk,1244,Hare scichte sijn soe ghefenijnt
Onbekend,Onbekend Hoofdstuk,1245,Wien si scietet wijf of man
Onbekend,Onbekend Hoofdstuk,1246,Dat hijs genesen niet en can
Onbekend,Onbekend Hoofdstuk,1247,Dit scicht die scone binnen heft
Onbekend,Onbekend Hoofdstuk,1248,Si salt dragen den dach datsi left
Onbekend,Onbekend Hoofdstuk,1249,Galiene sere versucht
Onbekend,Onbekend Hoofdstuk,1250,Si decket sere want si vrucht
Onbekend,Onbekend Hoofdstuk,1251,Dats haer oem mach werden in jnne
Onbekend,Onbekend Hoofdstuk,1252,Datsi ten ridder wert draget minne
Onbekend,Onbekend Hoofdstuk,1253,Enen bonten mantel ter vaert
Onbekend,Onbekend Hoofdstuk,1254,Brochtmen hem ende dede op sijn paert
Onbekend,Onbekend Hoofdstuk,1255,Men heuet gewreuen ende geconreit
Onbekend,Onbekend Hoofdstuk,1256,Die crebbe vol euenen vore hem geleit
Onbekend,Onbekend Hoofdstuk,1257,Dors ginc eten sere ende vast
Onbekend,Onbekend Hoofdstuk,1258,Nv peinsde die wert omme sinen gast
Onbekend,Onbekend Hoofdstuk,1259,Ende ferguut doet dat hi ghert
Onbekend,Onbekend Hoofdstuk,1260,Want sinen orsse niet en deert
Onbekend,Onbekend Hoofdstuk,1261,Indie zale sijn si gegaen
Onbekend,Onbekend Hoofdstuk,1262,Galiene was gheuaen
Onbekend,Onbekend Hoofdstuk,1263,Met minnen die sere ontsiet
Onbekend,Onbekend Hoofdstuk,1264,Haren oem maer hine merkes niet
Onbekend,Onbekend Hoofdstuk,1265,Enen pellen gincmen daer spreden
Onbekend,Onbekend Hoofdstuk,1266,Daer si op saten onder hen beden
Onbekend,Onbekend Hoofdstuk,1267,Ferguut ende die ioncfrouwe
Onbekend,Onbekend Hoofdstuk,1268,Diene minde met goeder trouwe
Onbekend,Onbekend Hoofdstuk,1269,Sine dorste hem gewagen niet
Onbekend,Onbekend Hoofdstuk,1270,Want si die onnere ontsiet
Onbekend,Onbekend Hoofdstuk,1271,Die riddere hare noit wort en seide
Onbekend,Onbekend Hoofdstuk,1272,Dus satense ende swegen ltbeidegt
Onbekend,Onbekend Hoofdstuk,1273,Datmen .i. grote mile
Onbekend,Onbekend Hoofdstuk,1274,Mochte hebben gegaen die wile
Onbekend,Onbekend Hoofdstuk,1275,Si en dorste no hi en ltconste medegt
Onbekend,Onbekend Hoofdstuk,1276,Daer omme die tale bllteef tier stedegt
Onbekend,Onbekend Hoofdstuk,1277,Men hietse dwaen ende gaen eten
Onbekend,Onbekend Hoofdstuk,1278,Si dwoegen ende sijn geseten
Onbekend,Onbekend Hoofdstuk,1279,Men brochte hem spisen gnoech
Onbekend,Onbekend Hoofdstuk,1280,Ende van wine haer geuoech
Onbekend,Onbekend Hoofdstuk,1281,Si aten ende men hiet op doen
Onbekend,Onbekend Hoofdstuk,1282,Doe quam gelopen een garsoen
Onbekend,Onbekend Hoofdstuk,1283,Ende dede op dat ammelaken
Onbekend,Onbekend Hoofdstuk,1284,Van wilden dieren ende van draken
Onbekend,Onbekend Hoofdstuk,1285,So was die tafle gehouwen
Onbekend,Onbekend Hoofdstuk,1286,Ic wanemen inder dunouwen
Onbekend,Onbekend Hoofdstuk,1287,Tafle en vonde so wel gewrocht
Onbekend,Onbekend Hoofdstuk,1288,Diese makede was wel bedocht
Onbekend,Onbekend Hoofdstuk,1289,Men deetse op ende die scragen
Onbekend,Onbekend Hoofdstuk,1290,Die wert ginc fergute vragen
Onbekend,Onbekend Hoofdstuk,1291,Wanen hi quame wat hi sochte
Onbekend,Onbekend Hoofdstuk,1292,Ferguut seit heme die niet en rochte
Onbekend,Onbekend Hoofdstuk,1293,Te liegene hoe hi te houe quam
Onbekend,Onbekend Hoofdstuk,1294,Ende hoe hi sine wapine nam
Onbekend,Onbekend Hoofdstuk,1295,Ende hoe hem her keye liep oppe
Onbekend,Onbekend Hoofdstuk,1296,Indie zale met sinen scoppe
Onbekend,Onbekend Hoofdstuk,1297,Daer na teldi hem te waren
Onbekend,Onbekend Hoofdstuk,1298,Hoe hi ter roken wilde varen
Onbekend,Onbekend Hoofdstuk,1299,Den wimpel halen ende den horen
Onbekend,Onbekend Hoofdstuk,1300,Comt mi die swerte ridder te voren
Onbekend,Onbekend Hoofdstuk,1301,Ic segt v wel alsonder faelgie
Onbekend,Onbekend Hoofdstuk,1302,Ic sal hem leueren battaelgie
Onbekend,Onbekend Hoofdstuk,1303,Magicken verwinnen ende matten
Onbekend,Onbekend Hoofdstuk,1304,Ic sal sijn hoeft diere scatten
Onbekend,Onbekend Hoofdstuk,1305,Die goede man wel verstoet
Onbekend,Onbekend Hoofdstuk,1306,Dat ferguut hadde stouten moet
Onbekend,Onbekend Hoofdstuk,1307,Het was heme vtermaten leet
Onbekend,Onbekend Hoofdstuk,1308,Dat hi die auenture ane geet
Onbekend,Onbekend Hoofdstuk,1309,Ende seide lieue iongelinc
Onbekend,Onbekend Hoofdstuk,1310,Niet lief en hadde v die coninc
Onbekend,Onbekend Hoofdstuk,1311,Die v sende in dese auonture
Onbekend,Onbekend Hoofdstuk,1312,Die menegen man es worden sure
Onbekend,Onbekend Hoofdstuk,1313,Nieman en mach danen comen
Onbekend,Onbekend Hoofdstuk,1314,Die ridder heft menegen tlijf genomen
Onbekend,Onbekend Hoofdstuk,1315,So sal hi v gi selter steruen
Onbekend,Onbekend Hoofdstuk,1316,Hi sal .i. hoeft meer moeten keruen
Onbekend,Onbekend Hoofdstuk,1317,Ic rade v wel dat gijs ontbert
Onbekend,Onbekend Hoofdstuk,1318,Ende ghi ter roken niet en vaert
Onbekend,Onbekend Hoofdstuk,1319,Laetse den duuel volen gaen
Onbekend,Onbekend Hoofdstuk,1320,Ghi hebt ene sotheit onder staen
Onbekend,Onbekend Hoofdstuk,1321,Die swarte ridder es so fel
Onbekend,Onbekend Hoofdstuk,1322,Hi nemt v thoeft dat wetic wel
Onbekend,Onbekend Hoofdstuk,1323,Si hebben hier gesocht den horen
Onbekend,Onbekend Hoofdstuk,1324,Diere haer leuen omme verloren
Onbekend,Onbekend Hoofdstuk,1325,Hens ridder jndie werelt gheen
Onbekend,Onbekend Hoofdstuk,1326,Die name heeft iegen hem .ij. sleen
Onbekend,Onbekend Hoofdstuk,1327,Ferguut verstont wel sinen wert
Onbekend,Onbekend Hoofdstuk,1328,Hi was blide ende onveruert
Onbekend,Onbekend Hoofdstuk,1329,Ende sprac lieue here en segt nemmeer
Onbekend,Onbekend Hoofdstuk,1330,Ic en weter ghenen andren keer
Onbekend,Onbekend Hoofdstuk,1331,Groet wint gesit met clenen regene
Onbekend,Onbekend Hoofdstuk,1332,Die hem veruaert berghe hem in deuene
Onbekend,Onbekend Hoofdstuk,1333,Ic sal der liebardinnen simple
Onbekend,Onbekend Hoofdstuk,1334,Den horen nemen ende den wimple
Onbekend,Onbekend Hoofdstuk,1335,Lieue her wert en raet mi niet
Onbekend,Onbekend Hoofdstuk,1336,Dat ic minen scilt die gi siet
Onbekend,Onbekend Hoofdstuk,1337,Adus geel te houe drage
Onbekend,Onbekend Hoofdstuk,1338,Men maecte van mi .i. sage
Onbekend,Onbekend Hoofdstuk,1339,Mijn her key hilt met mi sijn spod
Onbekend,Onbekend Hoofdstuk,1340,Hi hadde recht also help mi god
Onbekend,Onbekend Hoofdstuk,1341,Mijn lijf omme den horen verdwijnt
Onbekend,Onbekend Hoofdstuk,1342,Alse die wert hort dat hi hem pijnt
Onbekend,Onbekend Hoofdstuk,1343,Om niet dat hi den ridder bat
Onbekend,Onbekend Hoofdstuk,1344,Hi sprac vrient ic en seit niet op dat
Onbekend,Onbekend Hoofdstuk,1345,Dat v soude wesen quaet
Onbekend,Onbekend Hoofdstuk,1346,Nv doet dat v in therte staet
Onbekend,Onbekend Hoofdstuk,1347,Ghi sijt in auonturen groet
Onbekend,Onbekend Hoofdstuk,1348,God moet v bringen vter noet
Onbekend,Onbekend Hoofdstuk,1349,Alsi dus saten ende spraken
Onbekend,Onbekend Hoofdstuk,1350,So gincmen die bedden maken
Onbekend,Onbekend Hoofdstuk,1351,Een knape quam ende hiet op staen
Onbekend,Onbekend Hoofdstuk,1352,Die heren ende slapen gaen
Onbekend,Onbekend Hoofdstuk,1353,Ferguut stont op die sere vaect
Onbekend,Onbekend Hoofdstuk,1354,Vollec hi hem te bedde maect
Onbekend,Onbekend Hoofdstuk,1355,Doe gingensi alle gader slapen
Onbekend,Onbekend Hoofdstuk,1356,Die ioncfrouwe lach in vroewaken
Onbekend,Onbekend Hoofdstuk,1357,Die te ferragute hadde haer gepeins
Onbekend,Onbekend Hoofdstuk,1358,Si keerde hare hier ende gheins
Onbekend,Onbekend Hoofdstuk,1359,Sine wiste watsi secgen mochte
Onbekend,Onbekend Hoofdstuk,1360,Si verscoet dicke ende versochte
Onbekend,Onbekend Hoofdstuk,1361,O wi ferguut wel soete amijs
Onbekend,Onbekend Hoofdstuk,1362,Dat ic nv doge hoe lettel wettijs
Onbekend,Onbekend Hoofdstuk,1363,Amijs. wat seggic sottinne
Onbekend,Onbekend Hoofdstuk,1364,Ic en sagen noit dan heden hier inne
Onbekend,Onbekend Hoofdstuk,1365,Arger ben ic dan een dief
Onbekend,Onbekend Hoofdstuk,1366,Dat ic den genen wille hebben lief
Onbekend,Onbekend Hoofdstuk,1367,Die ic noit en sach meer dan heden
Onbekend,Onbekend Hoofdstuk,1368,Noch en sprac in eneger steden
Onbekend,Onbekend Hoofdstuk,1369,Morgen so sal hi orlof
Onbekend,Onbekend Hoofdstuk,1370,Betide nemen ende ltrumen thofgt
Onbekend,Onbekend Hoofdstuk,1371,Dan sal hi nemmer van mi weten
Onbekend,Onbekend Hoofdstuk,1372,Saen sal hi mijns vergeten
Onbekend,Onbekend Hoofdstuk,1373,In weet hoes hem gedinken mochte
Onbekend,Onbekend Hoofdstuk,1374,Dade hi altenen in sijn gedochte
Onbekend,Onbekend Hoofdstuk,1375,Daer hi quame alle ioncfrouwen
Onbekend,Onbekend Hoofdstuk,1376,Het ware heme quaet te minen trouwen
Onbekend,Onbekend Hoofdstuk,1377,Hi vaert tielec wech metten dage
Onbekend,Onbekend Hoofdstuk,1378,Hoe sal hi geweten mine clage
Onbekend,Onbekend Hoofdstuk,1379,Hoe wel dat icken minnen mach
Onbekend,Onbekend Hoofdstuk,1380,Hi sal mi geuen den doet slach
Onbekend,Onbekend Hoofdstuk,1381,Wisti dat ic in selken vare
Onbekend,Onbekend Hoofdstuk,1382,In allen stonden dore hem ware
Onbekend,Onbekend Hoofdstuk,1383,Hine dade nemmer die dorperheltidegt
Onbekend,Onbekend Hoofdstuk,1384,Dat hi mi sine minne ontseide
Onbekend,Onbekend Hoofdstuk,1385,Secgict hem niet hine weet nommer
Onbekend,Onbekend Hoofdstuk,1386,Wi seggict hem ic segge mi commer
Onbekend,Onbekend Hoofdstuk,1387,Waer soudic nemen die gedachte
Onbekend,Onbekend Hoofdstuk,1388,Ic soude onneren mijn geslachte
Onbekend,Onbekend Hoofdstuk,1389,Ic lage mi lieuer jndie doet kiste
Onbekend,Onbekend Hoofdstuk,1390,Dan hijt van minen monde wiste
Onbekend,Onbekend Hoofdstuk,1391,Wat doe ic dan ic sal wech vlien
Onbekend,Onbekend Hoofdstuk,1392,Om enen andren salic spien
Onbekend,Onbekend Hoofdstuk,1393,In willen sien in al mijn leuen
Onbekend,Onbekend Hoofdstuk,1394,Mijn vader wille mi emmer geuen
Onbekend,Onbekend Hoofdstuk,1395,Enen hogen prinche enen coninc
Onbekend,Onbekend Hoofdstuk,1396,Vele scoenre dan desen jongelinc
Onbekend,Onbekend Hoofdstuk,1397,Ay scoenren wat hebbic geseit
Onbekend,Onbekend Hoofdstuk,1398,So sconen ware mi onghereit
Onbekend,Onbekend Hoofdstuk,1399,Want niewer sijn genoet es
Onbekend,Onbekend Hoofdstuk,1400,Wiste hi doch hoet met mi es
Onbekend,Onbekend Hoofdstuk,1401,Ende icken lachterde so sere
Onbekend,Onbekend Hoofdstuk,1402,Hine minde mi nemmermere
Onbekend,Onbekend Hoofdstuk,1403,Want hine mint mi groet no clene
Onbekend,Onbekend Hoofdstuk,1404,Gisteren so sat hi bi mi allene
Onbekend,Onbekend Hoofdstuk,1405,Hine sprac te mi wert noit entwint
Onbekend,Onbekend Hoofdstuk,1406,Dat haddi . haddi mi ghemint
Onbekend,Onbekend Hoofdstuk,1407,Ic wane hijs niet togen en can
Onbekend,Onbekend Hoofdstuk,1408,Wat soudic minnen selken man
Onbekend,Onbekend Hoofdstuk,1409,Morgen vroe alst sal graken
Onbekend,Onbekend Hoofdstuk,1410,Sal lthi hemgt betide wech maken
Onbekend,Onbekend Hoofdstuk,1411,Hier en blijft niet sine scoenheit
Onbekend,Onbekend Hoofdstuk,1412,Soe sal hi mi sijn onghereit
Onbekend,Onbekend Hoofdstuk,1413,Sine scoenheit wat bestaetsi mi
Onbekend,Onbekend Hoofdstuk,1414,Waer omme spreke ic ende twi
Onbekend,Onbekend Hoofdstuk,1415,Sal icse heme nemen ende sine cracht
Onbekend,Onbekend Hoofdstuk,1416,Neen ic bider goeder nacht
Onbekend,Onbekend Hoofdstuk,1417,Mi ware leet sine mesquame
Onbekend,Onbekend Hoofdstuk,1418,Ic gaue heme eer dan ic hem name
Onbekend,Onbekend Hoofdstuk,1419,Dus leit die joncfrouwe in pinen
Onbekend,Onbekend Hoofdstuk,1420,Si versucht sere ende waent verdwinen
Onbekend,Onbekend Hoofdstuk,1421,Die minne dat spel haer leert
Onbekend,Onbekend Hoofdstuk,1422,Menechfout si hare op tbedde keert
Onbekend,Onbekend Hoofdstuk,1423,Dus gelt die minne achter lande
Onbekend,Onbekend Hoofdstuk,1424,Den ridders haer saut menegerande
Onbekend,Onbekend Hoofdstuk,1425,Der ioncfrouwen heft ltsgtijs oec gegeuen
Onbekend,Onbekend Hoofdstuk,1426,Sine werdes quite in al haer leuen
Onbekend,Onbekend Hoofdstuk,1427,Het was hare vtermaten leet
Onbekend,Onbekend Hoofdstuk,1428,Datter ferguut niet af enweet
Onbekend,Onbekend Hoofdstuk,1429,Si hadde sochter die pine gehouden
Onbekend,Onbekend Hoofdstuk,1430,Hadde die ridder geweest vergouden
Onbekend,Onbekend Hoofdstuk,1431,Bedi hadsijs te meerren pant
Onbekend,Onbekend Hoofdstuk,1432,Inharen rade datsi vant
Onbekend,Onbekend Hoofdstuk,1433,Datsi vanden bedde wille op staen
Onbekend,Onbekend Hoofdstuk,1434,Ende tote fergute gaen
Onbekend,Onbekend Hoofdstuk,1435,Die tote hare niet een twint
Onbekend,Onbekend Hoofdstuk,1436,En peinst no weet dat sine mint
Onbekend,Onbekend Hoofdstuk,1437,Si stac ane haer hemde sidijn
Onbekend,Onbekend Hoofdstuk,1438,Ende .i. pelse hermerijn
Onbekend,Onbekend Hoofdstuk,1439,Stillekine es si gegaen
Onbekend,Onbekend Hoofdstuk,1440,Toter cameren ende heftse ondaen
Onbekend,Onbekend Hoofdstuk,1441,Al met ghemake ginc si vort
Onbekend,Onbekend Hoofdstuk,1442,Haer ware leet haddement gehort
Onbekend,Onbekend Hoofdstuk,1443,Toten bedde dat si quam
Onbekend,Onbekend Hoofdstuk,1444,Ferguut si slapende vernam
Onbekend,Onbekend Hoofdstuk,1445,Si stont al pensende .i. lanc stic
Onbekend,Onbekend Hoofdstuk,1446,Wacharme seitsi wat salic
Onbekend,Onbekend Hoofdstuk,1447,Ten ridder secgen als hi ontwaect
Onbekend,Onbekend Hoofdstuk,1448,Wel naer hadsi haer weder gemaect
Onbekend,Onbekend Hoofdstuk,1449,Teltngt bedde daer si lach te voren
Onbekend,Onbekend Hoofdstuk,1450,Maer die minne riet hare in doreltngt
Onbekend,Onbekend Hoofdstuk,1451,Datsine wecte liselike
Onbekend,Onbekend Hoofdstuk,1452,Den ridder ende seide hem hastelike
Onbekend,Onbekend Hoofdstuk,1453,Algader hoet met haer stoet ende ware
Onbekend,Onbekend Hoofdstuk,1454,Galiene was in vare
Onbekend,Onbekend Hoofdstuk,1455,Dat sijt den ridder soude gewagen
Onbekend,Onbekend Hoofdstuk,1456,Die minne gincse weder jagen
Onbekend,Onbekend Hoofdstuk,1457,Ende riet hare datsi haren moet
Onbekend,Onbekend Hoofdstuk,1458,Den ridder ondecte ende hoet haer stoet
Onbekend,Onbekend Hoofdstuk,1459,Hen es dorper ne geen so fine
Onbekend,Onbekend Hoofdstuk,1460,Hem ensoude ontfarmen haer pine
Onbekend,Onbekend Hoofdstuk,1461,Die si dogede die joncfrouwe
Onbekend,Onbekend Hoofdstuk,1462,Si wranc haer hande met groten rouwe
Onbekend,Onbekend Hoofdstuk,1463,Ende si versuchte ende weende sere
Onbekend,Onbekend Hoofdstuk,1464,Want het dochte hare grote onnere
Onbekend,Onbekend Hoofdstuk,1465,Op sine herte tintelde hare hant
Onbekend,Onbekend Hoofdstuk,1466,Ferguut ontwakede alte hant
Onbekend,Onbekend Hoofdstuk,1467,Ende vant knielen galienen
Onbekend,Onbekend Hoofdstuk,1468,Vore hem ende sere wenen
Onbekend,Onbekend Hoofdstuk,1469,Ferguut gegreepse herde saen
Onbekend,Onbekend Hoofdstuk,1470,Ende seide ioncfrouwe gi sijt geuaen
Onbekend,Onbekend Hoofdstuk,1471,Segt mi wat soekedi hier nv
Onbekend,Onbekend Hoofdstuk,1472,Galiene sprac ic come hier tv
Onbekend,Onbekend Hoofdstuk,1473,Lief v minne heft mi gheuaen
Onbekend,Onbekend Hoofdstuk,1474,Ghine troest mi si sal mi verslaen
Onbekend,Onbekend Hoofdstuk,1475,V minne doet mi groten toren
Onbekend,Onbekend Hoofdstuk,1476,Al mine herte hebbic verloren
Onbekend,Onbekend Hoofdstuk,1477,Die hier tote v quam geuaren
Onbekend,Onbekend Hoofdstuk,1478,Waer es soe lief . wijstse mi caren
Onbekend,Onbekend Hoofdstuk,1479,Geeft mi mijn herte soe doedi wel
Onbekend,Onbekend Hoofdstuk,1480,Ferguut sprac houdi v spel
Onbekend,Onbekend Hoofdstuk,1481,Ioncfrouwe in sach v herte nie
Onbekend,Onbekend Hoofdstuk,1482,Sine quam hier niet in segt bedie
Onbekend,Onbekend Hoofdstuk,1483,Haddicse ic en gauese v niet
Onbekend,Onbekend Hoofdstuk,1484,Ic ensachse nie ioncfrouwe vliet
Onbekend,Onbekend Hoofdstuk,1485,Ay her ridder en secges nemmeer
Onbekend,Onbekend Hoofdstuk,1486,Ghi hebt mijn herte gi doet mi seer
Onbekend,Onbekend Hoofdstuk,1487,Ghi hebter qualijc omme gesien
Onbekend,Onbekend Hoofdstuk,1488,Dat gi mi wech hetet vlien
Onbekend,Onbekend Hoofdstuk,1489,Si es tuwen dienste lude ende stille
Onbekend,Onbekend Hoofdstuk,1490,Ghi moget met mi doen vwen wille
Onbekend,Onbekend Hoofdstuk,1491,Ic en werde nemmer blide
Onbekend,Onbekend Hoofdstuk,1492,Sonder v jn enegen tide
Onbekend,Onbekend Hoofdstuk,1493,Om v ben ic in groter noet
Onbekend,Onbekend Hoofdstuk,1494,Ghi hebt mijn leuen ende mijn doet
Onbekend,Onbekend Hoofdstuk,1495,Al lachende so sprac ferguut
Onbekend,Onbekend Hoofdstuk,1496,Ioncfrouwe omme ander dinc ben ic vut
Onbekend,Onbekend Hoofdstuk,1497,Dan omme dusdane saken comen
Onbekend,Onbekend Hoofdstuk,1498,Ene battaelgie hebbic genomen
Onbekend,Onbekend Hoofdstuk,1499,Die ic emmer voldoen moet
Onbekend,Onbekend Hoofdstuk,1500,Ioncfrouwe geualse mi goet
Onbekend,Onbekend Hoofdstuk,1501,Tote v salic weder keren
Onbekend,Onbekend Hoofdstuk,1502,Dan suldi mi te minnen leren
Onbekend,Onbekend Hoofdstuk,1503,Mine minne sal v sijn gereet
Onbekend,Onbekend Hoofdstuk,1504,Ende al dat ic mach doen godweet
Onbekend,Onbekend Hoofdstuk,1505,Maer ic bidde dat gi mi verste geft
Onbekend,Onbekend Hoofdstuk,1506,Tes mi die ridder gesproken heft
Onbekend,Onbekend Hoofdstuk,1507,ltDien men heet vander roken zwertgt
Onbekend,Onbekend Hoofdstuk,1508,ltHoe sere dat mi te pinen wertgt
Onbekend,Onbekend Hoofdstuk,1509,ltWant in weet ghene keyserinnegt
Onbekend,Onbekend Hoofdstuk,1510,Dier ic orlouede mine minne
Onbekend,Onbekend Hoofdstuk,1511,Vore dat ic hebbe verwonnen
Onbekend,Onbekend Hoofdstuk,1512,Den ridder wils mi god onnen
Onbekend,Onbekend Hoofdstuk,1513,Alse dit die ioncfrouwe versiet
Onbekend,Onbekend Hoofdstuk,1514,Hastelike si danen sciet
Onbekend,Onbekend Hoofdstuk,1515,Op hare bedde es si gegaen
Onbekend,Onbekend Hoofdstuk,1516,Si was met groten sere beuaen
Onbekend,Onbekend Hoofdstuk,1517,Si scaemde hare vtenmaten sere
Onbekend,Onbekend Hoofdstuk,1518,Dat si op minne ten jonchere
Onbekend,Onbekend Hoofdstuk,1519,Ginc diese haer ontseit heft
Onbekend,Onbekend Hoofdstuk,1520,Hare rouwet sere datsi left
Onbekend,Onbekend Hoofdstuk,1521,Si hilt hare seluen ouer quaet
Onbekend,Onbekend Hoofdstuk,1522,Datsi noit dede die ouerdaet
Onbekend,Onbekend Hoofdstuk,1523,Ene wile seitsoe si soude haer herten
Onbekend,Onbekend Hoofdstuk,1524,Soe soude si comen vter smerten
Onbekend,Onbekend Hoofdstuk,1525,Ene ander werf in haren sinne
Onbekend,Onbekend Hoofdstuk,1526,Seitsoe dat haer noit wijf om minne
Onbekend,Onbekend Hoofdstuk,1527,In haer geslachte tleuen nam
Onbekend,Onbekend Hoofdstuk,1528,Sine souts niet doen al was si gram
Onbekend,Onbekend Hoofdstuk,1529,Doe seidsoe morgen vroe alst daget
Onbekend,Onbekend Hoofdstuk,1530,Soe willic oec varen ter iaget
Onbekend,Onbekend Hoofdstuk,1531,Te minen vader sonder orlof
Onbekend,Onbekend Hoofdstuk,1532,Ic wille der minnen comen of
Onbekend,Onbekend Hoofdstuk,1533,Binnen dien dat dus gemict
Onbekend,Onbekend Hoofdstuk,1534,Die ioncfrouwe quam die dach gestrict
Onbekend,Onbekend Hoofdstuk,1535,Indie sale het was claer daer vut
Onbekend,Onbekend Hoofdstuk,1536,Hastelike wart op ferguut
Onbekend,Onbekend Hoofdstuk,1537,Hi wilde sine wapine anedoen
Onbekend,Onbekend Hoofdstuk,1538,Doe brochse voer hem een garsoen
Onbekend,Onbekend Hoofdstuk,1539,Hi was gewapint ghereet
Onbekend,Onbekend Hoofdstuk,1540,Men brochte sijn ors vor hem geleet
Onbekend,Onbekend Hoofdstuk,1541,Hi spranc vollijc in dat gesmide
Onbekend,Onbekend Hoofdstuk,1542,Sijn ors was vtermaten blide
Onbekend,Onbekend Hoofdstuk,1543,Te sinen wert nam hi orlof
Onbekend,Onbekend Hoofdstuk,1544,Ende seide hi wilde ltrumen thofgt
Onbekend,Onbekend Hoofdstuk,1545,Ende daerna ane die joncfrouwe
Onbekend,Onbekend Hoofdstuk,1546,Die stont beuaen met groten rouwe
Onbekend,Onbekend Hoofdstuk,1547,Doe ruemdi die iegenode
Onbekend,Onbekend Hoofdstuk,1548,Tors liep wech en deet niet node
Onbekend,Onbekend Hoofdstuk,1549,Sijn wert wijsdem dien pat
Onbekend,Onbekend Hoofdstuk,1550,Ter roken wert sere hi hem bat
Onbekend,Onbekend Hoofdstuk,1551,Oft hi vanden wige heft die ere
Onbekend,Onbekend Hoofdstuk,1552,Dat hi te heme weder kere
Onbekend,Onbekend Hoofdstuk,1553,Ferguut sprac here v gebod
Onbekend,Onbekend Hoofdstuk,1554,Salic doen wille mi helpen god
Onbekend,Onbekend Hoofdstuk,1555,Hebbic dien horen ende thoeft cleet
Onbekend,Onbekend Hoofdstuk,1556,Ic sal tote v comen gereet
Onbekend,Onbekend Hoofdstuk,1557,Doe sciet ferguut van sinen wert
Onbekend,Onbekend Hoofdstuk,1558,Ende reet vaste ter roken wert
Onbekend,Onbekend Hoofdstuk,1559,Ane dende van enen groten woude
Onbekend,Onbekend Hoofdstuk,1560,Ghemoetti liede hi vragedem houde
Onbekend,Onbekend Hoofdstuk,1561,Omden wech ter swerter roken
Onbekend,Onbekend Hoofdstuk,1562,Si hebben hastelijc gesproken
Onbekend,Onbekend Hoofdstuk,1563,Here gi sijt opten wech wel
Onbekend,Onbekend Hoofdstuk,1564,Gi selt vinden den ridder fel
Onbekend,Onbekend Hoofdstuk,1565,Wildi die auonture ane gaen
Onbekend,Onbekend Hoofdstuk,1566,Ic wane hi v te doet sal slaen
Onbekend,Onbekend Hoofdstuk,1567,Ferguut was te hem seluen wale
Onbekend,Onbekend Hoofdstuk,1568,Ende reet berge ende dale
Onbekend,Onbekend Hoofdstuk,1569,Soe verre dat hi die roke sach
Onbekend,Onbekend Hoofdstuk,1570,Hen was niet hoge opdien dach
Onbekend,Onbekend Hoofdstuk,1571,Die roke was herde slecht
Onbekend,Onbekend Hoofdstuk,1572,Si stont in die wolken gerecht
Onbekend,Onbekend Hoofdstuk,1573,Ens dier ter werelt so licht
Onbekend,Onbekend Hoofdstuk,1574,Dat soude vp climmen di roke slicht
Onbekend,Onbekend Hoofdstuk,1575,Hen ware dat hadde vlederike
Onbekend,Onbekend Hoofdstuk,1576,Die roke was swert ende eiselike
Onbekend,Onbekend Hoofdstuk,1577,Want wilen eer .i. gygant
Onbekend,Onbekend Hoofdstuk,1578,Hi hieu hare ane den enen cant
Onbekend,Onbekend Hoofdstuk,1579,Een padelkijn tote in den tsop
Onbekend,Onbekend Hoofdstuk,1580,Daer en mach geen perd op
Onbekend,Onbekend Hoofdstuk,1581,Een man mochter op gaen te voet
Onbekend,Onbekend Hoofdstuk,1582,ltDies droefde ferguut in sinen moetgt
Onbekend,Onbekend Hoofdstuk,1583,Hine weet wat doen met sinen wrene
Onbekend,Onbekend Hoofdstuk,1584,Hine canne gebinden ane die stene
Onbekend,Onbekend Hoofdstuk,1585,Tors dede heme groten toren
Onbekend,Onbekend Hoofdstuk,1586,Laet hijt staen het es verloren
Onbekend,Onbekend Hoofdstuk,1587,Te woude wert reet hi mettien
Onbekend,Onbekend Hoofdstuk,1588,Enen oliuier heft hi versien
Onbekend,Onbekend Hoofdstuk,1589,Hier indie werelt en es so scone
Onbekend,Onbekend Hoofdstuk,1590,Daer waren die ridders ane gewone
Onbekend,Onbekend Hoofdstuk,1591,Alsi die auonturen sochten
Onbekend,Onbekend Hoofdstuk,1592,Datsire hare orsse ane knochten
Onbekend,Onbekend Hoofdstuk,1593,Ferguut gincker tsine ane knopen
Onbekend,Onbekend Hoofdstuk,1594,ltEer hi woude danen lopengt
Onbekend,Onbekend Hoofdstuk,1595,Sinen scilt ende sinen scacht
Onbekend,Onbekend Hoofdstuk,1596,Laet hire hi es wel bedacht
Onbekend,Onbekend Hoofdstuk,1597,Haestelike clemt hi daer naer
Onbekend,Onbekend Hoofdstuk,1598,Ter roken op tswert al baer
Onbekend,Onbekend Hoofdstuk,1599,Sijn ors duchti meer sonder faelgie
Onbekend,Onbekend Hoofdstuk,1600,Te verliesen dan die battaelgie
Onbekend,Onbekend Hoofdstuk,1601,Hi clam op met groter pine
Onbekend,Onbekend Hoofdstuk,1602,Ende droech al an sine wapine
Onbekend,Onbekend Hoofdstuk,1603,Die hem harde sere weget
Onbekend,Onbekend Hoofdstuk,1604,Dicwile dat hi sneft ltende tregetgt
Onbekend,Onbekend Hoofdstuk,1605,So dat hi achter wert gleet
Onbekend,Onbekend Hoofdstuk,1606,Ne maer ane die bramen wreet
Onbekend,Onbekend Hoofdstuk,1607,Sloech hi sijn hant diere vele sijn
Onbekend,Onbekend Hoofdstuk,1608,Die hangen op dat padelkijn
Onbekend,Onbekend Hoofdstuk,1609,Met groter pinen clam hi bouen
Onbekend,Onbekend Hoofdstuk,1610,Dicke viel hi ouer die ellenbogen
Onbekend,Onbekend Hoofdstuk,1611,Sere moede was die ionchere
Onbekend,Onbekend Hoofdstuk,1612,Hine hadde .i. let niet enswoer hem sere
Onbekend,Onbekend Hoofdstuk,1613,Een lettelkijn so sat hi neder
Onbekend,Onbekend Hoofdstuk,1614,Ende sach dicke vort ende weder
Onbekend,Onbekend Hoofdstuk,1615,Hi sach ingelant ende cornualgie
Onbekend,Onbekend Hoofdstuk,1616,Algader hout hijt ouer falgie
Onbekend,Onbekend Hoofdstuk,1617,Datmen heme heft te houe geseit
Onbekend,Onbekend Hoofdstuk,1618,Om dat hi daer niet en vant gereit
Onbekend,Onbekend Hoofdstuk,1619,Den liebaert in midden den woch
Onbekend,Onbekend Hoofdstuk,1620,Maer lthijgt salne soeken noch
Onbekend,Onbekend Hoofdstuk,1621,Eer hine vint .i. stickelkijn
Onbekend,Onbekend Hoofdstuk,1622,Hi was in een capelkijn
Onbekend,Onbekend Hoofdstuk,1623,Van maerbelstenen al gehouwen
Onbekend,Onbekend Hoofdstuk,1624,Men mochte gene diere scouwen
Onbekend,Onbekend Hoofdstuk,1625,Die porte was van yvore
Onbekend,Onbekend Hoofdstuk,1626,Gewrocht herde wel ter core
Onbekend,Onbekend Hoofdstuk,1627,Die inganc was vergult roet
Onbekend,Onbekend Hoofdstuk,1628,Daer voren stont .i. dorper groet
Onbekend,Onbekend Hoofdstuk,1629,Die dorpere was van metale
Onbekend,Onbekend Hoofdstuk,1630,Ghemaect ende hi hilt van stale
Onbekend,Onbekend Hoofdstuk,1631,Enen hamer in sine hant
Onbekend,Onbekend Hoofdstuk,1632,En es so stout ridder int lant
Onbekend,Onbekend Hoofdstuk,1633,Soudi dien man ane sien
Onbekend,Onbekend Hoofdstuk,1634,Ic wane dat hi soude vlien
Onbekend,Onbekend Hoofdstuk,1635,Hi scheen leuen ende wilde slaen
Onbekend,Onbekend Hoofdstuk,1636,Den ghenen diere in wilde gaen
Onbekend,Onbekend Hoofdstuk,1637,Maer hine mach hem niet verporren
Onbekend,Onbekend Hoofdstuk,1638,Hi was gemaect dat niemen dorren
