author,chapter,line,text
Onbekend,Onbekend Hoofdstuk,1,"""Ten es wonder boven der aerde,"
Onbekend,Onbekend Hoofdstuk,2,"""Dat hem so groot ye verbaerde,"
Onbekend,Onbekend Hoofdstuk,3,"""Dat men met wapinen mochte vellen,"
Onbekend,Onbekend Hoofdstuk,4,"""Of met consten, verstaet mijn tellen,"
Onbekend,Onbekend Hoofdstuk,5,"""Sine soudent tonder doen,"
Onbekend,Onbekend Hoofdstuk,6,"""Fierabras, Elegast ende Myloen."""
Onbekend,Onbekend Hoofdstuk,7,"""Die ander seiden: ""dat es waer."""
Onbekend,Onbekend Hoofdstuk,8,Do slougen si met speren daer
Onbekend,Onbekend Hoofdstuk,9,"Die felle leewen, die daer hingen;"
Onbekend,Onbekend Hoofdstuk,10,"Robbrecht beghanre oec na springen,"
Onbekend,Onbekend Hoofdstuk,11,Ende slouchen se metter hacx van stale:
Onbekend,Onbekend Hoofdstuk,12,Als dieze vellen wilde te dale;
Onbekend,Onbekend Hoofdstuk,13,"Maer dat was dinc, dat niet besloot."
Onbekend,Onbekend Hoofdstuk,14,Doe reden vorwaert die genoot.
Onbekend,Onbekend Hoofdstuk,15,De leewen bleven hangende daer
Onbekend,Onbekend Hoofdstuk,16,"Also lange, dat es waer,"
Onbekend,Onbekend Hoofdstuk,17,"Dat se de lucht al verterde,"
Onbekend,Onbekend Hoofdstuk,18,Ende die vrome heren vermerde
Onbekend,Onbekend Hoofdstuk,19,Sijn te Rozenborch comen;
Onbekend,Onbekend Hoofdstuk,20,"Also Sansun heeft vernomen,"
Onbekend,Onbekend Hoofdstuk,21,Ontfinchize met blider chiere;
Onbekend,Onbekend Hoofdstuk,22,"Doe reden si dor die duwiere,"
Onbekend,Onbekend Hoofdstuk,23,So dat si quamen te Vauclere.
Onbekend,Onbekend Hoofdstuk,24,"Nu eist tijt, dat ic kere"
Onbekend,Onbekend Hoofdstuk,25,"Toet Fierabras ende toet Elegaste,"
Onbekend,Onbekend Hoofdstuk,26,"Ende te Mylen, die altoes vaste"
Onbekend,Onbekend Hoofdstuk,27,Ende ghenendelike jaghen;
Onbekend,Onbekend Hoofdstuk,28,Een somerpaert const cume gedragen
Onbekend,Onbekend Hoofdstuk,29,"Twilt, dat si hadden gevaen;"
Onbekend,Onbekend Hoofdstuk,30,Doe lieten si haer jagen staen.
Onbekend,Onbekend Hoofdstuk,31,Si wilden riden te Vauclere
Onbekend,Onbekend Hoofdstuk,32,Doe sagen si met groten ghere
Onbekend,Onbekend Hoofdstuk,33,Drie coninge comen ghereden
Onbekend,Onbekend Hoofdstuk,34,"Spelen met solaesliicheden,"
Onbekend,Onbekend Hoofdstuk,35,"Ongewapent, dat es ware;"
Onbekend,Onbekend Hoofdstuk,36,Maer elc hadde enen sporeware
Onbekend,Onbekend Hoofdstuk,37,Staende friscelijc up sijn hant.
Onbekend,Onbekend Hoofdstuk,38,Men hadde vonden in geen lant
Onbekend,Onbekend Hoofdstuk,39,Vromer payene dan si waren.
Onbekend,Onbekend Hoofdstuk,40,Haer namen sal ic u verclaren:
Onbekend,Onbekend Hoofdstuk,41,"Deen was coninc van Slavenyen,"
Onbekend,Onbekend Hoofdstuk,42,"Ende die ander in Tarteryen,"
Onbekend,Onbekend Hoofdstuk,43,Ende die derde Putagor
Onbekend,Onbekend Hoofdstuk,44,Van Antioetsen; herde dor
Onbekend,Onbekend Hoofdstuk,45,Waren deze coninge drye.
Onbekend,Onbekend Hoofdstuk,46,"Het sachse comen, geloves mye,"
Onbekend,Onbekend Hoofdstuk,47,"Fierabras, Elegast ende Myle."
Onbekend,Onbekend Hoofdstuk,48,"Doe drougen si over een ter wile,"
Onbekend,Onbekend Hoofdstuk,49,Dat sise zeker souden vaen;
Onbekend,Onbekend Hoofdstuk,50,Metten worden reden si hem aen.
Onbekend,Onbekend Hoofdstuk,51,Doe seiden die vrome ridders [wigants?] fier:
Onbekend,Onbekend Hoofdstuk,52,"""Here payene putertier,"
Onbekend,Onbekend Hoofdstuk,53,"Ghi sijt gevaen sonder liegen,"
Onbekend,Onbekend Hoofdstuk,54,Ter armen tijt so voerdi vliegen;
Onbekend,Onbekend Hoofdstuk,55,"Dat suldi seggen tuwen bouf."""
Onbekend,Onbekend Hoofdstuk,56,Susas doe die tale up houf:
Onbekend,Onbekend Hoofdstuk,57,"""Trouwen, ghi heren, dies es gheen noot,"
Onbekend,Onbekend Hoofdstuk,58,"Al sijn wi van wapinen bloot,"
Onbekend,Onbekend Hoofdstuk,59,Men mochte ons niet so lichte ringen;
Onbekend,Onbekend Hoofdstuk,60,"Ende dat ghijt daer toe sout bringen,"
Onbekend,Onbekend Hoofdstuk,61,Het soudu werden zere te sure;
Onbekend,Onbekend Hoofdstuk,62,"Maer hort, ic sal u setten cure:"
Onbekend,Onbekend Hoofdstuk,63,"Ic kenne u wel alle drye,"
Onbekend,Onbekend Hoofdstuk,64,"Ghi sijt die ghene, geloves mye,"
Onbekend,Onbekend Hoofdstuk,65,Die te Vauclere sonder lette
Onbekend,Onbekend Hoofdstuk,66,"Bootscap brochten van Mamette,"
Onbekend,Onbekend Hoofdstuk,67,Dat al gader was truffernye;
Onbekend,Onbekend Hoofdstuk,68,Gi daet met uwer gokelrie
Onbekend,Onbekend Hoofdstuk,69,"Ons allen royen in een boot,"
Onbekend,Onbekend Hoofdstuk,70,Ende Habigant den here groot
Onbekend,Onbekend Hoofdstuk,71,Dadi wezen vogelare.
Onbekend,Onbekend Hoofdstuk,72,"Nu hoer, wies ic u verclare:"
Onbekend,Onbekend Hoofdstuk,73,"Ghi sijt kerstijn alle drye,"
Onbekend,Onbekend Hoofdstuk,74,Ende wi loven die Mamettrye.
Onbekend,Onbekend Hoofdstuk,75,"Hets waer, wi haddent hier te quaet,"
Onbekend,Onbekend Hoofdstuk,76,"Na dat de dinc gescepen staet,"
Onbekend,Onbekend Hoofdstuk,77,Wildi ons emmer beraden noot;
Onbekend,Onbekend Hoofdstuk,78,"Ghij sijt ghewapent ende wi bloot,"
Onbekend,Onbekend Hoofdstuk,79,"Wi waren varinc te ghenaden,"
Onbekend,Onbekend Hoofdstuk,80,Na dat ghi heet van vromen daden.
Onbekend,Onbekend Hoofdstuk,81,"Wildi ene dinc bestaen,"
Onbekend,Onbekend Hoofdstuk,82,"Die ic u sal leggen aen,"
Onbekend,Onbekend Hoofdstuk,83,So prisic uwe vromichede:
Onbekend,Onbekend Hoofdstuk,84,Dat ghi laet wapinen onze lede
Onbekend,Onbekend Hoofdstuk,85,Ende nemen scilt ende spere;
Onbekend,Onbekend Hoofdstuk,86,"Wi sullen comen te Vauclere,"
Onbekend,Onbekend Hoofdstuk,87,"Alle drie, bi Tervogant!"
Onbekend,Onbekend Hoofdstuk,88,Buten daer staet een heylant
Onbekend,Onbekend Hoofdstuk,89,In die riviere onder die muer;
Onbekend,Onbekend Hoofdstuk,90,"Wi sullen daer sijn u gebuer,"
Onbekend,Onbekend Hoofdstuk,91,Ende met u vechten onder ons drien.
Onbekend,Onbekend Hoofdstuk,92,"Die daer mach tgeluck gescien,"
Onbekend,Onbekend Hoofdstuk,93,"Dat hi den anderen matteert,"
Onbekend,Onbekend Hoofdstuk,94,"Ende doet lyen vor sijn zweert,"
Onbekend,Onbekend Hoofdstuk,95,"Hi sal moeten, sonder waen,"
Onbekend,Onbekend Hoofdstuk,96,"Te sinen reymersoene staen,"
Onbekend,Onbekend Hoofdstuk,97,"Up dat hi niet ne blivet doot."""
Onbekend,Onbekend Hoofdstuk,98,"""Bi den here, die mi geboot,"""
Onbekend,Onbekend Hoofdstuk,99,"Sprac die stoute Fierebras,"
Onbekend,Onbekend Hoofdstuk,100,"""Willen uwe gezellen das"
Onbekend,Onbekend Hoofdstuk,101,"Consenteren, wi sullent doen."""
Onbekend,Onbekend Hoofdstuk,102,"""Jawi,"" seiden Saragoen,"
Onbekend,Onbekend Hoofdstuk,103,"Bi den voget Tervogant."""
Onbekend,Onbekend Hoofdstuk,104,"Doe clopten si an haren tant,"
Onbekend,Onbekend Hoofdstuk,105,"Dat was vaster dan gesworen,"
Onbekend,Onbekend Hoofdstuk,106,Ende die ridders welgeboren
Onbekend,Onbekend Hoofdstuk,107,Hilden hem wel gepayt daer aen.
Onbekend,Onbekend Hoofdstuk,108,"Elegast sprac: ""Doet ons verstaen"
Onbekend,Onbekend Hoofdstuk,109,"Den tijt, dat wi u zullen sien."""
Onbekend,Onbekend Hoofdstuk,110,"Doe sprac Gherdiflant, die payen:"
Onbekend,Onbekend Hoofdstuk,111,"""Morgen metter zonnen upghange."""
Onbekend,Onbekend Hoofdstuk,112,"Doe ne letten si niet lange,"
Onbekend,Onbekend Hoofdstuk,113,Sine staken metten sporen;
Onbekend,Onbekend Hoofdstuk,114,Maer onze ridders huutvercoren
Onbekend,Onbekend Hoofdstuk,115,"Beeten alle drie ter erde,"
Onbekend,Onbekend Hoofdstuk,116,"Ende vergorden hare perde,"
Onbekend,Onbekend Hoofdstuk,117,Ende hingen te pointe hare scilde.
Onbekend,Onbekend Hoofdstuk,118,Den sterken zomer metten wilde
Onbekend,Onbekend Hoofdstuk,119,Dreven si vor hem te diere tijt;
Onbekend,Onbekend Hoofdstuk,120,Elc up sine stegebande rijt
Onbekend,Onbekend Hoofdstuk,121,"Den rechten wech te Vauclere,"
Onbekend,Onbekend Hoofdstuk,122,"So lange dat si sagen there,"
Onbekend,Onbekend Hoofdstuk,123,Daer Susas of was rewaert.
Onbekend,Onbekend Hoofdstuk,124,Die heren [.....] vermaert
Onbekend,Onbekend Hoofdstuk,125,Reden daer in ter zelver stont.
Onbekend,Onbekend Hoofdstuk,126,"""Monyoie!"" roupen si, si u cont,"
Onbekend,Onbekend Hoofdstuk,127,"Ende slougent al onder voet,"
Onbekend,Onbekend Hoofdstuk,128,So wat quam in haer gemoet.
Onbekend,Onbekend Hoofdstuk,129,"Si slougen ontwee der tenten corden,"
Onbekend,Onbekend Hoofdstuk,130,Mengen Torc dat si vermorden:
Onbekend,Onbekend Hoofdstuk,131,Peyene vloen gelike sporewen;
Onbekend,Onbekend Hoofdstuk,132,Maer recht oft waren wilde leewen
Onbekend,Onbekend Hoofdstuk,133,Verslougen si die Torkiene.
Onbekend,Onbekend Hoofdstuk,134,Der tenten seven werven tiene
Onbekend,Onbekend Hoofdstuk,135,"Velden si, geloeft mi das,"
Onbekend,Onbekend Hoofdstuk,136,"Doe so reden si over tpas,"
Onbekend,Onbekend Hoofdstuk,137,Als die waren onvervaert;
Onbekend,Onbekend Hoofdstuk,138,"Emmer wachten si tsomerpaert,"
Onbekend,Onbekend Hoofdstuk,139,Dat hem niewer ontsapperde
Onbekend,Onbekend Hoofdstuk,140,Aldus voeren die heren gherde
Onbekend,Onbekend Hoofdstuk,141,"Int ander here van Habigante,"
Onbekend,Onbekend Hoofdstuk,142,Ende quamen daer recht als die Persante
Onbekend,Onbekend Hoofdstuk,143,"Ter maeltijt saten, geloves myen"
Onbekend,Onbekend Hoofdstuk,144,Die felle Soudaen Calistyen
Onbekend,Onbekend Hoofdstuk,145,Ende Habigant ende alle de zine
Onbekend,Onbekend Hoofdstuk,146,"Saten in die tente zidine,"
Onbekend,Onbekend Hoofdstuk,147,Die was des soudaens van Persi.
Onbekend,Onbekend Hoofdstuk,148,"In al die werelt, geloves mi,"
Onbekend,Onbekend Hoofdstuk,149,Ne hadde men vonden sulc juweel:
Onbekend,Onbekend Hoofdstuk,150,"Groene side ende root fluweel,"
Onbekend,Onbekend Hoofdstuk,151,"Daer af was so ondersneden,"
Onbekend,Onbekend Hoofdstuk,152,Daer in gewrocht bi suptiilheden
Onbekend,Onbekend Hoofdstuk,153,"Diveerse beestkine bi [.....] lyen,"
Onbekend,Onbekend Hoofdstuk,154,Tghelove al haerre mamettryen
Onbekend,Onbekend Hoofdstuk,155,"Stont daer in ghemagineert,"
Onbekend,Onbekend Hoofdstuk,156,Van finen goude gepol [.....]
Onbekend,Onbekend Hoofdstuk,157,Alle die wapine van hedenesse
Onbekend,Onbekend Hoofdstuk,158,"Stont daer ane, sijt gewesse,"
Onbekend,Onbekend Hoofdstuk,159,Ende alle die wige van [.....]
Onbekend,Onbekend Hoofdstuk,160,"Die oyt waren boven der erde,"
Onbekend,Onbekend Hoofdstuk,161,Van Troyen of dieregelike
Onbekend,Onbekend Hoofdstuk,162,"Stont daer an so rikelike,"
Onbekend,Onbekend Hoofdstuk,163,Dat men nyet negenen gewrochte
Onbekend,Onbekend Hoofdstuk,164,Rikeliker pensen mochte.
Onbekend,Onbekend Hoofdstuk,165,"Tgesteente, dat daer an stont,"
Onbekend,Onbekend Hoofdstuk,166,"Maket also overclaer,"
Onbekend,Onbekend Hoofdstuk,167,"Dat mer ter midder nach (sic) bi zach,"
Onbekend,Onbekend Hoofdstuk,168,Al hadt gewezen scone dach. »
Onbekend,Onbekend Hoofdstuk,169,"Up vijf maste dat sy stont,"
Onbekend,Onbekend Hoofdstuk,170,Ende die waren even ront;
Onbekend,Onbekend Hoofdstuk,171,"Die hoeftmast, verstaet wael,"
Onbekend,Onbekend Hoofdstuk,172,Was altemale van cristael
Onbekend,Onbekend Hoofdstuk,173,"Wel beslegen, geloves myen,"
Onbekend,Onbekend Hoofdstuk,174,Van finen goude huut Arabyen.
Onbekend,Onbekend Hoofdstuk,175,Die een vanden andren vieren
Onbekend,Onbekend Hoofdstuk,176,"Was, also ic u sal versieren,"
Onbekend,Onbekend Hoofdstuk,177,Al van claren cassydere [.....]
Onbekend,Onbekend Hoofdstuk,178,Die ander van albaester was
Onbekend,Onbekend Hoofdstuk,179,Ende die derde van elphant [.....]
Onbekend,Onbekend Hoofdstuk,180,"Die vierde van yvore rene,"
Onbekend,Onbekend Hoofdstuk,181,"Ende daer an, also men woude,"
Onbekend,Onbekend Hoofdstuk,182,"Grote spaengen van finen goude,"
Onbekend,Onbekend Hoofdstuk,183,Suverlike ende wel gep [.....]
Onbekend,Onbekend Hoofdstuk,184,"Die corden waren, ic wale [.....]"
Onbekend,Onbekend Hoofdstuk,185,Ghevlochten alle [.....]
Onbekend,Onbekend Hoofdstuk,186,Van groenre zide [.....]
Onbekend,Onbekend Hoofdstuk,187,Elkerlike met drie stringen;
Onbekend,Onbekend Hoofdstuk,188,Ende die [....] ken in waren dingen
Onbekend,Onbekend Hoofdstuk,189,"Waren zelverin in dezer wize,"
Onbekend,Onbekend Hoofdstuk,190,"Elc in gedrayt met eere vize,"
Onbekend,Onbekend Hoofdstuk,191,"Dat mense niet huut mochte trecken,"
Onbekend,Onbekend Hoofdstuk,192,Men mochter met avize up mecken.
Onbekend,Onbekend Hoofdstuk,193,Den appel van der tente boven
Onbekend,Onbekend Hoofdstuk,194,Mochte men wel te rechte loven;
Onbekend,Onbekend Hoofdstuk,195,"Want tgraefscap, als ic verstoet,"
Onbekend,Onbekend Hoofdstuk,196,Was nouwelike also goet
Onbekend,Onbekend Hoofdstuk,197,[.......] wiste hoe [...] herden gront
Onbekend,Onbekend Hoofdstuk,198,[..............]teneger stont
Onbekend,Onbekend Hoofdstuk,199,[......] pateren die dierbaerheyt
Onbekend,Onbekend Hoofdstuk,200,[.............] appel vas geleyt
Onbekend,Onbekend Hoofdstuk,201,[.................] die dies ave
Onbekend,Onbekend Hoofdstuk,202,Elegast [........] ende Myle die grave
Onbekend,Onbekend Hoofdstuk,203,"Ende Fierabras, die damoyseel,"
Onbekend,Onbekend Hoofdstuk,204,Dreven herde groet chembeel
Onbekend,Onbekend Hoofdstuk,205,Alsi dor dat here voeren;
Onbekend,Onbekend Hoofdstuk,206,"Clocke werden alle in roeren,"
Onbekend,Onbekend Hoofdstuk,207,[......] der mortyrien die si dreven;
Onbekend,Onbekend Hoofdstuk,208,Ten mochte niet lichte sijn bescreven
Onbekend,Onbekend Hoofdstuk,209,[.......] er die si van wapinen daden:
Onbekend,Onbekend Hoofdstuk,210,Die zwerden daden si dicke baden
Onbekend,Onbekend Hoofdstuk,211,Den Sarasinen doer den tanden;
Onbekend,Onbekend Hoofdstuk,212,Ghene riepen up Tervoganden
Onbekend,Onbekend Hoofdstuk,213,Ende liepen vaste haer hande slaende.
Onbekend,Onbekend Hoofdstuk,214,Ende die [......] heren [......] staende
Onbekend,Onbekend Hoofdstuk,215,[.....................] oe stegebande
Onbekend,Onbekend Hoofdstuk,216,[.....................] haer hande
Onbekend,Onbekend Hoofdstuk,217,[.....................] quam die goede
Onbekend,Onbekend Hoofdstuk,218,[..............................] fiere
Onbekend,Onbekend Hoofdstuk,219,[....................................]
Onbekend,Onbekend Hoofdstuk,220,[......................] ten saten
Onbekend,Onbekend Hoofdstuk,221,[...................] en ende aten
Onbekend,Onbekend Hoofdstuk,222,[............] soudane [...] amyrale
Onbekend,Onbekend Hoofdstuk,223,[.............]si met luder tale
Onbekend,Onbekend Hoofdstuk,224,[.....] ten wapinen roupen vaste.
Onbekend,Onbekend Hoofdstuk,225,Doe scoten up die felle gaste
Onbekend,Onbekend Hoofdstuk,226,"Om te weten, wat daer ware"
Onbekend,Onbekend Hoofdstuk,227,[..............] die edel bare
Onbekend,Onbekend Hoofdstuk,228,[..............] ter tente comen
Onbekend,Onbekend Hoofdstuk,229,[........................] genomen
Onbekend,Onbekend Hoofdstuk,230,Ende slougen die corden al ontwee
Onbekend,Onbekend Hoofdstuk,231,[.......................] tren mee
Onbekend,Onbekend Hoofdstuk,232,[.................] der up die stede
Onbekend,Onbekend Hoofdstuk,233,[.................] aren was sijn bede
Onbekend,Onbekend Hoofdstuk,234,"Sose de maste geraecten daer,"
Onbekend,Onbekend Hoofdstuk,235,Die van den goude waren zwaer;
Onbekend,Onbekend Hoofdstuk,236,"Thoeftmast, die quam gevallen,"
Onbekend,Onbekend Hoofdstuk,237,"Die tafle, die al met allen"
Onbekend,Onbekend Hoofdstuk,238,[.............] moeste van der wagen
Onbekend,Onbekend Hoofdstuk,239,[.............] felen ende scragen
Onbekend,Onbekend Hoofdstuk,240,[.............] alle in stickinen
Onbekend,Onbekend Hoofdstuk,241,[.............] die nappe met wine
Onbekend,Onbekend Hoofdstuk,242,"[........] gen si, wer hier, wer daer"
Onbekend,Onbekend Hoofdstuk,243,"[........] den plateelen swaer naer,"
Onbekend,Onbekend Hoofdstuk,244,"[........] ende [........] des sijt vroet,"
Onbekend,Onbekend Hoofdstuk,245,[........] al dat up die tafel stoet
Onbekend,Onbekend Hoofdstuk,246,[....................] in gaisemente
Onbekend,Onbekend Hoofdstuk,247,[...........] die lagen onder die tente
Onbekend,Onbekend Hoofdstuk,248,Ende onder die maste sonder waen
Onbekend,Onbekend Hoofdstuk,249,"Recht als vogel, die gevaen"
Onbekend,Onbekend Hoofdstuk,250,Sijn ende liggen onder tnet;
Onbekend,Onbekend Hoofdstuk,251,Sine mochten verporren met
Onbekend,Onbekend Hoofdstuk,252,"So die tente, dat es waer,"
Onbekend,Onbekend Hoofdstuk,253,Van den goude was so zwaer.
Onbekend,Onbekend Hoofdstuk,254,Payene lagen ende pepen;
Onbekend,Onbekend Hoofdstuk,255,Ende die heren die begrepen
Onbekend,Onbekend Hoofdstuk,256,"Waren in eenen hogen moede,"
Onbekend,Onbekend Hoofdstuk,257,"Als die waren van edelen bloede,"
Onbekend,Onbekend Hoofdstuk,258,"Ende negeen begrip ontsagen,"
Onbekend,Onbekend Hoofdstuk,259,Daer men eere an mochte beiagen
Onbekend,Onbekend Hoofdstuk,260,Om te [................] die doot
Onbekend,Onbekend Hoofdstuk,261,Ne consten hare herte groot
Onbekend,Onbekend Hoofdstuk,262,"Niet bedwingen noch haren moet,"
Onbekend,Onbekend Hoofdstuk,263,So dat rudderlike bloet
Onbekend,Onbekend Hoofdstuk,264,In hem selven began vermaken;
Onbekend,Onbekend Hoofdstuk,265,Si velden tenten ende staken
Onbekend,Onbekend Hoofdstuk,266,Masten ende daertoe corden.
Onbekend,Onbekend Hoofdstuk,267,Mengen payen si vermorden
Onbekend,Onbekend Hoofdstuk,268,"Al haddent gedaen Vm lieden,"
Onbekend,Onbekend Hoofdstuk,269,Men sout te wonder mogen bedieden
Onbekend,Onbekend Hoofdstuk,270,"Tgrote [.....] dat si daer daden,"
Onbekend,Onbekend Hoofdstuk,271,Huer hoge moet const niet verzaden;
Onbekend,Onbekend Hoofdstuk,272,"Die vele heeft, wille emmer bet."
Onbekend,Onbekend Hoofdstuk,273,"So lange vochten si, dat wet,"
Onbekend,Onbekend Hoofdstuk,274,Dat their wert verstrooyt al;
Onbekend,Onbekend Hoofdstuk,275,Doe so was daer groot gheschal.
Onbekend,Onbekend Hoofdstuk,276,"Men blies daer trompen ende nakaren,"
Onbekend,Onbekend Hoofdstuk,277,"Recht of die werelt soude vervaren,"
Onbekend,Onbekend Hoofdstuk,278,"So helden daer die grote bazinen,"
Onbekend,Onbekend Hoofdstuk,279,Ende die horne van goeder [.....]
Onbekend,Onbekend Hoofdstuk,280,[.....] op berch ende dal.
Onbekend,Onbekend Hoofdstuk,281,"Tfolc vergaderde overal,"
Onbekend,Onbekend Hoofdstuk,282,Ende begonsten hem battaelgieren.
Onbekend,Onbekend Hoofdstuk,283,Doe begonsten hem temayeren
Onbekend,Onbekend Hoofdstuk,284,"Onze Ridders, preus van aerde,"
Onbekend,Onbekend Hoofdstuk,285,"Ende reden metter vaerde,"
Onbekend,Onbekend Hoofdstuk,286,Als die meenden in der steden
Onbekend,Onbekend Hoofdstuk,287,Te vaerne; die hem onderreden
Onbekend,Onbekend Hoofdstuk,288,"Aldoe, was met groter druust"
Onbekend,Onbekend Hoofdstuk,289,Van payene wel XX duust.
Onbekend,Onbekend Hoofdstuk,290,Doe so rees daer groot gescal;
Onbekend,Onbekend Hoofdstuk,291,"D'onze aventurdent al,"
Onbekend,Onbekend Hoofdstuk,292,"Als die goene, in waren zaken,"
Onbekend,Onbekend Hoofdstuk,293,"Die daer haer kerchof wilden maken,"
Onbekend,Onbekend Hoofdstuk,294,Ende reden in die Saragoene.
Onbekend,Onbekend Hoofdstuk,295,"Elc hadde een spere met enen pongoene,"
Onbekend,Onbekend Hoofdstuk,296,Dat si hute Vauclere voerden;
Onbekend,Onbekend Hoofdstuk,297,Hare sporen dat si roerden
Onbekend,Onbekend Hoofdstuk,298,In die lanken hare [acatoene]
Onbekend,Onbekend Hoofdstuk,299,"Fierabras, die ridder coene,"
Onbekend,Onbekend Hoofdstuk,300,Noepte sinen drommedarijs.
Onbekend,Onbekend Hoofdstuk,301,"Die ridder, van naturen wijs"
Onbekend,Onbekend Hoofdstuk,302,"Warp die lanse onder den arem,"
Onbekend,Onbekend Hoofdstuk,303,"[Van tornemoede was hi warem,"
Onbekend,Onbekend Hoofdstuk,304,Dat hem die stede wert benomen]
Onbekend,Onbekend Hoofdstuk,305,Sinen spiet so ver ghedromen
Onbekend,Onbekend Hoofdstuk,306,Een payen in sijn lijf
Onbekend,Onbekend Hoofdstuk,307,Die glavie was daer lanc ende stijf
Onbekend,Onbekend Hoofdstuk,308,"Dat so node wilde breken,"
Onbekend,Onbekend Hoofdstuk,309,[.........] was ghesteken
Onbekend,Onbekend Hoofdstuk,310,[............] hant
Onbekend,Onbekend Hoofdstuk,311,Eenen andren Turkant
Onbekend,Onbekend Hoofdstuk,312,"Liep so [.....] in die borst,"
Onbekend,Onbekend Hoofdstuk,313,Hi moeste storten sonder vorst
Onbekend,Onbekend Hoofdstuk,314,Up die erde al steendoot.
Onbekend,Onbekend Hoofdstuk,315,"Fierebras, wies moet was groot,"
Onbekend,Onbekend Hoofdstuk,316,"Dromde den spiet altoes vorwaert,"
Onbekend,Onbekend Hoofdstuk,317,Dat hi den andren [.....] paert
Onbekend,Onbekend Hoofdstuk,318,"Verre dor den rugge leet,"
Onbekend,Onbekend Hoofdstuk,319,Doe zwanc hise van den orse gereet;
Onbekend,Onbekend Hoofdstuk,320,"Daer bleven si liggende te dier tijt,"
Onbekend,Onbekend Hoofdstuk,321,"An die glavye beede gerijt,"
Onbekend,Onbekend Hoofdstuk,322,Ghespeet gelijc den capoene.
Onbekend,Onbekend Hoofdstuk,323,"Die jonge, moedige ridder coene"
Onbekend,Onbekend Hoofdstuk,324,Trac den scarpen helmstaert;
Onbekend,Onbekend Hoofdstuk,325,Niemen wert van hem gespaert;
Onbekend,Onbekend Hoofdstuk,326,"Sone waest van Elegaste,"
Onbekend,Onbekend Hoofdstuk,327,Die met sporen noepte vaste
Onbekend,Onbekend Hoofdstuk,328,Ende stac te diere hure
Onbekend,Onbekend Hoofdstuk,329,Enen payen durenture;
Onbekend,Onbekend Hoofdstuk,330,Mettien sine glavye brac.
Onbekend,Onbekend Hoofdstuk,331,"Mile oec enen payen stac,"
Onbekend,Onbekend Hoofdstuk,332,Dat hi dorreden viel int sant;
Onbekend,Onbekend Hoofdstuk,333,Doe so trac hi sinen brant
Onbekend,Onbekend Hoofdstuk,334,Ende hi riep met luder voes:
Onbekend,Onbekend Hoofdstuk,335,"""Hier comt die jonge grave van Bloes,"
Onbekend,Onbekend Hoofdstuk,336,Die dor die vreeze van den payen
Onbekend,Onbekend Hoofdstuk,337,"Niet eenen voet mach achter vlyen,"
Onbekend,Onbekend Hoofdstuk,338,"Of sine wapine ne waren verloren,"
Onbekend,Onbekend Hoofdstuk,339,Die Partenoples was hier te voren
Onbekend,Onbekend Hoofdstuk,340,Upden coninc Noblioen;
Onbekend,Onbekend Hoofdstuk,341,Al so hortem die lyoen
Onbekend,Onbekend Hoofdstuk,342,"Toe, die ic mijn levedagen"
Onbekend,Onbekend Hoofdstuk,343,"In eeren hope [.....] dragen,"
Onbekend,Onbekend Hoofdstuk,344,"Of ic blive inden wille doot."""
Onbekend,Onbekend Hoofdstuk,345,"Hi seide waer, die genoot;"
Onbekend,Onbekend Hoofdstuk,346,"Hi hiltse in eeren, si u bekant."
Onbekend,Onbekend Hoofdstuk,347,"So dede sijn sone, die grave Roelant,"
Onbekend,Onbekend Hoofdstuk,348,"Die welke was een ridder rene,"
Onbekend,Onbekend Hoofdstuk,349,"Den roden leen eist dat ic mene,"
Onbekend,Onbekend Hoofdstuk,350,Die int gout stoet rampant;
Onbekend,Onbekend Hoofdstuk,351,"Hine was noyt so vaeliant,"
Onbekend,Onbekend Hoofdstuk,352,"Noch van herten also coene,"
Onbekend,Onbekend Hoofdstuk,353,Hine hadder genouch an te doene
Onbekend,Onbekend Hoofdstuk,354,Soude hize dragen na haer recht.
Onbekend,Onbekend Hoofdstuk,355,"Nu keric weder int gevecht,"
Onbekend,Onbekend Hoofdstuk,356,Daer die drie mids hare pine
Onbekend,Onbekend Hoofdstuk,357,"Doorbraken alle die Sarazine,"
Onbekend,Onbekend Hoofdstuk,358,Ende behilden haer venisoen.
Onbekend,Onbekend Hoofdstuk,359,"Ten es ter werelt man so coen,"
Onbekend,Onbekend Hoofdstuk,360,"Hem ne souds gruwen, up dat hijt sage,"
Onbekend,Onbekend Hoofdstuk,361,"Der vreezelike grote slage,"
Onbekend,Onbekend Hoofdstuk,362,Die si slougen alle drie.
Onbekend,Onbekend Hoofdstuk,363,"So vele daden si, geloves mie,"
Onbekend,Onbekend Hoofdstuk,364,"Dat si hare acatoen,"
Onbekend,Onbekend Hoofdstuk,365,"Daer up lach haer venisoen,"
Onbekend,Onbekend Hoofdstuk,366,Bonden an der porten rinc;
Onbekend,Onbekend Hoofdstuk,367,"Doe keerde elc, dats ware dinc,"
Onbekend,Onbekend Hoofdstuk,368,Tanscijn ten ten vianden waert;
Onbekend,Onbekend Hoofdstuk,369,Menich scilt ende menich daert
Onbekend,Onbekend Hoofdstuk,370,"Was aldaer up hem gescoten,"
Onbekend,Onbekend Hoofdstuk,371,Si zwe [.....] weder zulke noten
