author,chapter,line,text
Heraut Beyeren,Onbekend Hoofdstuk,1483,"Wilde siin een hertooch van Lotrike,"
Heraut Beyeren,Onbekend Hoofdstuk,1484,"Lambrecht dochte zekerlike,"
Heraut Beyeren,Onbekend Hoofdstuk,1485,Dat hiit ware met sinen wive
Heraut Beyeren,Onbekend Hoofdstuk,1486,Sculdich tewesen bi sinen live.
Heraut Beyeren,Onbekend Hoofdstuk,1487,Want een keiser Heinric gaf henen
Heraut Beyeren,Onbekend Hoofdstuk,1488,Tlant van Lotrike Godevaert van Ardenen.
Heraut Beyeren,Onbekend Hoofdstuk,1489,Daer quamen si beide tot enen wige
Heraut Beyeren,Onbekend Hoofdstuk,1490,"Tot Floriins met groten crige,"
Heraut Beyeren,Onbekend Hoofdstuk,1491,Daer menich wel vacht metten zwaerde.
Heraut Beyeren,Onbekend Hoofdstuk,1492,Daer bleef doot Lambrecht metten baerde.
Heraut Beyeren,Onbekend Hoofdstuk,1493,Aldus was Geerbrechen man gevelt.
Heraut Beyeren,Onbekend Hoofdstuk,1494,Geerbrech niet dan Brabant behelt.
Heraut Beyeren,Onbekend Hoofdstuk,1495,Geerbrech die dus verloor algader
Heraut Beyeren,Onbekend Hoofdstuk,1496,"Vrancrike, Lotrike, man ende vader."
Heraut Beyeren,Onbekend Hoofdstuk,1497,"Doch wan Lambrecht enen zone,"
Heraut Beyeren,Onbekend Hoofdstuk,1498,"Heinric doude hiet die gone,"
Heraut Beyeren,Onbekend Hoofdstuk,1499,"Die nemmeer en heeft behouden,"
Heraut Beyeren,Onbekend Hoofdstuk,1500,Dan Lueven ende Bruesel in rechten scouden.
Heraut Beyeren,Onbekend Hoofdstuk,1501,In die wile dat ons te zwigen staet
Heraut Beyeren,Onbekend Hoofdstuk,1502,"Der kueningen name ende hoir daet,"
Heraut Beyeren,Onbekend Hoofdstuk,1503,Die quamen van Hughen Capette.
Heraut Beyeren,Onbekend Hoofdstuk,1504,"Verstaet die reden, die ic hier zette,"
Heraut Beyeren,Onbekend Hoofdstuk,1505,"Van den hertogen altesamen,"
Heraut Beyeren,Onbekend Hoofdstuk,1506,Die van grote Kaerle quamen
Heraut Beyeren,Onbekend Hoofdstuk,1507,Ende vanden Ardenoisschen hertogen.
Heraut Beyeren,Onbekend Hoofdstuk,1508,"Want wie dat twaer te wetene pogen,"
Heraut Beyeren,Onbekend Hoofdstuk,1509,Hier vinden ziit cort ende licht
Heraut Beyeren,Onbekend Hoofdstuk,1510,Int waer duuts van mi gedicht.
Heraut Beyeren,Onbekend Hoofdstuk,1511,"Godevaert, die mogentlike"
Heraut Beyeren,Onbekend Hoofdstuk,1512,Heer bleef van Lotrike
Heraut Beyeren,Onbekend Hoofdstuk,1513,Om dat hi die ere wan
Heraut Beyeren,Onbekend Hoofdstuk,1514,"Op Lambrecht den stouten man,"
Heraut Beyeren,Onbekend Hoofdstuk,1515,"Starf in mogentlike doene,"
Heraut Beyeren,Onbekend Hoofdstuk,1516,Ende op siin boeder Giseloene
Heraut Beyeren,Onbekend Hoofdstuk,1517,"Quam al die name properlike,"
Heraut Beyeren,Onbekend Hoofdstuk,1518,Ende wart hertoge van Lotrike.
Heraut Beyeren,Onbekend Hoofdstuk,1519,"Dees Giseloen, dees grote here,"
Heraut Beyeren,Onbekend Hoofdstuk,1520,"Die siin name breide zere,"
Heraut Beyeren,Onbekend Hoofdstuk,1521,Drie hertoochdommen zo had hi.
Heraut Beyeren,Onbekend Hoofdstuk,1522,"Hi was hertoghe van Ansi,"
Heraut Beyeren,Onbekend Hoofdstuk,1523,Van Lotrike ende van Ardenne.
Heraut Beyeren,Onbekend Hoofdstuk,1524,"Siin kindre waren, als ic kenne,"
Heraut Beyeren,Onbekend Hoofdstuk,1525,"Een was paeus van Rome, hiet Steven,"
Heraut Beyeren,Onbekend Hoofdstuk,1526,"Dander hiet Godevaert van stouten leven,"
Heraut Beyeren,Onbekend Hoofdstuk,1527,"Die naden vader hertooch was,"
Heraut Beyeren,Onbekend Hoofdstuk,1528,"Ende een Oede, siit zeker das,"
Heraut Beyeren,Onbekend Hoofdstuk,1529,"Die van Bruesel was gravinne,"
Heraut Beyeren,Onbekend Hoofdstuk,1530,"Ende een hiet Reynilt, alsict kinne,"
Heraut Beyeren,Onbekend Hoofdstuk,1531,Die een gravinne was tot Namen.
Heraut Beyeren,Onbekend Hoofdstuk,1532,Dit was een scoon geslachte tesamen.
Heraut Beyeren,Onbekend Hoofdstuk,1533,"Geerbrechen zoon, Heinric doude,"
Heraut Beyeren,Onbekend Hoofdstuk,1534,"Wart grave van Bruesel met gewoude,"
Heraut Beyeren,Onbekend Hoofdstuk,1535,"Wan enen zoon, die Lambrecht hiet,"
Heraut Beyeren,Onbekend Hoofdstuk,1536,Dien hi tgraafscap van Bruesel liet
Heraut Beyeren,Onbekend Hoofdstuk,1537,"Ende een dochter, hiet Machtilt,"
Heraut Beyeren,Onbekend Hoofdstuk,1538,Die tgraefscap van Boenen hilt.
Heraut Beyeren,Onbekend Hoofdstuk,1539,"Heinric die oude wan Lambrechte,"
Heraut Beyeren,Onbekend Hoofdstuk,1540,"Die grave van Bruesel hiet bi rechte,"
Heraut Beyeren,Onbekend Hoofdstuk,1541,Tot Duringen bleef hi in enen striit.
Heraut Beyeren,Onbekend Hoofdstuk,1542,"Enen zoon liet hi tier tiit,"
Heraut Beyeren,Onbekend Hoofdstuk,1543,Die Henne hiet ende na hem was
Heraut Beyeren,Onbekend Hoofdstuk,1544,"Grave van Bruesel, als ict las."
Heraut Beyeren,Onbekend Hoofdstuk,1545,"Een hiet Harman, heeft hi gevaen"
Heraut Beyeren,Onbekend Hoofdstuk,1546,Ende heeften in siin huus bestaen
Heraut Beyeren,Onbekend Hoofdstuk,1547,"Ende vermoort, dus ende siin leven."
Heraut Beyeren,Onbekend Hoofdstuk,1548,"Een zone hiet Heinric, es hem bleven"
Heraut Beyeren,Onbekend Hoofdstuk,1549,Die grave van Lueven naden vader
Heraut Beyeren,Onbekend Hoofdstuk,1550,Ende van Brabant was algader.
Heraut Beyeren,Onbekend Hoofdstuk,1551,"Godevaert Giseloens zone,"
Heraut Beyeren,Onbekend Hoofdstuk,1552,"Stout ende vromich was die gone,"
Heraut Beyeren,Onbekend Hoofdstuk,1553,Ende een hertooch van Lotrike.
Heraut Beyeren,Onbekend Hoofdstuk,1554,Siin lant hilt hi vromelike.
Heraut Beyeren,Onbekend Hoofdstuk,1555,"Dese wan den buulticden Godevaert,"
Heraut Beyeren,Onbekend Hoofdstuk,1556,"Al was hi cleine hi was waert,"
Heraut Beyeren,Onbekend Hoofdstuk,1557,"Ende een dochter, die hiet Yde,"
Heraut Beyeren,Onbekend Hoofdstuk,1558,Die nu in al die werelt wide
Heraut Beyeren,Onbekend Hoofdstuk,1559,"Bekent es over santinne,"
Heraut Beyeren,Onbekend Hoofdstuk,1560,"Dese sint Yde, als ict kinne,"
Heraut Beyeren,Onbekend Hoofdstuk,1561,"Behuwede tgraefscap van Bonen,"
Heraut Beyeren,Onbekend Hoofdstuk,1562,Daer si moeder wart van iij sonen.
Heraut Beyeren,Onbekend Hoofdstuk,1563,"Hoir man die tlantscap hilt,"
Heraut Beyeren,Onbekend Hoofdstuk,1564,"Hiet Justaes, siin moeder Machtilt"
Heraut Beyeren,Onbekend Hoofdstuk,1565,"Was dochter Heinrix douden,"
Heraut Beyeren,Onbekend Hoofdstuk,1566,"Die tlant van Bruessel heeft behouden,"
Heraut Beyeren,Onbekend Hoofdstuk,1567,Also als ic sprac hier voren.
Heraut Beyeren,Onbekend Hoofdstuk,1568,Van sint Yden waren geboren
Heraut Beyeren,Onbekend Hoofdstuk,1569,"Justaes, die de graefscap algader"
Heraut Beyeren,Onbekend Hoofdstuk,1570,"Hilt na Justaes sinen vader,"
Heraut Beyeren,Onbekend Hoofdstuk,1571,Ende Godevaert hertooch van Bulyoen
Heraut Beyeren,Onbekend Hoofdstuk,1572,"Als ic u te verstaen zal doen,"
Heraut Beyeren,Onbekend Hoofdstuk,1573,Hoe hi hertoghe vromelike
Heraut Beyeren,Onbekend Hoofdstuk,1574,"Na den oom wart van Lotrike,"
Heraut Beyeren,Onbekend Hoofdstuk,1575,Ende Boudin die sint na hem
Heraut Beyeren,Onbekend Hoofdstuk,1576,Wart kueninc van Jherusalem.
Heraut Beyeren,Onbekend Hoofdstuk,1577,"Nu hoirt hier die waerheit das,"
Heraut Beyeren,Onbekend Hoofdstuk,1578,Hoe na hi Kaerles live was
Heraut Beyeren,Onbekend Hoofdstuk,1579,"Dees Godevaert geboren,"
Heraut Beyeren,Onbekend Hoofdstuk,1580,Looch ic dat waer pine verloren.
Heraut Beyeren,Onbekend Hoofdstuk,1581,Kaerle die grote wan Lodewiicke
Heraut Beyeren,Onbekend Hoofdstuk,1582,Heer van Rome ende van Vrancrike.
Heraut Beyeren,Onbekend Hoofdstuk,1583,"Kaerle die caelwe was siin zone,"
Heraut Beyeren,Onbekend Hoofdstuk,1584,"Keiser ende kueninc was die gone,"
Heraut Beyeren,Onbekend Hoofdstuk,1585,"Die Lodewiic den lispre wan,"
Heraut Beyeren,Onbekend Hoofdstuk,1586,Dees wan Kaerle den simpel man
Heraut Beyeren,Onbekend Hoofdstuk,1587,"Kaerle die simpel wan Lodewike,"
Heraut Beyeren,Onbekend Hoofdstuk,1588,"Die Brabant sciet ende Vrancrike,"
Heraut Beyeren,Onbekend Hoofdstuk,1589,"Kaerle die hertoge was siin een zone,"
Heraut Beyeren,Onbekend Hoofdstuk,1590,"Ende dese Kaerle was die ghone,"
Heraut Beyeren,Onbekend Hoofdstuk,1591,"Die verloos die kueninx crone,"
Heraut Beyeren,Onbekend Hoofdstuk,1592,Ende was die zevende geboren scone
Heraut Beyeren,Onbekend Hoofdstuk,1593,"Van groten Kaerle, elc mede getelt."
Heraut Beyeren,Onbekend Hoofdstuk,1594,"Geerbrech siin dochter, si behelt"
Heraut Beyeren,Onbekend Hoofdstuk,1595,Na hoir oor ende wan den ouden
Heraut Beyeren,Onbekend Hoofdstuk,1596,"Heinric, die Bruesel heeft behouden,"
Heraut Beyeren,Onbekend Hoofdstuk,1597,"Hi wan Machtilden, daer ic af kinne,"
Heraut Beyeren,Onbekend Hoofdstuk,1598,"Die van Boenen was gravinne,"
Heraut Beyeren,Onbekend Hoofdstuk,1599,"Machtilt den grave Justaes wan,"
Heraut Beyeren,Onbekend Hoofdstuk,1600,"Die Godevaert den heiligen man,"
Heraut Beyeren,Onbekend Hoofdstuk,1601,Justaes ende Boudin in die tiden
Heraut Beyeren,Onbekend Hoofdstuk,1602,"Waren gewonnen an sint Yden,"
Heraut Beyeren,Onbekend Hoofdstuk,1603,"Yden vader was Godevaert,"
Heraut Beyeren,Onbekend Hoofdstuk,1604,"Dien Lotrike te deel waert,"
Heraut Beyeren,Onbekend Hoofdstuk,1605,Siin geslachte staet hier voren.
Heraut Beyeren,Onbekend Hoofdstuk,1606,"Van al desen moech di horen,"
Heraut Beyeren,Onbekend Hoofdstuk,1607,Datter die waerheit niet hout
Heraut Beyeren,Onbekend Hoofdstuk,1608,"Van den ridder metten zwane,"
Heraut Beyeren,Onbekend Hoofdstuk,1609,Ende hout dat over boerde
Heraut Beyeren,Onbekend Hoofdstuk,1610,"Dat een zwane een ridder [voerde,]"
Heraut Beyeren,Onbekend Hoofdstuk,1611,Over alzo [menich zeebaren:]
Heraut Beyeren,Onbekend Hoofdstuk,1612,"Hi es dul diet [geloeft, twaren.]"
Heraut Beyeren,Onbekend Hoofdstuk,1613,Hier laet ic [mijn scelden varen]
Heraut Beyeren,Onbekend Hoofdstuk,1614,"Jegen die [liegende favelaren,]"
Heraut Beyeren,Onbekend Hoofdstuk,1615,"Hier volch ic [der historien voert,]"
Heraut Beyeren,Onbekend Hoofdstuk,1616,"Als icse las, [int ware woert.]"
Heraut Beyeren,Onbekend Hoofdstuk,1617,Die buulticde Godevaert helt
Heraut Beyeren,Onbekend Hoofdstuk,1618,"Tlant van Lotrike met gewelt,"
Heraut Beyeren,Onbekend Hoofdstuk,1619,"Ende wart tAntwerpen geslagen doot,"
Heraut Beyeren,Onbekend Hoofdstuk,1620,"Dat jammer was ende scade groot,"
Heraut Beyeren,Onbekend Hoofdstuk,1621,"Ende tlant quam op siinre zuster zone,"
Heraut Beyeren,Onbekend Hoofdstuk,1622,Godevaert van Bulyoen was die gone.
Heraut Beyeren,Onbekend Hoofdstuk,1623,Justaes siin broeder was grave van Bonen.
Heraut Beyeren,Onbekend Hoofdstuk,1624,"Wi vinden lesende vanden ghonen,"
Heraut Beyeren,Onbekend Hoofdstuk,1625,"Dat hi tot Clongiis leecht,"
Heraut Beyeren,Onbekend Hoofdstuk,1626,Daer men siins met eren pleecht.
Heraut Beyeren,Onbekend Hoofdstuk,1627,"Boudiin hiet die derde broeder,"
Heraut Beyeren,Onbekend Hoofdstuk,1628,Sint Yde was hoir alre moeder.
Heraut Beyeren,Onbekend Hoofdstuk,1629,Nu zal ic van horen duechden
Heraut Beyeren,Onbekend Hoofdstuk,1630,[...]
Heraut Beyeren,Onbekend Hoofdstuk,1631,Wart ghwonnen ooc met machte
Heraut Beyeren,Onbekend Hoofdstuk,1632,"Anthioce, die grote stat,"
Heraut Beyeren,Onbekend Hoofdstuk,1633,Daer Coorbiit tfolc in besat
Heraut Beyeren,Onbekend Hoofdstuk,1634,Daer na dat Jhesus wart geboren
Heraut Beyeren,Onbekend Hoofdstuk,1635,"Elf hondert jaer, als wiit horen,"
Heraut Beyeren,Onbekend Hoofdstuk,1636,Een min zo wart Jherusalem
Heraut Beyeren,Onbekend Hoofdstuk,1637,"Ghewonnen, ende ghemaect in hem"
Heraut Beyeren,Onbekend Hoofdstuk,1638,"Godevaert kueninc met hogen rade,"
Heraut Beyeren,Onbekend Hoofdstuk,1639,"Die zeide, dat hi nyet en dade"
Heraut Beyeren,Onbekend Hoofdstuk,1640,"Op siin hooft die crone van goude,"
Heraut Beyeren,Onbekend Hoofdstuk,1641,Daer God om onsen wille woude
Heraut Beyeren,Onbekend Hoofdstuk,1642,Een crone van doornen draghen.
Heraut Beyeren,Onbekend Hoofdstuk,1643,Als hi ende die sine laghen
Heraut Beyeren,Onbekend Hoofdstuk,1644,"Tot Jherusalem inder stede,"
Heraut Beyeren,Onbekend Hoofdstuk,1645,So quam met groter mogenthede
Heraut Beyeren,Onbekend Hoofdstuk,1646,Op hem Meraris van Babilone.
Heraut Beyeren,Onbekend Hoofdstuk,1647,Dien scofierden hi scone
Heraut Beyeren,Onbekend Hoofdstuk,1648,"Voir Asscalon die vaste poirt,"
Heraut Beyeren,Onbekend Hoofdstuk,1649,Ende daer ghesciede grote moirt.
Heraut Beyeren,Onbekend Hoofdstuk,1650,Een lettel min dan een iaer
Heraut Beyeren,Onbekend Hoofdstuk,1651,"Hilt hi trike, dat is waer,"
Heraut Beyeren,Onbekend Hoofdstuk,1652,"Opten een entwintichten dach,"
Heraut Beyeren,Onbekend Hoofdstuk,1653,"Die in Junius ghelach,"
Heraut Beyeren,Onbekend Hoofdstuk,1654,"Was hi te kueninc ghecoren,"
Heraut Beyeren,Onbekend Hoofdstuk,1655,"Ende hi starf ooc, als wiit horen,"
Heraut Beyeren,Onbekend Hoofdstuk,1656,"Alsmen scrief elf hondert jaer,"
Heraut Beyeren,Onbekend Hoofdstuk,1657,"Noch men noch meer, weet voir waer,"
Heraut Beyeren,Onbekend Hoofdstuk,1658,"In die maent, die hiet Junius,"
Heraut Beyeren,Onbekend Hoofdstuk,1659,"Des achtiendendaechs, wi lesent dus."
Heraut Beyeren,Onbekend Hoofdstuk,1660,"Sonder kint starf dees Godevaert,"
Heraut Beyeren,Onbekend Hoofdstuk,1661,"Want hi nye besmit en waert,"
Heraut Beyeren,Onbekend Hoofdstuk,1662,"Alsmen zeit, van sinen live,"
Heraut Beyeren,Onbekend Hoofdstuk,1663,Kuum quam ye beter man van wive.
Heraut Beyeren,Onbekend Hoofdstuk,1664,Begraven wart hi met mesbare
Heraut Beyeren,Onbekend Hoofdstuk,1665,"In Golgata, onder Monte Calvare."
Heraut Beyeren,Onbekend Hoofdstuk,1666,Na des edelen prinsen doot
Heraut Beyeren,Onbekend Hoofdstuk,1667,Die cristen heren die genoot
Heraut Beyeren,Onbekend Hoofdstuk,1668,"Koren Boudiin, sinen broeder,"
Heraut Beyeren,Onbekend Hoofdstuk,1669,"Te kueninge noch stouter no vroeder,"
Heraut Beyeren,Onbekend Hoofdstuk,1670,So en was ridder optien dach.
Heraut Beyeren,Onbekend Hoofdstuk,1671,"Dees Boudiin die lach,"
Heraut Beyeren,Onbekend Hoofdstuk,1672,"Tot Thoaes in die stede,"
Heraut Beyeren,Onbekend Hoofdstuk,1673,"Daer hi hadde behoet mede,"
Heraut Beyeren,Onbekend Hoofdstuk,1674,"Al dat graefscap vanden lande,"
Heraut Beyeren,Onbekend Hoofdstuk,1675,Daer dede hi den Torcken scande.
Heraut Beyeren,Onbekend Hoofdstuk,1676,"Noch en had hi tot dier tyt,"
Heraut Beyeren,Onbekend Hoofdstuk,1677,"Tanthioce, in den striit,"
Heraut Beyeren,Onbekend Hoofdstuk,1678,"Noch tot Jherusalem ghewesen,"
Heraut Beyeren,Onbekend Hoofdstuk,1679,Al zeitmen boerde van desen.
Heraut Beyeren,Onbekend Hoofdstuk,1680,"Opten kersdach croont men hem,"
Heraut Beyeren,Onbekend Hoofdstuk,1681,"In die kercke tot Bethlehem,"
Heraut Beyeren,Onbekend Hoofdstuk,1682,"Na siins broeder doot int selve iaer,"
Heraut Beyeren,Onbekend Hoofdstuk,1683,Die patriarck sacreerden daer.
Heraut Beyeren,Onbekend Hoofdstuk,1684,"Hi wan Assur ende Cesarien mede,"
Heraut Beyeren,Onbekend Hoofdstuk,1685,"Akers, Baruut ende menige stede,"
Heraut Beyeren,Onbekend Hoofdstuk,1686,"Drie vutnemende volc wighe,"
Heraut Beyeren,Onbekend Hoofdstuk,1687,Wan hi opt heiden diet met prighe.
Heraut Beyeren,Onbekend Hoofdstuk,1688,"Die crone droech hi achtien iaer,"
Heraut Beyeren,Onbekend Hoofdstuk,1689,"Ende was deerste, weet voir waer,"
Heraut Beyeren,Onbekend Hoofdstuk,1690,"Kueninc van Jherusalem,"
Heraut Beyeren,Onbekend Hoofdstuk,1691,"Die cristen was, dits waer van hem."
Heraut Beyeren,Onbekend Hoofdstuk,1692,"Hi bleef in Egipten doot,"
Heraut Beyeren,Onbekend Hoofdstuk,1693,"Van enen evel, dats jammer groot,"
Heraut Beyeren,Onbekend Hoofdstuk,1694,"Want hi getrect int lant was scone,"
Heraut Beyeren,Onbekend Hoofdstuk,1695,"Om te winnen Babylone,"
Heraut Beyeren,Onbekend Hoofdstuk,1696,"Ende al tland was voir hem geweken,"
Heraut Beyeren,Onbekend Hoofdstuk,1697,Want nyement iegen hem durste steken.
Heraut Beyeren,Onbekend Hoofdstuk,1698,"In Jherusalem wart hi ghedraghen,"
Heraut Beyeren,Onbekend Hoofdstuk,1699,"Mit wenen ende met groten claghen,"
Heraut Beyeren,Onbekend Hoofdstuk,1700,Neven den broeder ter luchter zide.
Heraut Beyeren,Onbekend Hoofdstuk,1701,"Ende men screef in ghenen tide,"
Heraut Beyeren,Onbekend Hoofdstuk,1702,Tcarnacioen elf hondert iaer
Heraut Beyeren,Onbekend Hoofdstuk,1703,"Ende achtien, dat is waer."
Heraut Beyeren,Onbekend Hoofdstuk,1704,"In April starf hi ten andren dage,"
Heraut Beyeren,Onbekend Hoofdstuk,1705,"Dat en is ooc gheen zighe,"
Heraut Beyeren,Onbekend Hoofdstuk,1706,"Ende zonder kint es hi bleven,"
Heraut Beyeren,Onbekend Hoofdstuk,1707,"Boudin van Bruesel, een siinre neven,"
Heraut Beyeren,Onbekend Hoofdstuk,1708,Heeft na hem die crone ontfaen.
Heraut Beyeren,Onbekend Hoofdstuk,1709,"Hier laet ic dees reden staen,"
Heraut Beyeren,Onbekend Hoofdstuk,1710,"Ende keer tot miinre materien weder,"
Heraut Beyeren,Onbekend Hoofdstuk,1711,"Vanden hertoghen, dien ic neder"
Heraut Beyeren,Onbekend Hoofdstuk,1712,Leide om deser heren doen.
Heraut Beyeren,Onbekend Hoofdstuk,1713,"Na hertooch Godevaert van Bulyoen,"
Heraut Beyeren,Onbekend Hoofdstuk,1714,"Die hertooch was van Lotrike,"
Heraut Beyeren,Onbekend Hoofdstuk,1715,"Quam thertoochdom op enen Heinrike,"
Heraut Beyeren,Onbekend Hoofdstuk,1716,Die Heinric van Lymboirch hiet.
Heraut Beyeren,Onbekend Hoofdstuk,1717,"Tien tiden begonste tbrabansce diet,"
Heraut Beyeren,Onbekend Hoofdstuk,1718,"Dat comen was van Kaerle den groten,"
Heraut Beyeren,Onbekend Hoofdstuk,1719,"Die Ardenoissche hertogen te verstoten,"
Heraut Beyeren,Onbekend Hoofdstuk,1720,"Ende hebben hem Lotrike af gewonnen,"
Heraut Beyeren,Onbekend Hoofdstuk,1721,"Dat wilde hem die keiser gonnen,"
Heraut Beyeren,Onbekend Hoofdstuk,1722,"Want hi Heinrike dreef siinre vaerde,"
Heraut Beyeren,Onbekend Hoofdstuk,1723,Ende gaft Godevaert mitten baerde.
Heraut Beyeren,Onbekend Hoofdstuk,1724,"Heinric Heinrics zoon voorscreven,"
Heraut Beyeren,Onbekend Hoofdstuk,1725,"Wan een zone es hem bleven,"
Heraut Beyeren,Onbekend Hoofdstuk,1726,"Die hiet Godevaert metten baerde,"
Heraut Beyeren,Onbekend Hoofdstuk,1727,"Ende zette tlant in hoger waerde,"
Heraut Beyeren,Onbekend Hoofdstuk,1728,"Ende verdreef ooc vromelike,"
Heraut Beyeren,Onbekend Hoofdstuk,1729,"Van Lymboirch hertooch Heinrike,"
Heraut Beyeren,Onbekend Hoofdstuk,1730,Dat hi bewesten der Mazen tlant
Heraut Beyeren,Onbekend Hoofdstuk,1731,"Moeste laten in Godevaerts hant,"
Heraut Beyeren,Onbekend Hoofdstuk,1732,"Ende aenwan met ghewelt,"
Heraut Beyeren,Onbekend Hoofdstuk,1733,"Tlant dat deerste Puppin helt,"
Heraut Beyeren,Onbekend Hoofdstuk,1734,"Ende Kaerle die hertoge, die onscone,"
Heraut Beyeren,Onbekend Hoofdstuk,1735,Thertoochdom verloos entie crone.
Heraut Beyeren,Onbekend Hoofdstuk,1736,"Dus wart Godevaert metten baerde,"
Heraut Beyeren,Onbekend Hoofdstuk,1737,"Beide met vonnesse ende metten zwaerde,"
Heraut Beyeren,Onbekend Hoofdstuk,1738,"Die eerste hertoge van hem allen,"
Heraut Beyeren,Onbekend Hoofdstuk,1739,Sint dat tlant was tevallen.
Heraut Beyeren,Onbekend Hoofdstuk,1740,"Ende dese starf, dat is waer,"
Heraut Beyeren,Onbekend Hoofdstuk,1741,Men screef xic ende veertich iaer.
Heraut Beyeren,Onbekend Hoofdstuk,1742,"Syn gheslachte brochte hi scone,"
Heraut Beyeren,Onbekend Hoofdstuk,1743,"Sonder toter kuenincx crone,"
Heraut Beyeren,Onbekend Hoofdstuk,1744,Daerse Hughe capet vut stack.
Heraut Beyeren,Onbekend Hoofdstuk,1745,"Hi was van Kaerle, die eerst brack,"
Heraut Beyeren,Onbekend Hoofdstuk,1746,"Die zevende na rechter geboirt,"
Heraut Beyeren,Onbekend Hoofdstuk,1747,"Ende Kaerle die hertoge, die was voirt"
Heraut Beyeren,Onbekend Hoofdstuk,1748,"Van grote Kaerle die zevende mede,"
Heraut Beyeren,Onbekend Hoofdstuk,1749,"Ende grote Kaerle, dits die waerhede,"
Heraut Beyeren,Onbekend Hoofdstuk,1750,Was die zevende van Kaerleman.
Heraut Beyeren,Onbekend Hoofdstuk,1751,Ende zegge u voirt van Godevaert dan.
Heraut Beyeren,Onbekend Hoofdstuk,1752,"Dese wan den andren Godevaert,"
Heraut Beyeren,Onbekend Hoofdstuk,1753,Die hertoge naden vader waert.
Heraut Beyeren,Onbekend Hoofdstuk,1754,"Die keiser track an hem dat kint,"
Heraut Beyeren,Onbekend Hoofdstuk,1755,"Want hi den vader hadde gemint,"
Heraut Beyeren,Onbekend Hoofdstuk,1756,"Ende gaf hem tewive een hiet Lutgaert,"
Heraut Beyeren,Onbekend Hoofdstuk,1757,"Siins wiifs zuster, daer Godevaert"
Heraut Beyeren,Onbekend Hoofdstuk,1758,Die derde aen ghewonnen was.
Heraut Beyeren,Onbekend Hoofdstuk,1759,"Mer die vader starf, als ict las,"
Heraut Beyeren,Onbekend Hoofdstuk,1760,Alst tkint hadde omtrent een iaer.
Heraut Beyeren,Onbekend Hoofdstuk,1761,"Hier om stont in groten vaer,"
Heraut Beyeren,Onbekend Hoofdstuk,1762,"Brabant enen langhen stont,"
Heraut Beyeren,Onbekend Hoofdstuk,1763,Eer dat kint wart naemkont.
Heraut Beyeren,Onbekend Hoofdstuk,1764,"Doch dat tkint cwin ghewan,"
Heraut Beyeren,Onbekend Hoofdstuk,1765,"Dat hem van rechten oir quam an,"
Heraut Beyeren,Onbekend Hoofdstuk,1766,"Ende hem wart beemt, rente ende lant,"
Heraut Beyeren,Onbekend Hoofdstuk,1767,Veel gheworpen vter hant.
Heraut Beyeren,Onbekend Hoofdstuk,1768,Dies noch huden die hertoghen
Heraut Beyeren,Onbekend Hoofdstuk,1769,"Weder ghewinnen nyet en moghen,"
Heraut Beyeren,Onbekend Hoofdstuk,1770,"Doch dat hi te manne wies,"
Heraut Beyeren,Onbekend Hoofdstuk,1771,"Ende nam tewive na dies,"
Heraut Beyeren,Onbekend Hoofdstuk,1772,"Van Lymboirch hertooch Heinrics kint,"
Heraut Beyeren,Onbekend Hoofdstuk,1773,"Ende wan, als men bescreven vint,"
Heraut Beyeren,Onbekend Hoofdstuk,1774,"An hoir Heynric den Ouden,"
Heraut Beyeren,Onbekend Hoofdstuk,1775,"Die na hem Brabant heeft behouden,"
Heraut Beyeren,Onbekend Hoofdstuk,1776,"Ende een Aelbrecht, die bisscop was"
Heraut Beyeren,Onbekend Hoofdstuk,1777,"Tot Ludicke, als ict las,"
Heraut Beyeren,Onbekend Hoofdstuk,1778,Dien die keiser Heinric dede
Heraut Beyeren,Onbekend Hoofdstuk,1779,Martelen tot Riemen inder stede.
Heraut Beyeren,Onbekend Hoofdstuk,1780,Dese Heinric doude wart hertoge
Heraut Beyeren,Onbekend Hoofdstuk,1781,"Ende huwede edelic ende hoge,"
Heraut Beyeren,Onbekend Hoofdstuk,1782,"Die een capiteyn was over meer,"
Heraut Beyeren,Onbekend Hoofdstuk,1783,Van al den cristen beer.
Heraut Beyeren,Onbekend Hoofdstuk,1784,"Hi nam een Machtilt van Bonen,"
Heraut Beyeren,Onbekend Hoofdstuk,1785,"Matheeus dochter, die gheen zonen"
Heraut Beyeren,Onbekend Hoofdstuk,1786,Gekreech van hore moeder.
Heraut Beyeren,Onbekend Hoofdstuk,1787,"Matheeus was graef Philips broeder,"
Heraut Beyeren,Onbekend Hoofdstuk,1788,Dien ic tevoren ghewoech.
Heraut Beyeren,Onbekend Hoofdstuk,1789,Dees hertoochinne Machtilt droech
Heraut Beyeren,Onbekend Hoofdstuk,1790,"Heynric, die naden vader,"
Heraut Beyeren,Onbekend Hoofdstuk,1791,"Thertoochdom behilt algader,"
Heraut Beyeren,Onbekend Hoofdstuk,1792,"Ende keiserinnen Marien,"
Heraut Beyeren,Onbekend Hoofdstuk,1793,"Keiser Otten wiif des vrien,"
Heraut Beyeren,Onbekend Hoofdstuk,1794,"Ende van Gelre die graefnede,"
Heraut Beyeren,Onbekend Hoofdstuk,1795,"Ende die van Avaerne mede,"
Heraut Beyeren,Onbekend Hoofdstuk,1796,Ende Machtilt deerste palensgravinne
Heraut Beyeren,Onbekend Hoofdstuk,1797,"Vanden Rine, als ict kinne,"
Heraut Beyeren,Onbekend Hoofdstuk,1798,Ende daer na vrouwe van Hollant.
Heraut Beyeren,Onbekend Hoofdstuk,1799,"Dees Heinric doude, als ict vant"
Heraut Beyeren,Onbekend Hoofdstuk,1800,"Nam echt een vrouwe hoghe,"
Heraut Beyeren,Onbekend Hoofdstuk,1801,"Philips dochter met een oghe,"
Heraut Beyeren,Onbekend Hoofdstuk,1802,"Dies Vrancrike was altesamen,"
Heraut Beyeren,Onbekend Hoofdstuk,1803,"Marie hiet si bi namen,"
Heraut Beyeren,Onbekend Hoofdstuk,1804,Daer hem een dochter van es bleven.
Heraut Beyeren,Onbekend Hoofdstuk,1805,"Die nam die jonge grave van Cleven,"
Heraut Beyeren,Onbekend Hoofdstuk,1806,"Die Diederic hiet, ende waren bi"
Heraut Beyeren,Onbekend Hoofdstuk,1807,Hate die vrouwe van Derbi.
Heraut Beyeren,Onbekend Hoofdstuk,1808,"Heinric doude, die jammerlike,"
Heraut Beyeren,Onbekend Hoofdstuk,1809,"Den broeder verloos bi keiser Heinrike,"
Heraut Beyeren,Onbekend Hoofdstuk,1810,"Had veel wederstoots ende pine,"
Heraut Beyeren,Onbekend Hoofdstuk,1811,Alomme vanden viande sine.
Heraut Beyeren,Onbekend Hoofdstuk,1812,"Hi wan Ludicke die stede,"
Heraut Beyeren,Onbekend Hoofdstuk,1813,"Daer hi grote scade in dede,"
Heraut Beyeren,Onbekend Hoofdstuk,1814,"Hier na ghevielen zo die zaken,"
Heraut Beyeren,Onbekend Hoofdstuk,1815,Dat die Ludickeren bi Montenaken
Heraut Beyeren,Onbekend Hoofdstuk,1816,"Op hem wonnen enen striit groot,"
Heraut Beyeren,Onbekend Hoofdstuk,1817,Daer veel Brabanders bleven doot.
Heraut Beyeren,Onbekend Hoofdstuk,1818,"Tot Cuelen starf dees edel here,"
Heraut Beyeren,Onbekend Hoofdstuk,1819,"Ende was tot Leuven gebracht met zere,"
Heraut Beyeren,Onbekend Hoofdstuk,1820,"Ende regneerde, dats openbaer,"
Heraut Beyeren,Onbekend Hoofdstuk,1821,"In Brabant xlviij jaer,"
Heraut Beyeren,Onbekend Hoofdstuk,1822,"Als tcaernacioen was, dits waer,"
Heraut Beyeren,Onbekend Hoofdstuk,1823,M twe hondert ende twaelf iaer.
Heraut Beyeren,Onbekend Hoofdstuk,1824,Ende liet Heinric sinen zone.
Heraut Beyeren,Onbekend Hoofdstuk,1825,"Stout ende vromich was die gone,"
Heraut Beyeren,Onbekend Hoofdstuk,1826,"Heinric die stoute entie vrie,"
Heraut Beyeren,Onbekend Hoofdstuk,1827,"Nam tewive een hiet Marie,"
Heraut Beyeren,Onbekend Hoofdstuk,1828,"Hoir maechscap, waen si was geboren,"
Heraut Beyeren,Onbekend Hoofdstuk,1829,"Muechdi hier bescreven horen,"
Heraut Beyeren,Onbekend Hoofdstuk,1830,"Vrederic die keyser doude,"
Heraut Beyeren,Onbekend Hoofdstuk,1831,"Die verdranck alst God woude,"
Heraut Beyeren,Onbekend Hoofdstuk,1832,"Die wan den keyser Heinrike,"
Heraut Beyeren,Onbekend Hoofdstuk,1833,"Die hem nyet proefde keiserlike,"
Heraut Beyeren,Onbekend Hoofdstuk,1834,"Ende Philipse, ziit zeker das,"
Heraut Beyeren,Onbekend Hoofdstuk,1835,"Die een roomscher koeninc was,"
Heraut Beyeren,Onbekend Hoofdstuk,1836,"Philips die wan dochtren drie,"
Heraut Beyeren,Onbekend Hoofdstuk,1837,"Deen hiet Marie, dien gaf hie,"
Heraut Beyeren,Onbekend Hoofdstuk,1838,"Desen Heinrike van Brabant,"
Heraut Beyeren,Onbekend Hoofdstuk,1839,"Die thertoochdom had in die hant,"
Heraut Beyeren,Onbekend Hoofdstuk,1840,"Daer hi enen Heinric an wan,"
Heraut Beyeren,Onbekend Hoofdstuk,1841,"Daer af quam die eerste Jan,"
Heraut Beyeren,Onbekend Hoofdstuk,1842,Die voir desen hadde thertoochrike.
