author,chapter,line,text
Heraut Beyeren,Onbekend Hoofdstuk,1,"Hets goet spreken van den vroeden,"
Heraut Beyeren,Onbekend Hoofdstuk,2,"Van den vromen end' van den goeden,"
Heraut Beyeren,Onbekend Hoofdstuk,3,Die hem voirmaels zeetten ter eren;
Heraut Beyeren,Onbekend Hoofdstuk,4,Ooc men macher an leren
Heraut Beyeren,Onbekend Hoofdstuk,5,Veel duechden ende wiisheiden
Heraut Beyeren,Onbekend Hoofdstuk,6,Diere siin leven na wil leiden.
Heraut Beyeren,Onbekend Hoofdstuk,7,Daer bi wil ic v nv seggen
Heraut Beyeren,Onbekend Hoofdstuk,8,In corten woirden vut leggen
Heraut Beyeren,Onbekend Hoofdstuk,9,"Van den besten prinsen waerliic,"
Heraut Beyeren,Onbekend Hoofdstuk,10,"Die ye quamen in aerdriic,"
Heraut Beyeren,Onbekend Hoofdstuk,11,Daer die edelen hertogen fiin
Heraut Beyeren,Onbekend Hoofdstuk,12,Van Braband af comen siin.
Heraut Beyeren,Onbekend Hoofdstuk,13,"Mi wondert wat hem ginc ane,"
Heraut Beyeren,Onbekend Hoofdstuk,14,Die den zage van den zwane
Heraut Beyeren,Onbekend Hoofdstuk,15,Visierde ende brachte voirt;
Heraut Beyeren,Onbekend Hoofdstuk,16,Want het en was nye gehoirt
Heraut Beyeren,Onbekend Hoofdstuk,17,Dat een zwane mocht mensce wesen.
Heraut Beyeren,Onbekend Hoofdstuk,18,Alle die gene die dit lesen
Heraut Beyeren,Onbekend Hoofdstuk,19,"Ende dichten quade truffen,"
Heraut Beyeren,Onbekend Hoofdstuk,20,"Daer si tfolc mede versuffen,"
Heraut Beyeren,Onbekend Hoofdstuk,21,Doen daer an zonde groot.
Heraut Beyeren,Onbekend Hoofdstuk,22,Nu hoirt hier al bloot
Heraut Beyeren,Onbekend Hoofdstuk,23,Die corte croniken te hant
Heraut Beyeren,Onbekend Hoofdstuk,24,"Vanden prinsen van Brabant,"
Heraut Beyeren,Onbekend Hoofdstuk,25,"Hoe si hieten ende wie si waren,"
Heraut Beyeren,Onbekend Hoofdstuk,26,"In viif ende twintich hondert jaren,"
Heraut Beyeren,Onbekend Hoofdstuk,27,"Tot op desen derden Janne,"
Heraut Beyeren,Onbekend Hoofdstuk,28,Die nv eerst es comen te manne.
Heraut Beyeren,Onbekend Hoofdstuk,29,God ons here moet hem gheven
Heraut Beyeren,Onbekend Hoofdstuk,30,"Wiisheit ende lange leven,"
Heraut Beyeren,Onbekend Hoofdstuk,31,"Gheluc, ere ende victorie"
Heraut Beyeren,Onbekend Hoofdstuk,32,Ende daer na die ewige glorie.
Heraut Beyeren,Onbekend Hoofdstuk,33,Amen zegt met zoeten sinne
Heraut Beyeren,Onbekend Hoofdstuk,34,Ende hoirt hier an ic beghinne.
Heraut Beyeren,Onbekend Hoofdstuk,35,Eerst zo hoirt van den Vrancken.
Heraut Beyeren,Onbekend Hoofdstuk,36,Doe dat riic begonde crancken.
Heraut Beyeren,Onbekend Hoofdstuk,37,"Als die spieghel v besciet,"
Heraut Beyeren,Onbekend Hoofdstuk,38,Dat edel fransoissche diet
Heraut Beyeren,Onbekend Hoofdstuk,39,"Dat es Vut Trogen geboren,"
Heraut Beyeren,Onbekend Hoofdstuk,40,"Alsment mach bescreven horen,"
Heraut Beyeren,Onbekend Hoofdstuk,41,Want doe Trogen met gewelt
Heraut Beyeren,Onbekend Hoofdstuk,42,"Gedestrueert wart ende gevelt,"
Heraut Beyeren,Onbekend Hoofdstuk,43,Daer hem die Griecken mede wraken
Heraut Beyeren,Onbekend Hoofdstuk,44,"Doir Helena dat siit ontscaken,"
Heraut Beyeren,Onbekend Hoofdstuk,45,"Ende dat dus ende nam,"
Heraut Beyeren,Onbekend Hoofdstuk,46,"Was na die geboirte van Abram,"
Heraut Beyeren,Onbekend Hoofdstuk,47,"Daer die derde Etaet in ghinc,"
Heraut Beyeren,Onbekend Hoofdstuk,48,Negen hondert iaer in ware dinc
Heraut Beyeren,Onbekend Hoofdstuk,49,"Ende xlvi, als wiid horen."
Heraut Beyeren,Onbekend Hoofdstuk,50,Eer dat xpc. ward geboren
Heraut Beyeren,Onbekend Hoofdstuk,51,So wast elf hondert jair
Heraut Beyeren,Onbekend Hoofdstuk,52,"Ende neghen ende tsestich, dat is waer,"
Heraut Beyeren,Onbekend Hoofdstuk,53,"Als die historien ons geven,"
Heraut Beyeren,Onbekend Hoofdstuk,54,Die de tiden hebben bescreven
Heraut Beyeren,Onbekend Hoofdstuk,55,"Ende Trogen stont, dat is waer,"
Heraut Beyeren,Onbekend Hoofdstuk,56,Hondert ende lxxxv jaer;
Heraut Beyeren,Onbekend Hoofdstuk,57,So vloon dair vut waerliic
Heraut Beyeren,Onbekend Hoofdstuk,58,"Die beste baroene van aerdriic,"
Heraut Beyeren,Onbekend Hoofdstuk,59,"Hectors geslachte des heren groot,"
Heraut Beyeren,Onbekend Hoofdstuk,60,Nye en vand men siins ghenoot.
Heraut Beyeren,Onbekend Hoofdstuk,61,"Dees edel geslachten, dees Trogiene"
Heraut Beyeren,Onbekend Hoofdstuk,62,Begonden hem streyen ente vliene.
Heraut Beyeren,Onbekend Hoofdstuk,63,"Eneas, die van Trogen ontginc,"
Heraut Beyeren,Onbekend Hoofdstuk,64,"Quam ter Tyber, dats waer dinc,"
Heraut Beyeren,Onbekend Hoofdstuk,65,"Selc zeit iij jaer, zelc achte,"
Heraut Beyeren,Onbekend Hoofdstuk,66,"Na dat Trogen vel met machte,"
Heraut Beyeren,Onbekend Hoofdstuk,67,Ende wart daer kueninc van Latine
Heraut Beyeren,Onbekend Hoofdstuk,68,"Met siinre dochter lauine,"
Heraut Beyeren,Onbekend Hoofdstuk,69,Waer tevoren hadde ghewesen
Heraut Beyeren,Onbekend Hoofdstuk,70,"Janus kueninck, als wiit lesen,"
Heraut Beyeren,Onbekend Hoofdstuk,71,Ende lande eerst an Ytale
Heraut Beyeren,Onbekend Hoofdstuk,72,"Daer Rome af quam, weetmen wale."
Heraut Beyeren,Onbekend Hoofdstuk,73,Ende xijm waerre in porre
Heraut Beyeren,Onbekend Hoofdstuk,74,In die vlucht met Anthenorre;
Heraut Beyeren,Onbekend Hoofdstuk,75,Te Vinegen lande hi ende te Padou
Heraut Beyeren,Onbekend Hoofdstuk,76,Daer leecht hi dees heer ontrou.
Heraut Beyeren,Onbekend Hoofdstuk,77,Hectors zoon Fransioen
Heraut Beyeren,Onbekend Hoofdstuk,78,Quam in die Dunou an gevloen
Heraut Beyeren,Onbekend Hoofdstuk,79,"Metten sinen, daer Ongeren end"
Heraut Beyeren,Onbekend Hoofdstuk,80,"Optie maertse, dus ist bekend,"
Heraut Beyeren,Onbekend Hoofdstuk,81,"Die men heit Meothides,"
Heraut Beyeren,Onbekend Hoofdstuk,82,Ende droegen over een daer des
Heraut Beyeren,Onbekend Hoofdstuk,83,"Dat si daer maecten ene stede,"
Heraut Beyeren,Onbekend Hoofdstuk,84,Die men Sycambren heiten deden
Heraut Beyeren,Onbekend Hoofdstuk,85,"Ten eersten hiet mense Trogiene,"
Heraut Beyeren,Onbekend Hoofdstuk,86,"Ende daer na Fransiene,"
Heraut Beyeren,Onbekend Hoofdstuk,87,Ende doe Sycambriene daer naer.
Heraut Beyeren,Onbekend Hoofdstuk,88,Dit was xv hondert jaer
Heraut Beyeren,Onbekend Hoofdstuk,89,Eer si besaten Vranckelant
Heraut Beyeren,Onbekend Hoofdstuk,90,Of eer si Vrancken waren genant.
Heraut Beyeren,Onbekend Hoofdstuk,91,Binnen desen tiden dees Trogiene
Heraut Beyeren,Onbekend Hoofdstuk,92,"Quamen in menigen gesciene,"
Heraut Beyeren,Onbekend Hoofdstuk,93,Ende daden dicke met ouerdaden
Heraut Beyeren,Onbekend Hoofdstuk,94,"Den Romeynen zwaren scaden,"
Heraut Beyeren,Onbekend Hoofdstuk,95,So dat sise dicke aen streden
Heraut Beyeren,Onbekend Hoofdstuk,96,"Toten Rine met mogentheden,"
Heraut Beyeren,Onbekend Hoofdstuk,97,So dat des groots Constantiins zone
Heraut Beyeren,Onbekend Hoofdstuk,98,Op hem street ende was die gone
Heraut Beyeren,Onbekend Hoofdstuk,99,Diese doch an horen dank
Heraut Beyeren,Onbekend Hoofdstuk,100,"Aen die roomsche wet bedwanck,"
Heraut Beyeren,Onbekend Hoofdstuk,101,Dat was die keiser Constant.
Heraut Beyeren,Onbekend Hoofdstuk,102,Daer na quamen in dat lant
Heraut Beyeren,Onbekend Hoofdstuk,103,"Die Alane, hebben wi verstaen,"
Heraut Beyeren,Onbekend Hoofdstuk,104,Doe die eerste Valentiniaen
Heraut Beyeren,Onbekend Hoofdstuk,105,"Keiser was int roomsche rike,"
Heraut Beyeren,Onbekend Hoofdstuk,106,Ende daden hem scade grotelike.
Heraut Beyeren,Onbekend Hoofdstuk,107,Doe geboot hi die Sicambriene vut
Heraut Beyeren,Onbekend Hoofdstuk,108,Ende verliet hem horen tribuut
Heraut Beyeren,Onbekend Hoofdstuk,109,"Tien jaer, bewonden si hem des"
Heraut Beyeren,Onbekend Hoofdstuk,110,Dat si die maertse Meothides
Heraut Beyeren,Onbekend Hoofdstuk,111,Suverden ende verdreven dane
Heraut Beyeren,Onbekend Hoofdstuk,112,"Die roomsche viande, die Alane."
Heraut Beyeren,Onbekend Hoofdstuk,113,Aldus des volcs een pertie
Heraut Beyeren,Onbekend Hoofdstuk,114,"Wonende es bleven in Ongerie,"
Heraut Beyeren,Onbekend Hoofdstuk,115,"Beide met kindren ende met wiven,"
Heraut Beyeren,Onbekend Hoofdstuk,116,"Als die daer wonende wouden bliven,"
Heraut Beyeren,Onbekend Hoofdstuk,117,Ende bleven daer wonende voirt
Heraut Beyeren,Onbekend Hoofdstuk,118,Tot na xpc. gheboirt
Heraut Beyeren,Onbekend Hoofdstuk,119,Omtrent viertien hondert jaer.
Heraut Beyeren,Onbekend Hoofdstuk,120,Ende om dat hem was te swaer
Heraut Beyeren,Onbekend Hoofdstuk,121,"Die keiser voirscr. Valentiniaen,"
Heraut Beyeren,Onbekend Hoofdstuk,122,"Daer si jegen hadden misdaen,"
Heraut Beyeren,Onbekend Hoofdstuk,123,"So rwmden si Ongherien,"
Heraut Beyeren,Onbekend Hoofdstuk,124,Ende quamen met horen pertien
Heraut Beyeren,Onbekend Hoofdstuk,125,Ende besaten alle die termine
Heraut Beyeren,Onbekend Hoofdstuk,126,Tusschen der Dunouwen enten Rine.
Heraut Beyeren,Onbekend Hoofdstuk,127,"Tien tiden hadden si enen hooftman,"
Heraut Beyeren,Onbekend Hoofdstuk,128,"Die geheiten was Prian,"
Heraut Beyeren,Onbekend Hoofdstuk,129,"Met hem traken si over die broecke,"
Heraut Beyeren,Onbekend Hoofdstuk,130,Ende daden zo zwaer zoecke
Heraut Beyeren,Onbekend Hoofdstuk,131,"Optie Alane, dat sise verdreven,"
Heraut Beyeren,Onbekend Hoofdstuk,132,Ende namer menich tleven
Heraut Beyeren,Onbekend Hoofdstuk,133,Des dancte hem Valentiniaen
Heraut Beyeren,Onbekend Hoofdstuk,134,Ende hietse Vrancken hetten zaen
Heraut Beyeren,Onbekend Hoofdstuk,135,Die eerst hieten Sicambriene
Heraut Beyeren,Onbekend Hoofdstuk,136,Athenorriene of Trogiene.
Heraut Beyeren,Onbekend Hoofdstuk,137,Ende daer maecken si aldus
Heraut Beyeren,Onbekend Hoofdstuk,138,"Enen kueninc, hiet Priamus,"
Heraut Beyeren,Onbekend Hoofdstuk,139,"Vroom, rike ende van machte,"
Heraut Beyeren,Onbekend Hoofdstuk,140,Ghecomen van Hectors geslachte.
Heraut Beyeren,Onbekend Hoofdstuk,141,Ende doe wart der Vrancken here
Heraut Beyeren,Onbekend Hoofdstuk,142,"Dees Priamus met groter ere,"
Heraut Beyeren,Onbekend Hoofdstuk,143,Ja van des ouden Priams natioene
Heraut Beyeren,Onbekend Hoofdstuk,144,Die van Hector bi Francioene
Heraut Beyeren,Onbekend Hoofdstuk,145,"Van rechter gheboirte quam,"
Heraut Beyeren,Onbekend Hoofdstuk,146,Alsment in der yeeste vernam.
Heraut Beyeren,Onbekend Hoofdstuk,147,Wie begonnen die Croniken
Heraut Beyeren,Onbekend Hoofdstuk,148,"Van der cronen van Vrancriken,"
Heraut Beyeren,Onbekend Hoofdstuk,149,"Onder den keiser Graciaen,"
Heraut Beyeren,Onbekend Hoofdstuk,150,Dies vader was Valentiniaen.
Heraut Beyeren,Onbekend Hoofdstuk,151,Die keiser wart met sinen broeder
Heraut Beyeren,Onbekend Hoofdstuk,152,"Valentiniaen, na dat die moeder"
Heraut Beyeren,Onbekend Hoofdstuk,153,Maria droech den Here almachtich
Heraut Beyeren,Onbekend Hoofdstuk,154,Drie hondert een jaer ende tachtich.
Heraut Beyeren,Onbekend Hoofdstuk,155,Ende doe was der Vrancken here
Heraut Beyeren,Onbekend Hoofdstuk,156,Priamus met groter ere.
Heraut Beyeren,Onbekend Hoofdstuk,157,"Dees Priam na dien x jare,"
Heraut Beyeren,Onbekend Hoofdstuk,158,"Dat hi was van tribute clare,"
Heraut Beyeren,Onbekend Hoofdstuk,159,"Om dat hi die Alane verdreef,"
Heraut Beyeren,Onbekend Hoofdstuk,160,"Als ic hier tevoren screef,"
Heraut Beyeren,Onbekend Hoofdstuk,161,En wilde hi nemeer tribuut geven;
Heraut Beyeren,Onbekend Hoofdstuk,162,Daer om wart hi tlans verdreven
Heraut Beyeren,Onbekend Hoofdstuk,163,Van den Romeynen met groter were.
Heraut Beyeren,Onbekend Hoofdstuk,164,Doe quam hi met sinen here
Heraut Beyeren,Onbekend Hoofdstuk,165,"Ten Rine waert, ende besat"
Heraut Beyeren,Onbekend Hoofdstuk,166,"Beide lant, burghe ende stat,"
Heraut Beyeren,Onbekend Hoofdstuk,167,Dat nv heit Vranckelant.
Heraut Beyeren,Onbekend Hoofdstuk,168,Dus ist na den Vrancken genant.
Heraut Beyeren,Onbekend Hoofdstuk,169,Ende besat alle die termine
Heraut Beyeren,Onbekend Hoofdstuk,170,Tusschen der Dunouwe enten Rine
Heraut Beyeren,Onbekend Hoofdstuk,171,"Viif jaer was dees Priam here,"
Heraut Beyeren,Onbekend Hoofdstuk,172,Ende starf inder werelt ere.
Heraut Beyeren,Onbekend Hoofdstuk,173,Priam dees kueninc liet
Heraut Beyeren,Onbekend Hoofdstuk,174,"Enen soon, die Mercomeris hiet."
Heraut Beyeren,Onbekend Hoofdstuk,175,Drie ende dertich jaer met gewelt
Heraut Beyeren,Onbekend Hoofdstuk,176,Trike na den vader helt.
Heraut Beyeren,Onbekend Hoofdstuk,177,Merct dat men hier over liit
Heraut Beyeren,Onbekend Hoofdstuk,178,Hoir oirloghe ende horen striit.
Heraut Beyeren,Onbekend Hoofdstuk,179,"Die wil weten die historien lanc,"
Heraut Beyeren,Onbekend Hoofdstuk,180,"Hi doe toten yeesten hoir ganc,"
Heraut Beyeren,Onbekend Hoofdstuk,181,"Ten groten boecken, die hoir leven"
Heraut Beyeren,Onbekend Hoofdstuk,182,Met goeder moeten hebben bescreven.
Heraut Beyeren,Onbekend Hoofdstuk,183,Hier muechdi horen een cort waer.
Heraut Beyeren,Onbekend Hoofdstuk,184,Al wairt mi te lanc ende te zwaer
Heraut Beyeren,Onbekend Hoofdstuk,185,"Te bescriven hoir yeesten,"
Heraut Beyeren,Onbekend Hoofdstuk,186,Hoir oirloghen ende hoir feesten.
Heraut Beyeren,Onbekend Hoofdstuk,187,"Hi lese Vincent den Jacoppiin,"
Heraut Beyeren,Onbekend Hoofdstuk,188,"Diet bescreven heeft int latiin,"
Heraut Beyeren,Onbekend Hoofdstuk,189,"In den Spieghel Historiale,"
Heraut Beyeren,Onbekend Hoofdstuk,190,"Die kuenincrike altemale,"
Heraut Beyeren,Onbekend Hoofdstuk,191,Van den beghinne van aerdrike
Heraut Beyeren,Onbekend Hoofdstuk,192,Tot dat Lodewiic van Vrancrike
Heraut Beyeren,Onbekend Hoofdstuk,193,Tot Damiaten was ghevaen
Heraut Beyeren,Onbekend Hoofdstuk,194,Van den heiden Soudaen.
Heraut Beyeren,Onbekend Hoofdstuk,195,"Daer vind hiit bescreven al,"
Heraut Beyeren,Onbekend Hoofdstuk,196,Hier vindi yeesten cort ende smal.
Heraut Beyeren,Onbekend Hoofdstuk,197,Mercomeris die wan
Heraut Beyeren,Onbekend Hoofdstuk,198,"Farramond den tyran,"
Heraut Beyeren,Onbekend Hoofdstuk,199,Ende was die eerste gecroonde here
Heraut Beyeren,Onbekend Hoofdstuk,200,"Elf jaer luttel min of mere,"
Heraut Beyeren,Onbekend Hoofdstuk,201,So nam Farramond in die hant
Heraut Beyeren,Onbekend Hoofdstuk,202,Na den vader Vranckenlant.
Heraut Beyeren,Onbekend Hoofdstuk,203,Daer na wast Clodioen siin zone
Heraut Beyeren,Onbekend Hoofdstuk,204,"Enen tzede plach die ghone,"
Heraut Beyeren,Onbekend Hoofdstuk,205,Dat hi siin haer liet wassen lanc
Heraut Beyeren,Onbekend Hoofdstuk,206,Toten ryem hadt sinen ghanc.
Heraut Beyeren,Onbekend Hoofdstuk,207,"Des plagen die vrancse heren gemene,"
Heraut Beyeren,Onbekend Hoofdstuk,208,Tot dat Puppin quam die clene.
Heraut Beyeren,Onbekend Hoofdstuk,209,Achtien jaer droech hi die crone
Heraut Beyeren,Onbekend Hoofdstuk,210,Doe nam die zone telone.
Heraut Beyeren,Onbekend Hoofdstuk,211,Die Merowing bi namen hiet
Heraut Beyeren,Onbekend Hoofdstuk,212,"Vromer liif en wistmen niet,"
Heraut Beyeren,Onbekend Hoofdstuk,213,Dat siin gheslachte altesamen
Heraut Beyeren,Onbekend Hoofdstuk,214,Merowinge hietten bi namen.
Heraut Beyeren,Onbekend Hoofdstuk,215,Ende hiit al wan met ghewelt
Heraut Beyeren,Onbekend Hoofdstuk,216,"Van den Riin toter Scelt,"
Heraut Beyeren,Onbekend Hoofdstuk,217,Ende Camerike die stede.
Heraut Beyeren,Onbekend Hoofdstuk,218,Tien jaer stont siin mogenthede.
Heraut Beyeren,Onbekend Hoofdstuk,219,Merowing wan Hildrike
Heraut Beyeren,Onbekend Hoofdstuk,220,Die xxvi jaer behelt trike.
Heraut Beyeren,Onbekend Hoofdstuk,221,Hi nam te wive van Duringen
Heraut Beyeren,Onbekend Hoofdstuk,222,"Die kueninciinne in waren dingen,"
Heraut Beyeren,Onbekend Hoofdstuk,223,"Basine hiet dees vrouwe mare,"
Heraut Beyeren,Onbekend Hoofdstuk,224,Men leest dat hi wan an hare
Heraut Beyeren,Onbekend Hoofdstuk,225,"Clodouis den kueninc,"
Heraut Beyeren,Onbekend Hoofdstuk,226,Die eerst kerstendom ontfinc
Heraut Beyeren,Onbekend Hoofdstuk,227,Van den kueningen van Vrancrike.
Heraut Beyeren,Onbekend Hoofdstuk,228,Want dees zesse ghemeenlike
Heraut Beyeren,Onbekend Hoofdstuk,229,"Die voir desen siin ghenoemt,"
Heraut Beyeren,Onbekend Hoofdstuk,230,Bleven heiden ende verdoemt.
Heraut Beyeren,Onbekend Hoofdstuk,231,Dese bleef kerstin goet van prise
Heraut Beyeren,Onbekend Hoofdstuk,232,"Bi den rade van sinte Remise,"
Heraut Beyeren,Onbekend Hoofdstuk,233,"Ende heeften Lodewiic ghenant,"
Heraut Beyeren,Onbekend Hoofdstuk,234,Want hi geweldich bleef int lant
Heraut Beyeren,Onbekend Hoofdstuk,235,Clodouis had in die hant
Heraut Beyeren,Onbekend Hoofdstuk,236,"Duringen ende Vrankenlant,"
Heraut Beyeren,Onbekend Hoofdstuk,237,"Ende wan al tlant, als ic hore,"
Heraut Beyeren,Onbekend Hoofdstuk,238,Van der Seynen toter Lore.
Heraut Beyeren,Onbekend Hoofdstuk,239,"Hi was stout ende onvervaert,"
Heraut Beyeren,Onbekend Hoofdstuk,240,"Noch toe eer hi kersten weert,"
Heraut Beyeren,Onbekend Hoofdstuk,241,Was hi milde ende goedertiere.
Heraut Beyeren,Onbekend Hoofdstuk,242,"Doe nam hi een joncvrou fiere,"
Heraut Beyeren,Onbekend Hoofdstuk,243,"Die Clotild hiet ende kerstin was,"
Heraut Beyeren,Onbekend Hoofdstuk,244,"Des kueninx dochter, als ict las,"
Heraut Beyeren,Onbekend Hoofdstuk,245,"Van Borgongen, die Cilpric hiet."
Heraut Beyeren,Onbekend Hoofdstuk,246,"Die dat horen manne riet,"
Heraut Beyeren,Onbekend Hoofdstuk,247,"Dat hi van sinte Remi van Riemen,"
Heraut Beyeren,Onbekend Hoofdstuk,248,"Want heiliger, waen ic, was doe niemen,"
Heraut Beyeren,Onbekend Hoofdstuk,249,"Doopsel ontfinc hi, dits bekent,"
Heraut Beyeren,Onbekend Hoofdstuk,250,Dat hem van den hemel is gesent
Heraut Beyeren,Onbekend Hoofdstuk,251,"Die heilige olinge in een vat,"
Heraut Beyeren,Onbekend Hoofdstuk,252,Daermen mede sacreerde tier stat.
Heraut Beyeren,Onbekend Hoofdstuk,253,"Noch is daer dampulle, des ziit wiis,"
Heraut Beyeren,Onbekend Hoofdstuk,254,"In den clooster tsinte Remiis,"
Heraut Beyeren,Onbekend Hoofdstuk,255,"Ende alsmen enen kueninc sal wien,"
Heraut Beyeren,Onbekend Hoofdstuk,256,Sacreren ende benedien
Heraut Beyeren,Onbekend Hoofdstuk,257,Neemt men een guldin spelde daer
Heraut Beyeren,Onbekend Hoofdstuk,258,"Ende steecse in dampulle, dats waer,"
Heraut Beyeren,Onbekend Hoofdstuk,259,Ende menget datter ane hanct
Heraut Beyeren,Onbekend Hoofdstuk,260,"In den krisdom, di men lanct,"
Heraut Beyeren,Onbekend Hoofdstuk,261,"Ende witer den kueninc mede,"
Heraut Beyeren,Onbekend Hoofdstuk,262,Dat is die rechte waerhede.
Heraut Beyeren,Onbekend Hoofdstuk,263,"Doe sinte Remi doopte desen,"
Heraut Beyeren,Onbekend Hoofdstuk,264,"Hiet hine Lodewiic, als wiit lesen."
Heraut Beyeren,Onbekend Hoofdstuk,265,Dese dede duechden vele
Heraut Beyeren,Onbekend Hoofdstuk,266,In goods dienste ende in wapen spele.
Heraut Beyeren,Onbekend Hoofdstuk,267,Aldus maecte sinte Remi
Heraut Beyeren,Onbekend Hoofdstuk,268,Clodovis van den duvel vri.
Heraut Beyeren,Onbekend Hoofdstuk,269,Als dees Clodovis van Vrancrike
Heraut Beyeren,Onbekend Hoofdstuk,270,Gherengneert hadde mogentlike
Heraut Beyeren,Onbekend Hoofdstuk,271,"Viif ende twintich jaer met groter eren,"
Heraut Beyeren,Onbekend Hoofdstuk,272,"Ward hi quellende, als die heren"
Heraut Beyeren,Onbekend Hoofdstuk,273,"Dicke doen van ledicheden,"
Heraut Beyeren,Onbekend Hoofdstuk,274,Als si hoir iuecht in onvreden
Heraut Beyeren,Onbekend Hoofdstuk,275,"Ende in wapene hebben ghehouden,"
Heraut Beyeren,Onbekend Hoofdstuk,276,Quellen si ghaerne inder ouden.
Heraut Beyeren,Onbekend Hoofdstuk,277,Hi sciet van desen aerdschen liue
Heraut Beyeren,Onbekend Hoofdstuk,278,"Int vc jaer ende drie warf viue,"
Heraut Beyeren,Onbekend Hoofdstuk,279,Tot Pariis tsinte Genenieuen.
Heraut Beyeren,Onbekend Hoofdstuk,280,"Daers veel van hem in ouden brieven,"
Heraut Beyeren,Onbekend Hoofdstuk,281,"Viif hondert jaer wast, als wiit horen,"
Heraut Beyeren,Onbekend Hoofdstuk,282,Na dat Cristus was gheboren.
Heraut Beyeren,Onbekend Hoofdstuk,283,"Clotaris so hiet siin zone,"
Heraut Beyeren,Onbekend Hoofdstuk,284,Goet kerstin zo was die gone.
Heraut Beyeren,Onbekend Hoofdstuk,285,"Dese maecte tot Sissoen,"
Heraut Beyeren,Onbekend Hoofdstuk,286,"In goods eren ende in siin doen,"
Heraut Beyeren,Onbekend Hoofdstuk,287,"Een clooster, heet sinte Medaerde"
Heraut Beyeren,Onbekend Hoofdstuk,288,"Ende goedet met groter waerde,"
Heraut Beyeren,Onbekend Hoofdstuk,289,"Crone droech hi viiftich jaer,"
Heraut Beyeren,Onbekend Hoofdstuk,290,Ende ward begraven aldaer.
Heraut Beyeren,Onbekend Hoofdstuk,291,"Clotaris die wan Cilprike,"
Heraut Beyeren,Onbekend Hoofdstuk,292,Die xxxiij jaer behilt trike
Heraut Beyeren,Onbekend Hoofdstuk,293,Moghentlike met groter eren.
Heraut Beyeren,Onbekend Hoofdstuk,294,"Tien tiden was hoir, wi leren,"
Heraut Beyeren,Onbekend Hoofdstuk,295,"Een groot here, hiet Kaerleman"
Heraut Beyeren,Onbekend Hoofdstuk,296,Die de mueghentheit gewan
Heraut Beyeren,Onbekend Hoofdstuk,297,"Op Haspegouwe ende in Brabant,"
Heraut Beyeren,Onbekend Hoofdstuk,298,Ende was een prinse daer ghenant.
Heraut Beyeren,Onbekend Hoofdstuk,299,"Cilpric liet Lottaris daer naer,"
Heraut Beyeren,Onbekend Hoofdstuk,300,"Die kueninc was xliiij jaer,"
Heraut Beyeren,Onbekend Hoofdstuk,301,Ende groot bi toenamen hiet.
Heraut Beyeren,Onbekend Hoofdstuk,302,Van hem quam tgrote heilich diet.
Heraut Beyeren,Onbekend Hoofdstuk,303,"Lottaris, die in Vrancrike"
Heraut Beyeren,Onbekend Hoofdstuk,304,"Kueninc was geweldichlike,"
Heraut Beyeren,Onbekend Hoofdstuk,305,Ende diet al dwanc metter hant
Heraut Beyeren,Onbekend Hoofdstuk,306,Van Zassen tote Spangenlant.
Heraut Beyeren,Onbekend Hoofdstuk,307,"Siin rike ghinc, dat weetmen wale,"
Heraut Beyeren,Onbekend Hoofdstuk,308,"Als ghi muecht horen hier die tale,"
Heraut Beyeren,Onbekend Hoofdstuk,309,"Van Spangen tot over Riin,"
Heraut Beyeren,Onbekend Hoofdstuk,310,"Oost ende west zo wast al siin,"
Heraut Beyeren,Onbekend Hoofdstuk,311,"Of datmen helt van hem te lene,"
Heraut Beyeren,Onbekend Hoofdstuk,312,Sonder Vrieslant allene.
Heraut Beyeren,Onbekend Hoofdstuk,313,"Goet kerstin ende die kercke goet,"
Heraut Beyeren,Onbekend Hoofdstuk,314,Jegen die arme wel gemoet
Heraut Beyeren,Onbekend Hoofdstuk,315,"Half tduuts half wals was siin rike,"
Heraut Beyeren,Onbekend Hoofdstuk,316,Hi rengneerde mogentlike
Heraut Beyeren,Onbekend Hoofdstuk,317,In al tlant bewester Dunouwe
Heraut Beyeren,Onbekend Hoofdstuk,318,Ende beneven den berghe Monyouwe.
Heraut Beyeren,Onbekend Hoofdstuk,319,"Hi was die de Zassen verwan,"
Heraut Beyeren,Onbekend Hoofdstuk,320,"Ende dwancse daer toe nochtan,"
Heraut Beyeren,Onbekend Hoofdstuk,321,Wat man die langher was
Heraut Beyeren,Onbekend Hoofdstuk,322,"Dan siin zwaert, siit zeker das,"
Heraut Beyeren,Onbekend Hoofdstuk,323,Dat hi ymmer den hals boot
Heraut Beyeren,Onbekend Hoofdstuk,324,Ende moester om ontfaen die doot.
Heraut Beyeren,Onbekend Hoofdstuk,325,"Lotharis die grote entie fiere,"
Heraut Beyeren,Onbekend Hoofdstuk,326,Die was viertich jaer ende viere
Heraut Beyeren,Onbekend Hoofdstuk,327,Naden vader zekerlike
Heraut Beyeren,Onbekend Hoofdstuk,328,Kueninc ouer Vrancrike.
Heraut Beyeren,Onbekend Hoofdstuk,329,"Van desen kueningen alte samen,"
Heraut Beyeren,Onbekend Hoofdstuk,330,"Die voirt van desen kueninc quamen,"
Heraut Beyeren,Onbekend Hoofdstuk,331,Laet ic die yeeste al stille staen.
Heraut Beyeren,Onbekend Hoofdstuk,332,"Ende wil op siinre dochter gaen,"
Heraut Beyeren,Onbekend Hoofdstuk,333,Dair die edele hertoghen fiin
Heraut Beyeren,Onbekend Hoofdstuk,334,Van Brabant af comen siin.
Heraut Beyeren,Onbekend Hoofdstuk,335,"Vlitelt hiet si, vind ick bescreven,"
Heraut Beyeren,Onbekend Hoofdstuk,336,Ende was te huwelic ghegeven
Heraut Beyeren,Onbekend Hoofdstuk,337,Enen edelen man vutvercoren
Heraut Beyeren,Onbekend Hoofdstuk,338,"Auselbaert, een romeyn geboren,"
Heraut Beyeren,Onbekend Hoofdstuk,339,Daer hi enen sone an wan.
Heraut Beyeren,Onbekend Hoofdstuk,340,Aernoud so hiet die man.
Heraut Beyeren,Onbekend Hoofdstuk,341,"Ende dees Aernoud, alst God woude,"
Heraut Beyeren,Onbekend Hoofdstuk,342,"Wan den goeden sint Aernoude,"
Heraut Beyeren,Onbekend Hoofdstuk,343,Die grave was met ghewelt
Heraut Beyeren,Onbekend Hoofdstuk,344,Bi Vlaendren neffens der Scelt.
Heraut Beyeren,Onbekend Hoofdstuk,345,Ende sint Aernoud die heilige wise
Heraut Beyeren,Onbekend Hoofdstuk,346,"Wan den goeden Angise,"
Heraut Beyeren,Onbekend Hoofdstuk,347,"Die sinte Beggen nam te wive,"
Heraut Beyeren,Onbekend Hoofdstuk,348,"Daer veel af quam als ic scrive,"
Heraut Beyeren,Onbekend Hoofdstuk,349,"Dees Puppins vader hiet Kaerleman,"
Heraut Beyeren,Onbekend Hoofdstuk,350,"Ende was deerste, die gewan"
Heraut Beyeren,Onbekend Hoofdstuk,351,"Heerscapie op Haspegouwe,"
Heraut Beyeren,Onbekend Hoofdstuk,352,"Ende hiet een prinse, als ict scouwe,"
Heraut Beyeren,Onbekend Hoofdstuk,353,Puppin was deerste hertooch becant
Heraut Beyeren,Onbekend Hoofdstuk,354,Op Haspegouwe ende in Brabant.
Heraut Beyeren,Onbekend Hoofdstuk,355,"Puppin nam in Gasscongen een wiif,"
Heraut Beyeren,Onbekend Hoofdstuk,356,"Drie kindren wan hi an hoir liif,"
Heraut Beyeren,Onbekend Hoofdstuk,357,"Een zoon twe dochtren, waer is ditte,"
Heraut Beyeren,Onbekend Hoofdstuk,358,Siin edel vrouwe die hiet Ytte.
Heraut Beyeren,Onbekend Hoofdstuk,359,"Hoir zoon die hiet Grimout,"
Heraut Beyeren,Onbekend Hoofdstuk,360,"Cort voer hi in die goods gewout,"
Heraut Beyeren,Onbekend Hoofdstuk,361,"Sinte Geertruud ende Begghe,"
Heraut Beyeren,Onbekend Hoofdstuk,362,"Puppins dochtren, als ic zegghe."
Heraut Beyeren,Onbekend Hoofdstuk,363,"Dese Begghe nam te manne Angiis,"
Heraut Beyeren,Onbekend Hoofdstuk,364,Die van duechden hadde priis.
Heraut Beyeren,Onbekend Hoofdstuk,365,"Dees Angiis was sint Aernouds zone,"
Heraut Beyeren,Onbekend Hoofdstuk,366,"Raed van Vrancriic was die gone,"
Heraut Beyeren,Onbekend Hoofdstuk,367,Mitten goeden Puppin van Landen
Heraut Beyeren,Onbekend Hoofdstuk,368,Die wilen vele hilt in handen.
Heraut Beyeren,Onbekend Hoofdstuk,369,Puppin Kaerlemans zone
Heraut Beyeren,Onbekend Hoofdstuk,370,"Was die voirbaerste entie gone,"
Heraut Beyeren,Onbekend Hoofdstuk,371,Daermen bi ints kueninx sale
Heraut Beyeren,Onbekend Hoofdstuk,372,"Wrachte meest altemale,"
Heraut Beyeren,Onbekend Hoofdstuk,373,"Ende sint Aernoud was Puppins raet,"
Heraut Beyeren,Onbekend Hoofdstuk,374,Dus en mocht niet wesen quaet.
Heraut Beyeren,Onbekend Hoofdstuk,375,Dit was sinte Geertruden vader
Heraut Beyeren,Onbekend Hoofdstuk,376,"Ende vrou Begghen beide gader,"
