author,chapter,line,text
Onbekend,1.,1,"Dit was van Landen Kaerleman,"
Onbekend,1.,2,die deerste heerschappije ghewan
Onbekend,1.,3,"van Brabant, ende oock die eere;"
Onbekend,1.,4,ende wasser aff prince ende heere
Onbekend,1.,5,ende oock mede van Haspengouwe.
Onbekend,1.,6,"Puppijn ende Sinte-Amelberch, die vrouwe,"
Onbekend,1.,7,waeren beijde die kinderen sijne;
Onbekend,1.,8,doen hij sterff bleef Brabant Puppijne.
Onbekend,2.,9,Die eerste hertoge was van Landen Puppijn;
Onbekend,2.,10,raet van Vranckerijcke moeste hij zijn.
Onbekend,2.,11,Sinte Begge ende Sinte-Geertruijt waeren
Onbekend,2.,12,"beijde sijne kinderen, hoordick verclaeren."
Onbekend,2.,13,Puppijn schiet van desen levene
Onbekend,2.,14,alsmen screeff vic XL ende sevene;
Onbekend,2.,15,"te Nijvele leet hij, dat es claer,"
Onbekend,2.,16,ende hij regneerde XXX jaer.
Onbekend,3.,17,Begge die wert hertoginne
Onbekend,3.,18,"van Brabant, als ick versinne;"
Onbekend,3.,19,"hertoge wert haer man Angijs,"
Onbekend,3.,20,"raet van Vranckerijck, dat ben ick wijs,"
Onbekend,3.,21,"Sinte-Aernouts sone, als ick las,"
Onbekend,3.,22,wiens overoudevader was
Onbekend,3.,23,"die groote Lottaris sekerlijcke,"
Onbekend,3.,24,die ixe coninck van Vranckerijcke.
Onbekend,4.,25,"Vuijt Troijen geboren, wij lesen dus,"
Onbekend,4.,26,daer dierste coninck aff hiet Priamus.
Onbekend,4.,27,"Dese Angijs, dese heere groot,"
Onbekend,4.,28,"bleeff in eenen strijde doot,"
Onbekend,4.,29,"alsmen screeff Ons Heeren jaer,"
Onbekend,4.,30,"VIc LXXXV, dat es waer."
Onbekend,4.,31,xxxviii jaer met groote eeren
Onbekend,4.,32,regneerde hij in Brabant als een heere.
Onbekend,5.,33,"Puppijn van Haerstalle, sone Angijs,"
Onbekend,5.,34,"wert hertoge van Brabant, des sijt wijs;"
Onbekend,5.,55,raet ende sweertdragere soo was hij
Onbekend,5.,36,in Vranckerijcke dese heere vrij;
Onbekend,5.,37,hij maecte kersten die Vriesen.
Onbekend,5.,38,Den doot moeste hij kiesen
Onbekend,5.,39,"alsmen screeff VIIc. XIIII, ick lese;"
Onbekend,5.,40,xxix jaer regneerde deze.
Onbekend,6.,41,"Kaerle Marteel, Puppijns sone,"
Onbekend,6.,42,"wert hertoge, dat hem was schoone;"
Onbekend,6.,43,"bescherme van Vranckerijck datmen hem coes,"
Onbekend,6.,44,die noijt seghe en verloes.
Onbekend,6.,45,Int jaer Ons Heeren es hij doot bleven
Onbekend,6.,46,alsmen VIIc ende XL vant bescreven;
Onbekend,6.,47,"te Sinte-Denijs dat hij leghet,"
Onbekend,6.,48,"xxvi jaer regneerde hij, alsmen seget."
Onbekend,7.,49,Hertoge wert de cleijne Puppijn
Onbekend,7.,50,"naer Kaerel Marteel, den vader zijn,"
Onbekend,7.,51,"als coninck in Vranckerijck, dat es waer."
Onbekend,7.,52,"Doen hij hertoge hadde geweest x jaer,"
Onbekend,7.,53,int jaer Ons Heeren hij doot bleeff
Onbekend,7.,54,"alsmen VIIc LXIX screeff,"
Onbekend,7.,55,ende leet begraven te Sinte-Denijs;
Onbekend,7.,56,"xxix jaer regneerde hij, des sijt wijs."
Onbekend,8.,57,"Kaerel die Groote wert hertoge,"
Onbekend,8.,58,coninck ende keijser hooghe;
Onbekend,8.,59,"Swavien reij hem, ende Almaignien"
Onbekend,8.,60,"dwanck hij, ende wan II werff Spaegnien."
Onbekend,8.,61,Hij sterff in dat jaer Ons Heeren
Onbekend,8.,62,VIIIc. XV met grooter eeren.
Onbekend,8.,63,tAken hij begraven was;
Onbekend,8.,64,"hij regneerde xlvii jaer, als ick las."
Onbekend,9.,65,"Lodewijck die Goedertierne wert coninck,"
Onbekend,9.,66,"keijser ende hertoghe, dats waere dinck;"
Onbekend,9.,67,"de kercken was hij onderdaen,"
Onbekend,9.,68,sijn kinderen wouden hem vaen.
Onbekend,9.,69,Int jaer ons Heeren sterff hij
Onbekend,9.,70,VIIIc ende XLII daer bij.
Onbekend,9.,71,Te Ments men tsijnen grave werde;
Onbekend,9.,72,xxvi jaer hij regneerde.
Onbekend,10.,73,Caerel die Calue coninck wert
Onbekend,10.,74,ende hertoghe; hij was wel hert
Onbekend,10.,75,"sinen brueders, dat es waer."
Onbekend,10.,76,Vore sijn doot was hij kersten ii jaer;
Onbekend,10.,77,int jaer Ons Heeren sterff hij te Nantes
Onbekend,10.,78,"VIIIc LXXII, gelooft mij des;"
Onbekend,10.,79,xxx jaer regneerde hij sij u bekant;
Onbekend,10.,80,hij maeckte den iersten grave in Hollant.
Onbekend,11.,81,Hertoge wert die simpele Lodewijck
Onbekend,11.,82,"als coninck in Vranckerijck,"
Onbekend,11.,83,"dat in zijnen tijde daelde zeere,"
Onbekend,11.,84,nae de croniken leere.
Onbekend,11.,85,"Int jaer Ons Heeren, dat hij sterff,"
Onbekend,11.,86,VIIIc LXXIIII hij de doot verwerff;
Onbekend,11.,87,hij regneerde maer twee jaer;
Onbekend,11.,88,zijn vrouwe ginck met kinde swaer.
Onbekend,12.,89,Kaerel die Simpele wert coninck hier naer
Onbekend,12.,90,ende hertoghe doen hij out was xii jaer;
Onbekend,12.,91,"Robrecht, grave van Parijs,"
Onbekend,12.,92,"sloech hij doot, dat ben ick wijs;"
Onbekend,12.,93,daeromme wert hij valschelijck gevaen
Onbekend,12.,94,te Pironne heeft hij de doot ontfaen
Onbekend,12.,95,alsmen screeff IXc ende XVne;
Onbekend,12.,96,"xxix jare regeerde hij, wij siene."
Onbekend,13.,97,Lodewijck die Simpele hij soo lach
Onbekend,13.,98,in die wieghe; sijn moeder haer ontsach
Onbekend,13.,99,ende voerden over in Ingelant.
Onbekend,13.,100,Te sijnen xiii jaeren wert hij in Brabant
Onbekend,13.,101,"hertoge, ende coninck van Vranckerijke."
Onbekend,13.,102,Int jaer Ons Heeren quam hij te lijcke
Onbekend,13.,103,"IXc LII, te Riemen dat hij leijt."
Onbekend,13.,104,"xxvii jaer regneerde hij, te waerheijt."
Onbekend,14.,105,Coninck ende hertoghe wert Lottarijs
Onbekend,14.,106,"doen hij hadde xiii jaer, des sijt wijs,"
Onbekend,14.,107,"van Vranckerijck geweest behoeder,"
Onbekend,14.,108,"gaff hij Kaerelen, sijnen broeder,"
Onbekend,14.,109,"Brabant, ende schiet van desen lijve"
Onbekend,14.,110,"alsmen screeff IXc LXXXI ende vive,"
Onbekend,14.,111,"ende hij geregneert hadde, dats waer,"
Onbekend,14.,112,omtrent xxxi jaer.
Onbekend,15.,113,Lodewijck de Jonge wert coninck
Onbekend,15.,114,ende hertoghe. Bij hem verghinck
Onbekend,15.,115,"vander croonen haerlieder gheslachte,"
Onbekend,15.,116,dat geregneert hadde met machte
Onbekend,15.,117,"cc. xxxii jaer, gewaerlijck."
Onbekend,15.,118,Maer een jaer en leeffde Lodewijck;
Onbekend,15.,119,"want hij gheen kint en gewan,"
Onbekend,15.,120,"Kaerel, sijn oom, track hem die croone an."
Onbekend,16.,121,Kaerel hertoghe van Lothrijcke
Onbekend,16.,122,"ende gerechtich coninck in Vranckerijcke,"
Onbekend,16.,123,"doen hij vernam sijns neven doot,"
Onbekend,16.,124,tooch hij derwaerts met volcke groot.
Onbekend,16.,125,"Hughe Capet heefften wederstaen,"
Onbekend,16.,126,"ende snachts op sijn bedde gevaen,"
Onbekend,16.,127,alsmen screeff IXc LXXX ende achte;
Onbekend,16.,128,xxix jaer hiel hij Brabant met machte.
Onbekend,17.,129,"Kaerel eenen sone nae hem liet,"
Onbekend,17.,130,"die hertoghe wert, ende Otto hiet,"
Onbekend,17.,131,van Lothrijcke ende Brabant;
Onbekend,17.,132,xiiii jaer regneerde hij in dlant;
Onbekend,17.,133,"hij sterff alsmen screeff, min no nee,"
Onbekend,17.,134,Ons Heeren jaer M. ende twee;
Onbekend,17.,135,"gheen kint en hadde hij, verstaet den sijn,"
Onbekend,17.,136,anders dan Geerberghe die suster sijn.
Onbekend,18.,137,"Geerberghe, die Caerels dochter, was"
Onbekend,18.,138,"Gravinne van Loven, als ick las,"
Onbekend,18.,139,"ende van Bruessel, dats waerhede."
Onbekend,18.,140,Doen Otte sijn inde dede
Onbekend,18.,141,"Haer broeder, gaff den keijser Lothrijcke"
Onbekend,18.,142,"Godevaert van Ardennen, sekerlijcke;"
Onbekend,18.,143,dus verloos Geerberge onschoone
Onbekend,18.,144,"vaderlant, ende daertoe die croone."
Onbekend,19.,145,"Haer man was Lambrecht metten baerde,"
Onbekend,19.,146,die dlant meijnde winnen metten swaerde
Onbekend,19.,147,"op Godevaert ter selver tijt,"
Onbekend,19.,148,"hoe dat sij vochten eenen strijt,"
Onbekend,19.,149,"dat Lambrecht verslegen bleeff,"
Onbekend,19.,150,alsmen djaer Ons Heeren screeff
Onbekend,19.,151,"M. XV, dats selve waer;"
Onbekend,19.,152,grave was hij xxvi jaer.
Onbekend,20.,153,"Lambrechts sone, Henrick dOude,"
Onbekend,20.,154,als sijn vader was bracht te moude
Onbekend,20.,155,Soo wert hij te Loven grave
Onbekend,20.,156,"ende van Bruessele, ende schiet ave"
Onbekend,20.,157,"den lijve, alsmen gescreven vant"
Onbekend,20.,158,"M. ende XLVIII, sijn u becant,"
Onbekend,20.,159,alse hij dede sijn endt;
Onbekend,20.,160,xxxiii jaer duerde sijn regiment.
Onbekend,21.,161,"Sijn sone was Lambrecht Stammelaert,"
Onbekend,21.,162,Grave van Loven dat hij waert;
Onbekend,21.,163,"hij stichte die canoninxdie, te waerhede,"
Onbekend,21.,164,"te Sinte-Pieters, te Loven, ende te Sinte-Goedelen beede,"
Onbekend,21.,165,ende Sinte-Goricx stichte hij mede.
Onbekend,21.,166,"In eenen strijt hij sijn eijnde dede,"
Onbekend,21.,167,"alsmen screeff M. LXIII, dats waer;"
Onbekend,21.,168,hij was grave xv jaer.
Onbekend,22.,169,"Henrick van Lovene, sone Lambrechts,"
Onbekend,22.,170,wert grave ende heere slechts
Onbekend,22.,171,van Loven ende Brueselen saen;
Onbekend,22.,172,"hij hadde eenen edelen man gevaen,"
Onbekend,22.,173,"daer Henrik aff was vermoort,"
Onbekend,22.,174,doemen screeff Ons Heeren geboert
Onbekend,22.,175,"M. CLXIIII, onthout wel dat;"
Onbekend,22.,176,xi jaer hij als grave sat.
Onbekend,23.,177,"Henrick, sijn sone, die wert heere"
Onbekend,23.,178,"als grave van Loven, seijt die leere;"
Onbekend,23.,179,"in sijn hertte soo hadde hij toren,"
Onbekend,23.,180,dat hij sijnen vader hadde verloren;
Onbekend,23.,181,ende dlant ende die croone was hem genomen
Onbekend,23.,182,"sijn voerders, daer hij aff was comen;"
Onbekend,23.,183,Hij sterff alsmen screeff XI hondert;
Onbekend,23.,184,"xxvi jaer was hij grave, wien dat wondert."
Onbekend,24.,185,Godevaert metten baerde ontfinck
Onbekend,24.,186,tgraefschap. Doen hij was jongelinck
Onbekend,24.,187,"verdiende hij aen keijser Henrike,"
Onbekend,24.,188,dat hijne hertoghe van Lothrike
Onbekend,24.,189,"maeckte. Int jaer Ons Heeren, dat hij sterff"
Onbekend,24.,190,"XIc XL, om sijnne sielen bederff,"
Onbekend,24.,191,Soo groeffmen hem in Affelghem;
Onbekend,24.,192,xl jaer was Brabant geregeert van hem.
Onbekend,25.,193,"Godevaert, sijn sone, wert hertoge"
Onbekend,25.,194,van Lotrijcke; groote oorloghe
Onbekend,25.,195,"hiel hij jegen die Grimbersche heeren,"
Onbekend,25.,196,"dat hij niet en conste gekeeren,"
Onbekend,25.,197,hij en moeste eerst die doot ontfaen
Onbekend,25.,198,alsmen XIc XLIIII sach gescreven staen.
Onbekend,25.,199,"Vier jaer was hij heere, als ic mercke;"
Onbekend,25.,200,te Loven leet hij in Sinte-Pieters kercke.
Onbekend,26.,201,"Hertoge wert die derde Godevaert,"
Onbekend,26.,202,"die metten wiegen gehangen waert,"
Onbekend,26.,203,"daermen die van Grimbergen tonder street,"
Onbekend,26.,204,"int xlste jaer, hij over zee reet,"
Onbekend,26.,205,ende sterff in dat jaer Ons Heeren
Onbekend,26.,206,"XIc LXXXVI jaer, Gode te eeren."
Onbekend,26.,207,"Te Loven leet hi, alsmen ons leest,"
Onbekend,26.,208,als hij xlii jaer hadde heere geweest.
Onbekend,27.,209,Henrick wert hertoge hier naer
Onbekend,27.,210,"als sijn vader doot was, dats waer;"
Onbekend,27.,211,hij was capiteyn over zee gecoren;
Onbekend,27.,212,menich oorloge quam hem te voren.
Onbekend,27.,213,"Voir Colen sciet hij van lijve,"
Onbekend,27.,214,alsmen screef XIIc XXX ende vive.
Onbekend,27.,215,"Te Sente-Pieters, te Loven, wert hij bracht;"
Onbekend,27.,216,xlix jaer hiel hij Brahant in sijnne macht.
Onbekend,28.,217,"Henrick die Grootmoedige, naden vadere"
Onbekend,28.,218,wert hertoge van Lothrijck algadere.
Onbekend,28.,219,"Die ketters van Stedinghen hij verwan,"
Onbekend,28.,220,Colenne belach hij als een man.
Onbekend,28.,221,Int jaer ons Heeren sterff hij
Onbekend,28.,222,XIIc ende XLVII daer bij;
Onbekend,28.,223,hij leget begraven te Villeer;
Onbekend,28.,224,"vi jaer was hij hertoge, niet meer."
Onbekend,29.,225,"Henrick die Saechtmoedighe van Brabant,"
Onbekend,29.,226,"hertoge van Lothrijcke, sij u becant,"
Onbekend,29.,227,"die edelste was hij van geslachte,"
Onbekend,29.,228,scamel van seden ende sachte.
Onbekend,29.,229,Jonck sterff hij in Ons Heeren jaer
Onbekend,29.,230,"XIIc ende LX, dat es waer;"
Onbekend,29.,231,"hij leget te Loven, ten Predicaeren,"
Onbekend,29.,232,ende regneerde xiiii de jaeren.
Onbekend,30.,233,"Henricks sone, wert hertoghe Jan,"
Onbekend,30.,234,die den strijt te Woeringhen wan;
Onbekend,30.,255,sinen tijtel screeff hij hoochelijcke
Onbekend,30.,236,"Brabant, Lijmborch ende Lotterijcke."
Onbekend,30.,237,"tEender tafelronde sterff hij ten Baeren,"
Onbekend,30.,238,alsmen screeff XIIc XCIIII de jaeren;
Onbekend,30.,239,"hij leget in Bruessel, te Minnebroedere;"
Onbekend,30.,240,xxxiiii jaer was hij Brabants behoedere.
Onbekend,31.,241,"Jan, sijn sone, was Brabants hertoghe,"
Onbekend,31.,242,"van Limborch, Lotterijcke prince hoghe."
Onbekend,31.,243,In sijnen tijt geschiedde groot wondere:
Onbekend,31.,244,die gemeijnte was bij hem op ende ondere.
Onbekend,31.,245,Hij sterff in Gods carnacioen
Onbekend,31.,246,"XIIIc ende XII jaer, screeffmen doen."
Onbekend,31.,247,Te Sinte-Goedelen soo leet hij;
Onbekend,31.,248,xviii jare was hij hertoge vrij.
Onbekend,32.,249,Die derde Jan nam sijn besorch
Onbekend,32.,250,"Brabant, Lotrijck, Lijmborch."
Onbekend,32.,251,"het ontseijden hem xvii lantsheeren,"
Onbekend,32.,252,die hij wederstont met grooter eeren.
Onbekend,32.,253,Hi sterff op Sinte-Claes avont
Onbekend,32.,254,"alsmen screeff XIIIc LV, sij u cont."
Onbekend,32.,255,Te Villeer was hij begraven hoghe;
Onbekend,32.,256,xliii jaer was hij hertoghe.
Onbekend,33.,257,"Hertoginne bleeff vrouwe Joanne,"
Onbekend,33.,258,"die hertoge Wenceline hadde te manne,"
Onbekend,33.,259,"van Bemen des conincx sone,"
Onbekend,33.,260,"(sijn broeder droech de keijsercroone),"
Onbekend,33.,261,doen moestte Brabant regeren.
Onbekend,33.,262,Godt gesparen tot sijnner eeren
Onbekend,33.,263,"ende tot hare salichede,"
Onbekend,33.,264,alsoo moethij ons allen mede.
Onbekend,34.,265,Hertoghe soo was Wencelijn
Onbekend,34.,266,"van Lutcenborch, Limborch, verstaet den sijn,"
Onbekend,34.,267,van Brabant ende van Limborch mede.
Onbekend,34.,268,"Opden avent, dat hij sijn inde dede,"
Onbekend,34.,269,"dat ontfangen was die maget Marie,"
Onbekend,34.,270,alsmen screeff XIIIc LXXX jaer ende drie;
Onbekend,34.,271,"tOruva leijt hij, int clooster;"
Onbekend,34.,272,xxvii jaer was hij Brabants trooster.
Onbekend,35.,273,"Hertoginne bleeff vrouwe Joanne,"
Onbekend,35.,274,die hertoge Wencelijn hadde te manne.
Onbekend,35.,275,"Sij was vrouwe LI jaer,"
Onbekend,35.,276,"in Decembre, dat es waer,"
Onbekend,35.,277,alsmen screeff Gods geboernesse
Onbekend,35.,278,XIIIIc ende daer toe sesse;
Onbekend,35.,279,"tOnser-Vrouwenbroeders dat sij leijt,"
Onbekend,35.,280,"te Bruessel, voer waer geseijt."
Onbekend,36.,281,"Anthonis van Bourgondien, tshertogen sone,"
Onbekend,36.,282,wert doen hertoge van Brabant;
Onbekend,36.,283,ontrent ix jaer regneerde hij in dlant.
Onbekend,36.,285,"In eenen strijt hij doot bleeff,"
Onbekend,36.,285,"alsmen XIIIIc ende XV screeff,"
Onbekend,36.,286,opden xxvsten dach in Octobris;
Onbekend,36.,287,"ter Vueren leet hij begraven, sijt wijs."
Onbekend,37.,288,"Jan, hertoghe Anthonis sone,"
Onbekend,37.,290,"geboren vuijte fransche croone,"
Onbekend,37.,290,"wert hertoge daernaer, dats waerhede,"
Onbekend,37.,291,"van Brabant ende van Limborch mede,"
Onbekend,37.,292,"van Henegouwe, Hollant ende Zeelant."
Onbekend,37.,293,"xii jaer regneerde hij, sij u bekant,"
Onbekend,37.,295,doen men screef XIIIIc XXVII inde hijt leven;
Onbekend,37.,295,"ter Vueren leet hij, sonder sneven."
Onbekend,38.,296,"Nae Jan, Anthonis sone, hertoghe"
Onbekend,38.,297,"wert Philips, sijn broeder, prince hooghe,"
Onbekend,38.,298,"van Brabant, Limborch ende Lothrijcke"
Onbekend,38.,300,oick grave van Simpol sekerlijcke.
Onbekend,38.,300,"Omtrent iiii jaer regneerde hij, dats waer,"
Onbekend,38.,301,hij sterff doe men screeff de geboorten jaer
Onbekend,38.,302,Ons Heeren XIIIIc XXXI; ende leghet
Onbekend,38.,303,"ter Vueren begraven, alsmen seghet."
