author,chapter,line,text
Onbekend,Onbekend Hoofdstuk,1,dats mi leet sonder waen
Onbekend,Onbekend Hoofdstuk,2,Seide oriande die suptile
Onbekend,Onbekend Hoofdstuk,3,ware hi doot in corter wile
Onbekend,Onbekend Hoofdstuk,4,Jc stoede altoos tuwen dienste
Onbekend,Onbekend Hoofdstuk,5,"die pape seide bedinke [int] sienste,"
Onbekend,Onbekend Hoofdstuk,6,dat wine dan souken varen
Onbekend,Onbekend Hoofdstuk,7,ende slane doot sonder sparen
Onbekend,Onbekend Hoofdstuk,8,wildi dan ewelike sonder fi
Onbekend,Onbekend Hoofdstuk,9,Getrouwelike minnen mi
Onbekend,Onbekend Hoofdstuk,10,Jaic seids[o] here sonder bliuen
Onbekend,Onbekend Hoofdstuk,11,here seidsoe co[nd]i lesen ende scriuen
Onbekend,Onbekend Hoofdstuk,12,helpe vrouwe wats dat ghi telt
Onbekend,Onbekend Hoofdstuk,13,een litel ghi mi horen selt
Onbekend,Onbekend Hoofdstuk,14,mester ic bem van tolet
Onbekend,Onbekend Hoofdstuk,15,aldie touerie can ic [met]
Onbekend,Onbekend Hoofdstuk,16,die men in de werlt mach doen
Onbekend,Onbekend Hoofdstuk,17,al waric gebonden in I prisoen
Onbekend,Onbekend Hoofdstuk,18,Jc soude mi seluen lo[ssen] wel
Onbekend,Onbekend Hoofdstuk,19,ay here kendi den mester s[nel]
Onbekend,Onbekend Hoofdstuk,20,die men heet madelgijs
Onbekend,Onbekend Hoofdstuk,21,die man es vroet ende wijs
Onbekend,Onbekend Hoofdstuk,22,dat hebic dickent gheoren gewagen
Onbekend,Onbekend Hoofdstuk,23,hie es doot ouer lange dag[en]
Onbekend,Onbekend Hoofdstuk,24,Sprac die pape bi waerheiden
Onbekend,Onbekend Hoofdstuk,25,Groet wo[nder dedi] te minen stede
Onbekend,Onbekend Hoofdstuk,26,dat hebbic dicken seggen horen
Onbekend,Onbekend Hoofdstuk,27,Karle dedi menigen toren
Onbekend,Onbekend Hoofdstuk,28,Met siere groter touerie
Onbekend,Onbekend Hoofdstuk,29,dus reden si geloues mie
Onbekend,Onbekend Hoofdstuk,30,also lange dat si quamen
Onbekend,Onbekend Hoofdstuk,31,dat si madelgijs vernamen
Onbekend,Onbekend Hoofdstuk,32,die quam gelopen in I hemde
Onbekend,Onbekend Hoofdstuk,33,met sinen cnape [harde vremde]
Onbekend,Onbekend Hoofdstuk,34,So dochte o[riande[ .......]
Onbekend,Onbekend Hoofdstuk,35,daer soe biden [pape ......]
Onbekend,Onbekend Hoofdstuk,36,verkennet [soene] alte ant
Onbekend,Onbekend Hoofdstuk,37,Sinen palster hi geprant
Onbekend,Onbekend Hoofdstuk,38,ende cleophus [...] enen stake
Onbekend,Onbekend Hoofdstuk,39,die pape seide met warer sprake
Onbekend,Onbekend Hoofdstuk,40,Siet gonder [comt] gelopen v man
Onbekend,Onbekend Hoofdstuk,41,Ghi hebt geraden bi sente ihan
Onbekend,Onbekend Hoofdstuk,42,Sprac oriande die was blide
Onbekend,Onbekend Hoofdstuk,43,vanden paerde ouer enen side
Onbekend,Onbekend Hoofdstuk,44,Viel[so] met aesten vptie aerde
Onbekend,Onbekend Hoofdstuk,45,die pape vinc te sinen zwaerde
Onbekend,Onbekend Hoofdstuk,46,dat hi trac vten scoe
Onbekend,Onbekend Hoofdstuk,47,Cleophus quam gelopen doe
Onbekend,Onbekend Hoofdstuk,48,ende slouch den pape vp sine crune
Onbekend,Onbekend Hoofdstuk,49,dat hi[..........]
Onbekend,Onbekend Hoofdstuk,50,[...............]
Onbekend,Onbekend Hoofdstuk,51,het[............]
Onbekend,Onbekend Hoofdstuk,52,[...............]
Onbekend,Onbekend Hoofdstuk,53,ende bant [..........]
Onbekend,Onbekend Hoofdstuk,54,[.....]at ic [......]
Onbekend,Onbekend Hoofdstuk,55,die hare[............]
Onbekend,Onbekend Hoofdstuk,56,[...............]
Onbekend,Onbekend Hoofdstuk,57,dede[..............]
Onbekend,Onbekend Hoofdstuk,58,hoe hi alse [.........]
Onbekend,Onbekend Hoofdstuk,59,dat hi hem[............]
Onbekend,Onbekend Hoofdstuk,60,also lieu cle[........]
Onbekend,Onbekend Hoofdstuk,61,Sijn [mi] genomen [.........]
Onbekend,Onbekend Hoofdstuk,62,wiet dede bem ic[..........]
Onbekend,Onbekend Hoofdstuk,63,aldus alse ghi m[i ........]
Onbekend,Onbekend Hoofdstuk,64,vandic [mi h..............]
Onbekend,Onbekend Hoofdstuk,65,metv [minen ...............]
Onbekend,Onbekend Hoofdstuk,66,So ics[....]ic here[.......]
Onbekend,Onbekend Hoofdstuk,67,Jc hebbe ons[..............]
Onbekend,Onbekend Hoofdstuk,68,daer ic ouerghe[...........]
Onbekend,Onbekend Hoofdstuk,69,dan ic doen [daer] mijn [....]
Onbekend,Onbekend Hoofdstuk,70,Nachs in es tverlies [.....]
Onbekend,Onbekend Hoofdstuk,71,hetne was bet[...........]
Onbekend,Onbekend Hoofdstuk,72,cleophus die II paer[......]
Onbekend,Onbekend Hoofdstuk,73,die [mi ontfoert ..........]
Onbekend,Onbekend Hoofdstuk,74,Mine auenturen s[............]
Onbekend,Onbekend Hoofdstuk,75,dies dankic gode[...........]
Onbekend,Onbekend Hoofdstuk,76,Oriande mesliet[............]
Onbekend,Onbekend Hoofdstuk,77,madelgijs troo[st]e[.........]
Onbekend,Onbekend Hoofdstuk,78,mettien oriande[...........]
Onbekend,Onbekend Hoofdstuk,79,hare auenture [groot .......]
Onbekend,Onbekend Hoofdstuk,80,te vertreckene al g[.......]
Onbekend,Onbekend Hoofdstuk,81,Hoe so in zwar[.............]
Onbekend,Onbekend Hoofdstuk,82,was madelgijs ge[.........]
Onbekend,Onbekend Hoofdstuk,83,ende hoe hi[..............]
Onbekend,Onbekend Hoofdstuk,84,ende hoe dat si verl[......]
Onbekend,Onbekend Hoofdstuk,85,met suptijleden al[........]
Onbekend,Onbekend Hoofdstuk,86,ooc seidie vp d[ie.........]
Onbekend,Onbekend Hoofdstuk,87,dat hi mester war[e.........]
Onbekend,Onbekend Hoofdstuk,88,madelgijs seide bi mij[n ....]
Onbekend,Onbekend Hoofdstuk,89,So wetic wel[.............]
Onbekend,Onbekend Hoofdstuk,90,Noosden mi mids s[.........]
Onbekend,Onbekend Hoofdstuk,91,men moetic [sere w........]
Onbekend,Onbekend Hoofdstuk,92,mettien es madelgijs v[.....]
Onbekend,Onbekend Hoofdstuk,93,Ten zwaerden dat spap[.......]
Onbekend,Onbekend Hoofdstuk,94,ende maecte II [grote .....]
Onbekend,Onbekend Hoofdstuk,95,in den enen leide[........]
Onbekend,Onbekend Hoofdstuk,96,[jn den andren [..........]
Onbekend,Onbekend Hoofdstuk,97,als adaen lange adde gescreit
Onbekend,Onbekend Hoofdstuk,98,ende eene [.... wilde ......]
Onbekend,Onbekend Hoofdstuk,99,dat men[..........]ben
Onbekend,Onbekend Hoofdstuk,100,als waerlike[..........]
Onbekend,Onbekend Hoofdstuk,101,d[ie ziechede die in oriande es ge....]
Onbekend,Onbekend Hoofdstuk,102,d[at soe mach de .........]
Onbekend,Onbekend Hoofdstuk,103,ende verdienen die[........]
Onbekend,Onbekend Hoofdstuk,104,dat geuonden es die [........]
Onbekend,Onbekend Hoofdstuk,105,Als madelgijs daer sine[.......]gelesen
Onbekend,Onbekend Hoofdstuk,106,orianden [gaen] genesen
Onbekend,Onbekend Hoofdstuk,107,want I duuel[.....]vor waer
Onbekend,Onbekend Hoofdstuk,108,vlooch ouer tbedde[......]ouer haer
Onbekend,Onbekend Hoofdstuk,109,alsoot ge[boot madelgijs] ter stont
Onbekend,Onbekend Hoofdstuk,110,daer wart oriande ge[sont]
Onbekend,Onbekend Hoofdstuk,111,Ende bleef daer seit die walsce istorien
Onbekend,Onbekend Hoofdstuk,112,tote soe van [tijdene mochte gescie]n
Onbekend,Onbekend Hoofdstuk,113,doe namen si orlof [met suete]n woorden
Onbekend,Onbekend Hoofdstuk,114,an alle die[........]behoorden
Onbekend,Onbekend Hoofdstuk,115,doe beualse te gode die waert
Onbekend,Onbekend Hoofdstuk,116,madelgijs alp vp I paert
Onbekend,Onbekend Hoofdstuk,117,orianden die was vroet
Onbekend,Onbekend Hoofdstuk,118,ende m[o]chte[...] metter spoet
Onbekend,Onbekend Hoofdstuk,119,al gewapent[..... seide]
Onbekend,Onbekend Hoofdstuk,120,Scilt addi ende sijn zwaert [mede]
Onbekend,Onbekend Hoofdstuk,121,ende ooc aldat h[........]
Onbekend,Onbekend Hoofdstuk,122,daer voeren si wech sonder [vo...]
Onbekend,Onbekend Hoofdstuk,123,So lange under hem II tesamen
Onbekend,Onbekend Hoofdstuk,124,datsi ter seluer stede quamen
Onbekend,Onbekend Hoofdstuk,125,daer die garsoene waren ver[...]
Onbekend,Onbekend Hoofdstuk,126,die hier te voren sonder waen
Onbekend,Onbekend Hoofdstuk,127,madelgijs als telt die ieeste
Onbekend,Onbekend Hoofdstuk,128,tsine namen binden [foreeste]
Onbekend,Onbekend Hoofdstuk,129,Sine lieten hem niet [vele bliuen]
Onbekend,Onbekend Hoofdstuk,130,Nv hort wat ic v sal [bescriue]n
Onbekend,Onbekend Hoofdstuk,131,also mi twalsce doet verstaan
Onbekend,Onbekend Hoofdstuk,132,So voer madelgijs sonder waen
Onbekend,Onbekend Hoofdstuk,133,Jn sbaeliuus herberge vander [stat]
Onbekend,Onbekend Hoofdstuk,134,daer si waren ontfangen bat
Onbekend,Onbekend Hoofdstuk,135,danic v soude connen gen[omen]
Onbekend,Onbekend Hoofdstuk,136,als die tijt was so [ver gecomen]
Onbekend,Onbekend Hoofdstuk,137,dat men I maeltijt soude gaen eten
Onbekend,Onbekend Hoofdstuk,138,ende si alle waren geseten
Onbekend,Onbekend Hoofdstuk,139,brochte men die gerechte voort
Onbekend,Onbekend Hoofdstuk,140,als[o]oc te doene behoort
Onbekend,Onbekend Hoofdstuk,141,madelgijs [d]ede[.......]
Onbekend,Onbekend Hoofdstuk,142,[....... waren sijn geb....]
Onbekend,Onbekend Hoofdstuk,143,ende vinc doe[.... wap.......]
Onbekend,Onbekend Hoofdstuk,144,als hi vp die [...]nden sach
Onbekend,Onbekend Hoofdstuk,145,[hi .....]sine[..........]
Onbekend,Onbekend Hoofdstuk,146,Scilllende waerden alsi deelden
Onbekend,Onbekend Hoofdstuk,147,ende alsi haer goet parceelden
Onbekend,Onbekend Hoofdstuk,148,D[oe] warter I ouer doot gewont
Onbekend,Onbekend Hoofdstuk,149,die waert cam [ommi] in corter stont
Onbekend,Onbekend Hoofdstuk,150,doe ginc seker met knapen viere
Onbekend,Onbekend Hoofdstuk,151,die gewont was [heerde] sciere
Onbekend,Onbekend Hoofdstuk,152,hoe si dienden I pape
Onbekend,Onbekend Hoofdstuk,153,die [brochte] in harde zwarer trape
Onbekend,Onbekend Hoofdstuk,154,I vrouwe die soone was
Onbekend,Onbekend Hoofdstuk,155,hi dede slapen sijt seker das
Onbekend,Onbekend Hoofdstuk,156,haren cnape ende haren man
Onbekend,Onbekend Hoofdstuk,157,Spapen knechten scoten an
Onbekend,Onbekend Hoofdstuk,158,vaerdelike den III paerden
Onbekend,Onbekend Hoofdstuk,159,die pape voerde siere vaerden
Onbekend,Onbekend Hoofdstuk,160,die scone vrouwe daer hi woude
Onbekend,Onbekend Hoofdstuk,161,entie knechten also houde
Onbekend,Onbekend Hoofdstuk,162,Gingen den man ende sinen knape
Onbekend,Onbekend Hoofdstuk,163,al dat si an adden[.......]
Onbekend,Onbekend Hoofdstuk,164,Dus roofdense enen[........]
Onbekend,Onbekend Hoofdstuk,165,doe quamen [.......]aghen
Onbekend,Onbekend Hoofdstuk,166,hem dochte si waren rike genouch
Onbekend,Onbekend Hoofdstuk,167,doe seide madelgijs ende louch
Onbekend,Onbekend Hoofdstuk,168,Wat [... woude ......] met die keytijf
Onbekend,Onbekend Hoofdstuk,169,Riep hij ontv[......]sijn wijf
Onbekend,Onbekend Hoofdstuk,170,Ende [...............]
Onbekend,Onbekend Hoofdstuk,171,hi en was niet [...........]
Onbekend,Onbekend Hoofdstuk,172,maergi[n alsi] wech sal riden
Onbekend,Onbekend Hoofdstuk,173,ende hier mede so liet ijt varen
Onbekend,Onbekend Hoofdstuk,174,hier binnen began die dach verclaren
Onbekend,Onbekend Hoofdstuk,175,oriande ende madelgijs
Onbekend,Onbekend Hoofdstuk,176,[..]ghe reden hem dessijt wijs
Onbekend,Onbekend Hoofdstuk,177,[Ende h]adden herte te lande waert
Onbekend,Onbekend Hoofdstuk,178,haer lieder herte was bezwaert
Onbekend,Onbekend Hoofdstuk,179,om die droem die quam te voren
Onbekend,Onbekend Hoofdstuk,180,hem dochte [...]roetcefloer was verloren
Onbekend,Onbekend Hoofdstuk,181,Ende of ver[berrent] ten gronde
Onbekend,Onbekend Hoofdstuk,182,Ende minen [........]van eggermonde
Onbekend,Onbekend Hoofdstuk,183,vor haren [ware..........]
Onbekend,Onbekend Hoofdstuk,184,Ende dat[...............]
Onbekend,Onbekend Hoofdstuk,185,onder serpente[n ........]
Onbekend,Onbekend Hoofdstuk,186,desen droom [wile .......]
Onbekend,Onbekend Hoofdstuk,187,Hadde[n] hem beide[n ........]
Onbekend,Onbekend Hoofdstuk,188,Gedroemt [madelgijs .......]
Onbekend,Onbekend Hoofdstuk,189,Hij plaecht van[........]
Onbekend,Onbekend Hoofdstuk,190,daer ware niet [........]
Onbekend,Onbekend Hoofdstuk,191,plach te segghene madelgijs
Onbekend,Onbekend Hoofdstuk,192,Sij namen orlof in hoel[sce wijs]
Onbekend,Onbekend Hoofdstuk,193,[sonder.... ]te houdene[......]
Onbekend,Onbekend Hoofdstuk,194,madelgijs was doe[..........]
Onbekend,Onbekend Hoofdstuk,195,[o]ntfinc lI grote wonden
Onbekend,Onbekend Hoofdstuk,196,[ende] alsene oriande sach bloeden
Onbekend,Onbekend Hoofdstuk,197,van iamere wanet soe verwoeden
Onbekend,Onbekend Hoofdstuk,198,Soe weende ende mesliet hare zere
Onbekend,Onbekend Hoofdstuk,199,dit sach madelgijs die here
Onbekend,Onbekend Hoofdstuk,200,dat soe hare sere mesliet
Onbekend,Onbekend Hoofdstuk,201,mettien verhief tcoene diet
Onbekend,Onbekend Hoofdstuk,202,Sijn zwaert ende slouchen vp thooft
Onbekend,Onbekend Hoofdstuk,203,dat hi den elm clooft
Onbekend,Onbekend Hoofdstuk,204,tbeckineel ende thouet mede
Onbekend,Onbekend Hoofdstuk,205,tzwaert sanc intere snede
Onbekend,Onbekend Hoofdstuk,206,eert weder stont toten kinne
Onbekend,Onbekend Hoofdstuk,207,madelgijs seide soete minne
Onbekend,Onbekend Hoofdstuk,208,verblijt waerbi weendi so
Onbekend,Onbekend Hoofdstuk,209,oriande was doe vro
Onbekend,Onbekend Hoofdstuk,210,Want soe sachen metter vaerde
Onbekend,Onbekend Hoofdstuk,211,aldoot vallen van den paerde
Onbekend,Onbekend Hoofdstuk,212,toten kinne was hi gesplet
Onbekend,Onbekend Hoofdstuk,213,mettien cam lopende symonet
Onbekend,Onbekend Hoofdstuk,214,daer ic of sprac hier te voren
Onbekend,Onbekend Hoofdstuk,215,die den hertoge wel geboren
Onbekend,Onbekend Hoofdstuk,216,vten stride nam tiere stonde
Onbekend,Onbekend Hoofdstuk,217,die men hiet bueue van eggermonde
Onbekend,Onbekend Hoofdstuk,218,ende voerden vp sijn paert aldoot
Onbekend,Onbekend Hoofdstuk,219,altote hine met eren groot
Onbekend,Onbekend Hoofdstuk,220,begrauen dede in ene stede
Onbekend,Onbekend Hoofdstuk,221,hi was doe deerste die zede
Onbekend,Onbekend Hoofdstuk,222,karle den coninc die niemare
Onbekend,Onbekend Hoofdstuk,223,dat Roetcefloer verloren ware
Onbekend,Onbekend Hoofdstuk,224,ende Bueue van eggermont doot
Onbekend,Onbekend Hoofdstuk,225,verslegen was ende sijn jroot
Onbekend,Onbekend Hoofdstuk,226,ende aimijn geuaen
Onbekend,Onbekend Hoofdstuk,227,diet dedi karle den coninc verstaen
Onbekend,Onbekend Hoofdstuk,228,die hem II bisanten gaf
Onbekend,Onbekend Hoofdstuk,229,doe zwoer hi thelige graf
Onbekend,Onbekend Hoofdstuk,230,hij soude madelgijs souken
Onbekend,Onbekend Hoofdstuk,231,aldure die werlt te vier houken
Onbekend,Onbekend Hoofdstuk,232,Ende niet cesseren toten stonden
Onbekend,Onbekend Hoofdstuk,233,vor dat hine adde vonden
Onbekend,Onbekend Hoofdstuk,234,Dvs so sciet hi vter zale
Onbekend,Onbekend Hoofdstuk,235,ende heeft berge ende dale
Onbekend,Onbekend Hoofdstuk,236,dorreden weder ende vort
Onbekend,Onbekend Hoofdstuk,237,ten laetsten gerochti ter port
Onbekend,Onbekend Hoofdstuk,238,daer hi dobbelaren vant
Onbekend,Onbekend Hoofdstuk,239,anden taerninc slouchi sijn hant
Onbekend,Onbekend Hoofdstuk,240,ende begonste dobblen mede
Onbekend,Onbekend Hoofdstuk,241,Sal hare bliscap geduren
Onbekend,Onbekend Hoofdstuk,242,madelgijs die vinc ter vre
Onbekend,Onbekend Hoofdstuk,243,Sbaeliuus ors eert yeweer ginc
Onbekend,Onbekend Hoofdstuk,244,Symonet seide dhemelsce coninc
Onbekend,Onbekend Hoofdstuk,245,moete v bewaren [here] fier
Onbekend,Onbekend Hoofdstuk,246,madelgijs seide wane comstu hier
Onbekend,Onbekend Hoofdstuk,247,ende waer waerdi geboren
Onbekend,Onbekend Hoofdstuk,248,Symonet seide ghi sul[le]t horen
Onbekend,Onbekend Hoofdstuk,249,jc was geboren in vrankerike
Onbekend,Onbekend Hoofdstuk,250,jc diende met enen prinche rike
Onbekend,Onbekend Hoofdstuk,251,die hiet van eggermont bueuoen
Onbekend,Onbekend Hoofdstuk,252,Jc souke enen edelen baroen
Onbekend,Onbekend Hoofdstuk,253,die es madelgijs genant
Onbekend,Onbekend Hoofdstuk,254,Jc hebbene gesocht in menich lant
Onbekend,Onbekend Hoofdstuk,255,Jc hebbe verloren al mine stonden
Onbekend,Onbekend Hoofdstuk,256,Ghine doet ghi hebt mi vonden
Onbekend,Onbekend Hoofdstuk,257,Jc bem zelue madelgijs
Onbekend,Onbekend Hoofdstuk,258,die knape was vroet ende wijs
Onbekend,Onbekend Hoofdstuk,259,hine wildem ten eersten male
Onbekend,Onbekend Hoofdstuk,260,Niet gewagen vander tale
Onbekend,Onbekend Hoofdstuk,261,daer hi omme sal dogen rauwe
Onbekend,Onbekend Hoofdstuk,262,doe seide oriande die vrouwe
Onbekend,Onbekend Hoofdstuk,263,Lieue knape sech mi tatoer
Onbekend,Onbekend Hoofdstuk,264,wat doet men in roetcefloer
Onbekend,Onbekend Hoofdstuk,265,wat doet bueue ende aymijn
Onbekend,Onbekend Hoofdstuk,266,Symonet seide den fijn
Onbekend,Onbekend Hoofdstuk,267,Salic v vertrecken ende vertellen
Onbekend,Onbekend Hoofdstuk,268,Noch tauont ende verspellen
Onbekend,Onbekend Hoofdstuk,269,maer ic hebbe so drouuen moet
Onbekend,Onbekend Hoofdstuk,270,dat ic hebbe verloren mijn goet
Onbekend,Onbekend Hoofdstuk,271,dat ic v niet mach maken cont
Onbekend,Onbekend Hoofdstuk,272,die bootscap van bueue van eggermont
Onbekend,Onbekend Hoofdstuk,273,ende ic hebbe ooc onger groot
Onbekend,Onbekend Hoofdstuk,274,madelgijs seide v veinoot
Onbekend,Onbekend Hoofdstuk,275,So bem ic
Onbekend,Onbekend Hoofdstuk,276,doe ic v
Onbekend,Onbekend Hoofdstuk,277,weten
Onbekend,Onbekend Hoofdstuk,278,maer ic wane ons ongeret es eten
Onbekend,Onbekend Hoofdstuk,279,Dje knape seide en es niet
Onbekend,Onbekend Hoofdstuk,280,madelgijs of ghijt gebiet
Onbekend,Onbekend Hoofdstuk,281,wi varen in corter wile
Onbekend,Onbekend Hoofdstuk,280,tenen clooste die ene mile
Onbekend,Onbekend Hoofdstuk,283,van hier staat die nes niet verre
Onbekend,Onbekend Hoofdstuk,284,madelgijs seide sonder merre
Onbekend,Onbekend Hoofdstuk,285,Neimt die wapine die dese heeft an
Onbekend,Onbekend Hoofdstuk,286,doe scoot hi anden doden man
Onbekend,Onbekend Hoofdstuk,285,ende ontwapinden vptie stede
Onbekend,Onbekend Hoofdstuk,288,ende wapendem met aesticheden
Onbekend,Onbekend Hoofdstuk,289,Sonder namelike sijn hooft
Onbekend,Onbekend Hoofdstuk,290,want die helm was ontwe geclooft
Onbekend,Onbekend Hoofdstuk,291,die madelgijs slouch met zwaerde
Onbekend,Onbekend Hoofdstuk,292,vten ogen int anscijn
Onbekend,Onbekend Hoofdstuk,293,hi seide bueue die here mijn
Onbekend,Onbekend Hoofdstuk,294,es verslegen sonder waen
Onbekend,Onbekend Hoofdstuk,295,aymin v neve es geuaen
Onbekend,Onbekend Hoofdstuk,296,ende roetcefloer die vaste stede
Onbekend,Onbekend Hoofdstuk,295,es al verberrent dats iamerhede
Onbekend,Onbekend Hoofdstuk,298,hi seide de redene al
Onbekend,Onbekend Hoofdstuk,299,entiere geuaernesse groot ende smal
Onbekend,Onbekend Hoofdstuk,300,ende al die auenture vort
Onbekend,Onbekend Hoofdstuk,301,die ghi hier voren hebt gehort
Onbekend,Onbekend Hoofdstuk,300,Hen dinke mi niet vougen wale
Onbekend,Onbekend Hoofdstuk,303,te vele te segne tere tale
Onbekend,Onbekend Hoofdstuk,304,hier bi willich mi wachten
Onbekend,Onbekend Hoofdstuk,305,maer also cvrt in onmachten
Onbekend,Onbekend Hoofdstuk,306,viel madelgijs ende oriande
Onbekend,Onbekend Hoofdstuk,305,of drouuelike wrongen si hare hande
Onbekend,Onbekend Hoofdstuk,308,Teerst datsi bequamen
Onbekend,Onbekend Hoofdstuk,309,wenen caermen alte samen
Onbekend,Onbekend Hoofdstuk,310,mochtmen vele hebben gesien
Onbekend,Onbekend Hoofdstuk,311,al wildic zere pinen mien
Onbekend,Onbekend Hoofdstuk,310,Jn soude de rauwe niet gescriuen
Onbekend,Onbekend Hoofdstuk,313,hier bi latic achter bliuen
Onbekend,Onbekend Hoofdstuk,314,daer was groot die droufede
Onbekend,Onbekend Hoofdstuk,315,doe ver[nieu]de die ziechede
Onbekend,Onbekend Hoofdstuk,316,daer soe te voren of was genesen
Onbekend,Onbekend Hoofdstuk,315,Oriande daer wi of lesen
Onbekend,Onbekend Hoofdstuk,318,Lach te bedde als die was cranc
Onbekend,Onbekend Hoofdstuk,319,Soe seide madelgijs niet lanc
Onbekend,Onbekend Hoofdstuk,320,Salic Ieuen wi moeten sceden
Onbekend,Onbekend Hoofdstuk,321,die abt quam met aesticheden
Onbekend,Onbekend Hoofdstuk,320,doe ginc soe hare biechte seggen
Onbekend,Onbekend Hoofdstuk,323,ende hare sonden vor ogen leggen
Onbekend,Onbekend Hoofdstuk,324,Ooc seide oriande met rauwen
Onbekend,Onbekend Hoofdstuk,325,dat soe madelgijs trauwen
Onbekend,Onbekend Hoofdstuk,326,emmer wilde vor hare doot
Onbekend,Onbekend Hoofdstuk,325,die abt madelgise geboot
Onbekend,Onbekend Hoofdstuk,328,dat hijt dade het ware hem goet
Onbekend,Onbekend Hoofdstuk,329,daer trouwedise ic maech v vroet
Onbekend,Onbekend Hoofdstuk,330,dies hi nie te voren dede
Onbekend,Onbekend Hoofdstuk,331,Soe was gemoneget ende geolijt mede
Onbekend,Onbekend Hoofdstuk,330,eer die abt van are sciet
Onbekend,Onbekend Hoofdstuk,333,die walsce ystorie doet ons bediet
Onbekend,Onbekend Hoofdstuk,334,dat soe bin VIII dagen starf
Onbekend,Onbekend Hoofdstuk,335,eerlike alsoot bedarf
Onbekend,Onbekend Hoofdstuk,336,hadsoe oon[inc]like sepulture
Onbekend,Onbekend Hoofdstuk,335,Oriande die soone figure
Onbekend,Onbekend Hoofdstuk,338,was [v]............
Onbekend,Onbekend Hoofdstuk,339,[..]ege ge[luc] binden [..]ampe
Onbekend,Onbekend Hoofdstuk,340,[....] van [....] ende van campe
Onbekend,Onbekend Hoofdstuk,341,[.....] ende sine gesellen
Onbekend,Onbekend Hoofdstuk,340,[w]at soudicker vele of tellen
Onbekend,Onbekend Hoofdstuk,343,[van]den wapinen die si adden an
Onbekend,Onbekend Hoofdstuk,344,[J]c weet in aertrike man
Onbekend,Onbekend Hoofdstuk,345,[...]wapine adden dan si
Onbekend,Onbekend Hoofdstuk,346,[h]addens te doene die here vri
Onbekend,Onbekend Hoofdstuk,345,Djckent waren si in felre lage
Onbekend,Onbekend Hoofdstuk,348,daer si onfingen grote slage
Onbekend,Onbekend Hoofdstuk,349,hem behoufde wapine goet
Onbekend,Onbekend Hoofdstuk,350,ende als dese heilden hoge moet
Onbekend,Onbekend Hoofdstuk,351,gewapent waren var[re] auise
Onbekend,Onbekend Hoofdstuk,350,Spronge si vp are orse van prise
Onbekend,Onbekend Hoofdstuk,353,[daer]waert waren meniger merc
Onbekend,Onbekend Hoofdstuk,354,[S]ie adde ene glauie sterc
Onbekend,Onbekend Hoofdstuk,355,[...] gebruneert inde hant
Onbekend,Onbekend Hoofdstuk,356,[....]en gemicke lijc seriant
Onbekend,Onbekend Hoofdstuk,355,[........]int lant vint
Onbekend,Onbekend Hoofdstuk,358,no met crachten no met g[enint]
Onbekend,Onbekend Hoofdstuk,359,[no] met siere manachtichede
Onbekend,Onbekend Hoofdstuk,360,[..... r ghe ...n] adde vander heide
Onbekend,Onbekend Hoofdstuk,361,[haren sc]ilden hinc si vorde borst
Onbekend,Onbekend Hoofdstuk,360,die orse noopten si sonder vorst
Onbekend,Onbekend Hoofdstuk,363,[....]oren vptie orse laysieren
Onbekend,Onbekend Hoofdstuk,364,[.....]er mochtmen die orse bestieren
Onbekend,Onbekend Hoofdstuk,365,[......]el sien metten [scerpen] sporen
Onbekend,Onbekend Hoofdstuk,366,[.......]n gardeforte moeti horen
Onbekend,Onbekend Hoofdstuk,365,[......]sinen castele sach vut
Onbekend,Onbekend Hoofdstuk,368,[.......]e hoe groot deduut
Onbekend,Onbekend Hoofdstuk,369,[.......] kerstine vpten velde [dreuen]
Onbekend,Onbekend Hoofdstuk,370,[....oe grot hen ther....] ble[uen]
Onbekend,Onbekend Hoofdstuk,371,[....]wapine bringen voert
Onbekend,Onbekend Hoofdstuk,370,[....]en wapinen Gardefoort
Onbekend,Onbekend Hoofdstuk,373,[........] was ontsien
Onbekend,Onbekend Hoofdstuk,374,[...]was daer morgalien
Onbekend,Onbekend Hoofdstuk,375,[.... metten] wapinen ooc te hant
Onbekend,Onbekend Hoofdstuk,376,So dede sijn broeder Gafridamant
Onbekend,Onbekend Hoofdstuk,375,ende alle [........] waren geloue es mie
Onbekend,Onbekend Hoofdstuk,378,Gafri[damant........]
Onbekend,Onbekend Hoofdstuk,379,[...........]en
Onbekend,Onbekend Hoofdstuk,380,[........] dede [.....]
Onbekend,Onbekend Hoofdstuk,381,[.........] si daer [.....]
Onbekend,Onbekend Hoofdstuk,380,[....] sloe[ch .....] of [.......]
Onbekend,Onbekend Hoofdstuk,383,Geuaen adden met harer cracht
Onbekend,Onbekend Hoofdstuk,384,Noch tauont so tal hare macht
Onbekend,Onbekend Hoofdstuk,385,Sere minderen ende faelgieren
Onbekend,Onbekend Hoofdstuk,386,die tyranten sonder vieren
Onbekend,Onbekend Hoofdstuk,385,Reden so lange datsi quamen
Onbekend,Onbekend Hoofdstuk,388,ten crite daer si vernamen
Onbekend,Onbekend Hoofdstuk,389,hare wederpartie [gereet] ten stride
Onbekend,Onbekend Hoofdstuk,390,Gardefort die vo[er nu mid]e
Onbekend,Onbekend Hoofdstuk,391,Jnt crite daer hi v[ant ogier]e
Onbekend,Onbekend Hoofdstuk,390,morgalien die voer ooc sciere
Onbekend,Onbekend Hoofdstuk,393,ten crite daer hi vant roelande
Onbekend,Onbekend Hoofdstuk,394,Gafridamant die voer te ha[nde]
Onbekend,Onbekend Hoofdstuk,395,daer hi vant oliuiere [den coenen]
Onbekend,Onbekend Hoofdstuk,396,Karel den coninc [met sine baroe]nen
Onbekend,Onbekend Hoofdstuk,395,S[ere blide als hi se] sach
Onbekend,Onbekend Hoofdstuk,398,hi helsde [..... als] hi eerst mach
Onbekend,Onbekend Hoofdstuk,399,ende helsde na[male] van bayuieren
Onbekend,Onbekend Hoofdstuk,400,ende van [gengeven reynieren]
Onbekend,Onbekend Hoofdstuk,401,ende [reynaten die rowerde]
Onbekend,Onbekend Hoofdstuk,400,ende van [normendien richerde]
Onbekend,Onbekend Hoofdstuk,403,ende gwide van borgoe[ngien]
Onbekend,Onbekend Hoofdstuk,404,ende ingelrame van gasc[oen]gien
Onbekend,Onbekend Hoofdstuk,405,hi seide heren van herten coene
Onbekend,Onbekend Hoofdstuk,406,Of god wille in desen [prisoene]
Onbekend,Onbekend Hoofdstuk,405,Sone comdire nemmermere
Onbekend,Onbekend Hoofdstuk,408,Nv hort van ogiere die here
Onbekend,Onbekend Hoofdstuk,409,ende van gardeforte den fellen
Onbekend,Onbekend Hoofdstuk,410,die sere gerne soude vellen
Onbekend,Onbekend Hoofdstuk,411,Ogiere mei sinen stercen sc[achte]
Onbekend,Onbekend Hoofdstuk,410,dies noopti met siere [crach]te
Onbekend,Onbekend Hoofdstuk,413,Sijn paert dat sterc was van [leden]
Onbekend,Onbekend Hoofdstuk,414,Ogier wilde ooc niet beiden
Onbekend,Onbekend Hoofdstuk,415,hi noopte brayforte [metten] sporen
Onbekend,Onbekend Hoofdstuk,416,Sinen spiet d[ael]di voren
Onbekend,Onbekend Hoofdstuk,415,welte pointe hinc sijn scilt
Onbekend,Onbekend Hoofdstuk,418,Gardefort quam met [gewilt]
Onbekend,Onbekend Hoofdstuk,419,Jegen ogiere den [sca]cht ged[ae]lt
Onbekend,Onbekend Hoofdstuk,420,Sijn spere dat wel w[as verst]aelt
Onbekend,Onbekend Hoofdstuk,421,Stac hi vp ten stercke[n] ogiere
Onbekend,Onbekend Hoofdstuk,420,So vruchtelike ende so [ongei]ere
Onbekend,Onbekend Hoofdstuk,423,die sterke scacht an [sticken] vlooch
Onbekend,Onbekend Hoofdstuk,424,ogier die [van moede] was hooch
Onbekend,Onbekend Hoofdstuk,425,Gerochten weder [metten spere]
