author,chapter,line,text
Lodewijk van Velthem,Onbekend Hoofdstuk,1,Om dien maras dier om ginc.
Lodewijk van Velthem,Onbekend Hoofdstuk,2,"Dus lagensi daer lange na die dinc,"
Lodewijk van Velthem,Onbekend Hoofdstuk,3,"entie coningin Eleine, die ter stede"
Lodewijk van Velthem,Onbekend Hoofdstuk,4,"binnen was, ende haer suster mede"
Lodewijk van Velthem,Onbekend Hoofdstuk,5,hadden groten anxt dat si
Lodewijk van Velthem,Onbekend Hoofdstuk,6,"verraden mochten werden yegeren (?) bi,"
Lodewijk van Velthem,Onbekend Hoofdstuk,7,"oft gevaen, ende weende sere"
Lodewijk van Velthem,Onbekend Hoofdstuk,8,"dicwile daer om haren here,"
Lodewijk van Velthem,Onbekend Hoofdstuk,9,dat elc so lange marret mede.
Lodewijk van Velthem,Onbekend Hoofdstuk,10,Graciaen troeste sere ter stede
Lodewijk van Velthem,Onbekend Hoofdstuk,11,"ende seide si souden, sonder waen,"
Lodewijk van Velthem,Onbekend Hoofdstuk,12,goet soccors hebben saen;
Lodewijk van Velthem,Onbekend Hoofdstuk,13,"dus troesti die vrouwe fijn,"
Lodewijk van Velthem,Onbekend Hoofdstuk,14,"ende hi had enen sone, hiet Banijn,"
Lodewijk van Velthem,Onbekend Hoofdstuk,15,"ende sijn peter was die coninc Ban,"
Lodewijk van Velthem,Onbekend Hoofdstuk,16,"ende hi was i scone ioncman,"
Lodewijk van Velthem,Onbekend Hoofdstuk,17,ende hi was Leonses maech mede;
Lodewijk van Velthem,Onbekend Hoofdstuk,18,ende doe Leonse wiste die waerheide
Lodewijk van Velthem,Onbekend Hoofdstuk,19,"dattie casteel belegen was,"
Lodewijk van Velthem,Onbekend Hoofdstuk,20,"ontboet hi Antianne na das,"
Lodewijk van Velthem,Onbekend Hoofdstuk,21,"den drossate, dat hine come pplien (?) nu;"
Lodewijk van Velthem,Onbekend Hoofdstuk,22,ende hi quam tot hem secgic u.
Lodewijk van Velthem,Onbekend Hoofdstuk,23,Doe hiet hine al hemelijc varen
Lodewijk van Velthem,Onbekend Hoofdstuk,24,"tote Biroske int foreest, twaren,"
Lodewijk van Velthem,Onbekend Hoofdstuk,25,met sinen ende onbeit ons daer naer
Lodewijk van Velthem,Onbekend Hoofdstuk,26,optie fonteine ende segt daer
Lodewijk van Velthem,Onbekend Hoofdstuk,27,"nieman van al uwen lieden,"
Lodewijk van Velthem,Onbekend Hoofdstuk,28,werwaert gi sult henen riden.
Lodewijk van Velthem,Onbekend Hoofdstuk,29,Doen seide die drossate saen
Lodewijk van Velthem,Onbekend Hoofdstuk,30,dat dit wel soude sijn gedaen;
Lodewijk van Velthem,Onbekend Hoofdstuk,31,doe vor hi henen hemelijc daer
Lodewijk van Velthem,Onbekend Hoofdstuk,32,"ende Leonse van Banniin daer naer,"
Lodewijk van Velthem,Onbekend Hoofdstuk,33,"sinen neue, ende senden nu"
Lodewijk van Velthem,Onbekend Hoofdstuk,34,"tote Pharine, dat secgic u,"
Lodewijk van Velthem,Onbekend Hoofdstuk,35,om dat hi quame toter stat
Lodewijk van Velthem,Onbekend Hoofdstuk,36,daer si geviseert hadden vor dat
Lodewijk van Velthem,Onbekend Hoofdstuk,37,"int foreest, daer hi wel wiste,"
Lodewijk van Velthem,Onbekend Hoofdstuk,38,"ende dat hi emmer niet en miste,"
Lodewijk van Velthem,Onbekend Hoofdstuk,39,"hine vor hemelic ende daer,"
Lodewijk van Velthem,Onbekend Hoofdstuk,40,ende Leonse vor nu daer naer
Lodewijk van Velthem,Onbekend Hoofdstuk,41,"int foreest, daer die borre stoet,"
Lodewijk van Velthem,Onbekend Hoofdstuk,42,"daer die drossate beide, des sijt vroet,"
Lodewijk van Velthem,Onbekend Hoofdstuk,43,dese stat hadden Merlijn vorwaer
Lodewijk van Velthem,Onbekend Hoofdstuk,44,gewijst dat si beiden souden daer;
Lodewijk van Velthem,Onbekend Hoofdstuk,45,dus beide oec Leonse ende Antran
Lodewijk van Velthem,Onbekend Hoofdstuk,46,tot dat Pharijn quam ende sijn man;
Lodewijk van Velthem,Onbekend Hoofdstuk,47,dus lagen si daer alle alsoe
Lodewijk van Velthem,Onbekend Hoofdstuk,48,tot smaendages na sent Jans dach toe;
Lodewijk van Velthem,Onbekend Hoofdstuk,49,doe Merlijn wiste dat si vergadert waren
Lodewijk van Velthem,Onbekend Hoofdstuk,50,"ende dat si ontbeiden na soccors, twaren,"
Lodewijk van Velthem,Onbekend Hoofdstuk,51,"dat hi hen geloefde te bringen daer,"
Lodewijk van Velthem,Onbekend Hoofdstuk,52,doe ginc hi ane Waler daer naer
Lodewijk van Velthem,Onbekend Hoofdstuk,53,ende seide dat hi dierste bataelge leide
Lodewijk van Velthem,Onbekend Hoofdstuk,54,ende met hen name daer gereide
Lodewijk van Velthem,Onbekend Hoofdstuk,55,"drie neuwe ridders entie XL mede,"
Lodewijk van Velthem,Onbekend Hoofdstuk,56,die van Carmelide quamen ter stede
Lodewijk van Velthem,Onbekend Hoofdstuk,57,ende nemt soe vele dan
Lodewijk van Velthem,Onbekend Hoofdstuk,58,"dat gi hebt Xm man,"
Lodewijk van Velthem,Onbekend Hoofdstuk,59,ende doet Ulfijn voren v baniere;
Lodewijk van Velthem,Onbekend Hoofdstuk,60,ende her Waler dede alsoe sciere
Lodewijk van Velthem,Onbekend Hoofdstuk,61,"alsem Merlijn heft geheten,"
Lodewijk van Velthem,Onbekend Hoofdstuk,62,"ende trac met sinen, als wijt weten,"
Lodewijk van Velthem,Onbekend Hoofdstuk,63,over ene side; daer na dede Merlijn
Lodewijk van Velthem,Onbekend Hoofdstuk,64,"den coninc Ban den andren sijn,"
Lodewijk van Velthem,Onbekend Hoofdstuk,65,die Waler volgen souden naer
Lodewijk van Velthem,Onbekend Hoofdstuk,66,"met Xm riddren, wet vor waer;"
Lodewijk van Velthem,Onbekend Hoofdstuk,67,doe riep Merlijn den coninc Bohorde
Lodewijk van Velthem,Onbekend Hoofdstuk,68,ende hiet hem dat hi nu vorde
Lodewijk van Velthem,Onbekend Hoofdstuk,69,"die derde betalie, ende nemt met u"
Lodewijk van Velthem,Onbekend Hoofdstuk,70,"die CCC ridders, die gi bracht nu"
Lodewijk van Velthem,Onbekend Hoofdstuk,71,"vt sconinc Anias lande, ende nemt daer mede"
Lodewijk van Velthem,Onbekend Hoofdstuk,72,tote Xm oec nu ter stede
Lodewijk van Velthem,Onbekend Hoofdstuk,73,van den ridders die quamen van Carmiliede.
Lodewijk van Velthem,Onbekend Hoofdstuk,74,Doe hiet Merlijn vort tien tide
Lodewijk van Velthem,Onbekend Hoofdstuk,75,"den coninc Artur: here, gi sult"
Lodewijk van Velthem,Onbekend Hoofdstuk,76,"die virde batalie leiden met gewelt,"
Lodewijk van Velthem,Onbekend Hoofdstuk,77,ende met u selen siin nu ten stonden
Lodewijk van Velthem,Onbekend Hoofdstuk,78,die heren vander Tavelronden.
Lodewijk van Velthem,Onbekend Hoofdstuk,79,Doe riep die coninc Artur ter stede
Lodewijk van Velthem,Onbekend Hoofdstuk,80,"her Uile (?) ende Nasciene mede,"
Lodewijk van Velthem,Onbekend Hoofdstuk,81,ende hiet sijn liede hen doen gereden
Lodewijk van Velthem,Onbekend Hoofdstuk,82,ende si dadent doen sonder beiden;
Lodewijk van Velthem,Onbekend Hoofdstuk,83,doe nam Merlijn den drake
Lodewijk van Velthem,Onbekend Hoofdstuk,84,"ende gaven Keyen na die sake,"
Lodewijk van Velthem,Onbekend Hoofdstuk,85,"ende seide dat hinen vorde daer naer,"
Lodewijk van Velthem,Onbekend Hoofdstuk,86,want het es v recht vor waer;
Lodewijk van Velthem,Onbekend Hoofdstuk,87,"ende wacht v wel, dat radic nv,"
Lodewijk van Velthem,Onbekend Hoofdstuk,88,dat ridderscap niet werde genedert bi v;
Lodewijk van Velthem,Onbekend Hoofdstuk,89,ende wetti wat gi selt doen ter stede
Lodewijk van Velthem,Onbekend Hoofdstuk,90,"alse gi onder die viande comt daer mede,"
Lodewijk van Velthem,Onbekend Hoofdstuk,91,So voret teken altoes in v hant.
Lodewijk van Velthem,Onbekend Hoofdstuk,92,"Dat salic wel doen, seide Keye te hant."
Lodewijk van Velthem,Onbekend Hoofdstuk,93,Merlijn hiet den iij coningen doe
Lodewijk van Velthem,Onbekend Hoofdstuk,94,"ende Waler (?), datsi dapperlijc alsoe"
Lodewijk van Velthem,Onbekend Hoofdstuk,95,"te Trebes werd voren gereit,"
Lodewijk van Velthem,Onbekend Hoofdstuk,96,"want hijs in vier sinnen beleit,"
Lodewijk van Velthem,Onbekend Hoofdstuk,97,ende elc prinse die der leget an
Lodewijk van Velthem,Onbekend Hoofdstuk,98,"heuet onder hem XXm man,"
Lodewijk van Velthem,Onbekend Hoofdstuk,99,ende elke bataelge vanden onsen mede
Lodewijk van Velthem,Onbekend Hoofdstuk,100,sal enen vanden haren anstriden ter stede.
Lodewijk van Velthem,Onbekend Hoofdstuk,101,"Hoe, seide die coninc Artur, Meerlijn,"
Lodewijk van Velthem,Onbekend Hoofdstuk,102,hebben si meer liede dan hier sijn?
Lodewijk van Velthem,Onbekend Hoofdstuk,103,"Jase, here, de helecht secgic v;"
Lodewijk van Velthem,Onbekend Hoofdstuk,104,"maer wi selen een scoen soccors hebben, secgic v,"
Lodewijk van Velthem,Onbekend Hoofdstuk,105,"wel van XXm man,"
Lodewijk van Velthem,Onbekend Hoofdstuk,106,"die ons selen comen an,"
Lodewijk van Velthem,Onbekend Hoofdstuk,107,die licgen int bosch van Brioskes.
Lodewijk van Velthem,Onbekend Hoofdstuk,108,Hoe selen si weten welc tijt dat es?
Lodewijk van Velthem,Onbekend Hoofdstuk,109,"seide Artur; here, seide Merlijn doe,"
Lodewijk van Velthem,Onbekend Hoofdstuk,110,ic salse halen tide genoch daer toe;
Lodewijk van Velthem,Onbekend Hoofdstuk,111,"ende Bliobleris sal vore varen nu,"
Lodewijk van Velthem,Onbekend Hoofdstuk,112,"want hi weet die pade wel, secgic v,"
Lodewijk van Velthem,Onbekend Hoofdstuk,113,ende recht alst daget suldi varen
Lodewijk van Velthem,Onbekend Hoofdstuk,114,"daer gi enen horen hort, daer volget naren,"
Lodewijk van Velthem,Onbekend Hoofdstuk,115,ende gi sult sien enen groten brant
Lodewijk van Velthem,Onbekend Hoofdstuk,116,"in die locht; daerna volget thant,"
Lodewijk van Velthem,Onbekend Hoofdstuk,117,"want dan sal v soccors sijn gereet,"
Lodewijk van Velthem,Onbekend Hoofdstuk,118,"dat ic v senden sal, God weet;"
Lodewijk van Velthem,Onbekend Hoofdstuk,119,blift te Gode! ic vare nu daer.
Lodewijk van Velthem,Onbekend Hoofdstuk,120,Dus sciet Merlijn van hen daer naer
Lodewijk van Velthem,Onbekend Hoofdstuk,121,ende quam daer Leonse was gelegen
Lodewijk van Velthem,Onbekend Hoofdstuk,122,"ende sinen gesellen, ende sprac daer iegen"
Lodewijk van Velthem,Onbekend Hoofdstuk,123,ende seide: wat licgdi hier onder v?
Lodewijk van Velthem,Onbekend Hoofdstuk,124,gine comt nember so vollic nv
Lodewijk van Velthem,Onbekend Hoofdstuk,125,te Trebes die coninc Artur ne sal
Lodewijk van Velthem,Onbekend Hoofdstuk,126,daer wesen met sinen volke al.
Lodewijk van Velthem,Onbekend Hoofdstuk,127,"Alse dit Leonse verstoet, vor waer"
Lodewijk van Velthem,Onbekend Hoofdstuk,128,dede hi hem grote feeste daer
Lodewijk van Velthem,Onbekend Hoofdstuk,129,ende vraechden om beide die coningen doe;
Lodewijk van Velthem,Onbekend Hoofdstuk,130,hi seide: gi selt se sien ende daer toe
Lodewijk van Velthem,Onbekend Hoofdstuk,131,met groter macht die si bringen;
Lodewijk van Velthem,Onbekend Hoofdstuk,132,maer vast gereit v; ende na dien dingen
Lodewijk van Velthem,Onbekend Hoofdstuk,133,gereiden si hen ende maecten daer
Lodewijk van Velthem,Onbekend Hoofdstuk,134,vier batalien; deerste daer naer
Lodewijk van Velthem,Onbekend Hoofdstuk,135,leide Anthiones met VIm man
Lodewijk van Velthem,Onbekend Hoofdstuk,136,"ende Graciaen VIm oec daer an,"
Lodewijk van Velthem,Onbekend Hoofdstuk,137,"ende Pharijn hadder VIm mede,"
Lodewijk van Velthem,Onbekend Hoofdstuk,138,ende Leonse VIm oec ter stede.
Lodewijk van Velthem,Onbekend Hoofdstuk,139,"Hier met quamen si te Trebes werd,"
Lodewijk van Velthem,Onbekend Hoofdstuk,140,ende al die wile dat si quamen in die verd
Lodewijk van Velthem,Onbekend Hoofdstuk,141,salic v vort secgen van Artur
Lodewijk van Velthem,Onbekend Hoofdstuk,142,ende vanden ij coningen haer aventure.
Lodewijk van Velthem,Onbekend Hoofdstuk,143,Hort hier tusschen den coninc Ban den strijt
Lodewijk van Velthem,Onbekend Hoofdstuk,144,"ende tusschen Claudase, dies droech nijt."
Lodewijk van Velthem,Onbekend Hoofdstuk,145,Daventure seget doe Merlijn was
Lodewijk van Velthem,Onbekend Hoofdstuk,146,"vanden coninc Artur gesceden na das,"
Lodewijk van Velthem,Onbekend Hoofdstuk,147,"dat Artur porde doe daer naer,"
Lodewijk van Velthem,Onbekend Hoofdstuk,148,"ende Bliobleris vore voren daer,"
Lodewijk van Velthem,Onbekend Hoofdstuk,149,want hi de passe conste sonder vrage;
Lodewijk van Velthem,Onbekend Hoofdstuk,150,dien nacht voren se toten dage;
Lodewijk van Velthem,Onbekend Hoofdstuk,151,daer quamense op I scoen plein gereet
Lodewijk van Velthem,Onbekend Hoofdstuk,152,"daer ene riviere neven leet,"
Lodewijk van Velthem,Onbekend Hoofdstuk,153,"die de Louure hiet, ende si waren daer"
Lodewijk van Velthem,Onbekend Hoofdstuk,154,den here nu comen alsoe naer
Lodewijk van Velthem,Onbekend Hoofdstuk,155,men had te v malen mogen nu
Lodewijk van Velthem,Onbekend Hoofdstuk,156,"wel overscieten, dat secgic u;"
Lodewijk van Velthem,Onbekend Hoofdstuk,157,"doen deildense, om dat se wilden sien"
Lodewijk van Velthem,Onbekend Hoofdstuk,158,dat teken daer hen af seide vor dien
Lodewijk van Velthem,Onbekend Hoofdstuk,159,"Merlijn, dat was vanden brande mede"
Lodewijk van Velthem,Onbekend Hoofdstuk,160,"die inden locht soude vliegen ter stede,"
Lodewijk van Velthem,Onbekend Hoofdstuk,161,ende vanden horne diese souden horen;
Lodewijk van Velthem,Onbekend Hoofdstuk,162,ende binnen desen quam daer te voren
Lodewijk van Velthem,Onbekend Hoofdstuk,163,"een spiere diese heeft versien,"
Lodewijk van Velthem,Onbekend Hoofdstuk,164,ende ginc int ander here secgen mettien;
Lodewijk van Velthem,Onbekend Hoofdstuk,165,ende doe dit die ander vernamen
Lodewijk van Velthem,Onbekend Hoofdstuk,166,wapenden si hen ende trocken tsamen
Lodewijk van Velthem,Onbekend Hoofdstuk,167,te velde ende battelgeerden hen daer.
Lodewijk van Velthem,Onbekend Hoofdstuk,168,Ende Ponces Antones trac daer naer
Lodewijk van Velthem,Onbekend Hoofdstuk,169,"ane dinde van enen bosch ter stede,"
Lodewijk van Velthem,Onbekend Hoofdstuk,170,ende daer na quam die hertoge mede
Lodewijk van Velthem,Onbekend Hoofdstuk,171,"van Aelmaengen; daerna quam Rodoen,"
Lodewijk van Velthem,Onbekend Hoofdstuk,172,ende Claudas van Deserte quam doen
Lodewijk van Velthem,Onbekend Hoofdstuk,173,ende lach met sinen lieden neven [...]
Lodewijk van Velthem,Onbekend Hoofdstuk,174,ende [..] die wile [.............]
Lodewijk van Velthem,Onbekend Hoofdstuk,175,"dat si dus wert voren, quam Merlijn,"
Lodewijk van Velthem,Onbekend Hoofdstuk,176,"die hier algader af wiste den siin,"
Lodewijk van Velthem,Onbekend Hoofdstuk,177,ende hi blies den horen doe
Lodewijk van Velthem,Onbekend Hoofdstuk,178,ende dede den brant vliegen daertoe.
Lodewijk van Velthem,Onbekend Hoofdstuk,179,Doe Artur den horen horde [....]
Lodewijk van Velthem,Onbekend Hoofdstuk,180,ende den brant [sach?] vliegen daer naer
Lodewijk van Velthem,Onbekend Hoofdstuk,181,"sloegen si alle ten here werd,"
Lodewijk van Velthem,Onbekend Hoofdstuk,182,ende her Walijn vergaderde metter verd;
Lodewijk van Velthem,Onbekend Hoofdstuk,183,"Antrolles de hertoge, secgic u,"
Lodewijk van Velthem,Onbekend Hoofdstuk,184,entie coninc Ban vergaderde nu
Lodewijk van Velthem,Onbekend Hoofdstuk,185,"anden coninc Claudas ter stede,"
Lodewijk van Velthem,Onbekend Hoofdstuk,186,entie coninc Bohor vergaderde mede
Lodewijk van Velthem,Onbekend Hoofdstuk,187,"an Pontes Antonijs nu ter stat,"
Lodewijk van Velthem,Onbekend Hoofdstuk,188,entie coninc Artur vergaderde na dat
Lodewijk van Velthem,Onbekend Hoofdstuk,189,[...............]
Lodewijk van Velthem,Onbekend Hoofdstuk,190,[...............]
Lodewijk van Velthem,Onbekend Hoofdstuk,191,[...............]
Lodewijk van Velthem,Onbekend Hoofdstuk,192,die met sulken nide reden beden
Lodewijk van Velthem,Onbekend Hoofdstuk,193,dat si beide storten daer neder;
Lodewijk van Velthem,Onbekend Hoofdstuk,194,maer si waren beide volliic op weder
Lodewijk van Velthem,Onbekend Hoofdstuk,195,ende togen haer swerd ende sloegen daer
Lodewijk van Velthem,Onbekend Hoofdstuk,196,deen opten andren slage swaer;
Lodewijk van Velthem,Onbekend Hoofdstuk,197,ende alse hi Wallijn te voet sach
Lodewijk van Velthem,Onbekend Hoofdstuk,198,Sagremor sloech hi al dat hi mach;
Lodewijk van Velthem,Onbekend Hoofdstuk,199,"daer [...] enen Ulfijn oec mede,"
Lodewijk van Velthem,Onbekend Hoofdstuk,200,"die sine baniere vorde ter stede,"
Lodewijk van Velthem,Onbekend Hoofdstuk,201,ende bander side quamen daer oec toe
Lodewijk van Velthem,Onbekend Hoofdstuk,202,om den hertoge te bescudden doe.
Lodewijk van Velthem,Onbekend Hoofdstuk,203,Dus vergaderde deen den andren daer;
Lodewijk van Velthem,Onbekend Hoofdstuk,204,doe werd mennich spere te broken daer naer
Lodewijk van Velthem,Onbekend Hoofdstuk,205,"ende ut gesteken mennich man,"
Lodewijk van Velthem,Onbekend Hoofdstuk,206,die meer op en stont vort an;
Lodewijk van Velthem,Onbekend Hoofdstuk,207,daer werd die striit groet ende starc mede
Lodewijk van Velthem,Onbekend Hoofdstuk,208,doch werden hermonteert ter stede
Lodewijk van Velthem,Onbekend Hoofdstuk,209,die hertoge ende Sagremor beide;
Lodewijk van Velthem,Onbekend Hoofdstuk,210,maer het was groeten leide.
Lodewijk van Velthem,Onbekend Hoofdstuk,211,"Daer dadent wel die XIJ, twaren,"
Lodewijk van Velthem,Onbekend Hoofdstuk,212,die neuwe ridderen gemaect waren;
Lodewijk van Velthem,Onbekend Hoofdstuk,213,"maer sint dat middach leet, vorwaer,"
Lodewijk van Velthem,Onbekend Hoofdstuk,214,sone was daer niemen die een haer
Lodewijk van Velthem,Onbekend Hoofdstuk,215,"Wallijn iet geliken const mede,"
Lodewijk van Velthem,Onbekend Hoofdstuk,216,want hi sloech doet daer ter stede
Lodewijk van Velthem,Onbekend Hoofdstuk,217,"ma[...] wat vor hen quam,"
Lodewijk van Velthem,Onbekend Hoofdstuk,218,"[...] sijn neve, als ict vernam,"
Lodewijk van Velthem,Onbekend Hoofdstuk,219,[.......] in dese twee
Lodewijk van Velthem,Onbekend Hoofdstuk,220,dadent herde wel ende noch mee;
Lodewijk van Velthem,Onbekend Hoofdstuk,221,Gal[....] ende Gaheries
Lodewijk van Velthem,Onbekend Hoofdstuk,222,dadent sowel dat m[....] des
Lodewijk van Velthem,Onbekend Hoofdstuk,223,over die beste hilt [..] daer nu
Lodewijk van Velthem,Onbekend Hoofdstuk,224,"naest Wallijn, dat secgic u,"
Lodewijk van Velthem,Onbekend Hoofdstuk,225,"ende Garies enen Egrawein,"
Lodewijk van Velthem,Onbekend Hoofdstuk,226,ende alle die daer waren int plein
Lodewijk van Velthem,Onbekend Hoofdstuk,227,dadent wel ende condechlike
Lodewijk van Velthem,Onbekend Hoofdstuk,228,[...............]
Lodewijk van Velthem,Onbekend Hoofdstuk,229,"was [.........] waere,"
Lodewijk van Velthem,Onbekend Hoofdstuk,230,"die de felste was van alden here,"
Lodewijk van Velthem,Onbekend Hoofdstuk,231,"ende daer aldus vergaderden, dan"
Lodewijk van Velthem,Onbekend Hoofdstuk,232,sloech hi metten swerde den coninc Ban
Lodewijk van Velthem,Onbekend Hoofdstuk,233,"opten helm, datter tfier ut vloech."
Lodewijk van Velthem,Onbekend Hoofdstuk,234,ende dat hi opt gereide boech;
Lodewijk van Velthem,Onbekend Hoofdstuk,235,"doe rechti hem op alse de erre was,"
Lodewijk van Velthem,Onbekend Hoofdstuk,236,ende sloech Claudas opt hoeft na das
Lodewijk van Velthem,Onbekend Hoofdstuk,237,"enen slach, maert swerd scamselde (sic) neder"
Lodewijk van Velthem,Onbekend Hoofdstuk,238,ende sloech den orsse alsoe weder
Lodewijk van Velthem,Onbekend Hoofdstuk,239,"den hals af ende het viel doe,"
Lodewijk van Velthem,Onbekend Hoofdstuk,240,ende Claudas met [.....] alsoe
Lodewijk van Velthem,Onbekend Hoofdstuk,241,op [.......] comen daer
Lodewijk van Velthem,Onbekend Hoofdstuk,242,gaf hi hem iij slage daer naer
Lodewijk van Velthem,Onbekend Hoofdstuk,243,dat hine had bina weder nu
Lodewijk van Velthem,Onbekend Hoofdstuk,244,"ter eerden doen tumelen, secgic v."
Lodewijk van Velthem,Onbekend Hoofdstuk,245,[...............]
Lodewijk van Velthem,Onbekend Hoofdstuk,246,[...............]
Lodewijk van Velthem,Onbekend Hoofdstuk,247,maer het was van sulker cracht ende gewelt
Lodewijk van Velthem,Onbekend Hoofdstuk,248,dat hi daer nochtan onthelt;
Lodewijk van Velthem,Onbekend Hoofdstuk,249,doe warp hi den scilt opt hoeft daer naer
Lodewijk van Velthem,Onbekend Hoofdstuk,250,ende quam te coninc Banne werd daer
Lodewijk van Velthem,Onbekend Hoofdstuk,251,ende began op hem te slane nu;
Lodewijk van Velthem,Onbekend Hoofdstuk,252,"maer h'liede in besiden, secgic v,"
Lodewijk van Velthem,Onbekend Hoofdstuk,253,quamenre toe; doe werd daer naer
Lodewijk van Velthem,Onbekend Hoofdstuk,254,"die coninc Claudas hermonteert, vorwaer,"
Lodewijk van Velthem,Onbekend Hoofdstuk,255,want hi hadde noch alse vele liede
Lodewijk van Velthem,Onbekend Hoofdstuk,256,"alse de coninc Ban dede tien tide,"
Lodewijk van Velthem,Onbekend Hoofdstuk,257,ende sine liede hadden met mogen staen
Lodewijk van Velthem,Onbekend Hoofdstuk,258,"en had die coninc Ban selve gedaen,"
Lodewijk van Velthem,Onbekend Hoofdstuk,259,diese aldus hilt durende daer
Lodewijk van Velthem,Onbekend Hoofdstuk,260,"toten middage, weet vor waer;"
Lodewijk van Velthem,Onbekend Hoofdstuk,261,ende bander side street die coninc Bohort
Lodewijk van Velthem,Onbekend Hoofdstuk,262,"jegen Pontes Antonijs vort,"
Lodewijk van Velthem,Onbekend Hoofdstuk,263,"die een groet spere had in die hant,"
Lodewijk van Velthem,Onbekend Hoofdstuk,264,ende quam opten coninc Bohor gerant
Lodewijk van Velthem,Onbekend Hoofdstuk,265,ende stac sijn speer op hem ontwee;
Lodewijk van Velthem,Onbekend Hoofdstuk,266,entie coninc Bohor die hem gevee (sic)
Lodewijk van Velthem,Onbekend Hoofdstuk,267,wat si staken dorden scilt
Lodewijk van Velthem,Onbekend Hoofdstuk,268,ende dore den arm met gewilt
Lodewijk van Velthem,Onbekend Hoofdstuk,269,ende nichelden hem an die side doe
Lodewijk van Velthem,Onbekend Hoofdstuk,270,"ende stac hem daer in ene wonde daer toe,"
Lodewijk van Velthem,Onbekend Hoofdstuk,271,ende hi viel van den orsse neder daer
Lodewijk van Velthem,Onbekend Hoofdstuk,272,"ende lach in ontmacht oec daer naer,"
Lodewijk van Velthem,Onbekend Hoofdstuk,273,dat men niet conde geweten daer bi
Lodewijk van Velthem,Onbekend Hoofdstuk,274,weder hi doet ofte levende sij.
Lodewijk van Velthem,Onbekend Hoofdstuk,275,Ende doen sine liede dit sagen daer
Lodewijk van Velthem,Onbekend Hoofdstuk,276,hadden si anxt ende groten vaer
Lodewijk van Velthem,Onbekend Hoofdstuk,277,"om dat hare here doet ware,"
Lodewijk van Velthem,Onbekend Hoofdstuk,278,"ende reden alle daer werd daer nare,"
Lodewijk van Velthem,Onbekend Hoofdstuk,279,om hem te bescudden aldaer nv;
Lodewijk van Velthem,Onbekend Hoofdstuk,280,"ende coninc liede quamenre iegen, secgic v,"
Lodewijk van Velthem,Onbekend Hoofdstuk,281,met starken speren; daer werd ter tijt
Lodewijk van Velthem,Onbekend Hoofdstuk,282,een groet ende een starc strijt
Lodewijk van Velthem,Onbekend Hoofdstuk,283,[...............]
Lodewijk van Velthem,Onbekend Hoofdstuk,284,[...............]
Lodewijk van Velthem,Onbekend Hoofdstuk,285,vander wonden ende scaenden (sic) sere
Lodewijk van Velthem,Onbekend Hoofdstuk,286,ende reden opten coninc met enen here
Lodewijk van Velthem,Onbekend Hoofdstuk,287,ende sloegen opten helm alsoe
Lodewijk van Velthem,Onbekend Hoofdstuk,288,"dat hi op siin gereide boech doe,"
Lodewijk van Velthem,Onbekend Hoofdstuk,289,ende die coninc Bohor sloegen weder
Lodewijk van Velthem,Onbekend Hoofdstuk,290,"dorden helm ene wonde, dat hi daer neder"
Lodewijk van Velthem,Onbekend Hoofdstuk,291,tumelen moeste ende overreden daer
Lodewijk van Velthem,Onbekend Hoofdstuk,292,eerne die romenie (sic) conden naer
Lodewijk van Velthem,Onbekend Hoofdstuk,293,hermonteren; doe beval hi saen
Lodewijk van Velthem,Onbekend Hoofdstuk,294,den sinen dat si hem in staden staen;
Lodewijk van Velthem,Onbekend Hoofdstuk,295,doe reet hi in de meeste porsse
Lodewijk van Velthem,Onbekend Hoofdstuk,296,daer werd mennich vanden orsse
Lodewijk van Velthem,Onbekend Hoofdstuk,297,gevelt; doe werd die coninc Bohord
Lodewijk van Velthem,Onbekend Hoofdstuk,298,achter gedreven alsoe vord
Lodewijk van Velthem,Onbekend Hoofdstuk,299,enen bogescote wel van daer;
Lodewijk van Velthem,Onbekend Hoofdstuk,300,"dus duerde die striit alsoe daer waer,"
Lodewijk van Velthem,Onbekend Hoofdstuk,301,"[.........] uer,"
Lodewijk van Velthem,Onbekend Hoofdstuk,302,ende al dese wile vacht die coninc Artur
Lodewijk van Velthem,Onbekend Hoofdstuk,303,jegen Randone van Gaules;
Lodewijk van Velthem,Onbekend Hoofdstuk,304,"entie coninc Artur, sijt seker des,"
Lodewijk van Velthem,Onbekend Hoofdstuk,305,entie ridderen vander Tavelronde
Lodewijk van Velthem,Onbekend Hoofdstuk,306,liepen hem seer optien stonden
Lodewijk van Velthem,Onbekend Hoofdstuk,307,ende dadense achter in dere wijs
Lodewijk van Velthem,Onbekend Hoofdstuk,308,"tote op Pontes here Antonijs,"
Lodewijk van Velthem,Onbekend Hoofdstuk,309,ende Keye volchde wel metten drake
Lodewijk van Velthem,Onbekend Hoofdstuk,310,"die hem Merlijn gaf vor dese sake,"
Lodewijk van Velthem,Onbekend Hoofdstuk,311,dien groet vier uter kelen scoet;
Lodewijk van Velthem,Onbekend Hoofdstuk,312,"dies noit ne sagen seiden bloet,"
Lodewijk van Velthem,Onbekend Hoofdstuk,313,"het soude domsdach wesen sciere,"
Lodewijk van Velthem,Onbekend Hoofdstuk,314,ende ververden hen sere vanden viere;
Lodewijk van Velthem,Onbekend Hoofdstuk,315,ende sonder twivel ane den drake
Lodewijk van Velthem,Onbekend Hoofdstuk,316,"lach betekenesse van groter sake,"
Lodewijk van Velthem,Onbekend Hoofdstuk,317,want tfier dat hem vter kelen scoet
Lodewijk van Velthem,Onbekend Hoofdstuk,318,dat betekende martilie groet
Lodewijk van Velthem,Onbekend Hoofdstuk,319,"van lieden doet te slane met,"
Lodewijk van Velthem,Onbekend Hoofdstuk,320,"ins coninc Arturs tiden, dat wet;"
Lodewijk van Velthem,Onbekend Hoofdstuk,321,ende dat sijn stert gewrongen was
Lodewijk van Velthem,Onbekend Hoofdstuk,322,betekent groet verraetnesse na das
Lodewijk van Velthem,Onbekend Hoofdstuk,323,dat in sijns selfs liede was mede;
Lodewijk van Velthem,Onbekend Hoofdstuk,324,doe si iegen hen keerden ter stede
Lodewijk van Velthem,Onbekend Hoofdstuk,325,"ende met Mordiette waren algader,"
Lodewijk van Velthem,Onbekend Hoofdstuk,326,daer hi oem af was ende vader
Lodewijk van Velthem,Onbekend Hoofdstuk,327,Met [..............]
Lodewijk van Velthem,Onbekend Hoofdstuk,328,"Wt ere crebben ghers, seggic u,"
Lodewijk van Velthem,Onbekend Hoofdstuk,329,ende omdat den onghecroenden leeu ter stede
Lodewijk van Velthem,Onbekend Hoofdstuk,330,"dochte dat beter weyde, waermede"
Lodewijk van Velthem,Onbekend Hoofdstuk,331,ten ghecroenden leeuwe waert
Lodewijk van Velthem,Onbekend Hoofdstuk,332,[....] ep hi hem op metter vaert
Lodewijk van Velthem,Onbekend Hoofdstuk,333,[........] hem daer
