author,chapter,line,text
Onbekend,Onbekend Hoofdstuk,1,"Ende decte hem onder sinen scilt,"
Onbekend,Onbekend Hoofdstuk,2,Daer hi met sorgen hem behilt.
Onbekend,Onbekend Hoofdstuk,3,"Parthonopeus gincker op slaen,"
Onbekend,Onbekend Hoofdstuk,4,"Ende hieu daer af manech spaen,"
Onbekend,Onbekend Hoofdstuk,5,"Ende lieten te geere waren comen,"
Onbekend,Onbekend Hoofdstuk,6,Ende gingen driven ende dromen
Onbekend,Onbekend Hoofdstuk,7,"Met swaren slagen ende met sueren,"
Onbekend,Onbekend Hoofdstuk,8,Dat hine niewerinc liet gedueren
Onbekend,Onbekend Hoofdstuk,9,"No bi stane, no bi vliene."
Onbekend,Onbekend Hoofdstuk,10,Do had die coninc harde ontsiene.
Onbekend,Onbekend Hoofdstuk,11,"Hi weec altoes ende dede hem tachter,"
Onbekend,Onbekend Hoofdstuk,12,Ende vernam wel dat hi den lachter
Onbekend,Onbekend Hoofdstuk,13,"Ende [scande] soude hebben, ende het saen"
Onbekend,Onbekend Hoofdstuk,14,Met hem ten argesten soude vergaen.
Onbekend,Onbekend Hoofdstuk,15,"Hem dochte doe wel sekerlike,"
Onbekend,Onbekend Hoofdstuk,16,Dat Parthonopeus erstelike
Onbekend,Onbekend Hoofdstuk,17,"Aldaer ierst togede sinen cracht,"
Onbekend,Onbekend Hoofdstuk,18,Ende hi te voren te scerne vacht.
Onbekend,Onbekend Hoofdstuk,19,Dus leert die minne ende geeft
Onbekend,Onbekend Hoofdstuk,20,"Den genen die der minnen plegt,"
Onbekend,Onbekend Hoofdstuk,21,So geeft si cracht ende raet
Onbekend,Onbekend Hoofdstuk,22,"Elken daertoe, dat hem staet."
Onbekend,Onbekend Hoofdstuk,23,"Den riddere maectse cone ende vroet,"
Onbekend,Onbekend Hoofdstuk,24,Ende geeft heme reyne moet;
Onbekend,Onbekend Hoofdstuk,25,"Si leert hem doget ende hovescheit,"
Onbekend,Onbekend Hoofdstuk,26,Ende doet hem scuwen alle dorperheit.
Onbekend,Onbekend Hoofdstuk,27,"Scone vrouwen, die niet en minnen,"
Onbekend,Onbekend Hoofdstuk,28,En mogen nemmer prijs gewinnen:
Onbekend,Onbekend Hoofdstuk,29,Hets recht wel dat sijs plegen.
Onbekend,Onbekend Hoofdstuk,30,Oec hebbic selve lange gedregen
Onbekend,Onbekend Hoofdstuk,31,Ende drage noch int herte binnen
Onbekend,Onbekend Hoofdstuk,32,"Ene wonde van sulker minnen,"
Onbekend,Onbekend Hoofdstuk,33,"Die mi in dinde sal verslaen,"
Onbekend,Onbekend Hoofdstuk,34,"Ende doch benic hare onderdaen,"
Onbekend,Onbekend Hoofdstuk,35,Als hare gevangene ende knecht.
Onbekend,Onbekend Hoofdstuk,36,"Souse mi lonen na mijn recht,"
Onbekend,Onbekend Hoofdstuk,37,"Si soude mijns hebben genade,"
Onbekend,Onbekend Hoofdstuk,38,Ende staen een deel in minen rade.
Onbekend,Onbekend Hoofdstuk,39,"Gi heren, dor God, vernoyt u niet,"
Onbekend,Onbekend Hoofdstuk,40,Dat ic binnen derre avonturen yet
Onbekend,Onbekend Hoofdstuk,41,Van mire minnen hebbe geleit.
Onbekend,Onbekend Hoofdstuk,42,Gi hebt wel gehort hoemen seit:
Onbekend,Onbekend Hoofdstuk,43,"Daer seer, daer hant; daer lief, daer ogen."
Onbekend,Onbekend Hoofdstuk,44,"Altoes pinsic ende poge,"
Onbekend,Onbekend Hoofdstuk,45,Hoe ic bi enegen treken
Onbekend,Onbekend Hoofdstuk,46,Dicke van der sueter spreke.
Onbekend,Onbekend Hoofdstuk,47,"Parthonopeus sloech menegen slach,"
Onbekend,Onbekend Hoofdstuk,48,Dien Sornagur wel sere onsach:
Onbekend,Onbekend Hoofdstuk,49,"Hine waende vor hem niet lange staen,"
Onbekend,Onbekend Hoofdstuk,50,Alsen Mares sach dus ontdaen
Onbekend,Onbekend Hoofdstuk,51,"Ende van den live dus staen in noet,"
Onbekend,Onbekend Hoofdstuk,52,"Ende sinen anxt wesen groet,"
Onbekend,Onbekend Hoofdstuk,53,"Daerne Parthonopeus sochte,"
Onbekend,Onbekend Hoofdstuk,54,Sorgede hi dat lich[telijc mochte]
Onbekend,Onbekend Hoofdstuk,55,Te lange merren o[........]
Onbekend,Onbekend Hoofdstuk,56,Sorcursen dor sin[....]
Onbekend,Onbekend Hoofdstuk,57,Sijn teken riep h[i ..........]
Onbekend,Onbekend Hoofdstuk,58,Met luder stimmen [...........]
Onbekend,Onbekend Hoofdstuk,59,Dan hine sach [.............]
Onbekend,Onbekend Hoofdstuk,60,Die di [............]
Onbekend,Onbekend Hoofdstuk,61,Daer hijs [dick] met hadde beraden.
Onbekend,Onbekend Hoofdstuk,62,"Hare cappen si te hant afdaden,"
Onbekend,Onbekend Hoofdstuk,63,Ende hadde haerre bare swert ge[reet].
Onbekend,Onbekend Hoofdstuk,64,"Mares op Parthonopeus reet,"
Onbekend,Onbekend Hoofdstuk,65,Als die gene die ergeren wilde.
Onbekend,Onbekend Hoofdstuk,66,Opten rant van den scilde
Onbekend,Onbekend Hoofdstuk,67,Sloech hine enen groten slach.
Onbekend,Onbekend Hoofdstuk,68,"Als dattie coninc Sornagur sach,"
Onbekend,Onbekend Hoofdstuk,69,"Vele lude riep hi: ""Laet, Mares!"
Onbekend,Onbekend Hoofdstuk,70,Du wets wel hoet gesekert es.
Onbekend,Onbekend Hoofdstuk,71,"Dor rechter trouwen manic di,"
Onbekend,Onbekend Hoofdstuk,72,"Also lief als di onse ere si,"
Onbekend,Onbekend Hoofdstuk,73,"So begef deser overdaet,"
Onbekend,Onbekend Hoofdstuk,74,Die sere jegen onse ere gaet:
Onbekend,Onbekend Hoofdstuk,75,"Laet ons houden ons sekeringe."""
Onbekend,Onbekend Hoofdstuk,76,Mares seide die hoge scalckinge:
Onbekend,Onbekend Hoofdstuk,77,"""Here,"" seit hi, ""dat en mach niet [sijn]."
Onbekend,Onbekend Hoofdstuk,78,Ic sal nu doen den wille mij[n].
Onbekend,Onbekend Hoofdstuk,79,"Dan latic niet, wien lief of [leet],"
Onbekend,Onbekend Hoofdstuk,80,"Dor enegen trouwe of dor [eet],"
Onbekend,Onbekend Hoofdstuk,81,Ic sal u looscen nu teser tijt
Onbekend,Onbekend Hoofdstuk,82,"Uter groter noet, daer gi in sijt."""
Onbekend,Onbekend Hoofdstuk,83,"Als die dusent Fransose sagen,"
Onbekend,Onbekend Hoofdstuk,84,"Die ter plaetsen gewapent lagen,"
Onbekend,Onbekend Hoofdstuk,85,Pongerden si in de Sarrasine.
Onbekend,Onbekend Hoofdstuk,86,Daer quam Fursijn met Faburine.
Onbekend,Onbekend Hoofdstuk,87,Twe coninge de plaetse hilden
Onbekend,Onbekend Hoofdstuk,88,"Banderside met dusent scilden,"
Onbekend,Onbekend Hoofdstuk,89,"Ende pongerden te haren here,"
Onbekend,Onbekend Hoofdstuk,90,Die hem mesliet ende clagede sere.
Onbekend,Onbekend Hoofdstuk,91,"""Edel heren,"" seit hi, ""dat ons Mares"
Onbekend,Onbekend Hoofdstuk,92,"Dus heeft gelastert, ic mane u des,"
Onbekend,Onbekend Hoofdstuk,93,"Dat gine slaet of gine bevaert,"
Onbekend,Onbekend Hoofdstuk,94,"[Ende den verra]dere niet en spaert."""
Onbekend,Onbekend Hoofdstuk,95,"[Si seiden: ""ger]ne,"" ende dadens pine"
Onbekend,Onbekend Hoofdstuk,96,[........] die Sarrasine
Onbekend,Onbekend Hoofdstuk,97,[....... m]et haren swerden
Onbekend,Onbekend Hoofdstuk,98,[........] se ende weerden
Onbekend,Onbekend Hoofdstuk,99,[........] jegen die Fransose vach
Onbekend,Onbekend Hoofdstuk,100,[...............]
Onbekend,Onbekend Hoofdstuk,101,[...] had [.........] man
Onbekend,Onbekend Hoofdstuk,102,Die halsberge al hebben an
Onbekend,Onbekend Hoofdstuk,103,"[Dan] die Fransose hadden daer,"
Onbekend,Onbekend Hoofdstuk,104,Dat was kinlijc ende openbaer.
Onbekend,Onbekend Hoofdstuk,105,Dus geviel dat Mares vinc
Onbekend,Onbekend Hoofdstuk,106,Parthonopeus den edelen jongelinc;
Onbekend,Onbekend Hoofdstuk,107,Maer het cochte menech man eer.
Onbekend,Onbekend Hoofdstuk,108,Der onser ware daer bleven meer
Onbekend,Onbekend Hoofdstuk,109,"Verslegen, en had gedaen de nacht:"
Onbekend,Onbekend Hoofdstuk,110,So sere waren si verhacht.
Onbekend,Onbekend Hoofdstuk,111,Sire sekeringen hi niet en vergat.
Onbekend,Onbekend Hoofdstuk,112,"Sornagur op een ors gesat,"
Onbekend,Onbekend Hoofdstuk,113,"Ende vor verbolgen op de sine,"
Onbekend,Onbekend Hoofdstuk,114,Als hem somen wart in scine.
Onbekend,Onbekend Hoofdstuk,115,"Hi deder onder scade groet,"
Onbekend,Onbekend Hoofdstuk,116,Ende hi slogere vele te doet.
Onbekend,Onbekend Hoofdstuk,117,"Parthonopeus, die jegen hem vacht,"
Onbekend,Onbekend Hoofdstuk,118,"[Riep] hi vele binnen der nacht,"
Onbekend,Onbekend Hoofdstuk,119,"[Ende] sorgede dat sine souden slaen,"
Onbekend,Onbekend Hoofdstuk,120,[....]e verradenesse had gedaen.
Onbekend,Onbekend Hoofdstuk,121,"Hi riepen vele ende sochte,"
Onbekend,Onbekend Hoofdstuk,122,"Maer als hine niet vinden en mochte,"
Onbekend,Onbekend Hoofdstuk,123,Hilt hine seker over doet:
Onbekend,Onbekend Hoofdstuk,124,Dies haddi anxt ende sorge groet.
Onbekend,Onbekend Hoofdstuk,125,"Het was so donker, dat si niet"
Onbekend,Onbekend Hoofdstuk,126,"En conden gesien, ende there saen sciet."
Onbekend,Onbekend Hoofdstuk,127,Doen keerden weder die Fransose
Onbekend,Onbekend Hoofdstuk,128,Met groten rouwe te Pontoise.
Onbekend,Onbekend Hoofdstuk,129,Parthonopeus hare jonchere
Onbekend,Onbekend Hoofdstuk,130,Rau hen utermate sere.
Onbekend,Onbekend Hoofdstuk,131,"Nu en conde geweten Sornagur,"
Onbekend,Onbekend Hoofdstuk,132,Waer hem Parthonopeus ontvoer:
Onbekend,Onbekend Hoofdstuk,133,Dies haddi int herte groten rouwe.
Onbekend,Onbekend Hoofdstuk,134,Nu mogedi horen groten trouwe:
Onbekend,Onbekend Hoofdstuk,135,Hi dede hem onder die Fransose
Onbekend,Onbekend Hoofdstuk,136,"Ende vor met hem al te Pontose,"
Onbekend,Onbekend Hoofdstuk,137,Als een die te hem behorde.
Onbekend,Onbekend Hoofdstuk,138,Daer vernam hi ende horde
Onbekend,Onbekend Hoofdstuk,139,Groet seer om den here van Bloys
Onbekend,Onbekend Hoofdstuk,140,[........] hi ende sprac Fransois
Onbekend,Onbekend Hoofdstuk,141,[...............]
Onbekend,Onbekend Hoofdstuk,142,"Ende bete neder vor die zale,"
Onbekend,Onbekend Hoofdstuk,143,"Ende liet sijn ors daer vore staen,"
Onbekend,Onbekend Hoofdstuk,144,Ende micte wiet soude ontfaen.
Onbekend,Onbekend Hoofdstuk,145,"Hi ginc op ende geninde hem das,"
Onbekend,Onbekend Hoofdstuk,146,"Also gewapent als hi was,"
Onbekend,Onbekend Hoofdstuk,147,Dat hi in sconincs camere ginc.
Onbekend,Onbekend Hoofdstuk,148,Daer sachi om den jongelinc
Onbekend,Onbekend Hoofdstuk,149,"So groet seer den coninc driven,"
Onbekend,Onbekend Hoofdstuk,150,Dat u nieman mocht gescriven.
Onbekend,Onbekend Hoofdstuk,151,Hi sachgene dicken in ommacht
Onbekend,Onbekend Hoofdstuk,152,"Vallen dicke in der selver nacht,"
Onbekend,Onbekend Hoofdstuk,153,"Ende alle die gene, die met hem waren,"
Onbekend,Onbekend Hoofdstuk,154,Hande slaen ende sere mesbaren.
Onbekend,Onbekend Hoofdstuk,155,"Elc hadde bi hem den rouwe so groet,"
Onbekend,Onbekend Hoofdstuk,156,"Ende al om Parthonopeus doet,"
Onbekend,Onbekend Hoofdstuk,157,Dat si den coninc hare here
Onbekend,Onbekend Hoofdstuk,158,"Niet en troesten van haren sere,"
Onbekend,Onbekend Hoofdstuk,159,"Dat herde tsinen onwille was vergaen,"
Onbekend,Onbekend Hoofdstuk,160,Ende hi was bleec ende ongedaen.
Onbekend,Onbekend Hoofdstuk,161,"""Ay arme !"" seit hi, ""goede neve,"
Onbekend,Onbekend Hoofdstuk,162,"Hoe leet es mi dat ic nu leve,"
Onbekend,Onbekend Hoofdstuk,163,Sider dat ic hebbe u verloren.
Onbekend,Onbekend Hoofdstuk,164,"Nie en wart so soete man geboren,"
Onbekend,Onbekend Hoofdstuk,165,"Soe goet, so scone, [so] wel gemaect,"
Onbekend,Onbekend Hoofdstuk,166,"Ende alre doget so wale geraect,"
Onbekend,Onbekend Hoofdstuk,167,Als gi waert van uwen ouden.
Onbekend,Onbekend Hoofdstuk,168,Ay God! hoe loeslike was gehouden
Onbekend,Onbekend Hoofdstuk,169,"Tvelt van dien verraderen heden,"
Onbekend,Onbekend Hoofdstuk,170,"Diet begonnen ende bereden,"
Onbekend,Onbekend Hoofdstuk,171,Daer ic dus bi bedrogen was ende ben;
Onbekend,Onbekend Hoofdstuk,172,"Ya en hebbense al versworen hen,"
Onbekend,Onbekend Hoofdstuk,173,Die coninge die mi heden sworen.
Onbekend,Onbekend Hoofdstuk,174,"Dus beriet Sornagur te voren,"
Onbekend,Onbekend Hoofdstuk,175,Die valsche verradere di[e] quaet es.
Onbekend,Onbekend Hoofdstuk,176,"Nu wetti wel ende sijt gewes,"
Onbekend,Onbekend Hoofdstuk,177,"Dat quaet die wet es die hi heeft,"
Onbekend,Onbekend Hoofdstuk,178,Ende valsche trouwe die hi geeft.
Onbekend,Onbekend Hoofdstuk,179,Valschelike heeft hi gelogen:
Onbekend,Onbekend Hoofdstuk,180,"Dus comt dat ic ben bedrogen."""
Onbekend,Onbekend Hoofdstuk,181,Sornagur [hevet dese wort]
Onbekend,Onbekend Hoofdstuk,182,Ende dese clage wel gehort.
Onbekend,Onbekend Hoofdstuk,183,"Hine mocht den lachter niet gedogen,"
Onbekend,Onbekend Hoofdstuk,184,Diemen hem sprac vor sinen ogen.
Onbekend,Onbekend Hoofdstuk,185,"Sijn hoeft ontwapendi te hant,"
Onbekend,Onbekend Hoofdstuk,186,"Ende nam tswert bi den orde in de hant,"
Onbekend,Onbekend Hoofdstuk,187,Ende liet den appel neder hangen:
Onbekend,Onbekend Hoofdstuk,188,Dus quam hi vor den coninc gegangen.
Onbekend,Onbekend Hoofdstuk,189,Dor genade ende dor vrede
Onbekend,Onbekend Hoofdstuk,190,"Dede hi dese omoedichede,"
Onbekend,Onbekend Hoofdstuk,191,Ende viel den coninc te sinen voeten
Onbekend,Onbekend Hoofdstuk,192,Met sconen worden ende met soeten.
Onbekend,Onbekend Hoofdstuk,193,"""Here coninc,"" seide hi, ""genade dor Got!"
Onbekend,Onbekend Hoofdstuk,194,Met minen live doet al u gebot.
Onbekend,Onbekend Hoofdstuk,195,"Siet hier, mijn swert hebbic getrect,"
Onbekend,Onbekend Hoofdstuk,196,"Mijn hooft hebbic u gerect,"
Onbekend,Onbekend Hoofdstuk,197,Nu doet uwen wille met mi.
Onbekend,Onbekend Hoofdstuk,198,In welken soet comen si
Onbekend,Onbekend Hoofdstuk,199,"Met Parthonopeuse uwen neve,"
Onbekend,Onbekend Hoofdstuk,200,"Of hi doet si of hi leve,"
Onbekend,Onbekend Hoofdstuk,201,"Dan en es bi gere dinc gesciet,"
Onbekend,Onbekend Hoofdstuk,202,Die ic daer toe dede ofte riet.
Onbekend,Onbekend Hoofdstuk,203,"Ic ben gereet, mocht u genogen,"
Onbekend,Onbekend Hoofdstuk,204,"Ens uwe man over een drogen,"
Onbekend,Onbekend Hoofdstuk,205,"Te done mine onsculdenesse,"
Onbekend,Onbekend Hoofdstuk,206,"Ende to dogene sulc vonnesse,"
Onbekend,Onbekend Hoofdstuk,207,"Mocht sijn bi uwen love,"
Onbekend,Onbekend Hoofdstuk,208,"Alsmen sal vinden in uwen hove,"
Onbekend,Onbekend Hoofdstuk,209,Comet te vromen of te scaden.
Onbekend,Onbekend Hoofdstuk,210,"En wildijs mi oec niet gestaden,"
Onbekend,Onbekend Hoofdstuk,211,"Siet hier mijn swert, richt over mi,"
Onbekend,Onbekend Hoofdstuk,212,"Also alst u bequamelijc si."""
Onbekend,Onbekend Hoofdstuk,213,Die coninc nam bi der hulten tswert.
Onbekend,Onbekend Hoofdstuk,214,"""Na dien,"" seit hi, ""dat gi dus geert"
Onbekend,Onbekend Hoofdstuk,215,"Ende met oetmode hier comen sijt,"
Onbekend,Onbekend Hoofdstuk,216,"Al dragic tuwert groten nijt,"
Onbekend,Onbekend Hoofdstuk,217,Ic wille gerne [wesen] genadech.
Onbekend,Onbekend Hoofdstuk,218,"Al waerdi vele meer mesdadech,"
Onbekend,Onbekend Hoofdstuk,219,"Mi donke wel an u gelaet,"
Onbekend,Onbekend Hoofdstuk,220,"Dat gi sijt onsculdich derre daet,"
Onbekend,Onbekend Hoofdstuk,221,Ende u int herte e[s vele l]eet
Onbekend,Onbekend Hoofdstuk,222,"Onse scade ende [onse] leet."""
Onbekend,Onbekend Hoofdstuk,223,Doen antworden die Sarrasijn:
Onbekend,Onbekend Hoofdstuk,224,"""Her coninc, gi moget wel seker sijn"
Onbekend,Onbekend Hoofdstuk,225,"Ende nu wel gelovet dies,"
Onbekend,Onbekend Hoofdstuk,226,"Dat mi vele leet es u verlies,"
Onbekend,Onbekend Hoofdstuk,227,Ende ic herde ben verraden
Onbekend,Onbekend Hoofdstuk,228,Tonsen lachtere ende tonser scaden.
Onbekend,Onbekend Hoofdstuk,229,"Nu hort, ic seg u die mi verriet."
Onbekend,Onbekend Hoofdstuk,230,"Al dunket u lanc, en vernoye u niet,"
Onbekend,Onbekend Hoofdstuk,231,"Mi heeft verraden een mijn knecht,"
Onbekend,Onbekend Hoofdstuk,232,Die wel gewracht heeft na recht;
Onbekend,Onbekend Hoofdstuk,233,"Want het was een dorpers sone,"
Onbekend,Onbekend Hoofdstuk,234,"Ende dede als dorpere es gewone,"
Onbekend,Onbekend Hoofdstuk,235,"Dats die oude grave Mares,"
Onbekend,Onbekend Hoofdstuk,236,"Die hoge bi mi getreden es,"
Onbekend,Onbekend Hoofdstuk,237,Die ontwaert was ende harde quaet
Onbekend,Onbekend Hoofdstuk,238,Eer icken dede ane minen raet.
Onbekend,Onbekend Hoofdstuk,239,"Hi was oec scalc in allen s[aken],"
Onbekend,Onbekend Hoofdstuk,240,Beide in dienste ende in sp[raken]:
Onbekend,Onbekend Hoofdstuk,241,Omme mine vrome pogede hi.
Onbekend,Onbekend Hoofdstuk,242,"So soete was hi jegen mi,"
Onbekend,Onbekend Hoofdstuk,243,"So oemoedich, so gemate,"
Onbekend,Onbekend Hoofdstuk,244,Dat icken maecte mijn drossate.
Onbekend,Onbekend Hoofdstuk,245,"Doen wart hi minen mannen vreet,"
Onbekend,Onbekend Hoofdstuk,246,"Ende dede hem vernoy ende leet,"
Onbekend,Onbekend Hoofdstuk,247,"Ende crincte tgerechte van den lande,"
Onbekend,Onbekend Hoofdstuk,248,"Ende dede hem lachter ende scande,"
Onbekend,Onbekend Hoofdstuk,249,"Menege overde ende scade,"
Onbekend,Onbekend Hoofdstuk,250,"Ende seide, het ware bi minen rade."
Onbekend,Onbekend Hoofdstuk,251,Hier bi maecte hi mi onthout
Onbekend,Onbekend Hoofdstuk,252,Al mine liede jonc ende out.
Onbekend,Onbekend Hoofdstuk,253,"Als ic der waerheit al gelie,"
Onbekend,Onbekend Hoofdstuk,254,"Har negeen en was so cone nie,"
Onbekend,Onbekend Hoofdstuk,255,Dat hi mi oyt van heme seide
Onbekend,Onbekend Hoofdstuk,256,Sonder ere ende hovescheide.
Onbekend,Onbekend Hoofdstuk,257,"Dat hise wrogede ende was hem fel,"
Onbekend,Onbekend Hoofdstuk,258,Dat prijsdic ende bequam mi wel.
Onbekend,Onbekend Hoofdstuk,259,Over rinc en haddic el gene
Onbekend,Onbekend Hoofdstuk,260,"Mire man sonder hen allene,"
Onbekend,Onbekend Hoofdstuk,261,"Ende gaf hem een edel wijf,"
Onbekend,Onbekend Hoofdstuk,262,Dies onwert [wa]s sijn bose lijf.
Onbekend,Onbekend Hoofdstuk,263,"Dus maectickene palensgrave,"
Onbekend,Onbekend Hoofdstuk,264,Daer mi lachter es comen ave.
Onbekend,Onbekend Hoofdstuk,265,"Heden, alse hi soude plegen"
Onbekend,Onbekend Hoofdstuk,266,"Mier eren, heeft hi vort gedregen"
Onbekend,Onbekend Hoofdstuk,267,"Minen lachter, so dat ic bi hem"
Onbekend,Onbekend Hoofdstuk,268,Valsch verradere gescouden ben:
Onbekend,Onbekend Hoofdstuk,269,Dies benic erre ende harde onvroe.
Onbekend,Onbekend Hoofdstuk,270,"Edel coninc, ocht comen es soe,"
Onbekend,Onbekend Hoofdstuk,271,"Dat die grave van Blois verslagen si,"
Onbekend,Onbekend Hoofdstuk,272,"Richt u te hant over mi,"
Onbekend,Onbekend Hoofdstuk,273,"Ic give u op lijf ende lede,"
Onbekend,Onbekend Hoofdstuk,274,Te doen al uwen wille daer mede.
Onbekend,Onbekend Hoofdstuk,275,Over dat verlies heeft dese grave
Onbekend,Onbekend Hoofdstuk,276,Enen coninc over enen grave.
Onbekend,Onbekend Hoofdstuk,277,"Wildi mi oec laten leven,"
Onbekend,Onbekend Hoofdstuk,278,"In wille u nemmermer begeven,"
Onbekend,Onbekend Hoofdstuk,279,"Ende werde u man eygenlike,"
Onbekend,Onbekend Hoofdstuk,280,Ende wille u emmer getruwelike
Onbekend,Onbekend Hoofdstuk,281,"Dienen in Parthonopeus stat,"
Onbekend,Onbekend Hoofdstuk,282,"Ende sekeren ende giselen dat,"
Onbekend,Onbekend Hoofdstuk,283,Also gelijc alst daertoe staet.
Onbekend,Onbekend Hoofdstuk,284,"Dor God nu hebt goeden raet."""
Onbekend,Onbekend Hoofdstuk,285,Doen antwerde die coninc van Vrancrike
Onbekend,Onbekend Hoofdstuk,286,Sornagure wel soetelike:
Onbekend,Onbekend Hoofdstuk,287,"""Ic en gere,"" seit hi, ""geen ander wrake,"
Onbekend,Onbekend Hoofdstuk,288,"So hoe comen si die sake,"
Onbekend,Onbekend Hoofdstuk,289,Maer dat gi wert mijn gelijc man
Onbekend,Onbekend Hoofdstuk,290,"Ende met trouwen wese dan,"
Onbekend,Onbekend Hoofdstuk,291,"Sonder beraet ende sonder wanc."""
Onbekend,Onbekend Hoofdstuk,292,Dies wisten sine man danc.
Onbekend,Onbekend Hoofdstuk,293,Alle die horden dese tale
Onbekend,Onbekend Hoofdstuk,294,"Prijsdens Sornagure wale,"
Onbekend,Onbekend Hoofdstuk,295,"Ende seiden, hi ware lovelijc"
Onbekend,Onbekend Hoofdstuk,296,"Ende in sire wet wel redelijc,"
Onbekend,Onbekend Hoofdstuk,297,Ende onsculdech van derre daet:
Onbekend,Onbekend Hoofdstuk,298,Dat ware kinlec an sijn gelaet.
Onbekend,Onbekend Hoofdstuk,299,"Doen dede Sornagur die soene,"
Onbekend,Onbekend Hoofdstuk,300,Die hi selve boet te doene.
Onbekend,Onbekend Hoofdstuk,301,Sine manscap die coninc ontfinc.
Onbekend,Onbekend Hoofdstuk,302,Do was hi comen te hoger dinc.
Onbekend,Onbekend Hoofdstuk,303,"Alse die soeninge was gedaen,"
Onbekend,Onbekend Hoofdstuk,304,"Die heren ontwapenden hem saen,"
Onbekend,Onbekend Hoofdstuk,305,"Ende die coninc beval den heren,"
Onbekend,Onbekend Hoofdstuk,306,Dat si souden dienen met eren
Onbekend,Onbekend Hoofdstuk,307,"Sornagur, dies wert was wale,"
Onbekend,Onbekend Hoofdstuk,308,"Ende plegen sijns met scoender tale,"
Onbekend,Onbekend Hoofdstuk,309,Met smekingen ende met spele.
Onbekend,Onbekend Hoofdstuk,310,"Si dadent, maer dies en was niet vele."
Onbekend,Onbekend Hoofdstuk,311,Ho soude ieman met andren mogen
Onbekend,Onbekend Hoofdstuk,312,"Bliscap hebben ende hogen,"
Onbekend,Onbekend Hoofdstuk,313,Die selve had int herte toren?
Onbekend,Onbekend Hoofdstuk,314,"Om Parthonopeus, die was verloren,"
Onbekend,Onbekend Hoofdstuk,315,"Hadden si alle so droven sin,"
Onbekend,Onbekend Hoofdstuk,316,Dat si plagen Sornagurs te min.
Onbekend,Onbekend Hoofdstuk,317,Dies nachts waren die Fransose
Onbekend,Onbekend Hoofdstuk,318,"Met groten rouwe binnen Pontose,"
Onbekend,Onbekend Hoofdstuk,319,"Met groten wenne, met groter clage."
Onbekend,Onbekend Hoofdstuk,320,Smorgens vroech metten dage
Onbekend,Onbekend Hoofdstuk,321,[...............]
