author,chapter,line,text
Onbekend,PARTHONOPEUS.,1,
Onbekend,PARTHONOPEUS.,2,I
Onbekend,PARTHONOPEUS.,3,
Onbekend,PARTHONOPEUS.,4,[............]
Onbekend,PARTHONOPEUS.,5,[............]
Onbekend,PARTHONOPEUS.,6,"Die coninc van Troyen hiet Priamus,"
Onbekend,PARTHONOPEUS.,7,Sinen name vinden wi bescreven dus.
Onbekend,PARTHONOPEUS.,8,Hi hadde ghewonnen sone vive
Onbekend,PARTHONOPEUS.,9,Bi Ecubene sinen wive:
Onbekend,PARTHONOPEUS.,5,"Dien sterken Ectore ende Parise,"
Onbekend,PARTHONOPEUS.,11,"Troylus, Heleine, Marcomirise;"
Onbekend,PARTHONOPEUS.,12,Dus hieten si als ic u noeme.
Onbekend,PARTHONOPEUS.,13,"Van hem allen was Ector bloeme,"
Onbekend,PARTHONOPEUS.,14,"Staerc, hovesch, groot ende vroet,"
Onbekend,PARTHONOPEUS.,10,"Te wapenen behendich ende goet,"
Onbekend,PARTHONOPEUS.,16,Hi was spelen van svader rike;
Onbekend,PARTHONOPEUS.,17,Men vant doen niewer sijn ghelike.
Onbekend,PARTHONOPEUS.,18,"Priamus was harde rike,"
Onbekend,PARTHONOPEUS.,19,Ende hilt harde vroedelike
Onbekend,PARTHONOPEUS.,15,Sonder zorghe ende sonder vaer
Onbekend,PARTHONOPEUS.,21,Tlant van Asyen menich iaer;
Onbekend,PARTHONOPEUS.,22,"Ende noch langher haddi tghehouden,"
Onbekend,PARTHONOPEUS.,23,"Maer als hi quam te siner ouden,"
Onbekend,PARTHONOPEUS.,24,"Ende sine kinder tharen daghen,"
Onbekend,PARTHONOPEUS.,20,"Ende si der wapenen plaghen,"
Onbekend,PARTHONOPEUS.,26,Was hem sijn rike ende sijn goet
Onbekend,PARTHONOPEUS.,27,"Ghewassen, ende hem wies sijn moet,"
Onbekend,PARTHONOPEUS.,28,"Ende die overmoede wies hem an,"
Onbekend,PARTHONOPEUS.,29,Dat hi ontkeerde ieghen sine man
Onbekend,PARTHONOPEUS.,25,So vele warf om haer scade
Onbekend,PARTHONOPEUS.,31,"Met talen ende met valscen rade,"
Onbekend,PARTHONOPEUS.,32,Dat hi die hoochste van sinen lande
Onbekend,PARTHONOPEUS.,33,Alle maecte sine viande.
Onbekend,PARTHONOPEUS.,34,Die hem te voren waren vrient
Onbekend,PARTHONOPEUS.,30,"Ende ghetrouwelike hadden ghedient,"
Onbekend,PARTHONOPEUS.,36,Moesten hem dienen met bedwanghe.
Onbekend,PARTHONOPEUS.,37,Maer het ne gheduerde niet langhe:
Onbekend,PARTHONOPEUS.,38,"Talreerst dat si stade saghen,"
Onbekend,PARTHONOPEUS.,39,"Ende die Grieken, die om Troyen laghen,"
Onbekend,PARTHONOPEUS.,35,"Jeghen hem setten si hem doe,"
Onbekend,PARTHONOPEUS.,41,Want si hadder grote hulpe toe.
Onbekend,PARTHONOPEUS.,42,Die coninc van Troyen heeft verheven
Onbekend,PARTHONOPEUS.,43,Enen vondelinc ende hadde hem ghegheven
Onbekend,PARTHONOPEUS.,44,Tgherechte van al den conincrike;
Onbekend,PARTHONOPEUS.,40,Hi trackene wel gheweldelike
Onbekend,PARTHONOPEUS.,46,"Boven alle sine hoghe baroene,"
Onbekend,PARTHONOPEUS.,47,Des hem niet bestoet te doene;
Onbekend,PARTHONOPEUS.,48,Anchises was hi gheheten.
Onbekend,PARTHONOPEUS.,49,Teerst dat Troyen was beseten[....]
Onbekend,PARTHONOPEUS.,50,[............]
Onbekend,PARTHONOPEUS.,45,Van groten scatte was so[e ghevult].
Onbekend,PARTHONOPEUS.,52,Ghine saecht noyt no sien [en sult]
Onbekend,PARTHONOPEUS.,53,Stat ghevisiert so wale;
Onbekend,PARTHONOPEUS.,54,Daer stoet in meneghe scone [sale]
Onbekend,PARTHONOPEUS.,55,Daer woonde in menech scoo[n seriant]
Onbekend,PARTHONOPEUS.,50,"Ende scone vrouwen ende ach[emant],"
Onbekend,PARTHONOPEUS.,57,"Menech ridder van hoghen [prijs],"
Onbekend,PARTHONOPEUS.,58,Tote dien dat ghelievede [Parijs]
Onbekend,PARTHONOPEUS.,59,Dat hi quam bi Venus [rade]
Onbekend,PARTHONOPEUS.,60,"In sconincs van Grieken keme[nade],"
Onbekend,PARTHONOPEUS.,55,"Ende hi hem sijn wijf ontf[oerde,"
Onbekend,PARTHONOPEUS.,62,"Daer hi al Troyen bi ver[stoerde],"
Onbekend,PARTHONOPEUS.,63,Als men daer ave vint bescre[ven].
Onbekend,PARTHONOPEUS.,64,"Dat emmer waer te wrekene [bleven],"
Onbekend,PARTHONOPEUS.,65,Hadde Priamus te vriende ghe[houden]
Onbekend,PARTHONOPEUS.,60,Die hem met rechte helpen so[uden].
Onbekend,PARTHONOPEUS.,67,[Maer] door [die] overmoedichede
Onbekend,PARTHONOPEUS.,68,"Die hi dede ende die hi sede,"
Onbekend,PARTHONOPEUS.,69,"Ende door siere kinder over[daet],"
Onbekend,PARTHONOPEUS.,70,Ende hi Anchisesse den groten q[uaet]
Onbekend,PARTHONOPEUS.,65,"Verhief bi hem door sinen sc[at],"
Onbekend,PARTHONOPEUS.,72,Daer omme worden hem eerst godsat
Onbekend,PARTHONOPEUS.,73,"Van den rike sijn hoochste man,"
Onbekend,PARTHONOPEUS.,74,Daer hi vernoy groot af ghew[an].
Onbekend,PARTHONOPEUS.,75,Menelaus was een lustich man
Onbekend,PARTHONOPEUS.,70,"Ende ghesinnich, daer wan hi an."
Onbekend,PARTHONOPEUS.,77,Hem diende harde gheweldelike
Onbekend,PARTHONOPEUS.,78,Van Grieken al sijn conincrike.
Onbekend,PARTHONOPEUS.,79,Meneghen dach leedi droev[ich lijf]
Onbekend,PARTHONOPEUS.,80,Dat hem Parijs sijn scone w[ijf]
Onbekend,PARTHONOPEUS.,75,Ontvoerde so overmoedelike.
Onbekend,PARTHONOPEUS.,82,Hi wiste wel dat den conincrike
Onbekend,PARTHONOPEUS.,83,Van Troyen grote cracht to[ehoorde];
Onbekend,PARTHONOPEUS.,84,"Van der stat hi dat wel hoo[rde],"
Onbekend,PARTHONOPEUS.,85,Dat het ware die vastste ve[ste]
Onbekend,PARTHONOPEUS.,80,"Die doe was iewers entie be[ste],"
Onbekend,PARTHONOPEUS.,87,Ende hine dors ghene wrake [aengaen]
Onbekend,PARTHONOPEUS.,88,Van den lachter die hem was [ghedaen].
Onbekend,PARTHONOPEUS.,89,Dies hi groten rouwe nam
Onbekend,PARTHONOPEUS.,90,"Tote dien dat Nestor totem [quam],"
Onbekend,PARTHONOPEUS.,85,Die hem was van herten hout;
Onbekend,PARTHONOPEUS.,92,"Hi was meer dan .C. iaer [out],"
Onbekend,PARTHONOPEUS.,93,"Ende was sconincs ghesekerde vr[ient],"
Onbekend,PARTHONOPEUS.,94,Ende hem haddi dicken wel ghedi[ent].
Onbekend,PARTHONOPEUS.,95,[............]
Onbekend,PARTHONOPEUS.,96,"[D]an eneghe rudder van den rike,"
Onbekend,PARTHONOPEUS.,90,"[E]nde voere toe ghenendelike,"
Onbekend,PARTHONOPEUS.,98,[W]ant hem mesquam die overdaet.
Onbekend,PARTHONOPEUS.,99,"[H]i hadde van Grieken al den raet,"
Onbekend,PARTHONOPEUS.,100,[E]nde peinsede om slandes ere;
Onbekend,PARTHONOPEUS.,101,"[S]o verre troosti sinen here,"
Onbekend,PARTHONOPEUS.,95,[D]at hi sinen lachter soude wreken.
Onbekend,PARTHONOPEUS.,103,"[B]i sinen rade, bi sinen treken"
Onbekend,PARTHONOPEUS.,104,[V]erwaerf hi dat hi sconincs man
Onbekend,PARTHONOPEUS.,105,[G]hewillich alle daer toe ghewan.
Onbekend,PARTHONOPEUS.,106,Doe sente[n] die coninc ute
Onbekend,PARTHONOPEUS.,100,"Met zeghele en met salute,"
Onbekend,PARTHONOPEUS.,108,[D]ie talden hoochsten soude varen
Onbekend,PARTHONOPEUS.,109,[D]ie onder den coninc [van] Troyen waren:
Onbekend,PARTHONOPEUS.,110,"[A]lle[n] de[n] coninghen ende den graven,"
Onbekend,PARTHONOPEUS.,111,[S]endi scone rike haven
Onbekend,PARTHONOPEUS.,105,"[B]eede van selvere ende van goude,"
Onbekend,PARTHONOPEUS.,113,[E]nde omboot hem datti hem woude
Onbekend,PARTHONOPEUS.,114,"[S]ekeren ende haer vrede houden,"
Onbekend,PARTHONOPEUS.,115,"[I]ndien datsi sine vriende wesen souden,"
Onbekend,PARTHONOPEUS.,116,[E]nde hi hem vaste ghiselinghe
Onbekend,PARTHONOPEUS.,110,[W]oude doen ende sekeringhe.
Onbekend,PARTHONOPEUS.,118,[D]us trac hi den coninc van Troyen af
Onbekend,PARTHONOPEUS.,119,"[B]i den groten giften die hi hem gaf,"
Onbekend,PARTHONOPEUS.,120,"[E]nde hi se hiet te houdene vri,"
Onbekend,PARTHONOPEUS.,121,"[D]ie van Indie entie van Persi,"
Onbekend,PARTHONOPEUS.,115,"[D]ie Crinule entie Mediene,"
Onbekend,PARTHONOPEUS.,123,"[Die v]an Capadocien entie Libiene,"
Onbekend,PARTHONOPEUS.,124,[D]ie Priamuse waren onderdaen.
Onbekend,PARTHONOPEUS.,125,"[T]alreerst dat men hem dede verstaen,"
Onbekend,PARTHONOPEUS.,126,"[D]at haer heren in warre waren,"
Onbekend,PARTHONOPEUS.,120,"[D]aren sijs ieghen hem openbaren,"
Onbekend,PARTHONOPEUS.,128,[E]nde makede[n] ieghen hem een ghespan;
Onbekend,PARTHONOPEUS.,129,[D]us verloos hi vele sier man.
Onbekend,PARTHONOPEUS.,130,"[A]ls men te Troyen vreescede dat,"
Onbekend,PARTHONOPEUS.,131,"[H]ector, die troost was van al der stat,"
Onbekend,PARTHONOPEUS.,125,[V]oer oestwaert ende ghewan hier ieghen
Onbekend,PARTHONOPEUS.,133,"[W]el meneghen goeden swerddeghen,"
Onbekend,PARTHONOPEUS.,134,"[D]ie lieten haer lant ende haer rike,"
Onbekend,PARTHONOPEUS.,135,[E]nde holpen hem ghetrouwelike
Onbekend,PARTHONOPEUS.,136,[.X.]iaer houden die vaste stat
Onbekend,PARTHONOPEUS.,130,[J]eghen tgriecsce here dat daer omme sat.
Onbekend,PARTHONOPEUS.,138,"[I]nt .Xe. iaer bleef Ector doot,"
Onbekend,PARTHONOPEUS.,139,[D]at was den sinen scade groot.
Onbekend,PARTHONOPEUS.,140,[............]
Onbekend,PARTHONOPEUS.,141,"[...... Anchises, daer ic u]"
Onbekend,PARTHONOPEUS.,142,"Af telde dat hi verriet,"
Onbekend,PARTHONOPEUS.,143,"Entie Grieken bij nachte inliet,"
Onbekend,PARTHONOPEUS.,135,"Dese[n] hadde die coninc verheven,"
Onbekend,PARTHONOPEUS.,145,"Ende hadde hem groot ghewelt ghegheven,"
Onbekend,PARTHONOPEUS.,146,Ende ghewout. Van .I. vondeline
Onbekend,PARTHONOPEUS.,147,"Sint dat hi quam te hogher dinc,"
Onbekend,PARTHONOPEUS.,148,"Was hi den besten wreet ende fel,"
Onbekend,PARTHONOPEUS.,140,"Ende diende sinen here niewaer af el,"
Onbekend,PARTHONOPEUS.,150,Maer datti hem gaderde scat.
Onbekend,PARTHONOPEUS.,151,Hier bi werden si eerst ghehat
Onbekend,PARTHONOPEUS.,152,"Die coninc Priamus entie sine,"
Onbekend,PARTHONOPEUS.,153,Als dien van Troyen es in scine.
Onbekend,PARTHONOPEUS.,145,Den hoochsten tor enten besten
Onbekend,PARTHONOPEUS.,155,"Hilt Anchises van al der vesten,"
Onbekend,PARTHONOPEUS.,156,Ende eene poorte valscelike;
Onbekend,PARTHONOPEUS.,157,Want hi bi nachte verholenlike
Onbekend,PARTHONOPEUS.,158,"Hilt [metten] Grieken een paerlement,"
Onbekend,PARTHONOPEUS.,150,Ende maecten ieghen hem een covent
Onbekend,PARTHONOPEUS.,160,Also als hijt selve verachte:
Onbekend,PARTHONOPEUS.,161,"Dat hi se inlaten soude bi nachte,"
Onbekend,PARTHONOPEUS.,162,"Bi sulker spraken, dat si souden"
Onbekend,PARTHONOPEUS.,163,Haer lijf ende haer goet behouden
Onbekend,PARTHONOPEUS.,155,"Hi ende alle die mettem waren,"
Onbekend,PARTHONOPEUS.,165,Ende uut met vreden souden varen.
Onbekend,PARTHONOPEUS.,166,Dus liet hise in als sijt bespraken;
Onbekend,PARTHONOPEUS.,167,Tere poorten si bi nachte traken.
Onbekend,PARTHONOPEUS.,168,Doen ghinghen si bernen ende slaen
Onbekend,PARTHONOPEUS.,160,"Ende vanghen dat si wilden vaen,"
Onbekend,PARTHONOPEUS.,170,Ende scorden die scone stat.
Onbekend,PARTHONOPEUS.,171,Anchises wiste sconincs scat
Onbekend,PARTHONOPEUS.,172,Ende dedene tsinen scepe draghen.
Onbekend,PARTHONOPEUS.,173,Alle die gone die sijns plaghen
Onbekend,PARTHONOPEUS.,165,"Rumeden die stat met ghenaden,"
Onbekend,PARTHONOPEUS.,175,Want hijt te voren hadde beraden.
Onbekend,PARTHONOPEUS.,176,"Daer bleef doot menech moederbaren,"
Onbekend,PARTHONOPEUS.,177,Daer ontfoer diere mochte ontfaren.
Onbekend,PARTHONOPEUS.,178,Daer bleef ghesleghen Priamus
Onbekend,PARTHONOPEUS.,170,Ende Parijs sijn sone ende Troylus.
Onbekend,PARTHONOPEUS.,180,Noch toe behilt Helein sijn lijf;
Onbekend,PARTHONOPEUS.,181,Sijn broederkijn gheprant een wijf
Onbekend,PARTHONOPEUS.,182,"Uter wieghen daert in lach,"
Onbekend,PARTHONOPEUS.,183,"Ende droecht wech, dats niemen sach."
Onbekend,PARTHONOPEUS.,175,Te Anchises scepe soere mede vlo
Onbekend,PARTHONOPEUS.,185,Ende behilt dat kint also.
Onbekend,PARTHONOPEUS.,186,
Onbekend,PARTHONOPEUS.,187,II
Onbekend,PARTHONOPEUS.,188,
Onbekend,PARTHONOPEUS.,189,[............]
Onbekend,PARTHONOPEUS.,190,[............]
Onbekend,PARTHONOPEUS.,191,"Daer men vele af mach tellen,"
Onbekend,PARTHONOPEUS.,192,"Ghinc hi te scepe met sinen ghesellen,"
Onbekend,PARTHONOPEUS.,193,"Ende met hem sijn sone Eneas,"
Onbekend,PARTHONOPEUS.,180,Die der verranesse onsculdich was;
Onbekend,PARTHONOPEUS.,195,Men waende ende seide datti ware
Onbekend,PARTHONOPEUS.,196,"Sijn sone, maer ic hebt ommare."
Onbekend,PARTHONOPEUS.,197,"Bedi Eneas was .I. ridder goet,"
Onbekend,PARTHONOPEUS.,198,"Hovesch ende vroet ende wel ghemoet,"
Onbekend,PARTHONOPEUS.,185,"Niet verradere, ende goedertiere;"
Onbekend,PARTHONOPEUS.,200,Anchises fel ende quadertiere
Onbekend,PARTHONOPEUS.,201,"Ende ghierech up have in allen tiden,"
Onbekend,PARTHONOPEUS.,202,Ende verradere in allen siden;
Onbekend,PARTHONOPEUS.,203,"Ende nien mach men ghelooven wel,"
Onbekend,PARTHONOPEUS.,190,Dat .I. so boos ende so scalc ende so fel
Onbekend,PARTHONOPEUS.,205,Soude winnen so goet een kint.
Onbekend,PARTHONOPEUS.,206,"Nadien dat men ghescreven vint,"
Onbekend,PARTHONOPEUS.,207,Hebbics proeve ende besceet ghenoech
Onbekend,PARTHONOPEUS.,208,Dat quaet boom noyt goede vrucht droech.
Onbekend,PARTHONOPEUS.,195,"Anchises voer wech ende Eneas,"
Onbekend,PARTHONOPEUS.,210,"Die hem harde onghelijc was,"
Onbekend,PARTHONOPEUS.,211,"Ende hi besochte harde menech eilant,"
Onbekend,PARTHONOPEUS.,212,Die hem te voren waren ombekant.
Onbekend,PARTHONOPEUS.,213,"So langhe dwaelden si up die zee,"
Onbekend,PARTHONOPEUS.,200,"In meneghen reghen, in meneghe snee,"
Onbekend,PARTHONOPEUS.,215,Dat si aen Romenie landen.
Onbekend,PARTHONOPEUS.,216,"Dat ghewonsi in hare handen,"
Onbekend,PARTHONOPEUS.,217,Theerscap al ende die voghedie
Onbekend,PARTHONOPEUS.,218,"Bin den lande van Romenie,"
Onbekend,PARTHONOPEUS.,205,Ende al de omsaten die hem bi
Onbekend,PARTHONOPEUS.,220,Gheseten waren sconfierden si.
Onbekend,PARTHONOPEUS.,221,Die voestermoeder was wel bedacht
Onbekend,PARTHONOPEUS.,222,Dat soe tkint daer hadde bracht.
Onbekend,PARTHONOPEUS.,223,Soe seide dat haer sone ware;
Onbekend,PARTHONOPEUS.,210,Want soe was altoes in vare
Onbekend,PARTHONOPEUS.,225,"Dattene Anchises soude verslaen,"
Onbekend,PARTHONOPEUS.,226,Die de verranesse hadde ghedaen
Onbekend,PARTHONOPEUS.,227,Jeghen den coninc sinen vader
Onbekend,PARTHONOPEUS.,228,"Ende ieghen die gone al gader,"
Onbekend,PARTHONOPEUS.,215,Die hem hout ende hulpich waren.
Onbekend,PARTHONOPEUS.,230,"Als tkint quam te sinen .XV. iaren,"
Onbekend,PARTHONOPEUS.,231,"Waest so scone van sinen daghen,"
Onbekend,PARTHONOPEUS.,232,Dat sine prijsden alle diene saghen:
Onbekend,PARTHONOPEUS.,233,"Scone was [hi] ende bequamelijc,"
Onbekend,PARTHONOPEUS.,220,"Hector, Parise haddi ghelijc."
Onbekend,PARTHONOPEUS.,235,[............]
Onbekend,PARTHONOPEUS.,236,Doe ne dorste soe niet in sine ghenaden
Onbekend,PARTHONOPEUS.,237,"Bliven, ende als sijs hadden staden,"
Onbekend,PARTHONOPEUS.,238,Ontfloen si hem te Monde Jou wart;
Onbekend,PARTHONOPEUS.,239,"Ende alse Anchises gheware wart,"
Onbekend,PARTHONOPEUS.,225,"Dedi hem te berghe volghen naer,"
Onbekend,PARTHONOPEUS.,241,Ende si ontfoeren sine wisten waer.
Onbekend,PARTHONOPEUS.,242,So langhe ghinghen si over berch ende over dal
Onbekend,PARTHONOPEUS.,243,"(Dies ic vele achter laten sal),"
Onbekend,PARTHONOPEUS.,244,Dat si in Vrankerike beede te samen
Onbekend,PARTHONOPEUS.,230,Met vernoy ende met pinen quamen.
Onbekend,PARTHONOPEUS.,246,"Dat lant hiet tien tiden Galle,"
Onbekend,PARTHONOPEUS.,247,Dat goede voeren niet wist alle.
Onbekend,PARTHONOPEUS.,248,Ic seggu dat men in dat lant
Onbekend,PARTHONOPEUS.,249,Tien tiden gheene vesten vant;
Onbekend,PARTHONOPEUS.,235,Daer ne stoet in borch no casteel.
Onbekend,PARTHONOPEUS.,251,Van Vrankerike was doe tmeeste deel
Onbekend,PARTHONOPEUS.,252,Woestine ende wout ende velt.
Onbekend,PARTHONOPEUS.,253,Over tvolc en hadde niemen ghewelt;
Onbekend,PARTHONOPEUS.,254,"Het woonde ghespreet bi .III., bi .I.;"
Onbekend,PARTHONOPEUS.,240,"Daer ne was coninc, no grave gheen"
Onbekend,PARTHONOPEUS.,256,Daer tlant bi bedwonghen stoet:
Onbekend,PARTHONOPEUS.,257,Elkerlijc was here over sijn goet.
Onbekend,PARTHONOPEUS.,258,Die voestermoeder [van] Marcomiris
Onbekend,PARTHONOPEUS.,259,Bleef doot in de gheborte van Parijs.
Onbekend,PARTHONOPEUS.,245,Doen dede hise bar[n]en als hi sach
Onbekend,PARTHONOPEUS.,261,Dat men daer in den lande plach.
Onbekend,PARTHONOPEUS.,262,"Dus bleef hi wonende in dat lant,"
Onbekend,PARTHONOPEUS.,263,Ende metten besten wart hi bekant.
Onbekend,PARTHONOPEUS.,264,Daer diendi hoofscelike ende wale
Onbekend,PARTHONOPEUS.,250,"So langhe, datti conste die tale."
Onbekend,PARTHONOPEUS.,266,Doen began hi hem tellen algader
Onbekend,PARTHONOPEUS.,267,"Wie hi ware ende hoe sijn vader,"
Onbekend,PARTHONOPEUS.,268,"Die coninc van Troyen, verraden was,"
Onbekend,PARTHONOPEUS.,269,"Ende hoe uut comen was Eneas,"
Onbekend,PARTHONOPEUS.,255,Ende in Ytalien hadde al tlant
Onbekend,PARTHONOPEUS.,271,"Gheconquireert ende in sijn hant,"
Onbekend,PARTHONOPEUS.,272,"Ende comen soude gheweldelike,"
Onbekend,PARTHONOPEUS.,273,"Ende conquireren al Vrankerike,"
Onbekend,PARTHONOPEUS.,274,Ende verscalken tlant met crachte.
Onbekend,PARTHONOPEUS.,260,Men maecter ieghen diere grachte
Onbekend,PARTHONOPEUS.,276,"Ende hoghe mure ende vaste vesten,"
Onbekend,PARTHONOPEUS.,277,Dies socht men raet ende vinc ten besten.
Onbekend,PARTHONOPEUS.,278,"Si stichten borghe ende casteelen,"
Onbekend,PARTHONOPEUS.,279,Daer up torren ende canteelen.
Onbekend,PARTHONOPEUS.,280,[............]
Onbekend,PARTHONOPEUS.,265,Marcomiris liet na sine doet
Onbekend,PARTHONOPEUS.,282,Enen sone die was van prise goet.
Onbekend,PARTHONOPEUS.,283,"Hi was lustich in alle saken,"
Onbekend,PARTHONOPEUS.,284,Gheradech ende vroet in spraken.
Onbekend,PARTHONOPEUS.,285,Daer na Vrankerike verstaerf
Onbekend,PARTHONOPEUS.,270,Op een ende ander menech waerf.
Onbekend,PARTHONOPEUS.,287,"Binnen dien gheviel datter here was een,"
Onbekend,PARTHONOPEUS.,288,So weert wasser nie negheen
Onbekend,PARTHONOPEUS.,289,Van al den anderen daer te voren.
Onbekend,PARTHONOPEUS.,290,"Die[n] hadden die Fransoyse vercoren,"
Onbekend,PARTHONOPEUS.,275,"Bi der doghet die si aen hem saghen,"
Onbekend,PARTHONOPEUS.,292,Dat sine crone daden draghen.
Onbekend,PARTHONOPEUS.,293,"Gheheten was hi Farramont,"
Onbekend,PARTHONOPEUS.,294,Die wart gheweldich namecont;
Onbekend,PARTHONOPEUS.,295,Dat was deerste coninc in Vrankerike.
Onbekend,PARTHONOPEUS.,280,Hi besette bescedenlike
Onbekend,PARTHONOPEUS.,297,"Al sijn recht ende sine[r] baroene,"
Onbekend,PARTHONOPEUS.,298,"Als coninc sculdich was te doene,"
Onbekend,PARTHONOPEUS.,299,"Ende haer coren ende haer vreden,"
Onbekend,PARTHONOPEUS.,300,Ende brochte up alle goede zeden.
Onbekend,PARTHONOPEUS.,285,In vreden hilt hi ende van ghevechte
Onbekend,PARTHONOPEUS.,302,"Al sijn rike ende wel te rechte,"
Onbekend,PARTHONOPEUS.,303,Ende gherne daden si dat hi gheboot.
Onbekend,PARTHONOPEUS.,304,Int .XVIIste. iaer bleef hi doot.
Onbekend,PARTHONOPEUS.,305,
Onbekend,PARTHONOPEUS.,306,"Doen bleef trike sinen sone Ludoene,"
Onbekend,PARTHONOPEUS.,290,Als het sculdich was te doene.
Onbekend,PARTHONOPEUS.,308,"Dat was een coninc onghemint,"
Onbekend,PARTHONOPEUS.,309,Die dogheden en hadde niet een twint;
Onbekend,PARTHONOPEUS.,310,Maer fel was hi ende vol van nide
Onbekend,PARTHONOPEUS.,311,Ende emmer in werren ende in stride
Onbekend,PARTHONOPEUS.,295,Jeghen die hoochste van den lande.
Onbekend,PARTHONOPEUS.,313,Als hem die vremde daden scande
Onbekend,PARTHONOPEUS.,314,Moesti[jt doghen] verholenlike;
Onbekend,PARTHONOPEUS.,315,Dus was beleet doe Vrankerike.
Onbekend,PARTHONOPEUS.,316,Dorpers kindere trac hi voort;
Onbekend,PARTHONOPEUS.,300,Die waren te hove best ghehoort
Onbekend,PARTHONOPEUS.,318,"Ende worden overdadich ende wreet,"
Onbekend,PARTHONOPEUS.,319,Ende daden vernoy ende menich leet
Onbekend,PARTHONOPEUS.,320,Den hoochsten kinderen enten riken.
Onbekend,PARTHONOPEUS.,321,Maer God verledeghese haesteliken
Onbekend,PARTHONOPEUS.,305,"Van dien vernoye, van dien bedwanghe,"
Onbekend,PARTHONOPEUS.,323,Want hi levede harde onlanghe.
Onbekend,PARTHONOPEUS.,324,"Maroveus was coninc daer naer,"
Onbekend,PARTHONOPEUS.,325,Als ons de boec seghet over waer.
Onbekend,PARTHONOPEUS.,326,[............]
Onbekend,PARTHONOPEUS.,327,[............]
Onbekend,PARTHONOPEUS.,328,"Doen waert coninc sijn sone Ghiderijs,"
Onbekend,PARTHONOPEUS.,310,Die nie ghewan lof no prijs;
Onbekend,PARTHONOPEUS.,330,"Met siere felheden hi das verdiende,"
Onbekend,PARTHONOPEUS.,331,Dat hi niemene hilt te vriende.
Onbekend,PARTHONOPEUS.,332,Na dien waert coninc van den rike
Onbekend,PARTHONOPEUS.,333,"Claudes sijn sone, die doghendelike"
Onbekend,PARTHONOPEUS.,315,"Berechte sijn lant, ende sine bede"
Onbekend,PARTHONOPEUS.,335,"Daer onlanghe hem ghestede,"
Onbekend,PARTHONOPEUS.,336,"Dattene bekeerde sente Remijs,"
Onbekend,PARTHONOPEUS.,337,Voordien dat quam sente Denijs;
Onbekend,PARTHONOPEUS.,338,"Hi wart kerstijn bi siere leeringhen,"
Onbekend,PARTHONOPEUS.,320,Ende alle die hi mochte bedwinghen;
Onbekend,PARTHONOPEUS.,340,"Met siere cracht, met siere wijsheit"
Onbekend,PARTHONOPEUS.,341,Ghestaerkedi dat kerstinheit.
Onbekend,PARTHONOPEUS.,342,Ridderscap eerde hi ende minde:
Onbekend,PARTHONOPEUS.,343,"So hi elken beter kinde,"
Onbekend,PARTHONOPEUS.,325,So hi hem dede mere ere.
Onbekend,PARTHONOPEUS.,345,In orloghen was hi here
Onbekend,PARTHONOPEUS.,346,"Altoes ieghen die Sarrasine,"
Onbekend,PARTHONOPEUS.,347,Ende hilt in vreden wel de sine.
Onbekend,PARTHONOPEUS.,348,Hine wilde noyt onthouden
Onbekend,PARTHONOPEUS.,330,Soudenieren die van hem sceden souden;
Onbekend,PARTHONOPEUS.,350,"Maer vremde ridderen hi omboot,"
Onbekend,PARTHONOPEUS.,351,"Ende gaf hem leen ende ghiften groot,"
Onbekend,PARTHONOPEUS.,352,So dat si hem ghewillich waren.
Onbekend,PARTHONOPEUS.,353,Noyt ne moeste van hem varen
Onbekend,PARTHONOPEUS.,335,"Ridder, no seriant [ne]gheen,"
Onbekend,PARTHONOPEUS.,355,Aen anderen here te soekene leen.
Onbekend,PARTHONOPEUS.,356,Die Fransoyse waren tien tiden
Onbekend,PARTHONOPEUS.,357,Verhoevaert harde van ghesmiden
Onbekend,PARTHONOPEUS.,358,"Ende in cleederen bi den here,"
Onbekend,PARTHONOPEUS.,340,Ende al tlant te meerre ere.
Onbekend,PARTHONOPEUS.,360,Ten wapenen waren si behendich;
Onbekend,PARTHONOPEUS.,361,Ende in orloghe harde ghenendich;
Onbekend,PARTHONOPEUS.,362,"Bi hem waertsi ontfruchtet meer,"
Onbekend,PARTHONOPEUS.,363,Dan si te voren worden noyt eer.
Onbekend,PARTHONOPEUS.,345,"Edele cnapen die hovesch waren,"
Onbekend,PARTHONOPEUS.,365,"Die gherne eerlijc hadden ghevaren,"
Onbekend,PARTHONOPEUS.,366,"Tien dat si hovesch waren ende wijs,"
Onbekend,PARTHONOPEUS.,367,"Ende dorpers kindere [die] hadden prijs,"
Onbekend,PARTHONOPEUS.,368,"Die trac hi voort, die makedi rike,"
Onbekend,PARTHONOPEUS.,350,Ende gaf hem sijn goet mildelike;
Onbekend,PARTHONOPEUS.,370,"Want hi was lustich ende vroet,"
Onbekend,PARTHONOPEUS.,371,Ende omoedich ende wel ghemoet.
Onbekend,PARTHONOPEUS.,372,
Onbekend,PARTHONOPEUS.,373,III
Onbekend,PARTHONOPEUS.,374,
Onbekend,PARTHONOPEUS.,375,[............]
Onbekend,PARTHONOPEUS.,376,[............]
Onbekend,PARTHONOPEUS.,377,"Soudic u die canteele loven,"
Onbekend,PARTHONOPEUS.,378,"Gherechte die daer stoeden boven,"
Onbekend,PARTHONOPEUS.,335,Daer ware vele toe te doene:
Onbekend,PARTHONOPEUS.,380,"Some root, some groene,"
Onbekend,PARTHONOPEUS.,381,"Some wit, ende al marberijn,"
Onbekend,PARTHONOPEUS.,382,Die niet en mochte[n] versconet sijn;
Onbekend,PARTHONOPEUS.,383,"Die havene wijt ende so ghedaen,"
Onbekend,PARTHONOPEUS.,360,Datter wel binnen mochte staen
Onbekend,PARTHONOPEUS.,385,"Noch .M. scepe, ofte mee,"
Onbekend,PARTHONOPEUS.,386,"Dat nie ne waert so sterc die zee,"
Onbekend,PARTHONOPEUS.,387,"No so hart verstormt die wint,"
Onbekend,PARTHONOPEUS.,388,Dat hem ghescaden mochte een twint.
Onbekend,PARTHONOPEUS.,365,Omtrent die stat buten mure
Onbekend,PARTHONOPEUS.,390,So ne was [no] borch no huus no scure.
Onbekend,PARTHONOPEUS.,391,"Alse Parthonopeus hadde ghesien,"
Onbekend,PARTHONOPEUS.,392,Hem wonderde wat sijns soude ghescien.
Onbekend,PARTHONOPEUS.,393,"Hine sach el niet noch,"
Onbekend,PARTHONOPEUS.,370,Newaer het dochte hem elfs ghedroch.
Onbekend,PARTHONOPEUS.,395,Doch en sach hire el niet dan goet;
Onbekend,PARTHONOPEUS.,396,Dies ghetroosti hem in sinen moet
Onbekend,PARTHONOPEUS.,397,Dat hi te min dies was vervaert.
Onbekend,PARTHONOPEUS.,398,Metten sporen noopti sijn paert.
Onbekend,PARTHONOPEUS.,375,"Met desen peinsen, met desen reden"
Onbekend,PARTHONOPEUS.,400,Quam hi toter poorten ghereden.
Onbekend,PARTHONOPEUS.,401,"Een tor boven der poorten stont,"
Onbekend,PARTHONOPEUS.,402,Die hadde ghecost menich pont.
Onbekend,PARTHONOPEUS.,403,"Hi was van clenen marberstene,"
Onbekend,PARTHONOPEUS.,380,Ende [wit] ghelijc yvoren beene.
Onbekend,PARTHONOPEUS.,405,"Wel warensi meester, diene wrochten;"
Onbekend,PARTHONOPEUS.,406,Hi was hoghe .CC. ghelachten;
Onbekend,PARTHONOPEUS.,407,Rikeliker ghi gheene en kent;
Onbekend,PARTHONOPEUS.,408,Hi hadde te metene al omtrent
Onbekend,PARTHONOPEUS.,385,.DCC. ghelachten of lettel min.
Onbekend,PARTHONOPEUS.,410,Ter poorten quam hi ghereden in;
Onbekend,PARTHONOPEUS.,411,"In groten ghepeinse reet hi voort,"
Onbekend,PARTHONOPEUS.,412,Ende die coutsiede van der poort
Onbekend,PARTHONOPEUS.,413,Blicten algader als glas.
Onbekend,PARTHONOPEUS.,390,"So die reghen meerre was,"
Onbekend,PARTHONOPEUS.,415,So het scoonre was in die strate.
Onbekend,PARTHONOPEUS.,416,"Daer sach hi menech scoon ghesate,"
Onbekend,PARTHONOPEUS.,417,"Menech scoon palays ende groot,"
Onbekend,PARTHONOPEUS.,418,"Some groene, some root,"
Onbekend,PARTHONOPEUS.,395,"Some wit, some zwart, van marber fijn,"
Onbekend,PARTHONOPEUS.,420,"Ic wane, nu niewerinc [selke] sijn."
Onbekend,PARTHONOPEUS.,421,[............]
Onbekend,PARTHONOPEUS.,422,[............]
Onbekend,PARTHONOPEUS.,423,Hi blicte ghelijc den claren v[iere];
Onbekend,PARTHONOPEUS.,424,Boven den appelen daer saten [diere]
Onbekend,PARTHONOPEUS.,425,"Lione, draken, voghelkine;"
Onbekend,PARTHONOPEUS.,400,"Diere ghewone plaghen te si[ne],"
Onbekend,PARTHONOPEUS.,427,"Dochtem staen in dier gheba[ren],"
Onbekend,PARTHONOPEUS.,428,Of si alle levende waren.
Onbekend,PARTHONOPEUS.,429,"Den hemel boven, die erde on[der],"
Onbekend,PARTHONOPEUS.,430,Daer mochtmen ane sien wond[er];
Onbekend,PARTHONOPEUS.,405,"Die zee ende die lucht wel bi [sinne],"
Onbekend,PARTHONOPEUS.,432,Ende meneghe creature daer in[ne].
Onbekend,PARTHONOPEUS.,433,"Daer was ghemaect wint ende reg[hen],"
Onbekend,PARTHONOPEUS.,434,Die sonne sceen claer daer ieg[hen];
Onbekend,PARTHONOPEUS.,435,"Ende hoe die mane in elke ma[ent],"
Onbekend,PARTHONOPEUS.,410,"Volwasset, ende weder waent;"
