author,chapter,line,text
Onbekend,PARTHONOPEUS.,6150,"Den gonen, die[n] ghi hebben sout,"
Onbekend,PARTHONOPEUS.,6364,"Dat uwe oghen beschouwen dien."""
Onbekend,PARTHONOPEUS.,6365,[............]
Onbekend,PARTHONOPEUS.,6366,"""[Trouwen,"" sprac Melior, dier herten wensch]"
Onbekend,PARTHONOPEUS.,6367,"Cursout seide: ""na dien dat s[taet],"
Onbekend,PARTHONOPEUS.,6368,"Dinct mi dit sijn die [beste raet],"
Onbekend,PARTHONOPEUS.,6369,Dien [er] noch iemen toe gheri[et].
Onbekend,PARTHONOPEUS.,6155,"Dat en roekic te heelne nie[t],"
Onbekend,PARTHONOPEUS.,6371,"Ic wille sien hoe scone hi [si],"
Onbekend,PARTHONOPEUS.,6372,"Die gone, die[n] men sal gheven [mi]"
Onbekend,PARTHONOPEUS.,6373,Ende wilne ooc wale bescouw[en].
Onbekend,PARTHONOPEUS.,6374,"Welc uwer es, die van vrouw[en]"
Onbekend,PARTHONOPEUS.,6160,"Soude kiesen, hine name"
Onbekend,PARTHONOPEUS.,6376,Gherne die hem best bequame
Onbekend,PARTHONOPEUS.,6377,Entie hem dochte die scoonste [sijn]?
Onbekend,PARTHONOPEUS.,6378,"Al namic gherne den wille [mijn],"
Onbekend,PARTHONOPEUS.,6379,"In sal nu nemmer dies ontke[ren],"
Onbekend,PARTHONOPEUS.,6165,"No daer uut gaen, daer ghi [heren]"
Onbekend,PARTHONOPEUS.,6381,Mi toe troost bi uwen rade;
Onbekend,PARTHONOPEUS.,6382,"Maer ic u alle[n] gherne bade,"
Onbekend,PARTHONOPEUS.,6383,"Dat ghi een deel mijns willen [daet],"
Onbekend,PARTHONOPEUS.,6384,"Ende doet den soudaen, of gijt ra[et],"
Onbekend,PARTHONOPEUS.,6170,"Ontwapent comen voort alre[eerst],"
Onbekend,PARTHONOPEUS.,6386,Want hi rijcst es ende gheeerst.
Onbekend,PARTHONOPEUS.,6387,"Bi aventuren, hadwine ghe[sien],"
Onbekend,PARTHONOPEUS.,6388,"Wine vercoren nemmer dien,"
Onbekend,PARTHONOPEUS.,6389,"Daer vele af es vertellet nu,"
Onbekend,PARTHONOPEUS.,6175,"Hoe goet ende hoe scone hi si u."""
Onbekend,PARTHONOPEUS.,6391,"Uten wapenen dedi hem do[e],"
Onbekend,PARTHONOPEUS.,6392,"Die soudaen, [daer halp] hem toe"
Onbekend,PARTHONOPEUS.,6393,"Menich hoghe man, die hem aen d[oen]"
Onbekend,PARTHONOPEUS.,6394,Sijn rikelike dier ghewaden [scoon].
Onbekend,PARTHONOPEUS.,6180,Doe broch[t]men[ne] voor die vrouw[e]
Onbekend,PARTHONOPEUS.,6396,Gheachemeert ende wel gheclee[t nauwe].
Onbekend,PARTHONOPEUS.,6397,"Lanc ende groot in die middel sij[n],"
Onbekend,PARTHONOPEUS.,6398,"So wel was hi volmak[et fijn],"
Onbekend,PARTHONOPEUS.,6399,Dat alle die ghene dien sagh[en gaen]
Onbekend,PARTHONOPEUS.,6185,"Nien hadden ghenen [twivel daer aen],"
Onbekend,PARTHONOPEUS.,6401,Hine souts sinen wille [winnen];
Onbekend,PARTHONOPEUS.,6402,Ende men seide in allen sin[nen]
Onbekend,PARTHONOPEUS.,6403,Dese sal hebben sekerlike
Onbekend,PARTHONOPEUS.,6404,Der vrouwen [hant] ende al tkeiserrike.
Onbekend,PARTHONOPEUS.,6190,"Ende daer hi voor die iugen st[oet],"
Onbekend,PARTHONOPEUS.,6406,Dochti hem allen sijn so go[et]
Onbekend,PARTHONOPEUS.,6407,"Ende so scone, dat sine [voor waer]"
Onbekend,PARTHONOPEUS.,6408,Stappans hadden ghecoren daer.
Onbekend,PARTHONOPEUS.,6409,"Doe ghinc hem die Fransoys [doen an],"
Onbekend,PARTHONOPEUS.,6195,Daer hi toe hadde ghen[en man]
Onbekend,PARTHONOPEUS.,6411,Sonder allene Gaudijn [den trouwen].
Onbekend,PARTHONOPEUS.,6412,[............]
Onbekend,PARTHONOPEUS.,6413,[A]lleene brocht men voort gheleet
Onbekend,PARTHONOPEUS.,6414,"[M]et ghenen cleederen ghecleet,"
Onbekend,PARTHONOPEUS.,6415,[Di]es hi een twint te scoonre sceen.
Onbekend,PARTHONOPEUS.,6200,"[Ende] cousen hevet hi ane sijn been,"
Onbekend,PARTHONOPEUS.,6417,"[D]ie in greinen ghevarwet sijn,"
Onbekend,PARTHONOPEUS.,6418,Ende hevet aenghedaen een hemdekijn
Onbekend,PARTHONOPEUS.,6419,[W]el ghescepen wit ende cort;
Onbekend,PARTHONOPEUS.,6420,[Daer] boven hevet hi hem ghegort
Onbekend,PARTHONOPEUS.,6205,"[M]et enen gordelkine van siden,"
Onbekend,PARTHONOPEUS.,6422,[D]at scone was in beeden siden
Onbekend,PARTHONOPEUS.,6423,[M]et enen dradekine gheecht.
Onbekend,PARTHONOPEUS.,6424,"[S]ijn hals was lanc, wit ende slecht,"
Onbekend,PARTHONOPEUS.,6425,"[E]nde was besmet een lettelkijn,"
Onbekend,PARTHONOPEUS.,6210,"[A]ls dicke rudders halse sijn,"
Onbekend,PARTHONOPEUS.,6427,"[V]an dien halsberghe, daer hi lach,"
Onbekend,PARTHONOPEUS.,6428,"[S]o kenlijc, dat ment sach"
Onbekend,PARTHONOPEUS.,6429,[V]an elker maelghen sonderlinghe.
Onbekend,PARTHONOPEUS.,6430,[T]usscen de smitten enten ringhe
Onbekend,PARTHONOPEUS.,6215,[V]an den maelghen bleeker uut
Onbekend,PARTHONOPEUS.,6432,[D]ie wit[s]te entie claerste huut
Onbekend,PARTHONOPEUS.,6433,Die ie ghewan creature.
Onbekend,PARTHONOPEUS.,6434,"Met seghet over waer, dat die nature"
Onbekend,PARTHONOPEUS.,6435,Noyt ne makede so scone[n] man.
Onbekend,PARTHONOPEUS.,6220,"Bequamelijc was hi te scouwene an,"
Onbekend,PARTHONOPEUS.,6437,"Namelike hare die[n]e minde,"
Onbekend,PARTHONOPEUS.,6438,"Entie een deel sier seden kinde,"
Onbekend,PARTHONOPEUS.,6439,Dien soe goelike doe besach;
Onbekend,PARTHONOPEUS.,6440,Soene vruchte doe no ontsach
Onbekend,PARTHONOPEUS.,6225,Wat die iugen wisen souden.
Onbekend,PARTHONOPEUS.,6442,"Coren [si] die si kiesen wouden,"
Onbekend,PARTHONOPEUS.,6443,Haer selves herte coos haer dien.
Onbekend,PARTHONOPEUS.,6444,"Melioer darne wel besien,"
Onbekend,PARTHONOPEUS.,6445,Maer hi ne dar niet openbare
Onbekend,PARTHONOPEUS.,6230,"Sine oghen drayen in de hare,"
Onbekend,PARTHONOPEUS.,6447,"Om dat hi hem mesdadech weet,"
Onbekend,PARTHONOPEUS.,6448,"Dies hem die vrouwe waer ghereet,"
Onbekend,PARTHONOPEUS.,6449,"Door sine scoonheit te doene raet,"
Onbekend,PARTHONOPEUS.,6450,"Ende pardon van siere mesdaet,"
Onbekend,PARTHONOPEUS.,6235,Dat hise te voren hadde ghehoont.
Onbekend,PARTHONOPEUS.,6452,"Van scaemte was hi een deel ghescoont,"
Onbekend,PARTHONOPEUS.,6453,Ende te bet ghevarwet int aensichte.
Onbekend,PARTHONOPEUS.,6454,[D]at ic u nu niet verdichte
Onbekend,PARTHONOPEUS.,6455,"[N]o vertelle van sier scoonheit,"
Onbekend,PARTHONOPEUS.,6240,[D]ats bedie ic hebbe gheseit[......]
Onbekend,PARTHONOPEUS.,6457,[............]
Onbekend,PARTHONOPEUS.,6458,[............]
Onbekend,PARTHONOPEUS.,6459,"So soete dochte hem wesen al,"
Onbekend,PARTHONOPEUS.,6460,"Datsine al onberaden coren,"
Onbekend,PARTHONOPEUS.,6461,"Ende die coninghe, die te voren"
Onbekend,PARTHONOPEUS.,6462,"Altoes den soudaen treckeden voort,"
Onbekend,PARTHONOPEUS.,6245,Ne spraken ieghen niet een woort.
Onbekend,PARTHONOPEUS.,6464,Si hadden recht dat si zweghen;
Onbekend,PARTHONOPEUS.,6465,"Al hadsire iet ghesproken ieghen,"
Onbekend,PARTHONOPEUS.,6466,Men souts niet hebben gheloovet;
Onbekend,PARTHONOPEUS.,6467,Die daer weren hadse verdoovet:
Onbekend,PARTHONOPEUS.,6250,Al riepen si dat si wouden
Onbekend,PARTHONOPEUS.,6469,Dien Fransoys tenen here houden.
Onbekend,PARTHONOPEUS.,6470,"Doe stont op die grauwe Ernout,"
Onbekend,PARTHONOPEUS.,6471,Die openbare was ende bout.
Onbekend,PARTHONOPEUS.,6472,"Dit gheroep bequam hem wale,"
Onbekend,PARTHONOPEUS.,6255,Ende seider toe een corte tale.
Onbekend,PARTHONOPEUS.,6474,"""Ghi heren,"" seiti, ""wat segghedijs?"
Onbekend,PARTHONOPEUS.,6475,"Dese dunct mi hebben al den prijs."""
Onbekend,PARTHONOPEUS.,6476,"Die [coninc] Cursout ende Anfors,"
Onbekend,PARTHONOPEUS.,6477,Ende Cursabres ende Genors
Onbekend,PARTHONOPEUS.,6260,"Volgheden hem, dat hi waerheit"
Onbekend,PARTHONOPEUS.,6479,"Ende recht vonnesse hadde gheseit,"
Onbekend,PARTHONOPEUS.,6480,Daert der vrouwen bequamelic ware.
Onbekend,PARTHONOPEUS.,6481,"Ende ic wane wel, baden sijs hare"
Onbekend,PARTHONOPEUS.,6482,"Dat soet door hem soude ghedooghen,"
Onbekend,PARTHONOPEUS.,6265,"Voor der coninghe, der heren ooghen"
Onbekend,PARTHONOPEUS.,6484,Hadt soe gheacht te nemene tehant
Onbekend,PARTHONOPEUS.,6485,"Parthonopeus bi der hant,"
Onbekend,PARTHONOPEUS.,6486,Ende te leedene in de zale;
Onbekend,PARTHONOPEUS.,6487,Maer dat soe viel in ene tale:
Onbekend,PARTHONOPEUS.,6270,"""Ghi heren,"" seit soe, ""in hadde vercoren"
Onbekend,PARTHONOPEUS.,6489,"Den soudaen, die mi was te voren"
Onbekend,PARTHONOPEUS.,6490,Uter maten sere gheprijst;
Onbekend,PARTHONOPEUS.,6491,"Dien rudder hebdi mi ontwijst,"
Onbekend,PARTHONOPEUS.,6492,So dat ic hadde die hope verloren;
Onbekend,PARTHONOPEUS.,6275,"Ende hoe ics ghelide ten toren,"
Onbekend,PARTHONOPEUS.,6494,Ic wils gherne uwen wille doen.
Onbekend,PARTHONOPEUS.,6495,"Mijns hevet Ernout van Marberoen,"
Onbekend,PARTHONOPEUS.,6496,Dies een twint ontfaerm[e]t niet
Onbekend,PARTHONOPEUS.,6497,"So wat vernoy mijns ghesciet,"
Onbekend,PARTHONOPEUS.,6280,Bi siere luste (hevet) sere ghehoont.
Onbekend,PARTHONOPEUS.,6499,"Hem tijc al; wat holps verscoont?"""
Onbekend,PARTHONOPEUS.,6500,"""Vrouwe,"" seiti, ""door uwen danc"
Onbekend,PARTHONOPEUS.,6501,"No door vrien[t]scap no door bedwanc,"
Onbekend,PARTHONOPEUS.,6502,In sal nemmermeer no nu no echt
Onbekend,PARTHONOPEUS.,6285,"Vonnesse luden sonder recht[.......]"""
Onbekend,PARTHONOPEUS.,6504,
Onbekend,PARTHONOPEUS.,6505,XV
Onbekend,PARTHONOPEUS.,6506,
Onbekend,PARTHONOPEUS.,6507,"""So dat si waren in allen tijt"
Onbekend,PARTHONOPEUS.,6508,Sonder orloghe ende strijt
Onbekend,PARTHONOPEUS.,6509,Bi onser hulpen in desen lande;
Onbekend,PARTHONOPEUS.,6510,"Sine verboordens willender hande,"
Onbekend,PARTHONOPEUS.,6290,Van ons soude hen comen al goet.
Onbekend,PARTHONOPEUS.,6512,"Wi soudense houden wel ghemoet,"
Onbekend,PARTHONOPEUS.,6513,"Dadewi [na] redene ende [na] wet,"
Onbekend,PARTHONOPEUS.,6514,Want wi sijnre toe gheset;
Onbekend,PARTHONOPEUS.,6515,Maer des en doewi niet albedalle.
Onbekend,PARTHONOPEUS.,6295,"Wi sijn so overmoedech alle,"
Onbekend,PARTHONOPEUS.,6517,Dat wi met hen al onsen wille
Onbekend,PARTHONOPEUS.,6518,Vorderen lude ende stille.
Onbekend,PARTHONOPEUS.,6519,Haers en ontfarmet ons niet:
Onbekend,PARTHONOPEUS.,6520,Wi doen hen doghen [swaer] verdriet.
Onbekend,PARTHONOPEUS.,6300,"So si bat sijn onse vrient,"
Onbekend,PARTHONOPEUS.,6522,So wi dicker onverdient
Onbekend,PARTHONOPEUS.,6523,Hen te felre sijn ende ooc te quader.
Onbekend,PARTHONOPEUS.,6524,"Aldus ontghelden sijt algader,"
Onbekend,PARTHONOPEUS.,6525,"Onse dulheit ende onse overdaet,"
Onbekend,PARTHONOPEUS.,6305,Onse dorperheit ende onse mesdaet.
Onbekend,PARTHONOPEUS.,6527,Die soudaen mint wel sottelike.
Onbekend,PARTHONOPEUS.,6528,Het moet ontghelden al sijn rike.
Onbekend,PARTHONOPEUS.,6529,"Bi Gode, dat dunct mi onrecht groot"
Onbekend,PARTHONOPEUS.,6530,Dat hise brinct in hare doot.
Onbekend,PARTHONOPEUS.,6310,Ic ben ooc in wel droeven sinne.
Onbekend,PARTHONOPEUS.,6532,"Salic besterven mine minne,"
Onbekend,PARTHONOPEUS.,6533,Dat moet binnen tiden wesen.
Onbekend,PARTHONOPEUS.,6534,Nimmer en moete hem God van desen
Onbekend,PARTHONOPEUS.,6535,"Te miwaert belghen, so dat wi"
Onbekend,PARTHONOPEUS.,6315,"Ter noot en werden ghecrinct daer bi."""
Onbekend,PARTHONOPEUS.,6537,Doe sprac Alijs na dese tale:
Onbekend,PARTHONOPEUS.,6538,"""Here,"" seit hi, ""dat dunct mi wale"
Onbekend,PARTHONOPEUS.,6539,Dat ghi een goet monic waert.
Onbekend,PARTHONOPEUS.,6540,Alse wi selen eneghe vaert
Onbekend,PARTHONOPEUS.,6320,"Ic ende min broeder Gautier bestaen,"
Onbekend,PARTHONOPEUS.,6542,"Hi es clerc, so doet hi mi verstaen"
Onbekend,PARTHONOPEUS.,6543,Bi ere redenen twee saken;
Onbekend,PARTHONOPEUS.,6544,"Wildi u dien ghelijc maken,"
Onbekend,PARTHONOPEUS.,6545,Sone werdi nimmer torloghe goet.
Onbekend,PARTHONOPEUS.,6325,"Maer ic segghe u, wat ghi doet:"
Onbekend,PARTHONOPEUS.,6547,Beset u bootscap met hen tween.
Onbekend,PARTHONOPEUS.,6548,"Ic love wel, dat ic si die een."""
Onbekend,PARTHONOPEUS.,6549,Gaudijn loech ombe dese woort
Onbekend,PARTHONOPEUS.,6550,"Ende alle, dise hadden ghehoort."
Onbekend,PARTHONOPEUS.,6330,"Doe sprac Gautier: ""dit es goet spel;"
Onbekend,PARTHONOPEUS.,6552,"Bi Gode, broeder, dat wetic wel,"
Onbekend,PARTHONOPEUS.,6553,"Vaertire allene, ghi wert dore houwen"
Onbekend,PARTHONOPEUS.,6554,Int wederkeren; het sal u rouwen.
Onbekend,PARTHONOPEUS.,6555,"Daer sijn so vele van dien uutlaghen,"
Onbekend,PARTHONOPEUS.,6335,Die hen met rovene beiaghen.
Onbekend,PARTHONOPEUS.,6557,"Maer wildire varen, ic vare met."
Onbekend,PARTHONOPEUS.,6558,"Wi selent hebben so beset,"
Onbekend,PARTHONOPEUS.,6559,"Alse ghi allene [vaert naer t]here,"
Onbekend,PARTHONOPEUS.,6560,"Dat ic bi u si [ten wederk]ere."""
Onbekend,PARTHONOPEUS.,6340,"Doe sprac Alijs: ""[spaer uwen r]aet;"
Onbekend,PARTHONOPEUS.,6562,"Of God wilt, sone compt nimmer quaet."""
Onbekend,PARTHONOPEUS.,6563,Ernout castide sine kinder.
Onbekend,PARTHONOPEUS.,6564,Si sweghen alle meerre ende minder.
Onbekend,PARTHONOPEUS.,6565,Si waren hovesch ende goedertiere.
Onbekend,PARTHONOPEUS.,6345,"Hi seide, dat hi twee messelgiere"
Onbekend,PARTHONOPEUS.,6567,"Hadde vernomen op die vaert,"
Onbekend,PARTHONOPEUS.,6568,"Dat hem dochte, te hen waert:"
Onbekend,PARTHONOPEUS.,6569,"Hi wilder varen ende Gaudijn,"
Onbekend,PARTHONOPEUS.,6570,Want si best kinnen haer latijn.
Onbekend,PARTHONOPEUS.,6350,"Melior en wilde niet ghehinghen,"
Onbekend,PARTHONOPEUS.,6572,"Dat Ernout hem doe teneghen dinghen,"
Onbekend,PARTHONOPEUS.,6573,Maer dat hi vare te Marberoen
Onbekend,PARTHONOPEUS.,6574,"Ende dat besette, of ment mach doen;"
Onbekend,PARTHONOPEUS.,6575,"Ofte neen, men werpt ter neder"
Onbekend,PARTHONOPEUS.,6355,Ende hi come haestelike weder.
Onbekend,PARTHONOPEUS.,6577,Parthonopeus blive terre noot.
Onbekend,PARTHONOPEUS.,6578,Supplices ende Anceloot
Onbekend,PARTHONOPEUS.,6579,Si selen hen ghereiden sciere
Onbekend,PARTHONOPEUS.,6580,"Ende varen ane die messelgiere,"
Onbekend,PARTHONOPEUS.,6360,Horen ende vernemen hare woort
Onbekend,PARTHONOPEUS.,6582,Ende voeren dan hare bootscap voort.
Onbekend,PARTHONOPEUS.,6583,"Ernout castide sinen sone,"
Onbekend,PARTHONOPEUS.,6584,"Alse hi sculdech was te done,"
Onbekend,PARTHONOPEUS.,6585,Ende hiet heme doen die bootscap wale:
Onbekend,PARTHONOPEUS.,6365,Dat hi dore enghene tale
Onbekend,PARTHONOPEUS.,6587,"Noch dore enghene dinc,"
Onbekend,PARTHONOPEUS.,6588,"Quame hi voor prinse ochte voor coninc,"
Onbekend,PARTHONOPEUS.,6589,Die overdaet te hem sprake;
Onbekend,PARTHONOPEUS.,6590,Dat hi altoes ware ghemate;
Onbekend,PARTHONOPEUS.,6370,"Want soete tale breket evelen moet,"
Onbekend,PARTHONOPEUS.,6592,Daerne die harde wassen doet.
Onbekend,PARTHONOPEUS.,6593,"""Dat houdet van mi alse van uwen vader."""
Onbekend,PARTHONOPEUS.,6594,Si neghen heme alle gader
Onbekend,PARTHONOPEUS.,6595,Ende voeren hare bootscap doen.
Onbekend,PARTHONOPEUS.,6375,Ernout voer te Marberoen
Onbekend,PARTHONOPEUS.,6597,Ende berichte dien casteel:
Onbekend,PARTHONOPEUS.,6598,Hevet hi .XL. daghe voordeel
Onbekend,PARTHONOPEUS.,6599,"Daer hijt besetten moghe binnen,"
Onbekend,PARTHONOPEUS.,6600,Sone maghet die soudaen niet winnen. -
Onbekend,PARTHONOPEUS.,6380,"Ic wane, u van derre ieesten"
Onbekend,PARTHONOPEUS.,6602,"Verlinghen mach; conste ict gheleesten,"
Onbekend,PARTHONOPEUS.,6603,Ic soude corten dese woort;
Onbekend,PARTHONOPEUS.,6604,Maer daer o[mbe varic] noch voort:
Onbekend,PARTHONOPEUS.,6605,Sware d[wanc bint mine her]te nu
Onbekend,PARTHONOPEUS.,6385,"Ane dit ghe[dichte], dat secghic u;"
Onbekend,PARTHONOPEUS.,6607,Soe begheert mijn leven ende mine doot.
Onbekend,PARTHONOPEUS.,6608,Want ic doghe pine groot
Onbekend,PARTHONOPEUS.,6609,"Dore haren wille dach ende nacht,"
Onbekend,PARTHONOPEUS.,6610,Daer ic ane hebbe cleine macht.
Onbekend,PARTHONOPEUS.,6390,Het ghevet haer pine dat si mi siet.
Onbekend,PARTHONOPEUS.,6612,Ic ben doot ende nighe om niet.
Onbekend,PARTHONOPEUS.,6613,"Ic sal doen als dede Doriecse,"
Onbekend,PARTHONOPEUS.,6614,"Die scone ioncvrouwe, een griecse,"
Onbekend,PARTHONOPEUS.,6615,Die ondersochte haer lief van minnen;
Onbekend,PARTHONOPEUS.,6395,Maer hine wout noyt onderkinnen
Onbekend,PARTHONOPEUS.,6617,Dat si dore hem groot verdriet
Onbekend,PARTHONOPEUS.,6618,Doghede; dies en achte hi niet.
Onbekend,PARTHONOPEUS.,6619,Hi was haer ember fel ende hart
Onbekend,PARTHONOPEUS.,6620,So langhe dat si onthopet wart.
Onbekend,PARTHONOPEUS.,6400,"Nochtan al was hi fel van sinne,"
Onbekend,PARTHONOPEUS.,6622,Sine gaf hem niet te min hare minne.
Onbekend,PARTHONOPEUS.,6623,Noch dore pine noch dore verdriet
Onbekend,PARTHONOPEUS.,6624,Ne mochte si van hem sceden niet.
Onbekend,PARTHONOPEUS.,6625,Si was ane hem van daghe te daghe
Onbekend,PARTHONOPEUS.,6405,Met biddene ende met verscer claghe;
Onbekend,PARTHONOPEUS.,6627,Maer alse hi niet en achte op hare
Onbekend,PARTHONOPEUS.,6628,"Noch weder stille noch oppenbare,"
Onbekend,PARTHONOPEUS.,6629,Belooc sijt [al] in hare herte.
Onbekend,PARTHONOPEUS.,6630,Sonder ruste in meneghe smerte
Onbekend,PARTHONOPEUS.,6410,"Minde sine ende sonder keer,"
Onbekend,PARTHONOPEUS.,6632,Ghelijc haer selve ende vele meer.
Onbekend,PARTHONOPEUS.,6633,Doe hise niet in derre noot
Onbekend,PARTHONOPEUS.,6634,"En vertrooste, bleef si doot."
Onbekend,PARTHONOPEUS.,6635,Sal mi die scone die mi doet leven
Onbekend,PARTHONOPEUS.,6415,"Aldus sonder troost begheven,"
Onbekend,PARTHONOPEUS.,6637,So meskeert si ende mesgheet.
Onbekend,PARTHONOPEUS.,6638,"Gheduert si daer in ende ghesteet,"
Onbekend,PARTHONOPEUS.,6639,"Bi dien meskere ben ic ghevaen,"
Onbekend,PARTHONOPEUS.,6640,"Bi dien ghestane ben ic ontdaen,"
Onbekend,PARTHONOPEUS.,6420,"Want al mijn keren ende al mijn gaen,"
Onbekend,PARTHONOPEUS.,6642,"Mijn dolen, mijn doghen, mijn ghestaen"
Onbekend,PARTHONOPEUS.,6643,Leghet al ane die ic hebbe lief.
Onbekend,PARTHONOPEUS.,6644,"Ic sal met crachte sijn haer lief,"
Onbekend,PARTHONOPEUS.,6645,"Wille si [of] en wille, doet [si] of laet."
Onbekend,PARTHONOPEUS.,6425,"Of si mi mint, of si mi haet,"
Onbekend,PARTHONOPEUS.,6647,Ic sal wonen in hare herte;
Onbekend,PARTHONOPEUS.,6648,Ine keers niet af door engheen smerte.
Onbekend,PARTHONOPEUS.,6649,"Si woont int mijn, dats waer;"
Onbekend,PARTHONOPEUS.,6650,Miere herten oghen siense daer.
Onbekend,PARTHONOPEUS.,6430,Si mach ooc wel minen ligchame
Onbekend,PARTHONOPEUS.,6652,"Carsereren, eest haer bequame;"
Onbekend,PARTHONOPEUS.,6653,Sine mach niet binden mijn ghepens.
Onbekend,PARTHONOPEUS.,6654,"Keert si hare, keert si ghens,"
Onbekend,PARTHONOPEUS.,6655,"Sine comt ute miere herten niet,"
Onbekend,PARTHONOPEUS.,6435,"Lese ic, late ic, wats ghesciet."
Onbekend,PARTHONOPEUS.,6657,Men mach ghepens niet binden; twi?
Onbekend,PARTHONOPEUS.,6658,[H]ets altoes in heme selven vri.
Onbekend,PARTHONOPEUS.,6659,Deus! hoe ghebint si dan
Onbekend,PARTHONOPEUS.,6660,"Mijn ghepens so, dat ic en can"
Onbekend,PARTHONOPEUS.,6440,El enghene dinc onderstaen?
Onbekend,PARTHONOPEUS.,6662,"Dat Diixe aneghinc, sal ic ane gaen,"
Onbekend,PARTHONOPEUS.,6663,Die ombe haers lieves wille starf:
Onbekend,PARTHONOPEUS.,6664,"Ic sal verwerven, dat si verwarf;"
Onbekend,PARTHONOPEUS.,6665,Ic bens ghereet in diere manieren. -
Onbekend,PARTHONOPEUS.,6445,Maer ic sal van den messelgieren
Onbekend,PARTHONOPEUS.,6667,"Dese bootscap segghen voort,"
Onbekend,PARTHONOPEUS.,6668,Daer ghi een deel af hebt ghehoort.
Onbekend,PARTHONOPEUS.,6669,Anceloot ende sijn gheselle
Onbekend,PARTHONOPEUS.,6670,"Supplices, daer ic af telle,"
Onbekend,PARTHONOPEUS.,6450,Si sijn nu comen op die vaert
Onbekend,PARTHONOPEUS.,6672,Ende varen ten soudaen waert
Onbekend,PARTHONOPEUS.,6673,Hore bootscap te doene.
Onbekend,PARTHONOPEUS.,6674,Si saghen die scone pauwelioene
Onbekend,PARTHONOPEUS.,6675,Vier milen verre vore hen staen.
Onbekend,PARTHONOPEUS.,6455,Si saghen riden ende gaen
Onbekend,PARTHONOPEUS.,6677,Groot volc daerwaert met spisen.
Onbekend,PARTHONOPEUS.,6678,Si voeren in der selver wisen
Onbekend,PARTHONOPEUS.,6679,"Met hen, dat si int here quamen"
Onbekend,PARTHONOPEUS.,6680,"So verre, dat si wel vernamen"
Onbekend,PARTHONOPEUS.,6460,Waer die edele soudaen
Onbekend,PARTHONOPEUS.,6682,"Sine pauwelioene hadde doen slaen,"
Onbekend,PARTHONOPEUS.,6683,"In enen mersch, in een dal."
Onbekend,PARTHONOPEUS.,6684,Daer saghen si een groot ghetal
Onbekend,PARTHONOPEUS.,6685,Riddren versament ombe een crijt;
Onbekend,PARTHONOPEUS.,6465,Daer si twee op groten nijt[.......]
Onbekend,PARTHONOPEUS.,6687,
Onbekend,PARTHONOPEUS.,6688,XVI
Onbekend,PARTHONOPEUS.,6689,
Onbekend,PARTHONOPEUS.,6690,Met derre talen scieden si.
Onbekend,PARTHONOPEUS.,6691,Aupatrijs die coninc vri
Onbekend,PARTHONOPEUS.,6692,Bleef ombe Gautiere sere vervaert.
Onbekend,PARTHONOPEUS.,6693,Die grave voer te Marberoen waert
Onbekend,PARTHONOPEUS.,6470,Wel op gheseten met .X. scaren.
Onbekend,PARTHONOPEUS.,6695,"In elke si twee hondert waren,"
Onbekend,PARTHONOPEUS.,6696,Baseleren van hoghen moede.
Onbekend,PARTHONOPEUS.,6697,Al met ghemake op hare hoede
Onbekend,PARTHONOPEUS.,6698,Seghen si neder in een dal.
Onbekend,PARTHONOPEUS.,6475,Wel stille waest daer over al.
Onbekend,PARTHONOPEUS.,6700,"Sine makeden daer hu no cri,"
Onbekend,PARTHONOPEUS.,6701,Onthier ende sire quamen bi.
Onbekend,PARTHONOPEUS.,6702,Anceloot vernamse teerst:
Onbekend,PARTHONOPEUS.,6703,"Ernoude, die daer was gheheerst,"
Onbekend,PARTHONOPEUS.,6480,Toghede hise ende met dien
Onbekend,PARTHONOPEUS.,6705,"Al den ghenen, diese wouden sien."
Onbekend,PARTHONOPEUS.,6706,"Doe sprac Ernout: ""wi sijn ghedreven"
Onbekend,PARTHONOPEUS.,6707,"Te scerne, want wi sijn beleghen."
Onbekend,PARTHONOPEUS.,6708,Ons naken harde felle gaste.
Onbekend,PARTHONOPEUS.,6485,"Dats waer, wi sitten harde vaste;"
Onbekend,PARTHONOPEUS.,6710,Maer dat en can ons niet ghedieden.
Onbekend,PARTHONOPEUS.,6711,Dore die ghebrekenesse van lieden
Onbekend,PARTHONOPEUS.,6712,"Sele wi ghescoffiert wesen."""
Onbekend,PARTHONOPEUS.,6713,"Doe sprac Alijs: ""here, swighet van desen,"
Onbekend,PARTHONOPEUS.,6490,Wi moeten slach ende stoot wel groot
Onbekend,PARTHONOPEUS.,6715,"Op hen doen of wi sijn doot."""
Onbekend,PARTHONOPEUS.,6716,Doe sprac sijn broeder Marcioen:
Onbekend,PARTHONOPEUS.,6717,"""Alijs, hets goet met rade doen,"
Onbekend,PARTHONOPEUS.,6718,Spreken te maten vore dien tijt
Onbekend,PARTHONOPEUS.,6495,"Dat gijs wel boven comen sijt."""
Onbekend,PARTHONOPEUS.,6720,"Do[e] sprac Dunas: ""[h]en voeghet niet wale"
Onbekend,PARTHONOPEUS.,6721,Dese tweerhande tale.
Onbekend,PARTHONOPEUS.,6722,Maer of wi nu werden ghescouden
Onbekend,PARTHONOPEUS.,6723,"Blode, so moets die duvel wouden."""
Onbekend,PARTHONOPEUS.,6500,"""Amen, amen, Gode weet,"""
Onbekend,PARTHONOPEUS.,6725,"Sprac Supplices, ""ic ben ghereet:"
Onbekend,PARTHONOPEUS.,6726,Varewi die Turke met sconen slaghen
Onbekend,PARTHONOPEUS.,6727,"Scoffieren ende henen jaghen."""
Onbekend,PARTHONOPEUS.,6728,Teerst dat Gautier hadde ghehoort
Onbekend,PARTHONOPEUS.,6505,"Dese tale, quam hi voort"
Onbekend,PARTHONOPEUS.,6730,Van sinen bedde vele bleec
Onbekend,PARTHONOPEUS.,6731,"Ende so verbloet, dat hi gheleec"
Onbekend,PARTHONOPEUS.,6732,Enen doden; maer nochtan
Onbekend,PARTHONOPEUS.,6733,Begonste hi spreken alse .I. man:
Onbekend,PARTHONOPEUS.,6510,"""Wapenewi ons haestelike"
Onbekend,PARTHONOPEUS.,6735,Dat si ons vinden te ghereke
Onbekend,PARTHONOPEUS.,6736,"Wel, ende varewi op die Ore;"
Onbekend,PARTHONOPEUS.,6737,Brekewi die brugghe; houdewi daer vore;
Onbekend,PARTHONOPEUS.,6738,Die Turke moeten daer ter faelgen
Onbekend,PARTHONOPEUS.,6515,"Spelen, eer si die uutbaelgen"
Onbekend,PARTHONOPEUS.,6740,"Met scilde, met spere op ons ghewinnen."
Onbekend,PARTHONOPEUS.,6741,Mijn vrouwe sal hierenbinnen
Onbekend,PARTHONOPEUS.,6742,"Met goude, met selvere, met ghewaden"
Onbekend,PARTHONOPEUS.,6743,Mule ende paerde wel doen laden
Onbekend,PARTHONOPEUS.,6520,Ende doen hen op die vaert
Onbekend,PARTHONOPEUS.,6745,Al heimelike te Chiefdoren waert
Onbekend,PARTHONOPEUS.,6746,Met haren cleinen ionghen kinden.
Onbekend,PARTHONOPEUS.,6747,Daer sal si Parthonopeus vinden.
Onbekend,PARTHONOPEUS.,6748,Wi moete[n] ute trecken te velde;
Onbekend,PARTHONOPEUS.,6525,Eer si ons met ghewelde
Onbekend,PARTHONOPEUS.,6750,"Helme ende scilde so scoffieren,"
Onbekend,PARTHONOPEUS.,6751,"Dat wi dore noot moeten keren,"
Onbekend,PARTHONOPEUS.,6752,"So eest ons een wel mate lachter,"
Onbekend,PARTHONOPEUS.,6753,Dat wi met staden trecken achter
Onbekend,PARTHONOPEUS.,6530,Binnen onsen barbakaren.
Onbekend,PARTHONOPEUS.,6755,"So wi[e] soet ons wert te baren,"
Onbekend,PARTHONOPEUS.,6756,Daer moetewi emmer houden strijt.
Onbekend,PARTHONOPEUS.,6757,"Maer eert compt ter vespertijt,"
Onbekend,PARTHONOPEUS.,6758,Sal ons tlantvolc te hulpen comen.
Onbekend,PARTHONOPEUS.,6535,Si selent hebben saen vernomen
Onbekend,PARTHONOPEUS.,6760,"Dese Turke, dese gaste."
Onbekend,PARTHONOPEUS.,6761,Nemmer en slaept ooc so vaste
Onbekend,PARTHONOPEUS.,6762,"Parthonopeus, hine sal ontspringhen;"
Onbekend,PARTHONOPEUS.,6763,Want hi noyt in enghenen dinghen
Onbekend,PARTHONOPEUS.,6540,"Dore blootheit achter en trac,"
Onbekend,PARTHONOPEUS.,6765,Noch ons ter noot en ghebrac.
Onbekend,PARTHONOPEUS.,6766,"Compt Parthonopeus, si sijn ontdaen"
Onbekend,PARTHONOPEUS.,6767,"Dese Turke, dats mijn waen."""
Onbekend,PARTHONOPEUS.,6768,"- ""Dat hi allene beter es"
Onbekend,PARTHONOPEUS.,6545,"Dan al dit volc, dies sijt ghewes,"""
Onbekend,PARTHONOPEUS.,6770,"Sprac Anselot: ""ghi hebt ghelesen"
Onbekend,PARTHONOPEUS.,6771,"Ene ware lesse van desen."""
Onbekend,PARTHONOPEUS.,6772,Na desen raet sijn die heren
Onbekend,PARTHONOPEUS.,6773,Ghemonteert met groter eren.
Onbekend,PARTHONOPEUS.,6550,Die oude Ernout sachse varen.
Onbekend,PARTHONOPEUS.,6775,"Hi dankede Gode van diere scaren,"
Onbekend,PARTHONOPEUS.,6776,"Ende sende hen, dat wet voorwaer,"
Onbekend,PARTHONOPEUS.,6777,Selke .XX. knapen naer
Onbekend,PARTHONOPEUS.,6778,"Van sinen lieden, die wel scoten"
Onbekend,PARTHONOPEUS.,6555,Met boghen ende met gaveloten
Onbekend,PARTHONOPEUS.,6780,Ende die wale conden striden.
Onbekend,PARTHONOPEUS.,6781,Die saten alle op starke rossiden
Onbekend,PARTHONOPEUS.,6782,Wel te ghereke; si waren stout.
Onbekend,PARTHONOPEUS.,6783,[H]et had[se] die oude Ernout
Onbekend,PARTHONOPEUS.,6560,"Op ghehouden al[le] gader,"
Onbekend,PARTHONOPEUS.,6785,Alse of hi hadde gheweest haer vader.
Onbekend,PARTHONOPEUS.,6786,"Des gheve men ere sulken man,"
Onbekend,PARTHONOPEUS.,6787,Die dus sijn dinc besetten can
Onbekend,PARTHONOPEUS.,6788,"Te poente wel, ende dit so saen;"
