author,chapter,line,text
Onbekend,PARTHONOPEUS.,2151,"Gavic scone ende rike gaven,"
Onbekend,PARTHONOPEUS.,2152,"Coninghen, hertoghen ende graven,"
Onbekend,PARTHONOPEUS.,2153,"Het ne was baroen in al tlant,"
Onbekend,PARTHONOPEUS.,2055,"So goet riddere noch seriant,"
Onbekend,PARTHONOPEUS.,2155,"Dies gheerden ende dies werdich waren,"
Onbekend,PARTHONOPEUS.,2156,In gaf hem scone van den ha[ren]:
Onbekend,PARTHONOPEUS.,2157,"Bi hare stont dit la[nt in vrede]."""
Onbekend,PARTHONOPEUS.,2158,[............]
Onbekend,PARTHONOPEUS.,2159,"""Becomt mi wel sonder in dien"
Onbekend,PARTHONOPEUS.,2060,Dat ic se niet [en] ghemach sien
Onbekend,PARTHONOPEUS.,2161,Totien dat se mi orlof ghevet.
Onbekend,PARTHONOPEUS.,2162,"Dat soe mi dit verboden hevet,"
Onbekend,PARTHONOPEUS.,2163,Dat es dat ic meest vruchte nu.
Onbekend,PARTHONOPEUS.,2164,"Ende wils mi setten al aen u."""
Onbekend,PARTHONOPEUS.,2065,Dit heeft die biscop wel ghehoort
Onbekend,PARTHONOPEUS.,2166,"Ende seit dat goet sijn sine woort,"
Onbekend,PARTHONOPEUS.,2167,"Ende troost ende bidt bi goeden rade,"
Onbekend,PARTHONOPEUS.,2168,"Teerst dat hijs mach hebben stade,"
Onbekend,PARTHONOPEUS.,2169,Dat hi verwerve om dat hi scouwe
Onbekend,PARTHONOPEUS.,2070,Sonder orlof die ioncfrouwe.
Onbekend,PARTHONOPEUS.,2171,
Onbekend,PARTHONOPEUS.,2172,Doen sprac sijn moeder overlanc.
Onbekend,PARTHONOPEUS.,2173,"""Sone,"" seit soe, ""hebt groten danc,"
Onbekend,PARTHONOPEUS.,2174,Dat ghi u wilt te Gode keren.
Onbekend,PARTHONOPEUS.,2175,"Ic salre u enen lust toe leren,"
Onbekend,PARTHONOPEUS.,2075,Dat ghise sult moghen sien al naect.
Onbekend,PARTHONOPEUS.,2177,"Hier es ene lanterne so ghemaect,"
Onbekend,PARTHONOPEUS.,2178,Dat se no wint no water mach
Onbekend,PARTHONOPEUS.,2179,"Donkelen, ende bernt nacht ende dach."
Onbekend,PARTHONOPEUS.,2180,"Nu, wetic wel, sal het ghescien,"
Onbekend,PARTHONOPEUS.,2080,"Daer mede suldise moghen sien,"
Onbekend,PARTHONOPEUS.,2182,Wildire toe varen behendelike.
Onbekend,PARTHONOPEUS.,2183,"Dat radic u wel sekerlike,"
Onbekend,PARTHONOPEUS.,2184,"Dat ghi u seint, ende weset niet"
Onbekend,PARTHONOPEUS.,2185,"Te sere vervaert, als ghise siet."
Onbekend,PARTHONOPEUS.,2085,"Want die duvelinne, seght mijn waen,"
Onbekend,PARTHONOPEUS.,2187,"Es harde leelijc ende onghedaen."""
Onbekend,PARTHONOPEUS.,2188,Dies [soe] bat hem hi loofde gherne;
Onbekend,PARTHONOPEUS.,2189,Doe gaf soe hem die lanterne.
Onbekend,PARTHONOPEUS.,2190,Hi namse ende deetse daer hi se behelt.
Onbekend,PARTHONOPEUS.,2090,Doe haddise vast in sijn ghewelt:
Onbekend,PARTHONOPEUS.,2192,Dit was dat vruchte Melioer.
Onbekend,PARTHONOPEUS.,2193,Sine vaert ghereedi ende voer.
Onbekend,PARTHONOPEUS.,2194,In dOre vant hi sinen boot
Onbekend,PARTHONOPEUS.,2195,"Ende voer ten scepe, dat vele groot"
Onbekend,PARTHONOPEUS.,2095,Ende rikelijc was ende vele goet;
Onbekend,PARTHONOPEUS.,2197,Te seilne haddi groten spoet.
Onbekend,PARTHONOPEUS.,2198,"Als hi [te] Chiefdore quam aen tlant,"
Onbekend,PARTHONOPEUS.,2199,Sijn ors leedi op dat sant.
Onbekend,PARTHONOPEUS.,2200,Hi was comen daer bi nachte.
Onbekend,PARTHONOPEUS.,2100,"Sine lanterne, die hi daer brachte,"
Onbekend,PARTHONOPEUS.,2202,"Voerdi so hi verholenlicst mochte,"
Onbekend,PARTHONOPEUS.,2203,Om dat hi musaerdie sochte.
Onbekend,PARTHONOPEUS.,2204,Hi voer in dien hoghen casteel;
Onbekend,PARTHONOPEUS.,2205,Van al dies hem behoefde .I. deel
Onbekend,PARTHONOPEUS.,2105,"Vanti binnen den palayse echt,"
Onbekend,PARTHONOPEUS.,2207,"Claer vier ende grote stallecht,"
Onbekend,PARTHONOPEUS.,2208,"Tafelen gherecht, die rikelic waren;"
Onbekend,PARTHONOPEUS.,2209,"Daer up rikelike candelaren,"
Onbekend,PARTHONOPEUS.,2210,"Guldene vate ende selverine,"
Onbekend,PARTHONOPEUS.,2110,"Dien wensch van brode ende van wine,"
Onbekend,PARTHONOPEUS.,2212,Ende venisoen ende alles ghenoech.
Onbekend,PARTHONOPEUS.,2213,Hier toe hem lettel sijn herte droech:
Onbekend,PARTHONOPEUS.,2214,Hine dranc .I. twint no en at.
Onbekend,PARTHONOPEUS.,2215,"Al dat hi peinsde, was omme dat"
Onbekend,PARTHONOPEUS.,2115,"Te doene, dat hem was gheraden."
Onbekend,PARTHONOPEUS.,2217,Hi maectem in der kemenaden;
Onbekend,PARTHONOPEUS.,2218,Te bedde gaet hi verdelike
Onbekend,PARTHONOPEUS.,2219,"Al ghecledet, in der ghelike"
Onbekend,PARTHONOPEUS.,2220,"Ofte hi Melioers hadde begheert,"
Onbekend,PARTHONOPEUS.,2120,"Die hi so langhe hevet ombeert,"
Onbekend,PARTHONOPEUS.,2222,Ende gherne hoorde ende sprake;
Onbekend,PARTHONOPEUS.,2223,"Neen, het es al ander sake,"
Onbekend,PARTHONOPEUS.,2224,Die hi vulbringhen soude gherne.
Onbekend,PARTHONOPEUS.,2225,Doe decti die lanterne
Onbekend,PARTHONOPEUS.,2125,"Onder tcovertoer behendelike,"
Onbekend,PARTHONOPEUS.,2227,Ende hi ontcleet hem haestelike
Onbekend,PARTHONOPEUS.,2228,"Ende ghinc ligghen up tbedde sachte,"
Onbekend,PARTHONOPEUS.,2229,Daer hi na die hoofsce wachte.
Onbekend,PARTHONOPEUS.,2230,"Hi [trac] te hem waert tcovertoer,"
Onbekend,PARTHONOPEUS.,2130,"Die [kersen] blussceden; ende Melioer,"
Onbekend,PARTHONOPEUS.,2232,"Die [milde] vrouwe ende die rike,"
Onbekend,PARTHONOPEUS.,2233,Quam [doe ghe]gaen vele hovesschelike
Onbekend,PARTHONOPEUS.,2234,Ende ghinc [ligghen] neven sier side.
Onbekend,PARTHONOPEUS.,2235,Sijns was [si uter] maten blide.
Onbekend,PARTHONOPEUS.,2135,Talree[r]st da[t Parthonope]us des
Onbekend,PARTHONOPEUS.,2237,"Ghenoech was seker ende ghewes,"
Onbekend,PARTHONOPEUS.,2238,"Dat soe naect was, trac hi van hare"
Onbekend,PARTHONOPEUS.,2239,"Tcovertoer - dat bet bleven ware -,"
Onbekend,PARTHONOPEUS.,2240,"Ende brochte dat licht ghetrect uut,"
Onbekend,PARTHONOPEUS.,2140,Dat sceen aen haer witte huut.
Onbekend,PARTHONOPEUS.,2242,Daer sach hi dat scone wijf.
Onbekend,PARTHONOPEUS.,2243,"Hem dochte, daer hi sach haer lijf,"
Onbekend,PARTHONOPEUS.,2244,Dat hi noyt sach creature
Onbekend,PARTHONOPEUS.,2245,Hebben so scone figure.
Onbekend,PARTHONOPEUS.,2246,
Onbekend,PARTHONOPEUS.,2145,"Als dus ghehoont was die ioncfrouwe,"
Onbekend,PARTHONOPEUS.,2248,"Dier hi dede groot ontrouwe,"
Onbekend,PARTHONOPEUS.,2249,Beswalt soe van groten sere.
Onbekend,PARTHONOPEUS.,2250,Doe vernam wel die ionchere
Onbekend,PARTHONOPEUS.,2251,"Dat hi ghedreven was te scerne,"
Onbekend,PARTHONOPEUS.,2150,Ende worp van hem die lanterne
Onbekend,PARTHONOPEUS.,2253,"Ieghen den muer, dat soe crakede,"
Onbekend,PARTHONOPEUS.,2254,Ende bevalse dien duvel die se makede;
Onbekend,PARTHONOPEUS.,2255,Soe brac te sticken ende tlicht verdarf.
Onbekend,PARTHONOPEUS.,2256,Parthonopeus wart die warf
Onbekend,PARTHONOPEUS.,2155,So ghesconfiert ende so ontdaen
Onbekend,PARTHONOPEUS.,2258,Hi ne wiste wat doen no wat bestaen;
Onbekend,PARTHONOPEUS.,2259,Hi sach wel dat hi dorpernie
Onbekend,PARTHONOPEUS.,2260,[Begaen had.......]
Onbekend,PARTHONOPEUS.,2261,[............]
Onbekend,PARTHONOPEUS.,2262,"""Nu waendi wijsdom hebben ghedaen;"
Onbekend,PARTHONOPEUS.,2160,Neen ghi; ic saelt u doen verstaen:
Onbekend,PARTHONOPEUS.,2264,Mijn gheslachte was al gader
Onbekend,PARTHONOPEUS.,2265,"Hooghe ende edel, ende mijn vader"
Onbekend,PARTHONOPEUS.,2266,"Was keiser, die wel deghenlike"
Onbekend,PARTHONOPEUS.,2267,Hielt te rechte sijn keiserrike.
Onbekend,PARTHONOPEUS.,2165,Van Constantinoble was hi here.
Onbekend,PARTHONOPEUS.,2269,Ter werelt haddi prijs ende ere;
Onbekend,PARTHONOPEUS.,2270,In meneghen lande was hi bekent.
Onbekend,PARTHONOPEUS.,2271,Hi dwanc al dat hem was omtrent
Onbekend,PARTHONOPEUS.,2272,"Gheseten verre ofte bi,"
Onbekend,PARTHONOPEUS.,2170,Sonder dien soudaen van Persi;
Onbekend,PARTHONOPEUS.,2274,"Want die hevet ghewelt so groot,"
Onbekend,PARTHONOPEUS.,2275,"Dat men negheen weet sijn ghenoot."""
Onbekend,PARTHONOPEUS.,2276,
Onbekend,PARTHONOPEUS.,2277,"""Doe ic kintsch ende lettel was,"
Onbekend,PARTHONOPEUS.,2278,Was mijn vader seker das
Onbekend,PARTHONOPEUS.,2175,Ende wiste wel in waren dinghen
Onbekend,PARTHONOPEUS.,2280,"Bi auguren, bi helscouwinghen[...]"""
Onbekend,PARTHONOPEUS.,2281,[............]
Onbekend,PARTHONOPEUS.,2282,"""Weten ende onderkinnen soude"
Onbekend,PARTHONOPEUS.,2283,Beede die hete entic coude;
Onbekend,PARTHONOPEUS.,2284,"Al dat men doen mach in fisiken,"
Onbekend,PARTHONOPEUS.,2180,Dies ne woudic niemene wiken.
Onbekend,PARTHONOPEUS.,2286,"So wel verstondic ende vernam,"
Onbekend,PARTHONOPEUS.,2287,Dat ic boven hen allen clam
Onbekend,PARTHONOPEUS.,2288,"Die mine meesters te voren waren,"
Onbekend,PARTHONOPEUS.,2289,Eer ic quam te minen .XII. jaren.
Onbekend,PARTHONOPEUS.,2185,"Doe leerdic van diviniteit,"
Onbekend,PARTHONOPEUS.,2291,"Die noch es dalre meeste wijsheit,"
Onbekend,PARTHONOPEUS.,2292,Ende d[oude] wet ende van der nieuwer
Onbekend,PARTHONOPEUS.,2293,Ic waens mijn meester noch nes niewer.
Onbekend,PARTHONOPEUS.,2294,"Daer na leerdic nigromantie,"
Onbekend,PARTHONOPEUS.,2190,Experimente ende gokelie.
Onbekend,PARTHONOPEUS.,2296,"So goeden sin haddicker toe,"
Onbekend,PARTHONOPEUS.,2297,Dats niemen so vele ne conste doe.
Onbekend,PARTHONOPEUS.,2298,"Ware iemen dies hem onderwonde,"
Onbekend,PARTHONOPEUS.,2299,"Ende hi van desen vele conde[.....]"""
Onbekend,PARTHONOPEUS.,2300,[............]
Onbekend,PARTHONOPEUS.,2301,"""[..... so grote claerheit],"
Onbekend,PARTHONOPEUS.,2195,Of het ware een somers dach.
Onbekend,PARTHONOPEUS.,2303,"[Op tplein des] velts dat voor ons lach,"
Onbekend,PARTHONOPEUS.,2304,Dedic datter riddren quamen
Onbekend,PARTHONOPEUS.,2305,".II. dusent ofte .III. te samen,"
Onbekend,PARTHONOPEUS.,2306,"Ghewapent ende ghereden wel,"
Onbekend,PARTHONOPEUS.,2200,Up ors die groot waren ende snel.
Onbekend,PARTHONOPEUS.,2308,"Die dedic vechten onderlinghe,"
Onbekend,PARTHONOPEUS.,2309,So dat sciere die witte ringhe
Onbekend,PARTHONOPEUS.,2310,"Scenen van den bloede root,"
Onbekend,PARTHONOPEUS.,2311,"Entie storm wort harde groot,"
Onbekend,PARTHONOPEUS.,2205,Ende stoet alse langhe als mi bequam;
Onbekend,PARTHONOPEUS.,2313,"Ende alsic woude, ict al benam,"
Onbekend,PARTHONOPEUS.,2314,Ende deet algader te hant te varen.
Onbekend,PARTHONOPEUS.,2315,"Doe dedic comen andre scare[n],"
Onbekend,PARTHONOPEUS.,2316,"Beede draken ende lioene,"
Onbekend,PARTHONOPEUS.,2210,Ende ander diere starc ende coene;
Onbekend,PARTHONOPEUS.,2318,"Menech vreselic dier, menech worm."
Onbekend,PARTHONOPEUS.,2319,"Dan dedic vechten enen andren storm."""
Onbekend,PARTHONOPEUS.,2320,[............]
Onbekend,PARTHONOPEUS.,2321,"""Nu prisic dat algader niet"
Onbekend,PARTHONOPEUS.,2322,Bi dien dat mi dit es ghesciet
Onbekend,PARTHONOPEUS.,2215,"Dat ic des[al]bem worden sonder,"
Onbekend,PARTHONOPEUS.,2324,Daer ic bi dede menich wonder.
Onbekend,PARTHONOPEUS.,2325,"Dat ic met arbeiden hadde gheleert,"
Onbekend,PARTHONOPEUS.,2326,Dat es mi al bi u ontkeert.
Onbekend,PARTHONOPEUS.,2327,"Eer die dagheraet sal bliken claer,"
Onbekend,PARTHONOPEUS.,2220,Suldi wel weten dat ic waer
Onbekend,PARTHONOPEUS.,2329,"Dicken hebbe gheseit hier te voren,"
Onbekend,PARTHONOPEUS.,2330,"Als men u sien sal ende horen,"
Onbekend,PARTHONOPEUS.,2331,"Ende onse minne bliken sal,"
Onbekend,PARTHONOPEUS.,2332,Die ic bi miere wijsheit hal.
Onbekend,PARTHONOPEUS.,2225,"Wel soete vrient, bi miere wit,"
Onbekend,PARTHONOPEUS.,2334,"Ic soude lettel claghen dit,"
Onbekend,PARTHONOPEUS.,2335,Maer mi crinct een ander smerte
Onbekend,PARTHONOPEUS.,2336,Dat mi sere torment mijn herte.
Onbekend,PARTHONOPEUS.,2337,Nu moghedi horen wat moghe sijn:
Onbekend,PARTHONOPEUS.,2230,"Mitter dagheraet morghijn[....] """
Onbekend,PARTHONOPEUS.,2339,
Onbekend,PARTHONOPEUS.,2340,X
Onbekend,PARTHONOPEUS.,2341,
Onbekend,PARTHONOPEUS.,2342,[............]
Onbekend,PARTHONOPEUS.,2343,"""Die hout dus starken evelen moet;"
Onbekend,PARTHONOPEUS.,2344,"Mi dinct dat het quaet minnen doet,"
Onbekend,PARTHONOPEUS.,2345,"Of iet mesciet bi aventuren,"
Onbekend,PARTHONOPEUS.,2346,"Dat het dus langhe sal gheduren,"
Onbekend,PARTHONOPEUS.,2235,"Ende ment vergheven niet ne wille."""
Onbekend,PARTHONOPEUS.,2348,Met desen zweghen si beede stille.
Onbekend,PARTHONOPEUS.,2349,
Onbekend,PARTHONOPEUS.,2350,Parthonopeus heeft dit ghehoort;
Onbekend,PARTHONOPEUS.,2351,"Selve ne sprac hi niet een woort,"
Onbekend,PARTHONOPEUS.,2352,Newaer die lachter ende tgrote zeer
Onbekend,PARTHONOPEUS.,2240,Sneet hem in therte allene meer.
Onbekend,PARTHONOPEUS.,2354,"Hi rechte hem op, ende bleef also"
Onbekend,PARTHONOPEUS.,2355,Op tbedde sittende ende was onvro.
Onbekend,PARTHONOPEUS.,2356,"Urake, die hovesch was ende vroet,"
Onbekend,PARTHONOPEUS.,2357,"Diende hem, daer soe voor hem stoet;"
Onbekend,PARTHONOPEUS.,2245,"Ende alle dandere stonden ghereet,"
Onbekend,PARTHONOPEUS.,2359,"Ne hadt haer vrouwe niet ghesijn leet,"
Onbekend,PARTHONOPEUS.,2360,Hem te diene ende ere te doene;
Onbekend,PARTHONOPEUS.,2361,"Maer nu ne wassere gheen so coene,"
Onbekend,PARTHONOPEUS.,2362,Die den bedde dorste ghenaken
Onbekend,PARTHONOPEUS.,2250,"Hem te diene van eneghen saken,"
Onbekend,PARTHONOPEUS.,2364,Ende bleven alle staende stille;
Onbekend,PARTHONOPEUS.,2365,Doch droeghen si hem alle goeden wille.
Onbekend,PARTHONOPEUS.,2366,In dole sat hi ende omberaden.
Onbekend,PARTHONOPEUS.,2367,"Urake gaf hem sine waden,"
Onbekend,PARTHONOPEUS.,2255,Die hi alreerst brochte voort daer;
Onbekend,PARTHONOPEUS.,2369,"Dat segghic u al over waer,"
Onbekend,PARTHONOPEUS.,2370,Hine mochte hebben ghene el.
Onbekend,PARTHONOPEUS.,2371,"Als hi se sach, hi kinnese wel."
Onbekend,PARTHONOPEUS.,2372,"So[e] began hem aendoen sine hemde,"
Onbekend,PARTHONOPEUS.,2260,"Al ongherecht, das was vremde,"
Onbekend,PARTHONOPEUS.,2374,So langhe hadt daer ghesijn;
Onbekend,PARTHONOPEUS.,2375,"Daer boven een grau pels[e]kijn,"
Onbekend,PARTHONOPEUS.,2376,"Enen groenen roc, die noch doe"
Onbekend,PARTHONOPEUS.,2377,Wel hadde ghehouden sine vloe.
Onbekend,PARTHONOPEUS.,2265,Doe tracse aen dat nouwe ghescoete
Onbekend,PARTHONOPEUS.,2379,"Aen sine wel ghescepene voete,"
Onbekend,PARTHONOPEUS.,2380,"Cousen ende socken ende leersen dicke,"
Onbekend,PARTHONOPEUS.,2381,"Sinen benen wel ghemicke,"
Onbekend,PARTHONOPEUS.,2382,Ende hart ghemaect ieghen quetsinghen.
Onbekend,PARTHONOPEUS.,2270,"Doe dede men hem sine sporen bringhen,"
Onbekend,PARTHONOPEUS.,2384,"Goet ende scone, al waren si out,"
Onbekend,PARTHONOPEUS.,2385,"Ende sonder selver, ende sonder gout."
Onbekend,PARTHONOPEUS.,2386,"Nu staet hi op voor die vrouwen,"
Onbekend,PARTHONOPEUS.,2387,Die sine scoonheit sere bescouwen:
Onbekend,PARTHONOPEUS.,2275,"Scone es hi, staerc ende groot."
Onbekend,PARTHONOPEUS.,2389,Urake gaf hem sijn sorcoot.
Onbekend,PARTHONOPEUS.,2390,[............]
Onbekend,PARTHONOPEUS.,2391,"Weenden van iammere ende va[n rouwen],"
Onbekend,PARTHONOPEUS.,2392,"Beede vrouwen ende ioncf[rouwen],"
Onbekend,PARTHONOPEUS.,2393,Ende bleven alle met droev[en sin]
Onbekend,PARTHONOPEUS.,2280,Om dat si saghen die keise[rin]
Onbekend,PARTHONOPEUS.,2395,"So verbolghen, sone dorste[n si niet]"
Onbekend,PARTHONOPEUS.,2396,"Te hem spreken, als hi danen [sciet]."
Onbekend,PARTHONOPEUS.,2397,"Urake dede haer hovesscei[t],"
Onbekend,PARTHONOPEUS.,2398,"Ende nammene in haer ghel[eit],"
Onbekend,PARTHONOPEUS.,2285,"Ende ghinc met hem toter z[ele],"
Onbekend,PARTHONOPEUS.,2400,Daer hi vant liede harde ve[le].
Onbekend,PARTHONOPEUS.,2401,"Daer hijt altoes, sonder doe,"
Onbekend,PARTHONOPEUS.,2402,"Hadde vonden wel ghero[e],"
Onbekend,PARTHONOPEUS.,2403,Nu waest verstormt ende luut
Onbekend,PARTHONOPEUS.,2290,"Beede bin den palayse, ende daer [uut],"
Onbekend,PARTHONOPEUS.,2405,"Ende alsi bin den palayse qu[amen],"
Onbekend,PARTHONOPEUS.,2406,"Mijn ioncfrouwe ende hi te samen,"
Onbekend,PARTHONOPEUS.,2407,"Sach hire vele ruddren bi[nnen],"
Onbekend,PARTHONOPEUS.,2408,"Behaghel ende van fieren sinnen,"
Onbekend,PARTHONOPEUS.,2295,.Vc. ofte mee.
Onbekend,PARTHONOPEUS.,2410,"So was hi ieghen hem ghevee,"
Onbekend,PARTHONOPEUS.,2411,"Haddi ghehat gheen goede ghe[lede],"
Onbekend,PARTHONOPEUS.,2412,Het waer hem comen te groten [lede];
Onbekend,PARTHONOPEUS.,2413,Ende ware stappans bleven do[ot];
Onbekend,PARTHONOPEUS.,2300,"Want si hadder toe wille groot,"
Onbekend,PARTHONOPEUS.,2415,Ende seiden datsi emmermeere
Onbekend,PARTHONOPEUS.,2416,Souden bliven ghelachtert [sere]
Onbekend,PARTHONOPEUS.,2417,Bi haerre groter leelicheit.
Onbekend,PARTHONOPEUS.,2418,Daer was bin dien daghe vele [gheseit]
Onbekend,PARTHONOPEUS.,2305,"Van hare, menich scone wo[ort],"
Onbekend,PARTHONOPEUS.,2420,Dat te rechte waer onghehoort.
Onbekend,PARTHONOPEUS.,2421,"Die ne willic u niet vert[recken],"
Onbekend,PARTHONOPEUS.,2422,Want men souse met rechte [decken]:
Onbekend,PARTHONOPEUS.,2423,Dorperheit seiden si van hare;
Onbekend,PARTHONOPEUS.,2310,Beede stille ende openbare
Onbekend,PARTHONOPEUS.,2425,Waren si alle haer ieghen:
Onbekend,PARTHONOPEUS.,2426,Cume blevet sine hadse versle[ghen].
Onbekend,PARTHONOPEUS.,2427,Si traken op [t]hare ende rume[den thof].
Onbekend,PARTHONOPEUS.,2428,In erren moede sonder orlof
Onbekend,PARTHONOPEUS.,2315,"Saten si alle op, ende alte ha[nt]"
Onbekend,PARTHONOPEUS.,2430,Keerden [si] weder in haer lant.
Onbekend,PARTHONOPEUS.,2431,Urake gheleedde den ionghelinc;
Onbekend,PARTHONOPEUS.,2432,Wel goelike soe met hem ghinc
Onbekend,PARTHONOPEUS.,2433,Tes si quamen ter scepin[ghen]:
Onbekend,PARTHONOPEUS.,2320,So verre wilt soene ghebring[hen]
Onbekend,PARTHONOPEUS.,2435,Dat hi tlijf mochte ont[draghen].
Onbekend,PARTHONOPEUS.,2436,[............]
Onbekend,PARTHONOPEUS.,2437,"[E]nde seiden dorpernie van hare,"
Onbekend,PARTHONOPEUS.,2438,[D]ie onw[aer enti]e verlelict ware.
Onbekend,PARTHONOPEUS.,2439,[D]ies was Urake harde onblide.
Onbekend,PARTHONOPEUS.,2325,"[S]i dede hem bringhen sijn rosside,"
Onbekend,PARTHONOPEUS.,2441,[M]agher ende arem ende onghedaen;
Onbekend,PARTHONOPEUS.,2442,[V]an verren sach hijt ende saecht staen.
Onbekend,PARTHONOPEUS.,2443,[A]l sijn harnasch was niet een haer
Onbekend,PARTHONOPEUS.,2444,"[Gh]earghert, sent hijt brachte daer."
Onbekend,PARTHONOPEUS.,2330,"[H]em was ghetorst sijn reghencleet,"
Onbekend,PARTHONOPEUS.,2446,"[A]l quaemt hem weder wel ghereet,"
Onbekend,PARTHONOPEUS.,2447,[Daer] hi mede te vleescene plach
Onbekend,PARTHONOPEUS.,2448,"[T]wilt, als het ghevellet lach:"
Onbekend,PARTHONOPEUS.,2449,[N]iet en docht hem verkeert een twint.
Onbekend,PARTHONOPEUS.,2335,"[T]e seilne haddi goeden wint,"
Onbekend,PARTHONOPEUS.,2451,[E]nde als gheluc en haddi meer.
Onbekend,PARTHONOPEUS.,2452,"[T]selve scip, daer ic af seide eer,"
Onbekend,PARTHONOPEUS.,2453,"[W]ant de mast daer ghevellet lach,"
Onbekend,PARTHONOPEUS.,2454,[Daer] hi mede te vaerne plach
Onbekend,PARTHONOPEUS.,2340,"[T]e voren, doe hi niemen [en] sach,"
Onbekend,PARTHONOPEUS.,2456,"[E]nde dat hadde so scone ghetouwe,"
Onbekend,PARTHONOPEUS.,2457,[D]ede hem reeden die ioncfrouwe.
Onbekend,PARTHONOPEUS.,2458,"[S]elve ghinc soe int scip, ende bat"
Onbekend,PARTHONOPEUS.,2459,"[E]nde beval hem allen dat,"
Onbekend,PARTHONOPEUS.,2345,"[D]ie meesters van den scepe waren,"
Onbekend,PARTHONOPEUS.,2461,"[D]at si te lande souden varen,"
Onbekend,PARTHONOPEUS.,2462,[A]ls lief als si hadden lijf ende ere;
Onbekend,PARTHONOPEUS.,2463,[D]at si te Nantes die[n] ionchere
Onbekend,PARTHONOPEUS.,2464,[V]oeren souden met ghemake;
Onbekend,PARTHONOPEUS.,2350,"[Gh]eviele ooc dat hem wints ghebrake,"
Onbekend,PARTHONOPEUS.,2466,"[E]nde si iewer moesten daghen,"
Onbekend,PARTHONOPEUS.,2467,"[D]at si sijns met eren plaghen,"
Onbekend,PARTHONOPEUS.,2468,"[E]nde van hem sceden niet ne souden,"
Onbekend,PARTHONOPEUS.,2469,"[T]es si waren comen behouden,"
Onbekend,PARTHONOPEUS.,2355,[Daer] hi selve woude wesen.
Onbekend,PARTHONOPEUS.,2471,"[D]us beriet soene, ende met desen"
Onbekend,PARTHONOPEUS.,2472,"[S]ciet soe van hem wenende sere,"
Onbekend,PARTHONOPEUS.,2473,[E]nde bevalne Gode Onsen Here.
Onbekend,PARTHONOPEUS.,2474,
Onbekend,PARTHONOPEUS.,2475,Doe seildi wech en trouwe
Onbekend,PARTHONOPEUS.,2360,"Parthonopeus, die so groten rouwe"
Onbekend,PARTHONOPEUS.,2477,"[D]reef: nieman, die levende bleef,"
Onbekend,PARTHONOPEUS.,2478,"[E]nde groten rouwe als [hi] doe, dreef."
Onbekend,PARTHONOPEUS.,2479,[Door]dattene die ioncfrouwe beval
Onbekend,PARTHONOPEUS.,2480,"[S]o harde, so stoet hem al"
Onbekend,PARTHONOPEUS.,2365,[T]e dienste dat hem was bi.
Onbekend,PARTHONOPEUS.,2482,[B]innen .XV. daghen quamen si
Onbekend,PARTHONOPEUS.,2483,[Te Nantes in de havene ghevaren.]
Onbekend,PARTHONOPEUS.,2484,[............]
Onbekend,PARTHONOPEUS.,2485,Dien ionchere ende sijn rosside
Onbekend,PARTHONOPEUS.,2486,Voeren si wech al tote Bloys;
Onbekend,PARTHONOPEUS.,2370,"Daer setten si uut dien Fransoys,"
Onbekend,PARTHONOPEUS.,2488,"Ende leeden uut op tlant sijn paert,"
Onbekend,PARTHONOPEUS.,2489,Ende keerden weder te scepe waert.
Onbekend,PARTHONOPEUS.,2490,"Alsi wech voeren, sach hi achter;"
Onbekend,PARTHONOPEUS.,2491,Dat was siere herte vele tonsachter
Onbekend,PARTHONOPEUS.,2375,Dan u iemen vertellen mach.
Onbekend,PARTHONOPEUS.,2493,"Als hise dan so verre sach,"
Onbekend,PARTHONOPEUS.,2494,"Dat hise niet en mochte spreken,"
Onbekend,PARTHONOPEUS.,2495,"Dochtem ontwee sine herte breken,"
Onbekend,PARTHONOPEUS.,2496,Ende ofte hi stappans sterven soude:
Onbekend,PARTHONOPEUS.,2380,"Boven opt hovet nammene een coude,"
Onbekend,PARTHONOPEUS.,2498,Dat hem doorliep sine lede;
Onbekend,PARTHONOPEUS.,2499,"Daer na quam hem een bleechede,"
Onbekend,PARTHONOPEUS.,2500,"Datti enen doden ghelijc sceen,"
Onbekend,PARTHONOPEUS.,2501,Ende viel driewaerf al in een
Onbekend,PARTHONOPEUS.,2385,In ommacht op die erde neder.
Onbekend,PARTHONOPEUS.,2503,"Ende als hi was becomen weder,"
Onbekend,PARTHONOPEUS.,2504,"Harde vaerlijc hi op scoot,"
Onbekend,PARTHONOPEUS.,2505,"Ende sach staerlike na den boot,"
Onbekend,PARTHONOPEUS.,2506,"Die hem dochte wesen so snel,"
Onbekend,PARTHONOPEUS.,2390,Dat niet en bequam sier herten wel.
Onbekend,PARTHONOPEUS.,2508,"Als hine nemmeer [en] mochte sien,"
Onbekend,PARTHONOPEUS.,2509,"Wart hi so sere ondaen van dien,"
Onbekend,PARTHONOPEUS.,2510,Dat hem sijn herte doclfte smelten;
Onbekend,PARTHONOPEUS.,2511,Doe moesti vallen ende beswelten
Onbekend,PARTHONOPEUS.,2395,"Tenen gadere so menech waerf,"
Onbekend,PARTHONOPEUS.,2513,"Mi wondert dat hi doe niet en staerf,"
Onbekend,PARTHONOPEUS.,2514,Want sijns daer niemen waer ne nam.
Onbekend,PARTHONOPEUS.,2515,Ende als hi them selven weder quam
Onbekend,PARTHONOPEUS.,2516,Bleef hi daer staende op tsant
Onbekend,PARTHONOPEUS.,2400,Vele elendich in sijn selves lant.
Onbekend,PARTHONOPEUS.,2518,"""Ay! arme,"" seiti, ""elendich keitijf,"
Onbekend,PARTHONOPEUS.,2519,Hoe sere mach mi rouwen mijn lijf!
Onbekend,PARTHONOPEUS.,2520,"Ic ben der onghevallichster een,"
Onbekend,PARTHONOPEUS.,2521,Die ie ter werelt dach besceen.
Onbekend,PARTHONOPEUS.,2405,"Hoe wel mochtic sijn bleven doet,"
Onbekend,PARTHONOPEUS.,2523,"Dat ic prijs hadde ende goet,"
Onbekend,PARTHONOPEUS.,2524,Dies mi mijn lijf onwerdich es!
Onbekend,PARTHONOPEUS.,2525,Twi ne doo[d]de mi niet die grave Mares
Onbekend,PARTHONOPEUS.,2526,Doe ic was in sine vancnesse?
Onbekend,PARTHONOPEUS.,2410,Of doe ic was in eer wildernesse
Onbekend,PARTHONOPEUS.,2528,"In Ardenen onder die diere,"
Onbekend,PARTHONOPEUS.,2529,"Dier vele waren ende onghiere,"
Onbekend,PARTHONOPEUS.,2530,"Twi ne was ic niet verteert van dien?"""
Onbekend,PARTHONOPEUS.,2531,[............]
Onbekend,PARTHONOPEUS.,2532,Dat mesquam hem uter maten.
Onbekend,PARTHONOPEUS.,2415,Datti den coninc entie prelaten
Onbekend,PARTHONOPEUS.,2534,"Sach den groten rouwe driven,"
Onbekend,PARTHONOPEUS.,2535,"Dien men niet mochte bescriven,"
Onbekend,PARTHONOPEUS.,2536,Dies ne achti niet een haer.
Onbekend,PARTHONOPEUS.,2537,Wel .L. daghe waren si daer.
Onbekend,PARTHONOPEUS.,2420,Doe lieten si alle den keitijf
Onbekend,PARTHONOPEUS.,2539,Leeden sulc keitivelijc lijf
Onbekend,PARTHONOPEUS.,2540,"Als een, die es verloren."
Onbekend,PARTHONOPEUS.,2541,"Nie ne wart man no wijf gheboren,"
Onbekend,PARTHONOPEUS.,2542,"Die rouwe dreef ghelijc den sinen,"
Onbekend,PARTHONOPEUS.,2425,Daer hi sijn lijf ghinc mede pinen.
Onbekend,PARTHONOPEUS.,2544,Temeer [ne] gheerdi niet die doot;
Onbekend,PARTHONOPEUS.,2545,Newaer lanc torment groot
Onbekend,PARTHONOPEUS.,2546,"Willi doen sinen bosen live,"
Onbekend,PARTHONOPEUS.,2547,Dat het in langher qualen blive.
Onbekend,PARTHONOPEUS.,2430,Nu moghedi horen wat [spise hi teerde]
Onbekend,PARTHONOPEUS.,2549,"Van etene, als hijt begheerde,"
Onbekend,PARTHONOPEUS.,2550,Ende hi hem makede tonghereke:
Onbekend,PARTHONOPEUS.,2551,Drie werf at hi bin der weke
Onbekend,PARTHONOPEUS.,2552,Broot van ghersten of van even.
Onbekend,PARTHONOPEUS.,2435,Mi wondert hoe hire mochte bi leven.
Onbekend,PARTHONOPEUS.,2554,Die fonteine hi daer toe dranc.
Onbekend,PARTHONOPEUS.,2555,Sijn haer lieti wassen lanc;
Onbekend,PARTHONOPEUS.,2556,Sine naghele ne corti niet;
Onbekend,PARTHONOPEUS.,2557,Sijn hovet hi onghedweghen liet;
Onbekend,PARTHONOPEUS.,2440,"Hine dede niet sine cleder uut,"
Onbekend,PARTHONOPEUS.,2559,Hi lietse rotten aen sijn huut;
Onbekend,PARTHONOPEUS.,2560,Dus tormentem die ionchere.
Onbekend,PARTHONOPEUS.,2561,"Met sulker pine, met sulken sere"
Onbekend,PARTHONOPEUS.,2562,Leeddi sijn lijf een iaer lanc.
Onbekend,PARTHONOPEUS.,2445,Tenden iare was hi so cranc
Onbekend,PARTHONOPEUS.,2564,"Ende so magher ende so bleec,"
Onbekend,PARTHONOPEUS.,2565,"Dat hi lettel hem selven gheleec,"
Onbekend,PARTHONOPEUS.,2566,Ende niemen[ne] mochte bekinnen.
Onbekend,PARTHONOPEUS.,2567,"Tseer, dat hem lach in therte binnen,"
Onbekend,PARTHONOPEUS.,2450,Dies wart men aen hem gheware.
Onbekend,PARTHONOPEUS.,2569,Elc man mochte bin .I. jare
Onbekend,PARTHONOPEUS.,2570,Ende bi sulker spisen arghen sere.
Onbekend,PARTHONOPEUS.,2571,"So cranc was worden die ionchere,"
Onbekend,PARTHONOPEUS.,2572,Datti allene niet mochte op staen
Onbekend,PARTHONOPEUS.,2455,"Ende .I. spoor niet voort ghegaen,"
Onbekend,PARTHONOPEUS.,2574,Het ne ware dat men[ne] hilde
Onbekend,PARTHONOPEUS.,2575,Ende leedene daer hi wesen wilde.
Onbekend,PARTHONOPEUS.,2576,"Dus torment hem die keitijf,"
Onbekend,PARTHONOPEUS.,2577,Met dier pine leeddi sijn lijf.
