author,chapter,line,text
Onbekend,Onbekend Hoofdstuk,1,WIllam die madock maecte
Onbekend,Onbekend Hoofdstuk,2,Dair hi dicke om waecte
Onbekend,Onbekend Hoofdstuk,3,Hem iamerde zeer haerde
Onbekend,Onbekend Hoofdstuk,4,Dat die geeste van reynaerde
Onbekend,Onbekend Hoofdstuk,5,Niet te recht en is gescreuen
Onbekend,Onbekend Hoofdstuk,6,Een deel is dair after gebleuen
Onbekend,Onbekend Hoofdstuk,7,Daer om dede hy die vite zoeken
Onbekend,Onbekend Hoofdstuk,8,Ende heeftse wtten walschen boeken
Onbekend,Onbekend Hoofdstuk,9,Jn duutsche aldus begonnen
Onbekend,Onbekend Hoofdstuk,10,God wil ons sijn hulpe gonnen
Onbekend,Onbekend Hoofdstuk,11,Nv keer my dair toe mynen synne
Onbekend,Onbekend Hoofdstuk,12,Dat ic bidde in dit begynne
Onbekend,Onbekend Hoofdstuk,13,Beide den dorpers ende den doren
Onbekend,Onbekend Hoofdstuk,14,Off sy comen dair zijt horen
Onbekend,Onbekend Hoofdstuk,15,Dese rijm ende dese woort
Onbekend,Onbekend Hoofdstuk,16,Off sy hem duncken niet goet gehoort
Onbekend,Onbekend Hoofdstuk,17,Dat sy die ongelastert laten
Onbekend,Onbekend Hoofdstuk,18,Mer so wie die doget haten
Onbekend,Onbekend Hoofdstuk,19,Die maken mitter logen malsch
Onbekend,Onbekend Hoofdstuk,20,Ende oordelen mennige rijm valsch
Onbekend,Onbekend Hoofdstuk,21,Dair sy niet meer of en weten
Onbekend,Onbekend Hoofdstuk,22,Dan sy doen hoe sy alle heten
Onbekend,Onbekend Hoofdstuk,23,Die nv woenen bynnen pauijen
Onbekend,Onbekend Hoofdstuk,24,Deden sy wel si soudens vertijen
Onbekend,Onbekend Hoofdstuk,25,Ende laten begaen elcken man
Onbekend,Onbekend Hoofdstuk,26,Mit sulken kunsten als hi can
Onbekend,Onbekend Hoofdstuk,27,Dit en seg ic niet om mynen wil
Onbekend,Onbekend Hoofdstuk,28,Mijn gedicht wair gebleuen stil
Onbekend,Onbekend Hoofdstuk,29,En hads my niet een gebeden
Onbekend,Onbekend Hoofdstuk,30,Die in groter heuscheden
Onbekend,Onbekend Hoofdstuk,31,Gerne keert al hair zaken
Onbekend,Onbekend Hoofdstuk,32,Si bad my dat ic woude maken
Onbekend,Onbekend Hoofdstuk,33,Die auentuer van reynaerde
Onbekend,Onbekend Hoofdstuk,34,Al berisp ic die musaerde
Onbekend,Onbekend Hoofdstuk,35,Ende die dorpers ende die doren
Onbekend,Onbekend Hoofdstuk,36,Jc wil wel dat die geen diet horen
Onbekend,Onbekend Hoofdstuk,37,Die gerne plegen der eren
Onbekend,Onbekend Hoofdstuk,38,Ende haren syn dair toe keren
Onbekend,Onbekend Hoofdstuk,39,Dat sy leuen in heuscheiden
Onbekend,Onbekend Hoofdstuk,40,Nv hoort ic sel v voort besceiden
Onbekend,Onbekend Hoofdstuk,41,Den syn des woorts na dit prologe
Onbekend,Onbekend Hoofdstuk,42,Mer ic bid v so wat ic toge
Onbekend,Onbekend Hoofdstuk,43,Hoort die woorden ende merct den syn
Onbekend,Onbekend Hoofdstuk,44,Onthout dair leit veel wijsheit in.
Onbekend,Onbekend Hoofdstuk,45,HEt was op enen pijnxster dach
Onbekend,Onbekend Hoofdstuk,46,Dat men woude ende velde sach
Onbekend,Onbekend Hoofdstuk,47,Groen staen myt louer ende grass
Onbekend,Onbekend Hoofdstuk,48,Ende menich vogel blide wass
Onbekend,Onbekend Hoofdstuk,49,Mit sange in hagen ende in bomen
Onbekend,Onbekend Hoofdstuk,50,Die crude sproten wt ende die bloemen
Onbekend,Onbekend Hoofdstuk,51,Die wel roken hier ende daer
Onbekend,Onbekend Hoofdstuk,52,Ende die dach was schoon ende claer
Onbekend,Onbekend Hoofdstuk,53,Nobel die coninc van allen dieren
Onbekend,Onbekend Hoofdstuk,54,Had sijn hoff doen kreygiren
Onbekend,Onbekend Hoofdstuk,55,Sijn lant al door ende ouer al
Onbekend,Onbekend Hoofdstuk,56,Om dat hi waende had hijs geual
Onbekend,Onbekend Hoofdstuk,57,Vol hoff te houden myt groten loue
Onbekend,Onbekend Hoofdstuk,58,Doe quamen tot des conincs houe
Onbekend,Onbekend Hoofdstuk,59,Alle dieren groot ende cleyn
Onbekend,Onbekend Hoofdstuk,60,Sonder voss reynaert alleyn
Onbekend,Onbekend Hoofdstuk,61,Hi had in thoff so veel misdaen
Onbekend,Onbekend Hoofdstuk,62,Dat hi dair niet en dorst comen gaen
Onbekend,Onbekend Hoofdstuk,63,Wie quaet doet die scuwet dat licht
Onbekend,Onbekend Hoofdstuk,64,Dat seit die scrift al ouer richt
Onbekend,Onbekend Hoofdstuk,65,Also dede reynaert dat hoff
Onbekend,Onbekend Hoofdstuk,66,Dair hi in hadde krancke loff
Onbekend,Onbekend Hoofdstuk,67,Doe al dit hoff versament was
Onbekend,Onbekend Hoofdstuk,68,En was dair nyement dan die das
Onbekend,Onbekend Hoofdstuk,69,Hy en had te clagen oeuer reynaert
Onbekend,Onbekend Hoofdstuk,70,Den fellen mitten roden baert
Onbekend,Onbekend Hoofdstuk,71,Nv gatet hier op een clagen
Onbekend,Onbekend Hoofdstuk,72,Jsegrym ende sijn magen
Onbekend,Onbekend Hoofdstuk,73,Ghingen voor den coninck staen
Onbekend,Onbekend Hoofdstuk,74,Jsegrim begonde zaen
Onbekend,Onbekend Hoofdstuk,75,Ende sprac her coninck lieue heer
Onbekend,Onbekend Hoofdstuk,76,Door v edelheit ende door v eer
Onbekend,Onbekend Hoofdstuk,77,Seide door recht ende door genaden
Onbekend,Onbekend Hoofdstuk,78,Ontfermt v der groter scaden
Onbekend,Onbekend Hoofdstuk,79,Die my reynaert heeft gedaen
Onbekend,Onbekend Hoofdstuk,80,Dair ic dick off heb ontfaen
Onbekend,Onbekend Hoofdstuk,81,Grote scande swaer verlies
Onbekend,Onbekend Hoofdstuk,82,Voor alle saken ontfermt v dies
Onbekend,Onbekend Hoofdstuk,83,Dat hi mijn goede wijff verdoort
Onbekend,Onbekend Hoofdstuk,84,Ende mijn kijnder so vermoort
Onbekend,Onbekend Hoofdstuk,85,Dat hi die beseycte dair sy lagen
Onbekend,Onbekend Hoofdstuk,86,Datter geen synt nye en sagen
Onbekend,Onbekend Hoofdstuk,87,Ende sijn al gader staet blynt
Onbekend,Onbekend Hoofdstuk,88,Nochtant hoende hi my noch synt
Onbekend,Onbekend Hoofdstuk,89,Want het was so ver gecomen
Onbekend,Onbekend Hoofdstuk,90,Datter een was van op genomen
Onbekend,Onbekend Hoofdstuk,91,Ende reynaert soude hebben gedaen
Onbekend,Onbekend Hoofdstuk,92,Sijn onscout. ende also zaen
Onbekend,Onbekend Hoofdstuk,93,Als die heiligen waren voort gebrocht
Onbekend,Onbekend Hoofdstuk,94,Was reynaert anders syns bedocht
Onbekend,Onbekend Hoofdstuk,95,Ende ontvoer ons in sijn veste
Onbekend,Onbekend Hoofdstuk,96,Heer dat weten noch die beste
Onbekend,Onbekend Hoofdstuk,97,Die tot uwen houe sijn al hier
Onbekend,Onbekend Hoofdstuk,98,My heeft reynaert dat felle dier
Onbekend,Onbekend Hoofdstuk,99,So veel gedaen te leide
Onbekend,Onbekend Hoofdstuk,100,Hy en leeft niet diet v seide
Onbekend,Onbekend Hoofdstuk,101,Ja al waert al perkement
Onbekend,Onbekend Hoofdstuk,102,Dat laken dat men maect te ghent
Onbekend,Onbekend Hoofdstuk,103,Men zouts dair in niet connen scyuen
Onbekend,Onbekend Hoofdstuk,104,Dit laet ic noch al after bliuen
Onbekend,Onbekend Hoofdstuk,105,Mer mijns wijfs laster
Onbekend,Onbekend Hoofdstuk,106,En mach niet bliuen after
Onbekend,Onbekend Hoofdstuk,107,Noch ongebetert off ongewroken
Onbekend,Onbekend Hoofdstuk,108,Als ysegrym dese woord had gesproken
Onbekend,Onbekend Hoofdstuk,109,Stont op een hondekijn ende hiet corttoys
Onbekend,Onbekend Hoofdstuk,110,Ende claechde den coninc in fransoys
Onbekend,Onbekend Hoofdstuk,111,Hoe dat so arm was wilen eer
Onbekend,Onbekend Hoofdstuk,112,Dattet alles goets en had niet meer
Onbekend,Onbekend Hoofdstuk,113,in enen winter in enen vorst
Onbekend,Onbekend Hoofdstuk,114,Dan alleen een cleyne worst
Onbekend,Onbekend Hoofdstuk,115,Ende hem reynaert die selue nam
Onbekend,Onbekend Hoofdstuk,116,Tybert die cater doe voort quam
Onbekend,Onbekend Hoofdstuk,117,Al toornich ende spranc inden rynck
Onbekend,Onbekend Hoofdstuk,118,Ende seide lieue heer coninck
Onbekend,Onbekend Hoofdstuk,119,Om dat gi reynaert zijt so hout
Onbekend,Onbekend Hoofdstuk,120,So en is hier nyement ionc off out
Onbekend,Onbekend Hoofdstuk,121,Hy en heeft te wroegen voor v
Onbekend,Onbekend Hoofdstuk,122,Dat cortoys hier claget nv
Onbekend,Onbekend Hoofdstuk,123,Dats ouer mennich iaer gesciet
Onbekend,Onbekend Hoofdstuk,124,Die worst was mijn al en clach ic niet
Onbekend,Onbekend Hoofdstuk,125,Jc hadze mijnre list gewonnen
Onbekend,Onbekend Hoofdstuk,126,Dair ic by nacht quam geronnen
Onbekend,Onbekend Hoofdstuk,127,Om mijn beiach in eenre molen
Onbekend,Onbekend Hoofdstuk,128,Dair had ic die worst gestolen
Onbekend,Onbekend Hoofdstuk,129,Enen slapende molen man
Onbekend,Onbekend Hoofdstuk,130,Mer had dair corttoys yet [.]
Onbekend,Onbekend Hoofdstuk,131,Dat en was by nyemen dan by my
Onbekend,Onbekend Hoofdstuk,132,Het is best dat ontboren sy
Onbekend,Onbekend Hoofdstuk,133,Der clagen die cortoys nv doet
Onbekend,Onbekend Hoofdstuk,134,Panther sprac dochtet v nv goet
Onbekend,Onbekend Hoofdstuk,135,Tybert dat men der clagen ontbaer
Onbekend,Onbekend Hoofdstuk,136,Reynaer die is een mordenaer
Onbekend,Onbekend Hoofdstuk,137,Ende een treker ende een dief
Onbekend,Onbekend Hoofdstuk,138,Hy en heeft nyement also lief
Onbekend,Onbekend Hoofdstuk,139,Noch selue den coninc onse heer
Onbekend,Onbekend Hoofdstuk,140,Hy en woude dat hi goet ende eer
Onbekend,Onbekend Hoofdstuk,141,Veloor. mocht hi dair aen wynnen
Onbekend,Onbekend Hoofdstuk,142,Een vet morseel van eenre hennen
Onbekend,Onbekend Hoofdstuk,143,Wat seg di van eenre sagen
Onbekend,Onbekend Hoofdstuk,144,Hi dede gisteren aenden dagen
Onbekend,Onbekend Hoofdstuk,145,Een die meeste ouerdaet
Onbekend,Onbekend Hoofdstuk,146,Aen kuwart den haess die daer staet
Onbekend,Onbekend Hoofdstuk,147,Dat nye enich dier en gedede
Onbekend,Onbekend Hoofdstuk,148,Want hi hem bynnen des conincs vrede
Onbekend,Onbekend Hoofdstuk,149,Ende bynnen des conincs geleide
Onbekend,Onbekend Hoofdstuk,150,Geloofde te leren synen crede
Onbekend,Onbekend Hoofdstuk,151,En souden maken goet cappellaen
Onbekend,Onbekend Hoofdstuk,152,Ende deden voor sytten gaen
Onbekend,Onbekend Hoofdstuk,153,Ende hielten vast tusschen sijn been
Onbekend,Onbekend Hoofdstuk,154,Doe begonnen sy al in een
Onbekend,Onbekend Hoofdstuk,155,Te lesen ende te syngen bede
Onbekend,Onbekend Hoofdstuk,156,Ende riepen beide lude credo crede
Onbekend,Onbekend Hoofdstuk,157,Ende my geuiel ten seluen tiden
Onbekend,Onbekend Hoofdstuk,158,Dat ic dair verby soude liden
Onbekend,Onbekend Hoofdstuk,159,Dair hoorde ic haerre beider sanck
Onbekend,Onbekend Hoofdstuk,160,Doe maecte ic derwaert mynen ganck
Onbekend,Onbekend Hoofdstuk,161,Mit eenre herder snelre vaert
Onbekend,Onbekend Hoofdstuk,162,Dair so vandic meyster reynaert
Onbekend,Onbekend Hoofdstuk,163,Die sijn lesse had begeuen
Onbekend,Onbekend Hoofdstuk,164,Dat hi vanden eersten had opgeheuen
Onbekend,Onbekend Hoofdstuk,165,Ende diende van synen ouden speel
Onbekend,Onbekend Hoofdstuk,166,Want hi had kuwart bider keel
Onbekend,Onbekend Hoofdstuk,167,En soude hem tlijff hebben genomen
Onbekend,Onbekend Hoofdstuk,168,Wair ic hem niet te hulp gecomen
Onbekend,Onbekend Hoofdstuk,169,By auentueren ten seluen stonden
Onbekend,Onbekend Hoofdstuk,170,Aensiet hier noch die versche wonden
Onbekend,Onbekend Hoofdstuk,171,Van kuwart den eellynck
Onbekend,Onbekend Hoofdstuk,172,Jc segge v wel heer coninck
Onbekend,Onbekend Hoofdstuk,173,Laet gi dit nv ongewroken
Onbekend,Onbekend Hoofdstuk,174,Dat v vrede dus is gebroken
Onbekend,Onbekend Hoofdstuk,175,Gy en rechtet als v mannen wisen
Onbekend,Onbekend Hoofdstuk,176,Men en selt uwen kijnderen niet prisen
Onbekend,Onbekend Hoofdstuk,177,Hier na ouer mennich iaer
Onbekend,Onbekend Hoofdstuk,178,Seker panther gi segt my waer
Onbekend,Onbekend Hoofdstuk,179,Sprac ysegrim dair hi stoet
Onbekend,Onbekend Hoofdstuk,180,Wair reynaert doot het waer ons goet
Onbekend,Onbekend Hoofdstuk,181,Ons allen die gern in vreden leuen
Onbekend,Onbekend Hoofdstuk,182,Mer wart hem dit nv dus vergeuen
Onbekend,Onbekend Hoofdstuk,183,Hy sel sel noch honen bynnen deser maent
Onbekend,Onbekend Hoofdstuk,184,Sulken dies nv luttel waent
Onbekend,Onbekend Hoofdstuk,185,Doe spranc op grymbaert die das
Onbekend,Onbekend Hoofdstuk,186,Die reynaerts brueders zoen was
Onbekend,Onbekend Hoofdstuk,187,Ende sprac myt eenre grymmender tale
Onbekend,Onbekend Hoofdstuk,188,Heer ysegrim gi en segt nyet wale
Onbekend,Onbekend Hoofdstuk,189,Mer doch het is een out bispel
Onbekend,Onbekend Hoofdstuk,190,Dat viants mont sprect selden wel
Onbekend,Onbekend Hoofdstuk,191,Wat wijt gi reynaert mynen oom
Onbekend,Onbekend Hoofdstuk,192,Jc wil hi henge aen enen boom
Onbekend,Onbekend Hoofdstuk,193,By sijnre kelen als een dieff
Onbekend,Onbekend Hoofdstuk,194,Her ysegrim waert v seluer lieff
Onbekend,Onbekend Hoofdstuk,195,Ende ghijt dorst also aen aen gaen
Onbekend,Onbekend Hoofdstuk,196,Die den anderen meest had mysdaen
Onbekend,Onbekend Hoofdstuk,197,Van mynen oom ende van v
Onbekend,Onbekend Hoofdstuk,198,Al en claecht hi niet ouer v
Onbekend,Onbekend Hoofdstuk,199,Mer wair hi also wel te houe
Onbekend,Onbekend Hoofdstuk,200,Ende stonde hi so wel in sconincs loue
Onbekend,Onbekend Hoofdstuk,201,Her ysegrim als gi doet
Onbekend,Onbekend Hoofdstuk,202,Ten soude hem niet duncken goet
Onbekend,Onbekend Hoofdstuk,203,Ende gi en blijft niet ongewroken
Onbekend,Onbekend Hoofdstuk,204,Dat gi mynen oom dus hebt beropen
Onbekend,Onbekend Hoofdstuk,205,Dicke ouer v felle tanden
Onbekend,Onbekend Hoofdstuk,206,Ende hem gedaen hebt dick veel scanden
Onbekend,Onbekend Hoofdstuk,207,Dat hijs niet en conde verandwoorden
Onbekend,Onbekend Hoofdstuk,208,Sijns vrienden dies nyet gern en hoorden
Onbekend,Onbekend Hoofdstuk,209,Gi heb ten mennich werff bedrogen
Onbekend,Onbekend Hoofdstuk,210,Meer dan ic seggen soude mogen
Onbekend,Onbekend Hoofdstuk,211,Mer doch wil ic v zommich punt bewisen
Onbekend,Onbekend Hoofdstuk,212,Gi mysdeilde hem aen der pladyzen
Onbekend,Onbekend Hoofdstuk,213,Die hi v werp al vander kerren
Onbekend,Onbekend Hoofdstuk,214,Doe gi hem navolchde van verren
Onbekend,Onbekend Hoofdstuk,215,Ende die goede pladizen op laset
Onbekend,Onbekend Hoofdstuk,216,Dair gi selue mede aset
Onbekend,Onbekend Hoofdstuk,217,En gaeft hem dair off groot noch cleyn
Onbekend,Onbekend Hoofdstuk,218,Dan der pladisen graet alleyn
Onbekend,Onbekend Hoofdstuk,219,Die gi hem tegen brocht
Onbekend,Onbekend Hoofdstuk,220,Om dat gijs seluer niet en mocht
Onbekend,Onbekend Hoofdstuk,221,Ende also dedi oec vanden baeck
Onbekend,Onbekend Hoofdstuk,222,Die vet was ende van goeden smaeck
Onbekend,Onbekend Hoofdstuk,223,Dien scoot gi al in v buuckzeel
Onbekend,Onbekend Hoofdstuk,224,Doe reynaert eyschde v sijn deel
Onbekend,Onbekend Hoofdstuk,225,Ende oec had gegeten gern
Onbekend,Onbekend Hoofdstuk,226,Andwoorde gi hem tot uwen schern
Onbekend,Onbekend Hoofdstuk,227,Reynaert scone iongelinck
Onbekend,Onbekend Hoofdstuk,228,Die visch dair den baec aen hynck
Onbekend,Onbekend Hoofdstuk,229,Dien liet gi lopen door v zet
Onbekend,Onbekend Hoofdstuk,230,Reynaert was des lutel te bet
Onbekend,Onbekend Hoofdstuk,231,Dat hi den goeden baeck wan
Onbekend,Onbekend Hoofdstuk,232,Jn sulker wijs datter een man
Onbekend,Onbekend Hoofdstuk,233,Quam. dien werp in enen zack
Onbekend,Onbekend Hoofdstuk,234,Dair hi en myt groten anxt wt brack
Onbekend,Onbekend Hoofdstuk,235,Ende was wel na op die doot
Onbekend,Onbekend Hoofdstuk,236,Dit mysual ende desen noot
Onbekend,Onbekend Hoofdstuk,237,Heeft reynaert geleden door ysegrim
Onbekend,Onbekend Hoofdstuk,238,Ende twee warff noch in meerre pijn
Onbekend,Onbekend Hoofdstuk,239,GHi heren dunct v dit genoech
Onbekend,Onbekend Hoofdstuk,240,Nochtant ist meerre ongeuoch
Onbekend,Onbekend Hoofdstuk,241,Dat gi laet clagen ouer sijn wijff
Onbekend,Onbekend Hoofdstuk,242,Die reynaert al hair lijff
Onbekend,Onbekend Hoofdstuk,243,Heeft gemynt so doet hi haer
Onbekend,Onbekend Hoofdstuk,244,Ja het is langer dan zeuen iaer
Onbekend,Onbekend Hoofdstuk,245,Dat mijn oom heeft hair trouwe
Onbekend,Onbekend Hoofdstuk,246,Off dan vrouwe ersswijn die vrouwe
Onbekend,Onbekend Hoofdstuk,247,Dair mijn eynde door huescheide
Onbekend,Onbekend Hoofdstuk,248,Reynaert synen wille dede
Onbekend,Onbekend Hoofdstuk,249,Wats dan sy was te vreden ende cort genesen
Onbekend,Onbekend Hoofdstuk,250,Wat clage soude dair meer off wesen
Onbekend,Onbekend Hoofdstuk,251,Wair ysegrim hier hi souds ontberen
Onbekend,Onbekend Hoofdstuk,252,Hy doet hem selue luttel eren
Onbekend,Onbekend Hoofdstuk,253,Dat hi sijn wijff aldus bedraecht
Onbekend,Onbekend Hoofdstuk,254,Ende sy selue niet en claecht
Onbekend,Onbekend Hoofdstuk,255,Nv maect hier kuwaert die haze
Onbekend,Onbekend Hoofdstuk,256,Een clage ende een vijsuase
Onbekend,Onbekend Hoofdstuk,257,Off hi sijn less niet en lass
Onbekend,Onbekend Hoofdstuk,258,Reynaert die sijn meyster wass
Onbekend,Onbekend Hoofdstuk,259,Most hi sijn scolier niet slaen
Onbekend,Onbekend Hoofdstuk,260,Dat wair onrecht ende mysdaen
Onbekend,Onbekend Hoofdstuk,261,Ende wennen hem van sijn tuusscherien
Onbekend,Onbekend Hoofdstuk,262,Jc segt openbair ic wilt wel lyen
Onbekend,Onbekend Hoofdstuk,263,Nvmmer en leerden sy te degen
Onbekend,Onbekend Hoofdstuk,264,Nv claecht cortoys dat hi had vercregen
Onbekend,Onbekend Hoofdstuk,265,Myt pinen een goede worst
Onbekend,Onbekend Hoofdstuk,266,Die clage die wair best geuorst
Onbekend,Onbekend Hoofdstuk,267,Ja hoordi wel sy was gestolen
Onbekend,Onbekend Hoofdstuk,268,Hi en hads geleert in geenre scolen
Onbekend,Onbekend Hoofdstuk,269,Male quesijt male perdijt
Onbekend,Onbekend Hoofdstuk,270,Mit recht so wartmens qualic quijt
Onbekend,Onbekend Hoofdstuk,271,Dat men qualic heeft gewonnen
Onbekend,Onbekend Hoofdstuk,272,Wie sel reynaert des vergonnen
Onbekend,Onbekend Hoofdstuk,273,Dat hi gestolen goet vanct an
Onbekend,Onbekend Hoofdstuk,274,Yement die recht sceiden can
Onbekend,Onbekend Hoofdstuk,275,Tis reden die hem rechts verstaet
Onbekend,Onbekend Hoofdstuk,276,Dat hi dieflic goet aen vaet
Onbekend,Onbekend Hoofdstuk,277,Ja dyent van edelre hoger geboort
Onbekend,Onbekend Hoofdstuk,278,Also wel alst mynen oom toebehoort
Onbekend,Onbekend Hoofdstuk,279,Al had hi al cortoys gehangen
Onbekend,Onbekend Hoofdstuk,280,Doe hi hem myt diefte had beuangen
Onbekend,Onbekend Hoofdstuk,281,Hi en had daer niet veel aen mysdaen
Onbekend,Onbekend Hoofdstuk,282,Dan tegen die croon had gegaen
Onbekend,Onbekend Hoofdstuk,283,Te rechten buten oorlofs ons heren
Onbekend,Onbekend Hoofdstuk,284,Dair om liet hijt den coninck teren
Onbekend,Onbekend Hoofdstuk,285,Al heeft hijs crancken danck beiaget
Onbekend,Onbekend Hoofdstuk,286,Wat scaet hem al is hier beclaget
Onbekend,Onbekend Hoofdstuk,287,Reynaert is een gerechtich man
Onbekend,Onbekend Hoofdstuk,288,Die geen onrecht gedogen en kan
Onbekend,Onbekend Hoofdstuk,289,Ende dair om haet hi die quade
Onbekend,Onbekend Hoofdstuk,290,Ende hi leeft bij sijns meysters rade
Onbekend,Onbekend Hoofdstuk,291,Want synt die coninck dede
Onbekend,Onbekend Hoofdstuk,292,Roepen. ende kundigen mede
Onbekend,Onbekend Hoofdstuk,293,Synen vrede. socht hi op nyement geen beiach
Onbekend,Onbekend Hoofdstuk,294,Hy en et mer eens op enen dach
Onbekend,Onbekend Hoofdstuk,295,Ende leeft recht als een clusenaer
Onbekend,Onbekend Hoofdstuk,296,Naest synen liue draecht hi een haer
Onbekend,Onbekend Hoofdstuk,297,Ende castijt sijn lichaem seer
Onbekend,Onbekend Hoofdstuk,298,Jn enen iaer off in meer
Onbekend,Onbekend Hoofdstuk,299,En had hi vleysch wilt ofte dam
Onbekend,Onbekend Hoofdstuk,300,Dat seide een die gisteren van hem quam
Onbekend,Onbekend Hoofdstuk,301,Mapertuus heeft hi begeuen
Onbekend,Onbekend Hoofdstuk,302,Sijn casteel ende heeft verheuen
Onbekend,Onbekend Hoofdstuk,303,Een cluse dair hi licht in
Onbekend,Onbekend Hoofdstuk,304,Ander beiach noch anders gewyn
Onbekend,Onbekend Hoofdstuk,305,Waen ic wel dat hi niet en heeft
Onbekend,Onbekend Hoofdstuk,306,Yet of niet dair hi of leeft
Onbekend,Onbekend Hoofdstuk,307,Bleeck ende mager is hi van pinen
Onbekend,Onbekend Hoofdstuk,308,Honger ende dorst ende swaer termynen
Onbekend,Onbekend Hoofdstuk,309,Doget hi voor sijn sonden
Onbekend,Onbekend Hoofdstuk,310,Recht in desen seluen stonden
Onbekend,Onbekend Hoofdstuk,311,Dat grymbaert stont in deser talen
Onbekend,Onbekend Hoofdstuk,312,Sagen sy neder wart ten dalen
Onbekend,Onbekend Hoofdstuk,313,Cantecleer comen geuaren
Onbekend,Onbekend Hoofdstuk,314,Ende brochten op eenre baren
Onbekend,Onbekend Hoofdstuk,315,Een dode henne ende hiet coppe
Onbekend,Onbekend Hoofdstuk,316,Die reynaert had biden croppe
Onbekend,Onbekend Hoofdstuk,317,Den hals ende heeft off gebeten
Onbekend,Onbekend Hoofdstuk,318,Dit most nv die coninck weten
Onbekend,Onbekend Hoofdstuk,319,CAntecleer die quam voor gaende
Onbekend,Onbekend Hoofdstuk,320,Mit synen vederen zeer slaende
Onbekend,Onbekend Hoofdstuk,321,Aen elliker zide vander baren
Onbekend,Onbekend Hoofdstuk,322,Gyngen twee hanen die droeuich waren
Onbekend,Onbekend Hoofdstuk,323,Die een haen heet cantecleer
Onbekend,Onbekend Hoofdstuk,324,Dair na geheten wart wilen eer
Onbekend,Onbekend Hoofdstuk,325,Vrou alente hair goede haen
Onbekend,Onbekend Hoofdstuk,326,Die ander hiet na mynen waen
Onbekend,Onbekend Hoofdstuk,327,Die goede haen craeyaert
Onbekend,Onbekend Hoofdstuk,328,Die stoutste die men vant
Onbekend,Onbekend Hoofdstuk,329,Tusschen hollant ende ordanen
Onbekend,Onbekend Hoofdstuk,330,Ellic van desen voorseiden hanen
Onbekend,Onbekend Hoofdstuk,331,Droech wyeroock ende stallicht
Onbekend,Onbekend Hoofdstuk,332,Die beide lanck waren ende richt
Onbekend,Onbekend Hoofdstuk,333,Die waren coppens brueders twee
Onbekend,Onbekend Hoofdstuk,334,Ende riepen wach ende wee
Onbekend,Onbekend Hoofdstuk,335,Om haerre zuster coppens doot
Onbekend,Onbekend Hoofdstuk,336,Sy dreuen rouwe ende droefheit groot
Onbekend,Onbekend Hoofdstuk,337,Pijnte ende sproete drogen die baer
Onbekend,Onbekend Hoofdstuk,338,Hem was te moede herde swaer
Onbekend,Onbekend Hoofdstuk,339,Om coppen die sy hadden verloren
Onbekend,Onbekend Hoofdstuk,340,Men mochtse herde ver horen
Onbekend,Onbekend Hoofdstuk,341,Haerre beider kermynge
Onbekend,Onbekend Hoofdstuk,342,Aldus quamen sy in tgedynge
Onbekend,Onbekend Hoofdstuk,343,Cantecleer spranck inden rijnck
Onbekend,Onbekend Hoofdstuk,344,Ende seide lieue heer coninck
Onbekend,Onbekend Hoofdstuk,345,Hoort na my door v genaden
Onbekend,Onbekend Hoofdstuk,346,Ende ontfermt v der groter scaden
Onbekend,Onbekend Hoofdstuk,347,Die my reynaert heeft gedaen
Onbekend,Onbekend Hoofdstuk,348,Ende mynen kijnderen die hier staen
Onbekend,Onbekend Hoofdstuk,349,Dies zeer hebben haren onwille
Onbekend,Onbekend Hoofdstuk,350,Ten inganck van aprille
Onbekend,Onbekend Hoofdstuk,351,Als die wijnter leden was
Onbekend,Onbekend Hoofdstuk,352,Ende men sach louer ende gras
Onbekend,Onbekend Hoofdstuk,353,Scoon bloeyen ende staen groen
Onbekend,Onbekend Hoofdstuk,354,Doe was ic fier ende harde coen
Onbekend,Onbekend Hoofdstuk,355,Van mynen groten geslachte
Onbekend,Onbekend Hoofdstuk,356,Jc hadde der ionger sonen achte
Onbekend,Onbekend Hoofdstuk,357,Ende dochteren schoon zeuen
Onbekend,Onbekend Hoofdstuk,358,Die al wel lusten te leuen
Onbekend,Onbekend Hoofdstuk,359,Die mijn wijff coppen die vroede
Onbekend,Onbekend Hoofdstuk,360,Herde wijsselic opvoede
Onbekend,Onbekend Hoofdstuk,361,Sy waren vet ende sterck
Onbekend,Onbekend Hoofdstuk,362,Ende gyngen te samen in een perck
Onbekend,Onbekend Hoofdstuk,363,Dat was besloten myt eenre mueren
Onbekend,Onbekend Hoofdstuk,364,Dair bynnen stont eens monics scuere
Onbekend,Onbekend Hoofdstuk,365,Dair sess stercke hond toe hoorden
Onbekend,Onbekend Hoofdstuk,366,Die mennige dieren den pels scoorden
Onbekend,Onbekend Hoofdstuk,367,Des waren mijn kijnder onuervaert
Onbekend,Onbekend Hoofdstuk,368,Dit benyde die dieff vos reynaert
Onbekend,Onbekend Hoofdstuk,369,Dat sy so vast waren dair bynnen
Onbekend,Onbekend Hoofdstuk,370,Ende haerre geen en const hi gewynnen
Onbekend,Onbekend Hoofdstuk,371,Reynaert die felle gebuere
Onbekend,Onbekend Hoofdstuk,372,Hoe dick ghinc hi om die muere
Onbekend,Onbekend Hoofdstuk,373,Ende leide om ons sijn lagen
Onbekend,Onbekend Hoofdstuk,374,Ende als hem dan die honde zagen
Onbekend,Onbekend Hoofdstuk,375,Setten sy hem aen myt alre cracht
Onbekend,Onbekend Hoofdstuk,376,Ende eens doe was hi op die dracht
Onbekend,Onbekend Hoofdstuk,377,By auentueren after lopen
Onbekend,Onbekend Hoofdstuk,378,Dair zach ic hem een deel becopen
Onbekend,Onbekend Hoofdstuk,379,Sijnre dieften ende synen rooff
Onbekend,Onbekend Hoofdstuk,380,So dat hem synen pels stooff
Onbekend,Onbekend Hoofdstuk,381,Nochtant ontquam hi bi beraet
Onbekend,Onbekend Hoofdstuk,382,Van danen datten goede verwaet
Onbekend,Onbekend Hoofdstuk,383,DAer mede waren wijss lange quijt
Onbekend,Onbekend Hoofdstuk,384,Synt quam hi als een heremijt
Onbekend,Onbekend Hoofdstuk,385,Reynaert die moordadige dieff
Onbekend,Onbekend Hoofdstuk,386,Ende bracht myt hem enen brieff
Onbekend,Onbekend Hoofdstuk,387,Te lesen lieue heer coninck
Onbekend,Onbekend Hoofdstuk,388,Daer v selfs zegel aen hynck
Onbekend,Onbekend Hoofdstuk,389,Doe ic den brief had gelesen
Onbekend,Onbekend Hoofdstuk,390,Docht my dair in gescreuen wesen
Onbekend,Onbekend Hoofdstuk,391,Dat gi had koenlike
Onbekend,Onbekend Hoofdstuk,392,Ouer al v conincrike
Onbekend,Onbekend Hoofdstuk,393,Alle dieren gegeuen vrede
Onbekend,Onbekend Hoofdstuk,394,Ende oec allen vogelen mede
Onbekend,Onbekend Hoofdstuk,395,Oec brocht hi my een ander maer
Onbekend,Onbekend Hoofdstuk,396,Ende seide ons dat hi waer
Onbekend,Onbekend Hoofdstuk,397,Een begeuen clvsenaer
Onbekend,Onbekend Hoofdstuk,398,Ende leefde in penitentien swaer
Onbekend,Onbekend Hoofdstuk,399,Hi had ontfaen om die sonden sijn
Onbekend,Onbekend Hoofdstuk,400,Hi toonde my pelse ende slavijn
Onbekend,Onbekend Hoofdstuk,401,Die hi brochte van elemaer
Onbekend,Onbekend Hoofdstuk,402,En dair onder had hi een scerpe haer
Onbekend,Onbekend Hoofdstuk,403,Doe sprac hi dus her cantecleer
Onbekend,Onbekend Hoofdstuk,404,Nv mochdi wel voort aen meer
Onbekend,Onbekend Hoofdstuk,405,Van my sonder sorge leuen
Onbekend,Onbekend Hoofdstuk,406,Want ic heb voor aen begeuen
Onbekend,Onbekend Hoofdstuk,407,Alle versch vleysch ende sout
Onbekend,Onbekend Hoofdstuk,408,Want ic bin worden so out
Onbekend,Onbekend Hoofdstuk,409,Dat ic mijnre zielen moet telen
Onbekend,Onbekend Hoofdstuk,410,Ende ic wil v god beuelen
Onbekend,Onbekend Hoofdstuk,411,Jc ga dair ic heb te doen
Onbekend,Onbekend Hoofdstuk,412,Jc heb noch sext ende noen
