author,chapter,line,text
Onbekend,Onbekend Hoofdstuk,4073,Doe bequam doe bloyde hi zeer
Onbekend,Onbekend Hoofdstuk,4074,Jc ghinc tot hem ende seide heer
Onbekend,Onbekend Hoofdstuk,4075,Ysegrim lieue oom hoe staet
Onbekend,Onbekend Hoofdstuk,4076,Si di van den vool wel gesaet
Onbekend,Onbekend Hoofdstuk,4077,Hoe en deildi my niet wat mede
Onbekend,Onbekend Hoofdstuk,4078,Ende ic doch v bootscap dede
Onbekend,Onbekend Hoofdstuk,4079,Hebdi geslapen op v mael
Onbekend,Onbekend Hoofdstuk,4080,Wair wast walsch ofte vocael
Onbekend,Onbekend Hoofdstuk,4081,Dat gescrift onder hair voet
Onbekend,Onbekend Hoofdstuk,4082,Jc wist wel gi zijt so vroet
Onbekend,Onbekend Hoofdstuk,4083,Dat nyement bet lesen en can gi
Onbekend,Onbekend Hoofdstuk,4084,O wi reynaert neue o wi
Onbekend,Onbekend Hoofdstuk,4085,Jc bid v dat gi v spotten laet
Onbekend,Onbekend Hoofdstuk,4086,Jc bin so qualiken begaet
Onbekend,Onbekend Hoofdstuk,4087,Het mocht ontfermen herde stenen
Onbekend,Onbekend Hoofdstuk,4088,Die hoeyr mitten langen benen
Onbekend,Onbekend Hoofdstuk,4089,Had haren voet so hooch op verheuen
Onbekend,Onbekend Hoofdstuk,4090,Jc waendet hadden geweest letteren gescreuen
Onbekend,Onbekend Hoofdstuk,4091,Die nagelen die dair in stonden
Onbekend,Onbekend Hoofdstuk,4092,Si sloech my zess groter wonden
Onbekend,Onbekend Hoofdstuk,4093,Ten eersten slage dat sy smeet
Onbekend,Onbekend Hoofdstuk,4094,Dat my thooft wel na spleet
Onbekend,Onbekend Hoofdstuk,4095,Ende mijn herssenbecken al ontwee
Onbekend,Onbekend Hoofdstuk,4096,Sulc lesen en geer ic niet mee
Onbekend,Onbekend Hoofdstuk,4097,LJue oom ist wair dat gi telt
Onbekend,Onbekend Hoofdstuk,4098,Dat heeft my wonder want ic helt
Onbekend,Onbekend Hoofdstuk,4099,V voorden den besten clerc die nv leeft
Onbekend,Onbekend Hoofdstuk,4100,Nv hoor ic wel dat men my heeft
Onbekend,Onbekend Hoofdstuk,4101,Wel eer geseit ende oec gelesen
Onbekend,Onbekend Hoofdstuk,4102,Jn boeken dat wel wair mach wesen
Onbekend,Onbekend Hoofdstuk,4103,Dats dat die beste clercke fijn
Onbekend,Onbekend Hoofdstuk,4104,Dicwijl die wijste lude niet en sijn
Onbekend,Onbekend Hoofdstuk,4105,Die leken veruroeden se by wilen
Onbekend,Onbekend Hoofdstuk,4106,Dat doet dat sy so versubtilen
Onbekend,Onbekend Hoofdstuk,4107,Jn kunsten dat sy dair in verdwalen
Onbekend,Onbekend Hoofdstuk,4108,Dus brocht ic ysegrim in dwalen
Onbekend,Onbekend Hoofdstuk,4109,Dat hi nauwe sijn lijff behelt
Onbekend,Onbekend Hoofdstuk,4110,Siet neue ic heb v nv vertelt
Onbekend,Onbekend Hoofdstuk,4111,Ad dat ic weet van mijnre
Onbekend,Onbekend Hoofdstuk,4112,Misselic hoet myt my vergaet
Onbekend,Onbekend Hoofdstuk,4113,Te houe nochtan bin ic sonder vaer
Onbekend,Onbekend Hoofdstuk,4114,Want ic bin nv sonder sunde claer
Onbekend,Onbekend Hoofdstuk,4115,Ende ic wil gern bi uwen rade
Onbekend,Onbekend Hoofdstuk,4116,Beteren ende comen te genade
Onbekend,Onbekend Hoofdstuk,4117,Grymbaert die mysdaet is groot
Onbekend,Onbekend Hoofdstuk,4118,Die doot is moet bliuen doot
Onbekend,Onbekend Hoofdstuk,4119,Men machs niet weder doen leuen
Onbekend,Onbekend Hoofdstuk,4120,Mer oom dit wil ic v al vergeuen
Onbekend,Onbekend Hoofdstuk,4121,Om den anxt die gi dair om liden moet
Onbekend,Onbekend Hoofdstuk,4122,Eer gi dair off v ontscout doet
Onbekend,Onbekend Hoofdstuk,4123,Ende hier op wil ic v absolueren
Onbekend,Onbekend Hoofdstuk,4124,Mer dat v alre meest sal deren
Onbekend,Onbekend Hoofdstuk,4125,Dats dat gi kuwaerts hooft dair sende
Onbekend,Onbekend Hoofdstuk,4126,Ende den coninck myt logen verblende
Onbekend,Onbekend Hoofdstuk,4127,Och oom dat was zeer mysdaen
Onbekend,Onbekend Hoofdstuk,4128,Neef die door die werelt sel gaen
Onbekend,Onbekend Hoofdstuk,4129,Moet dick horen tsijn vertrecken
Onbekend,Onbekend Hoofdstuk,4130,Hy moet hem besmytten ende beulecken
Onbekend,Onbekend Hoofdstuk,4131,Wie honich handelt vinger lect
Onbekend,Onbekend Hoofdstuk,4132,Jc ward dicwil gewect
Onbekend,Onbekend Hoofdstuk,4133,Van mijnre conscientien bynnen
Onbekend,Onbekend Hoofdstuk,4134,Gode bouen al te mynnen
Onbekend,Onbekend Hoofdstuk,4135,Ende mynen euen kersten als my
Onbekend,Onbekend Hoofdstuk,4136,Dattet goods liefste wille sy
Onbekend,Onbekend Hoofdstuk,4137,Ende dat dit wair dat beste recht
Onbekend,Onbekend Hoofdstuk,4138,Wat waendi dat die reden vecht
Onbekend,Onbekend Hoofdstuk,4139,Van bynen tegens die vterste wille
Onbekend,Onbekend Hoofdstuk,4140,Dan sta ic in my seluen stille
Onbekend,Onbekend Hoofdstuk,4141,Op mijn eygen vry vernuft
Onbekend,Onbekend Hoofdstuk,4142,En warde van synnen so versuft
Onbekend,Onbekend Hoofdstuk,4143,Dat ic niet en weet wat mijns gesciet
Onbekend,Onbekend Hoofdstuk,4144,Jc bin in een bloet niet
Onbekend,Onbekend Hoofdstuk,4145,Jc heb en bin van allen gelaten
Onbekend,Onbekend Hoofdstuk,4146,Dat wil ic van my steken ende haten
Onbekend,Onbekend Hoofdstuk,4147,Al dat mynre is dan got
Onbekend,Onbekend Hoofdstuk,4148,Ende hoge clymmen bouen sijn gebot
Onbekend,Onbekend Hoofdstuk,4149,Ende bescouwen der contemplacien
Onbekend,Onbekend Hoofdstuk,4150,Mer dese sonderlinge gratien
Onbekend,Onbekend Hoofdstuk,4151,Gescien my als ic bin alleen
Onbekend,Onbekend Hoofdstuk,4152,Mitter werlt noch myt mensch gemeen
Onbekend,Onbekend Hoofdstuk,4153,Ende ic my seluen van bynnen zie claer
Onbekend,Onbekend Hoofdstuk,4154,Mer ouer een corte wijl dair naer
Onbekend,Onbekend Hoofdstuk,4155,Als ic der werelt ward gemeen
Onbekend,Onbekend Hoofdstuk,4156,So vijnd ic so veel steen
Onbekend,Onbekend Hoofdstuk,4157,Jn mynen wech achter ende voren
Onbekend,Onbekend Hoofdstuk,4158,Ende ic zie die voet sporen
Onbekend,Onbekend Hoofdstuk,4159,Dair dese prelaten in gaen
Onbekend,Onbekend Hoofdstuk,4160,So ward ic weder vluysch geuaen
Onbekend,Onbekend Hoofdstuk,4161,So coomt die werelt en wil dat vleisch
Onbekend,Onbekend Hoofdstuk,4162,Mit groter genuechten sonder eysch
Onbekend,Onbekend Hoofdstuk,4163,Ende leggen my so veel te voren
Onbekend,Onbekend Hoofdstuk,4164,Dat ic die vriheit heb verloren
Onbekend,Onbekend Hoofdstuk,4165,End dat leuen dair ic eerst in was
Onbekend,Onbekend Hoofdstuk,4166,So hoor ic sanck ende pijp geblas
Onbekend,Onbekend Hoofdstuk,4167,Lachen spelen end vrolicheit
Onbekend,Onbekend Hoofdstuk,4168,Jc hoor dat dese off gemeen seit
Onbekend,Onbekend Hoofdstuk,4169,Die anders seggen ofte penzen
Onbekend,Onbekend Hoofdstuk,4170,Dair leer ic liegen ende venzen
Onbekend,Onbekend Hoofdstuk,4171,Jn sonderlingen heren houe
Onbekend,Onbekend Hoofdstuk,4172,Dair sprect meest alte loue
Onbekend,Onbekend Hoofdstuk,4173,Heren vrouwen papen clercken
Onbekend,Onbekend Hoofdstuk,4174,Dit sijn die geen die meest die luegen stercken
Onbekend,Onbekend Hoofdstuk,4175,Men der die heren niet tseggen twair
Onbekend,Onbekend Hoofdstuk,4176,Lieue neue hier leer ic naer
Onbekend,Onbekend Hoofdstuk,4177,Jc moet mede louentuten
Onbekend,Onbekend Hoofdstuk,4178,Ofte men soude my buten sluten
Onbekend,Onbekend Hoofdstuk,4179,Jc heb veel lude dic horen spreken
Onbekend,Onbekend Hoofdstuk,4180,Die reckelic ende wairach leken
Onbekend,Onbekend Hoofdstuk,4181,Als sy een reden vertogen
Onbekend,Onbekend Hoofdstuk,4182,Veel ontwee enyge logen
Onbekend,Onbekend Hoofdstuk,4183,Die hoor redene mocht geliken
Onbekend,Onbekend Hoofdstuk,4184,Sy lietense mede door striken
Onbekend,Onbekend Hoofdstuk,4185,Op dat hair tael wair te scoonre
Onbekend,Onbekend Hoofdstuk,4186,Nyet dan die luegenaer waeir coenre
Onbekend,Onbekend Hoofdstuk,4187,Mit verrade inder reden begyn
Onbekend,Onbekend Hoofdstuk,4188,Mer die reden wil dair in
Onbekend,Onbekend Hoofdstuk,4189,Ymmer sijn ende wantse wel clede
Onbekend,Onbekend Hoofdstuk,4190,So liet hise dair varen mede
Onbekend,Onbekend Hoofdstuk,4191,NEue dus moet men hier ende dair
Onbekend,Onbekend Hoofdstuk,4192,Nv liegen ende zeggen wair
Onbekend,Onbekend Hoofdstuk,4193,Dreigen smeken bidden ende vloeken
Onbekend,Onbekend Hoofdstuk,4194,Ende ellic op sijn hooft zoeken
Onbekend,Onbekend Hoofdstuk,4195,Die die werelt wil hantieren
Onbekend,Onbekend Hoofdstuk,4196,Ende een luegen wil vysieren
Onbekend,Onbekend Hoofdstuk,4197,Ende op hair scoonste dan setten voort
Onbekend,Onbekend Hoofdstuk,4198,Ende so bewympelen dair mense hoort
Onbekend,Onbekend Hoofdstuk,4199,Mit doeken die hi dair om wijnt
Onbekend,Onbekend Hoofdstuk,4200,Datmense voor die wairheit mynt
Onbekend,Onbekend Hoofdstuk,4201,Die en is sijn meyster niet ontlopen
Onbekend,Onbekend Hoofdstuk,4202,Can hise so subtilic knopen
Onbekend,Onbekend Hoofdstuk,4203,Dat hi niet en stamert in sijn tael
Onbekend,Onbekend Hoofdstuk,4204,Ende dan dat hi gehoort is wael
Onbekend,Onbekend Hoofdstuk,4205,Neue dese mach wonder maken
Onbekend,Onbekend Hoofdstuk,4206,Hy mach bont dragen ende scaerlaken
Onbekend,Onbekend Hoofdstuk,4207,Jnt geestlic end int weerlic recht
Onbekend,Onbekend Hoofdstuk,4208,Hy wint wair hi vecht
Onbekend,Onbekend Hoofdstuk,4209,Nochtan en trect hi sweert noch knijff
Onbekend,Onbekend Hoofdstuk,4210,Nv vijnt men mennigen losen katijff
Onbekend,Onbekend Hoofdstuk,4211,Diet zeer benijt dat hi ziet
Onbekend,Onbekend Hoofdstuk,4212,Dat desen dus vordel gesciet
Onbekend,Onbekend Hoofdstuk,4213,Ende meent dat hijt wel can
Onbekend,Onbekend Hoofdstuk,4214,Liegen ende grijpt een luegen an
Onbekend,Onbekend Hoofdstuk,4215,Die hi verschoont ende voort wil setten
Onbekend,Onbekend Hoofdstuk,4216,Hy aet oec gern vanden vetten
Onbekend,Onbekend Hoofdstuk,4217,Mer hi en is gelooft noch gehoort
Onbekend,Onbekend Hoofdstuk,4218,Ende sulc is so plomp als hi sijn woort
Onbekend,Onbekend Hoofdstuk,4219,Ten besten waent seggen ende sluten
Onbekend,Onbekend Hoofdstuk,4220,Valt hi al sijnre materien buten
Onbekend,Onbekend Hoofdstuk,4221,Ende en cant so wel niet zaluen
Onbekend,Onbekend Hoofdstuk,4222,Hy en laet sijn reden staen ten haluen
Onbekend,Onbekend Hoofdstuk,4223,Sonder hooft off sonder steert
Onbekend,Onbekend Hoofdstuk,4224,So wart hi voor een dwaes vermeert
Onbekend,Onbekend Hoofdstuk,4225,Ende men hout dair mede spot
Onbekend,Onbekend Hoofdstuk,4226,Mer die een luegen geeft een slot
Onbekend,Onbekend Hoofdstuk,4227,Ende seit sijn reden sonder sneuen
Onbekend,Onbekend Hoofdstuk,4228,Als oft voor hem stont gescreuen
Onbekend,Onbekend Hoofdstuk,4229,Ende maectse alle gader dooff
Onbekend,Onbekend Hoofdstuk,4230,Dat men se bet gelooft
Onbekend,Onbekend Hoofdstuk,4231,Dan die wairheit dats die man
Onbekend,Onbekend Hoofdstuk,4232,Wat const ende wijsheit is dair an
Onbekend,Onbekend Hoofdstuk,4233,Die wairheit te seggen dat is goet te doen
Onbekend,Onbekend Hoofdstuk,4234,Hoe lachen sy dan onder hair caproen
Onbekend,Onbekend Hoofdstuk,4235,Die lose scalcken geuen den raet
Onbekend,Onbekend Hoofdstuk,4236,Ende die geen die die logen aen gaet
Onbekend,Onbekend Hoofdstuk,4237,Als hair onrecht gaet te bouen
Onbekend,Onbekend Hoofdstuk,4238,Ende trecht wart afterwaert gescouen
Onbekend,Onbekend Hoofdstuk,4239,Och neue dan sy alte vroe
Onbekend,Onbekend Hoofdstuk,4240,Scout scepen rade dair toe
Onbekend,Onbekend Hoofdstuk,4241,Achterbaets ende helpent sijt in setten
Onbekend,Onbekend Hoofdstuk,4242,Off rechters van anderen wetten
Onbekend,Onbekend Hoofdstuk,4243,Ende leren door die vinger sien
Onbekend,Onbekend Hoofdstuk,4244,Op datsi mede genyeten in dien
Onbekend,Onbekend Hoofdstuk,4245,Off in hoore vrienden gonst
Onbekend,Onbekend Hoofdstuk,4246,Och neue dats een quade const
Onbekend,Onbekend Hoofdstuk,4247,Die sprekers die hair tonge verhueren
Onbekend,Onbekend Hoofdstuk,4248,Mogen hier in veel verbueren
Onbekend,Onbekend Hoofdstuk,4249,Logen te spreken myt berade
Onbekend,Onbekend Hoofdstuk,4250,Dair scand off coomt ende lijfs scade
Onbekend,Onbekend Hoofdstuk,4251,IC en seg niet men moet wel biwilen
Onbekend,Onbekend Hoofdstuk,4252,Spotten. boerten. liegen. gilen
Onbekend,Onbekend Hoofdstuk,4253,Jn dingen van mysseliken zake
Onbekend,Onbekend Hoofdstuk,4254,Want die altoos die wairheit sprake
Onbekend,Onbekend Hoofdstuk,4255,En conde die strate nergent houwen
Onbekend,Onbekend Hoofdstuk,4256,Sulc sweert ende seit by sijnre trouwen
Onbekend,Onbekend Hoofdstuk,4257,Ende spreken in placebo
Onbekend,Onbekend Hoofdstuk,4258,Dat hi mach doern herde no
Onbekend,Onbekend Hoofdstuk,4259,Wil hi leuen myt gemake
Onbekend,Onbekend Hoofdstuk,4260,Die altoos die waerheit sprake
Onbekend,Onbekend Hoofdstuk,4261,Soud dicwil vijnder wederstoot
Onbekend,Onbekend Hoofdstuk,4262,Men moet wel liegen alst doet noot
Onbekend,Onbekend Hoofdstuk,4263,En dair na beteren by rade
Onbekend,Onbekend Hoofdstuk,4264,Tot allen mysdoen staet genade
Onbekend,Onbekend Hoofdstuk,4265,Ten is nyement hi en dwaelt bitiden
Onbekend,Onbekend Hoofdstuk,4266,Wat oom v en can niet ontgliden
Onbekend,Onbekend Hoofdstuk,4267,Gi weet dat nauste op alle dingen
Onbekend,Onbekend Hoofdstuk,4268,Gi soud my wel brengen in dwalingen
Onbekend,Onbekend Hoofdstuk,4269,V. reden is buten mijn verstaen
Onbekend,Onbekend Hoofdstuk,4270,Wat noot is v te biecht te gaen
Onbekend,Onbekend Hoofdstuk,4271,Ghi soud selue sijn die paep
Onbekend,Onbekend Hoofdstuk,4272,Ende laten my ende ander scaep
Onbekend,Onbekend Hoofdstuk,4273,Tegens v biechten ende nemen raet
Onbekend,Onbekend Hoofdstuk,4274,Ghi weet so claer der werelt staet
Onbekend,Onbekend Hoofdstuk,4275,Dat nyement en mach voor v gaen manck
Onbekend,Onbekend Hoofdstuk,4276,Mit deser talen ende niet lanck
Onbekend,Onbekend Hoofdstuk,4277,Quamen sy int hoff gegaen
Onbekend,Onbekend Hoofdstuk,4278,Reynaert wart een deel ondaen
Onbekend,Onbekend Hoofdstuk,4279,Van twyuel in synen moet
Onbekend,Onbekend Hoofdstuk,4280,Nochtans dede hi dairt hem toe stoet
Onbekend,Onbekend Hoofdstuk,4281,Ende maecte int herte coen
Onbekend,Onbekend Hoofdstuk,4282,Hy streeck door alle die baroen
Onbekend,Onbekend Hoofdstuk,4283,Tot dair die coninc selue was
Onbekend,Onbekend Hoofdstuk,4284,Ende het ghinc by hem die dass
Onbekend,Onbekend Hoofdstuk,4285,Die tot hem seide oom reynaert
Onbekend,Onbekend Hoofdstuk,4286,Weest goets moets en onueruaert
Onbekend,Onbekend Hoofdstuk,4287,Die blode en dooch tot geenre wr
Onbekend,Onbekend Hoofdstuk,4288,Den coenen helpt die auentuer
Onbekend,Onbekend Hoofdstuk,4289,Een dach is beter dan sulc een iaer
Onbekend,Onbekend Hoofdstuk,4290,Reynaert sprac neue gi segt waer
Onbekend,Onbekend Hoofdstuk,4291,God danck v gi troost my wael
Onbekend,Onbekend Hoofdstuk,4292,Eer hi began enige tael
Onbekend,Onbekend Hoofdstuk,4293,Maecte hi een gelaet so fier
Onbekend,Onbekend Hoofdstuk,4294,Ende zach dair ende hier
Onbekend,Onbekend Hoofdstuk,4295,Als wie wat wil die come haer
Onbekend,Onbekend Hoofdstuk,4296,Hy zach dair veel in die scaer
Onbekend,Onbekend Hoofdstuk,4297,Van synen magen die dair stonden
Onbekend,Onbekend Hoofdstuk,4298,Die hem nochtan geen goet en gonden
Onbekend,Onbekend Hoofdstuk,4299,Ende dat conde hi wel verdienen
Onbekend,Onbekend Hoofdstuk,4300,Die otter. die beer myt hem tyenen
Onbekend,Onbekend Hoofdstuk,4301,Die ic hier noch wel sel noemen
Onbekend,Onbekend Hoofdstuk,4302,Doch was dair oec sulc comen
Onbekend,Onbekend Hoofdstuk,4303,Dien mynden ende hadden lieff
Onbekend,Onbekend Hoofdstuk,4304,Reynaert knyelde ende op hieff
Onbekend,Onbekend Hoofdstuk,4305,Sijn tael ende voorden coninck
Onbekend,Onbekend Hoofdstuk,4306,Hy sprac god die nye en verghinck
Onbekend,Onbekend Hoofdstuk,4307,Ende alles machtich blijft altoos
Onbekend,Onbekend Hoofdstuk,4308,Bewair mijn heer den coninc altoos
Onbekend,Onbekend Hoofdstuk,4309,Ende sijnre vrouwen der coninghin
Onbekend,Onbekend Hoofdstuk,4310,En geef hem wijsheit ende syn
Onbekend,Onbekend Hoofdstuk,4311,Wie dat recht off onrecht heeft
Onbekend,Onbekend Hoofdstuk,4312,Want dair veel op eerden leeft
Onbekend,Onbekend Hoofdstuk,4313,Die van buten dragen schijn
Onbekend,Onbekend Hoofdstuk,4314,Anders dan si van bynnen sijn
Onbekend,Onbekend Hoofdstuk,4315,Jc woud god toonde openbaer
Onbekend,Onbekend Hoofdstuk,4316,Ende voor thooft gescreuen waer
Onbekend,Onbekend Hoofdstuk,4317,Jc liets my costen een lieff dinck
Onbekend,Onbekend Hoofdstuk,4318,Ende ghijt also wist heer coninck
Onbekend,Onbekend Hoofdstuk,4319,Van allen saken als ic doe
Onbekend,Onbekend Hoofdstuk,4320,Jc heb geweest laet ende vroe
Onbekend,Onbekend Hoofdstuk,4321,Altoos in uwen dienst geuoecht
Onbekend,Onbekend Hoofdstuk,4322,En dair om bin ic dus gewroecht
Onbekend,Onbekend Hoofdstuk,4323,Mit logen voor v vanden quaden
Onbekend,Onbekend Hoofdstuk,4324,Die my gern souden scaden
Onbekend,Onbekend Hoofdstuk,4325,Ende doen verliesen v hulde
Onbekend,Onbekend Hoofdstuk,4326,Mit onrecht ende sonder sculde
Onbekend,Onbekend Hoofdstuk,4327,Des roep ic wopen ouer hair lijff
Onbekend,Onbekend Hoofdstuk,4328,Doch hoop Jc heer ende v goede wijff
Onbekend,Onbekend Hoofdstuk,4329,Sijt so wijs ende so besceiden
Onbekend,Onbekend Hoofdstuk,4330,Dat gi so niet en sijt te verleiden
Onbekend,Onbekend Hoofdstuk,4331,Mit loosheit off myt logentaelen
Onbekend,Onbekend Hoofdstuk,4332,Dat gi trecht yet laet verdwalen
Onbekend,Onbekend Hoofdstuk,4333,Want gi en hebs nye geplogen
Onbekend,Onbekend Hoofdstuk,4334,Dair om heer hebt voor ogen
Onbekend,Onbekend Hoofdstuk,4335,Na den recht alle saken
Onbekend,Onbekend Hoofdstuk,4336,Jst in daden of in spraken
Onbekend,Onbekend Hoofdstuk,4337,Ende doet ellic gelijc wet
Onbekend,Onbekend Hoofdstuk,4338,Dats my genoech en geer niet bet
Onbekend,Onbekend Hoofdstuk,4339,Die sculdich is die scaem hem
Onbekend,Onbekend Hoofdstuk,4340,Men sel wel weten wie ic ben
Onbekend,Onbekend Hoofdstuk,4341,Jc en can smeken off flatteren
Onbekend,Onbekend Hoofdstuk,4342,Jc wil mijn hooft ondecken myt eren
Onbekend,Onbekend Hoofdstuk,4343,ALle die int pallaes waren
Onbekend,Onbekend Hoofdstuk,4344,Swegen ende haddens wonder twaren
Onbekend,Onbekend Hoofdstuk,4345,Dat reynaert sprac so stoute tael
Onbekend,Onbekend Hoofdstuk,4346,Die coninc seide och hoe wael
Onbekend,Onbekend Hoofdstuk,4347,Reynaert condi v fallaci
Onbekend,Onbekend Hoofdstuk,4348,V scone bootsen ende saluaci
Onbekend,Onbekend Hoofdstuk,4349,En sel v niet baten veel
Onbekend,Onbekend Hoofdstuk,4350,Jc waen noch huden v keel
Onbekend,Onbekend Hoofdstuk,4351,V wercken sel ontgelden
Onbekend,Onbekend Hoofdstuk,4352,Jc en wil niet veel myt v scelden
Onbekend,Onbekend Hoofdstuk,4353,Mer ic sel corten v pijn
Onbekend,Onbekend Hoofdstuk,4354,Dat gi ons lief hebt dat is aenschijn
Onbekend,Onbekend Hoofdstuk,4355,Aent conijn ende aen corbout
Onbekend,Onbekend Hoofdstuk,4356,V scalcke vond loos ende stout
Onbekend,Onbekend Hoofdstuk,4357,Sellen v doen steruen sonder zuuct
Onbekend,Onbekend Hoofdstuk,4358,So lange gaet te water die kruuck
Onbekend,Onbekend Hoofdstuk,4359,Dat sy brect ende valt aen sticken
Onbekend,Onbekend Hoofdstuk,4360,Jc waen die kruuck die ons so dicken
Onbekend,Onbekend Hoofdstuk,4361,Heeft bedrogen haest sel breken
Onbekend,Onbekend Hoofdstuk,4362,Reynaert die was om dit spreken
Onbekend,Onbekend Hoofdstuk,4363,Jn groten anxt ende in vaer
Onbekend,Onbekend Hoofdstuk,4364,Hy woude dat hi tot colen waer
Onbekend,Onbekend Hoofdstuk,4365,Ende hi dair niet en wair gecomen
Onbekend,Onbekend Hoofdstuk,4366,Doe dochte hi wat mach my vromen
Onbekend,Onbekend Hoofdstuk,4367,Jc moet der duer so hoe ict make
Onbekend,Onbekend Hoofdstuk,4368,Heer coninc sprac hi gi sout mijn sprake
Onbekend,Onbekend Hoofdstuk,4369,Wt horen dat wair reden goet
Onbekend,Onbekend Hoofdstuk,4370,Al wair ic geoordelt totter doet
Onbekend,Onbekend Hoofdstuk,4371,Nochtan soud men mijn tael horen
Onbekend,Onbekend Hoofdstuk,4372,Jc heb v doch hier te voren
Onbekend,Onbekend Hoofdstuk,4373,Mennigen nvtten raet gegeuen
Onbekend,Onbekend Hoofdstuk,4374,Ende ic bin ter noot bi v gebleuen
Onbekend,Onbekend Hoofdstuk,4375,Dicke dair v die ander ontweken
Onbekend,Onbekend Hoofdstuk,4376,Off my die lose myt valschen treken
Onbekend,Onbekend Hoofdstuk,4377,Tonrecht tegen v my hebben belogen
Onbekend,Onbekend Hoofdstuk,4378,Ende ic des geen onscout en moet togen
Onbekend,Onbekend Hoofdstuk,4379,So mach ic mijn misual wel clagen
Onbekend,Onbekend Hoofdstuk,4380,Jc heb gesien in ouden dagen
Onbekend,Onbekend Hoofdstuk,4381,Dat ic gehoort was voer een ander
Onbekend,Onbekend Hoofdstuk,4382,Noch mocht die dach comen voir ander
Onbekend,Onbekend Hoofdstuk,4383,Ende comen in haren ouden staet
Onbekend,Onbekend Hoofdstuk,4384,Men sel gedencken ouder daet
Onbekend,Onbekend Hoofdstuk,4385,Ende myt besceide dair in voort gaen
Onbekend,Onbekend Hoofdstuk,4386,Jc zie hier noch so veel staen
Onbekend,Onbekend Hoofdstuk,4387,Mijnre magen ende geslachten
Onbekend,Onbekend Hoofdstuk,4388,Die luttel schinen mijns te achten
Onbekend,Onbekend Hoofdstuk,4389,Diet nochtant soude deren
Onbekend,Onbekend Hoofdstuk,4390,Heer coninc dat gi my sout ontheren
Onbekend,Onbekend Hoofdstuk,4391,Off verderuen myt onrecht.
Onbekend,Onbekend Hoofdstuk,4392,So deed gijt oec een den getruutsten knecht
Onbekend,Onbekend Hoofdstuk,4393,Die gi hebt in al v lant
Onbekend,Onbekend Hoofdstuk,4394,Wat waendi heer had ic becant
Onbekend,Onbekend Hoofdstuk,4395,Jn my enige brueke ofte smette
Onbekend,Onbekend Hoofdstuk,4396,Dat ic te rechte of te wette
Onbekend,Onbekend Hoofdstuk,4397,Jn v oge hier gecomen waer
Onbekend,Onbekend Hoofdstuk,4398,Ende onder mijnre viande scaer
Onbekend,Onbekend Hoofdstuk,4399,Neen ic om een werelt van goude
Onbekend,Onbekend Hoofdstuk,4400,Jc was dair ic wesen woude
Onbekend,Onbekend Hoofdstuk,4401,Op mijn rwmt ende op mijn vry
Onbekend,Onbekend Hoofdstuk,4402,Mer god danck ic ken my
Onbekend,Onbekend Hoofdstuk,4403,So claer sonder enige vlecken
Onbekend,Onbekend Hoofdstuk,4404,Dat ic wel openbaer der trecken
Onbekend,Onbekend Hoofdstuk,4405,Jnt licht en spreken voir die goede
Onbekend,Onbekend Hoofdstuk,4406,Mer my was so wee te moede
Onbekend,Onbekend Hoofdstuk,4407,Doe my grymbert brocht die maer
Onbekend,Onbekend Hoofdstuk,4408,Dat ic al om liep haer en daer
Onbekend,Onbekend Hoofdstuk,4409,Bijster als een onvroet man
Onbekend,Onbekend Hoofdstuk,4410,Ende wair dat ic was inden ban
Onbekend,Onbekend Hoofdstuk,4411,Jc wair hier gecomen sonder beiden
Onbekend,Onbekend Hoofdstuk,4412,Dair ic dus dwaelde aen die heiden
Onbekend,Onbekend Hoofdstuk,4413,Quam mijn oom mertijn die aep
Onbekend,Onbekend Hoofdstuk,4414,Die wiser is dan enich paep
Onbekend,Onbekend Hoofdstuk,4415,Van gramarien inder practiken
Onbekend,Onbekend Hoofdstuk,4416,Hy was des biscops van cameriken
Onbekend,Onbekend Hoofdstuk,4417,Aduocaet wel negen iaer
Onbekend,Onbekend Hoofdstuk,4418,Hy zach my dryuen groot misbaer
Onbekend,Onbekend Hoofdstuk,4419,Ende sprac neue wat is dat v let
Onbekend,Onbekend Hoofdstuk,4420,Ghi dunct wesen al onset
Onbekend,Onbekend Hoofdstuk,4421,Segt my wiet v heeft gedaen
Onbekend,Onbekend Hoofdstuk,4422,Men selt den vrienden doen verstaen
Onbekend,Onbekend Hoofdstuk,4423,Swaer saken die gaen ter noot
Onbekend,Onbekend Hoofdstuk,4424,Een tru vrient is een hulpe groot
Onbekend,Onbekend Hoofdstuk,4425,Hy vijnt dicke beteren raet
Onbekend,Onbekend Hoofdstuk,4426,Ter noot dan diet aen gaet
Onbekend,Onbekend Hoofdstuk,4427,Al is hi nochtan niet so vroet
Onbekend,Onbekend Hoofdstuk,4428,Dat doet den man ontgaet den moet
Onbekend,Onbekend Hoofdstuk,4429,En die wijsheit also zeer
Onbekend,Onbekend Hoofdstuk,4430,Alst hem aen tlijff gaet off aen deer
Onbekend,Onbekend Hoofdstuk,4431,Ende is so myt hem begaen
Onbekend,Onbekend Hoofdstuk,4432,Hy en weet wat doen off eerst bestaen
Onbekend,Onbekend Hoofdstuk,4433,Recht off hi wair sonder syn
Onbekend,Onbekend Hoofdstuk,4434,Och lieue oom seide ic meer off myn
Onbekend,Onbekend Hoofdstuk,4435,Also gi my seg is my gesciet
Onbekend,Onbekend Hoofdstuk,4436,Jc coom in groten swaren verdriet
Onbekend,Onbekend Hoofdstuk,4437,Sonder scout ende onuerdient
Onbekend,Onbekend Hoofdstuk,4438,Van hem dien ic so groten vrient
Onbekend,Onbekend Hoofdstuk,4439,Van herten altoos heb gesijn
Onbekend,Onbekend Hoofdstuk,4440,Dat is een dat lampreel ende conijn
Onbekend,Onbekend Hoofdstuk,4441,Dat deet my quam gisteren morgen
Onbekend,Onbekend Hoofdstuk,4442,Dair ic sat voir mijn borge
Onbekend,Onbekend Hoofdstuk,4443,Ende soude mijn getide lesen
Onbekend,Onbekend Hoofdstuk,4444,Hy seide dat hi te houe woude wesen
Onbekend,Onbekend Hoofdstuk,4445,Hy gruete my schoon ende ic hem
Onbekend,Onbekend Hoofdstuk,4446,Doe seide hi reynaert ic ben
Onbekend,Onbekend Hoofdstuk,4447,Moede gelopen ende hongerich mede
Onbekend,Onbekend Hoofdstuk,4448,Heb di ye teten door mijnre bede
Onbekend,Onbekend Hoofdstuk,4449,Jc seide ia ic genoech coomt haer
Onbekend,Onbekend Hoofdstuk,4450,Doe dede ic hem geuen een paer
Onbekend,Onbekend Hoofdstuk,4451,Kersspette dair botter op lach
Onbekend,Onbekend Hoofdstuk,4452,Want het was op enen woensdach
Onbekend,Onbekend Hoofdstuk,4453,Dat ic geen vleisch en plach te eten
Onbekend,Onbekend Hoofdstuk,4454,Ende oec vaste ic sel di weten
Onbekend,Onbekend Hoofdstuk,4455,Tegens pijnsteren die ons nv naect
Onbekend,Onbekend Hoofdstuk,4456,Want die hoochste wijsheit die smaect
Onbekend,Onbekend Hoofdstuk,4457,Ende geestelic leuen wil leyden
Onbekend,Onbekend Hoofdstuk,4458,Die sel hem tegen die hoochtijt bereiden
Onbekend,Onbekend Hoofdstuk,4459,Te veruulen des heren gebot
Onbekend,Onbekend Hoofdstuk,4460,Het was estote parati seit got
Onbekend,Onbekend Hoofdstuk,4461,Jn dat ewangelium lieue oom
Onbekend,Onbekend Hoofdstuk,4462,Jc dede sijns nemen goede goom
Onbekend,Onbekend Hoofdstuk,4463,Van boeten ende van sconen brode
Onbekend,Onbekend Hoofdstuk,4464,Dats goede haue voir hongers node.
Onbekend,Onbekend Hoofdstuk,4465,ENde doe hi sat gegeten was lampreel
Onbekend,Onbekend Hoofdstuk,4466,Quam mijn ionxste soen geheel
Onbekend,Onbekend Hoofdstuk,4467,Ende woude wech doen dat relijff
Onbekend,Onbekend Hoofdstuk,4468,Want ionge kijnder eten lief
Onbekend,Onbekend Hoofdstuk,4469,Doe hi taste na dat conijn
Onbekend,Onbekend Hoofdstuk,4470,Slochen voir die tande sijn
Onbekend,Onbekend Hoofdstuk,4471,Dat hem dat bloed wt ran ten ogen
Onbekend,Onbekend Hoofdstuk,4472,Ende viel in onmacht in swaren dogen
Onbekend,Onbekend Hoofdstuk,4473,Doe reynaert mijn outste zoen
