author,chapter,line,text
Onbekend,Onbekend Hoofdstuk,2046,Ende mennich die hier is by
Onbekend,Onbekend Hoofdstuk,2047,Wats dan dat heb ic wel verdient
Onbekend,Onbekend Hoofdstuk,2048,Jc ward noch licht hair liefte vrient
Onbekend,Onbekend Hoofdstuk,2049,Nochtan en deed ic hem nemmer goet
Onbekend,Onbekend Hoofdstuk,2050,Die coninc is sterc sijn raet is vroet
Onbekend,Onbekend Hoofdstuk,2051,Nochtant soud ic se wel behalen
Onbekend,Onbekend Hoofdstuk,2052,Mocht ic gebruken mijnre talen
Onbekend,Onbekend Hoofdstuk,2053,Jc weet so mennigen losen vont
Onbekend,Onbekend Hoofdstuk,2054,Nv quamen sy dair die galge stont
Onbekend,Onbekend Hoofdstuk,2055,Doe sprac ysegrim her brwn
Onbekend,Onbekend Hoofdstuk,2056,Denct nv om die rode crwn
Onbekend,Onbekend Hoofdstuk,2057,Die gi ontfenct bi reyers scout
Onbekend,Onbekend Hoofdstuk,2058,Twair tijt dat ghijs hem nv vergout
Onbekend,Onbekend Hoofdstuk,2059,Die quaetheit die hi v ye gedede
Onbekend,Onbekend Hoofdstuk,2060,Wy hebbens nv wel onss tijt ende stede
Onbekend,Onbekend Hoofdstuk,2061,Tybert haest v ende clymt op
Onbekend,Onbekend Hoofdstuk,2062,Knoopt aen die lijnde ende maect den strop
Onbekend,Onbekend Hoofdstuk,2063,Ghi zijt die lichte van ons drien
Onbekend,Onbekend Hoofdstuk,2064,Ghi sult uwen wil noch huden zien
Onbekend,Onbekend Hoofdstuk,2065,Van hem dien gi so zeer haet
Onbekend,Onbekend Hoofdstuk,2066,Brwn wacht dat hi v niet en ontgaet
Onbekend,Onbekend Hoofdstuk,2067,Hout hem vast ende ziet wel toe
Onbekend,Onbekend Hoofdstuk,2068,Jc moet pinen dat ic doe
Onbekend,Onbekend Hoofdstuk,2069,Die leder op rechten hem op te gaen
Onbekend,Onbekend Hoofdstuk,2070,Brwn sprac dats wel gedaen
Onbekend,Onbekend Hoofdstuk,2071,Doet dat sel hem wel bewaren
Onbekend,Onbekend Hoofdstuk,2072,Reynaert sprac my mach wel verswaren
Onbekend,Onbekend Hoofdstuk,2073,Mijn hert. mijn syn. van anxte groot
Onbekend,Onbekend Hoofdstuk,2074,Want ic sie voor mijn ogen die doot
Onbekend,Onbekend Hoofdstuk,2075,Dien ic niet en mach ontgaen
Onbekend,Onbekend Hoofdstuk,2076,Heer coninc ende alle die hier staen
Onbekend,Onbekend Hoofdstuk,2077,V. allen bid ic een bede
Onbekend,Onbekend Hoofdstuk,2078,Eer ic vander werelt scede
Onbekend,Onbekend Hoofdstuk,2079,Dat ic mijn biecht doch mach spreken
Onbekend,Onbekend Hoofdstuk,2080,Ende voor v allen mach mijn gebreken
Onbekend,Onbekend Hoofdstuk,2081,Claerlic vertrecken op dat dair by
Onbekend,Onbekend Hoofdstuk,2082,Min ziel des onbecommert sy
Onbekend,Onbekend Hoofdstuk,2083,Ende men mijn diefte ende verraet
Onbekend,Onbekend Hoofdstuk,2084,Enen anderen dies niet en bestaet
Onbekend,Onbekend Hoofdstuk,2085,Niet en betije na desen tiden
Onbekend,Onbekend Hoofdstuk,2086,Jc sal den doot te sachter liden
Onbekend,Onbekend Hoofdstuk,2087,Ende bid alle dan voor my
Onbekend,Onbekend Hoofdstuk,2088,Dat god mijnre zielen genadich sy
Onbekend,Onbekend Hoofdstuk,2089,Alle die geen die dese tael hoorden
Onbekend,Onbekend Hoofdstuk,2090,Dien iamerden van synen woorden
Onbekend,Onbekend Hoofdstuk,2091,Ende seiden het wair een cleyn bede
Onbekend,Onbekend Hoofdstuk,2092,Ende baden den coninck dat hi dede
Onbekend,Onbekend Hoofdstuk,2093,So. dats hem die coninck gaff oorloff
Onbekend,Onbekend Hoofdstuk,2094,Reynaert die blide was hier off
Onbekend,Onbekend Hoofdstuk,2095,Docht het mocht noch beter vallen
Onbekend,Onbekend Hoofdstuk,2096,Doe sprac hi aldus voor hem allen
Onbekend,Onbekend Hoofdstuk,2097,Nv helpt my spiritus domini
Onbekend,Onbekend Hoofdstuk,2098,Want ic en zie hier nyement by
Onbekend,Onbekend Hoofdstuk,2099,Jc en bin dair mysdadich tegen
Onbekend,Onbekend Hoofdstuk,2100,Nochtant was ic in allen wegen
Onbekend,Onbekend Hoofdstuk,2101,Dat goedertierentste ionge kijnt
Onbekend,Onbekend Hoofdstuk,2102,Dat men vant off noch vijnt
Onbekend,Onbekend Hoofdstuk,2103,Tot datmen my spaende vander mammen
Onbekend,Onbekend Hoofdstuk,2104,Doe ic ginck spelen mitten lammen
Onbekend,Onbekend Hoofdstuk,2105,Om te horen dat gebleet
Onbekend,Onbekend Hoofdstuk,2106,So lange dat ic dair een verbeet
Onbekend,Onbekend Hoofdstuk,2107,Het smaecte wel het docht my goet
Onbekend,Onbekend Hoofdstuk,2108,So dat ic tvleisch oec meed ontgan
Onbekend,Onbekend Hoofdstuk,2109,Dair leerd ic leckerny eerst an
Onbekend,Onbekend Hoofdstuk,2110,So veel dat ic liep totten geiten
Onbekend,Onbekend Hoofdstuk,2111,Jnt wout dair icse hoorde bleken
Onbekend,Onbekend Hoofdstuk,2112,Dair verbeet haerre twee
Onbekend,Onbekend Hoofdstuk,2113,Doe tast ic voort ende deed meer
Onbekend,Onbekend Hoofdstuk,2114,Ende ic wart boude ende koenre
Onbekend,Onbekend Hoofdstuk,2115,Ende ic verbeet vogel ende hoenre
Onbekend,Onbekend Hoofdstuk,2116,Ende ganse dair ic se vant
Onbekend,Onbekend Hoofdstuk,2117,So dat my bloedich wart mijn tant
Onbekend,Onbekend Hoofdstuk,2118,Doe wart ic so fel ende so wreet
Onbekend,Onbekend Hoofdstuk,2119,Dat icket dair al op beet
Onbekend,Onbekend Hoofdstuk,2120,Al dat ic vant ende dat my dochte
Onbekend,Onbekend Hoofdstuk,2121,Dat my wel bequam dat ic mochte
Onbekend,Onbekend Hoofdstuk,2122,Dair na quam ic aen ysegrim
Onbekend,Onbekend Hoofdstuk,2123,Te wijnter aen den ouden rijn
Onbekend,Onbekend Hoofdstuk,2124,Ende scuulde onder enen boom
Onbekend,Onbekend Hoofdstuk,2125,Ende rekende dat hi waer mijn oom
Onbekend,Onbekend Hoofdstuk,2126,Als ic hem dus maesscap hoorde tellen
Onbekend,Onbekend Hoofdstuk,2127,So worden wi al dair gesellen
Onbekend,Onbekend Hoofdstuk,2128,Dat my wel myt recht mach rouwen
Onbekend,Onbekend Hoofdstuk,2129,Dair geloofden wi myt trouwen
Onbekend,Onbekend Hoofdstuk,2130,Goet geselscap malcander te doen
Onbekend,Onbekend Hoofdstuk,2131,Ende gingen tsamen myt herten koen
Onbekend,Onbekend Hoofdstuk,2132,Hy stal dat groot ende ic dat cleen
Onbekend,Onbekend Hoofdstuk,2133,Dat wi cregen dat was gemeen
Onbekend,Onbekend Hoofdstuk,2134,Ende oec niet gemeen also
Onbekend,Onbekend Hoofdstuk,2135,Hi en was in huegen vro
Onbekend,Onbekend Hoofdstuk,2136,Mer ic en had mijn deel niet halff
Onbekend,Onbekend Hoofdstuk,2137,Als ysegrym had een calff
Onbekend,Onbekend Hoofdstuk,2138,Off een weder off een ram
Onbekend,Onbekend Hoofdstuk,2139,So grymde hi ende maecte hem gram
Onbekend,Onbekend Hoofdstuk,2140,Op my op dat hi my van hem dreeff
Onbekend,Onbekend Hoofdstuk,2141,Ende hem mijn deel alleen bleeff
Onbekend,Onbekend Hoofdstuk,2142,Doch was dit vanden mynsten al
Onbekend,Onbekend Hoofdstuk,2143,Mer als wi hadden al sulc geual
Onbekend,Onbekend Hoofdstuk,2144,Dat wi een oss off een koe
Onbekend,Onbekend Hoofdstuk,2145,Geuangen hadden so quam dair toe
Onbekend,Onbekend Hoofdstuk,2146,Sijn wijff ende haers neuen kijnder
Onbekend,Onbekend Hoofdstuk,2147,So en mocht my nau warden ghijnder
Onbekend,Onbekend Hoofdstuk,2148,Een vanden mynsten rebben
Onbekend,Onbekend Hoofdstuk,2149,Nochtan eer ic dat mochte hebben
Onbekend,Onbekend Hoofdstuk,2150,Hadden sy tvleysch al off geknagen
Onbekend,Onbekend Hoofdstuk,2151,Hier op mostic my doe bedragen
Onbekend,Onbekend Hoofdstuk,2152,Nochtan god danck ic en hads geen noot
Onbekend,Onbekend Hoofdstuk,2153,Want ic heb noch den scat so groot
Onbekend,Onbekend Hoofdstuk,2154,Beide aen siluer ende aen goude
Onbekend,Onbekend Hoofdstuk,2155,Dattet een wagen niet en soude
Onbekend,Onbekend Hoofdstuk,2156,Mit seuen reysen niet wech vueren
Onbekend,Onbekend Hoofdstuk,2157,Die coninck began sijn bloet te rueren
Onbekend,Onbekend Hoofdstuk,2158,Als hi den groten scat hoorde noemen
Onbekend,Onbekend Hoofdstuk,2159,Ende sprac waen is hi v gecomen
Onbekend,Onbekend Hoofdstuk,2160,Reynaert die scat dat segt my zaen
Onbekend,Onbekend Hoofdstuk,2161,Edel heer het wart gedaen
Onbekend,Onbekend Hoofdstuk,2162,Jc salt v seggen synt gi my hiet
Onbekend,Onbekend Hoofdstuk,2163,Noch door noch door leet
Onbekend,Onbekend Hoofdstuk,2164,En salt door my sijn verholen
Onbekend,Onbekend Hoofdstuk,2165,Heer die scat die was gestolen
Onbekend,Onbekend Hoofdstuk,2166,Ende en wair hi oec gestolen nyet
Onbekend,Onbekend Hoofdstuk,2167,Dair wair groot moort off gesciet
Onbekend,Onbekend Hoofdstuk,2168,Aen v selfs edel lijff
Onbekend,Onbekend Hoofdstuk,2169,Doe dit die coninck ende sijn wijff
Onbekend,Onbekend Hoofdstuk,2170,Hoorden worden sy veruaert
Onbekend,Onbekend Hoofdstuk,2171,Ende wopen riep sy reynaert
Onbekend,Onbekend Hoofdstuk,2172,O wi reynaert o wach o wy
Onbekend,Onbekend Hoofdstuk,2173,Wee my reynaert wat seg dy
Onbekend,Onbekend Hoofdstuk,2174,Jc vermaen v reynaert
Onbekend,Onbekend Hoofdstuk,2175,Op die lange henevaert
Onbekend,Onbekend Hoofdstuk,2176,Die v ziel varen sal
Onbekend,Onbekend Hoofdstuk,2177,Dat gi die wairheit segget al
Onbekend,Onbekend Hoofdstuk,2178,Ende openbaer brengt voort
Onbekend,Onbekend Hoofdstuk,2179,Al dat v cont is vanden moort
Onbekend,Onbekend Hoofdstuk,2180,Die tiegen mijn heer ende my gaet
Onbekend,Onbekend Hoofdstuk,2181,Ende gi des vmmer niet en laet
Onbekend,Onbekend Hoofdstuk,2182,So dat wijt alle mogen horen
Onbekend,Onbekend Hoofdstuk,2183,Nv hoort hoe reynaert sel verdoren
Onbekend,Onbekend Hoofdstuk,2184,Den coninck en der coninghynne
Onbekend,Onbekend Hoofdstuk,2185,Ende haerre beider gewynnen
Onbekend,Onbekend Hoofdstuk,2186,Ende nochtan dair toe verweruen
Onbekend,Onbekend Hoofdstuk,2187,Dat hi die geen sel verderuen
Onbekend,Onbekend Hoofdstuk,2188,Die nv so staen na synen doot
Onbekend,Onbekend Hoofdstuk,2189,Nv ist hem gecomen inden scoot
Onbekend,Onbekend Hoofdstuk,2190,Ende wil nv synen sack ontbijnden
Onbekend,Onbekend Hoofdstuk,2191,Ende sien off hi dair in can vijnden
Onbekend,Onbekend Hoofdstuk,2192,Dat hem mach comen te baten
Onbekend,Onbekend Hoofdstuk,2193,Nv wil hi so liegen wttermaten
Onbekend,Onbekend Hoofdstuk,2194,Ende dat so schoon brengen voort
Onbekend,Onbekend Hoofdstuk,2195,Dat ellic sel wanen waers diet hoort
Onbekend,Onbekend Hoofdstuk,2196,IN enen gelaet van droeuen syn
Onbekend,Onbekend Hoofdstuk,2197,Sprac reynaert vrou edel coninghin
Onbekend,Onbekend Hoofdstuk,2198,Al en had di my niet so hooch vermaent
Onbekend,Onbekend Hoofdstuk,2199,Jc bynt die nv steruen waent
Onbekend,Onbekend Hoofdstuk,2200,Jc en laet niet staen op mijn ziel
Onbekend,Onbekend Hoofdstuk,2201,Want licht dat my geuiel
Onbekend,Onbekend Hoofdstuk,2202,Jn die hel dair om te sijn
Onbekend,Onbekend Hoofdstuk,2203,Dair torment is ende ewich pijn
Onbekend,Onbekend Hoofdstuk,2204,Jn dien dat my die coninc mylde
Onbekend,Onbekend Hoofdstuk,2205,Een gestil nv maken wilde
Onbekend,Onbekend Hoofdstuk,2206,Jc soud hem seggen al myt staden
Onbekend,Onbekend Hoofdstuk,2207,Hoe iamerlic dat hi was verraden
Onbekend,Onbekend Hoofdstuk,2208,Te moorden van sijns sels lieden
Onbekend,Onbekend Hoofdstuk,2209,Nochtan diet alre meest berieden
Onbekend,Onbekend Hoofdstuk,2210,Sijn zom van mynen liefsten magen
Onbekend,Onbekend Hoofdstuk,2211,Die ic zeer node soud bedragen
Onbekend,Onbekend Hoofdstuk,2212,En dede my die zorge vander hellen
Onbekend,Onbekend Hoofdstuk,2213,Dair men seit dat si in quellen
Onbekend,Onbekend Hoofdstuk,2214,Die hier weten verraet off moort
Onbekend,Onbekend Hoofdstuk,2215,Ende dat niet en brengen voort
Onbekend,Onbekend Hoofdstuk,2216,Den coninck die wart dat hert zeer swaer
Onbekend,Onbekend Hoofdstuk,2217,Ende sprac segstu my waer
Onbekend,Onbekend Hoofdstuk,2218,O wi sprac reynaert waendi des
Onbekend,Onbekend Hoofdstuk,2219,Ghi ziet doch wel hoet myt my es
Onbekend,Onbekend Hoofdstuk,2220,Wat waendi des edel heer
Onbekend,Onbekend Hoofdstuk,2221,Al bin ic anders besundicht zeer
Onbekend,Onbekend Hoofdstuk,2222,Dat ic mijn ziel wil verdoemen
Onbekend,Onbekend Hoofdstuk,2223,Wat soud my te baten comen
Onbekend,Onbekend Hoofdstuk,2224,Dat ic anders seide dan het waer
Onbekend,Onbekend Hoofdstuk,2225,Mijn doot die is my also swaer
Onbekend,Onbekend Hoofdstuk,2226,My en mach helpen bede noch goet
Onbekend,Onbekend Hoofdstuk,2227,Doe beefde reynaert dair hi stoet
Onbekend,Onbekend Hoofdstuk,2228,Jn enen geueysden schijn van vresen
Onbekend,Onbekend Hoofdstuk,2229,Der coninghinne iammerde van desen
Onbekend,Onbekend Hoofdstuk,2230,Ende bat den coninc op genaden
Onbekend,Onbekend Hoofdstuk,2231,Om te scutten meerre scaden
Onbekend,Onbekend Hoofdstuk,2232,Dat hi den volc bode sylency
Onbekend,Onbekend Hoofdstuk,2233,Ende reynaert gaue audiency
Onbekend,Onbekend Hoofdstuk,2234,Sijn tael te spreken al wt
Onbekend,Onbekend Hoofdstuk,2235,Doe dede die coninc ouerluut
Onbekend,Onbekend Hoofdstuk,2236,Gebieden dat ellic swege al stille
Onbekend,Onbekend Hoofdstuk,2237,Ende liet reynaert synen wille
Onbekend,Onbekend Hoofdstuk,2238,Onberispt ten eynde spreken
Onbekend,Onbekend Hoofdstuk,2239,Reynaert die vol was loser treken
Onbekend,Onbekend Hoofdstuk,2240,Hem dochte beteren sijn geual
Onbekend,Onbekend Hoofdstuk,2241,Nv swijcht hi seit hi ouer al
Onbekend,Onbekend Hoofdstuk,2242,Synt dat mijn heer die coninc is lief
Onbekend,Onbekend Hoofdstuk,2243,Jc selt v lesen sonder brief
Onbekend,Onbekend Hoofdstuk,2244,Die verradenisse openbaer
Onbekend,Onbekend Hoofdstuk,2245,Dair ic nyement in en spaer
Onbekend,Onbekend Hoofdstuk,2246,Dien ic sculdich te wroegen ben
Onbekend,Onbekend Hoofdstuk,2247,Dies laster heeft die scaems hem
Onbekend,Onbekend Hoofdstuk,2248,NV hoort hoe reynaert des began
Onbekend,Onbekend Hoofdstuk,2249,Dat hi den vader die hem wan
Onbekend,Onbekend Hoofdstuk,2250,Jn verradenissen wil bedragen
Onbekend,Onbekend Hoofdstuk,2251,Ende een van synen liefsten magen
Onbekend,Onbekend Hoofdstuk,2252,Dat was grymbert die dass
Onbekend,Onbekend Hoofdstuk,2253,Die hout van herten hem altijt wass
Onbekend,Onbekend Hoofdstuk,2254,Dit dede hi al om dat
Onbekend,Onbekend Hoofdstuk,2255,Dat men sijnre woorden te bat
Onbekend,Onbekend Hoofdstuk,2256,Gelouen soude die hi sprake
Onbekend,Onbekend Hoofdstuk,2257,Ende hi dan die selue sake
Onbekend,Onbekend Hoofdstuk,2258,Op sijn vyande te bet mocht leggen
Onbekend,Onbekend Hoofdstuk,2259,Aldus began teerst van synen zeggen
Onbekend,Onbekend Hoofdstuk,2260,Hy sprac wileneer tot enen stonden
Onbekend,Onbekend Hoofdstuk,2261,Had mijn heer mijn vader vonden
Onbekend,Onbekend Hoofdstuk,2262,Des conincs heymelicste scat
Onbekend,Onbekend Hoofdstuk,2263,Jn enen verholentliken pat
Onbekend,Onbekend Hoofdstuk,2264,Ende doe hi had aldus groot goet
Onbekend,Onbekend Hoofdstuk,2265,Wart hi so fier so hooch gemoet
Onbekend,Onbekend Hoofdstuk,2266,Dat hi myt sijnre groter houeerde
Onbekend,Onbekend Hoofdstuk,2267,Alle dieren ver onweerde
Onbekend,Onbekend Hoofdstuk,2268,Die sijn gesellen te voren waren
Onbekend,Onbekend Hoofdstuk,2269,Hi dede tybert den cater varen
Onbekend,Onbekend Hoofdstuk,2270,Jn ardennen dat wilde lant
Onbekend,Onbekend Hoofdstuk,2271,Dair hi brwn den beer vant
Onbekend,Onbekend Hoofdstuk,2272,Hy ontboot sine houde
Onbekend,Onbekend Hoofdstuk,2273,Ende dat hi in vlaenderen varen soude
Onbekend,Onbekend Hoofdstuk,2274,Ende off hi coninc wilde wesen
Onbekend,Onbekend Hoofdstuk,2275,Brwn wart zeer blide van desen
Onbekend,Onbekend Hoofdstuk,2276,Want hi hads lange tijt begeert
Onbekend,Onbekend Hoofdstuk,2277,Ende hi maecte hem te vlaenderen weert
Onbekend,Onbekend Hoofdstuk,2278,Dair hi mynen vader vant
Onbekend,Onbekend Hoofdstuk,2279,Dien wel ontfenck doe te hant
Onbekend,Onbekend Hoofdstuk,2280,Seynde hi om grymbert den wisen
Onbekend,Onbekend Hoofdstuk,2281,Ende om ysegrim den grysen
Onbekend,Onbekend Hoofdstuk,2282,Ende tybert die cater dat was die wijfte
Onbekend,Onbekend Hoofdstuk,2283,Ende quamen bi een dorp heet hijfte
Onbekend,Onbekend Hoofdstuk,2284,Tusschen risel ende ghent
Onbekend,Onbekend Hoofdstuk,2285,Hielden sy haer perlement
Onbekend,Onbekend Hoofdstuk,2286,Jn enen donckeren langen nacht
Onbekend,Onbekend Hoofdstuk,2287,Ouermits des viant cracht
Onbekend,Onbekend Hoofdstuk,2288,Ende mijn vaders gewelde
Onbekend,Onbekend Hoofdstuk,2289,Dien dwanc myt synen gelde
Onbekend,Onbekend Hoofdstuk,2290,Swoeren si dair des conincs doot
Onbekend,Onbekend Hoofdstuk,2291,Nv hoort hier een wonder groot
Onbekend,Onbekend Hoofdstuk,2292,Sy zwoeren op ysegrims crwn
Onbekend,Onbekend Hoofdstuk,2293,Alle viue datse brwn
Onbekend,Onbekend Hoofdstuk,2294,Coninck ende heer souden maken
Onbekend,Onbekend Hoofdstuk,2295,Ende setten hem inden stoel taken
Onbekend,Onbekend Hoofdstuk,2296,Op sijn hooft die croon van goude
Onbekend,Onbekend Hoofdstuk,2297,Ende wair yement diet keren woude
Onbekend,Onbekend Hoofdstuk,2298,Van des conincs vriende ende magen
Onbekend,Onbekend Hoofdstuk,2299,Mijn vader soudze al veriagen
Onbekend,Onbekend Hoofdstuk,2300,Mit synen scat ende steken achter
Onbekend,Onbekend Hoofdstuk,2301,Ende bliuen souden inden lachter
Onbekend,Onbekend Hoofdstuk,2302,DJt weet ic wel ende seg v hoe
Onbekend,Onbekend Hoofdstuk,2303,Het geuiel op enen morge vroe
Onbekend,Onbekend Hoofdstuk,2304,Dat mijn neue grymbart die dass
Onbekend,Onbekend Hoofdstuk,2305,Van wijn een deel droncken wass
Onbekend,Onbekend Hoofdstuk,2306,So dat hi vrou sloppel kaerde
Onbekend,Onbekend Hoofdstuk,2307,Synen wiue seide in rade
Onbekend,Onbekend Hoofdstuk,2308,Ende hiet hair dat sijt zoude helen
Onbekend,Onbekend Hoofdstuk,2309,Ende sy vergat al sijn beuelen
Onbekend,Onbekend Hoofdstuk,2310,Want sijt voort in biechte seide
Onbekend,Onbekend Hoofdstuk,2311,Myne wiue op eenre heide
Onbekend,Onbekend Hoofdstuk,2312,Dair sy bedeuaert gingen tsamen
Onbekend,Onbekend Hoofdstuk,2313,Mer si most bider drie coningen namen
Onbekend,Onbekend Hoofdstuk,2314,Eerst sweren ende bi haerre trouwe
Onbekend,Onbekend Hoofdstuk,2315,Dat zijt door lieue noch door rouwe
Onbekend,Onbekend Hoofdstuk,2316,Nemmermeer zoud seggen voort
Onbekend,Onbekend Hoofdstuk,2317,Mer mijn wijff en hielt nye hair woort
Onbekend,Onbekend Hoofdstuk,2318,Want teerst dat si bi my quam
Onbekend,Onbekend Hoofdstuk,2319,Seide sy my wat sy vernam
Onbekend,Onbekend Hoofdstuk,2320,Mer si seit my in stillre teyken
Onbekend,Onbekend Hoofdstuk,2321,Mede seide si my sulck litteyken
Onbekend,Onbekend Hoofdstuk,2322,Dat ic kende also ende waer
Onbekend,Onbekend Hoofdstuk,2323,So dat my alle mijn haer
Onbekend,Onbekend Hoofdstuk,2324,Opwaert stonden van vare groot
Onbekend,Onbekend Hoofdstuk,2325,Mijn hert wart swaerre dan een loot
Onbekend,Onbekend Hoofdstuk,2326,Ende veel couder dan een ijss
Onbekend,Onbekend Hoofdstuk,2327,Jc sels v maken merkelic wijss
Onbekend,Onbekend Hoofdstuk,2328,Die puden die voormaels waren vry
Onbekend,Onbekend Hoofdstuk,2329,Ende hoe dat si claechden dat sy
Onbekend,Onbekend Hoofdstuk,2330,Te weel waren onbedwangen
Onbekend,Onbekend Hoofdstuk,2331,Ende riepen op gode myt luden tongen
Onbekend,Onbekend Hoofdstuk,2332,Dat hi hem gaue enen heer
Onbekend,Onbekend Hoofdstuk,2333,Diese bedwonge na sijnre geer
Onbekend,Onbekend Hoofdstuk,2334,Want ten dooch geen meent sonder dwanck
Onbekend,Onbekend Hoofdstuk,2335,Dit was alder puden sanck
Onbekend,Onbekend Hoofdstuk,2336,Ende god die dede hair begeer
Onbekend,Onbekend Hoofdstuk,2337,Ende sette hem enen heer
Onbekend,Onbekend Hoofdstuk,2338,End seynde hem enen oudevader
Onbekend,Onbekend Hoofdstuk,2339,Die verslant ende verbeetse algader
Onbekend,Onbekend Hoofdstuk,2340,Jn allen steden dair hi se vant
Onbekend,Onbekend Hoofdstuk,2341,Wast te water off opt lant
Onbekend,Onbekend Hoofdstuk,2342,Altijt deed hi hem ongenade
Onbekend,Onbekend Hoofdstuk,2343,Doe claechden sy doe wast te spade
Onbekend,Onbekend Hoofdstuk,2344,Het was te spade te seggen o wy
Onbekend,Onbekend Hoofdstuk,2345,Sy die te voren waren vry
Onbekend,Onbekend Hoofdstuk,2346,Ende niet en achten op yements dreigen
Onbekend,Onbekend Hoofdstuk,2347,Sijn ewelic scalc ende eygen
Onbekend,Onbekend Hoofdstuk,2348,Ende moeten bliuen onselinck
Onbekend,Onbekend Hoofdstuk,2349,Onder horen oudenvader den coninck
Onbekend,Onbekend Hoofdstuk,2350,Dair om gi arm ende gi rike
Onbekend,Onbekend Hoofdstuk,2351,Jc ducht aldes gelike
Onbekend,Onbekend Hoofdstuk,2352,Mit ons oec mocht geuallen
Onbekend,Onbekend Hoofdstuk,2353,Dus droech ic zorch voor v allen
Onbekend,Onbekend Hoofdstuk,2354,HEer dus sorchdic voor v
Onbekend,Onbekend Hoofdstuk,2355,Des gi my luttel dancket nv
Onbekend,Onbekend Hoofdstuk,2356,Jc ken brwn scalck ende quaet
Onbekend,Onbekend Hoofdstuk,2357,Ende vol van groter ouerdaet
Onbekend,Onbekend Hoofdstuk,2358,Dair om onsach ic hem zeer
Onbekend,Onbekend Hoofdstuk,2359,Ende peynsde word hi ons heer
Onbekend,Onbekend Hoofdstuk,2360,Dat wi alle waren verloren
Onbekend,Onbekend Hoofdstuk,2361,Jc kende den coninc wel geboren
Onbekend,Onbekend Hoofdstuk,2362,Mogende ende goedertieren
Onbekend,Onbekend Hoofdstuk,2363,Ende genadich allen dieren
Onbekend,Onbekend Hoofdstuk,2364,Dus docht ic by veel dingen
Onbekend,Onbekend Hoofdstuk,2365,Dattet wair quade wisselingen
Onbekend,Onbekend Hoofdstuk,2366,Dair ons altoos off soude comen
Onbekend,Onbekend Hoofdstuk,2367,Veel pinen ende veel onvromen
Onbekend,Onbekend Hoofdstuk,2368,Mennige zorch mijn herte doochde
Onbekend,Onbekend Hoofdstuk,2369,Nauwe pijnde ic ende poochde
Onbekend,Onbekend Hoofdstuk,2370,Hoe ic gedede enige zaken
Onbekend,Onbekend Hoofdstuk,2371,Dair bi ic scoorden ende braken
Onbekend,Onbekend Hoofdstuk,2372,Mijns vaders bosen raet
Onbekend,Onbekend Hoofdstuk,2373,Die enen dorper ende enen vraet
Onbekend,Onbekend Hoofdstuk,2374,Coninc ende heer maken waende
Onbekend,Onbekend Hoofdstuk,2375,Altoos bad ic gode ende maende
Onbekend,Onbekend Hoofdstuk,2376,Dat hi den coninc mynen heer
Onbekend,Onbekend Hoofdstuk,2377,Behielde sijn weerlike eer
Onbekend,Onbekend Hoofdstuk,2378,Mer wel beuroede ic altijt dat
Onbekend,Onbekend Hoofdstuk,2379,Behelde mijn vader sijn scat
Onbekend,Onbekend Hoofdstuk,2380,Hy soude myt synen valschen gespelen
Onbekend,Onbekend Hoofdstuk,2381,Den raet vijnden ende telen
Onbekend,Onbekend Hoofdstuk,2382,Dat die coninc worde verstoten
Onbekend,Onbekend Hoofdstuk,2383,Die in diepen penzen ende in groten
Onbekend,Onbekend Hoofdstuk,2384,Was ic dicke hoe ic dat
Onbekend,Onbekend Hoofdstuk,2385,Weten soude wair die scat
Onbekend,Onbekend Hoofdstuk,2386,Lach. die mijn vader had geuonden
Onbekend,Onbekend Hoofdstuk,2387,Jc wachte nauwe tallen stonden
Onbekend,Onbekend Hoofdstuk,2388,Jn bosch in hage. in veld in wouden
Onbekend,Onbekend Hoofdstuk,2389,Wanneer mijn vader die listige ouden
Onbekend,Onbekend Hoofdstuk,2390,Henen tooch off liep
Onbekend,Onbekend Hoofdstuk,2391,Wast heet. cout. nat. ofte diep
Onbekend,Onbekend Hoofdstuk,2392,Wast bi nachte off bi dage
Onbekend,Onbekend Hoofdstuk,2393,Vmmer was ic in sijn lage
Onbekend,Onbekend Hoofdstuk,2394,TEnen tiden lach ic in die eerde
Onbekend,Onbekend Hoofdstuk,2395,Ende wachte als die zeer begeerde
Onbekend,Onbekend Hoofdstuk,2396,Hoe ic best weten conde
Onbekend,Onbekend Hoofdstuk,2397,Wair ic den scat geuonde
Onbekend,Onbekend Hoofdstuk,2398,Dair ic ghern off had vernomen
Onbekend,Onbekend Hoofdstuk,2399,Doe zach ic mynen vader comen
Onbekend,Onbekend Hoofdstuk,2400,Wt enen hool oec ser gelopen
Onbekend,Onbekend Hoofdstuk,2401,So dat ic dair scats in hopen
Onbekend,Onbekend Hoofdstuk,2402,Was by doen zien dat ic zach
Onbekend,Onbekend Hoofdstuk,2403,Hem driuen als ic v zeggen mach
Onbekend,Onbekend Hoofdstuk,2404,Want ic aen hem dit vernam
Onbekend,Onbekend Hoofdstuk,2405,Dat hi wtten hole quam
Onbekend,Onbekend Hoofdstuk,2406,Al om ziende mercte hy
Onbekend,Onbekend Hoofdstuk,2407,Off hem yement wair by
Onbekend,Onbekend Hoofdstuk,2408,Ende als hi nergent nyement en zach
Onbekend,Onbekend Hoofdstuk,2409,So beide hi went opten dach
Onbekend,Onbekend Hoofdstuk,2410,Ende stopte sijn hol weder myt zande
Onbekend,Onbekend Hoofdstuk,2411,Ende maecte weder gelijc de lande
Onbekend,Onbekend Hoofdstuk,2412,Dat ic dat zach en wist hi niet
Onbekend,Onbekend Hoofdstuk,2413,Oec zach ic eer hi van dane sciet
Onbekend,Onbekend Hoofdstuk,2414,Dat hi sijn stert dair ouer liet gaen
Onbekend,Onbekend Hoofdstuk,2415,Dair sijn voeten hadden gestaen
Onbekend,Onbekend Hoofdstuk,2416,Ende decte sijn voetstappen mitten monde
Onbekend,Onbekend Hoofdstuk,2417,Dit leerd ic dair tot dier stonde
Onbekend,Onbekend Hoofdstuk,2418,Aen mynen valschen ouden vader
Onbekend,Onbekend Hoofdstuk,2419,Die dese liste cond alle gader
Onbekend,Onbekend Hoofdstuk,2420,Dair ic te voren off en wist niet
Onbekend,Onbekend Hoofdstuk,2421,Mittien hi van dane schiet
Onbekend,Onbekend Hoofdstuk,2422,Ende liep ten dorp waer om sijn genereren
Onbekend,Onbekend Hoofdstuk,2423,Om dies ic niet en woud ontberen
Onbekend,Onbekend Hoofdstuk,2424,Spranc ic op die vaert ende liep ten holle
Onbekend,Onbekend Hoofdstuk,2425,Oec so en was ic doe niet dolle
Onbekend,Onbekend Hoofdstuk,2426,Jc en genaecte doe te hant
Onbekend,Onbekend Hoofdstuk,2427,Dair ic scraefde op dat sant
Onbekend,Onbekend Hoofdstuk,2428,Myt mynen voeten ende croop dair in
Onbekend,Onbekend Hoofdstuk,2429,Dair ic vant een groot gewyn
Onbekend,Onbekend Hoofdstuk,2430,Fijn siluer ende root gout
Onbekend,Onbekend Hoofdstuk,2431,Hier en is nyement so bout
Onbekend,Onbekend Hoofdstuk,2432,Dies ye so veel te gader zach
Onbekend,Onbekend Hoofdstuk,2433,Doe en spaerde ic nacht noch dach
Onbekend,Onbekend Hoofdstuk,2434,Jc en ghinc slepen ende dragen
Onbekend,Onbekend Hoofdstuk,2435,Sonder kerre ende sonder wagen
Onbekend,Onbekend Hoofdstuk,2436,My halp mijn wijff vrou ermelijn
Onbekend,Onbekend Hoofdstuk,2437,Dus doochden wy grote pijn
Onbekend,Onbekend Hoofdstuk,2438,Eer dat wi den groten scat
Onbekend,Onbekend Hoofdstuk,2439,Brochten op een ander stat
Onbekend,Onbekend Hoofdstuk,2440,Dair hi bet lach tot onsen gelage
Onbekend,Onbekend Hoofdstuk,2441,Wy droegen onder enen hage
Onbekend,Onbekend Hoofdstuk,2442,Jn een hol in die eerde wel diep
Onbekend,Onbekend Hoofdstuk,2443,Bynnen deser tijt mijn vader liep
Onbekend,Onbekend Hoofdstuk,2444,Tottien den coninc wouden verraden
Onbekend,Onbekend Hoofdstuk,2445,Nv mogedi horen wat sy daden
Onbekend,Onbekend Hoofdstuk,2446,Brwn ende ysegrim seynden wt
Onbekend,Onbekend Hoofdstuk,2447,Hair brieue ende groot saluut
Onbekend,Onbekend Hoofdstuk,2448,Aen allen die soudi wouden wynnen
Onbekend,Onbekend Hoofdstuk,2449,Brwn die beer soudse scryuen ynne
