author,chapter,line,text
Jacob van Maerlant,LXVIII.  [Hoe Torec den roden ridder doedde.],2862,Ende seiden haer resen waren doet.
Jacob van Maerlant,LXVIII.  [Hoe Torec den roden ridder doedde.],2863,Doen sagen si Torec al bloet
Jacob van Maerlant,LXVIII.  [Hoe Torec den roden ridder doedde.],25990,Ende seiden dat hijt hadde gedaen.
Jacob van Maerlant,LXVIII.  [Hoe Torec den roden ridder doedde.],2865,Doe werd Torec ginder gevaen.
Jacob van Maerlant,LXVIII.  [Hoe Torec den roden ridder doedde.],2866,Rogard vragde hem wie hi ware?
Jacob van Maerlant,LXVIII.  [Hoe Torec den roden ridder doedde.],2867,Ende hi seide doe oppenbare
Jacob van Maerlant,LXVIII.  [Hoe Torec den roden ridder doedde.],2868,"Dat hi Torec hiete, scire,"
Jacob van Maerlant,LXVIII.  [Hoe Torec den roden ridder doedde.],25995,Ende dat Ydor vander Baserrivire
Jacob van Maerlant,LXVIII.  [Hoe Torec den roden ridder doedde.],2870,"Sijn vader ware, dine wan."
Jacob van Maerlant,LXVIII.  [Hoe Torec den roden ridder doedde.],2871,"""Ja,"" sprac hi, ""so sidi die man"
Jacob van Maerlant,LXVIII.  [Hoe Torec den roden ridder doedde.],2872,"Die den cyrkel soect met gewelt,"
Jacob van Maerlant,LXVIII.  [Hoe Torec den roden ridder doedde.],2873,Ende mire joncfrouwen onterven welt.
Jacob van Maerlant,LXVIII.  [Hoe Torec den roden ridder doedde.],26000,Nu moetti bliven hier gevaen.
Jacob van Maerlant,LXVIII.  [Hoe Torec den roden ridder doedde.],2875,"Vaste legte[n] inden kerker saen."""
Jacob van Maerlant,LXVIII.  [Hoe Torec den roden ridder doedde.],2876,"Torec seide: ""Dat ware verranesse"
Jacob van Maerlant,LXVIII.  [Hoe Torec den roden ridder doedde.],2877,"Leitdi mi nu in gevancnesse,"
Jacob van Maerlant,LXVIII.  [Hoe Torec den roden ridder doedde.],2878,"Want gi herberget mi selve hier."""
Jacob van Maerlant,LXVIII.  [Hoe Torec den roden ridder doedde.],26005,"Doe quamen daer twee ridders fier,"
Jacob van Maerlant,LXVIII.  [Hoe Torec den roden ridder doedde.],2880,"Die Rogards kinder waren,"
Jacob van Maerlant,LXVIII.  [Hoe Torec den roden ridder doedde.],2881,Ende leitden Rogarde besiden daernaren
Jacob van Maerlant,LXVIII.  [Hoe Torec den roden ridder doedde.],2882,"Ende seiden: ""Here, dit ware traisoen,"
Jacob van Maerlant,LXVIII.  [Hoe Torec den roden ridder doedde.],2883,Woudi uwen gaste dit doen;
Jacob van Maerlant,LXVIII.  [Hoe Torec den roden ridder doedde.],26010,Wi soudens lachter hebben embermere.
Jacob van Maerlant,LXVIII.  [Hoe Torec den roden ridder doedde.],2885,"Maer herbergetten ende doet hem ere,"
Jacob van Maerlant,LXVIII.  [Hoe Torec den roden ridder doedde.],2886,Ende laten mergen henen varen;
Jacob van Maerlant,LXVIII.  [Hoe Torec den roden ridder doedde.],2887,Ende wi .xv. selen hem naren
Jacob van Maerlant,LXVIII.  [Hoe Torec den roden ridder doedde.],2888,Riden ende seelne dan vaen.
Jacob van Maerlant,LXVIII.  [Hoe Torec den roden ridder doedde.],26015,"Dat donct ons, here, bat gedaen."""
Jacob van Maerlant,LXVIII.  [Hoe Torec den roden ridder doedde.],2890,Dit dochte den vader en goet raet.
Jacob van Maerlant,LXVIII.  [Hoe Torec den roden ridder doedde.],2891,Doen toendemen Torec goet gelaet;
Jacob van Maerlant,LXVIII.  [Hoe Torec den roden ridder doedde.],2892,"Ende men ginc eten metter vard,"
Jacob van Maerlant,LXVIII.  [Hoe Torec den roden ridder doedde.],2893,Ende daerna gincmen te beddeward.
Jacob van Maerlant,LXVIII.  [Hoe Torec den roden ridder doedde.],26020,Ende des ander dages harde vroe
Jacob van Maerlant,LXVIII.  [Hoe Torec den roden ridder doedde.],2895,"Stonden die .xv. op alsoe,"
Jacob van Maerlant,LXVIII.  [Hoe Torec den roden ridder doedde.],2896,"Ende reden wech doet begonde dagen,"
Jacob van Maerlant,LXVIII.  [Hoe Torec den roden ridder doedde.],2897,Ende deilden hen in tween lagen.
Jacob van Maerlant,LXVIII.  [Hoe Torec den roden ridder doedde.],2898,Ende Torec es oec opgestaen
Jacob van Maerlant,LXVIII.  [Hoe Torec den roden ridder doedde.],26025,Ende wapendem ende reet wech saen.
Jacob van Maerlant,LXVIII.  [Hoe Torec den roden ridder doedde.],2900,Ende hi quam ter ere lagen saen:
Jacob van Maerlant,LXVIII.  [Hoe Torec den roden ridder doedde.],2901,"Si ripen op hem: ""Gi blijft gevaen."""
Jacob van Maerlant,LXVIII.  [Hoe Torec den roden ridder doedde.],2902,Ende hi rechte doe sijn spere
Jacob van Maerlant,LXVIII.  [Hoe Torec den roden ridder doedde.],2903,Ende reet in hen met groten gere.
Jacob van Maerlant,LXVIII.  [Hoe Torec den roden ridder doedde.],26030,Hi staker enen ter eerden neder:
Jacob van Maerlant,LXVIII.  [Hoe Torec den roden ridder doedde.],2905,Hi sloech metten swaerde op ende weder
Jacob van Maerlant,LXVIII.  [Hoe Torec den roden ridder doedde.],2906,Ende wonder vele daer ter stat.
Jacob van Maerlant,LXVIII.  [Hoe Torec den roden ridder doedde.],2907,Doe quam die andere lage nadat;
Jacob van Maerlant,LXVIII.  [Hoe Torec den roden ridder doedde.],2908,"Ende reden op hem te samene alle,"
Jacob van Maerlant,LXVIII.  [Hoe Torec den roden ridder doedde.],26035,"So dat sine brachten daer te valle,"
Jacob van Maerlant,LXVIII.  [Hoe Torec den roden ridder doedde.],2910,"Ende slogen sere ende vingen daer,"
Jacob van Maerlant,LXVIII.  [Hoe Torec den roden ridder doedde.],2911,"Ende vordene den forestier daernaer,"
Jacob van Maerlant,LXVIII.  [Hoe Torec den roden ridder doedde.],2912,"Dies blide was, ende sonder beide"
Jacob van Maerlant,LXVIII.  [Hoe Torec den roden ridder doedde.],2913,"Doe in sinen kerker leide,"
Jacob van Maerlant,LXVIII.  [Hoe Torec den roden ridder doedde.],26040,Daert donker was ende sere stanc.
Jacob van Maerlant,LXVIII.  [Hoe Torec den roden ridder doedde.],2915,"Daer lach hi .xv. dage lanc,"
Jacob van Maerlant,LXVIII.  [Hoe Torec den roden ridder doedde.],2916,Daer hi maer at borne ende broet.
Jacob van Maerlant,LXVIII.  [Hoe Torec den roden ridder doedde.],2917,Nu hadde die rode riddere doet
Jacob van Maerlant,LXVIII.  [Hoe Torec den roden ridder doedde.],2918,"Geslegen Rogards kinder twee,"
Jacob van Maerlant,LXVIII.  [Hoe Torec den roden ridder doedde.],26045,"Dies was den broderen herde wee,"
Jacob van Maerlant,LXVIII.  [Hoe Torec den roden ridder doedde.],2920,"Ende spraken ten vader: ""Wi secgen u,"
Jacob van Maerlant,LXVIII.  [Hoe Torec den roden ridder doedde.],2921,"Wildi onsen raet doen nu,"
Jacob van Maerlant,LXVIII.  [Hoe Torec den roden ridder doedde.],2922,Wi werden gewroken over luut.
Jacob van Maerlant,LXVIII.  [Hoe Torec den roden ridder doedde.],2923,"Latewi desen riddere uut,"
Jacob van Maerlant,LXVIII.  [Hoe Torec den roden ridder doedde.],26050,Indien dat hi wilde gestaden
Jacob van Maerlant,LXVIII.  [Hoe Torec den roden ridder doedde.],2925,"Jegen den fellen vanden gewaden,"
Jacob van Maerlant,LXVIII.  [Hoe Torec den roden ridder doedde.],2926,"Den roden, die onse broder sloech."
Jacob van Maerlant,LXVIII.  [Hoe Torec den roden ridder doedde.],2927,"Mochet hine doden dat ware ons gnoech,"
Jacob van Maerlant,LXVIII.  [Hoe Torec den roden ridder doedde.],2928,Soe warewi wel gewroken dan;
Jacob van Maerlant,LXVIII.  [Hoe Torec den roden ridder doedde.],26055,"Want Torec es so starken man,"
Jacob van Maerlant,LXVIII.  [Hoe Torec den roden ridder doedde.],2930,"Hi sal den fellen verwinnen wel."""
Jacob van Maerlant,LXVIII.  [Hoe Torec den roden ridder doedde.],2931,Dus ginc Rogard ende dede niet el.
Jacob van Maerlant,LXVIII.  [Hoe Torec den roden ridder doedde.],2932,"Dan hi Torecke vrage das,"
Jacob van Maerlant,LXVIII.  [Hoe Torec den roden ridder doedde.],2933,Oft hi dit doen wilde? Doe was
Jacob van Maerlant,LXVIII.  [Hoe Torec den roden ridder doedde.],26060,"Torec soe blide, ende seide: ""Here,"
Jacob van Maerlant,LXVIII.  [Hoe Torec den roden ridder doedde.],2935,Jaic; ende vergeve u oec embermere
Jacob van Maerlant,LXVIII.  [Hoe Torec den roden ridder doedde.],2936,"Dat gi mi nu hebt mesdaen."""
Jacob van Maerlant,LXVIII.  [Hoe Torec den roden ridder doedde.],2937,"Doe sekerde hijt hem, ende daerna saen"
Jacob van Maerlant,LXVIII.  [Hoe Torec den roden ridder doedde.],2938,"Was Torec uten kerker gedaen,"
Jacob van Maerlant,LXVIII.  [Hoe Torec den roden ridder doedde.],26065,"Ende men deden te gemake,"
Jacob van Maerlant,LXVIII.  [Hoe Torec den roden ridder doedde.],2940,Dat hem gebrac van gere sake.
Jacob van Maerlant,LXVIII.  [Hoe Torec den roden ridder doedde.],2941,Doe hi wel was genesen
Jacob van Maerlant,LXVIII.  [Hoe Torec den roden ridder doedde.],2942,Doe lietment saen weten na desen
Jacob van Maerlant,LXVIII.  [Hoe Torec den roden ridder doedde.],2943,"Den fellen riddere vanden gewade,"
Jacob van Maerlant,LXVIII.  [Hoe Torec den roden ridder doedde.],26070,"Oft hi so cone ware van rade,"
Jacob van Maerlant,LXVIII.  [Hoe Torec den roden ridder doedde.],2945,Dat hi enen camp dorste bestaen
Jacob van Maerlant,LXVIII.  [Hoe Torec den roden ridder doedde.],2946,Vander mord die hi hadde gedaen?
Jacob van Maerlant,LXVIII.  [Hoe Torec den roden ridder doedde.],2947,"Hi ontboet : ja hi, God weet."
Jacob van Maerlant,LXVIII.  [Hoe Torec den roden ridder doedde.],2948,Doe voer Torec daerwaerd gereet
Jacob van Maerlant,LXVIII.  [Hoe Torec den roden ridder doedde.],26075,Ende vantene opten gewade daer.
Jacob van Maerlant,LXVIII.  [Hoe Torec den roden ridder doedde.],2950,Doe seide Torec te hen daernaer:
Jacob van Maerlant,LXVIII.  [Hoe Torec den roden ridder doedde.],2951,"""Gi sloget doet valscelike"
Jacob van Maerlant,LXVIII.  [Hoe Torec den roden ridder doedde.],2952,Rogards kinder; ende cortelike
Jacob van Maerlant,LXVIII.  [Hoe Torec den roden ridder doedde.],2953,"Willic dat hier proven op u."""
Jacob van Maerlant,LXVIII.  [Hoe Torec den roden ridder doedde.],26080,Dander ne [wilde] ter stede niet nu
Jacob van Maerlant,LXVIII.  [Hoe Torec den roden ridder doedde.],2955,"Hem geantwerden van groten moede,"
Jacob van Maerlant,LXVIII.  [Hoe Torec den roden ridder doedde.],2956,"Ende reet op Torec, die ander hoede"
Jacob van Maerlant,LXVIII.  [Hoe Torec den roden ridder doedde.],2957,"Was, ende op hem weder reet."
Jacob van Maerlant,LXVIII.  [Hoe Torec den roden ridder doedde.],2958,"Si quamen te gadere, van mode heet,"
Jacob van Maerlant,LXVIII.  [Hoe Torec den roden ridder doedde.],26085,"Soe datsi haer speren braken daer,"
Jacob van Maerlant,LXVIII.  [Hoe Torec den roden ridder doedde.],2960,Ende ter eerden vielen daernaer;
Jacob van Maerlant,LXVIII.  [Hoe Torec den roden ridder doedde.],2961,"Ende haer orsse vielen mede,"
Jacob van Maerlant,LXVIII.  [Hoe Torec den roden ridder doedde.],2962,"Torec spranc op daer ter stede,"
Jacob van Maerlant,LXVIII.  [Hoe Torec den roden ridder doedde.],2963,Ende die ander mede oec saen.
Jacob van Maerlant,LXVIII.  [Hoe Torec den roden ridder doedde.],26090,Doe gingen si metten swerden slaen
Jacob van Maerlant,LXVIII.  [Hoe Torec den roden ridder doedde.],2965,Vreesselike sere ende grote slage.
Jacob van Maerlant,LXVIII.  [Hoe Torec den roden ridder doedde.],2966,Dit geduerde toten middage.
Jacob van Maerlant,LXVIII.  [Hoe Torec den roden ridder doedde.],2967,"Doe geraecte Torec den anderen so wel,"
Jacob van Maerlant,LXVIII.  [Hoe Torec den roden ridder doedde.],2968,Dat hem daer sijn swaerd ontfel.
Jacob van Maerlant,LXVIII.  [Hoe Torec den roden ridder doedde.],26095,"Doe gegreep hi Torec, sonder waen,"
Jacob van Maerlant,LXVIII.  [Hoe Torec den roden ridder doedde.],2970,"Metten armen, ende waenden saen"
Jacob van Maerlant,LXVIII.  [Hoe Torec den roden ridder doedde.],2971,Onder hebben geworpen nu;
Jacob van Maerlant,LXVIII.  [Hoe Torec den roden ridder doedde.],2972,"Maer Torec warp hem. dat secgic u,"
Jacob van Maerlant,LXVIII.  [Hoe Torec den roden ridder doedde.],2973,"Optie harde eerde saen,"
Jacob van Maerlant,LXVIII.  [Hoe Torec den roden ridder doedde.],26100,Dat hem die ogen dochten vergaen.
Jacob van Maerlant,LXVIII.  [Hoe Torec den roden ridder doedde.],2975,"Doe trac hi den helm af daernaer,"
Jacob van Maerlant,LXVIII.  [Hoe Torec den roden ridder doedde.],2976,Ende wilde hem thoeft afslaen aldaer.
Jacob van Maerlant,LXVIII.  [Hoe Torec den roden ridder doedde.],2977,"Doe riep die gene: genade , sere."
Jacob van Maerlant,LXVIII.  [Hoe Torec den roden ridder doedde.],2978,"Die forestier seide: ""Slaet doet, here,"
Jacob van Maerlant,LXVIII.  [Hoe Torec den roden ridder doedde.],26105,"Den verradere, des biddic u."""
Jacob van Maerlant,LXVIII.  [Hoe Torec den roden ridder doedde.],2980,Die ander riep echt: genade. nu.
Jacob van Maerlant,LXVIII.  [Hoe Torec den roden ridder doedde.],2981,"Rogard seide: ""Liechdi mi, Torec,"
Jacob van Maerlant,LXVIII.  [Hoe Torec den roden ridder doedde.],2982,Ic leide u weder inden strec
Jacob van Maerlant,LXVIII.  [Hoe Torec den roden ridder doedde.],2983,"Daer gi hier vore laget in."""
Jacob van Maerlant,LXVIII.  [Hoe Torec den roden ridder doedde.],26110,Torec was drove in sinen sin
Jacob van Maerlant,LXVIII.  [Hoe Torec den roden ridder doedde.],2985,Ende seide ten riddere vanden gewade:
Jacob van Maerlant,LXVIII.  [Hoe Torec den roden ridder doedde.],2986,"""Nu nemt uwen helm met goden staden"
Jacob van Maerlant,LXVIII.  [Hoe Torec den roden ridder doedde.],2987,"Ende bintene vast, ende weert u nu:"
Jacob van Maerlant,LXVIII.  [Hoe Torec den roden ridder doedde.],2988,Dese genade so gevic u;
Jacob van Maerlant,LXVIII.  [Hoe Torec den roden ridder doedde.],26115,"Maer hierna bid mi genade nemmere."""
Jacob van Maerlant,LXVIII.  [Hoe Torec den roden ridder doedde.],2990,"Des dancte hem dander harde sere,"
Jacob van Maerlant,LXVIII.  [Hoe Torec den roden ridder doedde.],2991,Ende stont op ende dede alsoe.
Jacob van Maerlant,LXVIII.  [Hoe Torec den roden ridder doedde.],2992,"Van irst gingen si vechten doe,"
Jacob van Maerlant,LXVIII.  [Hoe Torec den roden ridder doedde.],2993,Ende vochten ene lange stonde.
Jacob van Maerlant,LXVIII.  [Hoe Torec den roden ridder doedde.],26120,Doe sloech hem Torec ene wonde
Jacob van Maerlant,LXVIII.  [Hoe Torec den roden ridder doedde.],2995,"Int hoeft, die ginc toten tanden."
Jacob van Maerlant,LXVIII.  [Hoe Torec den roden ridder doedde.],2996,Doe viel hi neder daer te handen
Jacob van Maerlant,LXVIII.  [Hoe Torec den roden ridder doedde.],2997,Ende was harde scire doet.
Jacob van Maerlant,LXVIII.  [Hoe Torec den roden ridder doedde.],2998,"Doe was Rogarts bliscap groet,"
Jacob van Maerlant,LXVIII.  [Hoe Torec den roden ridder doedde.],26125,Ende oec sire twe kinder mede.
Jacob van Maerlant,LXVIII.  [Hoe Torec den roden ridder doedde.],3000,Si daden Torecke daer ter stede
Jacob van Maerlant,LXVIII.  [Hoe Torec den roden ridder doedde.],3001,"Grote ere, ende noetden sere"
Jacob van Maerlant,LXVIII.  [Hoe Torec den roden ridder doedde.],3002,Met hen te varne; maer die here
Jacob van Maerlant,LXVIII.  [Hoe Torec den roden ridder doedde.],3003,"Ontseit al ende sciet van daer,"
Jacob van Maerlant,LXVIII.  [Hoe Torec den roden ridder doedde.],26130,Ende bat orlof an hen daernaer.
Jacob van Maerlant,LXVIII.  [Hoe Torec den roden ridder doedde.],3005,"Nu latic van Rogarde staen,"
Jacob van Maerlant,LXVIII.  [Hoe Torec den roden ridder doedde.],3006,Ende sal van Torec doen verstaen.
Jacob van Maerlant,LXIX.  Hoe Torec josterde jegen sinen oem ende jegen al die vander tavelronden.,3007,Nu gewaget daventure
Jacob van Maerlant,LXIX.  Hoe Torec josterde jegen sinen oem ende jegen al die vander tavelronden.,3008,Dat Torec reet ter selver ure
Jacob van Maerlant,LXIX.  Hoe Torec josterde jegen sinen oem ende jegen al die vander tavelronden.,26135,"Also vord al dien dach,"
Jacob van Maerlant,LXIX.  Hoe Torec josterde jegen sinen oem ende jegen al die vander tavelronden.,3010,[Ende] savons te eens ridders lach
Jacob van Maerlant,LXIX.  Hoe Torec josterde jegen sinen oem ende jegen al die vander tavelronden.,3011,Daer hi wel was ontfaen.
Jacob van Maerlant,LXIX.  Hoe Torec josterde jegen sinen oem ende jegen al die vander tavelronden.,3012,Doe die weerd hadde verstaen
Jacob van Maerlant,LXIX.  Hoe Torec josterde jegen sinen oem ende jegen al die vander tavelronden.,3013,Dat hi doet hadde vanden gewade
Jacob van Maerlant,LXIX.  Hoe Torec josterde jegen sinen oem ende jegen al die vander tavelronden.,26140,"Den fellen riddere sonder genade,"
Jacob van Maerlant,LXIX.  Hoe Torec josterde jegen sinen oem ende jegen al die vander tavelronden.,3015,Dies was hi utermatene blide;
Jacob van Maerlant,LXIX.  Hoe Torec josterde jegen sinen oem ende jegen al die vander tavelronden.,3016,Want hi was sijn viant te dien tide.
Jacob van Maerlant,LXIX.  Hoe Torec josterde jegen sinen oem ende jegen al die vander tavelronden.,3017,"Om dit ontfinc hine wel aldaer,"
Jacob van Maerlant,LXIX.  Hoe Torec josterde jegen sinen oem ende jegen al die vander tavelronden.,3018,Ende dedene drie dage bliven daernaer
Jacob van Maerlant,LXIX.  Hoe Torec josterde jegen sinen oem ende jegen al die vander tavelronden.,26145,Om te genese sine wonden.
Jacob van Maerlant,LXIX.  Hoe Torec josterde jegen sinen oem ende jegen al die vander tavelronden.,3020,Ende daerna reet ten selven stonden
Jacob van Maerlant,LXIX.  Hoe Torec josterde jegen sinen oem ende jegen al die vander tavelronden.,3021,Die riddere ende wijsde Torec saen
Jacob van Maerlant,LXIX.  Hoe Torec josterde jegen sinen oem ende jegen al die vander tavelronden.,3022,Waer die casteel ware gestaen
Jacob van Maerlant,LXIX.  Hoe Torec josterde jegen sinen oem ende jegen al die vander tavelronden.,3023,Daer die cyrkel binnen was.
Jacob van Maerlant,LXIX.  Hoe Torec josterde jegen sinen oem ende jegen al die vander tavelronden.,26150,Doe nam Torec orlof na das
Jacob van Maerlant,LXIX.  Hoe Torec josterde jegen sinen oem ende jegen al die vander tavelronden.,3025,"Ende dancte den riddere sere der vard,"
Jacob van Maerlant,LXIX.  Hoe Torec josterde jegen sinen oem ende jegen al die vander tavelronden.,3026,"Ende reet vaste daerward,"
Jacob van Maerlant,LXIX.  Hoe Torec josterde jegen sinen oem ende jegen al die vander tavelronden.,3027,In gepense van groter minnen.
Jacob van Maerlant,LXIX.  Hoe Torec josterde jegen sinen oem ende jegen al die vander tavelronden.,3028,Doe sach hi comen hierenbinnen
Jacob van Maerlant,LXIX.  Hoe Torec josterde jegen sinen oem ende jegen al die vander tavelronden.,26155,"Ene die alre scoenste maget,"
Jacob van Maerlant,LXIX.  Hoe Torec josterde jegen sinen oem ende jegen al die vander tavelronden.,3030,Die hem soe overwel behaget:
Jacob van Maerlant,LXIX.  Hoe Torec josterde jegen sinen oem ende jegen al die vander tavelronden.,3031,"Si quam op een teldende pard,"
Jacob van Maerlant,LXIX.  Hoe Torec josterde jegen sinen oem ende jegen al die vander tavelronden.,3032,Met groter sierheit wel beward.
Jacob van Maerlant,LXIX.  Hoe Torec josterde jegen sinen oem ende jegen al die vander tavelronden.,3033,Vor hare sach hi knapen comen
Jacob van Maerlant,LXIX.  Hoe Torec josterde jegen sinen oem ende jegen al die vander tavelronden.,26160,"Die ene tente brachten somen,"
Jacob van Maerlant,LXIX.  Hoe Torec josterde jegen sinen oem ende jegen al die vander tavelronden.,3035,"Ende some brachten si gode spise,"
Jacob van Maerlant,LXIX.  Hoe Torec josterde jegen sinen oem ende jegen al die vander tavelronden.,3036,Wet gereet na harre wise.
Jacob van Maerlant,LXIX.  Hoe Torec josterde jegen sinen oem ende jegen al die vander tavelronden.,3037,"Torec heeft die joncfrouwe gemoet,"
Jacob van Maerlant,LXIX.  Hoe Torec josterde jegen sinen oem ende jegen al die vander tavelronden.,3038,Ende heefse minlike oec gegroet.
Jacob van Maerlant,LXIX.  Hoe Torec josterde jegen sinen oem ende jegen al die vander tavelronden.,26165,"Doe seitsi: ""Here, God lone u."
Jacob van Maerlant,LXIX.  Hoe Torec josterde jegen sinen oem ende jegen al die vander tavelronden.,3040,"Siet, dit paulioen sentmen u nu"
Jacob van Maerlant,LXIX.  Hoe Torec josterde jegen sinen oem ende jegen al die vander tavelronden.,3041,"Al hier te slane tuwen dele,"
Jacob van Maerlant,LXIX.  Hoe Torec josterde jegen sinen oem ende jegen al die vander tavelronden.,3042,Daer in te drivene uwe rivele;
Jacob van Maerlant,LXIX.  Hoe Torec josterde jegen sinen oem ende jegen al die vander tavelronden.,3043,Ende dat gijt hier doet slaen ter stede;
Jacob van Maerlant,LXIX.  Hoe Torec josterde jegen sinen oem ende jegen al die vander tavelronden.,26170,"Ende eten ende drinken sint si u mede."""
Jacob van Maerlant,LXIX.  Hoe Torec josterde jegen sinen oem ende jegen al die vander tavelronden.,3045,Doe sloechmen gene tente metter spoet:
Jacob van Maerlant,LXIX.  Hoe Torec josterde jegen sinen oem ende jegen al die vander tavelronden.,3046,En sach nie man gene so goet.
Jacob van Maerlant,LXIX.  Hoe Torec josterde jegen sinen oem ende jegen al die vander tavelronden.,3047,Men dede Torec te gemake daer
Jacob van Maerlant,LXIX.  Hoe Torec josterde jegen sinen oem ende jegen al die vander tavelronden.,3048,"Van etene, van drinke, ende daernaer"
Jacob van Maerlant,LXIX.  Hoe Torec josterde jegen sinen oem ende jegen al die vander tavelronden.,26175,Ginc hi hem verwandelen saen;
Jacob van Maerlant,LXIX.  Hoe Torec josterde jegen sinen oem ende jegen al die vander tavelronden.,3050,Ende die joncfrouwe es met hem gegaen.
Jacob van Maerlant,LXIX.  Hoe Torec josterde jegen sinen oem ende jegen al die vander tavelronden.,3051,Doen besach hi den casteel
Jacob van Maerlant,LXIX.  Hoe Torec josterde jegen sinen oem ende jegen al die vander tavelronden.,3052,Daer sijn herte in was een deel.
Jacob van Maerlant,LXIX.  Hoe Torec josterde jegen sinen oem ende jegen al die vander tavelronden.,3053,Doe vernam hi saen daer mettien
Jacob van Maerlant,LXIX.  Hoe Torec josterde jegen sinen oem ende jegen al die vander tavelronden.,26180,Ten cantele udewaerd sien
Jacob van Maerlant,LXIX.  Hoe Torec josterde jegen sinen oem ende jegen al die vander tavelronden.,3055,"Die scone, die smale, dies geloeft,"
Jacob van Maerlant,LXIX.  Hoe Torec josterde jegen sinen oem ende jegen al die vander tavelronden.,3056,Ende metten cyrkele opt hoeft.
Jacob van Maerlant,LXIX.  Hoe Torec josterde jegen sinen oem ende jegen al die vander tavelronden.,3057,Ende doenre Torec werd geware
Jacob van Maerlant,LXIX.  Hoe Torec josterde jegen sinen oem ende jegen al die vander tavelronden.,3058,Bleef hi altenen siende op hare.
Jacob van Maerlant,LXIX.  Hoe Torec josterde jegen sinen oem ende jegen al die vander tavelronden.,26185,Ende doe doe joncfrouwe die tente sach
Jacob van Maerlant,LXIX.  Hoe Torec josterde jegen sinen oem ende jegen al die vander tavelronden.,3060,"En wist si niet watter ane gelach,"
Jacob van Maerlant,LXIX.  Hoe Torec josterde jegen sinen oem ende jegen al die vander tavelronden.,3061,"Ende ginc vaste neder te dale,"
Jacob van Maerlant,LXIX.  Hoe Torec josterde jegen sinen oem ende jegen al die vander tavelronden.,3062,Ende riep haer ridders in die zale
Jacob van Maerlant,LXIX.  Hoe Torec josterde jegen sinen oem ende jegen al die vander tavelronden.,3063,Ende dede hen verstaen aldaer
Jacob van Maerlant,LXIX.  Hoe Torec josterde jegen sinen oem ende jegen al die vander tavelronden.,26190,"Vander tenten al oppenbaer,"
Jacob van Maerlant,LXIX.  Hoe Torec josterde jegen sinen oem ende jegen al die vander tavelronden.,3065,Ende vanden riddere die daer stoet:
Jacob van Maerlant,LXIX.  Hoe Torec josterde jegen sinen oem ende jegen al die vander tavelronden.,3066,"""In weet oft es om inse goet;"
Jacob van Maerlant,LXIX.  Hoe Torec josterde jegen sinen oem ende jegen al die vander tavelronden.,3067,Gaet ende vernemet ons nu saen
Jacob van Maerlant,LXIX.  Hoe Torec josterde jegen sinen oem ende jegen al die vander tavelronden.,3068,"Wat si willen anegaen."""
Jacob van Maerlant,LXIX.  Hoe Torec josterde jegen sinen oem ende jegen al die vander tavelronden.,26195,Dus sijn twee ridders gegaen daernare
Jacob van Maerlant,LXIX.  Hoe Torec josterde jegen sinen oem ende jegen al die vander tavelronden.,3070,"Ende vrachden Torec wie hi ware,"
Jacob van Maerlant,LXIX.  Hoe Torec josterde jegen sinen oem ende jegen al die vander tavelronden.,3071,Ende wat hi sochte daer ter stede?
Jacob van Maerlant,LXIX.  Hoe Torec josterde jegen sinen oem ende jegen al die vander tavelronden.,3072,Torec antwerde hem gerede:
Jacob van Maerlant,LXIX.  Hoe Torec josterde jegen sinen oem ende jegen al die vander tavelronden.,3073,"""Ic hete Torec, wet dat scire,"
Jacob van Maerlant,LXIX.  Hoe Torec josterde jegen sinen oem ende jegen al die vander tavelronden.,26200,Ende Ydor vander Baserrivire
Jacob van Maerlant,LXIX.  Hoe Torec josterde jegen sinen oem ende jegen al die vander tavelronden.,3075,"Es min vader, ende ic soeke mede"
Jacob van Maerlant,LXIX.  Hoe Torec josterde jegen sinen oem ende jegen al die vander tavelronden.,3076,"Die joncfrouwe ende den cyrkel bede."""
Jacob van Maerlant,LXIX.  Hoe Torec josterde jegen sinen oem ende jegen al die vander tavelronden.,3077,"""Dats dulheit,"" seiden die ander, ""groet."
Jacob van Maerlant,LXIX.  Hoe Torec josterde jegen sinen oem ende jegen al die vander tavelronden.,3078,U staet eer te blivene doet
Jacob van Maerlant,LXIX.  Hoe Torec josterde jegen sinen oem ende jegen al die vander tavelronden.,26205,"Eer u dit gesciet; Godweit,"
Jacob van Maerlant,LXIX.  Hoe Torec josterde jegen sinen oem ende jegen al die vander tavelronden.,3080,"Gi staet bat af derre sotheit."""
Jacob van Maerlant,LXIX.  Hoe Torec josterde jegen sinen oem ende jegen al die vander tavelronden.,3081,"Torec seide: ""Dit moet wesen,"
Jacob van Maerlant,LXIX.  Hoe Torec josterde jegen sinen oem ende jegen al die vander tavelronden.,3082,Wire om sterft oft sal genesen.
Jacob van Maerlant,LXIX.  Hoe Torec josterde jegen sinen oem ende jegen al die vander tavelronden.,3083,"Dus sijn si gesceden van daer,"
Jacob van Maerlant,LXIX.  Hoe Torec josterde jegen sinen oem ende jegen al die vander tavelronden.,26210,"Ende seident haerre joncfrouwen daernaer,"
Jacob van Maerlant,LXIX.  Hoe Torec josterde jegen sinen oem ende jegen al die vander tavelronden.,3085,"Dat hi omden cyrkel comen ware,"
