author,chapter,line,text
Jacob van Maerlant,LVII.  Van den [coninc] ende vander [joncfrouwen] metten [cyrkel].,1,"Die aventure doet ons cont,"
Jacob van Maerlant,LVII.  Van den [coninc] ende vander [joncfrouwen] metten [cyrkel].,2,Dat in deser selver stont
Jacob van Maerlant,LVII.  Van den [coninc] ende vander [joncfrouwen] metten [cyrkel].,3,"Een coninc was, ende hiet Briant,"
Jacob van Maerlant,LVII.  Van den [coninc] ende vander [joncfrouwen] metten [cyrkel].,23130,Ende was coninc int rode eylant;
Jacob van Maerlant,LVII.  Van den [coninc] ende vander [joncfrouwen] metten [cyrkel].,5,Ende hi voer jagen op enen tijt
Jacob van Maerlant,LVII.  Van den [coninc] ende vander [joncfrouwen] metten [cyrkel].,6,"In enen wout, was herde wijt."
Jacob van Maerlant,LVII.  Van den [coninc] ende vander [joncfrouwen] metten [cyrkel].,7,"Een ever doe vor hem daer leet,"
Jacob van Maerlant,LVII.  Van den [coninc] ende vander [joncfrouwen] metten [cyrkel].,8,Daer hi sinen liden na ontreet
Jacob van Maerlant,LVII.  Van den [coninc] ende vander [joncfrouwen] metten [cyrkel].,23135,"Soe verre in genen groten woude,"
Jacob van Maerlant,LVII.  Van den [coninc] ende vander [joncfrouwen] metten [cyrkel].,10,"Dat hi quam, alst wesen soude,"
Jacob van Maerlant,LVII.  Van den [coninc] ende vander [joncfrouwen] metten [cyrkel].,11,Daer hi vant sittende op enen boem
Jacob van Maerlant,LVII.  Van den [coninc] ende vander [joncfrouwen] metten [cyrkel].,12,"Ene scone maget, dier hi nam goem,"
Jacob van Maerlant,LVII.  Van den [coninc] ende vander [joncfrouwen] metten [cyrkel].,13,Want si was so overscone;
Jacob van Maerlant,LVII.  Van den [coninc] ende vander [joncfrouwen] metten [cyrkel].,23140,"Ende op haer hoeft stont ene crone,"
Jacob van Maerlant,LVII.  Van den [coninc] ende vander [joncfrouwen] metten [cyrkel].,15,Dat was een die beste hoetbant
Jacob van Maerlant,LVII.  Van den [coninc] ende vander [joncfrouwen] metten [cyrkel].,16,Diemen in die werelt vant.
Jacob van Maerlant,LVII.  Van den [coninc] ende vander [joncfrouwen] metten [cyrkel].,17,Doen Briade derre joncfrouwen
Jacob van Maerlant,LVII.  Van den [coninc] ende vander [joncfrouwen] metten [cyrkel].,18,Soe overscone vant int scouwen
Jacob van Maerlant,LVII.  Van den [coninc] ende vander [joncfrouwen] metten [cyrkel].,23145,Werd hi ontsteken van harre minne
Jacob van Maerlant,LVII.  Van den [coninc] ende vander [joncfrouwen] metten [cyrkel].,20,"Ende sprac: ""Joncfrouwe, live vrindinne,"
Jacob van Maerlant,LVII.  Van den [coninc] ende vander [joncfrouwen] metten [cyrkel].,21,"Woudi, ic hulpe u ave gerne."""
Jacob van Maerlant,LVII.  Van den [coninc] ende vander [joncfrouwen] metten [cyrkel].,22,"""Here, mine staets u niet te werne"
Jacob van Maerlant,LVII.  Van den [coninc] ende vander [joncfrouwen] metten [cyrkel].,23,Indien dat gijt wilt getemen
Jacob van Maerlant,LVII.  Van den [coninc] ende vander [joncfrouwen] metten [cyrkel].,23150,"Dat gi mi te wive wilt nemen."""
Jacob van Maerlant,LVII.  Van den [coninc] ende vander [joncfrouwen] metten [cyrkel].,25,"Briade seide: ""Jayc en trouwen."""
Jacob van Maerlant,LVII.  Van den [coninc] ende vander [joncfrouwen] metten [cyrkel].,26,"Op dese sake quam neder die joncfrouwe,"
Jacob van Maerlant,LVII.  Van den [coninc] ende vander [joncfrouwen] metten [cyrkel].,27,Die soe overscone was.
Jacob van Maerlant,LVII.  Van den [coninc] ende vander [joncfrouwen] metten [cyrkel].,28,"Doe gingen si sitten in dat gras,"
Jacob van Maerlant,LVII.  Van den [coninc] ende vander [joncfrouwen] metten [cyrkel].,23155,Ende die coninc vragede doe hare
Jacob van Maerlant,LVII.  Van den [coninc] ende vander [joncfrouwen] metten [cyrkel].,30,Hoe si dus es comen dare?
Jacob van Maerlant,LVII.  Van den [coninc] ende vander [joncfrouwen] metten [cyrkel].,31,"Si seide: ""Here, al nu ter stat"
Jacob van Maerlant,LVII.  Van den [coninc] ende vander [joncfrouwen] metten [cyrkel].,32,"Heeft mi min vader hier gesat,"
Jacob van Maerlant,LVII.  Van den [coninc] ende vander [joncfrouwen] metten [cyrkel].,33,Om dat hi wilde dat mi name
Jacob van Maerlant,LVII.  Van den [coninc] ende vander [joncfrouwen] metten [cyrkel].,23160,"Die gene die hier irstwerf quame,"
Jacob van Maerlant,LVII.  Van den [coninc] ende vander [joncfrouwen] metten [cyrkel].,35,Ende hi desen cyrkel van goude
Jacob van Maerlant,LVII.  Van den [coninc] ende vander [joncfrouwen] metten [cyrkel].,36,Ane mi dan behuwen soude;
Jacob van Maerlant,LVII.  Van den [coninc] ende vander [joncfrouwen] metten [cyrkel].,37,"Ende wine oec hevet, nembermere"
Jacob van Maerlant,LVII.  Van den [coninc] ende vander [joncfrouwen] metten [cyrkel].,38,Sone gebrect hem goet noch ere.
Jacob van Maerlant,LVII.  Van den [coninc] ende vander [joncfrouwen] metten [cyrkel].,23165,"Ende ic hete selve Mariole."""
Jacob van Maerlant,LVII.  Van den [coninc] ende vander [joncfrouwen] metten [cyrkel].,40,"Die coninc werd doe soe in dole,"
Jacob van Maerlant,LVII.  Van den [coninc] ende vander [joncfrouwen] metten [cyrkel].,41,Dat hi hare ter stede boet saen
Jacob van Maerlant,LVII.  Van den [coninc] ende vander [joncfrouwen] metten [cyrkel].,42,Dat hise te wive wilde ontfaen.
Jacob van Maerlant,LVII.  Van den [coninc] ende vander [joncfrouwen] metten [cyrkel].,43,"Dits ene dinc daer vele an leget,"
Jacob van Maerlant,LVII.  Van den [coninc] ende vander [joncfrouwen] metten [cyrkel].,23170,"Ende daer Merlijn af hevet geseget,"
Jacob van Maerlant,LVII.  Van den [coninc] ende vander [joncfrouwen] metten [cyrkel].,45,Ende daer die vander tavelronden
Jacob van Maerlant,LVII.  Van den [coninc] ende vander [joncfrouwen] metten [cyrkel].,46,Hebben alsoe langen stonden
Jacob van Maerlant,LVII.  Van den [coninc] ende vander [joncfrouwen] metten [cyrkel].,47,"Haer lijf daer ombe geaventurt,"
Jacob van Maerlant,LVII.  Van den [coninc] ende vander [joncfrouwen] metten [cyrkel].,48,"Ende soe menech leet besuert,"
Jacob van Maerlant,LVII.  Van den [coninc] ende vander [joncfrouwen] metten [cyrkel].,23175,Ende noch nie mochten gewinnen.
Jacob van Maerlant,LVII.  Van den [coninc] ende vander [joncfrouwen] metten [cyrkel].,50,"Si sprac doe: ""Here, wildijt kinnen,"
Jacob van Maerlant,LVII.  Van den [coninc] ende vander [joncfrouwen] metten [cyrkel].,51,Al dat gi wilt doe ic gaerne:
Jacob van Maerlant,LVII.  Van den [coninc] ende vander [joncfrouwen] metten [cyrkel].,52,"Met u benic gereet te vaerne,"
Jacob van Maerlant,LVII.  Van den [coninc] ende vander [joncfrouwen] metten [cyrkel].,53,"Condi mi nu seker gedoen,"
Jacob van Maerlant,LVII.  Van den [coninc] ende vander [joncfrouwen] metten [cyrkel].,23180,Dat mi niet neme die rode lyoen;
Jacob van Maerlant,LVII.  Van den [coninc] ende vander [joncfrouwen] metten [cyrkel].,55,"Want min vader daer af te secgen plach,"
Jacob van Maerlant,LVII.  Van den [coninc] ende vander [joncfrouwen] metten [cyrkel].,56,"Dat daer af soude comen groet hantgeslach."""
Jacob van Maerlant,LVII.  Van den [coninc] ende vander [joncfrouwen] metten [cyrkel].,57,"""Joncfrouwe, vaerdi met mi, nu siet,"
Jacob van Maerlant,LVII.  Van den [coninc] ende vander [joncfrouwen] metten [cyrkel].,58,"Gine doerft u daer af ontsien niet,"
Jacob van Maerlant,LVII.  Van den [coninc] ende vander [joncfrouwen] metten [cyrkel].,23185,"Dat u daer af gesciet meer leet."""
Jacob van Maerlant,LVII.  Van den [coninc] ende vander [joncfrouwen] metten [cyrkel].,60,"""Soe varic met u, here, gereet."""
Jacob van Maerlant,LVII.  Van den [coninc] ende vander [joncfrouwen] metten [cyrkel].,61,Ende binnen desen selven stonden
Jacob van Maerlant,LVII.  Van den [coninc] ende vander [joncfrouwen] metten [cyrkel].,62,"Quamen die jagers metten honden,"
Jacob van Maerlant,LVII.  Van den [coninc] ende vander [joncfrouwen] metten [cyrkel].,63,Ende hadden enen ever gevaen.
Jacob van Maerlant,LVII.  Van den [coninc] ende vander [joncfrouwen] metten [cyrkel].,23190,Doe dede die coninc den heren verstaen
Jacob van Maerlant,LVII.  Van den [coninc] ende vander [joncfrouwen] metten [cyrkel].,65,"Dat hi die joncfrouwe nemen woude,"
Jacob van Maerlant,LVII.  Van den [coninc] ende vander [joncfrouwen] metten [cyrkel].,66,So wat datter af comen soude.
Jacob van Maerlant,LVII.  Van den [coninc] ende vander [joncfrouwen] metten [cyrkel].,67,Dus nam hise daer ter selver stat
Jacob van Maerlant,LVII.  Van den [coninc] ende vander [joncfrouwen] metten [cyrkel].,68,"Ende voretse tsire borch na dat,"
Jacob van Maerlant,LVII.  Van den [coninc] ende vander [joncfrouwen] metten [cyrkel].,23195,Ende namse tenen wive vortan:
Jacob van Maerlant,LVII.  Van den [coninc] ende vander [joncfrouwen] metten [cyrkel].,70,Dan liet hi om riddere no om man.
Jacob van Maerlant,LVII.  Van den [coninc] ende vander [joncfrouwen] metten [cyrkel].,71,Nu hort vort van deser dinge.
Jacob van Maerlant,LVII.  Van den [coninc] ende vander [joncfrouwen] metten [cyrkel].,72,"Drie gesustere waren nu sonderlinge,"
Jacob van Maerlant,LVII.  Van den [coninc] ende vander [joncfrouwen] metten [cyrkel].,73,"Die ne hadden vader no moder,"
Jacob van Maerlant,LVII.  Van den [coninc] ende vander [joncfrouwen] metten [cyrkel].,23200,Ende oec en haddense genen broder.
Jacob van Maerlant,LVII.  Van den [coninc] ende vander [joncfrouwen] metten [cyrkel].,75,Si hadden viftech castele
Jacob van Maerlant,LVII.  Van den [coninc] ende vander [joncfrouwen] metten [cyrkel].,76,Allene onder hen te dele;
Jacob van Maerlant,LVII.  Van den [coninc] ende vander [joncfrouwen] metten [cyrkel].,77,"Ende die twee hadden amise,"
Jacob van Maerlant,LVII.  Van den [coninc] ende vander [joncfrouwen] metten [cyrkel].,78,Maer dat was in goder wise:
Jacob van Maerlant,LVII.  Van den [coninc] ende vander [joncfrouwen] metten [cyrkel].,23205,"Dat doe amise hiten sonderlinge,"
Jacob van Maerlant,LVII.  Van den [coninc] ende vander [joncfrouwen] metten [cyrkel].,80,Dat waren getrouwe vrilinge.
Jacob van Maerlant,LVII.  Van den [coninc] ende vander [joncfrouwen] metten [cyrkel].,81,Die derde hadde geen lief vercoren.
Jacob van Maerlant,LVII.  Van den [coninc] ende vander [joncfrouwen] metten [cyrkel].,82,"Die twee amise, alswijt horen,"
Jacob van Maerlant,LVII.  Van den [coninc] ende vander [joncfrouwen] metten [cyrkel].,83,Hiten Bruant ende Briade.
Jacob van Maerlant,LVII.  Van den [coninc] ende vander [joncfrouwen] metten [cyrkel].,23210,Dene joncfrouwe bat op genade
Jacob van Maerlant,LVII.  Van den [coninc] ende vander [joncfrouwen] metten [cyrkel].,85,"Haren amijs, op gerechte minne,"
Jacob van Maerlant,LVII.  Van den [coninc] ende vander [joncfrouwen] metten [cyrkel].,86,Dat hi den cyrkel haer gewinne:
Jacob van Maerlant,LVII.  Van den [coninc] ende vander [joncfrouwen] metten [cyrkel].,87,Daer ombe mach hi in allen tijt
Jacob van Maerlant,LVII.  Van den [coninc] ende vander [joncfrouwen] metten [cyrkel].,88,Haer vrinscap hebben ende haer delijt.
Jacob van Maerlant,LVII.  Van den [coninc] ende vander [joncfrouwen] metten [cyrkel].,23215,Ende Bruant vander Montangen
Jacob van Maerlant,LVII.  Van den [coninc] ende vander [joncfrouwen] metten [cyrkel].,90,"Wachte so lange derre calangen,"
Jacob van Maerlant,LVII.  Van den [coninc] ende vander [joncfrouwen] metten [cyrkel].,91,"Dattie coninc thus nine was,"
Jacob van Maerlant,LVII.  Van den [coninc] ende vander [joncfrouwen] metten [cyrkel].,92,Ende quam al gewapent na das
Jacob van Maerlant,LVII.  Van den [coninc] ende vander [joncfrouwen] metten [cyrkel].,93,"In die zale gereden binnen,"
Jacob van Maerlant,LVII.  Van den [coninc] ende vander [joncfrouwen] metten [cyrkel].,23220,Ende sach hebben opt hoeft der coninginnen
Jacob van Maerlant,LVII.  Van den [coninc] ende vander [joncfrouwen] metten [cyrkel].,95,"Den cyrkel, daer si sat tere stat."
Jacob van Maerlant,LVII.  Van den [coninc] ende vander [joncfrouwen] metten [cyrkel].,96,Hi namen hare ende kerde nadat
Jacob van Maerlant,LVII.  Van den [coninc] ende vander [joncfrouwen] metten [cyrkel].,97,Uter zalen. Doe merkede si saen
Jacob van Maerlant,LVII.  Van den [coninc] ende vander [joncfrouwen] metten [cyrkel].,98,"Enen roeden lybart, sonder waen,"
Jacob van Maerlant,LVII.  Van den [coninc] ende vander [joncfrouwen] metten [cyrkel].,23225,An sinen scilt. Doe riep si sere:
Jacob van Maerlant,LVII.  Van den [coninc] ende vander [joncfrouwen] metten [cyrkel].,100,"""Hulpe, acharme. nu es mine ere"
Jacob van Maerlant,LVII.  Van den [coninc] ende vander [joncfrouwen] metten [cyrkel].,101,"Embermer vortane gedaen."""
Jacob van Maerlant,LVII.  Van den [coninc] ende vander [joncfrouwen] metten [cyrkel].,102,Doe quamen daer hare liede saen
Jacob van Maerlant,LVII.  Van den [coninc] ende vander [joncfrouwen] metten [cyrkel].,103,"Ende volhden hem daer na, twaren;"
Jacob van Maerlant,LVII.  Van den [coninc] ende vander [joncfrouwen] metten [cyrkel].,23230,Maer hi was hen allen ontvaren
Jacob van Maerlant,LVII.  Van den [coninc] ende vander [joncfrouwen] metten [cyrkel].,105,"Ende reet te sinen lieve thant,"
Jacob van Maerlant,LVII.  Van den [coninc] ende vander [joncfrouwen] metten [cyrkel].,106,Ende gaf haer daer den hoetbant.
Jacob van Maerlant,LVII.  Van den [coninc] ende vander [joncfrouwen] metten [cyrkel].,107,"Dies was si doe so overblide,"
Jacob van Maerlant,LVII.  Van den [coninc] ende vander [joncfrouwen] metten [cyrkel].,108,Dat si riep ten selven tide:
Jacob van Maerlant,LVII.  Van den [coninc] ende vander [joncfrouwen] metten [cyrkel].,23235,"""Ay Bruant, live amijs,"
Jacob van Maerlant,LVII.  Van den [coninc] ende vander [joncfrouwen] metten [cyrkel].,110,Nu benic dine in alre wijs:
Jacob van Maerlant,LVII.  Van den [coninc] ende vander [joncfrouwen] metten [cyrkel].,111,"Ic wille u trouwen tenen man."""
Jacob van Maerlant,LVII.  Van den [coninc] ende vander [joncfrouwen] metten [cyrkel].,112,"""So willic u sustere ontbiden dan"
Jacob van Maerlant,LVII.  Van den [coninc] ende vander [joncfrouwen] metten [cyrkel].,113,"Ende deilen die castele vort,"
Jacob van Maerlant,LVII.  Van den [coninc] ende vander [joncfrouwen] metten [cyrkel].,23240,"Sonder enege scalke wort."""
Jacob van Maerlant,LVII.  Van den [coninc] ende vander [joncfrouwen] metten [cyrkel].,115,"Hi ontboet die sustere, di scire quamen."
Jacob van Maerlant,LVII.  Van den [coninc] ende vander [joncfrouwen] metten [cyrkel].,116,Ende doe si vergadert waren tsamen
Jacob van Maerlant,LVII.  Van den [coninc] ende vander [joncfrouwen] metten [cyrkel].,117,So deildi die viftech castele aldaer
Jacob van Maerlant,LVII.  Van den [coninc] ende vander [joncfrouwen] metten [cyrkel].,118,"In tween delen, wet vorwaer,"
Jacob van Maerlant,LVII.  Van den [coninc] ende vander [joncfrouwen] metten [cyrkel].,23245,Ende die cyerkel was terde deel.
Jacob van Maerlant,LVII.  Van den [coninc] ende vander [joncfrouwen] metten [cyrkel].,120,Doen hiet hi kisen al geheel
Jacob van Maerlant,LVII.  Van den [coninc] ende vander [joncfrouwen] metten [cyrkel].,121,"Der outster suster oec na dat,"
Jacob van Maerlant,LVII.  Van den [coninc] ende vander [joncfrouwen] metten [cyrkel].,122,"Die den cyrkel coes ter stat,"
Jacob van Maerlant,LVII.  Van den [coninc] ende vander [joncfrouwen] metten [cyrkel].,123,"Dies Bruans amie drove was doe,"
Jacob van Maerlant,LVII.  Van den [coninc] ende vander [joncfrouwen] metten [cyrkel].,23250,Maer het meeste ember wesen alsoe.
Jacob van Maerlant,LVII.  Van den [coninc] ende vander [joncfrouwen] metten [cyrkel].,125,Doe troude elc sijn lief aldaer.
Jacob van Maerlant,LVII.  Van den [coninc] ende vander [joncfrouwen] metten [cyrkel].,126,Grote feeste was daer vorwaer.
Jacob van Maerlant,LVII.  Van den [coninc] ende vander [joncfrouwen] metten [cyrkel].,127,"Ende die metten cyrkele werd sere rike,"
Jacob van Maerlant,LVII.  Van den [coninc] ende vander [joncfrouwen] metten [cyrkel].,128,Want men niet vant des gelike.
Jacob van Maerlant,LVII.  Van den [coninc] ende vander [joncfrouwen] metten [cyrkel].,23255,"Nu latic bliven hieraf di tale,"
Jacob van Maerlant,LVII.  Van den [coninc] ende vander [joncfrouwen] metten [cyrkel].,130,"Ic salre hierna af spreken wale,"
Jacob van Maerlant,LVII.  Van den [coninc] ende vander [joncfrouwen] metten [cyrkel].,131,Maer ic moet u secgen ere
Jacob van Maerlant,LVII.  Van den [coninc] ende vander [joncfrouwen] metten [cyrkel].,132,Van hare di bleef in groten sere.
Jacob van Maerlant,"LVIII.  Van Torecs moder, ende hoe hi riddere werd.",133,"Die aventure seget na desen,"
Jacob van Maerlant,"LVIII.  Van Torecs moder, ende hoe hi riddere werd.",23260,"Dattie coninginne meer wilde wesen,"
Jacob van Maerlant,"LVIII.  Van Torecs moder, ende hoe hi riddere werd.",135,"In geselscap, sijt seker das,"
Jacob van Maerlant,"LVIII.  Van Torecs moder, ende hoe hi riddere werd.",136,Waer dat enege bliscap was.
Jacob van Maerlant,"LVIII.  Van Torecs moder, ende hoe hi riddere werd.",137,"Ende haer goet minderde daer naer,"
Jacob van Maerlant,"LVIII.  Van Torecs moder, ende hoe hi riddere werd.",138,Ende haer man starf int jaer.
Jacob van Maerlant,"LVIII.  Van Torecs moder, ende hoe hi riddere werd.",23265,Ende si oec daerna genas
Jacob van Maerlant,"LVIII.  Van Torecs moder, ende hoe hi riddere werd.",140,"Van ere dochter, sijt seker das;"
Jacob van Maerlant,"LVIII.  Van Torecs moder, ende hoe hi riddere werd.",141,"Ende die deetsi in ene tonne beslaen,"
Jacob van Maerlant,"LVIII.  Van Torecs moder, ende hoe hi riddere werd.",142,"Ende cledere ende gout, sonder waen,"
Jacob van Maerlant,"LVIII.  Van Torecs moder, ende hoe hi riddere werd.",143,"Ende enen brief, daer in sal staen"
Jacob van Maerlant,"LVIII.  Van Torecs moder, ende hoe hi riddere werd.",23270,"Hoe al haer saken sijn vergaen,"
Jacob van Maerlant,"LVIII.  Van Torecs moder, ende hoe hi riddere werd.",145,"Hoe si opten boem vonden was,"
Jacob van Maerlant,"LVIII.  Van Torecs moder, ende hoe hi riddere werd.",146,"Ende hose die coninc troude nadas,"
Jacob van Maerlant,"LVIII.  Van Torecs moder, ende hoe hi riddere werd.",147,"Ende hoe di cyrkel werd genomen,"
Jacob van Maerlant,"LVIII.  Van Torecs moder, ende hoe hi riddere werd.",148,"Daer si in onsalecheiden bi es comen,"
Jacob van Maerlant,"LVIII.  Van Torecs moder, ende hoe hi riddere werd.",23275,Ende dat hare Bruant vander Montangen
Jacob van Maerlant,"LVIII.  Van Torecs moder, ende hoe hi riddere werd.",150,Heeft gedaen al dese calangen.
Jacob van Maerlant,"LVIII.  Van Torecs moder, ende hoe hi riddere werd.",151,Dit was metter dochter gedaen
Jacob van Maerlant,"LVIII.  Van Torecs moder, ende hoe hi riddere werd.",152,"In een tonne, ende geworpen saen"
Jacob van Maerlant,"LVIII.  Van Torecs moder, ende hoe hi riddere werd.",153,"In die zee, ende litense varen"
Jacob van Maerlant,"LVIII.  Van Torecs moder, ende hoe hi riddere werd.",23280,Daerse God wilde bewaren.
Jacob van Maerlant,"LVIII.  Van Torecs moder, ende hoe hi riddere werd.",155,Doe quam die tonne gevaren scire
Jacob van Maerlant,"LVIII.  Van Torecs moder, ende hoe hi riddere werd.",156,"Int lant vander Baser rivire,"
Jacob van Maerlant,"LVIII.  Van Torecs moder, ende hoe hi riddere werd.",157,Daer Ydor in coninc doe was.
Jacob van Maerlant,"LVIII.  Van Torecs moder, ende hoe hi riddere werd.",158,"Daer was si opgehaelt nadas,"
Jacob van Maerlant,"LVIII.  Van Torecs moder, ende hoe hi riddere werd.",23285,"Ende vorden coninc bracht daer saen,"
Jacob van Maerlant,"LVIII.  Van Torecs moder, ende hoe hi riddere werd.",160,Dise scire op dede slaen.
Jacob van Maerlant,"LVIII.  Van Torecs moder, ende hoe hi riddere werd.",161,"Daer vant men in een meissekijn,"
Jacob van Maerlant,"LVIII.  Van Torecs moder, ende hoe hi riddere werd.",162,"Dat scoenste dat in die werelt mach sijn,"
Jacob van Maerlant,"LVIII.  Van Torecs moder, ende hoe hi riddere werd.",163,"Ende gout ende selver ende cleder dire,"
Jacob van Maerlant,"LVIII.  Van Torecs moder, ende hoe hi riddere werd.",23290,"Ende enen brief, dien lasmen scire,"
Jacob van Maerlant,"LVIII.  Van Torecs moder, ende hoe hi riddere werd.",165,Daer in gescreven stont algader
Jacob van Maerlant,"LVIII.  Van Torecs moder, ende hoe hi riddere werd.",166,"Wat gesciet was moder ende vader,"
Jacob van Maerlant,"LVIII.  Van Torecs moder, ende hoe hi riddere werd.",167,Ende dat tkint niet kersten ware gedaen:
Jacob van Maerlant,"LVIII.  Van Torecs moder, ende hoe hi riddere werd.",168,Dit dede die brief al verstaen.
Jacob van Maerlant,"LVIII.  Van Torecs moder, ende hoe hi riddere werd.",23295,"Die coninc deet doen kersten daernaer,"
Jacob van Maerlant,"LVIII.  Van Torecs moder, ende hoe hi riddere werd.",170,"Ende deet Tristoise heten vorwaer,"
Jacob van Maerlant,"LVIII.  Van Torecs moder, ende hoe hi riddere werd.",171,Om met rouwen was gedragen.
Jacob van Maerlant,"LVIII.  Van Torecs moder, ende hoe hi riddere werd.",172,Hi deet doen voesteren in dien dagen.
Jacob van Maerlant,"LVIII.  Van Torecs moder, ende hoe hi riddere werd.",173,Doen tkint tsinen dagen quam
Jacob van Maerlant,"LVIII.  Van Torecs moder, ende hoe hi riddere werd.",23300,Entie coninc so overscone vernam
Jacob van Maerlant,"LVIII.  Van Torecs moder, ende hoe hi riddere werd.",175,Wildise nemen tenen wive.
Jacob van Maerlant,"LVIII.  Van Torecs moder, ende hoe hi riddere werd.",176,Wat holpt dat icker vele af scrive?
Jacob van Maerlant,"LVIII.  Van Torecs moder, ende hoe hi riddere werd.",177,Want alle die gene die hem bestaen
Jacob van Maerlant,"LVIII.  Van Torecs moder, ende hoe hi riddere werd.",178,En haddens hem niet doen ave gaen.
Jacob van Maerlant,"LVIII.  Van Torecs moder, ende hoe hi riddere werd.",23305,Hi namsse te wive ende dreef feeste groet:
Jacob van Maerlant,"LVIII.  Van Torecs moder, ende hoe hi riddere werd.",180,Die brullocht was sonder genoet
Jacob van Maerlant,"LVIII.  Van Torecs moder, ende hoe hi riddere werd.",181,"Gedreven viertien nacht al uut,"
Jacob van Maerlant,"LVIII.  Van Torecs moder, ende hoe hi riddere werd.",182,Ende Ydor wan an sine bruut
Jacob van Maerlant,"LVIII.  Van Torecs moder, ende hoe hi riddere werd.",183,"Een knapelijn, hebbic verstaen."
Jacob van Maerlant,"LVIII.  Van Torecs moder, ende hoe hi riddere werd.",23310,"Ende ter selver tijt oec, sonder waen,"
Jacob van Maerlant,"LVIII.  Van Torecs moder, ende hoe hi riddere werd.",185,"Doen die vrouwe daer af genas,"
Jacob van Maerlant,"LVIII.  Van Torecs moder, ende hoe hi riddere werd.",186,"Ende si sach dat een kneplijn was,"
Jacob van Maerlant,"LVIII.  Van Torecs moder, ende hoe hi riddere werd.",187,Loech si sere daer ter steden;
Jacob van Maerlant,"LVIII.  Van Torecs moder, ende hoe hi riddere werd.",188,Ende des hadde grote wonderlijcheden
Jacob van Maerlant,"LVIII.  Van Torecs moder, ende hoe hi riddere werd.",23315,Den genen dise lachgen sagen;
Jacob van Maerlant,"LVIII.  Van Torecs moder, ende hoe hi riddere werd.",190,Want si noit in haren dagen
Jacob van Maerlant,"LVIII.  Van Torecs moder, ende hoe hi riddere werd.",191,Ne loech dan nu ter stont.
Jacob van Maerlant,"LVIII.  Van Torecs moder, ende hoe hi riddere werd.",192,"Dit dedemen daer den coninc cont,"
Jacob van Maerlant,"LVIII.  Van Torecs moder, ende hoe hi riddere werd.",193,"Dies blide was doe hijt heeft vernomen,"
Jacob van Maerlant,"LVIII.  Van Torecs moder, ende hoe hi riddere werd.",23320,"Ende seide: ""Hier sal ons goet af comen;"
Jacob van Maerlant,"LVIII.  Van Torecs moder, ende hoe hi riddere werd.",195,"Ende wet oec wel ende seker sijt,"
Jacob van Maerlant,"LVIII.  Van Torecs moder, ende hoe hi riddere werd.",196,Dat si vortmeer in al haren tijt
Jacob van Maerlant,"LVIII.  Van Torecs moder, ende hoe hi riddere werd.",197,"Maer twewerf noch lachgen sal."""
Jacob van Maerlant,"LVIII.  Van Torecs moder, ende hoe hi riddere werd.",198,Men dede den kinde sine behoefte al
Jacob van Maerlant,"LVIII.  Van Torecs moder, ende hoe hi riddere werd.",23325,"Ende droecht daer ten kerstenhede,"
Jacob van Maerlant,"LVIII.  Van Torecs moder, ende hoe hi riddere werd.",200,"Ende es Torec geheten mede,"
Jacob van Maerlant,"LVIII.  Van Torecs moder, ende hoe hi riddere werd.",201,Want sijn oudervader hiet alsoe.
Jacob van Maerlant,"LVIII.  Van Torecs moder, ende hoe hi riddere werd.",202,"Men gaf hem ene voestere doe,"
Jacob van Maerlant,"LVIII.  Van Torecs moder, ende hoe hi riddere werd.",203,Die tkint wel achterwaren can.
Jacob van Maerlant,"LVIII.  Van Torecs moder, ende hoe hi riddere werd.",23330,Het wies sere ende werd vrome dan.
Jacob van Maerlant,"LVIII.  Van Torecs moder, ende hoe hi riddere werd.",205,Daerna dede hem Ydor leren
Jacob van Maerlant,"LVIII.  Van Torecs moder, ende hoe hi riddere werd.",206,Alrehande spel met groten heren;
Jacob van Maerlant,"LVIII.  Van Torecs moder, ende hoe hi riddere werd.",207,Want en was en gene dinc
Jacob van Maerlant,"LVIII.  Van Torecs moder, ende hoe hi riddere werd.",208,"Daer hi sinen sin toe hinc,"
Jacob van Maerlant,"LVIII.  Van Torecs moder, ende hoe hi riddere werd.",23335,Hine leret bat dan enech man;
Jacob van Maerlant,"LVIII.  Van Torecs moder, ende hoe hi riddere werd.",210,Ende oec was hi di melste daer an
Jacob van Maerlant,"LVIII.  Van Torecs moder, ende hoe hi riddere werd.",211,Diemen enegen wiste tien tiden;
Jacob van Maerlant,"LVIII.  Van Torecs moder, ende hoe hi riddere werd.",212,Ende oec conde hi bat riden
Jacob van Maerlant,"LVIII.  Van Torecs moder, ende hoe hi riddere werd.",213,Dan ieman diemen vinden conde;
Jacob van Maerlant,"LVIII.  Van Torecs moder, ende hoe hi riddere werd.",23340,Ende oec en was nieman ter stonde
Jacob van Maerlant,"LVIII.  Van Torecs moder, ende hoe hi riddere werd.",215,"Soe starc alse Torec, sijt seker das."
Jacob van Maerlant,"LVIII.  Van Torecs moder, ende hoe hi riddere werd.",216,"Ja, doe hi twintech jaer out was"
Jacob van Maerlant,"LVIII.  Van Torecs moder, ende hoe hi riddere werd.",217,Quam hi toten vader gegaen
Jacob van Maerlant,"LVIII.  Van Torecs moder, ende hoe hi riddere werd.",218,"Ende wilde riddere sijn gedaen,"
Jacob van Maerlant,"LVIII.  Van Torecs moder, ende hoe hi riddere werd.",23345,Dattie vader gerne dede.
