author,chapter,line,text
Hein van Aken,DIE ROSE,6910,"Die de dinc spart, hine es niet vroet,"
Hein van Aken,DIE ROSE,6911,"Die nine mindert, wat menre afdoet."
Hein van Aken,DIE ROSE,6912,"Hets alse die kerse in die lanterne,"
Hein van Aken,DIE ROSE,6913,Daermen ane al sonder scerne
Hein van Aken,DIE ROSE,6915,"Dusentich kersen mach ontsteken,"
Hein van Aken,DIE ROSE,6915,Nochtanne salre af niet gebreken
Hein van Aken,DIE ROSE,6916,"Lichts, noch mindren niet dat vier:"
Hein van Aken,DIE ROSE,6917,Vander saken eist aldus hier.
Hein van Aken,DIE ROSE,6918,"Wat ic meine versteet elc man,"
Hein van Aken,DIE ROSE,6920,Die evel ende goet bekinnen can.
Hein van Aken,DIE ROSE,6920,"Hebben desen te doene ondienst,"
Hein van Aken,DIE ROSE,6921,"So dient danne, dat es u tsienst,"
Hein van Aken,DIE ROSE,6922,"Ende doet hem ere, dat es mijn raet,"
Hein van Aken,DIE ROSE,6923,"Ende doet so emmer, dat verstaet,"
Hein van Aken,DIE ROSE,6925,"Dat sijs geware werden niet,"
Hein van Aken,DIE ROSE,6925,Dat gise wilt bedriegen iet;
Hein van Aken,DIE ROSE,6926,"Want selc helst selken openbare,"
Hein van Aken,DIE ROSE,6927,Hi woude dat hi verhangen ware
Hein van Aken,DIE ROSE,6928,An ene galge met sire kelen;
Hein van Aken,DIE ROSE,6930,"Nochtanne gaet hi met hem spelen,"
Hein van Aken,DIE ROSE,6930,"Om te vorderne sinen wille,"
Hein van Aken,DIE ROSE,6931,Dien hi draecht in therte stille.
Hein van Aken,DIE ROSE,6932,"Ende alse gi coemt tien portieren,"
Hein van Aken,DIE ROSE,6933,"Dien seldi hovesscelike antieren,"
Hein van Aken,DIE ROSE,6935,"Ende geven hem scoenheide, alselc alse gi"
Hein van Aken,DIE ROSE,6935,Hier selt horen nomen mi:
Hein van Aken,DIE ROSE,6936,"Rosen hoeden, alle maniere,"
Hein van Aken,DIE ROSE,6937,"Die niet en sijn van coste diere,"
Hein van Aken,DIE ROSE,6938,"Ende siden huvekine van cleinen drade,"
Hein van Aken,DIE ROSE,6940,"Op dat gijs wel hebt die staede,"
Hein van Aken,DIE ROSE,6940,Ocht iet dat hen onfangelic si.
Hein van Aken,DIE ROSE,6941,Ende dan radic u daerbi
Hein van Aken,DIE ROSE,6942,Hen te vertreckene al u leet
Hein van Aken,DIE ROSE,6943,"Ende die pine die u versleet,"
Hein van Aken,DIE ROSE,6945,Ende tdogen dat gi hebt van minnen;
Hein van Aken,DIE ROSE,6945,Ende en condi oec niet gewinnen
Hein van Aken,DIE ROSE,6946,"Gichte, sie en sie u te swaer"
Hein van Aken,DIE ROSE,6947,"Ochte en liggen alsoe naer,"
Hein van Aken,DIE ROSE,6948,So doet gelof groet op die stede:
Hein van Aken,DIE ROSE,6950,Gelof en breect gene lede.
Hein van Aken,DIE ROSE,6950,"Geloeft u, dat wart vergouden,"
Hein van Aken,DIE ROSE,6951,"Ende swert diere, dats al behouden;"
Hein van Aken,DIE ROSE,6952,"Want logene so heeft die maniere,"
Hein van Aken,DIE ROSE,6953,Dat soe wilt sijn gesworen diere;
Hein van Aken,DIE ROSE,6955,"Ende eer gi ongenerent gaet,"
Hein van Aken,DIE ROSE,6955,"So gevet uwe trouwe, dats mijn raet,"
Hein van Aken,DIE ROSE,6956,"Ende bidt hem dat si u geraden,"
Hein van Aken,DIE ROSE,6957,Ende oec mede staen in staden.
Hein van Aken,DIE ROSE,6958,"Weent vol u ogen met heten tranen,"
Hein van Aken,DIE ROSE,6960,Sone salmen gere loesheit wanen;
Hein van Aken,DIE ROSE,6960,"Knielt ende legt te gadre uwe hande,"
Hein van Aken,DIE ROSE,6961,"Bidt ernstenlic, hebs gene scande;"
Hein van Aken,DIE ROSE,6962,"Sucht van herten ende wel gedichte,"
Hein van Aken,DIE ROSE,6963,Ende vaget van tranen u ansichte;
Hein van Aken,DIE ROSE,6965,"Want tranen muruwen, dats wel inscijn,"
Hein van Aken,DIE ROSE,6965,Herten die ontfarmich sijn.
Hein van Aken,DIE ROSE,6966,"En condi oec geweenen niet,"
Hein van Aken,DIE ROSE,6967,"So net uwe ogen, daert niemenne siet,"
Hein van Aken,DIE ROSE,6968,"Met ure spekelen over ancun,"
Hein van Aken,DIE ROSE,6970,"Ochte stoet ontwee enen enguun,"
Hein van Aken,DIE ROSE,6970,Ende metten sape bestrijct u ogen;
Hein van Aken,DIE ROSE,6971,"Gi selt dan wel weenen mogen,"
Hein van Aken,DIE ROSE,6972,Want het doet weenen elken man.
Hein van Aken,DIE ROSE,6973,"Menich truffere diet wel can,"
Hein van Aken,DIE ROSE,6975,"Ende weenen met groten barate,"
Hein van Aken,DIE ROSE,6975,"Ende scinen minnende bi gelate,"
Hein van Aken,DIE ROSE,6976,Die nochtan noit en minden
Hein van Aken,DIE ROSE,6977,"Anders, dan si hier met vinden"
Hein van Aken,DIE ROSE,6978,"Die vrouwen in sachten wille,"
Hein van Aken,DIE ROSE,6980,Die hens ontfarmet lude ende stille.
Hein van Aken,DIE ROSE,6980,"Wisten die vrouwen wat si jagen,"
Hein van Aken,DIE ROSE,6981,Si ontfarmder te genen dagen.
Hein van Aken,DIE ROSE,6982,"Ende es u soe die wech benomen,"
Hein van Aken,DIE ROSE,6983,"Dat gi gaen en dort no comen,"
Hein van Aken,DIE ROSE,6985,"Daer si sijn, no daer no hier,"
Hein van Aken,DIE ROSE,6985,"So moettiere senden enen messagier,"
Hein van Aken,DIE ROSE,6986,"Diet gerne doen om uwe lieve,"
Hein van Aken,DIE ROSE,6987,Of met talen ofte met brieven;
Hein van Aken,DIE ROSE,6988,"Ende scrijft hare, dats u betame;"
Hein van Aken,DIE ROSE,6990,"Maer en set niet uwen name,"
Hein van Aken,DIE ROSE,6990,"Want daer mede es menich bedroghen,"
Hein van Aken,DIE ROSE,6991,Die wel waende wesen in hoghe.
Hein van Aken,DIE ROSE,6992,Hoet u oec dat ghi niet
Hein van Aken,DIE ROSE,6993,Met kinderen doet u ghebiet
Hein van Aken,DIE ROSE,6995,"Want het es der kinder sede,"
Hein van Aken,DIE ROSE,6995,Dat sire gerne spelen mede
Hein van Aken,DIE ROSE,6996,"Met dat si hebben onderhanden,"
Hein van Aken,DIE ROSE,6997,"Ende dat vergaet hem dicwile te scanden,"
Hein van Aken,DIE ROSE,6998,"Alst coemt onder die vrogeren fel,"
Hein van Aken,DIE ROSE,7000,Die altoes en geret niet el
Hein van Aken,DIE ROSE,7000,Dan te breidene der liede onnere;
Hein van Aken,DIE ROSE,7001,Dies geve hem lachter God onse here.
Hein van Aken,DIE ROSE,7002,Dese portieren sijn alle uren
Hein van Aken,DIE ROSE,7003,"So ontfarmich van naturen,"
Hein van Aken,DIE ROSE,7005,"Eest dat si u gichte ontfaen,"
Hein van Aken,DIE ROSE,7005,"So selense u te hulpen staen,"
Hein van Aken,DIE ROSE,7006,Gelike dat die loder maect
Hein van Aken,DIE ROSE,7007,"Den valke, alse hi daes gesmaect,"
Hein van Aken,DIE ROSE,7008,Diene ter hant comen doet.
Hein van Aken,DIE ROSE,7010,Aldusso maect gichte ende goet
Hein van Aken,DIE ROSE,7010,Die portiere van sachten sinne
Hein van Aken,DIE ROSE,7011,Jegen diegene die dragen minne.
Hein van Aken,DIE ROSE,7012,Ende geviele dat gise oec vont
Hein van Aken,DIE ROSE,7013,"So overmoedich talre stont,"
Hein van Aken,DIE ROSE,7015,"Dat gise met gichten noch met beden,"
Hein van Aken,DIE ROSE,7015,"Noch met weenen, noch met geneden,"
Hein van Aken,DIE ROSE,7016,"No met smeken en cont verwinnen,"
Hein van Aken,DIE ROSE,7017,"Hine verstake u in allen zinnen,"
Hein van Aken,DIE ROSE,7018,"Beede met worden ende met daeden,"
Hein van Aken,DIE ROSE,7020,"Keert dan wech ende wacht ure staeden,"
Hein van Aken,DIE ROSE,7020,Ende laetse in paise bliven hier.
Hein van Aken,DIE ROSE,7021,En smalt noit case jegen tfier
Hein van Aken,DIE ROSE,7022,"Alse sere alsi selen doen,"
Hein van Aken,DIE ROSE,7023,"Omdat gi hen sijt ontfloen,"
Hein van Aken,DIE ROSE,7025,Ende u wanen u meer vercrigen.
Hein van Aken,DIE ROSE,7025,Dies moetti een stuc swigen;
Hein van Aken,DIE ROSE,7026,"Want die dorper heeft so behagel een herte,"
Hein van Aken,DIE ROSE,7027,"Diene meest mint, doe hi meest smerte,"
Hein van Aken,DIE ROSE,7028,"Ende die hem meest onderdanich es,"
Hein van Aken,DIE ROSE,7030,"Dien scuwet hi meest, sijt seker des;"
Hein van Aken,DIE ROSE,7030,Mare alse een man geet sire verde
Hein van Aken,DIE ROSE,7031,"Ende bliven laet, sinct sine hoverde,"
Hein van Aken,DIE ROSE,7032,"Ende het dunct hem quaet gedaen,"
Hein van Aken,DIE ROSE,7033,"Dat hine dus heeft laten gaen,"
Hein van Aken,DIE ROSE,7035,Ende sijns te doene en heeft nemmeer;
Hein van Aken,DIE ROSE,7035,Dan prijst hine diene lachterde eer.
Hein van Aken,DIE ROSE,7036,"Dus moetmen soeken menichge manire,"
Hein van Aken,DIE ROSE,7037,"Ende doen gelijc den marniere,"
Hein van Aken,DIE ROSE,7038,Die vart op die welde zee.
Hein van Aken,DIE ROSE,7040,"Ene sterre soect hi ende nemmee,"
Hein van Aken,DIE ROSE,7040,Daer hi mede wille varen.
Hein van Aken,DIE ROSE,7041,"Sijn seil trect hi op te waren,"
Hein van Aken,DIE ROSE,7042,"Ende dorezelt wel menich lant,"
Hein van Aken,DIE ROSE,7043,Beide Potau ende Ingelant.
Hein van Aken,DIE ROSE,7045,"Hine zeilt bi enen winde al niet,"
Hein van Aken,DIE ROSE,7045,Hi strijct tseil als hi storm siet
Hein van Aken,DIE ROSE,7046,Dore den tempeest ende den wint:
Hein van Aken,DIE ROSE,7047,"Dus moet hi doen, die gene die mint,"
Hein van Aken,DIE ROSE,7048,Sal hem van minnen goet gescien;
Hein van Aken,DIE ROSE,7050,Hi moet connen jagen ende vlien.
Hein van Aken,DIE ROSE,7050,"Noch seggic u ene maniere,"
Hein van Aken,DIE ROSE,7051,"Het doet goet bidden desen portiere,"
Hein van Aken,DIE ROSE,7052,Want niet verliest men daermede
Hein van Aken,DIE ROSE,7053,"Dan een man verlore sine bede,"
Hein van Aken,DIE ROSE,7055,Ende sine pine ende sine stonde
Hein van Aken,DIE ROSE,7055,Van dat hise irst minnen begonde.
Hein van Aken,DIE ROSE,7056,"Sidi ontfaen, dat es u genoech,"
Hein van Aken,DIE ROSE,7057,Want so hebbedi al u gevoech;
Hein van Aken,DIE ROSE,7058,"Ende en sidi oec niet ontfaen,"
Hein van Aken,DIE ROSE,7060,"So seldi hovesscelike enwech gaen,"
Hein van Aken,DIE ROSE,7060,Ende engene gramscap togen
Hein van Aken,DIE ROSE,7061,"Noch met maniere, no met ogen;"
Hein van Aken,DIE ROSE,7062,Maer gelaet u blidelike.
Hein van Aken,DIE ROSE,7063,"Nochtanne eist onmogelike,"
Hein van Aken,DIE ROSE,7065,"Datmen u verdriven sal,"
Hein van Aken,DIE ROSE,7065,En doe kinlic ongeval.
Hein van Aken,DIE ROSE,7066,"Hoe erre hen dese portiere gelaten,"
Hein van Aken,DIE ROSE,7067,"Om anesoeken si niemene haeten,"
Hein van Aken,DIE ROSE,7068,"Maer sijns blide ende wel gemeet,"
Hein van Aken,DIE ROSE,7070,"Ende pensen dat met hem wel steet,"
Hein van Aken,DIE ROSE,7070,"Ende datmen hem doet grote ere,"
Hein van Aken,DIE ROSE,7071,Alsmen hen anesoect hare minne sere.
Hein van Aken,DIE ROSE,7072,Men sal den portieren niet
Hein van Aken,DIE ROSE,7073,"Doen verstaen, datmen wilt iet"
Hein van Aken,DIE ROSE,7075,Die Rosen plucken ochte lesen;
Hein van Aken,DIE ROSE,7075,Maer datmen getrouwe sal wesen
Hein van Aken,DIE ROSE,7076,"Beide met herten ende met sinne,"
Hein van Aken,DIE ROSE,7077,Ende els ne geert dan goede minne;
Hein van Aken,DIE ROSE,7078,"Want si hen altoes ontsien,"
Hein van Aken,DIE ROSE,7080,Datmen mach na hare Rose spien.
Hein van Aken,DIE ROSE,7080,"Nochtanne est sonder twifel waer,"
Hein van Aken,DIE ROSE,7081,"Diese wel besoect ende naer,"
Hein van Aken,DIE ROSE,7082,Hi salse vinden goedertieren;
Hein van Aken,DIE ROSE,7083,"Ende si sijn al van dien manieren,"
Hein van Aken,DIE ROSE,7085,"Hoe fier si sijn in hare gelaet,"
Hein van Aken,DIE ROSE,7085,"En sochte mense niet, dat verstaet,"
Hein van Aken,DIE ROSE,7086,Dat sijs selve soeken souden
Hein van Aken,DIE ROSE,7087,"Dies men hem bidt, ende onlange houden,"
Hein van Aken,DIE ROSE,7088,Ende gevens harden goeden coep.
Hein van Aken,DIE ROSE,7090,En ware niet soe nieloep
Hein van Aken,DIE ROSE,7090,"Die haestichge ende die sotte melde,"
Hein van Aken,DIE ROSE,7091,"Hen te gevene van haren gelde,"
Hein van Aken,DIE ROSE,7092,Dar si verdiren met die rosen;
Hein van Aken,DIE ROSE,7093,"Want sire hem selven sere met nosen,"
Hein van Aken,DIE ROSE,7095,"Si soudense hebben al ongecocht,"
Hein van Aken,DIE ROSE,7095,En warense te voren niet besocht;
Hein van Aken,DIE ROSE,7096,"Ende drogense al wel overeen,"
Hein van Aken,DIE ROSE,7097,So dat besokere en ware negeen
Hein van Aken,DIE ROSE,7098,"Van haren Rosen, ende lietense staen,"
Hein van Aken,DIE ROSE,7100,"Tes hare scoenheit ware vergaen,"
Hein van Aken,DIE ROSE,7100,"Ende te valuwene begonsten hare blader,"
Hein van Aken,DIE ROSE,7101,- Maer sine dragen niet te gader:
Hein van Aken,DIE ROSE,7102,Dat es hem ene grote scade! -
Hein van Aken,DIE ROSE,7103,"Si haddent om niet, hilden sijs staede."
Hein van Aken,DIE ROSE,7105,"Sekerlike dat woudic wale,"
Hein van Aken,DIE ROSE,7105,Dat die liede altemale
Hein van Aken,DIE ROSE,7106,"Haren mont hilden ende swegen,"
Hein van Aken,DIE ROSE,7107,"Tote dat si haren tijt gecregen,"
Hein van Aken,DIE ROSE,7108,"Si soudens comen te betren lone,"
Hein van Aken,DIE ROSE,7110,Ende lieten hem hebben hare Rosen scone
Hein van Aken,DIE ROSE,7110,Ende houden den poertieren.
Hein van Aken,DIE ROSE,7111,"Mine dochte noit in gheere manieren,"
Hein van Aken,DIE ROSE,7112,"Dat hi hadde wel mans name,"
Hein van Aken,DIE ROSE,7113,Die comanscap maecte van sinen lichame;
Hein van Aken,DIE ROSE,7115,"Maer daer bi en seggics niet,"
Hein van Aken,DIE ROSE,7115,Dat ic wille dat gi iet
Hein van Aken,DIE ROSE,7116,"Met versoekene beidt so lange,"
Hein van Aken,DIE ROSE,7117,Dat si u daer met ontgange;
Hein van Aken,DIE ROSE,7118,"Maer soect vaste an hare minne,"
Hein van Aken,DIE ROSE,7120,"Recht hare tnette, daersi inne"
Hein van Aken,DIE ROSE,7120,Valle ende blive gevaen.
Hein van Aken,DIE ROSE,7121,"Gi mocht so lange laten staen,"
Hein van Aken,DIE ROSE,7122,Te hare soudenre comen scire
Hein van Aken,DIE ROSE,7123,"Een ocht twee, drie ocht viere,"
Hein van Aken,DIE ROSE,7125,Ja twewerf sestich dosinen
Hein van Aken,DIE ROSE,7125,"In enen jare, wouden sijs pinen,"
Hein van Aken,DIE ROSE,7126,"Ende souden hen keren elre warde,"
Hein van Aken,DIE ROSE,7127,Op datmense te lange sparde.
Hein van Aken,DIE ROSE,7128,Ine rade niet dat so lange een man
Hein van Aken,DIE ROSE,7130,"Beide, dat hem een wijf soket an"
Hein van Aken,DIE ROSE,7130,Sine vrientscap ende sine minne;
Hein van Aken,DIE ROSE,7131,"Want hare dunct in haren sinne,"
Hein van Aken,DIE ROSE,7132,"Datse hem te scone es, getrouwes mi,"
Hein van Aken,DIE ROSE,7133,Hoe lelic ocht hoe swart sie si.
Hein van Aken,DIE ROSE,7135,Daer omme seldi vroech ende spade
Hein van Aken,DIE ROSE,7135,U wachten dat gi spreect bi rade;
Hein van Aken,DIE ROSE,7136,Want hoverdich sijn die vrouwen.
Hein van Aken,DIE ROSE,7137,"Dies radic elken man entrouwen,"
Hein van Aken,DIE ROSE,7138,Dat hi na sinen poente ontbeide
Hein van Aken,DIE ROSE,7140,"Ende staden wachte, dat es vroetheide,"
Hein van Aken,DIE ROSE,7140,Eer gi soect te verre die minne.
Hein van Aken,DIE ROSE,7141,"Al es ene vrouwe fier van sinne,"
Hein van Aken,DIE ROSE,7142,Daer omme en laetse te minne twent;
Hein van Aken,DIE ROSE,7143,"Want tscepman altoes havene vent,"
Hein van Aken,DIE ROSE,7145,Op dat hi heme wiselike keert.
Hein van Aken,DIE ROSE,7145,"Geselle, nu hebbic u geleert,"
Hein van Aken,DIE ROSE,7146,Hoe gi sult varen mettien portieren.
Hein van Aken,DIE ROSE,7147,"Vindise fel ende quadertieren,"
Hein van Aken,DIE ROSE,7148,Dan en seldi hen bidden niet;
Hein van Aken,DIE ROSE,7150,"Maer alse gise in hogen siet,"
Hein van Aken,DIE ROSE,7150,Dan so eist hem bidden goet:
Hein van Aken,DIE ROSE,7151,Dat in droefheiden niet en doet.
Hein van Aken,DIE ROSE,7152,"En ware Droefheit niet geboren,"
Hein van Aken,DIE ROSE,7153,Ver Jalosie hadde selden toren;
Hein van Aken,DIE ROSE,7155,"Maer die vule, quade Droefheide"
Hein van Aken,DIE ROSE,7155,Maecse verwoedt ende erre beide.
Hein van Aken,DIE ROSE,7156,"Vrient, oec so mochti comen"
Hein van Aken,DIE ROSE,7157,"Wel tselken poente, dat u vromen"
Hein van Aken,DIE ROSE,7158,"Soude sere, ic segge u dat,"
Hein van Aken,DIE ROSE,7160,"Vondise in ene heimelike stat,"
Hein van Aken,DIE ROSE,7160,"Daer gi en ducht niemens gaen,"
Hein van Aken,DIE ROSE,7161,Ende verlost ware Suete Onfaen
Hein van Aken,DIE ROSE,7162,Van daer hi om u gevangen leit;
Hein van Aken,DIE ROSE,7163,Ende hi u dan daede hovescheit
Hein van Aken,DIE ROSE,7165,Ende van minnen goet gelaet.
Hein van Aken,DIE ROSE,7165,"Dan pluct die Rosen, daer si staet"
Hein van Aken,DIE ROSE,7166,Op haren stele in dien rosier.
Hein van Aken,DIE ROSE,7167,"Al bolge hem die vilain Dangier,"
Hein van Aken,DIE ROSE,7168,"Ochte Vrese, ochte Scande sone lates niet"
Hein van Aken,DIE ROSE,7170,"Vort te gane, wat uwes gesciet,"
Hein van Aken,DIE ROSE,7170,Opdat si hen blodelike weren;
Hein van Aken,DIE ROSE,7171,"Ende als si verwonnen danne geberen,"
Hein van Aken,DIE ROSE,7172,"Dan mogedi wel werden geware,"
Hein van Aken,DIE ROSE,7173,"Alse Vrese beeft van groten vare,"
Hein van Aken,DIE ROSE,7175,"Ende Scande wart roet ende Dangier weent,"
Hein van Aken,DIE ROSE,7175,Dan moegedi weten watmen meent;
Hein van Aken,DIE ROSE,7176,"Ende al weenden alle drie,"
Hein van Aken,DIE ROSE,7177,"En achtes niet ene quade slie,"
Hein van Aken,DIE ROSE,7178,"Mare hebt vaste in uwe gedachte,"
Hein van Aken,DIE ROSE,7180,Dat gi plucket die Rosen met crachte;
Hein van Aken,DIE ROSE,7180,Ende toent dat gi sijt een man:
Hein van Aken,DIE ROSE,7181,Daer leit al uw vordeel an;
Hein van Aken,DIE ROSE,7182,Want hens dinc dat hen bat haget
Hein van Aken,DIE ROSE,7183,"Danmense tien spele nine verdraget,"
Hein van Aken,DIE ROSE,7185,"Ende men met crachte plucket die Rose,"
Hein van Aken,DIE ROSE,7185,Al weenen si ende maken nose.
Hein van Aken,DIE ROSE,7186,"Si doen gevensede gelaet verstaen,"
Hein van Aken,DIE ROSE,7187,Datment met crachten heft gedaen;
Hein van Aken,DIE ROSE,7188,Nochtan dat sijt bi willen gedogen.
Hein van Aken,DIE ROSE,7190,"Wat si seggen ende togen,"
Hein van Aken,DIE ROSE,7190,Hen ware leet dat si ontgingen
Hein van Aken,DIE ROSE,7191,"Bi enichgen warne, dat si vortbringen;"
Hein van Aken,DIE ROSE,7192,"Ende ontgingense u oec in desen,"
Hein van Aken,DIE ROSE,7193,"Eer die Rose ware gelesen,"
Hein van Aken,DIE ROSE,7195,"Voert meer souden si u haten,"
Hein van Aken,DIE ROSE,7195,Ende niet so na hem comen laten.
Hein van Aken,DIE ROSE,7196,"Sie sijn som al van selken seden,"
Hein van Aken,DIE ROSE,7197,Dat si die dinc die hem gebeden
Hein van Aken,DIE ROSE,7198,"Niet en doen noch toe en comen,"
Hein van Aken,DIE ROSE,7200,En sie hem met crachten genomen;
Hein van Aken,DIE ROSE,7200,"Maer wardi ane die portier geware,"
Hein van Aken,DIE ROSE,7201,Dat si u tonen al openbare
Hein van Aken,DIE ROSE,7202,"Bolgenscap ende grote were,"
Hein van Aken,DIE ROSE,7203,"Ende u spel hebben onmere,"
Hein van Aken,DIE ROSE,7205,"Dan so seldise niet bestaen,"
Hein van Aken,DIE ROSE,7205,Ende selt ontbeiden dat enwech gaen
Hein van Aken,DIE ROSE,7206,"Die III portieren, die u dus nosen,"
Hein van Aken,DIE ROSE,7207,"Die dicwile hoeden vaste hare Rosen,"
Hein van Aken,DIE ROSE,7208,"Ende Suete Onfane hebben gelaten,"
Hein van Aken,DIE ROSE,7210,"Die vaste te voren bi hem saten,"
Hein van Aken,DIE ROSE,7210,Die hem al gevet tuwen doene;
Hein van Aken,DIE ROSE,7211,Dan proeft u vort alse die coene.
Hein van Aken,DIE ROSE,7212,Besiet Suete Onfane dat kint:
Hein van Aken,DIE ROSE,7213,"In wat poente dat gijt vint,"
Hein van Aken,DIE ROSE,7215,"In dien so pijnt u oec te sine,"
Hein van Aken,DIE ROSE,7215,Al sout u geven een deel pine.
Hein van Aken,DIE ROSE,7216,"Es hi blide, sijt blide mede;"
Hein van Aken,DIE ROSE,7217,"Es hi erre, hebbet oec errede."
Hein van Aken,DIE ROSE,7218,Gi moet allen tijt besien
Hein van Aken,DIE ROSE,7220,"Hoe hi hem hout, ende in dien"
Hein van Aken,DIE ROSE,7220,Poente ende in dien gelate
Hein van Aken,DIE ROSE,7221,Seldi u houden: het sal u bate
Hein van Aken,DIE ROSE,7222,Wesen utermaten groet.
Hein van Aken,DIE ROSE,7223,"Es hi blide, weset sijn gnoet;"
Hein van Aken,DIE ROSE,7225,Emmer hout u na sine manieren;
Hein van Aken,DIE ROSE,7225,"Es hi kinchs, gi moettene antieren"
Hein van Aken,DIE ROSE,7226,"Kintcheit oec, dat es mijn raet;"
Hein van Aken,DIE ROSE,7227,"Weent hi ende heeft drove gelaet,"
Hein van Aken,DIE ROSE,7228,"So weent mede, dats wel gedaen:"
Hein van Aken,DIE ROSE,7230,Na sinen sede hout u bevaen.
Hein van Aken,DIE ROSE,7230,"Dien hi mint, dien seldi minnen,"
Hein van Aken,DIE ROSE,7231,Hier bi seldi u lief gewinnen;
Hein van Aken,DIE ROSE,7232,"Dien hi blameert, blameertene mede,"
Hein van Aken,DIE ROSE,7233,Ende hout u vaste na sine sede.
Hein van Aken,DIE ROSE,7235,Waendi dat ene scone vrouwe
Hein van Aken,DIE ROSE,7235,Enen sotten knecht op trouwe
Hein van Aken,DIE ROSE,7236,"Minnen soude van selken gelate,"
Hein van Aken,DIE ROSE,7237,Die nacht ende dach liepe op die strate
Hein van Aken,DIE ROSE,7238,"Dansen, reien ende springen,"
Hein van Aken,DIE ROSE,7240,"Ende lude ropen ende singen,"
Hein van Aken,DIE ROSE,7240,Alse ochte hi uten sinne ware?
Hein van Aken,DIE ROSE,7241,Het soude hare hebben harde onmare;
Hein van Aken,DIE ROSE,7242,"Want si soude ontsien, dat si"
Hein van Aken,DIE ROSE,7243,"Haer ere soude verliesen daerbi,"
Hein van Aken,DIE ROSE,7245,Ende warden te niemaren:
Hein van Aken,DIE ROSE,7245,"Si ware sot, daede sijt tuwaren,"
Hein van Aken,DIE ROSE,7246,Want selke minne sone mach niet
Hein van Aken,DIE ROSE,7247,"Verholen bliven, wats gesciet."
Hein van Aken,DIE ROSE,7248,Soect enich vroet man minne
Hein van Aken,DIE ROSE,7250,"An ene vrouwe dom van sinne,"
Hein van Aken,DIE ROSE,7250,"Ende hi toent dat hi es vroet,"
Hein van Aken,DIE ROSE,7251,"Si en sal herte, sen noch moet"
Hein van Aken,DIE ROSE,7252,"Ane hem keren, wats gesciet,"
Hein van Aken,DIE ROSE,7253,Alse lange alse hi der vroetheit pliet;
Hein van Aken,DIE ROSE,7255,"Mare tone sine seden gelike den haren,"
Hein van Aken,DIE ROSE,7255,Ochte si sal wanen te waren
Hein van Aken,DIE ROSE,7256,"Altoes van hem gehoent wesen,"
Hein van Aken,DIE ROSE,7257,"Ende danne so verstoet si desen,"
Hein van Aken,DIE ROSE,7258,"Ende keer hare ane enen andren man,"
Hein van Aken,DIE ROSE,7260,"Daer si hare nedert an,"
Hein van Aken,DIE ROSE,7260,"Ende steect den getrouwen henen,"
Hein van Aken,DIE ROSE,7261,"Ende houde hare vort anden genen,"
Hein van Aken,DIE ROSE,7262,"Daer si gekeert heeft haren moet,"
Hein van Aken,DIE ROSE,7263,Nochtan dat hi haer en doet
Hein van Aken,DIE ROSE,7265,"Nemmer goet, raste noch ere:"
Hein van Aken,DIE ROSE,7265,Dus kiest si tquaetste van beiden sere.
Hein van Aken,DIE ROSE,7266,"Geselle, ist dat Suete Onfaen"
Hein van Aken,DIE ROSE,7267,"Jegen u wilt enich spel bestaen,"
Hein van Aken,DIE ROSE,7268,"Eist van taflen, ist van scake,"
Hein van Aken,DIE ROSE,7270,"Emmer begaedt also die sake,"
Hein van Aken,DIE ROSE,7270,"Dat hi te boven si int spel,"
Hein van Aken,DIE ROSE,7271,Dat sal hem genogen wel;
Hein van Aken,DIE ROSE,7272,"Ende verliest al dat gi set,"
Hein van Aken,DIE ROSE,7273,"Ende al maect hire sijn sceren met,"
Hein van Aken,DIE ROSE,7275,Dies en seldi achten niet.
Hein van Aken,DIE ROSE,7275,"Prijst al dat gi ane hem siet,"
Hein van Aken,DIE ROSE,7276,"Ende dient hem, dat es wel gedaen."
Hein van Aken,DIE ROSE,7277,"Ende sal hi oec versitten gaen,"
Hein van Aken,DIE ROSE,7278,"So brinct een cussin ocht een cleet,"
Hein van Aken,DIE ROSE,7280,Ende dat legt onder hem gereet.
Hein van Aken,DIE ROSE,7280,"Hinge sijn cleet oec in die moude,"
Hein van Aken,DIE ROSE,7281,Dat heft ute oec alse houde:
Hein van Aken,DIE ROSE,7282,"Het sal hen genogen wale,"
Hein van Aken,DIE ROSE,7283,"Ende dat hem baget, doet altemale;"
Hein van Aken,DIE ROSE,7285,"Ende ontsiet u niet van desen,"
Hein van Aken,DIE ROSE,7285,Dat gi sult verstoten wesen;
Hein van Aken,DIE ROSE,7286,Mar gi sult tuwen vromen
Hein van Aken,DIE ROSE,7287,"Van uwen saken te boven comen."""
Hein van Aken,DIE ROSE,7288,"""Lieve vrient,"" die minnere seide,"
Hein van Aken,DIE ROSE,7290,"""Dits ene gerechte duvelheide,"
Hein van Aken,DIE ROSE,7290,"Dat gi mi hier verstaen doet,"
Hein van Aken,DIE ROSE,7291,Ende dat u dunct wesende goet;
Hein van Aken,DIE ROSE,7292,Ende wilt dat ic lieve ende ere
Hein van Aken,DIE ROSE,7293,"Hem doe, die ic hate so sere,"
Hein van Aken,DIE ROSE,7295,"Ende alle verradere sijn gemene,"
Hein van Aken,DIE ROSE,7295,Sonder Suete Onfaen allene.
Hein van Aken,DIE ROSE,7296,"Es uwe raet aldus gedaen,"
Hein van Aken,DIE ROSE,7297,Dat ic soude dienen ende doen verstaen
Hein van Aken,DIE ROSE,7298,"Hem ere ende doeget ende alle houde,"
Hein van Aken,DIE ROSE,7300,"Daer icse met verraden soude,"
Hein van Aken,DIE ROSE,7300,Verradre soudic wesen dan.
Hein van Aken,DIE ROSE,7301,"Ic wille dengenen, dien ic mesan,"
Hein van Aken,DIE ROSE,7302,"Te voren warnen ende ontseggen,"
Hein van Aken,DIE ROSE,7303,So en machmen lachter leggen
Hein van Aken,DIE ROSE,7305,Op mi in enichgen hove;
Hein van Aken,DIE ROSE,7305,"Ende laet sijn bi uwen orlove,"
Hein van Aken,DIE ROSE,7306,"Dat ic hen ontsegge te voren,"
Hein van Aken,DIE ROSE,7307,Eer ic hen doe enichgen toren;
Hein van Aken,DIE ROSE,7308,Ocht dat ic Quade Tonge daede
Hein van Aken,DIE ROSE,7310,Seggen dat hi mine mesdaede
Hein van Aken,DIE ROSE,7310,Betren wille na mine genoge;
Hein van Aken,DIE ROSE,7311,Ocht rietdijt dat ickene sloge
Hein van Aken,DIE ROSE,7312,"Ende mine wrake selve neme,"
Hein van Aken,DIE ROSE,7313,"Ocht clagen den rechtere over heme?"""
Hein van Aken,DIE ROSE,7315,"""Geselle, geselle, dit soude togen"
Hein van Aken,DIE ROSE,7315,Die gene die sijn vol orlogen.
Hein van Aken,DIE ROSE,7316,Quade Tonge es sere bedect:
Hein van Aken,DIE ROSE,7317,"Ic segge, dien hi smeect ende lect,"
Hein van Aken,DIE ROSE,7318,Dien so sal hi heimelike achter
Hein van Aken,DIE ROSE,7320,Spreken blame ende lachter.
Hein van Aken,DIE ROSE,7320,"Hi es verradere, God moetene scaden,"
Hein van Aken,DIE ROSE,7321,Dies soudemen weder te rechte verraden;
Hein van Aken,DIE ROSE,7322,"Want manne, dat verradere es,"
Hein van Aken,DIE ROSE,7323,"En gelovic niet, sijt seker des,"
Hein van Aken,DIE ROSE,7325,"Want hi haet die liede van binnen,"
Hein van Aken,DIE ROSE,7325,Dies hi buten nine laet kinnen.
Hein van Aken,DIE ROSE,7326,"Al lacht hi ende toent goet gelaet,"
Hein van Aken,DIE ROSE,7327,Hi penst int herte mort ende quaet.
Hein van Aken,DIE ROSE,7328,"Selc man en behagede Gode nie,"
Hein van Aken,DIE ROSE,7330,Want quaet was hi oit ende ie.
Hein van Aken,DIE ROSE,7330,"Hets recht datmen verradre hone,"
Hein van Aken,DIE ROSE,7331,Ende met verradenesse weder lone.
Hein van Aken,DIE ROSE,7332,Niet eerleker en machmen wreken
Hein van Aken,DIE ROSE,7333,Over die gene die quaet spreken;
