author,chapter,line,text
Hein van Aken,DIE ROSE,10753,"Hier vertelt hebbe nu,"
Hein van Aken,DIE ROSE,10755,Machmen bidden sekerlike;
Hein van Aken,DIE ROSE,10755,"Maer anders en eist niet redenlike,"
Hein van Aken,DIE ROSE,10756,"Dat ic u hier hebbe geseit,"
Hein van Aken,DIE ROSE,10757,"Dat een mensche te biddene plegt,"
Hein van Aken,DIE ROSE,10758,Ocht die meester van Sent Omars
Hein van Aken,DIE ROSE,10760,"Loech, ende dede wanen waers"
Hein van Aken,DIE ROSE,10760,"Menegen te Parijs in die stede,"
Hein van Aken,DIE ROSE,10761,"Daer hi las ende predecte mede,"
Hein van Aken,DIE ROSE,10762,Dat grote sonde anders ware
Hein van Aken,DIE ROSE,10763,"Bidden, ende hi hads openbare"
Hein van Aken,DIE ROSE,10765,Met hem leke ende die clerke;
Hein van Aken,DIE ROSE,10765,"Mare mijn vrouwe met haren werke,"
Hein van Aken,DIE ROSE,10766,"Ver Ypocrisie, dede dat,"
Hein van Aken,DIE ROSE,10767,Datmen daer bien uter stat
Hein van Aken,DIE ROSE,10768,"Ende uten rike, omdat hi seide"
Hein van Aken,DIE ROSE,10770,"Ende predecte die waerheide,"
Hein van Aken,DIE ROSE,10770,"Ende niet genadich en was hars,"
Hein van Aken,DIE ROSE,10771,"So wart gebannen die clerc Omars,"
Hein van Aken,DIE ROSE,10772,"Sint hi nouwe boeke maecte,"
Hein van Aken,DIE ROSE,10773,Daer hi in al besaecte
Hein van Aken,DIE ROSE,10775,"Hare leven, ende woude,"
Hein van Aken,DIE ROSE,10775,"Dat ic altoes arbeiten soude,"
Hein van Aken,DIE ROSE,10776,Opdat ic gnoech en ware gegoedt.
Hein van Aken,DIE ROSE,10777,Weende hi dat ic was verwoedt?
Hein van Aken,DIE ROSE,10778,"Nenic! entrouwen ende God,"
Hein van Aken,DIE ROSE,10780,Ine werde nemmer so versot;
Hein van Aken,DIE ROSE,10780,Want werken es ene sware pine.
Hein van Aken,DIE ROSE,10781,"Ic sal buten doen in scine,"
Hein van Aken,DIE ROSE,10782,Dat ic goede werke doe;
Hein van Aken,DIE ROSE,10783,"Maer nemmeer en weerkic soe,"
Hein van Aken,DIE ROSE,10785,Ine sal mine ypocrisien
Hein van Aken,DIE ROSE,10785,"Mantelen wel met reinardien."""
Hein van Aken,DIE ROSE,10786,Die God van Minnen seide doe saen:
Hein van Aken,DIE ROSE,10787,"""Wat duvle doedi ons verstaen?"
Hein van Aken,DIE ROSE,10788,"Grote Valscheit, bi onser Vrouwen,"
Hein van Aken,DIE ROSE,10790,"Geloefdi Goede?"" - ""Neen ic, entrouwen;"
Hein van Aken,DIE ROSE,10790,"Want niemenne en mach, hebbic vernomen,"
Hein van Aken,DIE ROSE,10791,Tenegen groten dingen comen
Hein van Aken,DIE ROSE,10792,"Op erterike, die Goede geloeft,"
Hein van Aken,DIE ROSE,10793,Ende die es altemale verdoeft;
Hein van Aken,DIE ROSE,10795,"Want die goede, die laten varen"
Hein van Aken,DIE ROSE,10795,Alle quaetheit ende metten haren
Hein van Aken,DIE ROSE,10796,"Hen laten genogen met paise,"
Hein van Aken,DIE ROSE,10797,"Die donken mi mesayse,"
Hein van Aken,DIE ROSE,10798,Ende mi wanhaget haer leven;
Hein van Aken,DIE ROSE,10800,"Maer die persemarden, die geven"
Hein van Aken,DIE ROSE,10800,"Moegen die borse vol van penninge,"
Hein van Aken,DIE ROSE,10801,Met hem so houdic wandelinge;
Hein van Aken,DIE ROSE,10802,"Met meyeren, met valsceren, met taverniren,"
Hein van Aken,DIE ROSE,10803,"Die alle quaetheit antieren,"
Hein van Aken,DIE ROSE,10805,"Ende al biden rove leven,"
Hein van Aken,DIE ROSE,10805,"Die hen die arme node geven,"
Hein van Aken,DIE ROSE,10806,Die hen achter straten volgen
Hein van Aken,DIE ROSE,10807,"Ende menich anscijn sien verbolgen,"
Hein van Aken,DIE ROSE,10808,"Ende die si toten tanden plecken,"
Hein van Aken,DIE ROSE,10810,Die ga ic striken ende lecken.
Hein van Aken,DIE ROSE,10810,Bi minen strikenne ende leckenne
Hein van Aken,DIE ROSE,10811,Pijn ic te gadre goet te treckene.
Hein van Aken,DIE ROSE,10812,"Penninge diere hebbic oec gnoech,"
Hein van Aken,DIE ROSE,10813,"Ende dunct mi oec mijn gevoech,"
Hein van Aken,DIE ROSE,10815,"Dat ic wille maken ene nuwe zale,"
Hein van Aken,DIE ROSE,10815,"Om mi daer in taysierne wale,"
Hein van Aken,DIE ROSE,10816,Dat mijn begeren es algader;
Hein van Aken,DIE ROSE,10817,"Want het raed mi mijn vader,"
Hein van Aken,DIE ROSE,10818,"Dat ic aldus leven soude,"
Hein van Aken,DIE ROSE,10820,"Dan comen die lieden, die menechfoude"
Hein van Aken,DIE ROSE,10820,Mi toegeven goede muken:
Hein van Aken,DIE ROSE,10821,Dus winne ic altoes ane mijn smuken;
Hein van Aken,DIE ROSE,10822,"Want ane tbejach sijn mine attenten,"
Hein van Aken,DIE ROSE,10823,Want beter vele dan mijn renten
Hein van Aken,DIE ROSE,10825,"Es mijn bejach, dat weet wale:"
Hein van Aken,DIE ROSE,10825,Want al mijn gaen opentale
Hein van Aken,DIE ROSE,10826,Dats al omdat ic wille winnen.
Hein van Aken,DIE ROSE,10827,"Ic biechte keysere ende keyserrinne,"
Hein van Aken,DIE ROSE,10828,"Coninge, hertogen ende graven,"
Hein van Aken,DIE ROSE,10830,"Ende die rike sijn van haven,"
Hein van Aken,DIE ROSE,10830,Ende mi vollen minen crop;
Hein van Aken,DIE ROSE,10831,Mar in achte twent daer op
Hein van Aken,DIE ROSE,10832,Wat dat doen die arme kaytive:
Hein van Aken,DIE ROSE,10833,"Die wisic al bi minen live,"
Hein van Aken,DIE ROSE,10835,Dat si te haren pape gaen:
Hein van Aken,DIE ROSE,10835,Hare biechte en willic niet verstaen;
Hein van Aken,DIE ROSE,10836,"Want mine baecht niet, dat verstaet,"
Hein van Aken,DIE ROSE,10837,Arme lieden noch hare gelaet.
Hein van Aken,DIE ROSE,10838,"Dese coninge, dese keyserrinnen,"
Hein van Aken,DIE ROSE,10840,"Dese gravinnen, dese hertoginnen,"
Hein van Aken,DIE ROSE,10840,"Dese grote vrouwen, dese prelatessen,"
Hein van Aken,DIE ROSE,10841,"Dese nonnen ende dese abdessen,"
Hein van Aken,DIE ROSE,10842,"Dese vrouwen, dese joncfrouwen,"
Hein van Aken,DIE ROSE,10843,"Ende begginnen, diemen scone mach scouwen,"
Hein van Aken,DIE ROSE,10845,Dese begeric sekerlike
Hein van Aken,DIE ROSE,10845,"Te biechtene, opdat sie sijn rike;"
Hein van Aken,DIE ROSE,10846,Maer om haer ziele Goede te gevene
Hein van Aken,DIE ROSE,10847,"Vragic hem van haren levene,"
Hein van Aken,DIE ROSE,10848,"Den groten heren, hets mijn sede,"
Hein van Aken,DIE ROSE,10850,Ende al haren maisniden mede;
Hein van Aken,DIE ROSE,10850,"Ende swere hem bider crune mijn,"
Hein van Aken,DIE ROSE,10851,Dat alle hare papen beesten sijn
Hein van Aken,DIE ROSE,10852,"Jegen mi ende mine gesellen,"
Hein van Aken,DIE ROSE,10853,"Diere ic hebbe menegen fellen,"
Hein van Aken,DIE ROSE,10855,Ende dien ic der liede heimelicheide
Hein van Aken,DIE ROSE,10855,"Segge, ende sie mi weder meide,"
Hein van Aken,DIE ROSE,10856,"Want ic en hele een twent hem niet,"
Hein van Aken,DIE ROSE,10857,Noch si mi van dies men pliet.
Hein van Aken,DIE ROSE,10858,Omme te toenne hare quaetheit
Hein van Aken,DIE ROSE,10860,Hoert wat die Ewangelie seit
Hein van Aken,DIE ROSE,10860,"Sinte Matheus oppenbaer,"
Hein van Aken,DIE ROSE,10861,"- In XXIII capiteel, dats waer,"
Hein van Aken,DIE ROSE,10862,Daer binnen gescreven steet -
Hein van Aken,DIE ROSE,10863,"Die dus spreect, Godeweet:"
Hein van Aken,DIE ROSE,10865,Op den setel Moyses sal al in een
Hein van Aken,DIE ROSE,10865,"Sitten Scriven ende Phariseen,"
Hein van Aken,DIE ROSE,10866,"Dat sin die quade, die God verdoeme,"
Hein van Aken,DIE ROSE,10867,Dien ic ypocriten nome.
Hein van Aken,DIE ROSE,10868,"Dese seggen tgoede, dat verstaet,"
Hein van Aken,DIE ROSE,10870,Ende werken tselve alle quaet.
Hein van Aken,DIE ROSE,10870,"Werct na dat sie u leren,"
Hein van Aken,DIE ROSE,10871,Ende nemmeer en wilt u keren
Hein van Aken,DIE ROSE,10872,Ane hare werke no an hare daet;
Hein van Aken,DIE ROSE,10873,Want sie sijn vor Gode quaet.
Hein van Aken,DIE ROSE,10875,"Si leggen op u bordenen swaer,"
Hein van Aken,DIE ROSE,10875,Maer selve en doensire niet haer;
Hein van Aken,DIE ROSE,10876,Maer sie hurtens alle wege
Hein van Aken,DIE ROSE,10877,Met haren minsten vingere wege.
Hein van Aken,DIE ROSE,10878,"Sie hoeden hem van goeden werke,"
Hein van Aken,DIE ROSE,10880,En sie daert die lieden merken;
Hein van Aken,DIE ROSE,10880,Ende geen dinc en gerense bat
Hein van Aken,DIE ROSE,10881,Dan tire taflen die irste stat
Hein van Aken,DIE ROSE,10882,Ende in die marc die gruettinge
Hein van Aken,DIE ROSE,10883,"Van den lieden sonderlinge,"
Hein van Aken,DIE ROSE,10885,"Ende dat voren staen in die kerke,"
Hein van Aken,DIE ROSE,10885,"Dat alle sijn des duvels werke,"
Hein van Aken,DIE ROSE,10886,Ende wille meester geheten wesen;
Hein van Aken,DIE ROSE,10887,"Mare, na dien dat wi lesen,"
Hein van Aken,DIE ROSE,10888,Sone souden sijs doen meer no min;
Hein van Aken,DIE ROSE,10890,Want dEwangelie spreect jegen hem.
Hein van Aken,DIE ROSE,10890,"Noch hebben wi enen andren sede,"
Hein van Aken,DIE ROSE,10891,Daer sijn alle gebonden mede;
Hein van Aken,DIE ROSE,10892,"Want so wien wi jegen ons sien,"
Hein van Aken,DIE ROSE,10893,Altemale so haten wi dien
Hein van Aken,DIE ROSE,10895,"Bi accorde ende oec bi rade,"
Hein van Aken,DIE ROSE,10895,"Ende beraden hem altoes scade,"
Hein van Aken,DIE ROSE,10896,"Waer wie moegen, bedectelike."
Hein van Aken,DIE ROSE,10897,Siewi dat hi sal werden rike
Hein van Aken,DIE ROSE,10898,"Met provenden ocht met gichten,"
Hein van Aken,DIE ROSE,10900,"Enen raet gaen wi dan dichten,"
Hein van Aken,DIE ROSE,10900,"Hoe wi weten moegen gereet,"
Hein van Aken,DIE ROSE,10901,"Bi wat trappe dat hi opgeet,"
Hein van Aken,DIE ROSE,10902,Dan lachterwine heimelike
Hein van Aken,DIE ROSE,10903,- So leet waer ons waer hi rike! -
Hein van Aken,DIE ROSE,10905,Emmer ane die hulpe sine;
Hein van Aken,DIE ROSE,10905,"Ende dat doen wi so stillekine,"
Hein van Aken,DIE ROSE,10906,Dat niet en wart geopenbaert.
Hein van Aken,DIE ROSE,10907,Dan valt hi weder nederwart
Hein van Aken,DIE ROSE,10908,"Vanden grade, daer hi op stoet,"
Hein van Aken,DIE ROSE,10910,Ende tumelt weder ondervoet;
Hein van Aken,DIE ROSE,10910,"Mare wisti dat van ons quame,"
Hein van Aken,DIE ROSE,10911,Hi soude lachtren onse name.
Hein van Aken,DIE ROSE,10912,Waert oec dat hem iemenne daeden
Hein van Aken,DIE ROSE,10913,"Vordeel, dat hem quame te staeden,"
Hein van Aken,DIE ROSE,10915,"Van goede, van eren, ende tebaten,"
Hein van Aken,DIE ROSE,10915,"Dan soe souden wi ons gelaten,"
Hein van Aken,DIE ROSE,10916,"Ocht wijt al hadden gedaen,"
Hein van Aken,DIE ROSE,10917,"Ende souden wie hem seggen saen,"
Hein van Aken,DIE ROSE,10918,"Ende andren lieden openbare,"
Hein van Aken,DIE ROSE,10920,"Dat hi bi ons geholpen ware,"
Hein van Aken,DIE ROSE,10920,Om te hebbene der liede prijs.
Hein van Aken,DIE ROSE,10921,Oec pinen wie ons in alre wijs
Hein van Aken,DIE ROSE,10922,"Loselic ane dese heren,"
Hein van Aken,DIE ROSE,10923,"Die vol sijn der werelt eren,"
Hein van Aken,DIE ROSE,10925,Dat si ons hare lettren geven
Hein van Aken,DIE ROSE,10925,"Ende orcontscape, dat ons leven"
Hein van Aken,DIE ROSE,10926,"Goet ende harde helich si,"
Hein van Aken,DIE ROSE,10927,"Waer wi wandelen, na ocht bi;"
Hein van Aken,DIE ROSE,10928,"Ende altoes maken wie ons arm mede,"
Hein van Aken,DIE ROSE,10930,"Mare hoe wi clagen onse lede,"
Hein van Aken,DIE ROSE,10930,"Wie sijn die gene, ine logens niet,"
Hein van Aken,DIE ROSE,10931,Diet al hebben sonder te hebbene iet.
Hein van Aken,DIE ROSE,10932,"Ic warde selc tijt een makelare,"
Hein van Aken,DIE ROSE,10933,"Ende make paixs, ho soet geware;"
Hein van Aken,DIE ROSE,10935,Huwelic vergadert wel bi mi;
Hein van Aken,DIE ROSE,10935,Ic doe oec waers te doene si
Hein van Aken,DIE ROSE,10936,"Executien, hets wel mijn sede,"
Hein van Aken,DIE ROSE,10937,Ende bem oec procurerre mede;
Hein van Aken,DIE ROSE,10938,"Ic bem messagier ende bode,"
Hein van Aken,DIE ROSE,10940,"Dat mi nochtanne mesteet, bi Gode;"
Hein van Aken,DIE ROSE,10940,Want swaer ambocht es ter core
Hein van Aken,DIE ROSE,10941,Te doene anders liede orbore.
Hein van Aken,DIE ROSE,10942,"Ende hebbedi enege sake te doene,"
Hein van Aken,DIE ROSE,10943,"Seggese mi ende sijs dies cone,"
Hein van Aken,DIE ROSE,10945,"Dat si sal comen te goeden inde,"
Hein van Aken,DIE ROSE,10945,"Sint dat ics mi onderwinde,"
Hein van Aken,DIE ROSE,10946,"Ende gi mi hebt dan so gedient,"
Hein van Aken,DIE ROSE,10947,Dat ic wesen mach u vrient.
Hein van Aken,DIE ROSE,10948,"Ine minne niemene nocht en prise,"
Hein van Aken,DIE ROSE,10950,Die mi castijt in eneger wise;
Hein van Aken,DIE ROSE,10950,Ine wille gecastijt niet sijn
Hein van Aken,DIE ROSE,10951,Noch geblameert int herte mijn;
Hein van Aken,DIE ROSE,10952,"Nochtan willict blameren al,"
Hein van Aken,DIE ROSE,10953,Dat ic sie ocht sien sal.
Hein van Aken,DIE ROSE,10955,"Ic wille lachtren dat ic sie,"
Hein van Aken,DIE ROSE,10955,Want mijn sede wast oit ende ie.
Hein van Aken,DIE ROSE,10956,"Ine roke niet der hermitagen,"
Hein van Aken,DIE ROSE,10957,Der woestinen noch diere bosscagen:
Hein van Aken,DIE ROSE,10958,Ic laetse Sinte Jhanne Baptisten;
Hein van Aken,DIE ROSE,10960,Want ic ware vander kisten
Hein van Aken,DIE ROSE,10960,"Te verre, daer die morsele in sijn"
Hein van Aken,DIE ROSE,10961,"Ende oec mede den goeden wijn,"
Hein van Aken,DIE ROSE,10962,"Ende vanden borge ende vanden staeden,"
Hein van Aken,DIE ROSE,10963,Daer ic mi wel in can beraden.
Hein van Aken,DIE ROSE,10965,"Ic make mi daer in ere stede,"
Hein van Aken,DIE ROSE,10965,"Daer ic in hebbe mine heimelichede,"
Hein van Aken,DIE ROSE,10966,"Ende segge daer ic ga achter straten,"
Hein van Aken,DIE ROSE,10967,"Dat ic die werelt hebbe gelaten,"
Hein van Aken,DIE ROSE,10968,"Dat ic leve in ermoeden groet,"
Hein van Aken,DIE ROSE,10970,Dies ic en hebbe engenen noet;
Hein van Aken,DIE ROSE,10970,Want ic mi ligge ende aisiere
Hein van Aken,DIE ROSE,10971,"Met groten rasten bi den viere,"
Hein van Aken,DIE ROSE,10972,Ende bade mine lede in warm water:
Hein van Aken,DIE ROSE,10973,Dus bem ic ayser dan een cater.
Hein van Aken,DIE ROSE,10975,"Ic bem gerechts Ankerts bode,"
Hein van Aken,DIE ROSE,10975,Die verstoten sijn van Gode;
Hein van Aken,DIE ROSE,10976,"Ic bem een van dien dieven,"
Hein van Aken,DIE ROSE,10977,"Daer dEwangelie ave brieven,"
Hein van Aken,DIE ROSE,10978,"Die alse een lam buten geet,"
Hein van Aken,DIE ROSE,10980,Ende binnen es een wolf wreet.
Hein van Aken,DIE ROSE,10980,"Dos gaen wi omme water ende lant,"
Hein van Aken,DIE ROSE,10981,"Ende settent al na onse hant,"
Hein van Aken,DIE ROSE,10982,Waer wi gaen ocht waer wi comen;
Hein van Aken,DIE ROSE,10983,Want ic hebbe orloge genomen
Hein van Aken,DIE ROSE,10985,Jegen die werelt altemale;
Hein van Aken,DIE ROSE,10985,Want ic wilse op entale
Hein van Aken,DIE ROSE,10986,"Berespen van haren dingen,"
Hein van Aken,DIE ROSE,10987,"Ende te mi wart altoes bringen,"
Hein van Aken,DIE ROSE,10988,"Ende die nine keren ane mijn bort,"
Hein van Aken,DIE ROSE,10990,"Van hem seggic altoes vort,"
Hein van Aken,DIE ROSE,10990,Dat buggeren ende cattren sijn;
Hein van Aken,DIE ROSE,10991,"Mar die bort ter geselscap mijn,"
Hein van Aken,DIE ROSE,10992,Dat sijn altoes goede liede;
Hein van Aken,DIE ROSE,10993,Van hem hebbic mine miede:
Hein van Aken,DIE ROSE,10995,"Coptine, plumieren, te minen dele,"
Hein van Aken,DIE ROSE,10995,Ende goede leckere morsele;
Hein van Aken,DIE ROSE,10996,"Conine, hasen ende pertrisen"
Hein van Aken,DIE ROSE,10997,Gevense mi te mire spisen;
Hein van Aken,DIE ROSE,10998,Ende den wensch van goeden wine
Hein van Aken,DIE ROSE,11000,"Bringen si mi altoes, die mine."
Hein van Aken,DIE ROSE,11000,Dese absolveric ende geve pardoen;
Hein van Aken,DIE ROSE,11001,"Want wat quade dat si doen,"
Hein van Aken,DIE ROSE,11002,"Eist rovere, eist dief, eist persemart,"
Hein van Aken,DIE ROSE,11003,Dese hebbic alle lief ende wart.
Hein van Aken,DIE ROSE,11005,"Wat si mesdoen neme ic op mi,"
Hein van Aken,DIE ROSE,11005,Sint ic van hem iet wennende si;
Hein van Aken,DIE ROSE,11006,"Ende wie ons tsins nine wilt geven,"
Hein van Aken,DIE ROSE,11007,"Moegen wi, hi wart verdreven,"
Hein van Aken,DIE ROSE,11008,Ocht wie doene levende bernen;
Hein van Aken,DIE ROSE,11010,"Sine geven ons, wie sullense ernen,"
Hein van Aken,DIE ROSE,11010,"Ochte penitensie setten so swaer,"
Hein van Aken,DIE ROSE,11011,"Dat hem beter ware, vore waer,"
Hein van Aken,DIE ROSE,11012,Dat si ons penitentie gaven
Hein van Aken,DIE ROSE,11013,"Van haeren goede, van haerre haven,"
Hein van Aken,DIE ROSE,11015,Daer wi met haren vrienden bliven;
Hein van Aken,DIE ROSE,11015,Want niemenne en weet tquaet dat wi driven.
Hein van Aken,DIE ROSE,11016,"Maer en daet die grote wachte,"
Hein van Aken,DIE ROSE,11017,Die ons bi dage ende bi nachte
Hein van Aken,DIE ROSE,11018,"Doet die Universiteit,"
Hein van Aken,DIE ROSE,11020,Wie hadden ene andre wet geleit;
Hein van Aken,DIE ROSE,11020,"Want ic segge u seker waer,"
Hein van Aken,DIE ROSE,11021,Dat was in ons Heren jaer
Hein van Aken,DIE ROSE,11022,"M. CC. L ende vive,"
Hein van Aken,DIE ROSE,11023,Gebannen was vanden live
Hein van Aken,DIE ROSE,11025,"Een boec, dat was sere opcomen,"
Hein van Aken,DIE ROSE,11025,En hadde ons dat niet genomen
Hein van Aken,DIE ROSE,11026,"Geweest, dat wet bi mire eren,"
Hein van Aken,DIE ROSE,11027,"Wie hadden geweest die meeste heren,"
Hein van Aken,DIE ROSE,11028,"Die nu in dese werelt sijn,"
Hein van Aken,DIE ROSE,11030,Dat sere dert der herten mijn:
Hein van Aken,DIE ROSE,11030,Dat dUniversiteit van Parijs
Hein van Aken,DIE ROSE,11031,Onse boec benam in alre wijs.
Hein van Aken,DIE ROSE,11032,Wat soudic hieraf vele maken?
Hein van Aken,DIE ROSE,11033,Het worde mi te lange saken.
Hein van Aken,DIE ROSE,11035,"Maer hoert een deel van minen geslachte,"
Hein van Aken,DIE ROSE,11035,"Dat in die werelt es van machte,"
Hein van Aken,DIE ROSE,11036,"Ondancs hebs die Helege Kerke,"
Hein van Aken,DIE ROSE,11037,Daer ic altoes jegen werke.
Hein van Aken,DIE ROSE,11038,Baraet mijn vader blijft keyser ende here
Hein van Aken,DIE ROSE,11040,"Van der werelt emmermere,"
Hein van Aken,DIE ROSE,11040,Ende mijn moeder Ypocrisie
Hein van Aken,DIE ROSE,11041,"Blijft keyserrinne, wats gescie."
Hein van Aken,DIE ROSE,11042,"Wie regneren in elc rike,"
Hein van Aken,DIE ROSE,11043,Alst wel es recht ende mogenlike;
Hein van Aken,DIE ROSE,11045,Wie connen der liede raet ontecken
Hein van Aken,DIE ROSE,11045,"Heimelike, die ane ons trecken."
Hein van Aken,DIE ROSE,11046,"Men hout ons over soe goet,"
Hein van Aken,DIE ROSE,11047,"Dat elc ane ons comen moet,"
Hein van Aken,DIE ROSE,11048,Ende wie castiense van sonden sere;
Hein van Aken,DIE ROSE,11050,Maer wie en geren nemmermere
Hein van Aken,DIE ROSE,11050,Van hen gecastijt te sine:
Hein van Aken,DIE ROSE,11051,Daden sijt dat ware onse pine.
Hein van Aken,DIE ROSE,11052,"Segt, wat lieden soudemen eren"
Hein van Aken,DIE ROSE,11053,"Dan ons, die vore die grote heren"
Hein van Aken,DIE ROSE,11055,Ende vor ons lieden altoes beden?
Hein van Aken,DIE ROSE,11055,"Mare wie sijn van andren seden,"
Hein van Aken,DIE ROSE,11056,Alse wie hem hebben gekeert den rugge:
Hein van Aken,DIE ROSE,11057,Dan siwi talre quaetheit vlugge.
Hein van Aken,DIE ROSE,11058,Welc es meerre verwoedthede
Hein van Aken,DIE ROSE,11060,"Danne tanteerne ridders sede,"
Hein van Aken,DIE ROSE,11060,"Ocht die edele lieden te minnene,"
Hein van Aken,DIE ROSE,11061,Ende daer ane niet te winnene?
Hein van Aken,DIE ROSE,11062,"Ware een man van selken sede,"
Hein van Aken,DIE ROSE,11063,Dat hi hilde vore wardichede
Hein van Aken,DIE ROSE,11065,"Ende sijn gelof al oppenbare,"
Hein van Aken,DIE ROSE,11065,"Ende en twent daer jegen en ware,"
Hein van Aken,DIE ROSE,11066,"Ende altoes scuwede Ypocrisie,"
Hein van Aken,DIE ROSE,11067,Dits volc dat ic vermaledie!
Hein van Aken,DIE ROSE,11068,"Mar desen langen caperoen,"
Hein van Aken,DIE ROSE,11070,"Dese gerunste gebondene scoen,"
Hein van Aken,DIE ROSE,11070,"Dese lange, wide tabbarden,"
Hein van Aken,DIE ROSE,11071,"Dese cappen van graeuwen arden,"
Hein van Aken,DIE ROSE,11072,"Ende lieden van simplen gedanen,"
Hein van Aken,DIE ROSE,11073,"Dese souden die princhen ane hem tanen,"
Hein van Aken,DIE ROSE,11075,Ende geven hem al onderhanden
Hein van Aken,DIE ROSE,11075,"Die orboren van haren landen,"
Hein van Aken,DIE ROSE,11076,"Wart in paise, wart in onvreden,"
Hein van Aken,DIE ROSE,11077,Sie soudent hem in geestelijcheden
Hein van Aken,DIE ROSE,11078,"Berechten, want si hebbes name:"
Hein van Aken,DIE ROSE,11080,Derre est dierre ic mi niet en scame.
Hein van Aken,DIE ROSE,11080,"Twaren, mine roect wat ic doe"
Hein van Aken,DIE ROSE,11081,Om minen wille te bringenne toe.
Hein van Aken,DIE ROSE,11082,"Niet en seggic u daerbi,"
Hein van Aken,DIE ROSE,11083,Dat ic wille dat versmaet si
Hein van Aken,DIE ROSE,11085,"Oetmoedich abijt, diet hout wale;"
Hein van Aken,DIE ROSE,11085,"Maer ic mene anders altemale,"
Hein van Aken,DIE ROSE,11086,"Ende dat lachtert God oec mede,"
Hein van Aken,DIE ROSE,11087,Dat die minsce teneger stede
Hein van Aken,DIE ROSE,11088,"Hem geeft toetmoedichgen abite,"
Hein van Aken,DIE ROSE,11090,"Ende der werelt nine werd quite,"
Hein van Aken,DIE ROSE,11090,Sint hise metten monde begeft.
Hein van Aken,DIE ROSE,11091,"Dese slacht den roden, die heeft"
Hein van Aken,DIE ROSE,11092,"So vele geslonden tenen male,"
Hein van Aken,DIE ROSE,11093,"Dat hijt en can gedragen wale,"
Hein van Aken,DIE ROSE,11095,"Ende moet utespuwen neder,"
Hein van Aken,DIE ROSE,11095,"Ende alse hem hongert, et hijt weder."
Hein van Aken,DIE ROSE,11096,"Here, ine dar u loegen niet;"
Hein van Aken,DIE ROSE,11097,"Mar mochtic gevolen iet,"
Hein van Aken,DIE ROSE,11098,"Dat gijs niet en wort geware,"
Hein van Aken,DIE ROSE,11100,Gine hadt die logene oppenbare
Hein van Aken,DIE ROSE,11100,"In u hant van mi gereet,"
Hein van Aken,DIE ROSE,11101,"Ende u bedriegen, Gode weet,"
Hein van Aken,DIE ROSE,11102,"Dan soudic laten om gene sonden."""
Hein van Aken,DIE ROSE,11103,Die God van Minnen doe begonde
Hein van Aken,DIE ROSE,11105,"Te lachene van groten wondre,"
Hein van Aken,DIE ROSE,11105,"Ende elc so logre om besondre,"
Hein van Aken,DIE ROSE,11106,"Ende seiden: ""Dit es een scone seriant"
Hein van Aken,DIE ROSE,11107,"Om wel te getrouwene in dit lant!"""
Hein van Aken,DIE ROSE,11108,"Die God van Minnen seide: ""Valsch Gelaet,"
Hein van Aken,DIE ROSE,11110,Sint dat gi sint in selken staet
Hein van Aken,DIE ROSE,11110,"In mijn hof, ende hebt gewelt,"
Hein van Aken,DIE ROSE,11111,Dat gi coninc wesen selt
Hein van Aken,DIE ROSE,11112,"Van den Ribauden in mijn hof,"
Hein van Aken,DIE ROSE,11113,Seldi mi houden mijn gelof?
Hein van Aken,DIE ROSE,11115,"- ""Jaic, ende swere u, wat ic mach,"
Hein van Aken,DIE ROSE,11115,Dat uwen vader noit dien dach
Hein van Aken,DIE ROSE,11116,"Getrouwer en was te gere stede,"
Hein van Aken,DIE ROSE,11117,"Noch oec uwen oudervader meede."""
Hein van Aken,DIE ROSE,11118,"- ""Hoe! het es jegen u nature."""
Hein van Aken,DIE ROSE,11120,"""Set u jegen die avonture,"
Hein van Aken,DIE ROSE,11120,"Want sochtijs borghe, wel besiet,"
Hein van Aken,DIE ROSE,11121,Sone waerdijs twent te sekerre niet.
Hein van Aken,DIE ROSE,11122,"Al gavics lettren ende pande,"
Hein van Aken,DIE ROSE,11123,Ic appeleret in selken lande
Hein van Aken,DIE ROSE,11125,"Met orcontscape, dat weet wel,"
Hein van Aken,DIE ROSE,11125,"Vor selken rechtre, dat hi te fel"
Hein van Aken,DIE ROSE,11126,Laten soude met ongemake
Hein van Aken,DIE ROSE,11127,Ende verliesen soude al sine sake.
Hein van Aken,DIE ROSE,11128,"Waendi, dat ic nine can liegen"
Hein van Aken,DIE ROSE,11130,Ende die liede wel bedriegen
Hein van Aken,DIE ROSE,11130,"Onder tsimpele cledre, die ic drage,"
Hein van Aken,DIE ROSE,11131,Daer ic ondre alle dage
Hein van Aken,DIE ROSE,11132,"Werke mort, dat verstaet?"
Hein van Aken,DIE ROSE,11133,"Al es simpel mijn gelaet,"
Hein van Aken,DIE ROSE,11135,Van quaet te doene en werdic sat;
Hein van Aken,DIE ROSE,11135,"Want mire amien es te bat,"
Hein van Aken,DIE ROSE,11136,Ende heves dicke groten noet.
Hein van Aken,DIE ROSE,11137,"Sie ware lange van hongere doet,"
Hein van Aken,DIE ROSE,11138,Hadde sijt allene moeten herden:
Hein van Aken,DIE ROSE,11140,"Lates mi ende hare gewerden."""
Hein van Aken,DIE ROSE,11140,"Die God van Minnen seide, ""Dat si!"""
Hein van Aken,DIE ROSE,11141,"Ende mettien so knielde hi,"
Hein van Aken,DIE ROSE,11142,"Ende dankede hem utermaten sere,"
Hein van Aken,DIE ROSE,11143,Alse sinen God ende sinen here.
Hein van Aken,DIE ROSE,11145,"""Nu nes niet el dan ons gereiden"
Hein van Aken,DIE ROSE,11145,"Tien asaute al sonder beiden,"""
Hein van Aken,DIE ROSE,11146,So sprac die God van Minnen.
Hein van Aken,DIE ROSE,11147,Doe gingen si hem wapenen in allen sinnen;
Hein van Aken,DIE ROSE,11148,"Ende alsi alle gewapent waren,"
Hein van Aken,DIE ROSE,11150,"Doe gingen si hare lieden scaren,"
Hein van Aken,DIE ROSE,11150,"Ende ordeneerden hem in vieren,"
Hein van Aken,DIE ROSE,11151,Om dat si wouden assaelgieren
Hein van Aken,DIE ROSE,11152,Die viere porten ende winnen;
Hein van Aken,DIE ROSE,11153,"Maer die gene, diere waren binnen,"
Hein van Aken,DIE ROSE,11155,Sine waren trage no lat
Hein van Aken,DIE ROSE,11155,Omme te hoedene wel hare stat.
Hein van Aken,DIE ROSE,11156,Nu willic u seggen sonder gilen
Hein van Aken,DIE ROSE,11157,"Van Valsch Gelaet ende sire amien,"
Hein van Aken,DIE ROSE,11158,"Alse ic int Walsche hebbe gelesen,"
Hein van Aken,DIE ROSE,11160,Soe heten si Bedect Wesen.
Hein van Aken,DIE ROSE,11160,Jegen Quade Tonge dat si quamen.
Hein van Aken,DIE ROSE,11161,"Onder hem beiden si raet namen,"
Hein van Aken,DIE ROSE,11162,"In wat manieren si gaen wouden,"
Hein van Aken,DIE ROSE,11163,Ende ocht si hem kennen laten souden.
Hein van Aken,DIE ROSE,11165,Doe vonden si in haren raet
Hein van Aken,DIE ROSE,11165,"Over tbeste, dat verstaet,"
Hein van Aken,DIE ROSE,11166,Alse pelegrime te gane.
Hein van Aken,DIE ROSE,11167,Gevenst Wesen dede doe ane
Hein van Aken,DIE ROSE,11168,Graeuwe cledre alse ene beggine;
Hein van Aken,DIE ROSE,11170,"Si gerde in hare abijt te sine,"
Hein van Aken,DIE ROSE,11170,"Ende want hare met gecrouwen doken,"
Hein van Aken,DIE ROSE,11171,Daer si onder wel conste loken.
Hein van Aken,DIE ROSE,11172,Enen ommedoec hinc si om hare;
Hein van Aken,DIE ROSE,11173,Si sceen beginne doe openbare.
Hein van Aken,DIE ROSE,11175,"Haren soutre en vergat si niet,"
Hein van Aken,DIE ROSE,11175,"Daer si dickent binnen siet,"
