author,chapter,line,text
Hein van Aken,DIE ROSE,3471,"Sone willics engeensens niet,"
Hein van Aken,DIE ROSE,3472,"Wat pinen mi daerna gesciet."""
Hein van Aken,DIE ROSE,3473,"""Vrient,"" seide daerna Suete Ontfaen,"
Hein van Aken,DIE ROSE,3474,"Sekerleke ic sout doen saen,"
Hein van Aken,DIE ROSE,3475,"En duchtic Reinicheiden niet,"
Hein van Aken,DIE ROSE,3476,Dat sijs hare soude belgen iet;
Hein van Aken,DIE ROSE,3477,Anders soude ict u node wernen.
Hein van Aken,DIE ROSE,3478,"Si soude mi scelden ende bescernen,"
Hein van Aken,DIE ROSE,3479,"Mesdadic een twent jegen hare,"
Hein van Aken,DIE ROSE,3480,Daer ic node jegen ware;
Hein van Aken,DIE ROSE,3481,"Want altoes verbiedt so mi,"
Hein van Aken,DIE ROSE,3482,"Dat minnare engeen ne si,"
Hein van Aken,DIE ROSE,3483,"Dat ic een cussen hem orlove,"
Hein van Aken,DIE ROSE,3484,Want hi coemter met te hone.
Hein van Aken,DIE ROSE,3485,"Diemen een vriendelec cussen geft,"
Hein van Aken,DIE ROSE,3486,Dat scoenste hi vander proien heft;
Hein van Aken,DIE ROSE,3487,Want van dien dat daer es bleven
Hein van Aken,DIE ROSE,3488,So heft men hem weder afgegeven;
Hein van Aken,DIE ROSE,3489,"Want die een cussen mach gecrigen,"
Hein van Aken,DIE ROSE,3490,Selden so macht daer met bliven.
Hein van Aken,DIE ROSE,3491,Doe ickene horde dus antworden
Hein van Aken,DIE ROSE,3492,"En dorsticne meer aneverden,"
Hein van Aken,DIE ROSE,3493,Dies ickene erre mochte maken.
Hein van Aken,DIE ROSE,3494,Men sal te vele van ere saken
Hein van Aken,DIE ROSE,3495,"Enen man niet bringen vort,"
Hein van Aken,DIE ROSE,3496,"Daer hi mede mach sijn gestort,"
Hein van Aken,DIE ROSE,3497,"Noch vele bidden jegen wille,"
Hein van Aken,DIE ROSE,3498,Hier bi so swegics stille
Hein van Aken,DIE ROSE,3499,"Ende pensede in mi selven wale,"
Hein van Aken,DIE ROSE,3500,Dat dies boem ten irsten male
Hein van Aken,DIE ROSE,3501,"Niet en valt alsemen sleet,"
Hein van Aken,DIE ROSE,3502,Noch oec die wijn niet en geet
Hein van Aken,DIE ROSE,3503,"Al uten druven, hi en si"
Hein van Aken,DIE ROSE,3504,"Al ute geperst, geloves mi."
Hein van Aken,DIE ROSE,3505,Alte lange hadde gemert
Hein van Aken,DIE ROSE,3506,"Dat cussen ende van mi gevert,"
Hein van Aken,DIE ROSE,3507,"Dat ic begerde, en hadde gedaen"
Hein van Aken,DIE ROSE,3508,"Venus die vrouwe wel gedaen,"
Hein van Aken,DIE ROSE,3509,"Die Gods moeder van Minnen,"
Hein van Aken,DIE ROSE,3510,Die orloget in allen sinnen
Hein van Aken,DIE ROSE,3511,"Reinicheiden, om hulpe te sine"
Hein van Aken,DIE ROSE,3512,Die van minnen dragen pine.
Hein van Aken,DIE ROSE,3513,Dese vrouwe hilt in hare hant
Hein van Aken,DIE ROSE,3514,"Al blakende enen groten brant,"
Hein van Aken,DIE ROSE,3515,Daer si menichge vrouwe mede
Hein van Aken,DIE ROSE,3516,Ontstac ende ontfuncken dede.
Hein van Aken,DIE ROSE,3517,Si was behagel ende jolijs;
Hein van Aken,DIE ROSE,3518,Si sceen wel in alre wijs
Hein van Aken,DIE ROSE,3519,Ene goddinne van hogen doene;
Hein van Aken,DIE ROSE,3520,Sine was niet van religione
Hein van Aken,DIE ROSE,3521,Alse ene nonne ocht ene beggine.
Hein van Aken,DIE ROSE,3522,Wat soudic maken grote pine
Hein van Aken,DIE ROSE,3523,"Van haren rekeliken gewaden,"
Hein van Aken,DIE ROSE,3524,"Beide van perlen ende van goutdraden,"
Hein van Aken,DIE ROSE,3525,Ende van broken ochte van riemen.
Hein van Aken,DIE ROSE,3526,Henne gebrachte te hovede niemen
Hein van Aken,DIE ROSE,3527,"Hoe cuichs, ho scone dat si was;"
Hein van Aken,DIE ROSE,3528,"Ende in hare, geloeft mi das,"
Hein van Aken,DIE ROSE,3529,En was hovarde niet een twint.
Hein van Aken,DIE ROSE,3530,Si sprac ane Suete Onfane dat kint
Hein van Aken,DIE ROSE,3531,"Ende seide: ""Lieve, nu segt mi,"
Hein van Aken,DIE ROSE,3532,Dore wat saken ende waerbi
Hein van Aken,DIE ROSE,3533,"Sidi den minnare also wreet,"
Hein van Aken,DIE ROSE,3534,Die hem aldus dore u versleet
Hein van Aken,DIE ROSE,3535,Om een cussen te gewinne?
Hein van Aken,DIE ROSE,3536,"Hi es werdich wel te minne,"
Hein van Aken,DIE ROSE,3537,"Hi en es no valsch noch loes,"
Hein van Aken,DIE ROSE,3538,Maer getrouwe uwer minnen altoes
Hein van Aken,DIE ROSE,3539,Ende gereet al tuwen gebode.
Hein van Aken,DIE ROSE,3540,"Hem ne soude niet sijn, bi Gode!"
Hein van Aken,DIE ROSE,3541,Een vriendelec cussen wedersegt.
Hein van Aken,DIE ROSE,3542,Siet die scoenheit die ane hem legt;
Hein van Aken,DIE ROSE,3543,Hi es wel wert dat menne minne.
Hein van Aken,DIE ROSE,3544,En es vrouwe no borgravinne
Hein van Aken,DIE ROSE,3545,"So hoge, sine mochte wel met eren"
Hein van Aken,DIE ROSE,3546,Al hare herte ane hem keren.
Hein van Aken,DIE ROSE,3547,"Hijs kinchs ende jonc van dagen,"
Hein van Aken,DIE ROSE,3548,Datter mi ane best dunct bagen.
Hein van Aken,DIE ROSE,3549,"Het dochte mi grote dorperheide,"
Hein van Aken,DIE ROSE,3550,Datmen hem een cussen ontseide;
Hein van Aken,DIE ROSE,3551,Want hets ane heme wel bestaedt.
Hein van Aken,DIE ROSE,3552,"Sijn mont recht te cussene gaedt,"
Hein van Aken,DIE ROSE,3553,"Hi heft den adem suete ende rene,"
Hein van Aken,DIE ROSE,3554,"Sine tanden wit ende clene,"
Hein van Aken,DIE ROSE,3555,"Effene staene ende even groet,"
Hein van Aken,DIE ROSE,3556,Sine lippe suete ende roet.
Hein van Aken,DIE ROSE,3557,Het dunct mi wale bestaedt dat hi
Hein van Aken,DIE ROSE,3558,Een cussen hebbe dat vriendelic si.
Hein van Aken,DIE ROSE,3559,"Gevet hem, hets wel mijn raet:"
Hein van Aken,DIE ROSE,3560,"Te lange tonbeidene dats quaet,"
Hein van Aken,DIE ROSE,3561,"Dies gi den tijt verliest te meer,"
Hein van Aken,DIE ROSE,3562,"Dies gi vercovert nemmermeer."""
Hein van Aken,DIE ROSE,3563,"Suete Ontfaen, die den brant"
Hein van Aken,DIE ROSE,3564,"Van Venuse heft gevoelt thant,"
Hein van Aken,DIE ROSE,3565,"Georlovede mi een cussen daer,"
Hein van Aken,DIE ROSE,3566,"Dat ic staphans, wet vorwaer,"
Hein van Aken,DIE ROSE,3567,Sonder langer beiden nam.
Hein van Aken,DIE ROSE,3568,"Dieus! hoe wel dat mi bequam,"
Hein van Aken,DIE ROSE,3569,Dat mijn mont die rose gereen.
Hein van Aken,DIE ROSE,3570,Nu ne darf ic wanen ure negeen
Hein van Aken,DIE ROSE,3571,Ochtic joie doe hadde tier stede.
Hein van Aken,DIE ROSE,3572,Ene roke ginc uter rosen mede.
Hein van Aken,DIE ROSE,3573,Die mi int herte binnen vloech
Hein van Aken,DIE ROSE,3574,"Ende minen rouwe al uut daer toech,"
Hein van Aken,DIE ROSE,3575,"Ende minderde al mijn seer,"
Hein van Aken,DIE ROSE,3576,Dat ic droech te voren eer.
Hein van Aken,DIE ROSE,3577,"Danc hebbe tcussen van sueter smake,"
Hein van Aken,DIE ROSE,3578,Dat mi dus dede te gemake;
Hein van Aken,DIE ROSE,3579,"Ende dat saet, dat goelec roec,"
Hein van Aken,DIE ROSE,3580,"Was dat mi therte ontloec,"
Hein van Aken,DIE ROSE,3581,Ende deder vrede ende pais in wonen;
Hein van Aken,DIE ROSE,3582,"Aldus can minne bi uren lonen,"
Hein van Aken,DIE ROSE,3583,"Nochtan mijn herte dicke leet,"
Hein van Aken,DIE ROSE,3584,"Sint icse roec, wel menich leet."
Hein van Aken,DIE ROSE,3585,Die zee en es nemmer twent
Hein van Aken,DIE ROSE,3586,"So wel in paise, een cleine went"
Hein van Aken,DIE ROSE,3587,En doetse verstormen harde saen:
Hein van Aken,DIE ROSE,3588,Aldus es die minne gedaen.
Hein van Aken,DIE ROSE,3589,"Si heft tsuete metten suren,"
Hein van Aken,DIE ROSE,3590,Si en mach in enen poente niet duren.
Hein van Aken,DIE ROSE,3591,Vort eest recht dat ic gewage
Hein van Aken,DIE ROSE,3592,"Mijn vernoi ende mine clage,"
Hein van Aken,DIE ROSE,3593,"Hoe ic te Scanden wart verdreven,"
Hein van Aken,DIE ROSE,3594,"Ende hoe die borch wart opgegeven,"
Hein van Aken,DIE ROSE,3595,"Ende die starke mure mede,"
Hein van Aken,DIE ROSE,3596,Die sint die Minne vallen dede.
Hein van Aken,DIE ROSE,3597,Distorie willic al bescriven
Hein van Aken,DIE ROSE,3598,Ende niet achter en laten bliven.
Hein van Aken,DIE ROSE,3599,"En hadde Venus dasaut begonnen,"
Hein van Aken,DIE ROSE,3600,Die borch sine ware niet gewonnen.
Hein van Aken,DIE ROSE,3601,"Quade Tongen, die altoes spiet"
Hein van Aken,DIE ROSE,3602,Na die minnen ende voresiet
Hein van Aken,DIE ROSE,3603,"Al tquade, dat hi gepensen mach,"
Hein van Aken,DIE ROSE,3604,Hi hadde gesien op enen dach
Hein van Aken,DIE ROSE,3605,"Dat goede gelaet, dat mi dede"
Hein van Aken,DIE ROSE,3606,"Suete Onfaen up hovesscede,"
Hein van Aken,DIE ROSE,3607,Dies hi geswigen niet ne conste
Hein van Aken,DIE ROSE,3608,"Hier ende gender, hine begonste"
Hein van Aken,DIE ROSE,3609,Te clappene utermaten sere
Hein van Aken,DIE ROSE,3610,"Ende seide, hi sette lijf ende ere"
Hein van Aken,DIE ROSE,3611,"Ende sijn hoeft oec af te slane,"
Hein van Aken,DIE ROSE,3612,Dat tusscen mi ende Suete Onfane
Hein van Aken,DIE ROSE,3613,Dorperleke vrientscap ware.
Hein van Aken,DIE ROSE,3614,"Des maecte hi so groten mare,"
Hein van Aken,DIE ROSE,3615,"Dat hire mede wecte Jalosien,"
Hein van Aken,DIE ROSE,3616,"Die Suete Onfane ginc castien,"
Hein van Aken,DIE ROSE,3617,"Ende seide: ""Vuel onreine knecht,"
Hein van Aken,DIE ROSE,3618,Hoe hebbedi u selven dus berecht?
Hein van Aken,DIE ROSE,3619,"Qualec so hebbic u geleert,"
Hein van Aken,DIE ROSE,3620,Dat gi u selven dus onteert:
Hein van Aken,DIE ROSE,3621,In wille mi meer in u betrouwen.
Hein van Aken,DIE ROSE,3622,Ic sal u leggen daert u sal rouwen;
Hein van Aken,DIE ROSE,3623,"Gine selt mi, wanic, meer ontgaen."
Hein van Aken,DIE ROSE,3624,"Scande es te verre van u gegaen,"
Hein van Aken,DIE ROSE,3625,Die u soude wachten ende hoeden;
Hein van Aken,DIE ROSE,3626,"Ende Reineit, diet al wale vervroeden"
Hein van Aken,DIE ROSE,3627,"Soude, heft laten comen hier"
Hein van Aken,DIE ROSE,3628,Enen knecht in dit vergier
Hein van Aken,DIE ROSE,3629,Om ons beiden scande te doene:
Hein van Aken,DIE ROSE,3630,"Dies, hu was si noit so coene!"""
Hein van Aken,DIE ROSE,3631,"Suete Onfaen en sprac noit wart,"
Hein van Aken,DIE ROSE,3632,No sere so was si vervart.
Hein van Aken,DIE ROSE,3633,"Doe ic horde die grote nose,"
Hein van Aken,DIE ROSE,3634,Vloe ic en wech ende liet die rose.
Hein van Aken,DIE ROSE,3635,"Omdat ic duchte tperlement,"
Hein van Aken,DIE ROSE,3636,En dorstic langer letten twent.
Hein van Aken,DIE ROSE,3637,"Scande was doe vort getogen,"
Hein van Aken,DIE ROSE,3638,Die sere ontsach dat si hadde mogen
Hein van Aken,DIE ROSE,3639,Iet mesdoen in enegen wille.
Hein van Aken,DIE ROSE,3640,"So was gewonden met enen wile,"
Hein van Aken,DIE ROSE,3641,Gelijc ene helichge nonne draeget.
Hein van Aken,DIE ROSE,3642,Si sprac alse die was versaget:
Hein van Aken,DIE ROSE,3643,"""Vrouwe, dore God, wats u gesciet?"
Hein van Aken,DIE ROSE,3644,"En geloeft Quaden Tongen niet,"
Hein van Aken,DIE ROSE,3645,"Want hi harde gerne lieget,"
Hein van Aken,DIE ROSE,3646,Daer hi menegen met bedrieget.
Hein van Aken,DIE ROSE,3647,"Al seit hi quaet van Suetonfane,"
Hein van Aken,DIE ROSE,3648,Hine es niet dirste na minen wane;
Hein van Aken,DIE ROSE,3649,"Want Quade Tonge es so geleert,"
Hein van Aken,DIE ROSE,3650,Dat hi heren ende vrouwen ondert
Hein van Aken,DIE ROSE,3651,"Ende belieget harde gerne,"
Hein van Aken,DIE ROSE,3652,Daer hi mede drijft te scerne
Hein van Aken,DIE ROSE,3653,Menichgen man ende doet verdriet.
Hein van Aken,DIE ROSE,3654,"Swijcht,"" seit hi, ""en es logene niet:"
Hein van Aken,DIE ROSE,3655,Suete Onfaen hadde al te lanc
Hein van Aken,DIE ROSE,3656,"Sijn lancvedere, daer hi met swanc,"
Hein van Aken,DIE ROSE,3657,Datmen hem gedogede te gane
Hein van Aken,DIE ROSE,3658,"Met selken lieden ende die tonfane,"
Hein van Aken,DIE ROSE,3659,Dier hi niet en hadde te doene.
Hein van Aken,DIE ROSE,3660,"Ine houdene niet over so coene,"
Hein van Aken,DIE ROSE,3661,"Dat hi dorperheit hadde gedaen,"
Hein van Aken,DIE ROSE,3662,"Hovesscheit dedene hem ontfaen,"
Hein van Aken,DIE ROSE,3663,"Die sijn moeder es tuwaren,"
Hein van Aken,DIE ROSE,3664,Die hem leerde al sonder sparen
Hein van Aken,DIE ROSE,3665,"Lachen, spelen met allen lieden."
Hein van Aken,DIE ROSE,3666,Men mochte mi daer toe niet gemieden.
Hein van Aken,DIE ROSE,3667,Dat ict langer soude gedogen.
Hein van Aken,DIE ROSE,3668,Ic sal wachten ende nauwe pogen
Hein van Aken,DIE ROSE,3669,Bat te hoedene Suete Onfane
Hein van Aken,DIE ROSE,3670,Van te verre van mi te gane;
Hein van Aken,DIE ROSE,3671,"- Scande, Scande,"" seide Jalosie,"
Hein van Aken,DIE ROSE,3672,"""Ic bem die mi sere ontsie,"
Hein van Aken,DIE ROSE,3673,"Dat ic verraden wesen mach,"
Hein van Aken,DIE ROSE,3674,Want Leckerheide nacht ende dach
Hein van Aken,DIE ROSE,3675,Ende Luxurie si regneren
Hein van Aken,DIE ROSE,3676,"Nu in die werelt ende sijn heren,"
Hein van Aken,DIE ROSE,3677,Beide in cloestre ende in abdien;
Hein van Aken,DIE ROSE,3678,"Want daer en es geen castien,"
Hein van Aken,DIE ROSE,3679,Dat Reinicheit daer seker si.
Hein van Aken,DIE ROSE,3680,"Daer omme willics wachten mi,"
Hein van Aken,DIE ROSE,3681,Ende dien wech doen al verslaen
Hein van Aken,DIE ROSE,3682,"Die gene diere comen ende gaen,"
Hein van Aken,DIE ROSE,3683,Die el ne jagen ende spien
Hein van Aken,DIE ROSE,3684,"Dan om stelen, mocht hem gescien,"
Hein van Aken,DIE ROSE,3685,"Mine rosen, die ic ommuren sal"
Hein van Aken,DIE ROSE,3686,"Ende so besluten overal,"
Hein van Aken,DIE ROSE,3687,Datse die quade knechte en selen
Hein van Aken,DIE ROSE,3688,"No gewinnen noch gestelen,"
Hein van Aken,DIE ROSE,3689,Noch vercrigen met genen saken.
Hein van Aken,DIE ROSE,3690,In midden tplain sal ic doen maken
Hein van Aken,DIE ROSE,3691,"Enen tor vaste ende goet,"
Hein van Aken,DIE ROSE,3692,Daer ic Suete Ontfaen in moet
Hein van Aken,DIE ROSE,3693,"Houden also vaste gevaen,"
Hein van Aken,DIE ROSE,3694,Dat hi mi niet en sal ontgaen
Hein van Aken,DIE ROSE,3695,Ende den quaden knechten volgen.
Hein van Aken,DIE ROSE,3696,"Hi heft mi so sere verbolgen,"
Hein van Aken,DIE ROSE,3697,"Dat hijt wel diere sal becopen,"
Hein van Aken,DIE ROSE,3698,"Beide sijn rennen ende sijn lopen."""
Hein van Aken,DIE ROSE,3699,Vrese so quam metten warde
Hein van Aken,DIE ROSE,3700,Bevende alse die hare vervaerde;
Hein van Aken,DIE ROSE,3701,Doe si horde scelden Jalosien
Hein van Aken,DIE ROSE,3702,"Ende felle spreken ende castien,"
Hein van Aken,DIE ROSE,3703,Sine dorste antwerden niet.
Hein van Aken,DIE ROSE,3704,Jalosie ginc wech ende liet
Hein van Aken,DIE ROSE,3705,Vrese ende Scande al beide
Hein van Aken,DIE ROSE,3706,"In al te groter sericheide,"
Hein van Aken,DIE ROSE,3707,Dies si horde hare ongevoech.
Hein van Aken,DIE ROSE,3708,"Vrese, diet thoeft nedersloech,"
Hein van Aken,DIE ROSE,3709,"Seide: ""Scande, nichte, ic hebs toren,"
Hein van Aken,DIE ROSE,3710,Dat wi nose moeten horen
Hein van Aken,DIE ROSE,3711,Van dien dies wi en mogen twent.
Hein van Aken,DIE ROSE,3712,Wie hebben leden ongescent
Hein van Aken,DIE ROSE,3713,Menichgen Mey met eren groet:
Hein van Aken,DIE ROSE,3714,Nu doet ons leven in groter noet
Hein van Aken,DIE ROSE,3715,"Jalosie, die ons mesloeft."
Hein van Aken,DIE ROSE,3716,"Ic wane Dangier es verdoeft,"
Hein van Aken,DIE ROSE,3717,"Dat hi so qualec hoedt die rosen,"
Hein van Aken,DIE ROSE,3718,Datter afcomen alselke nosen.
Hein van Aken,DIE ROSE,3719,"Gawi te hem, hets wel gedaen,"
Hein van Aken,DIE ROSE,3720,"Ende seggen heme ende doen verstaen,"
Hein van Aken,DIE ROSE,3721,"Dat hi bat die rosen hoede."""
Hein van Aken,DIE ROSE,3722,Doe gingen si beide met erren moede
Hein van Aken,DIE ROSE,3723,"Tote Dangiere, daer hi was"
Hein van Aken,DIE ROSE,3724,"Gelegen in dat groene gras,"
Hein van Aken,DIE ROSE,3725,Ende was ontswimelt van groten vake.
Hein van Aken,DIE ROSE,3726,"Scande, diene met ongemake"
Hein van Aken,DIE ROSE,3727,"Wecte ende versprectene sere,"
Hein van Aken,DIE ROSE,3728,"Soe seide: ""In sleeds duvels ere,"
Hein van Aken,DIE ROSE,3729,"Here dorpre, moetti slapen nu?"
Hein van Aken,DIE ROSE,3730,Wie soude hem getrouwen tu
Hein van Aken,DIE ROSE,3731,Te hoedene rosen ochte pottone?
Hein van Aken,DIE ROSE,3732,Hets qualec van uwen doene!
Hein van Aken,DIE ROSE,3733,"Wie sijn beide up u herde erre,"
Hein van Aken,DIE ROSE,3734,"Dangier, dat gi hebt so verre"
Hein van Aken,DIE ROSE,3735,Laten gebruken Suete Onfane
Hein van Aken,DIE ROSE,3736,"Sijns willen, daer leget u lachter ane."
Hein van Aken,DIE ROSE,3737,"Siedi vervart, wats u gesciet?"
Hein van Aken,DIE ROSE,3738,"Henne behort tuwer name niet,"
Hein van Aken,DIE ROSE,3739,"Dat gi sijn sout goedertiere,"
Hein van Aken,DIE ROSE,3740,Maer fel ende quaet ende putertiere.
Hein van Aken,DIE ROSE,3741,"Staet op ende vermaect uwe hage,"
Hein van Aken,DIE ROSE,3742,So dat meer engene clage
Hein van Aken,DIE ROSE,3743,Over ons en come; nu op ter vart!
Hein van Aken,DIE ROSE,3744,"Want dorper, die nine es groniart"
Hein van Aken,DIE ROSE,3745,"Ende die hovesch wille wesen,"
Hein van Aken,DIE ROSE,3746,"Hi staerfter af, hine mach genesen."
Hein van Aken,DIE ROSE,3747,Sijt suer ende fel sonder verdragen
Hein van Aken,DIE ROSE,3748,Wildi u doen wel behagen
Hein van Aken,DIE ROSE,3749,"Den lieden ende hem dienen gerne,"
Hein van Aken,DIE ROSE,3750,Gi werter met gedreven te scerne;
Hein van Aken,DIE ROSE,3751,Na uwen art seldi u houden.
Hein van Aken,DIE ROSE,3752,"Jalosie heft ons bescouden,"
Hein van Aken,DIE ROSE,3753,"Daer wi af sijn sere versaget,"
Hein van Aken,DIE ROSE,3754,"Ende Suete Onfane wech gejaget,"
Hein van Aken,DIE ROSE,3755,Ende swert hi salne doen vermuren
Hein van Aken,DIE ROSE,3756,Ende hem sijn leven maken te suren:
Hein van Aken,DIE ROSE,3757,Dat es bi ure traecheit al;
Hein van Aken,DIE ROSE,3758,"Dat u God geve ongeval!"""
Hein van Aken,DIE ROSE,3759,Doe stoet up die felle groniart
Hein van Aken,DIE ROSE,3760,"Alse een die sere was vervart,"
Hein van Aken,DIE ROSE,3761,"Dies hi hem dus scelden hoert,"
Hein van Aken,DIE ROSE,3762,"Ende wart erre ende sere testoert,"
Hein van Aken,DIE ROSE,3763,"Ende scorste nese ende mont,"
Hein van Aken,DIE ROSE,3764,Ende swoer sere tier selver stont
Hein van Aken,DIE ROSE,3765,"Ende seide: so moesti verwoeden,"
Hein van Aken,DIE ROSE,3766,Hine soude den rosier so wel hoeden
Hein van Aken,DIE ROSE,3767,Datter man en sette meer voet:
Hein van Aken,DIE ROSE,3768,"Des gaens, des comens sal nu sijn boet."
Hein van Aken,DIE ROSE,3769,Hi nam sine colve in sine hant
Hein van Aken,DIE ROSE,3770,"Ende stoppede die gate, die hi vant"
Hein van Aken,DIE ROSE,3771,Overal in dat rosier.
Hein van Aken,DIE ROSE,3772,Nu ist sere verwandelt hier
Hein van Aken,DIE ROSE,3773,Met Dangiere dien vilain.
Hein van Aken,DIE ROSE,3774,"Weet God, ine sal nu meer int plain"
Hein van Aken,DIE ROSE,3775,Meer dorren comen daer ic sie
Hein van Aken,DIE ROSE,3776,"Die rose, die mi doet so wee."
Hein van Aken,DIE ROSE,3777,"Die Dangier erde, heft mi doet"
Hein van Aken,DIE ROSE,3778,Ende bracht in pinen harde groet.
Hein van Aken,DIE ROSE,3779,Alsic pense dat ic ne mach
Hein van Aken,DIE ROSE,3780,"Die rose, die ic te siene plach,"
Hein van Aken,DIE ROSE,3781,"Nemmerme sien, mi doet so wee!"
Hein van Aken,DIE ROSE,3782,"Therte, mi dunct, si breect ontwee,"
Hein van Aken,DIE ROSE,3783,"Alsic om dat cussen peise,"
Hein van Aken,DIE ROSE,3784,"Dat wesen dede mi so eyse,"
Hein van Aken,DIE ROSE,3785,Dat sueter was dan enege sake.
Hein van Aken,DIE ROSE,3786,Hoe mochte mi therte te gemake
Hein van Aken,DIE ROSE,3787,"Wesen, dat ic dus verren moet"
Hein van Aken,DIE ROSE,3788,"Der rosen, die mi therte bloet"
Hein van Aken,DIE ROSE,3789,Met suetheiden heft dorevlogen;
Hein van Aken,DIE ROSE,3790,Hoe salic geduren mogen?
Hein van Aken,DIE ROSE,3791,Mi ware beter vele die doet
Hein van Aken,DIE ROSE,3792,Dan te levene in selker noet!
Hein van Aken,DIE ROSE,3793,Nu sal mi weder sonder vieren
Hein van Aken,DIE ROSE,3794,Beven ende suchten assaelgieren
Hein van Aken,DIE ROSE,3795,"Ende ander vele swaer gepens,"
Hein van Aken,DIE ROSE,3796,"Vele te groet sal sijn die tsens,"
Hein van Aken,DIE ROSE,3797,Die nemen sal van mi die Minne:
Hein van Aken,DIE ROSE,3798,"Dat ic dier rosen suetheit kinne,"
Hein van Aken,DIE ROSE,3799,"Alse vele es mine begerte te meer,"
Hein van Aken,DIE ROSE,3800,Ende mine herte ontsteecse teer.
Hein van Aken,DIE ROSE,3801,"Weet God, nu bem ic terre stont"
Hein van Aken,DIE ROSE,3802,Gevallen inder hellen gront.
Hein van Aken,DIE ROSE,3803,"Quade Tonge moete sijn onteert,"
Hein van Aken,DIE ROSE,3804,Die mi aldus heeft geonneert;
Hein van Aken,DIE ROSE,3805,God late hem sijn leven rouwen:
Hein van Aken,DIE ROSE,3806,"Hi heeft mi al dese sause gebrouwen!"""
Hein van Aken,DIE ROSE,3807,Nu eist tijt dat ic u moet
Hein van Aken,DIE ROSE,3808,"Seggen wat Jalosie doet,"
Hein van Aken,DIE ROSE,3809,Die in therte heeft dogen groet
Hein van Aken,DIE ROSE,3810,In allen landen si onboet
Hein van Aken,DIE ROSE,3811,"Wercliede, ende dede ene veste"
Hein van Aken,DIE ROSE,3812,"Maken, die alre scoenste ende die beste"
Hein van Aken,DIE ROSE,3813,"Die noit wart gesien met ogen,"
Hein van Aken,DIE ROSE,3814,"Alomme dien rosier betogen,"
Hein van Aken,DIE ROSE,3815,Ende op dien veste enen muer.
Hein van Aken,DIE ROSE,3816,"Het soude mi werden alte suer,"
Hein van Aken,DIE ROSE,3817,Soudic volprisen die tornele
Hein van Aken,DIE ROSE,3818,Die daer stoeden ende die cantele.
Hein van Aken,DIE ROSE,3819,Die muer hi was harde wale
Hein van Aken,DIE ROSE,3820,Viercante gemaect alte male:
Hein van Aken,DIE ROSE,3821,"In elke side ene porte so stoet,"
Hein van Aken,DIE ROSE,3822,"Geordijst vaste ende goet,"
Hein van Aken,DIE ROSE,3823,"Ende oec voren ende achter ene,"
Hein van Aken,DIE ROSE,3824,Wel gewracht van vasten stenen;
Hein van Aken,DIE ROSE,3825,Vor elke porte mede uut te gane
Hein van Aken,DIE ROSE,3826,Ene valbrugge ende ene barbekane.
Hein van Aken,DIE ROSE,3827,In midden tplain dede Jalosie
Hein van Aken,DIE ROSE,3828,Enen torre op meesterrie
Hein van Aken,DIE ROSE,3829,"Maken, bi compasse al ront,"
Hein van Aken,DIE ROSE,3830,Daer menichge scone garite an stont.
Hein van Aken,DIE ROSE,3831,"Hi was so vast ende so hoge,"
Hein van Aken,DIE ROSE,3832,Men haddene niet met orloge
Hein van Aken,DIE ROSE,3833,Noch met crachte mogen winnen:
Hein van Aken,DIE ROSE,3834,So vast was hi in allen sinnen.
Hein van Aken,DIE ROSE,3835,Tusscen den torre ende dat vorboech
Hein van Aken,DIE ROSE,3836,So stoet geplant na sijn gevoech
Hein van Aken,DIE ROSE,3837,"Dat rosier meniger rosen,"
Hein van Aken,DIE ROSE,3838,Die Quade Tonge met sire nosen
Hein van Aken,DIE ROSE,3839,Aldus vaste dede besluten
Hein van Aken,DIE ROSE,3840,Jegen diegene daer van buten.
Hein van Aken,DIE ROSE,3841,Daer waren binnen dien castele
Hein van Aken,DIE ROSE,3842,"Beide bliden ende oec magnele,"
Hein van Aken,DIE ROSE,3843,Diemen van buten wel mochte kinnen.
Hein van Aken,DIE ROSE,3844,Daer lagen scuttren tallen tinnen
Hein van Aken,DIE ROSE,3845,Met aremborsten harde goet.
Hein van Aken,DIE ROSE,3846,"Buten der veste een ander muer stoet,"
Hein van Aken,DIE ROSE,3847,"Nederre gemaect, om grote were"
Hein van Aken,DIE ROSE,3848,"Te doene, quame daer enich here,"
Hein van Aken,DIE ROSE,3849,Datmen ter vesten nine mochte riden
Hein van Aken,DIE ROSE,3850,Sonder vechten ende striden.
Hein van Aken,DIE ROSE,3851,Ver Jalosie die vrouwe vroede
Hein van Aken,DIE ROSE,3852,"Heft inden tor geleit hoede,"
Hein van Aken,DIE ROSE,3853,Want dirste porte so hoedde hier
Hein van Aken,DIE ROSE,3854,"Die felle dorpre, here Dangier,"
Hein van Aken,DIE ROSE,3855,Die ten oestenen staet gekeert.
Hein van Aken,DIE ROSE,3856,"XXX seriante, wel geleert,"
Hein van Aken,DIE ROSE,3857,Heft hi in sire hulpen daer.
Hein van Aken,DIE ROSE,3858,"Dandre porte hoedde daer naer,"
Hein van Aken,DIE ROSE,3859,"Die middage wart stoet,"
Hein van Aken,DIE ROSE,3860,"Scande, die node mesdoet,"
Hein van Aken,DIE ROSE,3861,"Met menegen ontsienden man,"
Hein van Aken,DIE ROSE,3862,Die ten wapinen wale can
Hein van Aken,DIE ROSE,3863,Ende gereet te haren dienste waren;
Hein van Aken,DIE ROSE,3864,Ende Vrese hoedde met haren scaren
Hein van Aken,DIE ROSE,3865,Die porte die stoet ter slinker siden;
Hein van Aken,DIE ROSE,3866,Vrese diene was in genen tiden
Hein van Aken,DIE ROSE,3867,"Seker, si en sloet haer dore"
Hein van Aken,DIE ROSE,3868,Ende starke hameide leidde sire vore.
Hein van Aken,DIE ROSE,3869,Hare porte si gaet selden op.
Hein van Aken,DIE ROSE,3870,"Alsi van den winde hort geclop,"
Hein van Aken,DIE ROSE,3871,"Ocht geclap van enichen tongen,"
Hein van Aken,DIE ROSE,3872,Dan es si haestelike ontsprongen.
Hein van Aken,DIE ROSE,3873,"Quade Tonge, die God verdome,"
Hein van Aken,DIE ROSE,3874,"Dat ickene hier so dicke nome,"
Hein van Aken,DIE ROSE,3875,Hi hadde met hem vele quadien
Hein van Aken,DIE ROSE,3876,"Sariante al ute Normandien,"
Hein van Aken,DIE ROSE,3877,Ende hoedde die porte van troes.
Hein van Aken,DIE ROSE,3878,Quade Tonge plach altoes
Hein van Aken,DIE ROSE,3879,"Toten andren porten te gane,"
Hein van Aken,DIE ROSE,3880,Om te versiene ente verstane
Hein van Aken,DIE ROSE,3881,"Hoe si besetten hare saken,"
Hein van Aken,DIE ROSE,3882,Ende wire tsnachts soude waken.
Hein van Aken,DIE ROSE,3883,Daerna ginc hi te cantelen
Hein van Aken,DIE ROSE,3884,"Met gescutte ende met quarelen,"
Hein van Aken,DIE ROSE,3885,Die hi orbarde in die wachte;
Hein van Aken,DIE ROSE,3886,Want hi waecte alle nachte
Hein van Aken,DIE ROSE,3887,Ende trompte ende blies te tinnen.
Hein van Aken,DIE ROSE,3888,"Hi horde buten ende binnen,"
Hein van Aken,DIE ROSE,3889,"Hi blies stiven, die dat songen,"
Hein van Aken,DIE ROSE,3890,Dat noit wijf ongedwongen
Hein van Aken,DIE ROSE,3891,Gerecht en was no reine van live
Hein van Aken,DIE ROSE,3892,"Hets ene nature in die wive,"
Hein van Aken,DIE ROSE,3893,Dat si horen harde gerne
Hein van Aken,DIE ROSE,3894,Lekernie ende lodderscerne;
Hein van Aken,DIE ROSE,3895,Die sijn puten ende amien
Hein van Aken,DIE ROSE,3896,Ende vol van dorpernien;
Hein van Aken,DIE ROSE,3897,Sie en achten op hare ere twent.
Hein van Aken,DIE ROSE,3898,"Siet hoet dese haer selven scent,"
Hein van Aken,DIE ROSE,3899,Ende dese andre hoe si haer anscijn
Hein van Aken,DIE ROSE,3900,"Bestrijct, om dat si scone wil sijn."
Hein van Aken,DIE ROSE,3901,"Quade Tonge, die nine spart,"
Hein van Aken,DIE ROSE,3902,Vint emmer te seggene van lieden quaet.
