author,chapter,line,text
Augustijnken,De schepping.,1,"O Heilige Gheest, Vader ende Sone,"
Augustijnken,De schepping.,2,"Die een God es in drien persone,"
Augustijnken,De schepping.,3,"Een ewech wesen, dat tuucht mijn sin,"
Augustijnken,De schepping.,4,"Voir al die werelt een beghin,"
Augustijnken,De schepping.,5,Doen dijn woert hier neder quam:
Augustijnken,De schepping.,6,Faciamus hominem ad ymaginem et similitudinem nostram.
Augustijnken,De schepping.,7,Sprac sijn woert wael minnelijc:
Augustijnken,De schepping.,8,"""Maken wi den minsche ons ghelijc."""
Augustijnken,De schepping.,9,"Doen hi Adame maken soude,"
Augustijnken,De schepping.,10,Dat was teken datti woude
Augustijnken,De schepping.,11,Maken in der menscheit
Augustijnken,De schepping.,12,Een beelde der drivoldicheit.
Augustijnken,De schepping.,13,Doen maecte hi Adame meer no min
Augustijnken,De schepping.,14,"Siele, lichame ende sin."
Augustijnken,De schepping.,15,"Die ziele was met sinen lichame,"
Augustijnken,De schepping.,16,Sijn lijf was met der zielen name.
Augustijnken,De schepping.,17,"Die sin en was gheen van beiden,"
Augustijnken,De schepping.,18,Elc was een ende onghesceiden;
Augustijnken,De schepping.,19,Want in dese drieheit
Augustijnken,De schepping.,20,En was maer een minscheit.
Augustijnken,De schepping.,21,"Haddic gheen ziele ic waer beest,"
Augustijnken,De schepping.,22,"Haddic gheen lijf ic ware gheest,"
Augustijnken,De schepping.,23,"Haddic gheen sin soe waer ic wonder,"
Augustijnken,De schepping.,24,Dus sijnre drie ende gheen besonder;
Augustijnken,De schepping.,25,Want waer een van drien ghebrake
Augustijnken,De schepping.,26,Waer twifel minscheliker sake;
Augustijnken,De schepping.,27,"Dus es ziele, sin ende lichame,"
Augustijnken,De schepping.,28,"Drie in eens minschen name,"
Augustijnken,De schepping.,29,"Als Heileghe Gheest, Vader en Sone,"
Augustijnken,De schepping.,30,Een God es in drie persone.
Augustijnken,De schepping.,31,Nu heeft God ghenomen lijf
Augustijnken,De schepping.,32,"Aen een maghet, die oec es wijf."
Augustijnken,De schepping.,33,Si es maghet in der reinicheit;
Augustijnken,De schepping.,34,Want nie en dacht si dorperheit.
Augustijnken,De schepping.,35,"Si es oec wijf als men vint,"
Augustijnken,De schepping.,36,"Want God sprac: ""Wijf, sich dijn kint."""
Augustijnken,De schepping.,37,"Si hadde oec weduwen name verworven,"
Augustijnken,De schepping.,38,Doen Joseph was haer man ghestorven;
Augustijnken,De schepping.,39,Dus es si weduwe na mannes doet.
Augustijnken,De schepping.,40,"Si was wijf gaende met vruchten groet,"
Augustijnken,De schepping.,41,"Si es maghet, want sy nie ghedede,"
Augustijnken,De schepping.,42,Noch en gedachte dorperhede.
Augustijnken,De schepping.,43,"O wedue, maghet ende wijf,"
Augustijnken,De schepping.,44,Drie namen in eens wijfs lijf.
Augustijnken,De schepping.,45,"O Heileghen Gheest, Vader ende Sone,"
Augustijnken,De schepping.,46,"Die een God es in drien persone,"
Augustijnken,De schepping.,47,"Hulpe ons ziele, sin ende lichame"
Augustijnken,De schepping.,48,Te regneren in dijnre name.
Augustijnken,De schepping.,49,Uut deser werder triniteit
Augustijnken,De schepping.,50,"Een edel boem ghewortelt steit,"
Augustijnken,De schepping.,51,"Dat es dat godlike woert,"
Augustijnken,De schepping.,52,"Daer bi al vrucht es comen voert,"
Augustijnken,De schepping.,53,"Met bloemen .VII. werven seven,"
Augustijnken,De schepping.,54,"Die ons sijn in exempel bleven,"
Augustijnken,De schepping.,55,Als die scrifturen ons ghewagen;
Augustijnken,De schepping.,56,Sijn telcken dat sijn seven daghen:
Augustijnken,De schepping.,57,"Maendach, Dijnsdach, Woensdach,"
Augustijnken,De schepping.,58,"Donredach, Vrijdach, Saterdach,"
Augustijnken,De schepping.,59,Ende den Sondach ic meine.
Augustijnken,De schepping.,60,In desen seven daghen reine
Augustijnken,De schepping.,61,"Sciep God dat Firmament,"
Augustijnken,De schepping.,62,"Sterren, planeten ende 't element,"
Augustijnken,De schepping.,63,"Ende water dat minscheit daer toebehoert,"
Augustijnken,De schepping.,64,Formeerde daer in sijn godlike woert.
Augustijnken,De schepping.,65,In elken daghe maect hi ons blide;
Augustijnken,De schepping.,66,Elken daghe gaf hi ons .VII. tide;
Augustijnken,De schepping.,67,"Mette, prime, tercie, sexte, noen,"
Augustijnken,De schepping.,68,"Vesperen, completen; dit woudi doen"
Augustijnken,De schepping.,69,Voer des minschen salicheit.
Augustijnken,De schepping.,70,Den .VII. tiden heeft hi ons bereit
Augustijnken,De schepping.,71,.VII. heileghe sacrament.
Augustijnken,De schepping.,72,Den sacramenten heeft hi ghesent
Augustijnken,De schepping.,73,".VII. gaven des Heileghen Gheest,"
Augustijnken,De schepping.,74,"Met .VII. werken, soe men leest,"
Augustijnken,De schepping.,75,Van ontfermherticheit;
Augustijnken,De schepping.,76,Lof hebbe die werde triniteit.
Augustijnken,De schepping.,77,Nu heeft God ghemaect scone
Augustijnken,De schepping.,78,.VII. hemel onder den trone;
Augustijnken,De schepping.,79,"Ende sulke sijn cristal,"
Augustijnken,De schepping.,80,Als astrologien tughen wale.
Augustijnken,De schepping.,81,"Onder die hemel, ic versta,"
Augustijnken,De schepping.,82,Sijn roerende .VII. sphera;
Augustijnken,De schepping.,83,In die sphera doe ic weten
Augustijnken,De schepping.,84,Sijn ghestalt die .VII. planeten:
Augustijnken,De schepping.,85,"Sol, luna, mars, marcurius,"
Augustijnken,De schepping.,86,"Saturnus, jupiter, venus."
Augustijnken,De schepping.,87,Die .VII. planeten met riker onsten
Augustijnken,De schepping.,88,Heeft God vervult met .VII. consten:
Augustijnken,De schepping.,89,"Retorica, astrologia, philosophia,"
Augustijnken,De schepping.,90,"Aritmetica, musica, logica, geometria."
Augustijnken,De schepping.,91,"Dit sijn die .VII. consten tsaert,"
Augustijnken,De schepping.,92,"Met .VII. planeten gheopenbaert,"
Augustijnken,De schepping.,93,"Lopende in .VII. sphera,"
Augustijnken,De schepping.,94,"Die onder .VII. hemelen ga,"
Augustijnken,De schepping.,95,"Al volmaect in .VII. daghen,"
Augustijnken,De schepping.,96,"Die ons .VII. tiden draghen,"
Augustijnken,De schepping.,97,"Met .VII. heileghe sacrament,"
Augustijnken,De schepping.,98,Daer God selve in heeft bekent
Augustijnken,De schepping.,99,"Seven gaven des Heileghen Gheest,"
Augustijnken,De schepping.,100,"Met .VII. werken, aldus eest,"
Augustijnken,De schepping.,101,Van ontfermherticheit;
Augustijnken,De schepping.,102,Lof hebbe die werde triniteit.
Augustijnken,De schepping.,103,Noch wanic dat daer ghescreven is
Augustijnken,De schepping.,104,"In Johannes boec Apocalipsis,"
Augustijnken,De schepping.,105,Doen hi in Phatmos was ghesint
Augustijnken,De schepping.,106,"Bi Domicianus es ons bekint,"
Augustijnken,De schepping.,107,Daer sach hi in den trone
Augustijnken,De schepping.,108,.VII. kerken met visioene.
Augustijnken,De schepping.,109,Bi den kerken wert hi gheware
Augustijnken,De schepping.,110,Eenen gulden kandelare;
Augustijnken,De schepping.,111,Bi den candelaren hi sach
Augustijnken,De schepping.,112,Seven zeghel op dien dach
Augustijnken,De schepping.,113,"In enen scilt, also men las,"
Augustijnken,De schepping.,114,Die bina driecante was.
Augustijnken,De schepping.,115,"Dese driewerf .VII. willic leeren,"
Augustijnken,De schepping.,116,"Papen, leeken exponeren;"
Augustijnken,De schepping.,117,Want icse niet hebbe ghehoert
Augustijnken,De schepping.,118,In sermonen brenghen voert.
Augustijnken,De schepping.,119,"Soe willic dan Austijnkijn,"
Augustijnken,De schepping.,120,Exponeren met worden mijn
Augustijnken,De schepping.,121,"Op dat mi God der eren an,"
Augustijnken,De schepping.,122,"Want ic anders niet en can,"
Augustijnken,De schepping.,123,Ende niement yet van consten heeft
Augustijnken,De schepping.,124,Ten si oft God van gracien gheeft.
Augustijnken,De schepping.,125,Die seven kerken willic noemen:
Augustijnken,De schepping.,126,Dierste es een paus volcomen;
Augustijnken,De schepping.,127,Want God selve sprac alleen:
Augustijnken,De schepping.,128,"""Petrus, Petrus, du best een steen,"
Augustijnken,De schepping.,129,"Daer ic op fundere mine kerke!"""
Augustijnken,De schepping.,130,"'t Fondament van goeden werke,"
Augustijnken,De schepping.,131,Dat es gherecht Oetmoedicheit;
Augustijnken,De schepping.,132,Want God selve heeft gheseit:
Augustijnken,De schepping.,133,Wie veroetmoedicht wert verheven.
Augustijnken,De schepping.,134,Petrus leyde oetmoedich leven;
Augustijnken,De schepping.,135,"Daden die pause diere ghelike,"
Augustijnken,De schepping.,136,Dat soude schinen in kerstenrike.
Augustijnken,De schepping.,137,Dander es een cardinael;
Augustijnken,De schepping.,138,"Dat derde een legaet, dat wet wael;"
Augustijnken,De schepping.,139,'t Fierde een erdsche bisscob si;
Augustijnken,De schepping.,140,'t Vijfte es een onderbisscob vri;
Augustijnken,De schepping.,141,"Die seste es een abt oft een prelaet,"
Augustijnken,De schepping.,142,Oft een die in sijn ghelijc staet.
Augustijnken,De schepping.,143,Die sevende sijn canoneke
Augustijnken,De schepping.,144,"Reghelike, ende ander moneke;"
Augustijnken,De schepping.,145,"Dat es die staet van seven kerken,"
Augustijnken,De schepping.,146,"Die in dogheden souden werken,"
Augustijnken,De schepping.,147,"Dat ons van Gode si bekent,"
Augustijnken,De schepping.,148,Dit sijn die .VII. sacrament.
Augustijnken,De schepping.,149,"Nu sijnre .VII. candelare,"
Augustijnken,De schepping.,150,Ende alle ghemaect van goude clare:
Augustijnken,De schepping.,151,"Dyerste sal sijn een keyser,"
Augustijnken,De schepping.,152,Die sal wesen een voerreiser
Augustijnken,De schepping.,153,"Om te lichten kerstenhede,"
Augustijnken,De schepping.,154,"Ghelijc Karle, die coninc dede."
Augustijnken,De schepping.,155,Daeromme es hi ghecroent scone
Augustijnken,De schepping.,156,"Op erden metten gulden crone,"
Augustijnken,De schepping.,157,Om datti sal des Heren kerke
Augustijnken,De schepping.,158,Van hemelrike met goede werken
Augustijnken,De schepping.,159,Bescermen in kerstenhiet.
Augustijnken,De schepping.,160,Een swert sal hem sijn bereit:
Augustijnken,De schepping.,161,Die een egghe sal tot allen tiden
Augustijnken,De schepping.,162,"Met machte op donghelove striden,"
Augustijnken,De schepping.,163,Die kerstenheit willen storen;
Augustijnken,De schepping.,164,"Daer sal hi manlike varen,"
Augustijnken,De schepping.,165,"Ende ons ghelove wel bewaren,"
Augustijnken,De schepping.,166,Lijf noch goet daer teghen sparen.
Augustijnken,De schepping.,167,Die ander egghe met scarpheit
Augustijnken,De schepping.,168,Sal hi doen voeren in rechticheit
Augustijnken,De schepping.,169,"Op hem, die weduwen ende wesen"
Augustijnken,De schepping.,170,Hier verdrucken ofte vresen.
Augustijnken,De schepping.,171,Dus es hier een recht candelaer
Augustijnken,De schepping.,172,Metten pause in den outaer
Augustijnken,De schepping.,173,"Te lichten den heileghen Sacrament,"
Augustijnken,De schepping.,174,Dat ons te troest hier es ghesent.
Augustijnken,De schepping.,175,Enen coninc met enen cardenale
Augustijnken,De schepping.,176,Sal daer lichten ghelijc wale;
Augustijnken,De schepping.,177,"Een hertoge met enen legaet,"
Augustijnken,De schepping.,178,Als een lichter lichtende staet.
Augustijnken,De schepping.,179,"Een grave met enen erdschen bisscob si,"
Augustijnken,De schepping.,180,"Een baenrus licht onderbisscob vri,"
Augustijnken,De schepping.,181,"Een ridder die men in doechden noemt,"
Augustijnken,De schepping.,182,"Waer hi rijt of waer hi coemt,"
Augustijnken,De schepping.,183,"Licht met abten oft met prelaet,"
Augustijnken,De schepping.,184,Oft enen die hem ghelijc staet.
Augustijnken,De schepping.,185,"Een sciltknape die den wapene dient,"
Augustijnken,De schepping.,186,"Ende soe es der eren vrient,"
Augustijnken,De schepping.,187,Dat hi in werken ende in worden
Augustijnken,De schepping.,188,"Leeft na doghenliker orden,"
Augustijnken,De schepping.,189,"Die licht enen canoneke,"
Augustijnken,De schepping.,190,"Oft enen ghehorsamen moneke,"
Augustijnken,De schepping.,191,Die noch gheen priester worden si;
Augustijnken,De schepping.,192,"Maer gherne quame daer bi,"
Augustijnken,De schepping.,193,Ocht hi met heilicheiden mochte leren
Augustijnken,De schepping.,194,Gods lichame consacreren.
Augustijnken,De schepping.,195,Des ghelijcs sal in werken
Augustijnken,De schepping.,196,Een sciltknecht gherne doen merken
Augustijnken,De schepping.,197,Dat hi in dogheden soe vol vaert
Augustijnken,De schepping.,198,"Dat hi met eren vaet aen 't swaert,"
Augustijnken,De schepping.,199,"Dat toebehoert den rechter recht,"
Augustijnken,De schepping.,200,Alse hi niet mere willen wesen knecht.
Augustijnken,De schepping.,201,"Dit sijn die .VII. candelaren,"
Augustijnken,De schepping.,202,"Die lichten souden rechte clare,"
Augustijnken,De schepping.,203,"Met .VII. kerken hier beneden,"
Augustijnken,De schepping.,204,Ende houden Gods volk in vreden.
Augustijnken,De schepping.,205,"Nu sijnre .VII. hoetsonden,"
Augustijnken,De schepping.,206,"Die de viant heeft ghebonden,"
Augustijnken,De schepping.,207,"Ende daer in verduystert mede,"
Augustijnken,De schepping.,208,Daer 't siet seven claerhede:
Augustijnken,De schepping.,209,"D'eerste heet Superbia,"
Augustijnken,De schepping.,210,"Daer men Hovaerde bi versta,"
Augustijnken,De schepping.,211,Die verdrijft Humilitas;
Augustijnken,De schepping.,212,"Oetmoet, die in den pause was,"
Augustijnken,De schepping.,213,Als Petrus leefde heilich leven.
Augustijnken,De schepping.,214,Doer sijn oetmoet wert hi verheven
Augustijnken,De schepping.,215,Hier nedere ende in hemelrike.
Augustijnken,De schepping.,216,"Waren die pause diere ghelike,"
Augustijnken,De schepping.,217,"Dat si oetmoet minnen wouden,"
Augustijnken,De schepping.,218,Ic wane die liede nemen souden
Augustijnken,De schepping.,219,"Goet exempel in 't ghemeine,"
Augustijnken,De schepping.,220,Dat hovaerde beneemt alleine.
Augustijnken,De schepping.,221,"Avaricia hetet Vrecheide,"
Augustijnken,De schepping.,222,Ende brenct heren ter ghecheide
Augustijnken,De schepping.,223,"Dat si doer den vingher sien,"
Augustijnken,De schepping.,224,Om gelt laten onrecht ghescien.
Augustijnken,De schepping.,225,Luxuria maket Onreinicheit;
Augustijnken,De schepping.,226,Gula maket Gulsicheit;
Augustijnken,De schepping.,227,Invidia maket Nijt;
Augustijnken,De schepping.,228,Ira maket Toren ende Strijt;
Augustijnken,De schepping.,229,"Desidia maket Traechede,"
Augustijnken,De schepping.,230,"Ende verdrijft Goetwillichede,"
Augustijnken,De schepping.,231,Daer die liede mede souden
Augustijnken,De schepping.,232,Gode dienen oft si wouden.
Augustijnken,De schepping.,233,"Dit sijn die .VII. hoetsonden,"
Augustijnken,De schepping.,234,Daer heb ic anxt met sijn ghebonden;
Augustijnken,De schepping.,235,"Beide die hoefde van den seven,"
Augustijnken,De schepping.,236,Nu aen ghesien van haren leven.
Augustijnken,De schepping.,237,"Nu sijnre .VII. zeghel claer,"
Augustijnken,De schepping.,238,Die sinte Jan sach openbaer
Augustijnken,De schepping.,239,In enen scilt der Drieheit.
Augustijnken,De schepping.,240,"Dat aengesicht der menscheit,"
Augustijnken,De schepping.,241,"Dat es een schilt driecant,"
Augustijnken,De schepping.,242,Gemaect van der godliker hant;
Augustijnken,De schepping.,243,"Beneden scarp ende boven breit,"
Augustijnken,De schepping.,244,Na der formen der Driheit.
Augustijnken,De schepping.,245,In den scilt mag men ontsluten
Augustijnken,De schepping.,246,Seven seghel als seven conduten:
Augustijnken,De schepping.,247,Twee aen den oeren en twee aen ogen;
Augustijnken,De schepping.,248,Daer mach men vier segel togen:
Augustijnken,De schepping.,249,Twee aen nese ende een aen mont.
Augustijnken,De schepping.,250,Die seven tugen telker stont
Augustijnken,De schepping.,251,Dat God met vaderliken lieve
Augustijnken,De schepping.,252,"Dus formeerde recht erfbrieve,"
Augustijnken,De schepping.,253,Daer wi souden mede
Augustijnken,De schepping.,254,Winnen sijn erfachtichede.
Augustijnken,De schepping.,255,Mijn een oere sal doghet verstaen
Augustijnken,De schepping.,256,Om dat mi sal ter herten gaen;
Augustijnken,De schepping.,257,D'ander sal boesheit horen
Augustijnken,De schepping.,258,Om dat mi grouwen sal daer voren;
Augustijnken,De schepping.,259,"Tusschen tween es besceidenheit,"
Augustijnken,De schepping.,260,Die mi wiset die waerheit.
Augustijnken,De schepping.,261,Mijn een oge sal wel scoen
Augustijnken,De schepping.,262,Gode dancken in den troen
Augustijnken,De schepping.,263,"Sijnre sonnen ende sijnre maen,"
Augustijnken,De schepping.,264,"Die sterren, die aen den hemel staen."
Augustijnken,De schepping.,265,D'ander oge sal op erden
Augustijnken,De schepping.,266,Onsen God lovende werden
Augustijnken,De schepping.,267,"Sijnre beesten ende sijnre lude,"
Augustijnken,De schepping.,268,"Sijn vogel, sijnre crude."
Augustijnken,De schepping.,269,Lovic Gode in mijns herten gront
Augustijnken,De schepping.,270,Soe doen ic recht in alderstont.
Augustijnken,De schepping.,271,"Mijn een nese sal rieken stanc,"
Augustijnken,De schepping.,272,Dat bediet des lijfs bedwanc;
Augustijnken,De schepping.,273,Als 't lichame wilt te weldich sijn
Augustijnken,De schepping.,274,Men sal hem geven disciplijn.
Augustijnken,De schepping.,275,Nature en can haer niet gesaten
Augustijnken,De schepping.,276,Sonder dwanc te sine in maten.
Augustijnken,De schepping.,277,D'ander nese sal sijn bereit
Augustijnken,De schepping.,278,"Dat si sal rieken sueticheit,"
Augustijnken,De schepping.,279,Gode dienen ende wesen vro:
Augustijnken,De schepping.,280,Letamini in Domino.
Augustijnken,De schepping.,281,Nu en hebben wi niet dan enen
Augustijnken,De schepping.,282,"Mont, omme dat wi menen,"
Augustijnken,De schepping.,283,"Worde, werken ende gedacht,"
Augustijnken,De schepping.,284,In dogeden al in eenre macht.
Augustijnken,De schepping.,285,"Gedacht sal wesen reine goet,"
Augustijnken,De schepping.,286,Onse woerde waerachtic wel behoet;
Augustijnken,De schepping.,287,"Lenden, handen sal men werken"
Augustijnken,De schepping.,288,Dat si altoes weldaen sterken.
Augustijnken,De schepping.,289,Als die drie sijn geboget
Augustijnken,De schepping.,290,"Eendrechtechlijc al in doget,"
Augustijnken,De schepping.,291,Soe leit die mensche een salich leven;
Augustijnken,De schepping.,292,"Hadde ons God .II. monde gegeven,"
Augustijnken,De schepping.,293,"Die een waer te spreken, dander logen;"
Augustijnken,De schepping.,294,Soe hadde ons God selve bedrogen.
Augustijnken,De schepping.,295,Nu en gaf hi ons meer dan enen
Augustijnken,De schepping.,296,"Omme dat woerde, werken, menen"
Augustijnken,De schepping.,297,Leven selen al in 't waer;
Augustijnken,De schepping.,298,Soe volgen wi sinen stappen naer.
Augustijnken,De schepping.,299,"Hi heeft gesproken, als men 't versta:"
Augustijnken,De schepping.,300,"Ego sum via, veritas et vita!"
Augustijnken,De schepping.,301,"Hi es leven, wech ende waerheit"
Augustijnken,De schepping.,302,Tot der ewegher salicheit.
Augustijnken,De schepping.,303,"O ghi mannen metten wiven,"
Augustijnken,De schepping.,304,"Wildi recht salich bliven,"
Augustijnken,De schepping.,305,Soe gheeft die siele in den Vader
Augustijnken,De schepping.,306,"Metter memorien algader,"
Augustijnken,De schepping.,307,Ende dat lichaem in den Sone
Augustijnken,De schepping.,308,"Metter verstannessen scone,"
Augustijnken,De schepping.,309,"Ende den Heilegen Gheest den sin,"
Augustijnken,De schepping.,310,Met alden wille ende niet min.
Augustijnken,De schepping.,311,"In welden scouwet overmoet,"
Augustijnken,De schepping.,312,Leeft bi maten het wort u goet;
Augustijnken,De schepping.,313,Niet mestroestich en sijt in liden;
Augustijnken,De schepping.,314,"In liden suldi u verbliden,"
Augustijnken,De schepping.,315,"Ende leven in verduldicheit,"
Augustijnken,De schepping.,316,Dit es 't folc der drivoldicheit.
