author,chapter,line,text
Lodewijk van Velthem,[ Eerste blad  - XXXVII.],1,[................................]
Lodewijk van Velthem,[ Eerste blad  - XXXVII.],2,"Dat in rade doe uinc, dat die gone"
Lodewijk van Velthem,[ Eerste blad  - XXXVII.],3,"Die deken in liet comen na tgone,"
Lodewijk van Velthem,[ Eerste blad  - XXXVII.],4,"Ende met pinen georlovede das,"
Lodewijk van Velthem,[ Eerste blad  - XXXVII.],20,Dat hem daer geleent was
Lodewijk van Velthem,[ Eerste blad  - XXXVII.],6,"Een outhaer, dat daer besiden stoet,"
Lodewijk van Velthem,[ Eerste blad  - XXXVII.],7,Daer men onser Vrouwen fierter up moet
Lodewijk van Velthem,[ Eerste blad  - XXXVII.],8,"Setten, sal soe daer binnen staen."
Lodewijk van Velthem,[ Eerste blad  - XXXVII.],9,Entie coopmans quamen gegaen
Lodewijk van Velthem,[ Eerste blad  - XXXVII.],25,"Some, die oec hadden gewesen"
Lodewijk van Velthem,[ Eerste blad  - XXXVII.],11,Te Wincestre ende gehort van desen
Lodewijk van Velthem,[ Eerste blad  - XXXVII.],12,Fiertre miraclen harde scone.
Lodewijk van Velthem,[ Eerste blad  - XXXVII.],13,Deser vele quamen na tgone
Lodewijk van Velthem,[ Eerste blad  - XXXVII.],14,Ende offerden onser Vrouwen teren.
Lodewijk van Velthem,[ Eerste blad  - XXXVII.],30,Dus volgheden hem vele andre heren.
Lodewijk van Velthem,[ Eerste blad  - XXXVII.],16,"Ende als die deken dit heift vernomen,"
Lodewijk van Velthem,[ Eerste blad  - XXXVII.],17,"Es hi te gonen lieden comen,"
Lodewijk van Velthem,[ Eerste blad  - XXXVII.],18,"Die metten fiertre waren comen daer,"
Lodewijk van Velthem,[ Eerste blad  - XXXVII.],19,"Ende deedse uter kerken daer naer,"
Lodewijk van Velthem,[ Eerste blad  - XXXVII.],35,Daer si hare paerde ende haer gewaden
Lodewijk van Velthem,[ Eerste blad  - XXXVII.],21,"Jammerlike moesten begaden,"
Lodewijk van Velthem,[ Eerste blad  - XXXVII.],22,Want het reynde ende was quaet weder.
Lodewijk van Velthem,[ Eerste blad  - XXXVII.],23,"Dus voeren si vort ende weder,"
Lodewijk van Velthem,[ Eerste blad  - XXXVII.],24,Dat si niewer conden gewinnen
Lodewijk van Velthem,[ Eerste blad  - XXXVII.],40,"Herberghe, so vul was die stat binnen"
Lodewijk van Velthem,[ Eerste blad  - XXXVII.],26,Van coopmans die daer vergadert waren.
Lodewijk van Velthem,[ Eerste blad  - XXXVII.],27,"Dus quamen si tere vrouwe gevaren,"
Lodewijk van Velthem,[ Eerste blad  - XXXVII.],28,"Die haers ontfaeremde, ende seide zaen"
Lodewijk van Velthem,[ Eerste blad  - XXXVII.],29,"Tote haren man: ""Laet ons ontfaen"
Lodewijk van Velthem,[ Eerste blad  - XXXVII.],45,"Dese liede in onse woninghe,"
Lodewijk van Velthem,[ Eerste blad  - XXXVII.],31,"Die wi gemaect hebben niewinghe"","
Lodewijk van Velthem,[ Eerste blad  - XXXVII.],32,Ende thant verhuerd was
Lodewijk van Velthem,[ Eerste blad  - XXXVII.],33,Coopmans. Nochtan na das
Lodewijk van Velthem,[ Eerste blad  - XXXVII.],34,Ontfinc soe daer in die Moeder ons Heren
Lodewijk van Velthem,[ Eerste blad  - XXXVII.],50,"Ende hare clerke met groter eren,"
Lodewijk van Velthem,[ Eerste blad  - XXXVII.],36,"In manieren, dat sie daer na"
Lodewijk van Velthem,[ Eerste blad  - XXXVII.],37,"Des ander daghes, alsic versta,"
Lodewijk van Velthem,[ Eerste blad  - XXXVII.],38,Ene ander herberghe souden souken zaen.
Lodewijk van Velthem,[ Eerste blad  - XXXVII.],39,"Aldus sijn si daer ontfaen,"
Lodewijk van Velthem,[ Eerste blad  - XXXVII.],55,Die van reyne ende van coude grot
Lodewijk van Velthem,[ Eerste blad  - XXXVII.],41,Bina waren uptie doot.
Lodewijk van Velthem,[ Eerste blad  - XXXVII.],42,Dat goede wijf hare cleder wiesch
Lodewijk van Velthem,[ Eerste blad  - XXXVII.],43,"Van der meudre, ende na dies"
Lodewijk van Velthem,[ Eerste blad  - XXXVII.],44,Dede soese droghen ende wel begaden;
Lodewijk van Velthem,[ Eerste blad  - XXXVII.],60,Daer na dede soe met staden
Lodewijk van Velthem,[ Eerste blad  - XXXVII.],46,Behanghen den fiertre met cleder scone
Lodewijk van Velthem,[ Eerste blad  - XXXVII.],47,Van onser Vrouwen; daer na die gone
Lodewijk van Velthem,[ Eerste blad  - XXXVII.],48,"Opende den heren haer herberghe al,"
Lodewijk van Velthem,[ Eerste blad  - XXXVII.],49,Ende hiet mede ende beval
Lodewijk van Velthem,[ Eerste blad  - XXXVII.],65,Hem te dienne ende ere te doene.
Lodewijk van Velthem,[ Eerste blad  - XXXVII.],51,"Nu was daer een, na slands gewone,"
Lodewijk van Velthem,[ Eerste blad  - XXXVII.],52,"Van den coopmans, die hadde daer bi"
Lodewijk van Velthem,[ Eerste blad  - XXXVII.],53,"Drie clocken gehanghen, omme dat hi"
Lodewijk van Velthem,[ Eerste blad  - XXXVII.],54,"Die daer vercopen wille also,"
Lodewijk van Velthem,[ Eerste blad  - XXXVII.],70,"In enen solrebalke ho,"
Lodewijk van Velthem,[ Eerste blad  - XXXVII.],56,"In een groot huus, daer hi ter stede"
Lodewijk van Velthem,[ Eerste blad  - XXXVII.],57,Dese luden ginc wel gereide;
Lodewijk van Velthem,[ Eerste blad  - XXXVII.],58,Ende alse sine gesellen vernamen
Lodewijk van Velthem,[ Eerste blad  - XXXVII.],59,"Die clocken luden, quamen si tsamen"
Lodewijk van Velthem,[ Eerste blad  - XXXVII.],75,Alle gelopen daer waert;
Lodewijk van Velthem,[ Eerste blad  - XXXVII.],61,"Ende als die gone geware waerd,"
Lodewijk van Velthem,[ Eerste blad  - XXXVII.],62,"Dat sine gesellen versamet waren,"
Lodewijk van Velthem,[ Eerste blad  - XXXVII.],63,"Ginc hi hem daer openbaren,"
Lodewijk van Velthem,[ Eerste blad  - XXXVII.],64,Hoe den fiertre ende hare clerke
Lodewijk van Velthem,[ Eerste blad  - XXXVII.],80,"Die deken stac uut sire kerke,"
Lodewijk van Velthem,[ Eerste blad  - XXXVII.],66,"Ende oec geboot om dese dinghe,"
Lodewijk van Velthem,[ Eerste blad  - XXXVII.],67,"Dat niemen van hem ter kerke ginghe,"
Lodewijk van Velthem,[ Eerste blad  - XXXVII.],68,"Maer ginghen ten huse, daer onse Vrouwe"
Lodewijk van Velthem,[ Eerste blad  - XXXVII.],69,"In ware, ende daer elc bescauwe"
Lodewijk van Velthem,[ Eerste blad  - XXXVII.],85,Ende hore daer den dienst van hare.
Lodewijk van Velthem,[ Eerste blad  - XXXVII.],71,Int ende worden si alle daer nare
Lodewijk van Velthem,[ Eerste blad  - XXXVII.],72,"Eendrachtich up ene peyne zaen,"
Lodewijk van Velthem,[ Eerste blad  - XXXVII.],73,"Ware yemen ter kerke ghesien gaen,"
Lodewijk van Velthem,[ Eerste blad  - XXXVII.],74,Dat hi V d. sculdich ware
Lodewijk van Velthem,[ Eerste blad  - XXXVII.],90,Den gesellen te gevene dare.
Lodewijk van Velthem,[ Eerste blad  - XXXVII.],76,Dit was tsaterdaghes vor doctave
Lodewijk van Velthem,[ Eerste blad  - XXXVII.],77,"Van Pentecoste, daer ic scrive ave."
Lodewijk van Velthem,(C. XXXVIII).,78,"Die weerd, daer onse Vrouwe was,"
Lodewijk van Velthem,(C. XXXVIII).,79,"Hadde een huus niet verre van das,"
Lodewijk van Velthem,(C. XXXVIII).,80,"Daer hi ossen ende beesten voedde,"
Lodewijk van Velthem,(C. XXXVIII).,81,"Die een arm dorpman hoedde,"
Lodewijk van Velthem,(C. XXXVIII).,5,"Die hadde een clene dochterkijn,"
Lodewijk van Velthem,(C. XXXVIII).,83,Dat oec van der geboorten sijn
Lodewijk van Velthem,(C. XXXVIII).,84,"Hadde enen voet, als men ons leert,"
Lodewijk van Velthem,(C. XXXVIII).,85,"Die voren dat achter was gekeert,"
Lodewijk van Velthem,(C. XXXVIII).,86,"Also dattie teen, die voren staen,"
Lodewijk van Velthem,(C. XXXVIII).,10,An die versen waren gegaen.
Lodewijk van Velthem,(C. XXXVIII).,88,"Dese dranc waters genoech,"
Lodewijk van Velthem,(C. XXXVIII).,89,"Daer men die reliquien in dwoech,"
Lodewijk van Velthem,(C. XXXVIII).,90,"Ende bespersde den voet daer na,"
Lodewijk van Velthem,(C. XXXVIII).,91,"Ende waecte, alsic versta,"
Lodewijk van Velthem,(C. XXXVIII).,15,Ene nacht der fiertren bi.
Lodewijk van Velthem,(C. XXXVIII).,93,Smorghens was genesen si.
Lodewijk van Velthem,(C. XXXVIII).,94,Des ander daghes quam een drake
Lodewijk van Velthem,(C. XXXVIII).,95,"Uter zee, die met onghemake"
Lodewijk van Velthem,(C. XXXVIII).,96,Dede leven menighen ter stat;
Lodewijk van Velthem,(C. XXXVIII).,20,Want vlamme ende vier voer ute dat.
Lodewijk van Velthem,(C. XXXVIII).,98,Dese vlooch ter kerken waert
Lodewijk van Velthem,(C. XXXVIII).,99,Ende verberende die ter vaert.
Lodewijk van Velthem,(C. XXXVIII).,100,Dat was terste dat hi dede.
Lodewijk van Velthem,(C. XXXVIII).,101,Daer na verbernedi ander huse mede
Lodewijk van Velthem,(C. XXXVIII).,25,"Metter vlamme, die hem ginc uut"
Lodewijk van Velthem,(C. XXXVIII).,103,Tsire neuse; groot geluut
Lodewijk van Velthem,(C. XXXVIII).,104,Ward ghinder. Dit was omtrent
Lodewijk van Velthem,(C. XXXVIII).,105,"Wel enen halven pas na tghent,"
Lodewijk van Velthem,(C. XXXVIII).,106,Van daer onse Vrauwe was ontfaen.
Lodewijk van Velthem,(C. XXXVIII).,30,Daer na senden die liede zaen
Lodewijk van Velthem,(C. XXXVIII).,108,"Tote onser Vrouwen boden, godweet,"
Lodewijk van Velthem,(C. XXXVIII).,109,Dat si brochten wel gereet
Lodewijk van Velthem,(C. XXXVIII).,110,Haer fierter om staen te staden
Lodewijk van Velthem,(C. XXXVIII).,111,Der bernender port. Zaen beraden
Lodewijk van Velthem,(C. XXXVIII).,35,"Worden die van Lodine daer,"
Lodewijk van Velthem,(C. XXXVIII).,113,Ende met vroeden lieden vorwaer
Lodewijk van Velthem,(C. XXXVIII).,114,Senden si up paerde met haesten grot
Lodewijk van Velthem,(C. XXXVIII).,115,"Dat helichdom, daer die noot"
Lodewijk van Velthem,(C. XXXVIII).,116,"Groot was van genen drake,"
Lodewijk van Velthem,(C. XXXVIII).,40,Daer so groot af was die sake
Lodewijk van Velthem,(C. XXXVIII).,118,"Dat onghelovelic te segne es,"
Lodewijk van Velthem,(C. XXXVIII).,119,"So grot so lanc, so ongetes,"
Lodewijk van Velthem,(C. XXXVIII).,120,"Met V hoveden onghehier,"
Lodewijk van Velthem,(C. XXXVIII).,121,Daer ute vlooch vlamme ende vier
Lodewijk van Velthem,(C. XXXVIII).,45,"Sulferachtich ten nesegaten,"
Lodewijk van Velthem,(C. XXXVIII).,123,"Ende vlooch van straten te straten,"
Lodewijk van Velthem,(C. XXXVIII).,124,Ende verbernede die huse alle.
Lodewijk van Velthem,(C. XXXVIII).,125,"Die kerke was worden so te walle,"
Lodewijk van Velthem,(C. XXXVIII).,126,Dat daer ne bleef stoc no steen
Lodewijk van Velthem,(C. XXXVIII).,50,"Van al den mure over een,"
Lodewijk van Velthem,(C. XXXVIII).,128,"Hen ward verbernt tasschen dare,"
Lodewijk van Velthem,(C. XXXVIII).,129,"Stene, houte entie outhare,"
Lodewijk van Velthem,(C. XXXVIII).,130,"So dat niemen mochte sijn vroet,"
Lodewijk van Velthem,(C. XXXVIII).,131,Dat daer noyt kerke stoet.
Lodewijk van Velthem,(C. XXXVIII).,55,Die deken sach die kerke borren
Lodewijk van Velthem,(C. XXXVIII).,133,Ende sijn huus oec sijn in porren
Lodewijk van Velthem,(C. XXXVIII).,134,Ende metten viere ontsteken daer.
Lodewijk van Velthem,(C. XXXVIII).,135,Sine cleder ende sine allame vorwaer
Lodewijk van Velthem,(C. XXXVIII).,136,Ende alle sine sconede mede
Lodewijk van Velthem,(C. XXXVIII).,60,"Dedi binden daer ter stede,"
Lodewijk van Velthem,(C. XXXVIII).,138,Ende deed draghen te scepe waert
Lodewijk van Velthem,(C. XXXVIII).,139,"In die zee met snelre vaert,"
Lodewijk van Velthem,(C. XXXVIII).,140,Daer soe naest was geleghen.
Lodewijk van Velthem,(C. XXXVIII).,141,"Doe dit te scepe was ghedreghen,"
Lodewijk van Velthem,(C. XXXVIII).,65,"Entie scipman dit hadde ontfaen,"
Lodewijk van Velthem,(C. XXXVIII).,143,So quam die drake also zaen
Lodewijk van Velthem,(C. XXXVIII).,144,"Daer waert gevloghen, als of hi wrake"
Lodewijk van Velthem,(C. XXXVIII).,145,Up tscip doen wilde omme die sake;
Lodewijk van Velthem,(C. XXXVIII).,146,Ende omme des dekens goet dat ontfaen
Lodewijk van Velthem,(C. XXXVIII).,70,"Hadde, verbernet also zaen"
Lodewijk van Velthem,(C. XXXVIII).,148,Met alden goede tote in den gront.
Lodewijk van Velthem,(C. XXXVIII).,149,"Dit wonder en wart noyt cont,"
Lodewijk van Velthem,(C. XXXVIII).,150,Dat een scip int water mochte soe
Lodewijk van Velthem,(C. XXXVIII).,151,Verbernen alset dede doe.
Lodewijk van Velthem,(C. XXXVIII).,75,Des werds huus ende oec mede
Lodewijk van Velthem,(C. XXXVIII).,153,"Al sijn goet ende al sine clenede,"
Lodewijk van Velthem,(C. XXXVIII).,154,"Ende oec dat huus, daer in was"
Lodewijk van Velthem,(C. XXXVIII).,155,"Sine beesten, als ict las,"
Lodewijk van Velthem,(C. XXXVIII).,156,Die bleven behoet van desen viere
Lodewijk van Velthem,(C. XXXVIII).,80,"Ende van den drake onghehiere,"
Lodewijk van Velthem,(C. XXXVIII).,158,Entie coopmans sijn oec ontladen
Lodewijk van Velthem,(C. XXXVIII).,159,"Die onser Vrauwen ere daden,"
Lodewijk van Velthem,(C. XXXVIII).,160,So dat si lettel ofte niet
Lodewijk van Velthem,(C. XXXVIII).,161,Van haren goede hadden verdriet
Lodewijk van Velthem,(C. XXXVIII).,85,"Ofte scade, die te telne was."
Lodewijk van Velthem,(C. XXXVIII).,163,"Entie deken, die ghinder na das"
Lodewijk van Velthem,(C. XXXVIII).,164,"Comen was in zwaer verdriet,"
Lodewijk van Velthem,(C. XXXVIII).,165,Om datti uter kerken stiet
Lodewijk van Velthem,(C. XXXVIII).,166,"Onser Vrouwen fiertre ende hare gewade,"
Lodewijk van Velthem,(C. XXXVIII).,90,"Bepeinsdem doe, al waest te spade,"
Lodewijk van Velthem,(C. XXXVIII).,168,"Ende wilde sine penitencie ontfaen,"
Lodewijk van Velthem,(C. XXXVIII).,169,"Ende quam wullin ende baervoet gegaen,"
Lodewijk van Velthem,(C. XXXVIII).,170,"Ende viel ter erden vor hare mede,"
Lodewijk van Velthem,(C. XXXVIII).,171,Ende begonde lien daer ter stede
Lodewijk van Velthem,(C. XXXVIII).,95,"Vor den fiertre, dat ware Gods recht."
Lodewijk van Velthem,(C. XXXVIII).,173,"Dus kendi hem mesdadich echt,"
Lodewijk van Velthem,(C. XXXVIII).,174,Ende bat om absolveren daer zaen
Lodewijk van Velthem,(C. XXXVIII).,175,Van datti daer an hadde mesdaen.
Lodewijk van Velthem,(C. XXXIX).,176,Tote Excesteren in ere stede
Lodewijk van Velthem,(C. XXXIX).,177,"Ontfincse in groter waerdichede,"
Lodewijk van Velthem,(C. XXXIX).,178,"Den fiertre van Lodine, secgic u,"
Lodewijk van Velthem,(C. XXXIX).,179,"Die choerbiscop Robrecht, die vor nu"
Lodewijk van Velthem,(C. XXXIX).,5,Lanc te Lodine woende binnen.
Lodewijk van Velthem,(C. XXXIX).,181,"Dese horde, als wi bekinnen,"
Lodewijk van Velthem,(C. XXXIX).,182,Daer van meester Anselme menige lesse.
Lodewijk van Velthem,(C. XXXIX).,183,Het worden oec daer X ende sesse
Lodewijk van Velthem,(C. XXXIX).,184,Zieke genesen ende al gesont.
Lodewijk van Velthem,(C. XXXIX).,10,Daer was oec in der selver stont
Lodewijk van Velthem,(C. XXXIX).,186,War . . inghe . . . . te . . . sene daer
Lodewijk van Velthem,(C. XXXIX).,187,"Enen biscop weit weit vor waer,"
Lodewijk van Velthem,(C. XXXIX).,188,Die wesen soude te Salebiere.
Lodewijk van Velthem,(C. XXXIX).,189,"Hieromme ne wilde die goedertiere,"
Lodewijk van Velthem,(C. XXXIX).,15,"Die Moeder Gods, daer niemen genesen,"
Lodewijk van Velthem,(C. XXXIX).,191,Die in dat bisdom soude wesen.
Lodewijk van Velthem,(C. XXXIX).,192,Daer na quamen si van Salebiere
Lodewijk van Velthem,(C. XXXIX).,193,"Tote enen cloestre van nonnen sciere,"
Lodewijk van Velthem,(C. XXXIX).,194,"Die men Wiltona hiet bi namen,"
Lodewijk van Velthem,(C. XXXIX).,20,Ende al daer die boden vernamen
Lodewijk van Velthem,(C. XXXIX).,196,"Waer een graf was gewiset daer na,"
Lodewijk van Velthem,(C. XXXIX).,197,"Daer in lach die priester Beda,"
Lodewijk van Velthem,(C. XXXIX).,198,Die men in omelien seghet.
Lodewijk van Velthem,(C. XXXIX).,199,Bi sinen grave was geleghet
Lodewijk van Velthem,(C. XXXIX).,200,........
Lodewijk van Velthem,[ Tweede blad  . XLVI.],201,[................................]
Lodewijk van Velthem,[ Tweede blad  . XLVI.],202,"Daer tusschen so geviel twaren,"
Lodewijk van Velthem,[ Tweede blad  . XLVI.],203,"Dattie paefs verwerf algader,"
Lodewijk van Velthem,[ Tweede blad  . XLVI.],204,"Entie ward ye so lanc so quader,"
Lodewijk van Velthem,[ Tweede blad  . XLVI.],205,Entie ward daer in den ban
Lodewijk van Velthem,[ Tweede blad  . XLVI.],206,Ghedaen ende al sine man.
Lodewijk van Velthem,(C. XLVII).,207,Int jaer ons Heren min no mee
Lodewijk van Velthem,(C. XLVII).,208,Dan XIC XVIII ende twee
Lodewijk van Velthem,(C. XLVII).,209,Begonste die ordine van Premonstreit.
Lodewijk van Velthem,(C. XLVII).,210,Van Norberte na die wareit
Lodewijk van Velthem,(C. XLVII).,5,So was soe erstwaerven gemaect.
Lodewijk van Velthem,(C. XLVII).,212,"Dese was in dogheden wel geraect,"
Lodewijk van Velthem,(C. XLVII).,213,Ende ute Lottrike geboren
Lodewijk van Velthem,(C. XLVII).,214,"Ende van goeden lieden te voren,"
Lodewijk van Velthem,(C. XLVII).,215,Ende metten groten heren al daer
Lodewijk van Velthem,(C. XLVII).,10,Hi was bekent verre ende naer.
Lodewijk van Velthem,(C. XLVII).,217,"Daer na hi die werelt liet,"
Lodewijk van Velthem,(C. XLVII).,218,"Ente priesterscepe hem tiet,"
Lodewijk van Velthem,(C. XLVII).,219,"Ende dede an den roc gereet,"
Lodewijk van Velthem,(C. XLVII).,220,"Die men in Latijn ermode heet,"
Lodewijk van Velthem,(C. XLVII).,15,Ende oec dat woord der predicaden
Lodewijk van Velthem,(C. XLVII).,222,"Nam hi an met desen gewaden,"
Lodewijk van Velthem,(C. XLVII).,223,Die met innegher herten groot
Lodewijk van Velthem,(C. XLVII).,224,"Hem boot ten cruce albloot,"
Lodewijk van Velthem,(C. XLVII).,225,Want naect volgedi den naecten Gode.
Lodewijk van Velthem,(C. XLVII).,20,Doe hi aldus in die aermoede
Lodewijk van Velthem,(C. XLVII).,227,"Die regle hadde van Gode ontfaen,"
Lodewijk van Velthem,(C. XLVII).,228,Quam hi up ene tijt gegaen
Lodewijk van Velthem,(C. XLVII).,229,"In dien winter, doet reynde sere,"
Lodewijk van Velthem,(C. XLVII).,230,Al baervoet dor die Gods ere;
Lodewijk van Velthem,(C. XLVII).,25,Doe bestandi jeghen die wolken.
Lodewijk van Velthem,(C. XLVII).,232,In dien weghe bekeerdi selken
Lodewijk van Velthem,(C. XLVII).,233,"Vander doolnessen twaren, daer si in waren."
Lodewijk van Velthem,(C. XLVII).,234,Daer na es Gelacius gevaren
Lodewijk van Velthem,(C. XLVII).,235,"In Gallen, alsic seide te voren,"
Lodewijk van Velthem,(C. XLVII).,30,"Tere consilie, als ghi moghet horen."
Lodewijk van Velthem,(C. XLVII).,237,Dus was dese Norbert gegaen
Lodewijk van Velthem,(C. XLVII).,238,"Al baervoet, sonder waen,"
Lodewijk van Velthem,(C. XLVII).,239,"Ende quam vor den paefs int hof,"
Lodewijk van Velthem,(C. XLVII).,240,"Ende impetreerde daer orlof,"
Lodewijk van Velthem,(C. XLVII).,35,Dat hi mochte dat word ons Heren
Lodewijk van Velthem,(C. XLVII).,242,"Achter lande gaen ende leren,"
Lodewijk van Velthem,(C. XLVII).,243,Ende dies gelijc impetreerdi dus
Lodewijk van Velthem,(C. XLVII).,244,Van den paefs Kalixtus.
Lodewijk van Velthem,(C. XLVII).,245,"Daer na quam hi te Lodine binnen,"
Lodewijk van Velthem,(C. XLVII).,40,Daer was hi ontfaen met minnen
Lodewijk van Velthem,(C. XLVII).,247,"Van Bertholomeuse, die doe was"
Lodewijk van Velthem,(C. XLVII).,248,"Biscop daer, ende na das"
Lodewijk van Velthem,(C. XLVII).,249,So settene die biscop daer naer
Lodewijk van Velthem,(C. XLVII).,250,"In sente Martins kerke daer,"
Lodewijk van Velthem,(C. XLVII).,45,Omme metten canoniken daer te sine;
Lodewijk van Velthem,(C. XLVII).,252,Maer sine consten sine pine
Lodewijk van Velthem,(C. XLVII).,253,Niet gedoghen no anesien.
Lodewijk van Velthem,(C. XLVII).,254,Dus quam vor den biscop na dien
Lodewijk van Velthem,(C. XLVII).,255,"Die deken entie capitele mede,"
Lodewijk van Velthem,(C. XLVII).,50,Ende seiden ten biscop daer ter stede
Lodewijk van Velthem,(C. XLVII).,257,"Dat leven, dat hi daer brochte vort."
Lodewijk van Velthem,(C. XLVII).,258,Dus ginc hi om dit uter port.
Lodewijk van Velthem,(C. XLVII).,259,"Maer die biscop beval heme,"
Lodewijk van Velthem,(C. XLVII).,260,Dat hi daer yeweren neme
Lodewijk van Velthem,(C. XLVII).,55,Ene stede an sijn behoren.
Lodewijk van Velthem,(C. XLVII).,262,Doe quam desen man voren
Lodewijk van Velthem,(C. XLVII).,263,"Bi vorsiene der Godlicheit,"
Lodewijk van Velthem,(C. XLVII).,264,"Datti quam tote Premonstreit,"
Lodewijk van Velthem,(C. XLVII).,265,Daer hi een sonderlanc leven nam an.
Lodewijk van Velthem,(C. XLVII).,60,"Daer na in de vastine dan,"
Lodewijk van Velthem,(C. XLVII).,267,"Om te vergaderne gesellen daer,"
Lodewijk van Velthem,(C. XLVII).,268,"Ginc hie allene uut vorwaer,"
Lodewijk van Velthem,(C. XLVII).,269,Ende quam vor Paschen tsire cellen
Lodewijk van Velthem,(C. XLVII).,270,"Weder met XIII gesellen,"
Lodewijk van Velthem,(C. XLVII).,65,Ende mettesen te Premonstreit
Lodewijk van Velthem,(C. XLVII).,272,"Began hi dat leven der wareit,"
Lodewijk van Velthem,(C. XLVII).,273,"Ende nam an die regle entie pine,"
Lodewijk van Velthem,(C. XLVII).,274,Die men hout van Augustine.
Lodewijk van Velthem,(C. XLVII).,275,"Dus begonste die cloester daer,"
Lodewijk van Velthem,(C. XLVII).,70,Die hi vort brochte al over waer.
Lodewijk van Velthem,(C. XLVII).,277,"In desen tiden, alsic gome,"
Lodewijk van Velthem,(C. XLVII).,278,"Voer Kalixtus die paefs te Rome,"
Lodewijk van Velthem,(C. XLVII).,279,Ende ward van den senaturen ontfaen
Lodewijk van Velthem,(C. XLVII).,280,"Ende van alder stat, sonder waen;"
Lodewijk van Velthem,(C. XLVII).,75,Want al die gone van der stat
Lodewijk van Velthem,(C. XLVII).,282,Hebben in den stoel gesat.
Lodewijk van Velthem,(C. XLVII).,283,"Burdinus, die paefs van daer voren,"
Lodewijk van Velthem,(C. XLVII).,284,"Dien die keyser gaf die coren,"
Lodewijk van Velthem,(C. XLVII).,285,"Te Surs in de stat binnen,"
Lodewijk van Velthem,(C. XLVII).,80,"Dese, alse waenden gaen met minnen"
Lodewijk van Velthem,(C. XLVII).,287,"Die pelegrime te Rome [ter] bedevaert,"
Lodewijk van Velthem,(C. XLVII).,288,"Berovedise al ongespaert,"
Lodewijk van Velthem,(C. XLVII).,289,Bede int gaen ende int keren.
Lodewijk van Velthem,(C. XLVII).,290,Daer na warti met groter onneren
Lodewijk van Velthem,(C. XLVII).,85,"Gevaen, gelijc enen onwettighen man,"
Lodewijk van Velthem,(C. XLVII).,292,Ende enen man bescoren vort an.
Lodewijk van Velthem,(C. XLVIII).,293,Tote Premonstreit geviel aldus
Lodewijk van Velthem,(C. XLVIII).,294,"Enen monic, hiet Altius."
Lodewijk van Velthem,(C. XLVIII).,295,"In de kerke also hi sat,"
Lodewijk van Velthem,(C. XLVIII).,296,Ende sere peinsende ward na dat
Lodewijk van Velthem,(C. XLVIII).,5,Met innegher herten wel gereit
Lodewijk van Velthem,(C. XLVIII).,298,"Omme die helighe Drievoudicheit,"
Lodewijk van Velthem,(C. XLVIII).,299,Te mattinen hem die duvel openbaerde
Lodewijk van Velthem,(C. XLVIII).,300,"Den monic, als in diere waerde"
Lodewijk van Velthem,(C. XLVIII).,301,"Der Triniteit, met III hoveden."
Lodewijk van Velthem,(C. XLVIII).,10,"Die monic, die in desen gelovede,"
Lodewijk van Velthem,(C. XLVIII).,303,"Om dat hire om peinsde daer ter stede,"
Lodewijk van Velthem,(C. XLVIII).,304,"So waende hi dat in der jeghenwordichede,"
Lodewijk van Velthem,(C. XLVIII).,305,"Dattie hoofde God daer brachte,"
Lodewijk van Velthem,(C. XLVIII).,306,Om datti om die Triniteit dachte.
Lodewijk van Velthem,(C. XLVIII).,15,Maer daer naer wartijs geware
Lodewijk van Velthem,(C. XLVIII).,308,Ende dede den duvel vlien van dare.
Lodewijk van Velthem,(C. XLVIII).,309,Norbert doe hi ginc int lant
Lodewijk van Velthem,(C. XLVIII).,310,"Prediken, quam hi daer hi eens vant"
Lodewijk van Velthem,(C. XLVIII).,311,"Ene joncvrouwe, die was beseten."
Lodewijk van Velthem,(C. XLVIII).,20,"Die belas hi, als wijt weiten,"
Lodewijk van Velthem,(C. XLVIII).,313,Entie duvel begonste daer na
Lodewijk van Velthem,(C. XLVIII).,314,Te scerne Cantorum Cantica
Lodewijk van Velthem,(C. XLVIII).,315,"Van worde te worde, ende in Walsch."
Lodewijk van Velthem,(C. XLVIII).,316,"Daer na warti oec gemalsch,"
Lodewijk van Velthem,(C. XLVIII).,25,"Ende riep dit sere in Duutsche met,"
Lodewijk van Velthem,(C. XLVIII).,318,Als in die Cantike es geset.
Lodewijk van Velthem,(C. XLVIII).,319,"Maer Norbert daer na, Gods knecht,"
Lodewijk van Velthem,(C. XLVIII).,320,Heiftene met gebeden verjaecht echt.
Lodewijk van Velthem,(C. XLVIII).,321,Daer na so ginc Norbert van daer
Lodewijk van Velthem,(C. XLVIII).,30,"Te Cuelne waerd, ende sochte vor waer"
Lodewijk van Velthem,(C. XLVIII).,323,Reliquien in die stede binnen.
Lodewijk van Velthem,(C. XLVIII).,324,Die sine heifti met zoeten sinnen
Lodewijk van Velthem,(C. XLVIII).,325,"Vermaent, dat si vasten wouden,"
Lodewijk van Velthem,(C. XLVIII).,326,Eers die reliquien souken souden;
Lodewijk van Velthem,(C. XLVIII).,35,"Ende I vertoghedem, godweet,"
Lodewijk van Velthem,(C. XLVIII).,328,"Van den XIM mageden gereet,"
Lodewijk van Velthem,(C. XLVIII).,329,"Ende hare name ende hare stat,"
Lodewijk van Velthem,(C. XLVIII).,330,Ende waer soe geleghen ware na dat.
Lodewijk van Velthem,(C. XLVIII).,331,Sander daghes heiftise verheven
Lodewijk van Velthem,(C. XLVIII).,40,"Met andren reliquien, die daer beneven"
Lodewijk van Velthem,(C. XLVIII).,333,"Laghen, ende heifse te Premonstreit"
Lodewijk van Velthem,(C. XLVIII).,334,"Verheven, alst hier na ward geseit."
Lodewijk van Velthem,(C. XLVIII).,335,"Des ander daghes rusti niet,"
Lodewijk van Velthem,(C. XLVIII).,336,"Van dat sente Gereon es gesciet,"
Lodewijk van Velthem,(C. XLVIII).,45,Daer waecti snachts ende beede sere.
Lodewijk van Velthem,(C. XLVIII).,338,Smorghins vro so quam die here
Lodewijk van Velthem,(C. XLVIII).,339,"In de kerke; onder sinen voet,"
Lodewijk van Velthem,(C. XLVIII).,340,"Recht in midden, daer hi stoet,"
Lodewijk van Velthem,(C. XLVIII).,341,"Daer gheen graf es gesien,"
Lodewijk van Velthem,(C. XLVIII).,50,"So vant hi recht na dien,"
Lodewijk van Velthem,(C. XLVIII).,343,Alsment onverre hadde na tgone
Lodewijk van Velthem,(C. XLVIII).,344,"Gegraven, den helighen Gereone."
Lodewijk van Velthem,(C. XLVIII).,345,Sonder herssinbeckin met waerden
Lodewijk van Velthem,(C. XLVIII).,346,So lachi daer in der erden;
Lodewijk van Velthem,(C. XLVIII).,55,"Also alst ons es besceden,"
Lodewijk van Velthem,(C. XLVIII).,348,So was hem thooft som afgesneden.
Lodewijk van Velthem,(C. XLVIII).,349,"Dus namen sie den lichame met eren,"
Lodewijk van Velthem,(C. XLVIII).,350,"Die clerke entie andre heren,"
Lodewijk van Velthem,(C. XLVIII).,351,Ende hebbene daer verheven.
Lodewijk van Velthem,(C. XLVIII).,60,"Daer was Norberte een deel gegeven,"
Lodewijk van Velthem,(C. XLVIII).,353,"Daer hi mede ten cloestre waerd ginc,"
