author,chapter,line,text
Hein van Aken(?),I,1,Iacop die van mertene vant
Hein van Aken(?),I,2,Heeft mi gesent enen brant
Hein van Aken(?),I,3,Die mi heeft ontsteken.
Hein van Aken(?),I,4,Nu eest met mi also bewant:
Hein van Aken(?),I,5,Het sal mi costen huus ende lant
Hein van Aken(?),I,6,Of ic saels mi wreken.
Hein van Aken(?),I,7,En es saphier noch dyamant
Hein van Aken(?),I,8,Vindickene in dat sant
Hein van Aken(?),I,9,"Alsic wade ouer die beken,"
Hein van Aken(?),I,10,"In wachte na negenen cant,"
Hein van Aken(?),I,11,In treder op bi sente amant
Hein van Aken(?),I,12,Al soude hi te stucken breken.
Hein van Aken(?),I,13,Die mi dus loepen toter hant
Hein van Aken(?),I,14,Ende toenen mi den fellen tant
Hein van Aken(?),I,15,Op hen willic spreken.
Hein van Aken(?),I,16,Si willen wesen so faeliant
Hein van Aken(?),I,17,"Die dus maken den parant,"
Hein van Aken(?),I,18,Alsic hare scip sie leken
Hein van Aken(?),I,19,Toegict den hoghen deken.
Hein van Aken(?),II,20,Constic fraye rime vinden
Hein van Aken(?),II,21,"Ende op .XIX. doen inden,"
Hein van Aken(?),II,22,So woudic rime maken
Hein van Aken(?),II,23,Ende verdroeuen diet verblinden
Hein van Aken(?),II,24,Ende valsche verraders scinden
Hein van Aken(?),II,25,"- Al in dietscher spraken, -"
Hein van Aken(?),II,26,Die ons die werelt sere binden
Hein van Aken(?),II,27,Al met haren valschen sinden
Hein van Aken(?),II,28,Ende die doecht doen laken.
Hein van Aken(?),II,29,Woude[t] ons god also bewinden
Hein van Aken(?),II,30,Dat si hen seluen weder kinden
Hein van Aken(?),II,31,"Die in de archeit waken,"
Hein van Aken(?),II,32,So woudics mi onderwinden
Hein van Aken(?),II,33,Ende hen hoge mere sinden
Hein van Aken(?),II,34,Die edelheiden smaken.
Hein van Aken(?),II,35,Mi deert dat si te houe spinden
Hein van Aken(?),II,36,Die trouwe noyt en minden.
Hein van Aken(?),II,37,In wils u niet messaken:
Hein van Aken(?),II,38,Dit doet mi dicke waken.
Hein van Aken(?),III,39,"Helpe iacob, geselle mijn,"
Hein van Aken(?),III,40,Sal trouwe lange verloren sijn
Hein van Aken(?),III,41,Ende hoe blijft si dus verloren?
Hein van Aken(?),III,42,Wanen quam ons dit venijn?
Hein van Aken(?),III,43,Het doet orloge in schijn
Hein van Aken(?),III,44,Dat god wert versworen.
Hein van Aken(?),III,45,"Iacop, toech de conste dijn,"
Hein van Aken(?),III,46,"Proef daer na, niet en verdwijn"
Hein van Aken(?),III,47,Dijn herte in enegen toren.
Hein van Aken(?),III,48,Het drinct selc der heren wijn
Hein van Aken(?),III,49,Op die seine ende op den rijn
Hein van Aken(?),III,50,Die iudas was geboren.
Hein van Aken(?),III,51,"Edelre heren herte, pijn"
Hein van Aken(?),III,52,Na die doecht ende die gerijn:
Hein van Aken(?),III,53,Du words daer toe vercoren.
Hein van Aken(?),III,54,"Dits oppenbaer blickende fijn,"
Hein van Aken(?),III,55,"Sprac iacob, lieue mertijn,"
Hein van Aken(?),III,56,"Du vrages mi te voren,"
Hein van Aken(?),III,57,"Ic segt di, wildijt horen."
Hein van Aken(?),IV,58,Doe die heren ierst ontfingen
Hein van Aken(?),IV,59,Des dorpers scat ende omme gingen
Hein van Aken(?),IV,60,Met haren valschen rade
Hein van Aken(?),IV,61,Ende na doecht niet en wouden ringen
Hein van Aken(?),IV,62,"Daer si nv sere aue wringen,"
Hein van Aken(?),IV,63,Doe vielen wi in die scade.
Hein van Aken(?),IV,64,Hi es meester diese nv sal dwingen
Hein van Aken(?),IV,65,Die ons die valsche maren bringen:
Hein van Aken(?),IV,66,Goet raet comt ons te spade.
Hein van Aken(?),IV,67,Jc sie nv te houe singen
Hein van Aken(?),IV,68,Te samen reien ende springen
Hein van Aken(?),IV,69,Die goede ende die quade.
Hein van Aken(?),IV,70,"Nv \ wille hen god de werelt ingen,"
Hein van Aken(?),IV,71,Hine can langer niet gehingen
Hein van Aken(?),IV,72,Hare boese dade.
Hein van Aken(?),IV,73,"Werde god, laet ons verdingen"
Hein van Aken(?),IV,74,Onse mesdaet ende cringen
Hein van Aken(?),IV,75,Van desen loesen sade
Hein van Aken(?),IV,76,Daer af comt ongenade.
Hein van Aken(?),V,77,"Iacob vrient, nv segt mi dan,"
Hein van Aken(?),V,78,Enen onnedelen raetsman
Hein van Aken(?),V,79,Hoe salic dien geloeuen?
Hein van Aken(?),V,80,Nadat ic nu bevroeden can
Hein van Aken(?),V,81,So leget vele verlies daer an
Hein van Aken(?),V,82,Sinen here als te bouen.
Hein van Aken(?),V,83,Maer wie hi es of wiene wan
Hein van Aken(?),V,84,Die iegen darcheit maect gespan
Hein van Aken(?),V,85,Met hem soudemen houen;
Hein van Aken(?),V,86,Maer daer tfenijn vte ran
Hein van Aken(?),V,87,Die edelheit brachte in den ban
Hein van Aken(?),V,88,Die moeten sijn verscouen.
Hein van Aken(?),V,89,"Verhuedt u, heren, in desen dan:"
Hein van Aken(?),V,90,Heetti heinrec ochte ian
Hein van Aken(?),V,91,Scuwet valsche gelouen.
Hein van Aken(?),V,92,Hi dede alse een loes tyran
Hein van Aken(?),V,93,Die ons dit valsche webbe span
Hein van Aken(?),V,94,Daer trouwe mede es te clouen
Hein van Aken(?),V,95,Ende edelheit moet douen.
Hein van Aken(?),VI,96,"Iacob, men siet nv in dlant"
Hein van Aken(?),VI,97,Dat edelheit gaet in hant
Hein van Aken(?),VI,98,Ende trouwe es al verloren.
Hein van Aken(?),VI,99,Daer men wilen trouwe vant
Hein van Aken(?),VI,100,Daer eest nv also bewant:
Hein van Aken(?),VI,101,Men wilt daer niemen horen
Hein van Aken(?),VI,102,Hine bringe gelt of goeden pant.
Hein van Aken(?),VI,103,Dan so es hi auenant
Hein van Aken(?),VI,104,Siere stucken als tevoren.
Hein van Aken(?),VI,105,Dus es edelheit in bant:
Hein van Aken(?),VI,106,Men vintse in water noch op sant
Hein van Aken(?),VI,107,Sine hebben trouwe versworen.
Hein van Aken(?),VI,108,God die vant der edelheit cant
Hein van Aken(?),VI,109,Blussche ons desen leeden brant
Hein van Aken(?),VI,110,Ochte hi sal ons versmoren.
Hein van Aken(?),VI,111,"Nu helpe, werde heylant,"
Hein van Aken(?),VI,112,Huedt ons vore sduuels tant;
Hein van Aken(?),VI,113,"Ende helpt ons, here vercoren,"
Hein van Aken(?),VI,114,Ghi wordt om ons geboren.
Hein van Aken(?),VII,115,God die alle dinc vorsiet
Hein van Aken(?),VII,116,En sal u ontfermen niet
Hein van Aken(?),VII,117,Deser werelt uerwerren.
Hein van Aken(?),VII,118,Eest dat darcheit vorwert tiet
Hein van Aken(?),VII,119,Ende trouwe vorder achter vliet
Hein van Aken(?),VII,120,Vroude sal ons merren.
Hein van Aken(?),VII,121,Die menschen doen om cleen geniet
Hein van Aken(?),VII,122,Alse iudas dede die gode verriet:
Hein van Aken(?),VII,123,Dies moechdi u wel erren.
Hein van Aken(?),VII,124,Dus moet in den helschen vliet
Hein van Aken(?),VII,125,Ghemeenlec al dat boese diet
Hein van Aken(?),VII,126,Daer die duuele berren.
Hein van Aken(?),VII,127,"O weerde god, ontferme v iet"
Hein van Aken(?),VII,128,Dat dese iammer dus gesciet:
Hein van Aken(?),VII,129,Twi mogedi ons dus verren?
Hein van Aken(?),VII,130,Als yemen na die doget spiet
Hein van Aken(?),VII,131,Comen alse gers ende griet
Hein van Aken(?),VII,132,Die duuele met haren gherren
Hein van Aken(?),VII,133,Die ons met sonden terren.
Hein van Aken(?),VIII,134,"Merten, es een ionc of out"
Hein van Aken(?),VIII,135,God geeft hem tweer wege gewout:
Hein van Aken(?),VIII,136,Dat seit ons die screfture.
Hein van Aken(?),VIII,137,"Doedi wel, god es u hout;"
Hein van Aken(?),VIII,138,"Doedi quaet, u en helpt geen gout"
Hein van Aken(?),VIII,139,Ghine moet in sduuels scuere.
Hein van Aken(?),VIII,140,Weldaet loent god menechfout;
Hein van Aken(?),VIII,141,"Doedi quaet, ghi hebt die scout:"
Hein van Aken(?),VIII,142,Dits een seker cuere.
Hein van Aken(?),VIII,143,Hi en es so edel noch so stout
Hein van Aken(?),VIII,144,Noch so vrome noch so bout
Hein van Aken(?),VIII,145,Hine wacht deser auontuere.
Hein van Aken(?),VIII,146,"Aldus sijn wi in een hout,"
Hein van Aken(?),VIII,147,in een neder donker wout
Hein van Aken(?),VIII,148,Onder felle gebuere.
Hein van Aken(?),VIII,149,"Merten, scemelheit behout"
Hein van Aken(?),VIII,150,Ende verdiene dat hoge sout
Hein van Aken(?),VIII,151,Te scouwene gods figuere
Hein van Aken(?),VIII,152,Eewelec sonder suere.
Hein van Aken(?),IX,153,"Merten, ons seggen coroniken"
Hein van Aken(?),IX,154,Als gode niet en willen wiken
Hein van Aken(?),IX,155,"Die erdsche creaturen,"
Hein van Aken(?),IX,156,So doet hi sine abolge striken
Hein van Aken(?),IX,157,Beide ten armen ende ten riken.
Hein van Aken(?),IX,158,Dit valt noch tselker vren.
Hein van Aken(?),IX,159,Wilen dede hi dit wel bliken:
Hein van Aken(?),IX,160,"Hen en halp gescut, sweert no piken,"
Hein van Aken(?),IX,161,Grachte noch hoge mueren.
Hein van Aken(?),IX,162,Als hen god wilde beswiken
Hein van Aken(?),IX,163,Worden si wel sciere te liken:
Hein van Aken(?),IX,164,Dit gaf hi hen ter cueren.
Hein van Aken(?),IX,165,Hen en halp dammen no diken
Hein van Aken(?),IX,166,Noch geen ouermoedech priken:
Hein van Aken(?),IX,167,God deedt al vervueren.
Hein van Aken(?),IX,168,Onse wesen mach wel dien geliken
Hein van Aken(?),IX,169,Dat wi ons leuen dus besliken.
Hein van Aken(?),IX,170,Ic vruchte god sal pueren
Hein van Aken(?),IX,171,Die werelt tonsen sueren.
Hein van Aken(?),X,172,"Iacob vrient, ghi segt waer."
Hein van Aken(?),X,173,Ons seit die screfture claer
Hein van Aken(?),X,174,Hoe god in hemelrike
Hein van Aken(?),X,175,Sijn abolge keerde openbaer
Hein van Aken(?),X,176,Op luciferre die al daer
Hein van Aken(?),X,177,Woude wesen sijn gelike
Hein van Aken(?),X,178,Ende der ingele menech paer
Hein van Aken(?),X,179,Die ouermoet trocken naer:
Hein van Aken(?),X,180,Dat rout hen ewelike.
Hein van Aken(?),X,181,Dies warp hise in den eeuschen vaer
Hein van Aken(?),X,182,In der leider pinen swaer
Hein van Aken(?),X,183,Binnen der hellen dike.
Hein van Aken(?),X,184,Ouermoet was in hen caer:
Hein van Aken(?),X,185,God en liet van hen daer niet een haer
Hein van Aken(?),X,186,Hine warpse in den slike.
Hein van Aken(?),X,187,Riese domme herte spaer:
Hein van Aken(?),X,188,Ouermoet es gode onmaer.
Hein van Aken(?),X,189,"Helpt, god, dat ic di wike"
Hein van Aken(?),X,190,So dat mijn weldaet blike.
Hein van Aken(?),XI,191,Aldus maecte ouermoet
Hein van Aken(?),XI,192,Den quaden alre iersten woet
Hein van Aken(?),XI,193,Also wijt vinden bescreuen.
Hein van Aken(?),XI,194,"Dienne anteren sijn onvroet,"
Hein van Aken(?),XI,195,Hen naket die helsche stoet
Hein van Aken(?),XI,196,Daer rouwe in es becleuen.
Hein van Aken(?),XI,197,"Want hi menegen pine doet,"
Hein van Aken(?),XI,198,Die sine werpt hi onder voet:
Hein van Aken(?),XI,199,Hine can niet anders geuen.
Hein van Aken(?),XI,200,Die hem dienen geeft hi spoet
Hein van Aken(?),XI,201,Te comene in die helsche gloet
Hein van Aken(?),XI,202,Daer si altoes in sneuen.
Hein van Aken(?),XI,203,"Scemelheit, gi sijt [so] goet:"
Hein van Aken(?),XI,204,Die u dienen hebben den hoed
Hein van Aken(?),XI,205,In deewelike leuen.
Hein van Aken(?),XI,206,"Helpt, god, dor u heilege bloet"
Hein van Aken(?),XI,207,Huedt ons vore sduuels broed
Hein van Aken(?),XI,208,Dat wi werden verheuen
Hein van Aken(?),XI,209,Daer dingele selen beuen.
Hein van Aken(?),XII,210,"O maria, weerde maget"
Hein van Aken(?),XII,211,"Vol gracien ende onversaget,"
Hein van Aken(?),XII,212,Ghenade der creaturen
Hein van Aken(?),XII,213,Daer u sone omme wert geiaget
Hein van Aken(?),XII,214,Ende gebonden ende gelaget
Hein van Aken(?),XII,215,"In ere bittere vren,"
Hein van Aken(?),XII,216,"Hort, vrouwe, wat men u saget:"
Hein van Aken(?),XII,217,Ghenadecheit es in u bedaget
Hein van Aken(?),XII,218,Sonder enech mueren.
Hein van Aken(?),XII,219,Dit wetti wel ongevraget
Hein van Aken(?),XII,220,Dat gi \ des sonders soene draget:
Hein van Aken(?),XII,221,Hoe mochte wi els geduren?
Hein van Aken(?),XII,222,"Vrouwe, wie dat u gewaget"
Hein van Aken(?),XII,223,Sine [sonden] ende claget
Hein van Aken(?),XII,224,Daer af moettine pueren.
Hein van Aken(?),XII,225,Nu es die werelt sere geplaget
Hein van Aken(?),XII,226,Metten sonden ende vertraget.
Hein van Aken(?),XII,227,"Helpt, vrouwe, dinen gebueren"
Hein van Aken(?),XII,228,In deeusche rike cueren.
Hein van Aken(?),XIII,229,"230 Berecht mi lieue iacop,"
Hein van Aken(?),XIII,230,Sonder enegen loesen scop
Hein van Aken(?),XIII,231,Dies ic di sal vragen.
Hein van Aken(?),XIII,232,Twi sijn die heren also een dop
Hein van Aken(?),XIII,233,Wandelbaer ende in walop?
Hein van Aken(?),XIII,234,Wien magic dit clagen?
Hein van Aken(?),XIII,235,Si maken scoene haren top
Hein van Aken(?),XIII,236,Ende si sijn ydel als een rop:
Hein van Aken(?),XIII,237,Wien mach dit behagen?
Hein van Aken(?),XIII,238,Si dragen wel in haren crop
Hein van Aken(?),XIII,239,Tfenijn meerre dan .i. cnop:
Hein van Aken(?),XIII,240,Dit en sijn geen sagen.
Hein van Aken(?),XIII,241,Dies moeten si in thelsche slop
Hein van Aken(?),XIII,242,Inder leeder duuele strop:
Hein van Aken(?),XIII,243,[Daer] sal hen wee bedagen.
Hein van Aken(?),XIII,244,"Wij sijn gevallen; helpt ons op,"
Hein van Aken(?),XIII,245,"God, die den weerden iob"
Hein van Aken(?),XIII,246,"Ganset van sinen plagen,"
Hein van Aken(?),XIII,247,Sone mach ons niemen iagen.
Hein van Aken(?),XIV,248,"Merten vrient, hets al verloren:"
Hein van Aken(?),XIV,249,Ridderscap heeft hen versworen
Hein van Aken(?),XIV,250,Ende verloechent sijn trouwe
Hein van Aken(?),XIV,251,Dies niemen en plach te voren.
Hein van Aken(?),XIV,252,Noch salment vele swaerre horen:
Hein van Aken(?),XIV,253,Dies draecht mijn herte rouwe.
Hein van Aken(?),XIV,254,In kinnen niet so wel geboren
Hein van Aken(?),XIV,255,Hine laet den dorper gaen tsiere oren;
Hein van Aken(?),XIV,256,Mi es leet dat ict aenscouwe.
Hein van Aken(?),XIV,257,Die doecht houwet dors met sporen
Hein van Aken(?),XIV,258,Ende heeft de vlocht vercoren;
Hein van Aken(?),XIV,259,Men maect op hare die mouwe.
Hein van Aken(?),XIV,260,[Aercheit] sayt nv hare coren
Hein van Aken(?),XIV,261,Daer wt wast wel menech doren
Hein van Aken(?),XIV,262,Dat es ons te nouwe.
Hein van Aken(?),XIV,263,"Weerde god, dit moetti scoren:"
Hein van Aken(?),XIV,264,Ic vrochte die domp sal ons versmoren.
Hein van Aken(?),XIV,265,"Helpt, marie vrouwe,"
Hein van Aken(?),XIV,266,In desen nederen houwe.
Hein van Aken(?),XV,267,Helpe ouer die valsche treken
Hein van Aken(?),XV,268,Dat heren metten monde spreken
Hein van Aken(?),XV,269,Dies si niet en minen
Hein van Aken(?),XV,270,Ende trouwe ende letteren breken.
Hein van Aken(?),XV,271,"Weerde god, dit seldi wreken"
Hein van Aken(?),XV,272,Met alte groter pinen.
Hein van Aken(?),XV,273,Ghi hebt die sterre doen ontsteken
Hein van Aken(?),XV,274,Die ons wijst een swaer gebreken
Hein van Aken(?),XV,275,Ic vruchte van veninen.
Hein van Aken(?),XV,276,Dat wi die doecht ie besweken
Hein van Aken(?),XV,277,Mach ons rouwen alle weken.
Hein van Aken(?),XV,278,God hi doedt ons scinen.
Hein van Aken(?),XV,279,"Wi seilen in der valscher beken,"
Hein van Aken(?),XV,280,Onse scep cranc sien wi leken.
Hein van Aken(?),XV,281,Duwe metten minen
Hein van Aken(?),XV,282,"Mesdoen heeft ons gesteken,"
Hein van Aken(?),XV,283,Dat onse herte es gereken
Hein van Aken(?),XV,284,In sonden diese trahinen.
Hein van Aken(?),XV,285,Wee hen diese gerinen!
Hein van Aken(?),XVI,286,"Iacop vrient, ic moet u vraghen"
Hein van Aken(?),XVI,287,Van hogen dingen ende clagen:
Hein van Aken(?),XVI,288,Seldi mi berechten?
Hein van Aken(?),XVI,289,"Dese coninge leggen grote lagen,"
Hein van Aken(?),XVI,290,Deen wilt den anderen veriagen:
Hein van Aken(?),XVI,291,"Segt, selen si vechten?"
Hein van Aken(?),XVI,292,Dan sal den genen niet behagen
Hein van Aken(?),XVI,293,Die den fijn van houe dragen
Hein van Aken(?),XVI,294,Ende edelheit vercrechten.
Hein van Aken(?),XVI,295,"Dit en sijn negene sagen,"
Hein van Aken(?),XVI,296,Dan moeten si die sweerde dragen
Hein van Aken(?),XVI,297,Ende kniue metten hechten.
Hein van Aken(?),XVI,298,En helpt geen sculen in der hagen;
Hein van Aken(?),XVI,299,"Ic vruchte het wert al verslagen,"
Hein van Aken(?),XVI,300,God en wilt berechten.
Hein van Aken(?),XVI,301,"God here, nv moetti ons verdragen"
Hein van Aken(?),XVI,302,Beide van scanden ende van plagen;
Hein van Aken(?),XVI,303,"Ende ane u, here, hechten"
Hein van Aken(?),XVI,304,Met dinen lieuen cnechten.
Hein van Aken(?),XVII,305,"Wat helpt, merten, dat gi vraecht"
Hein van Aken(?),XVII,306,War om god die werelt plaecht?
Hein van Aken(?),XVII,307,Dan heeft mi geen wonder.
Hein van Aken(?),XVII,308,Die heren hebben so lange gedaecht
Hein van Aken(?),XVII,309,Dat wi van akers sijn geiaecht:
Hein van Aken(?),XVII,310,Kerstenheit geet onder.
Hein van Aken(?),XVII,311,De heilege kerke es versaecht.
Hein van Aken(?),XVII,312,Waer es hi dient wel behaecht
Hein van Aken(?),XVII,313,Ons wesen? dats besonder.
Hein van Aken(?),XVII,314,Mi deert dat edelheit cnaecht
Hein van Aken(?),XVII,315,Des dorpers cant ende verdraecht;
Hein van Aken(?),XVII,316,Ic vruchte den euschen donder.
Hein van Aken(?),XVII,317,Ridderscap es nu vertraecht
Hein van Aken(?),XVII,318,- Dorperheit es bat gemaecht -
Hein van Aken(?),XVII,319,Ende gaet op den helschen vonder.
Hein van Aken(?),XVII,320,"O maria, weerde maecht,"
Hein van Aken(?),XVII,321,Hoe es edelheit dus af gevaecht!
Hein van Aken(?),XVII,322,Archeit es naem conder;
Hein van Aken(?),XVII,323,Dies benic vrouden sonder.
Hein van Aken(?),XVIII,324,"Hieromme, merten, es begonnen"
Hein van Aken(?),XVIII,325,Dat wi geweten niet en connen
Hein van Aken(?),XVIII,326,Hoe die dinc sal inden.
Hein van Aken(?),XVIII,327,Die soene es den paeus ontronnen:
Hein van Aken(?),XVIII,328,Dorloge es also gesponnen
Hein van Aken(?),XVIII,329,Hine caens hem niet bewinden.
Hein van Aken(?),XVIII,330,"En sijn clerke, leeke noch nonnen"
Hein van Aken(?),XVIII,331,Sine mogen hen wel goets onnen
Hein van Aken(?),XVIII,332,"Die ons die soene vinden,"
Hein van Aken(?),XVIII,333,Sint parijs ende lonnen
Hein van Aken(?),XVIII,334,Dit sware orloge helpen tonnen
Hein van Aken(?),XVIII,335,Ende haren scat ontbinden.
Hein van Aken(?),XVIII,336,Die al daer werden uerwonnen
Hein van Aken(?),XVIII,337,Selen droefheit helpen bonnen
Hein van Aken(?),XVIII,338,Die noyt de wise en minden.
Hein van Aken(?),XVIII,339,"Hine leeft niet onder der sonnen,"
Hein van Aken(?),XVIII,340,Hine moge den genen wanconnen
Hein van Aken(?),XVIII,341,Die dus die werelt scinden
Hein van Aken(?),XVIII,342,Ende edelheit verblinden.
Hein van Aken(?),XIX,343,Iherusalem ende calephas
Hein van Aken(?),XIX,344,Ende akers dat gewonnen was
Hein van Aken(?),XIX,345,"Ende suers die goede stede,"
Hein van Aken(?),XIX,346,"En es fransoys, bihemere noch sas"
Hein van Aken(?),XIX,347,Die daer heeft eens honts gebas
Hein van Aken(?),XIX,348,Die houdt kerstennen sede.
Hein van Aken(?),XIX,349,Nu maectmen der heidenen tas
Hein van Aken(?),XIX,350,Daer maria selue genas
Hein van Aken(?),XIX,351,Tonser salechede.
Hein van Aken(?),XIX,352,"Die werelt es broesscher dan glas,"
Hein van Aken(?),XIX,353,Die trouwe soect hi vint gedwas:
Hein van Aken(?),XIX,354,Dit es al waerhede.
Hein van Aken(?),XIX,355,Takers - seker sijt das! -
Hein van Aken(?),XIX,356,Sloechmen die kerstene dore hare vas:
Hein van Aken(?),XIX,357,Dat was iammerhede.
Hein van Aken(?),XIX,358,Wi sonden segel ende was
Hein van Aken(?),XIX,359,Maer niet en leden wi den pas;
Hein van Aken(?),XIX,360,Wat men ons mesdede
Hein van Aken(?),XIX,361,Wine wouden daer niet mede.
Hein van Aken(?),XX,362,Nu soe bliket die [swaerhede]
Hein van Aken(?),XX,363,Die huge capet den hertoge dede
Hein van Aken(?),XX,364,Die here was van lotrike
Hein van Aken(?),XX,365,Ende van vrankerike mede:
Hein van Aken(?),XX,366,Te louwen vinc hine in die stede
Hein van Aken(?),XX,367,Herde valschelike
Hein van Aken(?),XX,368,Binnen gherechten vrien vrede.
Hein van Aken(?),XX,369,Dies moet hi hebben den rede.
Hein van Aken(?),XX,370,Daer scoerde hi onse coronike.
Hein van Aken(?),XX,371,Dingelsche coninc lach in [gevede]
Hein van Aken(?),XX,372,Iegen die heidene; buten gelede
Hein van Aken(?),XX,373,Men dede hem die gelike.
Hein van Aken(?),XX,374,Dese coninc heeft ten derden lede
Hein van Aken(?),XX,375,Siere nichten: dat es onsede.
Hein van Aken(?),XX,376,Ic wille dat het blike.
Hein van Aken(?),XX,377,"Wat ic heye ochte smede,"
Hein van Aken(?),XX,378,Hoe na dat ic der waerheit trede
Hein van Aken(?),XX,379,Het valt al in den slike
Hein van Aken(?),XX,380,Van den hoegen dyke.
Hein van Aken(?),XXI,381,"Iacob, woudict al vertellen"
Hein van Aken(?),XXI,382,In soude connen niet gespellen
Hein van Aken(?),XXI,383,Die mesdaet van den heren.
Hein van Aken(?),XXI,384,Die in darcheit sere swellen
Hein van Aken(?),XXI,385,Si souden u wel sere quellen
Hein van Aken(?),XXI,386,"Ende mi, woudicse weren."
Hein van Aken(?),XXI,387,Mi dunct dat alle [heren] vellen
Hein van Aken(?),XXI,388,Edelheit ende aue pellen
Hein van Aken(?),XXI,389,Ende en volgen niet der eren;
Hein van Aken(?),XXI,390,Si volgen al der valscher bellen
Hein van Aken(?),XXI,391,Den rechten wech ter leider hellen
Hein van Aken(?),XXI,392,"In dat lange beseren,"
Hein van Aken(?),XXI,393,Daer die duuele hen snellen
Hein van Aken(?),XXI,394,Ende die sielen swarlec scellen
Hein van Aken(?),XXI,395,Ende met hen doen reeren.
Hein van Aken(?),XXI,396,Met luder stemmen ende met rebellen
Hein van Aken(?),XXI,397,Criten die sielen na mijn tellen.
Hein van Aken(?),XXI,398,Alsoe ons die wise leren
Hein van Aken(?),XXI,399,So mogen wi ons wel uerveren.
Hein van Aken(?),XXII,400,Roeme heuet sere mesdaen.
Hein van Aken(?),XXII,401,"Al seggic roeme, wildijt verstaen,"
Hein van Aken(?),XXII,402,Ic saelt u wel ontbinden:
Hein van Aken(?),XXII,403,Ic meene den paeus sonder waen
Hein van Aken(?),XXII,404,Ende die den houe anegaen
Hein van Aken(?),XXII,405,Ende alle doecht verblinden.
Hein van Aken(?),XXII,406,"Hier met es dordene bevaen,"
Hein van Aken(?),XXII,407,Dats kerstenhede een wederstaen
Hein van Aken(?),XXII,408,Dat wi wel ondervinden.
Hein van Aken(?),XXII,409,Dus es vrankerike wel saen
Hein van Aken(?),XXII,410,In den pas sere bestaen.
Hein van Aken(?),XXII,411,Gherechtecheit gaet tinden.
Hein van Aken(?),XXII,412,"Eest generael, eest gardiaen,"
Hein van Aken(?),XXII,413,"Eest commendoer, bi sente germaen,"
Hein van Aken(?),XXII,414,Het \ wilt al rijcheit prinden.
Hein van Aken(?),XXII,415,"Wi lieten kerstenheit verslaen,"
Hein van Aken(?),XXII,416,Wine wouden ons niet reene dwaen
Hein van Aken(?),XXII,417,Met hen die gode minden
Hein van Aken(?),XXII,418,Ende den duuel scinden.
Hein van Aken(?),XXIII,419,Nv hebbic roeme ende vrankerike
Hein van Aken(?),XXIII,420,Ende die ordenen des gelike
Hein van Aken(?),XXIII,421,Een deel wel versproken.
Hein van Aken(?),XXIII,422,Ondanc hebbe anderen wike.
Hein van Aken(?),XXIII,423,Ingelant heeft sijn coronike
Hein van Aken(?),XXIII,424,Somwile sere te broken;
Hein van Aken(?),XXIII,425,Alsic almanien dor strike
Hein van Aken(?),XXIII,426,Vindic herde iammerlike
Hein van Aken(?),XXIII,427,Vele swaerre croken.
Hein van Aken(?),XXIII,428,Wat hulpet ic wille dat blike?
Hein van Aken(?),XXIII,429,Onse wesen leit in den slike
Hein van Aken(?),XXIII,430,Dat wilen woende op roken;
Hein van Aken(?),XXIII,431,"Onse ouermoet, onse geprike"
Hein van Aken(?),XXIII,432,Ontvalt ons vanden hogen dike
Hein van Aken(?),XXIII,433,Om dat wi gods niet en roken.
Hein van Aken(?),XXIII,434,"Maria maget suuerlike,"
Hein van Aken(?),XXIII,435,Bidt gode dat hi ons niet en beswike:
Hein van Aken(?),XXIII,436,Ic vruchte sere dat stoken
Hein van Aken(?),XXIII,437,Daer die duuele coken.
Hein van Aken(?),XXIV,438,"Waerheit, merten, ghi versint"
Hein van Aken(?),XXIV,439,Dat dorpers herte lettel kint
Hein van Aken(?),XXIV,440,Al hort sijt voren spreken.
Hein van Aken(?),XXIV,441,Die sonde maect den mensche blint
Hein van Aken(?),XXIV,442,Dat hi de doecht niet een twint
Hein van Aken(?),XXIV,443,Aen hem en can gereken.
Hein van Aken(?),XXIV,444,God onse here heeft dicke gescint
Hein van Aken(?),XXIV,445,De werelt ende hare ane gesint
Hein van Aken(?),XXIV,446,Loen van haren treken.
Hein van Aken(?),XXIV,447,Wie es die ons tgaren spint?
Hein van Aken(?),XXIV,448,"Wijf, man ende kint"
Hein van Aken(?),XXIV,449,"Es al eens ontsteken,"
Hein van Aken(?),XXIV,450,Ouer see ende hier ontrint
Hein van Aken(?),XXIV,451,Heeft geweest ende begint
Hein van Aken(?),XXIV,452,Van weken te weken.
Hein van Aken(?),XXIV,453,Hadden wi gode te tide gemint
Hein van Aken(?),XXIV,454,Sone vruchten wi niet den swaren [scint].
Hein van Aken(?),XXIV,455,Nu vruchtic tgebreken:
Hein van Aken(?),XXIV,456,Verbolgen es de deken.
Hein van Aken(?),XXV,457,"Merten, gi sijt herde bout;"
Hein van Aken(?),XXV,458,Waren wi beide aldus stout
Hein van Aken(?),XXV,459,Het soude ons sere scaden.
Hein van Aken(?),XXV,460,En es niemen ionc noch out
Hein van Aken(?),XXV,461,Wi en geuen hem die scout
Hein van Aken(?),XXV,462,Van sinen mesdaden.
Hein van Aken(?),XXV,463,"Merten, ochtu dichten wout"
Hein van Aken(?),XXV,464,Laet dijn rimen menechfout:
Hein van Aken(?),XXV,465,Dijn sin es verladen.
Hein van Aken(?),XXV,466,Du sijs in dat neder hout
Hein van Aken(?),XXV,467,Dat dijn herte maket cout
Hein van Aken(?),XXV,468,Quade crude saden.
Hein van Aken(?),XXV,469,Beter es sin dan gout.
Hein van Aken(?),XXV,470,Verhuede di seluen met gewout
Hein van Aken(?),XXV,471,Ende met gods genaden.
Hein van Aken(?),XXV,472,"Doet di seluen in dbehout,"
Hein van Aken(?),XXV,473,Minne vore dat water smout.
Hein van Aken(?),XXV,474,Es dijn herte verbraden
Hein van Aken(?),XXV,475,Wat selen di de caden?
Hein van Aken(?),XXVI,476,"Iacob, die bi rade doet"
Hein van Aken(?),XXVI,477,Dat hi doet es hem goet.
Hein van Aken(?),XXVI,478,Mi en mach geen dichten deren:
Hein van Aken(?),XXVI,479,Ic ben dies seker ende vroet
Hein van Aken(?),XXVI,480,Dat ic al mijn leuen dichten moet
Hein van Aken(?),XXVI,481,Ende meest op die heren.
Hein van Aken(?),XXVI,482,God moeter mi toe geuen spoet
Hein van Aken(?),XXVI,483,Dor sinen lieuen oetmoet
Hein van Aken(?),XXVI,484,Sonder wederkeren.
Hein van Aken(?),XXVI,485,Hebbic sijn gracie metter vloet
Hein van Aken(?),XXVI,486,Al liggic hier onder voet
Hein van Aken(?),XXVI,487,"Hi sal mi ginder eren,"
Hein van Aken(?),XXVI,488,Alse dat vuele valsche [broet]
Hein van Aken(?),XXVI,489,Liggen sal in die gloet
