author,chapter,line,text
Clays van Haerlem,Onbekend Hoofdstuk,1,"Met sinen knape vor hi sire strate,"
Clays van Haerlem,Onbekend Hoofdstuk,2,"Hi haesten uter maten sere,"
Clays van Haerlem,Onbekend Hoofdstuk,3,Ende soude dien abt sinen here
Clays van Haerlem,Onbekend Hoofdstuk,4,"Gerne die vessce te tide bringen,"
Clays van Haerlem,Onbekend Hoofdstuk,5,Wils hem god gehingen.
Clays van Haerlem,Onbekend Hoofdstuk,6,"Soe lange reet die edele man,"
Clays van Haerlem,Onbekend Hoofdstuk,7,Dat hi int dal ten Sigeren quam.
Clays van Haerlem,Onbekend Hoofdstuk,8,Hi reet onder die gebr[.]chte groet
Clays van Haerlem,Onbekend Hoofdstuk,9,Ende hi en duchte en gene noet;
Clays van Haerlem,Onbekend Hoofdstuk,10,Mar die knape hadde vaer;
Clays van Haerlem,Onbekend Hoofdstuk,11,Dat seggic u over waer;
Clays van Haerlem,Onbekend Hoofdstuk,12,Hi waender wel doet bliuen
Clays van Haerlem,Onbekend Hoofdstuk,13,Ende datmenne soude ontliuen.
Clays van Haerlem,Onbekend Hoofdstuk,14,Doe sprac hi tien edelen man
Clays van Haerlem,Onbekend Hoofdstuk,15,Harde vervarlike an:
Clays van Haerlem,Onbekend Hoofdstuk,16,"""Here, ic en can niet geduren"
Clays van Haerlem,Onbekend Hoofdstuk,17,"Van vare terre uren."""
Clays van Haerlem,Onbekend Hoofdstuk,18,Ten knape sprac hi vriendelike:
Clays van Haerlem,Onbekend Hoofdstuk,19,"""Vrient, ic biddu hertelike,"
Clays van Haerlem,Onbekend Hoofdstuk,20,Dat gi een liedekijn singet
Clays van Haerlem,Onbekend Hoofdstuk,21,Dar gi u seluen mede bringet
Clays van Haerlem,Onbekend Hoofdstuk,22,Uten vare dar gi in sijt
Clays van Haerlem,Onbekend Hoofdstuk,23,"Ende mi dar mede verblijt,"
Clays van Haerlem,Onbekend Hoofdstuk,24,"Ic hope an gode, die ons geboet,"
Clays van Haerlem,Onbekend Hoofdstuk,25,"Wi en selen hebben gene noet."""
Clays van Haerlem,Onbekend Hoofdstuk,26,"Alse dat die knape versiet,"
Clays van Haerlem,Onbekend Hoofdstuk,27,"""Here"", seit hi, ""oft gijt gebiet,"
Clays van Haerlem,Onbekend Hoofdstuk,28,"Oft gi ember wilt, dat si,"
Clays van Haerlem,Onbekend Hoofdstuk,29,"Ic sal singen, grave vri,"
Clays van Haerlem,Onbekend Hoofdstuk,30,"Ine souts u niet werren dorren."""
Clays van Haerlem,Onbekend Hoofdstuk,31,Mettien ginc hi een liedekijn porren
Clays van Haerlem,Onbekend Hoofdstuk,32,"Al soetelike te haluen uut,"
Clays van Haerlem,Onbekend Hoofdstuk,33,Hi en dorste maken geen geluut.
Clays van Haerlem,Onbekend Hoofdstuk,34,Willem horet ende sprac doe
Clays van Haerlem,Onbekend Hoofdstuk,35,Sinen knape vriendelijc toe:
Clays van Haerlem,Onbekend Hoofdstuk,36,"""Vrient [........]"
Clays van Haerlem,Onbekend Hoofdstuk,37,[...............]
Clays van Haerlem,Onbekend Hoofdstuk,38,Die mordenaers waren bine desen
Clays van Haerlem,Onbekend Hoofdstuk,39,Comen ende hadden roof gedaen
Clays van Haerlem,Onbekend Hoofdstuk,40,Ende si hebben den sanc verstaen.
Clays van Haerlem,Onbekend Hoofdstuk,40,"Si quamen van op dien dach,"
Clays van Haerlem,Onbekend Hoofdstuk,42,Dar si waren om hare beiach
Clays van Haerlem,Onbekend Hoofdstuk,43,Ende enen edelen man hadden doet
Clays van Haerlem,Onbekend Hoofdstuk,44,Ende sine maisnide ende syn conroet
Clays van Haerlem,Onbekend Hoofdstuk,45,Ende sine kinder; des gelike
Clays van Haerlem,Onbekend Hoofdstuk,45,Si plagen dagelike.
Clays van Haerlem,Onbekend Hoofdstuk,47,"Si brachten tgoet, dat sine was,"
Clays van Haerlem,Onbekend Hoofdstuk,48,"Nimanne en wondere das,"
Clays van Haerlem,Onbekend Hoofdstuk,49,Mordenaren noch oec dief
Clays van Haerlem,Onbekend Hoofdstuk,50,"En hadden nimanne soe lief,"
Clays van Haerlem,Onbekend Hoofdstuk,50,"Hi en souden om clene dinc doden,"
Clays van Haerlem,Onbekend Hoofdstuk,52,Si en latens hem niet verbloden.
Clays van Haerlem,Onbekend Hoofdstuk,53,Si waren ten tafflen geseten
Clays van Haerlem,Onbekend Hoofdstuk,54,Ende souden hebben geten;
Clays van Haerlem,Onbekend Hoofdstuk,55,"Dar was spise gnoech,"
Clays van Haerlem,Onbekend Hoofdstuk,55,Dar af hadden si har gevoech.
Clays van Haerlem,Onbekend Hoofdstuk,57,"XV. sater tenen ringe,"
Clays van Haerlem,Onbekend Hoofdstuk,58,"Sijn paert hadde elc sonderlinge,"
Clays van Haerlem,Onbekend Hoofdstuk,59,"Oft teneger noet quame,"
Clays van Haerlem,Onbekend Hoofdstuk,60,Dat elc tsine vinge ende name
Clays van Haerlem,Onbekend Hoofdstuk,60,Ende hare wapine dar bi;
Clays van Haerlem,Onbekend Hoofdstuk,62,Aldus te gadre saten si.
Clays van Haerlem,Onbekend Hoofdstuk,63,"Die meester was Gonnart geheten,"
Clays van Haerlem,Onbekend Hoofdstuk,64,"Men conste genen fellere geweten,"
Clays van Haerlem,Onbekend Hoofdstuk,65,"Noch die conste stellen bat,"
Clays van Haerlem,Onbekend Hoofdstuk,65,Want hem noit geen man ontsat
Clays van Haerlem,Onbekend Hoofdstuk,67,Noch enne ontfarme in gere maniere;
Clays van Haerlem,Onbekend Hoofdstuk,68,"Dese was soe putertiere,"
Clays van Haerlem,Onbekend Hoofdstuk,69,God die motene verwaten
Clays van Haerlem,Onbekend Hoofdstuk,70,Ende alle sine gesellen haten.
Clays van Haerlem,Onbekend Hoofdstuk,70,Si hebben gehort sonder wanc
Clays van Haerlem,Onbekend Hoofdstuk,72,Van des graven knape dien sanc
Clays van Haerlem,Onbekend Hoofdstuk,73,Bi al dat icker an gem[......]
Clays van Haerlem,Onbekend Hoofdstuk,74,Hi comt van ere br[.........]
Clays van Haerlem,Onbekend Hoofdstuk,75,Dar hi hevet wasdom [........]
Clays van Haerlem,Onbekend Hoofdstuk,75,Alsi hebben II. scellin......]
Clays van Haerlem,Onbekend Hoofdstuk,77,Sijn si vele blidere [........]
Clays van Haerlem,Onbekend Hoofdstuk,78,Dan oft I. hertoge of [grave]
Clays van Haerlem,Onbekend Hoofdstuk,79,Hadde M. marc van [.........]
Clays van Haerlem,Onbekend Hoofdstuk,80,Gonnart seide: Ic h[.......]
Clays van Haerlem,Onbekend Hoofdstuk,80,Wonder laet dese re[.......]
Clays van Haerlem,Onbekend Hoofdstuk,82,Men sal hem nemen d[......]
Clays van Haerlem,Onbekend Hoofdstuk,83,Ic weet wel dat men [........]
Clays van Haerlem,Onbekend Hoofdstuk,84,Dicke perde di si ri[den]
Clays van Haerlem,Onbekend Hoofdstuk,85,"Cledere, geelt, dire [gesmiden]"
Clays van Haerlem,Onbekend Hoofdstuk,85,Hoege liede dar si [........]
Clays van Haerlem,Onbekend Hoofdstuk,87,"Gaet wech, roeften [........]"
Clays van Haerlem,Onbekend Hoofdstuk,88,Die VII saten [..........]
Clays van Haerlem,Onbekend Hoofdstuk,89,Ende reden d[..........]
Clays van Haerlem,Onbekend Hoofdstuk,90,Die VIII. bleven [.........]
Clays van Haerlem,Onbekend Hoofdstuk,90,Die VII. voren sonder v[...]
Clays van Haerlem,Onbekend Hoofdstuk,92,Tote beneden ere [..........]
Clays van Haerlem,Onbekend Hoofdstuk,93,Dar si dien grave st[.........]
Clays van Haerlem,Onbekend Hoofdstuk,94,Ende sinen knape d[..........]
Clays van Haerlem,Onbekend Hoofdstuk,95,Si waren blide sere [.........]
Clays van Haerlem,Onbekend Hoofdstuk,95,Omdat I. man was [.........]
Clays van Haerlem,Onbekend Hoofdstuk,97,Si waren dapper e[..........]
Clays van Haerlem,Onbekend Hoofdstuk,98,Si reden met snelre [vaert]
Clays van Haerlem,Onbekend Hoofdstuk,99,Dapperlike dare [waert;]
Clays van Haerlem,Onbekend Hoofdstuk,100,"Elc riep: ""Moenc be[.....]"
Clays van Haerlem,Onbekend Hoofdstuk,100,Ende maect u henen v[.....]
Clays van Haerlem,Onbekend Hoofdstuk,102,Laet ons cledere ende g[elt]
Clays van Haerlem,Onbekend Hoofdstuk,103,"Ende rumet al naect d[at velt]."""
Clays van Haerlem,Onbekend Hoofdstuk,104,"""Gerne"", seide Willem, ""ma[...]"
Clays van Haerlem,Onbekend Hoofdstuk,105,"Sonde, seit hi toten m[....]"
Clays van Haerlem,Onbekend Hoofdstuk,105,Want ic ben van ordinen [.....]
Clays van Haerlem,Onbekend Hoofdstuk,107,[...............]
Clays van Haerlem,Onbekend Hoofdstuk,108,"[M]ettien hi sgraven knape sach,"
Clays van Haerlem,Onbekend Hoofdstuk,109,[M]et crachte sine namen
Clays van Haerlem,Onbekend Hoofdstuk,110,[E]nde banden hem te samen
Clays van Haerlem,Onbekend Hoofdstuk,111,"[B]eide voete ende hande,"
Clays van Haerlem,Onbekend Hoofdstuk,110,[S]i daden hem grote scande;
Clays van Haerlem,Onbekend Hoofdstuk,113,"[S]i worpene in ene gracht,"
Clays van Haerlem,Onbekend Hoofdstuk,114,[D]atter Willem niet jegen vacht.
Clays van Haerlem,Onbekend Hoofdstuk,115,"Doe riep die knape: ""wach arme!"" sere,"
Clays van Haerlem,Onbekend Hoofdstuk,116,"""Ay God, helpe minen here,"
Clays van Haerlem,Onbekend Hoofdstuk,115,"[D]ie die beste es, die je wart geboren;"
Clays van Haerlem,Onbekend Hoofdstuk,118,[M]i gaet naerre sijn toren
Clays van Haerlem,Onbekend Hoofdstuk,119,"[D]an mijn seer, overwar."""
Clays van Haerlem,Onbekend Hoofdstuk,120,[D]oe sprac die grave dar:
Clays van Haerlem,Onbekend Hoofdstuk,121,"""[G]i heren, gi hebt onrecht!"
Clays van Haerlem,Onbekend Hoofdstuk,120,"[G]eeft mi weder minen knecht,"
Clays van Haerlem,Onbekend Hoofdstuk,123,[S]oe dodi utermaten wel.
Clays van Haerlem,Onbekend Hoofdstuk,124,"[Jegen] mi sidi te fel,"
Clays van Haerlem,Onbekend Hoofdstuk,125,"[E]nde nemt dat gi wilt van minen goede,"
Clays van Haerlem,Onbekend Hoofdstuk,126,"[D]ies biddic u op oetmoede."""
Clays van Haerlem,Onbekend Hoofdstuk,125,"Gonnart, die mester antworde;"
Clays van Haerlem,Onbekend Hoofdstuk,128,Alse hi den grave spreken horde:
Clays van Haerlem,Onbekend Hoofdstuk,129,"""[A]nderssijns moetti singen,"
Clays van Haerlem,Onbekend Hoofdstuk,130,[E]er gi mi heden selt ontspringen.
Clays van Haerlem,Onbekend Hoofdstuk,131,"[B]i dien here, die mi geboet,"
Clays van Haerlem,Onbekend Hoofdstuk,130,"[T]en sal bliven clene no groet,"
Clays van Haerlem,Onbekend Hoofdstuk,133,"Gi sijt hir qualike geraect,"
Clays van Haerlem,Onbekend Hoofdstuk,134,Gi moet van ons sceden naect;
Clays van Haerlem,Onbekend Hoofdstuk,135,"Nochtan suldi cume dlijf ontdragen."""
Clays van Haerlem,Onbekend Hoofdstuk,136,Willem begans qualike behagen;
Clays van Haerlem,Onbekend Hoofdstuk,135,"Hi en hadde no knief no swert,"
Clays van Haerlem,Onbekend Hoofdstuk,138,Dar hi hem mede hadde verwert
Clays van Haerlem,Onbekend Hoofdstuk,139,Mochte hebben in dien strijt.
Clays van Haerlem,Onbekend Hoofdstuk,140,"Opdat God sijns niet mijt,"
Clays van Haerlem,Onbekend Hoofdstuk,141,Hi blijfter sonder twivel doet
Clays van Haerlem,Onbekend Hoofdstuk,142,[...............]
Clays van Haerlem,Onbekend Hoofdstuk,140,Dat mi hellinc no penninc es bleven.
Clays van Haerlem,Onbekend Hoofdstuk,144,"Laet mi gaen, soe doedi wale."""
Clays van Haerlem,Onbekend Hoofdstuk,145,Die meester seide met derre tale:
Clays van Haerlem,Onbekend Hoofdstuk,146,"""Hets triwantise, dat gi spreket,"
Clays van Haerlem,Onbekend Hoofdstuk,147,"Ic sie wel, dat u therte gebreket"
Clays van Haerlem,Onbekend Hoofdstuk,145,Tonswaert in quaden moede;
Clays van Haerlem,Onbekend Hoofdstuk,149,"Wardi wel op uwe hoede,"
Clays van Haerlem,Onbekend Hoofdstuk,150,"Ende gi wapine hadt an,"
Clays van Haerlem,Onbekend Hoofdstuk,151,"Gi wart een herde starc man,"
Clays van Haerlem,Onbekend Hoofdstuk,152,"Gi en ontsaget ons allen niet,"
Clays van Haerlem,Onbekend Hoofdstuk,150,"Als men an u merct ende siet."""
Clays van Haerlem,Onbekend Hoofdstuk,154,Die grave loech alse hijt horde;
Clays van Haerlem,Onbekend Hoofdstuk,155,Them selven sprac hi mettien worde:
Clays van Haerlem,Onbekend Hoofdstuk,156,"""Du mochts wel seggen waer,"
Clays van Haerlem,Onbekend Hoofdstuk,157,"Waric gewapent, ic soudi vaer"
Clays van Haerlem,Onbekend Hoofdstuk,155,"Ende dinen gesellen doen,"
Clays van Haerlem,Onbekend Hoofdstuk,159,"Eer si mi meer ontvloen."""
Clays van Haerlem,Onbekend Hoofdstuk,160,"Echt bat Willem die vrie,"
Clays van Haerlem,Onbekend Hoofdstuk,161,"Genade dor Sente Marie,"
Clays van Haerlem,Onbekend Hoofdstuk,162,Dat si sijns souden ontfarmen
Clays van Haerlem,Onbekend Hoofdstuk,160,Ende sinen knape lieten geharmen.
Clays van Haerlem,Onbekend Hoofdstuk,164,Die meester antworde gereet:
Clays van Haerlem,Onbekend Hoofdstuk,165,"""Gi selt u selven, Godeweet,"
Clays van Haerlem,Onbekend Hoofdstuk,166,"Al moedernaect ontcleden,"
Clays van Haerlem,Onbekend Hoofdstuk,167,"Eer gi van ons selt sceden."""
Clays van Haerlem,Onbekend Hoofdstuk,165,Willem seide op die stonde:
Clays van Haerlem,Onbekend Hoofdstuk,169,"""Bi Gode, gi daet sonde."""
Clays van Haerlem,Onbekend Hoofdstuk,170,Die meester wert harde gram;
Clays van Haerlem,Onbekend Hoofdstuk,171,"Hi seide: ""swiget des, goet man,"
Clays van Haerlem,Onbekend Hoofdstuk,172,"Gi selt mi die covele laten,"
Clays van Haerlem,Onbekend Hoofdstuk,170,"Ende uwe pelse ende gaet uwer straten,"
Clays van Haerlem,Onbekend Hoofdstuk,174,Dar toe boten ende cousen mede;
Clays van Haerlem,Onbekend Hoofdstuk,175,Dus soe mogedi hebben vrede;
Clays van Haerlem,Onbekend Hoofdstuk,176,Ende dien goeden stamijn
Clays van Haerlem,Onbekend Hoofdstuk,177,"Hi moet verdronken sijn."""
Clays van Haerlem,Onbekend Hoofdstuk,178,[...............]
Clays van Haerlem,Onbekend Hoofdstuk,175,Doe sprac Willem die baroen:
Clays van Haerlem,Onbekend Hoofdstuk,180,"""Gi sijt te scerne gedreven;"
Clays van Haerlem,Onbekend Hoofdstuk,181,Mijn broecrime es mi bleven;
Clays van Haerlem,Onbekend Hoofdstuk,182,"Mine gespe es beter dan al tgoet,"
Clays van Haerlem,Onbekend Hoofdstuk,183,Dat gi mi nemen doet.
Clays van Haerlem,Onbekend Hoofdstuk,180,"Die stene, die daer sijn ane,"
Clays van Haerlem,Onbekend Hoofdstuk,185,Costen na minen wane
Clays van Haerlem,Onbekend Hoofdstuk,186,XXX. marc van finen goude.
Clays van Haerlem,Onbekend Hoofdstuk,187,Dar sijn mirauden an menechfoude:
Clays van Haerlem,Onbekend Hoofdstuk,188,C. marc hads die goutsmet.
Clays van Haerlem,Onbekend Hoofdstuk,185,Niman en mochten maken bet:
Clays van Haerlem,Onbekend Hoofdstuk,190,"Hi coste M. pont al te male."""
Clays van Haerlem,Onbekend Hoofdstuk,191,Wat holper ombe lange tale?
Clays van Haerlem,Onbekend Hoofdstuk,192,Elkerlijc begerden sere.
Clays van Haerlem,Onbekend Hoofdstuk,193,"Die meester, hare alre here,"
Clays van Haerlem,Onbekend Hoofdstuk,190,"Seide: ""Die broecrime es mijn."
Clays van Haerlem,Onbekend Hoofdstuk,195,Doe antworde die grave fijn
Clays van Haerlem,Onbekend Hoofdstuk,196,"""Ja, seldi mi laten bloet,"
Clays van Haerlem,Onbekend Hoofdstuk,197,"Dat ware u lachter al te groet."""
Clays van Haerlem,Onbekend Hoofdstuk,198,"""Nenic"", seide die domme,"
Clays van Haerlem,Onbekend Hoofdstuk,195,"""Ic sal u den minen doen ombe;"
Clays van Haerlem,Onbekend Hoofdstuk,200,"Geven, des wissele wi."
Clays van Haerlem,Onbekend Hoofdstuk,201,"Willem seide: ""Gi selten mi"
Clays van Haerlem,Onbekend Hoofdstuk,202,"Nemen, op dat gine hebben selt"
Clays van Haerlem,Onbekend Hoofdstuk,203,"Nembermer in uwer gewelt."""
Clays van Haerlem,Onbekend Hoofdstuk,200,Gonnart beette van dien perde
Clays van Haerlem,Onbekend Hoofdstuk,205,Ende haestem darwart herde.
Clays van Haerlem,Onbekend Hoofdstuk,206,Hi knielde vor dien degen goet
Clays van Haerlem,Onbekend Hoofdstuk,207,Ende waenden metter spoet
Clays van Haerlem,Onbekend Hoofdstuk,208,Dien broecrime hebben genomen;
Clays van Haerlem,Onbekend Hoofdstuk,205,"God danc, hets anders comen."
Clays van Haerlem,Onbekend Hoofdstuk,210,Alse doe die grave sach
Clays van Haerlem,Onbekend Hoofdstuk,211,"Vor hem liggen, diene al dien dach"
Clays van Haerlem,Onbekend Hoofdstuk,212,"Hem gereit sijn ongevoech,"
Clays van Haerlem,Onbekend Hoofdstuk,213,"Hief hi die vust op, ende sloech"
Clays van Haerlem,Onbekend Hoofdstuk,210,"Ende dies en hadde hi bore wat,"
Clays van Haerlem,Onbekend Hoofdstuk,215,Nemare bi maten syn vat.
Clays van Haerlem,Onbekend Hoofdstuk,216,"Hi hadde te dien stonden,"
Clays van Haerlem,Onbekend Hoofdstuk,217,Grote pine van sinen wonden.
Clays van Haerlem,Onbekend Hoofdstuk,218,Bander side dogedi mee:
Clays van Haerlem,Onbekend Hoofdstuk,215,"Dar quam water in van der zee,"
Clays van Haerlem,Onbekend Hoofdstuk,220,Dat was gemaect met condute
Clays van Haerlem,Onbekend Hoofdstuk,221,Ten keere te lopene in ende ute
Clays van Haerlem,Onbekend Hoofdstuk,222,"Dar sat hi dicke wile inne,"
Clays van Haerlem,Onbekend Hoofdstuk,223,"Toter borst ende toten kinne,"
Clays van Haerlem,Onbekend Hoofdstuk,220,"Dat dede sinen wonden soe seer,"
Clays van Haerlem,Onbekend Hoofdstuk,225,Hi en wanes genesen nembermeer.
Clays van Haerlem,Onbekend Hoofdstuk,226,"Dus was hi nacht ende dach,"
Clays van Haerlem,Onbekend Hoofdstuk,227,Dies haddi swaer verdrach.
Clays van Haerlem,Onbekend Hoofdstuk,228,VII. jaer soe lach hi daer
Clays van Haerlem,Onbekend Hoofdstuk,225,In gevancnesse herde swaer
Clays van Haerlem,Onbekend Hoofdstuk,230,Met groter clagen ende met weene;
Clays van Haerlem,Onbekend Hoofdstuk,231,Dar op achten Serrasine clene;
Clays van Haerlem,Onbekend Hoofdstuk,232,"Mar God, die alle dinc versiet,"
Clays van Haerlem,Onbekend Hoofdstuk,233,"En lietene in dien rowe niet,"
Clays van Haerlem,Onbekend Hoofdstuk,230,Al gedogedijt menegen dach;
Clays van Haerlem,Onbekend Hoofdstuk,235,Nu hort hoe hine versach.
Clays van Haerlem,Onbekend Hoofdstuk,236,(Dat u onse here lone
Clays van Haerlem,Onbekend Hoofdstuk,237,"Ene aventure scone,"
Clays van Haerlem,Onbekend Hoofdstuk,238,Ende van dien boeke dbeste te voren
Clays van Haerlem,Onbekend Hoofdstuk,235,"Ende van den walsce ende vercoren,)"
Clays van Haerlem,Onbekend Hoofdstuk,240,Hoe Willem vor vort an
Clays van Haerlem,Onbekend Hoofdstuk,241,Hi wert bi enen edelen man
Clays van Haerlem,Onbekend Hoofdstuk,242,"Verloest ende bi enen ridder fier,"
Clays van Haerlem,Onbekend Hoofdstuk,243,Geheten was hi Timoier:
Clays van Haerlem,Onbekend Hoofdstuk,240,"Landridas hordicken nomen,"
Clays van Haerlem,Onbekend Hoofdstuk,245,"Ende was van sinen geslechte comen,"
Clays van Haerlem,Onbekend Hoofdstuk,246,Alse gi hier na selt horen;
Clays van Haerlem,Onbekend Hoofdstuk,247,"Mar ic telle van Willem voren,"
Clays van Haerlem,Onbekend Hoofdstuk,248,"Die in dien kerkere lach,"
Clays van Haerlem,Onbekend Hoofdstuk,245,Ende hadde swar verdrach
Clays van Haerlem,Onbekend Hoofdstuk,250,Doe sprac die grave vri:
Clays van Haerlem,Onbekend Hoofdstuk,251,"""Horenkindere, gaet van mi;"
Clays van Haerlem,Onbekend Hoofdstuk,252,"Ic sweert u allen, Godeweet,"
Clays van Haerlem,Onbekend Hoofdstuk,253,Hir an leget u grote leet.
Clays van Haerlem,Onbekend Hoofdstuk,250,"Magic noch van hir ontgaen,"
Clays van Haerlem,Onbekend Hoofdstuk,255,"Ic sal u doen hangen, sonder waen,"
Clays van Haerlem,Onbekend Hoofdstuk,256,Ende Synagoene uwen coninc
Clays van Haerlem,Onbekend Hoofdstuk,257,Salic doen in warre dinc
Clays van Haerlem,Onbekend Hoofdstuk,258,"Breken op een rat, ende slechten"
Clays van Haerlem,Onbekend Hoofdstuk,255,"Dese stat sonder wedervechten."""
Clays van Haerlem,Onbekend Hoofdstuk,260,"Serrasinen logen sere,"
Clays van Haerlem,Onbekend Hoofdstuk,261,Alsi horden dreigen dien here;
Clays van Haerlem,Onbekend Hoofdstuk,262,"Si seiden: ""Dreiget al sochte, heer grave,"
Clays van Haerlem,Onbekend Hoofdstuk,263,"U en can gehelpen scat no have,"
Clays van Haerlem,Onbekend Hoofdstuk,260,"Dat gi nembermeer ute comt."""
Clays van Haerlem,Onbekend Hoofdstuk,265,"Die grave sprac: ""Gi syt verdomt;"
Clays van Haerlem,Onbekend Hoofdstuk,266,Swiget hir af al stille!
Clays van Haerlem,Onbekend Hoofdstuk,267,"Het geet al an Gods wille."""
Clays van Haerlem,Onbekend Hoofdstuk,268,"Die grave was van hongere bleec,"
Clays van Haerlem,Onbekend Hoofdstuk,265,Dat hi hem selven niet geleec;
Clays van Haerlem,Onbekend Hoofdstuk,270,"Engeens dincs haddi gnoech,"
Clays van Haerlem,Onbekend Hoofdstuk,271,Sonder leets ende ongevoech.
Clays van Haerlem,Onbekend Hoofdstuk,272,"Hi en was gedwegen no gescoren,"
Clays van Haerlem,Onbekend Hoofdstuk,273,Ru was hi achter ende voren.
Clays van Haerlem,Onbekend Hoofdstuk,270,"Alse hi soude gaen slapen daer,"
Clays van Haerlem,Onbekend Hoofdstuk,275,Clam hi hoge op een pilaer.
Clays van Haerlem,Onbekend Hoofdstuk,276,"Hi sliep dar, soe hi best mochte;"
Clays van Haerlem,Onbekend Hoofdstuk,277,Ander bedde men hem niet brochte.
Clays van Haerlem,Onbekend Hoofdstuk,278,"Tenen tide soe sliep hi,"
Clays van Haerlem,Onbekend Hoofdstuk,275,"Die grave edel ende vri,"
Clays van Haerlem,Onbekend Hoofdstuk,280,"Ende alse hi slapen soude,"
Clays van Haerlem,Onbekend Hoofdstuk,281,"Quam die ingel boude,"
Clays van Haerlem,Onbekend Hoofdstuk,282,"Dien God dar selven sende,"
Clays van Haerlem,Onbekend Hoofdstuk,283,"Ende troestene int elende,"
Clays van Haerlem,Onbekend Hoofdstuk,280,"Willem, dien edelen man."
Clays van Haerlem,Onbekend Hoofdstuk,285,Tierst hine genesen began
Clays van Haerlem,Onbekend Hoofdstuk,286,Van al sine wonden
Clays van Haerlem,Onbekend Hoofdstuk,287,[...............]
Clays van Haerlem,Onbekend Hoofdstuk,288,Dat h[............]
Clays van Haerlem,Onbekend Hoofdstuk,289,Tote d[...........]
Clays van Haerlem,Onbekend Hoofdstuk,285,Hir [............]
Clays van Haerlem,Onbekend Hoofdstuk,291,Ende [............]
Clays van Haerlem,Onbekend Hoofdstuk,292,Tote da[..........]
Clays van Haerlem,Onbekend Hoofdstuk,293,Van lan[..........]
Clays van Haerlem,Onbekend Hoofdstuk,294,Hi was [............]
Clays van Haerlem,Onbekend Hoofdstuk,290,Het we[..........]
Clays van Haerlem,Onbekend Hoofdstuk,296,Alse w[...........]
Clays van Haerlem,Onbekend Hoofdstuk,297,Ende hi [...........]
Clays van Haerlem,Onbekend Hoofdstuk,298,En w[............]
Clays van Haerlem,Onbekend Hoofdstuk,299,Si w[...........]
Clays van Haerlem,Onbekend Hoofdstuk,295,Dat si [............]
Clays van Haerlem,Onbekend Hoofdstuk,301,Dese [...........]
Clays van Haerlem,Onbekend Hoofdstuk,302,Dat [............]
Clays van Haerlem,Onbekend Hoofdstuk,303,Mi [.............]
Clays van Haerlem,Onbekend Hoofdstuk,304,Met [.............]
Clays van Haerlem,Onbekend Hoofdstuk,300,Dar [............]
Clays van Haerlem,Onbekend Hoofdstuk,306,Wan[............]
Clays van Haerlem,Onbekend Hoofdstuk,307,Ende g[...........]
Clays van Haerlem,Onbekend Hoofdstuk,308,Ende [............]
Clays van Haerlem,Onbekend Hoofdstuk,309,Hi [............]
Clays van Haerlem,Onbekend Hoofdstuk,305,Dar [.............]
Clays van Haerlem,Onbekend Hoofdstuk,311,Ende [............]
Clays van Haerlem,Onbekend Hoofdstuk,312,Ende [............]
Clays van Haerlem,Onbekend Hoofdstuk,313,Diet [............]
Clays van Haerlem,Onbekend Hoofdstuk,314,Doe [..............]
Clays van Haerlem,Onbekend Hoofdstuk,310,Hie[.............]
Clays van Haerlem,Onbekend Hoofdstuk,316,Hi [............]
Clays van Haerlem,Onbekend Hoofdstuk,317,Ute[.............]
Clays van Haerlem,Onbekend Hoofdstuk,318,Si h[............]
Clays van Haerlem,Onbekend Hoofdstuk,319,Ende [.............]
Clays van Haerlem,Onbekend Hoofdstuk,315,Die [............]
Clays van Haerlem,Onbekend Hoofdstuk,321,Mar [.............]
Clays van Haerlem,Onbekend Hoofdstuk,322,Die [.............]
Clays van Haerlem,Onbekend Hoofdstuk,323,Dede [............]
Clays van Haerlem,Onbekend Hoofdstuk,324,Te p[.............]
Clays van Haerlem,Onbekend Hoofdstuk,325,[...............]
Clays van Haerlem,Onbekend Hoofdstuk,320,[...]el galioete quamer toe
Clays van Haerlem,Onbekend Hoofdstuk,327,[...]at si waren ontvloen doe
Clays van Haerlem,Onbekend Hoofdstuk,328,"[...] in III. scepe mee,"
Clays van Haerlem,Onbekend Hoofdstuk,329,[...] die in die zee
Clays van Haerlem,Onbekend Hoofdstuk,330,"[...]im te rovene plagen,"
Clays van Haerlem,Onbekend Hoofdstuk,325,[...] si die kerstine sagen
Clays van Haerlem,Onbekend Hoofdstuk,332,[...] doe dar wert
Clays van Haerlem,Onbekend Hoofdstuk,333,"[...]e worden ververt,"
Clays van Haerlem,Onbekend Hoofdstuk,334,"[...]eide: ""Wi sijn verloren"
Clays van Haerlem,Onbekend Hoofdstuk,335,[...]u herde wel te voren
Clays van Haerlem,Onbekend Hoofdstuk,330,[...] wi ons verweren
Clays van Haerlem,Onbekend Hoofdstuk,337,[...]et selen ons deren
Clays van Haerlem,Onbekend Hoofdstuk,338,[...]lide gereet
Clays van Haerlem,Onbekend Hoofdstuk,339,"[...]weren, godweet,"
Clays van Haerlem,Onbekend Hoofdstuk,340,"[...] si hare wapine ane,"
Clays van Haerlem,Onbekend Hoofdstuk,335,[...] sere te slane
Clays van Haerlem,Onbekend Hoofdstuk,342,[...]rde gedichte
Clays van Haerlem,Onbekend Hoofdstuk,343,[...]hten niet lichte
Clays van Haerlem,Onbekend Hoofdstuk,344,[...]lioete was vele
Clays van Haerlem,Onbekend Hoofdstuk,345,[...]nc uten spele
Clays van Haerlem,Onbekend Hoofdstuk,340,[...] verslagen
Clays van Haerlem,Onbekend Hoofdstuk,347,[...]an sinen magen
Clays van Haerlem,Onbekend Hoofdstuk,348,[...]nen stonden
Clays van Haerlem,Onbekend Hoofdstuk,349,[...]ebonden
Clays van Haerlem,Onbekend Hoofdstuk,350,[...] dar bi gesciede
Clays van Haerlem,Onbekend Hoofdstuk,345,[...] ons liede
Clays van Haerlem,Onbekend Hoofdstuk,352,[...]r die ze
Clays van Haerlem,Onbekend Hoofdstuk,353,[...]dene wee
Clays van Haerlem,Onbekend Hoofdstuk,354,[...]agen
Clays van Haerlem,Onbekend Hoofdstuk,355,[...]e plagen
Clays van Haerlem,Onbekend Hoofdstuk,350,[...] gevaen
Clays van Haerlem,Onbekend Hoofdstuk,357,[...]aliote gedaen
Clays van Haerlem,Onbekend Hoofdstuk,358,[...] kort sekerlike
Clays van Haerlem,Onbekend Hoofdstuk,359,[...]storie van erttrike
Clays van Haerlem,Onbekend Hoofdstuk,360,[...]ste mede
Clays van Haerlem,Onbekend Hoofdstuk,355,[...] warhede
Clays van Haerlem,Onbekend Hoofdstuk,362,[...]ie grave
Clays van Haerlem,Onbekend Hoofdstuk,363,[...............]
Clays van Haerlem,Onbekend Hoofdstuk,364,"Si sijn duchtech ende coene,"
Clays van Haerlem,Onbekend Hoofdstuk,365,War dats es te doene.
Clays van Haerlem,Onbekend Hoofdstuk,366,Siedi genen sconen langen?
Clays van Haerlem,Onbekend Hoofdstuk,360,Hi werdem herde strangen
Clays van Haerlem,Onbekend Hoofdstuk,368,Ende hi es harre alre here:
Clays van Haerlem,Onbekend Hoofdstuk,369,Hi es duchtech herde sere.
Clays van Haerlem,Onbekend Hoofdstuk,370,Ic wane hi van hogen geslechte si;
Clays van Haerlem,Onbekend Hoofdstuk,371,Ant gelaet donckes mi.
Clays van Haerlem,Onbekend Hoofdstuk,365,Nu doeter uwen wille mede;
Clays van Haerlem,Onbekend Hoofdstuk,373,"Rechter over, na uwen sede!"""
Clays van Haerlem,Onbekend Hoofdstuk,374,Synagoen seits hem groten danc
Clays van Haerlem,Onbekend Hoofdstuk,375,Dar na hietse eer iet lanc
Clays van Haerlem,Onbekend Hoofdstuk,376,Boven leiden in die zale.
Clays van Haerlem,Onbekend Hoofdstuk,370,"Hi sette Landri in tale,"
